OrganisationURI,OrganisationLabel,SiteReference,PreviouslyPartOf,SiteNameAddress,SiteplanURL,CoordinateReferenceSystem,GeoX,GeoY,Hectares,OwnershipStatus,Deliverable,PlanningStatus,PermissionType,PermissionDate,PlanningHistory,ProposedForPIP,MinNetDwellings,DevelopmentDescription,NonHousingDevelopment,Part2,NetDwellingsRangeFrom,NetDwellingsRangeTo,HazardousSubstances,SiteInformation,Notes,FirstAddedDate,LastUpdatedDate
http://opendatacommunities.org/id/district-council/basingstoke,Basingstoke & Deane Borough Council,17/01292/FUL,,15 New Road,https://planning.basingstoke.gov.uk/online-applications/applicationDetails.do?activeTab=map&keyVal=ONW5XNCRIWO00,OSGB36,463997.15,152112.79,0.13,not owned by a public authority,yes,permissioned,full planning permission,20171207,https://planning.basingstoke.gov.uk/online-applications/applicationDetails.do?activeTab=relatedCases&keyVal=ONW5XNCRIWO00,,10,Demolition of existing building and erection of 10 no. three bed flats with parking and associated works,,,,,,,The site gained permission for 10 units in December 2017 (17/01292/FUL). The orgional building has been demolished and significant progress has been made and completions are expected from 2019/20. The site is deliverable within five years. ,20181231,20181231
http://opendatacommunities.org/id/district-council/basingstoke,Basingstoke & Deane Borough Council,17/01714/GPDOFF,,Global House Victoria Street Basingstoke ,https://planning.basingstoke.gov.uk/online-applications/applicationDetails.do?activeTab=map&keyVal=OPU0RECR0GT00,OSGB36,463650.05,151679.55,0.12,not owned by a public authority,yes,permissioned,planning permission granted under an order,20170803,https://planning.basingstoke.gov.uk/online-applications/applicationDetails.do?activeTab=relatedCases&keyVal=OPU0RECR0GT00,,37,Change of use of class B1(a) office to class C3 residential consisting of 37no. flats,,,,,,,The site gained prior approval for 37 units in August 2017 (17/01714/GPDOFF). The developer has stated that the development will be complete by 2019/20 following their site acquisition.  The site is deliverable within five years.  ,20171231,20181231
http://opendatacommunities.org/id/district-council/basingstoke,Basingstoke & Deane Borough Council,17/02279/FUL,,Land At Chapel Hill  Kingsclere Road Basingstoke ,https://planning.basingstoke.gov.uk/online-applications/applicationDetails.do?activeTab=map&keyVal=NWBJ80CRHKY00,OSGB36,463160.73,152676.63,10.77,not owned by a public authority,yes,permissioned,full planning permission,20180323,https://planning.basingstoke.gov.uk/online-applications/applicationDetails.do?activeTab=relatedCases&keyVal=NWBJ80CRHKY00,,491,Residential development of 491 units ,,,,,,,Outline planning permission granted for 578 units (14/00865/OUT) in January 2015. Reserved matters consent for the full 578 units  (15/03667/RES) was granted in May 2016. Work has commenced on site and the first 12 units were completed in 2016/17 and 115 in 2017/18. 56 of the units are to be delivered in the existing  'white building' and an application to increase this to 96 units (17/02279/FUL) was granted in March 2018.   The site is deliverable within five years.  ,20171231,20181231
http://opendatacommunities.org/id/district-council/basingstoke,Basingstoke & Deane Borough Council,17/02486/GPDOFF,,St Pancras House Jacobs Yard Basingstoke,https://planning.basingstoke.gov.uk/online-applications/applicationDetails.do?activeTab=map&keyVal=OT8MWYCR0GT00,OSGB36,463914.06,151829.03,0.04,not owned by a public authority,yes,permissioned,planning permission granted under an order,20170915,https://planning.basingstoke.gov.uk/online-applications/applicationDetails.do?activeTab=relatedCases&keyVal=OT8MWYCR0GT00,,20,Change of use from class B1(a) office to class C3 consisting of 20 no.flats ,,,,,,,Prior notification was approved  for 20 flats on the  site in September 2017  (17/02486/GPDOFF).  All units are under construction. The site is deliverable within five years.  ,20171231,20181231
http://opendatacommunities.org/id/district-council/basingstoke,Basingstoke & Deane Borough Council,17/02516/GPDOFF,,Spinnaker House  Lime Tree Way Chineham Basingstoke,https://planning.basingstoke.gov.uk/online-applications/applicationDetails.do?activeTab=map&keyVal=OHEH4KCR0GT00,OSGB36,465646.98,155802.08,0.41,not owned by a public authority,yes,permissioned,planning permission granted under an order,20171220,https://planning.basingstoke.gov.uk/online-applications/applicationDetails.do?activeTab=relatedCases&keyVal=OHEH4KCR0GT00,,36,Change of use from office to 36no. apartments,,,,,,,A prior approval application for conversion from office to residential was approved in February 2017 (16/04426/GPDOFF) for 33 units. A  further prior approval application  (17/02516/GPDOFF) for 36 units was granted in December 2017. The agent advises that the site will be complete by the end of the 2018/19 monitoring year. The site is deliverable within five years.  ,20181231,20181231
http://opendatacommunities.org/id/district-council/basingstoke,Basingstoke & Deane Borough Council,17/02605/GPDOFF,,Spectrum House 8 Woodlands Business Village Coronation Road Basingstoke,https://planning.basingstoke.gov.uk/online-applications/applicationDetails.do?activeTab=map&keyVal=NWTUAECR0FP00,OSGB36,464700.97,152979.47,0.2,not owned by a public authority,yes,permissioned,planning permission granted under an order,20170920,https://planning.basingstoke.gov.uk/online-applications/applicationDetails.do?activeTab=relatedCases&keyVal=NWTUAECR0FP00,,18,Change of use from offices to residential consisting of 18 flats ,,,,,,,Prior notification was approved  for 13 flats on the  site in December 2015  (15/03777/GPDOFF). A further prior notification was approved for 18 flats in September 2017 (17/02605/GDPOFF). It is understood that the site has been sold to a developer who will implement the scheme. A further application for 28 flats is pending consideration (17/04283/FUL) so the yeild form this site may change.  Completions expected from 2021/22.   The site is deliverable within five years.  ,20171231,20181231
http://opendatacommunities.org/id/district-council/basingstoke,Basingstoke & Deane Borough Council,17/03309/OUT,,Centenary House 10 Winchester Road ,https://planning.basingstoke.gov.uk/online-applications/applicationDetails.do?activeTab=map&keyVal=OX1TGCCRJY000,OSGB36,463530.33,151708.93,0.33,not owned by a public authority,yes,permissioned,outline planning permission,20170301,https://planning.basingstoke.gov.uk/online-applications/applicationDetails.do?activeTab=relatedCases&keyVal=OX1TGCCRJY000,,9,Demolition of existing conference centre and erection of 9 residential units,,,,,,,Small site granted outline permission for 9 dwellings in March 2017 (17/03309/OUT).  No starts recorded at 1 April 2018 but site considered deliverable within five years.,20181231,20181231
http://opendatacommunities.org/id/district-council/basingstoke,Basingstoke & Deane Borough Council,BAS004,,Basing View Basingstoke,http://www.basingstoke.gov.uk/SHELAA,OSGB36,464490.13,152581.93,25.86,owned by a public authority,,not permissioned,,,,,300,Residential development of 300 units ,Mixed uses including office and leisure expected on wider site ,,,,,http:www.basingstoke.gov.uk/SHELAA,"The regeneration of Basing View  is being actively pursued by the borough council. This is reflected in  Local Plan policy SS8 which supports the redevelopment of the area for a mix of uses including a residential component of approximately 300 units. The site is in a suitable location for housing development, lying in a highly accessible location with good access to public transport interchanges, town centre facilities and employment opportunities. The Council has recently published the Basing View Masterplan which includes provision for residential development.  The site plan shows the whole of basing view reflecting the local plan allocation. The precise location of the residential element will be determined through site masterplanning. ",20171231,20181231
http://opendatacommunities.org/id/district-council/basingstoke,Basingstoke & Deane Borough Council,BAS012,,Police Station London Road Basingstoke,http://www.basingstoke.gov.uk/SHELAA,OSGB36,464116.03,151920.89,0.33,owned by a public authority,,not permissioned,,,,,30,Residential development of 30 units,,,,,,http:www.basingstoke.gov.uk/SHELAA,The site is a SHELAA site (BAS012) which falls within the built up area of Basingstoke and within the SPB in an area of predominantly residential development in close proximity to the town. The current use as a police station is due to cease (as part of the wider review of Hampshire Constabulary sites) and the site is currently being marketed for redevelopment. ,20171231,20181231
http://opendatacommunities.org/id/district-council/basingstoke,Basingstoke & Deane Borough Council,BAS026,,Sandringham Court Paddock Road Basingstoke ,http://www.basingstoke.gov.uk/SHELAA,OSGB36,461569.63,151110.72,0.16,owned by a public authority,yes,not permissioned,,,,,12,Residential development of 12 units ,,,,,,http:www.basingstoke.gov.uk/SHELAA,"This SHELAA site (BAS026) is owned by a Housing Association, who are actively persuing it for residential development.  A planning application has been submitted and is at an advanced stage (17/04029/FUL). The council has accepted, through a previous planning application on the site, that the loss of a care facility is acceptable in planning terms. The re-use of the site for residential development is therefore established. The site is deliverable within five years.  ",20171231,20181231
http://opendatacommunities.org/id/district-council/basingstoke,Basingstoke & Deane Borough Council,BAS028,,Deeside Alliston Way,http://www.basingstoke.gov.uk/SHELAA,OSGB36,461084.76,151024.53,0.34,owned by a public authority,yes,not permissioned,,,,,15,Residential development of 15 units,,,,,,http://www.basingstoke.gov.uk/SHELAA,This SHELAA site (BAS028) benefits from planning permission granted after 1 April 2018 (17/03673/FUL). Soverign who are taking the site forward state that the site will be completed by 2020/21. The site is deliverable within five years.  ,20181231,20181231
http://opendatacommunities.org/id/district-council/basingstoke,Basingstoke & Deane Borough Council,BAS030,,Site Of Harlech Hall Harlech Close Winklebury Basingstoke,http://www.basingstoke.gov.uk/SHELAA,OSGB36,461341.36,152357.35,0.19,owned by a public authority,yes,not permissioned,,,,,6,Residential development of 6 units ,,,,,,http:www.basingstoke.gov.uk/SHELAA,This SHELAA site (BAS030)  benefits from planning permission granted after 1 April 2018 (18/01184/FUL). No start on site has been recorded at 1 April 2018 but the site considered deliverable within five years.,20171231,20181231
http://opendatacommunities.org/id/district-council/basingstoke,Basingstoke & Deane Borough Council,BAS031,,Land At Former Newman Bassett House Basingstoke ,http://www.basingstoke.gov.uk/SHELAA,OSGB36,461266.82,152720.43,0.38,owned by a public authority,,not permissioned,,,,,12,Residential development of 12 units ,,,,,,http:www.basingstoke.gov.uk/SHELAA,"Consent was originally granted on the wider site  for the demolition of the Former Newman Bassett House building and a replacement smaller ‘respite unit’ which has now been completed. (Hindson House).Therefore, this retains the facility and service use and frees up the remainder of the land for residential redevelopment. The land is vacant but not currently available as it is being used as a temporary construction compound, the requirement for which is due to cease in late 2018. Afterwhich HCC confirm that they intend to apply for planning permission for residential development. The site is deliverable within five years.  ",20171231,20181231
http://opendatacommunities.org/id/district-council/basingstoke,Basingstoke & Deane Borough Council,BAS043,,12 London Road ,http:www.basingstoke.gov.uk/SHELAA,OSGB36,463873.76,151889.02,0.03,not owned by a public authority,yes,not permissioned,,,,,10,Residential development of 10 units,,,,,,http:www.basingstoke.gov.uk/SHELAA,The SHELAA site (BAS043) benefits from planning permission granted in July 2018 (18/01270/FUL) for 10 units. The agent has confirmed that the development is well advanced and completions are expected in 2018/19.  The site is deliverable within five years. ,20181231,20181231
http://opendatacommunities.org/id/district-council/basingstoke,Basingstoke & Deane Borough Council,BAS045,,Chineham House  Shakespeare Road Basingstoke,https://planning.basingstoke.gov.uk/online-applications/applicationDetails.do?activeTab=map&keyVal=N2DYPNCRAT000,OSGB36,464593.88,153942.78,0.13,owned by a public authority,yes,not permissioned,,,https://planning.basingstoke.gov.uk/online-applications/applicationDetails.do?activeTab=relatedCases&keyVal=N2DYPNCRAT000,,10,Change of use from offices to 10 residential affordable units and office for community use,Office for community use,,,,,,Planning permission for the conversion of this council owned building was granted in October 2014 (14/00759/FUL). This permission lapsed in 2018 and a new permission was granted in September 2018 (17/04259/FUL). Work is expected to commence in 2018-19.  The site is deliverable within five years.  ,20171231,20181231
http://opendatacommunities.org/id/district-council/basingstoke,Basingstoke & Deane Borough Council,BAS046,,Kings School,http:www.basingstoke.gov.uk/SHELAA,OSGB36,463409.69,151889.43,0.17,not owned by a public authority,,not permissioned,,,,,9,Residential development of 9 units ,,,,,,http:www.basingstoke.gov.uk/SHELAA,The SHELAA site (BAS046) benefits from permission in principle granted in October 2018 (18/02735/PIP). The site is currently being marketed and it is expected that there will be completions on site in the 6-10 year timeframe. ,20181231,20181231
http://opendatacommunities.org/id/district-council/basingstoke,Basingstoke & Deane Borough Council,BDB/63103,,Cheam Hawtreys  Newbury Road Headley,https://planning.basingstoke.gov.uk/online-applications/applicationDetails.do?activeTab=map&keyVal=ZZZTBZCRBJ724,OSGB36,451799.63,161998.01,0.28,owned by a public authority,,permissioned,full planning permission,20060621,https://planning.basingstoke.gov.uk/online-applications/applicationDetails.do?activeTab=relatedCases&keyVal=ZZZTBZCRBJ724,,6,Erection of 12 terraced and semi-detached dwellings,,,,,,,"The site is the remainder of a larger scheme for tied staff accommodation at Cheam Hawtreys School  (BDB/63103, approved 2006).  The school has confirmed, through the site monitoring consultation, that whilst the site will be delivered in due course, at present they have no intention to build out the remaining 6 units within the next 5 years.  The site has therefore been phased into the 5-10 year time band and its future delivery will continue to be reviewed through the annual monitoring process.",20171231,20181231
http://opendatacommunities.org/id/district-council/basingstoke,Basingstoke & Deane Borough Council,WHIT004,,Former Police Station Dances Lane Whitchurch,http://www.basingstoke.gov.uk/SHELAA,OSGB36,446564.06,148624.34,0.43,owned by a public authority,,not permissioned,,,,,15,Housing development of 15 dwellings ,,,,,,http:www.basingstoke.gov.uk/SHELAA,The site is allocated for approximately 15 dwellings in the Whitchurch Neighbourhood Plan (Policy HA1)  which was made in October 2017 . The brownfield site is currently in use as a police station and is therefore not currently available. The Police Commissioners have confirmed that this site will cease to be used for its present purpose and will be available for housing development within the Plan Period. ,20171231,20181231
http://opendatacommunities.org/id/district-council/basingstoke,Basingstoke & Deane Borough Council,WHIT007,,57 Winchester Road (Whitchurch Car Centre) Whitchurch,http://www.basingstoke.gov.uk/SHELAA,OSGB36,446341.45,147716.57,0.37,not owned by a public authority,,not permissioned,,,,,10,Housing development of 10 dwellings ,,,,,,http:www.basingstoke.gov.uk/SHELAA,"The site is allocated for approximately 10 dwellings in the Whitchurch Neighbourhood Plan (Policy HA3)  which was made in October 2017 . The brownfield site is currently in use as a car centre and is therefore not currently available.  However, the owners have confirmed their intention to redevelop the site for housings over the Plan period.",20171231,20181231
