Site Name Address,Coordinates (Latitude & Longitude),GeoX,GeoY,Site Plan,Hectares,Ownership,Deliverable,Planning Status,Permission Date,Min Net Dwellings,Development Description,Notes
"102-104 Fore Street (1st, 2nd and 3rd floors only)",Latitude: 50.72131 Longitude: -3.53389,-3.53389,50.72131,https://drive.google.com/drive/folders/0B4CpCORtOQdTem1rTDJ4WC1kYVU,0.07,Not owned by a public authority,Yes,Full consent,22.09.2011,13,Partial redevelopment to provide 13 self contained flats.,"Planning consent has been implemented, but work is on hold."
"130 Fore Street (1st, upper 1st, 2nd and 3rd floors only)",Latitude: 50.72009 Longitude: -3.53519,-3.53519,50.72009,https://drive.google.com/drive/folders/0B4CpCORtOQdTem1rTDJ4WC1kYVU,0.03,Not owned by a public authority,Yes,Full consent,14.02.2013,13,Redevelopment to provide 13 flats with associated access and communal facilities,"Planning consent has been implemented, but work is on hold."
"1-6 North Street, 182-183, 185 and 186 Fore Street (1st, 2nd, 3rd, 4th and 5th floors only)",Latitude: 50.72162 Longitude: -3.47811,-3.47811,50.72162,https://drive.google.com/drive/folders/0B4CpCORtOQdTem1rTDJ4WC1kYVU,0.08,Not owned by a public authority,Yes,Full consent,21.04.2017,24,Creation of 24 new dwellings (total of 28 dwellings including the existing) within vacant building formerly used as retail space.,
"The Courtyard, 48 New North Road",Latitude: 50.72697 Longitude: -3.52812,-3.52812,50.72697,https://drive.google.com/drive/folders/0B4CpCORtOQdTem1rTDJ4WC1kYVU,0.15,Not owned by a public authority,Yes,Prior notification,21.11.2017,13,Prior approval for change of use from office (B1a) to residential (C3) to provide 13 no. self-contained flats,
"Exeter Royal Academy for Deaf Education, Topsham Road",Latitude: 50.71616 Longitude: -3.52338,-3.52338,50.71616,https://drive.google.com/drive/folders/0B4CpCORtOQdTem1rTDJ4WC1kYVU,3.58,Not owned by a public authority,Yes,Full consent,28.06.2018,146,"Redevelopment of the Exeter Royal Academy for Deaf Education (eRADE) site to provide 146 new homes (C3), a care home and assisted living units (both C2), accommodation for a pre-school, access related works, provision of landscaping and open space and other associated works.",
"Former Exwick Middle School, Higher Exwick Hill",Latitude: 50.7299 Longitude: -3.55459,-3.55459,50.7299,https://drive.google.com/drive/folders/0B4CpCORtOQdTem1rTDJ4WC1kYVU,1.25,Owned by a public authority,Yes,Outline consent,07.01.2019,Unspecified,Outline application for residential development with vehicular access from Gloucester Road,
"Former Foxhayes Infant School, Gloucester Road",Latitude: 50.72813 Longitude: -3.5524,-3.5524,50.72813,https://drive.google.com/drive/folders/0B4CpCORtOQdTem1rTDJ4WC1kYVU,0.8,Owned by a public authority,Yes,Outline consent,07.01.2019,Unspecified,"Outline application for residential development with vehicular access from Gloucester Road (all detailed matters relating to appearance, landscaping, layout and scale of development reserved for future consideration)",
Land r/o 94-106 Thornpark Rise,Latitude: 50.72504 Longitude: -3.4888,-3.4888,50.72504,https://drive.google.com/drive/folders/0B4CpCORtOQdTem1rTDJ4WC1kYVU,0.34,Owned by a public authority,Yes,Full consent,03.10.2018,9,Demolition of 54no. garages and redevelopment of site comprising construction of 9no. 3 bed 4 person terraced and semi-detached houses and associated access and parking.,
"9a North Street (1st, 2nd and 3rd floors only)",Latitude: 50.72282 Longitude: -3.53341,-3.53341,50.72282,https://drive.google.com/drive/folders/0B4CpCORtOQdTem1rTDJ4WC1kYVU,0.04,Not owned by a public authority,Yes,Full consent,15.10.2015,8,"Conversion and internal alterations of the first, second and third floors to form 8no. one and two bedroom flats.",
35-37 Sidwell Street and land r/o 32-34 Sidwell Street (1st and 2nd floors only),Latitude: 50.72713 Longitude: -3.52442,-3.52442,50.72713,https://drive.google.com/drive/folders/0B4CpCORtOQdTem1rTDJ4WC1kYVU,0.08,Owned by a public authority,Yes,Full consent,04.10.2017,27,Change of use and extension to Nos. 35-37 Sidwell Street to provide 27no. bed purpose built student accommodation alongside 9no. self-contained dwellings (Class C3). Associated refuse / recycling storage and cycle parking.,
1-5 Lower Avenue,Latitude: 50.72637 Longitude: -3.50858,-3.50858,50.72637,https://drive.google.com/drive/folders/0B4CpCORtOQdTem1rTDJ4WC1kYVU,0.04,Not owned by a public authority,Yes,Prior notification,05.06.2018,5,Change of use from offices (Use Class B1a) to 5 flats (Use Class C3),
"Newberry Car Breakers, Redhills",Latitude: 50.71862 Longitude: -3.50283,-3.50283,50.71862,https://drive.google.com/drive/folders/0B4CpCORtOQdTem1rTDJ4WC1kYVU,0.33,Not owned by a public authority,Yes,Outline consent,31.07.2018,5,Outline application for five dwellings (All Matters Reserved),
"Moose Hall, Blackboy Road",Latitude: 50.72982 Longitude: -3.51887,-3.51887,50.72982,https://drive.google.com/drive/folders/0B4CpCORtOQdTem1rTDJ4WC1kYVU,0.06,Not owned by a public authority,Yes,Full consent,24.10.2018,8,"Change of use and conversion of former church/social hall (Use Class D1) to 8no. 2-bedroom dwellings (Use Class C3), with associated external alterations to the building. (Revised).",
The King Billy and 26-28 Longbrook Street,Latitude: 50.72619 Longitude: -3.52705,-3.52705,50.72619,https://drive.google.com/drive/folders/0B4CpCORtOQdTem1rTDJ4WC1kYVU,0.05,Not owned by a public authority,Yes,Full consent,27.04.2018,108,"Demolition of the King Billy pub to build a mixed-use development scheme comprising of ground floor commercial units (Use classes A1, A3 and A4) with 108 bed space student accommodation above over 6 and 7 storeys",
Land at Glenthorne Road,Latitude: 50.73787 Longitude: -3.54264,-3.54264,50.73787,https://drive.google.com/drive/folders/0B4CpCORtOQdTem1rTDJ4WC1kYVU,0.57,Not owned by a public authority,Yes,Full consent,17.12.2018,178,Construction of student accommodation including the creation of access and associated infrastructure,
"City Arcade, Fore Street",Latitude: 50.7211 Longitude: -3.53415,-3.53415,50.7211,https://drive.google.com/drive/folders/0B4CpCORtOQdTem1rTDJ4WC1kYVU,0.06,Not owned by a public authority,Yes,Full consent,22.10.2018,64,Demolition of existing single storey arcade. Construction of 4 storey building for 64 student bedspaces incoporating ground retail unit  with associated bike and bin stores.,Under construction.
78-84 Bovemoors Lane,Latitude: 50.7275 Longitude: -3.52239,-3.52239,50.7275,https://drive.google.com/drive/folders/0B4CpCORtOQdTem1rTDJ4WC1kYVU,0.24,Owned by a public authority,Yes,Full consent,12.10.2018,10,"Demolition of 2 no. residential buildings containing 4 no. flats and 30 no. garages, and redevelopment of site comprising construction of 10 no. 3 bed 4 person terraced houses and associated access and parking.",Site cleared.
"Land adj Exeter St Davids Station, Bonhay Road/Cowley Bridge Road",Latitude: 50.72958 Longitude: -3.54289,-3.54289,50.72958,https://drive.google.com/drive/folders/0B4CpCORtOQdTem1rTDJ4WC1kYVU,2.2,Not owned by a public authority,Yes,Not consented,,,,"Site assessed as suitable, available and achievable for mixed use development including residential in the Revised 2015 SHLAA."
Nos. 36-37 Well Street,Latitude: 50.73026 Longitude: -3.52283,-3.52283,50.73026,https://drive.google.com/drive/folders/0B4CpCORtOQdTem1rTDJ4WC1kYVU,0.09,Not owned by a public authority,Yes,Not consented,,,,"Site assessed as suitable, available and achievable for residential development in the Revised 2015 SHLAA."
"Exmouth Junction, Prince Charles Road",Latitude: 50.73385 Longitude: -3.51012,-3.51012,50.73385,https://drive.google.com/drive/folders/0B4CpCORtOQdTem1rTDJ4WC1kYVU,6.7,Not owned by a public authority,Yes,Not consented,,,,"Site assessed as suitable, available and achievable for residential development in the Revised 2015 SHLAA. Planning application submitted."
"Land adj Exeter Arms Hotel, Rydon Lane",Latitude: 50.71713 Longitude: -3.47981,-3.47981,50.71713,https://drive.google.com/drive/folders/0B4CpCORtOQdTem1rTDJ4WC1kYVU,0.23,Not owned by a public authority,Yes,Not consented,,,,"Site assessed as suitable, available and achievable for residential development in the Revised 2015 SHLAA. Lapsed consent for 14 apartments."
"DOA & Exeter Mobility Centre, Wonford Road",Latitude: 50.71544 Longitude: -3.51207,-3.51207,50.71544,https://drive.google.com/drive/folders/0B4CpCORtOQdTem1rTDJ4WC1kYVU,0.8,Owned by a public authority,Yes,Not consented,,,,"Site assessed as suitable, available and achievable for residential development in the Revised 2015 SHLAA."
"Honeylands Hospital, Pinhoe Road",Latitude: 50.73138 Longitude: -3.49689,-3.49689,50.73138,https://drive.google.com/drive/folders/0B4CpCORtOQdTem1rTDJ4WC1kYVU,0.68,Not owned by a public authority,Yes,Not consented,,,,"Site assessed as suitable, available and achievable for residential development in the Revised 2015 SHLAA. Planning application submitted."
"Mary Arches Surface Car Park, Mary Arches Street",Latitude: 50.72267 Longitude: -3.53459,-3.53459,50.72267,https://drive.google.com/drive/folders/0B4CpCORtOQdTem1rTDJ4WC1kYVU,0.2,Owned by a public authority,Yes,Not consented,,,,"Site assessed as suitable, available and achievable for residential development in the Revised 2015 SHLAA."
"Bendene Hotel, 15-16 Richmond Road",Latitude: 50.72628 Longitude: -3.5367,-3.5367,50.72628,https://drive.google.com/drive/folders/0B4CpCORtOQdTem1rTDJ4WC1kYVU,0.05,Not owned by a public authority,Yes,Not consented,,,,"Site assessed as suitable, available and achievable for residential development in the Revised 2015 SHLAA. Conversion/change of use only."
"Pyramids Leisure Centre, Heavitree Road",Latitude: 50.72453 Longitude: -3.5213,-3.5213,50.72453,https://drive.google.com/drive/folders/0B4CpCORtOQdTem1rTDJ4WC1kYVU,0.22,Owned by a public authority,Yes,Not consented,,,,"Site assessed as suitable, available and achievable for residential development in the Revised 2015 SHLAA."
Nos. 91-97 Wonford Street,Latitude: 50.71535 Longitude: -3.49933,-3.49933,50.71535,https://drive.google.com/drive/folders/0B4CpCORtOQdTem1rTDJ4WC1kYVU,0.08,Owned by a public authority,Yes,Not consented,,,,"Site assessed as suitable, available and achievable for residential development in the Revised 2015 SHLAA."
Corner of Summerland St & Red Lion Lane,Latitude: 50.7275 Longitude: -3.52239,-3.52239,50.7275,https://drive.google.com/drive/folders/0B4CpCORtOQdTem1rTDJ4WC1kYVU,0.05,Owned by a public authority,Yes,Not consented,,,,Lapsed consent for redevelopment to provide five storey building with 28 flats and retail/restaurant unit at ground floor and associated works
