OrganisationURI,SiteReference,SiteNameAddress,SiteplanURL,GeoY,GeoX,Hectares,OwnershipStatus,PlanningStatus,PermissionType,PermissionDate,PlanningHistory,Deliverable,NetDwellingsRangeFrom,NetDwellingsRangeTo,HazardousSubstances,Notes,FirstAddedDate,LastUpdatedDate,EndDate
http://opendatacommunities.org/id/unitary-authority/brighton-and-hove,BLR0001,Oakley House Leicester Street Brighton,https://new.brighton-hove.gov.uk/sites/default/files/planning_bc_regen/policy/brownfield-sites/blr0001-oakley-house-leicester-street.pdf,54.595336,-6.581715,0.08,owned by a public authority,not permissioned,,,,yes,5,5,,Added due to response from landowner that site could be developed. Considered min 5 attainable,2018-12-17,2019-12-09,
http://opendatacommunities.org/id/unitary-authority/brighton-and-hove,PP4588,17 Marmion Road Hove,https://new.brighton-hove.gov.uk/sites/default/files/planning_bc_regen/policy/brownfield-sites/pp4588-17-marmion-road-hove.pdf,54.558558,-6.557738,0.07,not owned by a public authority,permissioned,full planning permission,2015-11-03,https://planningapps.brighton-hove.gov.uk/online-applications/applicationDetails.do?activeTab=summary&keyVal=ZZZR5ZDMXE257|https://planningapps.brighton-hove.gov.uk/online-applications/applicationDetails.do?activeTab=summary&keyVal=ZZZR65DMXE247,yes,5,,,Development commenced 201617,2017-10-03,2019-12-09,
http://opendatacommunities.org/id/unitary-authority/brighton-and-hove,PP4653,20 Sackville Road & 78 Pembroke Crescent Hove,https://new.brighton-hove.gov.uk/sites/default/files/planning_bc_regen/policy/brownfield-sites/pp4653-20-sackville-road-78-pembroke-crescent-hove.pdf,54.564327,-6.565040,0.07,not owned by a public authority,permissioned,full planning permission,2016-03-01,https://planningapps.brighton-hove.gov.uk/online-applications/applicationDetails.do?activeTab=summary&keyVal=ZZZR63DMXE559,yes,5,,,Development commenced 201617,2017-10-03,2019-12-09,
http://opendatacommunities.org/id/unitary-authority/brighton-and-hove,PP5659,19 Oriental Place Brighton,https://new.brighton-hove.gov.uk/sites/default/files/planning_bc_regen/policy/brownfield-sites/pp5659-19-oriental-place-brighton.pdf,54.579832,-6.578238,0.01,not owned by a public authority,permissioned,full planning permission,2017-11-14,https://planningapps.brighton-hove.gov.uk/online-applications/applicationDetails.do?keyVal=ORSGA5DMGSF00&activeTab=summary,yes,5,,,Development not started on site 201718,2018-11-06,2019-12-09,
http://opendatacommunities.org/id/unitary-authority/brighton-and-hove,PP5771,2 - 4 Sackville Road Hove,https://www.brighton-hove.gov.uk/sites/brighton-hove.gov.uk/files/PP5771%202%20to%204%20Sackville%20Road%20Hove.pdf,54.564015,-6.566863,0.07,not owned by a public authority,permissioned,full planning permission,2018-05-02,https://planningapps.brighton-hove.gov.uk/online-applications/applicationDetails.do?activeTab=summary&keyVal=OW7I5MDMLCM00,yes,5,,,Development commenced 2019,2019-12-09,2019-12-09,
http://opendatacommunities.org/id/unitary-authority/brighton-and-hove,PP5925,45 Portland Road Hove,https://www.brighton-hove.gov.uk/sites/brighton-hove.gov.uk/files/PP5925%2045%20Portland%20Road%20Hove.pdf,54.562269,-6.583526,0.02,not owned by a public authority,permissioned,other,2019-03-11,https://planningapps.brighton-hove.gov.uk/online-applications/applicationDetails.do?activeTab=summary&keyVal=PJDKC8DM0PA00,yes,5,,,Development Not Started 2019,2019-12-09,2019-12-09,
http://opendatacommunities.org/id/unitary-authority/brighton-and-hove,SHLAA0001,Gas Works Site Boundary Road Brighton,https://new.brighton-hove.gov.uk/sites/default/files/planning_bc_regen/policy/brownfield-sites/shlaa0001-gas-works-site-boundary-road-brighton.pdf,54.609912,-6.593027,2.34,mixed ownership,not permissioned,,,https://planningapps.brighton-hove.gov.uk/online-applications/applicationDetails.do?activeTab=summary&keyVal=PDG5TVDM0PA00|https://planningapps.brighton-hove.gov.uk/online-applications/applicationDetails.do?activeTab=summary&keyVal=ZZZR7SDMXE993,,340,340,yes,"The Gas Works site is included within CPP1 policy DA2 Brighton Marina. The Gas Works Site is an existing Strategic Allocation for business floorspace 85 residential units and some ancillary retail. Land slopes to the south - opportunities for higher density development. Southern part of sites contains non-operational land formally used for storage and production of gas. The northern part of the site  is occupied by 2 operational gas holders. 
The northern part of site is owned by Southern Gas Network plc and use would require decommissioning and removal of gasholders. Owners of site consider there is a reasonable prospect that residential development will take place on the land within 5 years",2017-09-18,2019-12-16,
http://opendatacommunities.org/id/unitary-authority/brighton-and-hove,SHLAA0003,Land at Brighton Marina (Inner Harbour),https://new.brighton-hove.gov.uk/sites/default/files/planning_bc_regen/policy/brownfield-sites/shlaa0003-land-at-brighton-marina-inner-harbour.pdf,54.610571,-6.598387,11.52,not owned by a public authority,not permissioned,,,,,1000,1000,,Brighton Marina & Black Rock Development Area. Strategic Allocation. Adjacent to Local Wildlife Site. No planning app. Call for Sites 2017. No site wide planning history.,2017-09-26,2019-12-16,
http://opendatacommunities.org/id/unitary-authority/brighton-and-hove,SHLAA0004,Land at Brighton Marina (Outer Harbour),https://new.brighton-hove.gov.uk/sites/default/files/planning_bc_regen/policy/brownfield-sites/shlaa0004-land-at-brighton-marina-outer-harbour.pdf,54.609342,-6.601844,5.33,not owned by a public authority,permissioned,full planning permission,2006-07-04,https://planningapps.brighton-hove.gov.uk/online-applications/applicationDetails.do?activeTab=summary&keyVal=PPA1IFDM0PA00|https://planningapps.brighton-hove.gov.uk/online-applications/applicationDetails.do?activeTab=summary&keyVal=ZZZR61DMXE980|https://planningapps.brighton-hove.gov.uk/online-applications/applicationDetails.do?activeTab=summary&keyVal=ZZZR67DMXE520|https://planningapps.brighton-hove.gov.uk/online-applications/applicationDetails.do?activeTab=summary&keyVal=ZZZR6EDMXE556|https://planningapps.brighton-hove.gov.uk/online-applications/applicationDetails.do?activeTab=summary&keyVal=ZZZR73DMXE858|https://planningapps.brighton-hove.gov.uk/online-applications/applicationDetails.do?activeTab=summary&keyVal=ZZZR79DMXE336,yes,661,,,Phase 1 complete 201516 (195) Phase 2 (244) Commenced 2016/17. Brighton Marina Inner Harbour is a Strategic Allocation within the DA2 Development Area within CPP1. Call for Sites 2017. Public exhibition for proposed remaining sites Nov 2018. New application for Phase 2 received April 2019 for 480 units,2017-09-18,2019-12-16,
http://opendatacommunities.org/id/unitary-authority/brighton-and-hove,SHLAA0014,Preston Barracks Lewes Road Brighton,https://new.brighton-hove.gov.uk/sites/default/files/planning_bc_regen/policy/brownfield-sites/shlaa0014-preston-barracks-lewes-road-brighton.pdf,54.601046,-6.546533,1.96,not owned by a public authority,permissioned,full planning permission,2017-12-22,https://planningapps.brighton-hove.gov.uk/online-applications/applicationDetails.do?activeTab=summary&keyVal=OL5ZO4DMHIF00,yes,363,363,,Development substantially commenced. Strategic Allocation. Planning app BH2017/00492 includes Preston Barracks site as part of wider site including Brighton University Mithras House and Watts sites as part of a the Strategic Allocation within policy DA3 – Lewes Road in CPP1. The Preston Barracks site brings forward the residential requirement of the allocation.,2017-09-18,2019-12-16,
http://opendatacommunities.org/id/unitary-authority/brighton-and-hove,SHLAA0027,BT Site bottom side Freshfield Road,https://new.brighton-hove.gov.uk/sites/default/files/planning_bc_regen/policy/brownfield-sites/shlaa0027-bt-site-bottom-side-freshfield-road.pdf,54.597329,-6.581816,0.6,not owned by a public authority,not permissioned,,,https://planningapps.brighton-hove.gov.uk/online-applications/applicationDetails.do?activeTab=summary&keyVal=ZZZR75DMXE948,,45,45,,Eastern Street/Edward Street Development Area. Site currently used by British Telecom (sui generis use) for employment purposes. Existing employment use of the site should be retained on this non designated site.,2017-09-26,2019-12-16,
http://opendatacommunities.org/id/unitary-authority/brighton-and-hove,SHLAA0028,Brighton Youth Centre 64 Edward Street Grosvenor Place,https://new.brighton-hove.gov.uk/sites/default/files/planning_bc_regen/policy/brownfield-sites/shlaa0028-brighton-youth-centre-64-edward-street-grosvenor-place.pdf,54.594187,-6.581152,0.07,not owned by a public authority,not permissioned,,,,,11,11,,Eastern Street/Edward Street Development Area. Possible ownership constraints. Site protected under policy HO20. Community use to be incorporated into new development,2017-09-26,2019-12-16,
http://opendatacommunities.org/id/unitary-authority/brighton-and-hove,SHLAA0030,Former Municipal Market Circus Street Brighton,https://new.brighton-hove.gov.uk/sites/default/files/planning_bc_regen/policy/brownfield-sites/shlaa0030-former-municipal-market-circus-street-brighton.pdf,54.591946,-6.576439,0.79,not owned by a public authority,permissioned,full planning permission,2015-03-19,https://planningapps.brighton-hove.gov.uk/online-applications/applicationDetails.do?activeTab=summary&keyVal=ZZZR62DMXE124|https://planningapps.brighton-hove.gov.uk/online-applications/applicationDetails.do?keyVal=ZZZR63DMXE207&activeTab=summary|https://planningapps.brighton-hove.gov.uk/online-applications/applicationDetails.do?keyVal=ZZZR6BDMXE145&activeTab=summary,yes,142,,,Development substantially commenced 201819 -  Strategic Allocation - Commenced 2015/16,2017-09-18,2019-12-16,
http://opendatacommunities.org/id/unitary-authority/brighton-and-hove,SHLAA0032,Edward St (Amex House),https://new.brighton-hove.gov.uk/sites/default/files/planning_bc_regen/policy/brownfield-sites/shlaa0032-edward-st-amex-house.pdf,54.592873,-6.579517,1.8,not owned by a public authority,permissioned,full planning permission,2018-10-25,https://planningapps.brighton-hove.gov.uk/online-applications/applicationDetails.do?activeTab=summary&keyVal=P3IQ96DM0P100|https://planningapps.brighton-hove.gov.uk/online-applications/applicationDetails.do?activeTab=summary&keyVal=ZZZR6RDMXE754|https://planningapps.brighton-hove.gov.uk/online-applications/simpleSearchResults.do?action=firstPage|https://planningapps.brighton-hove.gov.uk/online-applications/applicationDetails.do?keyVal=ZZZR5ZDMXE699&activeTab=summary|http://planningapps.brighton-hove.gov.uk/online-applications/applicationDetails.do?activeTab=summary&keyVal=ZZZR65DMXE802|http://planningapps.brighton-hove.gov.uk/online-applications/applicationDetails.do?activeTab=summary&keyVal=ZZZR6EDMXE524|http://planningapps.brighton-hove.gov.uk/online-applications/applicationDetails.do?activeTab=summary&keyVal=ZZZR6QDMXE171,yes,168,168,,Eastern Street/Edward Street Development Area.  Call for Sites 2017. The quantity of housing proposed for this site is based upon SPD04 Edward Street Quarter which was adopted in March 2006.  There are two options set out in the SPD - Option 1 was selected.  Implementation of this scheme is reliant upon the support of Amex. Strategic Allocation Application Submitted,2017-09-26,2019-12-16,
http://opendatacommunities.org/id/unitary-authority/brighton-and-hove,SHLAA0035,PO Sorting Office Denmark Villas Hove,https://new.brighton-hove.gov.uk/sites/default/files/planning_bc_regen/policy/brownfield-sites/shlaa0035-po-sorting-denmark-villas.pdf,54.570856,-6.558912,0.59,not owned by a public authority,not permissioned,,,,,67,67,,Added due to response from landowner that site could be developed in 6-10 years. 67 units considered possible to allow for a possible employment element.,2018-12-17,2019-12-16,
http://opendatacommunities.org/id/unitary-authority/brighton-and-hove,SHLAA0041,(Smoky Estate) Corner of Church Road Lincoln Road & Gladstone Road Portslade,https://new.brighton-hove.gov.uk/sites/default/files/planning_bc_regen/policy/brownfield-sites/shlaa0041-smoky-estate-corner-of-church-road-lincoln-road-gladstone-road-portslade.pdf,54.541522,-6.557414,0.32,not owned by a public authority,not permissioned,,,,,32,32,,Emerging City Plan Part 2 Allocation 32 Units,2017-09-26,2019-12-16,
http://opendatacommunities.org/id/unitary-authority/brighton-and-hove,SHLAA0045,King Alfred Kingsway Hove,https://new.brighton-hove.gov.uk/sites/default/files/planning_bc_regen/policy/brownfield-sites/shlaa0045-king-alfred-kingsway-hove.pdf,54.563589,-6.574324,1.6,owned by a public authority,not permissioned,,,https://planningapps.brighton-hove.gov.uk/online-applications/applicationDetails.do?activeTab=summary&keyVal=ZZZR71DMXE825,,500,500,,Strategic Allocation. Pre-Application Stage,2017-09-26,2019-12-16,
http://opendatacommunities.org/id/unitary-authority/brighton-and-hove,SHLAA0046,12 Richmond Parade Brighton,https://new.brighton-hove.gov.uk/sites/default/files/planning_bc_regen/policy/brownfield-sites/shlaa0046-12-richmond-parade-brighton.pdf,54.592361,-6.573557,0.09,not owned by a public authority,not permissioned,,,https://planningapps.brighton-hove.gov.uk/online-applications/applicationDetails.do?activeTab=summary&keyVal=ZZZR7BDMXE317|https://planningapps.brighton-hove.gov.uk/online-applications/applicationDetails.do?activeTab=summary&keyVal=ZZZR7TDMXE548,,7,7,,Call for sites for 7 units SHLAA 2015,2017-09-18,2019-12-16,
http://opendatacommunities.org/id/unitary-authority/brighton-and-hove,SHLAA0047,Brighton General Hospital Elm Grove Brighton,https://new.brighton-hove.gov.uk/sites/default/files/planning_bc_regen/policy/brownfield-sites/shlaa0047-brighton-general-hospital-elm-grove-brighton.pdf,54.604338,-6.567526,5.77,not owned by a public authority,not permissioned,,,https://planningapps.brighton-hove.gov.uk/online-applications/applicationDetails.do?activeTab=summary&keyVal=ZZZR6FDMXE238|https://planningapps.brighton-hove.gov.uk/online-applications/applicationDetails.do?activeTab=summary&keyVal=ZZZR6FDMXE537|https://planningapps.brighton-hove.gov.uk/online-applications/applicationDetails.do?activeTab=summary&keyVal=ZZZR6NDMXE150|https://planningapps.brighton-hove.gov.uk/online-applications/applicationDetails.do?activeTab=summary&keyVal=ZZZR6PDMXE087|https://planningapps.brighton-hove.gov.uk/online-applications/applicationDetails.do?activeTab=summary&keyVal=ZZZR6VDMXE931,,200,200,,Adjacent to Local Wildlife Site. Consultation on plan options May 2018  Preferred Option chosen Oct 2018,2017-09-26,2019-12-16,
http://opendatacommunities.org/id/unitary-authority/brighton-and-hove,SHLAA0049,Manchester Street/Charles Street Brighton,https://new.brighton-hove.gov.uk/sites/default/files/planning_bc_regen/policy/brownfield-sites/shlaa0049-manchester-street-charles-street-brighton.pdf,54.591135,-6.584295,0.06,not owned by a public authority,not permissioned,,,,,12,12,,,2017-09-26,2019-12-16,
http://opendatacommunities.org/id/unitary-authority/brighton-and-hove,SHLAA0052,Lansdowne Mews Farm Road Hove,https://new.brighton-hove.gov.uk/sites/default/files/planning_bc_regen/policy/brownfield-sites/shlaa0052-lansdowne-mews-farm-road-hove.pdf,54.576060,-6.573091,0.08,not owned by a public authority,not permissioned,,,,,6,6,,Mainly commercial garage small business use.  Would need to demonstrated genuinely redundant.  Possible access issues.,2017-09-26,2019-12-16,
http://opendatacommunities.org/id/unitary-authority/brighton-and-hove,SHLAA0055,Victoria Grove Second Avenue Hove,https://new.brighton-hove.gov.uk/sites/default/files/planning_bc_regen/policy/brownfield-sites/shlaa0055-victoria-grove-second-avenue-hove.pdf,54.571226,-6.571743,0.13,not owned by a public authority,not permissioned,,,,,20,20,,Mixed ownership,2017-09-26,2019-12-16,
http://opendatacommunities.org/id/unitary-authority/brighton-and-hove,SHLAA0056,St John's Place First Avenue Hove,https://new.brighton-hove.gov.uk/sites/default/files/planning_bc_regen/policy/brownfield-sites/shlaa0056-st-johns-place-first-avenue-hove.pdf,54.572489,-6.572365,0.11,not owned by a public authority,not permissioned,,,,,17,17,,Mixed ownership,2017-09-26,2019-12-16,
http://opendatacommunities.org/id/unitary-authority/brighton-and-hove,SHLAA0057,44 - 50 Brunswick Street West Hove,https://new.brighton-hove.gov.uk/sites/default/files/planning_bc_regen/policy/brownfield-sites/shlaa0057-44-50-brunswick-street-west-hove.pdf,54.575593,-6.575191,0.08,not owned by a public authority,not permissioned,,,,,6,6,,,2017-09-26,2019-12-16,
http://opendatacommunities.org/id/unitary-authority/brighton-and-hove,SHLAA0075,Land south of Lincoln Cottages (Lincoln Cottage Works) 15-26 Lincoln Street Brighton,https://new.brighton-hove.gov.uk/sites/default/files/planning_bc_regen/policy/brownfield-sites/shlaa0075-land-south-of-lincoln-cottages-15-26-lincoln-street.pdf,54.595762,-6.569741,0.12,not owned by a public authority,not permissioned,,,https://planningapps.brighton-hove.gov.uk/online-applications/applicationDetails.do?activeTab=summary&keyVal=ZZZR6EDMXE333|https://planningapps.brighton-hove.gov.uk/online-applications/applicationDetails.do?activeTab=summary&keyVal=ZZZR6EDMXE333,,18,18,,Draft City Plan Part 2 Allocation,2017-09-26,2019-12-16,
http://opendatacommunities.org/id/unitary-authority/brighton-and-hove,SHLAA0079,Lee Hire 7-13 Church Place Brighton,https://new.brighton-hove.gov.uk/sites/default/files/planning_bc_regen/policy/brownfield-sites/shlaa0079-lee-hire-7-13-church-place-brighton.pdf,54.605892,-6.589443,0.07,not owned by a public authority,not permissioned,,,https://planningapps.brighton-hove.gov.uk/online-applications/applicationDetails.do?activeTab=summary&keyVal=ZZZR71DMXE623,,7,7,,Ex garage/petrol sales site & possible land contamination would need investigating.,2017-09-26,2019-12-16,
http://opendatacommunities.org/id/unitary-authority/brighton-and-hove,SHLAA0084,25 Montague Place Brighton,https://new.brighton-hove.gov.uk/sites/default/files/planning_bc_regen/policy/brownfield-sites/shlaa0084-25-montague-place-brighton.pdf,54.598415,-6.585920,0.06,not owned by a public authority,not permissioned,,,,,6,6,,Would result in loss of employment use and would need to demonstrate site genuinely redundant.  Possible land contamination would need to be investigated.,2017-09-26,2019-12-16,
http://opendatacommunities.org/id/unitary-authority/brighton-and-hove,SHLAA0085,55  (adj 31Walpole Road) Canning Street Brighton,https://new.brighton-hove.gov.uk/sites/default/files/planning_bc_regen/policy/brownfield-sites/shlaa0085-55-adj-31walpole-road-canning-street-brighton.pdf,54.601907,-6.580425,0.06,not owned by a public authority,not permissioned,,,https://planningapps.brighton-hove.gov.uk/online-applications/applicationDetails.do?activeTab=summary&keyVal=ZZZR71DMXE224|https://planningapps.brighton-hove.gov.uk/online-applications/applicationDetails.do?activeTab=summary&keyVal=ZZZR73DMXE028,,6,6,,Loss of employment use,2017-09-26,2019-12-16,
http://opendatacommunities.org/id/unitary-authority/brighton-and-hove,SHLAA0086,Land and garages at rear of 1 -3 Queensway Southwater Close Brighton,https://new.brighton-hove.gov.uk/sites/default/files/planning_bc_regen/policy/brownfield-sites/shlaa0086-land-and-garages-at-rear-of-1-3-queensway-southwater-close-brighton.pdf,54.601196,-6.576378,0.08,not owned by a public authority,not permissioned,,,,,9,9,,Garage parking area developable,2017-09-26,2019-12-16,
http://opendatacommunities.org/id/unitary-authority/brighton-and-hove,SHLAA0092,Rear of 31 Appledore Road & 3-5 Halland Road,https://new.brighton-hove.gov.uk/sites/default/files/planning_bc_regen/policy/brownfield-sites/shlaa0092-rear-of-31-appledore-road-3-5-halland-road.pdf,54.612876,-6.526651,0.09,owned by a public authority,not permissioned,,,,,8,8,,Garage site owned by council,2017-09-26,2019-12-16,
http://opendatacommunities.org/id/unitary-authority/brighton-and-hove,SHLAA0095,Land west of Homeleigh London Road Brighton,https://new.brighton-hove.gov.uk/sites/default/files/planning_bc_regen/policy/brownfield-sites/shlaa0095-land-west-of-homeleigh-london-road-brighton.pdf,54.580331,-6.519117,0.15,not owned by a public authority,not permissioned,,,,,23,23,,The site is car parking for Homeleigh a block of flats.,2017-09-26,2019-12-16,
http://opendatacommunities.org/id/unitary-authority/brighton-and-hove,SHLAA0101,1 Shelldale Road Portslade,https://new.brighton-hove.gov.uk/sites/default/files/planning_bc_regen/policy/brownfield-sites/shlaa0101-1-shelldale-road-portslade.pdf,54.540593,-6.554386,0.06,not owned by a public authority,not permissioned,,,,,6,6,,,2017-09-26,2019-12-16,
http://opendatacommunities.org/id/unitary-authority/brighton-and-hove,SHLAA0103,117 Victoria Road Portslade,https://new.brighton-hove.gov.uk/sites/default/files/planning_bc_regen/policy/brownfield-sites/shlaa0103-117-victoria-road-portslade.pdf,54.544095,-6.552657,0.06,not owned by a public authority,not permissioned,,,,,6,6,,Current use - Garage,2017-09-27,2019-12-16,
http://opendatacommunities.org/id/unitary-authority/brighton-and-hove,SHLAA0105,Former Brewery Site South Street Portslade,https://new.brighton-hove.gov.uk/sites/default/files/planning_bc_regen/policy/brownfield-sites/shlaa0105-former-brewery-site-south-street-portslade.pdf,54.538701,-6.540838,0.35,not owned by a public authority,permissioned,full planning permission,,https://planningapps.brighton-hove.gov.uk/online-applications/applicationDetails.do?activeTab=summary&keyVal=ZZZR5ZDMXE418|https://planningapps.brighton-hove.gov.uk/online-applications/applicationDetails.do?activeTab=summary&keyVal=ZZZR62DMXE129|https://planningapps.brighton-hove.gov.uk/online-applications/applicationDetails.do?activeTab=summary&keyVal=ZZZR62DMXE134|https://planningapps.brighton-hove.gov.uk/online-applications/applicationDetails.do?activeTab=summary&keyVal=ZZZR62DMXE131,yes,48,48,,Development substantially commenced 201819 BH2016/02459.,2017-09-18,2019-12-16,
http://opendatacommunities.org/id/unitary-authority/brighton-and-hove,SHLAA0122,PO Sorting Office Nevill Road Rottingdean Brighton,https://new.brighton-hove.gov.uk/sites/default/files/planning_bc_regen/policy/brownfield-sites/shlaa0122-po-sorting-office-nevill-road-rottingdean-brighton.pdf,54.639025,-6.614493,0.1,not owned by a public authority,not permissioned,,,,,8,8,,,2017-09-27,2019-12-16,
http://opendatacommunities.org/id/unitary-authority/brighton-and-hove,SHLAA0132,North of Theobald House Blackman Street/Cheapside Whitecross Street Brighton,https://new.brighton-hove.gov.uk/sites/default/files/planning_bc_regen/policy/brownfield-sites/shlaa0132-north-of-theobald-house-blackman-street-cheapside-whitecross-street-brighton.pdf,54.589709,-6.568767,0.16,not owned by a public authority,not permissioned,,,,,32,32,,In a variety of employment type uses but not allocated site. CPP1 Strategic allocation.,2017-09-27,2019-12-16,
http://opendatacommunities.org/id/unitary-authority/brighton-and-hove,SHLAA0139,35-39 The Droveway Hove,https://new.brighton-hove.gov.uk/sites/default/files/planning_bc_regen/policy/brownfield-sites/shlaa0139-35-39-the-droveway-hove.pdf,54.574316,-6.545177,0.44,not owned by a public authority,pending decision,,,https://planningapps.brighton-hove.gov.uk/online-applications/applicationDetails.do?activeTab=summary&keyVal=PJIPRRDMMLK00|https://planningapps.brighton-hove.gov.uk/online-applications/applicationDetails.do?activeTab=summary&keyVal=P0MUAIDMIU700,yes,14,14,,SHLAA 2015 Call for sites submission.  Pre App 2017. Application  BH2018/03798 Under Consideration  for 14 Resi Units with mixed use Commercial.,2017-09-18,2019-12-16,
http://opendatacommunities.org/id/unitary-authority/brighton-and-hove,SHLAA0143,25 Ditchling Rise/rear of 57-63 Beaconsfield Road Brighton,https://new.brighton-hove.gov.uk/sites/default/files/planning_bc_regen/policy/brownfield-sites/shlaa0143-25-ditchling-rise-rear-of-57-63-beaconsfield-road.pdf,54.588624,-6.557709,0.09,not owned by a public authority,not permissioned,,,,,15,15,,Beaconsfield car workshops.  Loss of employment. Possible land contamination from existing use.,2017-09-27,2019-12-16,
http://opendatacommunities.org/id/unitary-authority/brighton-and-hove,SHLAA0156,Rear of 149 to 163 Preston Road,https://new.brighton-hove.gov.uk/sites/default/files/planning_bc_regen/policy/brownfield-sites/shlaa0156-rear-of-149-to-163-preston-road.pdf,54.584883,-6.555293,0.26,not owned by a public authority,not permissioned,,,https://planningapps.brighton-hove.gov.uk/online-applications/applicationDetails.do?activeTab=summary&keyVal=ZZZR7ADMXE563,,26,26,,Car Park for offices on Preston Road and garden area for dwellings.,2017-09-27,2019-12-16,
http://opendatacommunities.org/id/unitary-authority/brighton-and-hove,SHLAA0163,Studor House 13 Sheridan Terrace Hove,https://new.brighton-hove.gov.uk/sites/default/files/planning_bc_regen/policy/brownfield-sites/shlaa0163-studor-house-13-sheridan-terrace-hove.pdf,54.563511,-6.555444,0.06,not owned by a public authority,not permissioned,,,,,9,9,,Loss of B1a office site,2017-09-27,2019-12-16,
