entry-date,organisation,site,site-address,site-plan-url,deliverable,ownership,planning-permission-status,planning-permission-type,hazardous-substances,latitude,longitude,hectares,minimum-net-dwellings,maximum-net-dwellings,start-date,end-date,notes,resource
2017-12-31,local-authority-eng:HAL,H1032,"Busway and Former Petrol Station, Bridge Street, Runcorn",http://map.halton.gov.uk/WebMapLayers8External/map.aspx?MapName=Linked&overlayname=Brownfield%20Register&schemacolumn=Ref&resolution=1&UID=H1032,yes,mixed ownership,not permissioned,,,53.341239,-2.727265,0.9,24,32,2017-12-31,,"Potential capacity based on a density multiplier with the minimum based on 30dph and maximum at 40dph. Physical constraints identified include woodland and potentially contaminated land.. ""Potential for housing and apartments.""",1e676ab6544457f0c926c787f10159e952c78c3be221eb5cd94cc005791042c4
2017-12-31,local-authority-eng:HAL,H1077,"Highways Agency Depot, Chester Road, Preston Brook",http://map.halton.gov.uk/WebMapLayers8External/map.aspx?MapName=Linked&overlayname=Brownfield%20Register&schemacolumn=Ref&resolution=1&UID=H1077,,owned by a public authority,not permissioned,,,53.319595,-2.652483,0.88,20,30,2017-12-31,,"Site is currently in use. Minimum capacity to allow for other uses, whilst maximum capacity is based on a density multiplier at 35dph. The relocation of the existing depot would be a constraint to the development of the site.. ""Potential for houses, along with potential for community uses and small scale retail to support the local centre""",1e676ab6544457f0c926c787f10159e952c78c3be221eb5cd94cc005791042c4
2017-12-31,local-authority-eng:HAL,H1079,"Land to the south of Old Quay Street and Mason Street, Runcorn",http://map.halton.gov.uk/WebMapLayers8External/map.aspx?MapName=Linked&overlayname=Brownfield%20Register&schemacolumn=Ref&resolution=1&UID=H1079,,owned by a public authority,not permissioned,,,53.343069,-2.721994,1.46,39,52,2017-12-31,,"Potential capacity based on a density multiplier with the minimum based on 30dph and maximum at 40dph. Potentially contaminated land within the site from former use as a brickworks and due to landfilling within part of the site.. ""Potential for housing and apartments.""",1e676ab6544457f0c926c787f10159e952c78c3be221eb5cd94cc005791042c4
2017-12-31,local-authority-eng:HAL,H1085,"Paramount Foods, Halton Road, Runcorn",http://map.halton.gov.uk/WebMapLayers8External/map.aspx?MapName=Linked&overlayname=Brownfield%20Register&schemacolumn=Ref&resolution=1&UID=H1085,yes,not owned by a public authority,permissioned,outline planning permission,,53.33875,-2.715237,3.71,53,118,2017-12-31,,"Potential capacity based on a density multiplier with the minimum based on the planning permission for part of the site and the maximum at 40dph across the site. Physical constraints identified include potentially contaminated land.. ""Outline application for part of the site, with all matters reserved, for demolition of existing buildings and erection of up to 53 dwellings with associated access, landscaping and ancillary works at Former Warehouse Halton Court"". http://map.halton.gov.uk/WebMapLayers8External/map.aspx?MapName=Planning&overlayname=All&schemacolumn=REFVAL&UID=10/00397/OUT&resolution=1&initialDialog=layersDialog",1e676ab6544457f0c926c787f10159e952c78c3be221eb5cd94cc005791042c4
2017-12-31,local-authority-eng:HAL,H1104,"Former Polar Ford and surrounds, Victoria Road, Runcorn",http://map.halton.gov.uk/WebMapLayers8External/map.aspx?MapName=Linked&overlayname=Brownfield%20Register&schemacolumn=Ref&resolution=1&UID=H1104,yes,not owned by a public authority,not permissioned,,,53.340457,-2.725689,1.44,20,20,2017-12-31,,"Potential capacity reflects the available part of site. Physical constraints identified include potentially contaminated land.. ""Potential for housing and apartments.""",1e676ab6544457f0c926c787f10159e952c78c3be221eb5cd94cc005791042c4
2017-12-31,local-authority-eng:HAL,H1109,"East Lane House, East Lane, Runcorn",http://map.halton.gov.uk/WebMapLayers8External/map.aspx?MapName=Linked&overlayname=Brownfield%20Register&schemacolumn=Ref&resolution=1&UID=H1109,yes,not owned by a public authority,permissioned,other,,53.327094,-2.695043,1.14,30,448,2017-12-31,,"Potential capacity based on a density multiplier with the minimum based on 30dph and the maximum capacity based on the extant Prior Approval for the site. The site is currently developed but derelict.. ""Potential for demolition and new houses or apartments or potential for conversion of existing building in line with planning permission. Prior Approval (15/00034/P3JPA) - Proposed change of use from former office building (use class B1) to 448 no. self contained apartments comprising 54 1 bedroom flats and 394 studio flats."". http://map.halton.gov.uk/WebMapLayers8External/map.aspx?MapName=Planning&overlayname=All&schemacolumn=REFVAL&UID=15/00034/P3JPA&resolution=1&initialDialog=layersDialog",1e676ab6544457f0c926c787f10159e952c78c3be221eb5cd94cc005791042c4
2017-12-31,local-authority-eng:HAL,H1118,"Brosley House, Widnes Road, Widnes",http://map.halton.gov.uk/WebMapLayers8External/map.aspx?MapName=Linked&overlayname=Brownfield%20Register&schemacolumn=Ref&resolution=1&UID=H1118,yes,not owned by a public authority,not permissioned,,,53.364326,-2.730964,0.33,9,16,2017-12-31,,"Potential capacity based on a density multiplier with the minimum based on 30dph and maximum at 50dph. Site is developed. No other known constraints on the site.. ""Potential for houses and / or apartments""",1e676ab6544457f0c926c787f10159e952c78c3be221eb5cd94cc005791042c4
2018-10-26,local-authority-eng:HAL,H1120,"The Foundry, Lugsdale Road, Widnes",http://map.halton.gov.uk/WebMapLayers8External/map.aspx?MapName=Linked&overlayname=Brownfield%20Register&schemacolumn=Ref&resolution=1&UID=H1120,,not owned by a public authority,not permissioned,,,53.363545,-2.726502,0.39,11,15,2017-12-31,,"Potential capacity based on a density multiplier with the minimum based on 30dph and maximum at 40dph. Potentially contaminated land within the site.. ""Potential for houses""",1e676ab6544457f0c926c787f10159e952c78c3be221eb5cd94cc005791042c4
2017-12-31,local-authority-eng:HAL,H1155,"Former Polar Ford Second Hand Cars Site, Victoria Road, Runcorn",http://map.halton.gov.uk/WebMapLayers8External/map.aspx?MapName=Linked&overlayname=Brownfield%20Register&schemacolumn=Ref&resolution=1&UID=H1155,yes,not owned by a public authority,not permissioned,,,53.340005,-2.724735,0.37,11,18,2017-12-31,,"Potential capacity based on a density multiplier with the minimum based on 30dph and maximum at 50dph. Potentially contaminated land within the site.. ""Potential for houses on this site""",1e676ab6544457f0c926c787f10159e952c78c3be221eb5cd94cc005791042c4
2017-12-31,local-authority-eng:HAL,H1159,"Former Express Dairies Site, Sewell Street, Runcorn",http://map.halton.gov.uk/WebMapLayers8External/map.aspx?MapName=Linked&overlayname=Brownfield%20Register&schemacolumn=Ref&resolution=1&UID=H1159,yes,not owned by a public authority,not permissioned,,,53.339891,-2.722781,0.66,17,81,2017-12-31,,"Potential capacity based on a density multiplier with the minimum based on 30dph and maximum based on SHLAA capacity. Lapsed planning permission 11/00018/FUL granted 12/12/2012.. ""Potential for houses and / or apartments"". http://map.halton.gov.uk/WebMapLayers8External/map.aspx?MapName=Planning&overlayname=All&schemacolumn=REFVAL&UID=11/00018/FUL&resolution=1&initialDialog=layersDialog",1e676ab6544457f0c926c787f10159e952c78c3be221eb5cd94cc005791042c4
2017-12-31,local-authority-eng:HAL,H1177,"Site of former Rathbone Institute, Waterloo Road, Runcorn",http://map.halton.gov.uk/WebMapLayers8External/map.aspx?MapName=Linked&overlayname=Brownfield%20Register&schemacolumn=Ref&resolution=1&UID=H1177,yes,mixed ownership,not permissioned,,,53.342284,-2.737075,0.65,17,29,2017-12-31,,"Potential capacity based on a density multiplier with the minimum based on 30dph and maximum at 50dph. Physical constraints identified include heritage assets and PADHI pipelines. 13/00429/DEM - permission for demolition of building, now demolished.. ""Potential for houses and / or apartments""",1e676ab6544457f0c926c787f10159e952c78c3be221eb5cd94cc005791042c4
2017-12-31,local-authority-eng:HAL,H1195,"Former Eternit, Derby Road, Widnes",http://map.halton.gov.uk/WebMapLayers8External/map.aspx?MapName=Linked&overlayname=Brownfield%20Register&schemacolumn=Ref&resolution=1&UID=H1195,yes,not owned by a public authority,permissioned,full planning permission,,53.382969,-2.720699,5.24,110,116,2017-12-31,,"Potential capacity based on a density multiplier with the minimum based on 30dph and maximum based on the extant Planning Permission. Potentially contaminated land identified on this site. Site now Under Construction for Housing.. ""Proposed residential development comprising 116 no. dwellings, road, open space, substation and all associated works"". http://map.halton.gov.uk/WebMapLayers8External/map.aspx?MapName=Planning&overlayname=All&schemacolumn=REFVAL&UID=15/00430/FUL&resolution=1&initialDialog=layersDialog",1e676ab6544457f0c926c787f10159e952c78c3be221eb5cd94cc005791042c4
2018-10-26,local-authority-eng:HAL,H1201,"Castle View House, East Lane, Runcorn",http://map.halton.gov.uk/WebMapLayers8External/map.aspx?MapName=Linked&overlayname=Brownfield%20Register&schemacolumn=Ref&resolution=1&UID=H1201,yes,not owned by a public authority,permissioned,other,,53.327835,-2.694365,1.53,54,248,2017-12-31,,"Potential capacity based on a density multiplier with the minimum based on 30dph and maximum based on the extant Prior Approval. Physical constraints identified include trees and woodland. Prior approval for 248 dwellings (17/00375/P3JPA), Site now under construction.. ""Proposed change of use from office building to 248 residential units"". http://map.halton.gov.uk/WebMapLayers8External/map.aspx?MapName=Planning&overlayname=All&schemacolumn=REFVAL&UID=17/00209/P3JPA&resolution=1&initialDialog=layersDialog",1e676ab6544457f0c926c787f10159e952c78c3be221eb5cd94cc005791042c4
2018-10-26,local-authority-eng:HAL,H1237,"Widnes Films Ltd., Warrington Road",http://map.halton.gov.uk/WebMapLayers8External/map.aspx?MapName=Linked&overlayname=Brownfield%20Register&schemacolumn=Ref&resolution=1&UID=H1237,yes,not owned by a public authority,permissioned,full planning permission,,53.367542,-2.715104,1.76,47,69,2018-10-26,,"Potential capacity based on a density multiplier with the minimum based on 30dph and maximum based on the extant Planning Application.. ""Proposed development of 118 dwellings (including affordable housing). Site H1343 forms the remainder of this application.""",1e676ab6544457f0c926c787f10159e952c78c3be221eb5cd94cc005791042c4
2017-12-31,local-authority-eng:HAL,H1275,"RMC House, Terrace Road, West Bank, Widnes",http://map.halton.gov.uk/WebMapLayers8External/map.aspx?MapName=Linked&overlayname=Brownfield%20Register&schemacolumn=Ref&resolution=1&UID=H1275,yes,not owned by a public authority,permissioned,full planning permission,,53.349625,-2.731749,0.51,13,92,2017-12-31,,"Potential capacity based on a density multiplier with the minimum based on 30dph and maximum in line with planning permission. Contamination and heritage constraints have been identified.. ""Proposed development comprising 92 no. one and two bedroom apartments for the over 55's spread over 2 no. 6 storey blocks"". http://map.halton.gov.uk/WebMapLayers8External/map.aspx?MapName=Planning&overlayname=All&schemacolumn=REFVAL&UID=15/00392/FUL&resolution=1&initialDialog=layersDialog",1e676ab6544457f0c926c787f10159e952c78c3be221eb5cd94cc005791042c4
2017-12-31,local-authority-eng:HAL,H1277,"The Deck, Mersey Road, Runcorn",http://map.halton.gov.uk/WebMapLayers8External/map.aspx?MapName=Linked&overlayname=Brownfield%20Register&schemacolumn=Ref&resolution=1&UID=H1277,yes,not owned by a public authority,permissioned,reserved matters approval,,53.343546,-2.729241,2.36,27,178,2017-12-31,,"Site under construction, with 6 of the 10 apartment buildings completed. Site could still accommodate the remaining 4 buildings. Potential capacity based on a density multiplier with the minimum based on 30dph on the land remaining and maximum  based on the 178 dwellings remaining on extant planning permission.. ""Proposed residential development consisting of 10 no. apartment blocks ranging between 5 & 6 storeys (466 no. apartments) and 3 no. retail/ leisure units with associated road layout, car parking and landscaping. Permission granted 2005 - site partially built part still extant."". http://map.halton.gov.uk/WebMapLayers8External/map.aspx?MapName=Planning&overlayname=All&schemacolumn=REFVAL&UID=05/00590/REM&resolution=1&initialDialog=layersDialog",1e676ab6544457f0c926c787f10159e952c78c3be221eb5cd94cc005791042c4
2017-12-31,local-authority-eng:HAL,H1280,"Land Opposite Motherwell Close, Lanark Gardens, Widnes",http://map.halton.gov.uk/WebMapLayers8External/map.aspx?MapName=Linked&overlayname=Brownfield%20Register&schemacolumn=Ref&resolution=1&UID=H1280,,not owned by a public authority,not permissioned,,,53.381157,-2.747804,0.34,10,10,2017-12-31,,"Potential capacity based on a density multiplier of 30dph. Current permission for a medical centre. Previous permission now lapsed (11/00197/FUL) for 12 dwellings.. ""Potential for residential development, if currently proposed medical centre is not built.""",1e676ab6544457f0c926c787f10159e952c78c3be221eb5cd94cc005791042c4
2018-10-26,local-authority-eng:HAL,H1288,"Land at 79-83 High Street, Runcorn Old Town",http://map.halton.gov.uk/WebMapLayers8External/map.aspx?MapName=Linked&overlayname=Brownfield%20Register&schemacolumn=Ref&resolution=1&UID=H1288,,not owned by a public authority,not permissioned,,,53.340972,-2.735506,0.88,23,31,2018-10-26,,"Potential capacity based on a density multiplier with the minimum based on 30dph and maximum based of 40dph in line with nearby town centre.. ""Potential for houses and / or apartments""",1e676ab6544457f0c926c787f10159e952c78c3be221eb5cd94cc005791042c4
2017-12-31,local-authority-eng:HAL,H1303,"Land to the east of Kestrel's Way, Hallwood Park, Runcorn",http://map.halton.gov.uk/WebMapLayers8External/map.aspx?MapName=Linked&overlayname=Brownfield%20Register&schemacolumn=Ref&resolution=1&UID=H1303,,not owned by a public authority,not permissioned,,,53.324737,-2.698308,1.61,29,35,2017-12-31,,"Potential capacity based on a density multiplier with the minimum based on retention of part of the woodland area and a maximum based on 30dph across the site. Yield affected by woodland and open space.. ""Potential for residential development in line with surrounding Hallwood Park residential area.""",1e676ab6544457f0c926c787f10159e952c78c3be221eb5cd94cc005791042c4
2018-10-26,local-authority-eng:HAL,H1336,"Land Adjacent to St. Helens Canal (Routledge Site), Tanhouse Lane",http://map.halton.gov.uk/WebMapLayers8External/map.aspx?MapName=Linked&overlayname=Brownfield%20Register&schemacolumn=Ref&resolution=1&UID=H1336,yes,not owned by a public authority,permissioned,outline planning permission,,53.361292,-2.717027,7.56,211,230,2018-10-26,,"Potential capacity based on a density multiplier with the minimum based on 40dph and maximum based on the PREAPP Application. The site has potential contamination due to past works.. ""Outline 05/00057/OUTEIA 624 Residential units. PREAPP - Proposed residential development for c230 dwellings - Pending now a Full Application submission""",1e676ab6544457f0c926c787f10159e952c78c3be221eb5cd94cc005791042c4
2017-12-31,local-authority-eng:HAL,H1343,"Walmsley Street Site, Widnes",http://map.halton.gov.uk/WebMapLayers8External/map.aspx?MapName=Linked&overlayname=Brownfield%20Register&schemacolumn=Ref&resolution=1&UID=H1343,yes,not owned by a public authority,permissioned,full planning permission,,53.367438,-2.717341,1.12,30,49,2017-12-31,,"Potential capacity based on a density multiplier with the minimum based on 30dph and maximum in line with planning permission. Constraints identified include potentially contaminated land.. ""Proposed development of 118 dwellings (including affordable housing) of which 49 dwellings relate to this site. Site H1237 forms the remainder of this application (69 dwellings)""",1e676ab6544457f0c926c787f10159e952c78c3be221eb5cd94cc005791042c4
2018-10-26,local-authority-eng:HAL,H1345,Land at Derby Road and Mill Lane Junction Roundabout,http://map.halton.gov.uk/WebMapLayers8External/map.aspx?MapName=Linked&overlayname=Brownfield%20Register&schemacolumn=Ref&resolution=1&UID=H1345,,not owned by a public authority,not permissioned,,,53.386827,-2.715923,0.97,26,34,2018-10-26,,"Potential capacity based on a density multiplier with the minimum based on 30dph and maximum based of 40dph. Issues regarding the contamination of the land would need to be mitigated as necessary. Vacant (Demolished Chemical Works).. ""Potential for houses and / or apartments""",1e676ab6544457f0c926c787f10159e952c78c3be221eb5cd94cc005791042c4
2018-10-26,local-authority-eng:HAL,H1347,"Part of Former Fairfield school site, Peel House Lane, Widnes",http://map.halton.gov.uk/WebMapLayers8External/map.aspx?MapName=Linked&overlayname=Brownfield%20Register&schemacolumn=Ref&resolution=1&UID=H1347,yes,mixed ownership,not permissioned,,,53.379646,-2.723154,0.4,10,14,2017-12-31,,"Potential capacity based on a density multiplier with the minimum based on 30dph and maximum at 40dph. The site does not currently contain any physical constraints of note.. ""Potential for residential development, in line with new development adjacent.""",1e676ab6544457f0c926c787f10159e952c78c3be221eb5cd94cc005791042c4
2018-10-26,local-authority-eng:HAL,H1622,"Car Park between High Street and Bridgewater Canal, Runcorn",http://map.halton.gov.uk/WebMapLayers8External/map.aspx?MapName=Linked&overlayname=Brownfield%20Register&schemacolumn=Ref&resolution=1&UID=H1622,,owned by a public authority,not permissioned,,,53.340869,-2.733266,0.39,11,19,2017-12-31,,"Potential capacity based on a density multiplier with the minimum based on 30dph and maximum at 50dph.. ""Potential for residential development to support Runcorn Old Town and to make most of waterfront location.""",1e676ab6544457f0c926c787f10159e952c78c3be221eb5cd94cc005791042c4
2018-10-26,local-authority-eng:HAL,H1635,"Greenoaks Farm Industrial Estate, Warrington Road, Widnes",http://map.halton.gov.uk/WebMapLayers8External/map.aspx?MapName=Linked&overlayname=Brownfield%20Register&schemacolumn=Ref&resolution=1&UID=H1635,,not owned by a public authority,not permissioned,,,53.368467,-2.716652,0.3,12,15,2017-12-31,,"Potential capacity based on a density multiplier with the minimum based on 40dph and maximum based on 50dph. Current permission now lapsed, still has potential for residential development.. ""Potential for residential development even though current application has now lapsed."". http://map.halton.gov.uk/WebMapLayers8External/map.aspx?MapName=Planning&overlayname=All&schemacolumn=REFVAL&UID=14/00269/S73&resolution=1&initialDialog=layersDialog",1e676ab6544457f0c926c787f10159e952c78c3be221eb5cd94cc005791042c4
2017-12-31,local-authority-eng:HAL,H1714,"The Heath Offices, Heath Road South, Runcorn",http://map.halton.gov.uk/WebMapLayers8External/map.aspx?MapName=Linked&overlayname=Brownfield%20Register&schemacolumn=Ref&resolution=1&UID=H1714,yes,not owned by a public authority,not permissioned,,,53.326005,-2.734182,1.74,46,62,2017-12-31,,"Potential capacity based on a density multiplier with the minimum based on 30dph and maximum at 40dph.. ""Potential for residential development, appropriate landscaping would be required to existing employment development and to retain amenity of adjacent residential properties.""",1e676ab6544457f0c926c787f10159e952c78c3be221eb5cd94cc005791042c4
2017-12-31,local-authority-eng:HAL,H1733,"Land at The Heath Business Park, Heath Road South, Runcorn",http://map.halton.gov.uk/WebMapLayers8External/map.aspx?MapName=Linked&overlayname=Brownfield%20Register&schemacolumn=Ref&resolution=1&UID=H1733,yes,not owned by a public authority,permissioned,outline planning permission,,53.323554,-2.736632,4.26,53,53,2017-12-31,,"Dwelling figures to reflect planning permission. Development in the area will be limited due to its location within the inner zone of a PADHI.. ""Outline planning application (with all matters reserved) for construction of up to 53 residential dwellings."". http://map.halton.gov.uk/WebMapLayers8External/map.aspx?MapName=Planning&overlayname=All&schemacolumn=REFVAL&UID=12/00100/OUT&resolution=1&initialDialog=layersDialog",1e676ab6544457f0c926c787f10159e952c78c3be221eb5cd94cc005791042c4
2018-10-26,local-authority-eng:HAL,H1784,"The Old Bridgewater Centre, Castlefields Avenue North, Runcorn",http://map.halton.gov.uk/WebMapLayers8External/map.aspx?MapName=Linked&overlayname=Brownfield%20Register&schemacolumn=Ref&resolution=1&UID=H1784,yes,not owned by a public authority,permissioned,full planning permission,,53.341094,-2.692612,0.36,20,20,2017-12-31,,"Site Completed. Dwelling figures reflect planning permission.. ""Proposed demolition of existing building and construction of 20 no. dwellings comprising 10 no. houses and 10 no. apartments."". http://map.halton.gov.uk/WebMapLayers8External/map.aspx?MapName=Planning&overlayname=All&schemacolumn=REFVAL&UID=15/00267/FUL&resolution=1&initialDialog=layersDialog",1e676ab6544457f0c926c787f10159e952c78c3be221eb5cd94cc005791042c4
2017-12-31,local-authority-eng:HAL,H1808,"Land to the rear of Gaunts Way, Hallwood Park, Runcorn",http://map.halton.gov.uk/WebMapLayers8External/map.aspx?MapName=Linked&overlayname=Brownfield%20Register&schemacolumn=Ref&resolution=1&UID=H1808,,mixed ownership,not permissioned,,,53.322801,-2.704987,1.88,49,65,2017-12-31,,"Potential capacity based on a density multiplier with the minimum based on 30dph and maximum at 40dph.. ""Potential for residential development in line with surrounding Hallwood Park residential area, would need to retain amenity of existing properties.""",1e676ab6544457f0c926c787f10159e952c78c3be221eb5cd94cc005791042c4
2018-10-26,local-authority-eng:HAL,H1839,"Land At Rose View Avenue, Widnes",http://map.halton.gov.uk/WebMapLayers8External/map.aspx?MapName=Linked&overlayname=Brownfield%20Register&schemacolumn=Ref&resolution=1&UID=H1839,yes,not owned by a public authority,permissioned,reserved matters approval,,53.375867,-2.732665,0.29,4,4,2017-12-31,,"Site Completed. 16/00282/REM - of 4 no. detached dwellings.. ""Application for approval of reserved matters on Planning Permission 13/00285/OUT for access, appearance, landscaping, layout and scale for erection of 4 no. detached dwellings"". http://map.halton.gov.uk/WebMapLayers8External/map.aspx?MapName=Planning&overlayname=All&schemacolumn=REFVAL&UID=16/00282/REM&resolution=1&initialDialog=layersDialog",1e676ab6544457f0c926c787f10159e952c78c3be221eb5cd94cc005791042c4
2017-12-31,local-authority-eng:HAL,H1962,"Fomer Riverside College, Campus Drive, Runcorn",http://map.halton.gov.uk/WebMapLayers8External/map.aspx?MapName=Linked&overlayname=Brownfield%20Register&schemacolumn=Ref&resolution=1&UID=H1962,yes,not owned by a public authority,permissioned,outline planning permission,,53.341666,-2.7454,4,120,128,2017-12-31,,"Potential capacity based on a density multiplier with the minimum based on planning application and maximum at 40dph. Physical constraints identified include potentially contaminated land (99%); the proximity to a Listed Building; the existing development on the site; the wooded area; and landfill (Canal basin).. ""Outline application, with all matters reserved, for development of up to 120 dwellings, open space, infrastructure and associated works."". http://map.halton.gov.uk/WebMapLayers8External/map.aspx?MapName=Planning&overlayname=All&schemacolumn=REFVAL&UID=16/00131/OUT&resolution=1&initialDialog=layersDialog",1e676ab6544457f0c926c787f10159e952c78c3be221eb5cd94cc005791042c4
2018-10-26,local-authority-eng:HAL,H2001,"Former Jolly Brewer, The Ridgeway, Runcorn",http://map.halton.gov.uk/WebMapLayers8External/map.aspx?MapName=Linked&overlayname=Brownfield%20Register&schemacolumn=Ref&resolution=1&UID=H2001,yes,not owned by a public authority,permissioned,full planning permission,,53.323766,-2.665368,0.46,18,18,2017-12-31,,"Site Under Construction. 14/00563/FUL. ""Proposed construction of 18 dwellings comprising 10 no. two bedroom flats and 8 no. two bedroom houses with associated infrastructure and landscaping."". http://map.halton.gov.uk/WebMapLayers8External/map.aspx?MapName=Planning&overlayname=All&schemacolumn=REFVAL&UID=14/00563/FUL&resolution=1&initialDialog=layersDialog",1e676ab6544457f0c926c787f10159e952c78c3be221eb5cd94cc005791042c4
2017-12-31,local-authority-eng:HAL,H2026,"Grosvenor House, Northway, Runcorn",http://map.halton.gov.uk/WebMapLayers8External/map.aspx?MapName=Linked&overlayname=Brownfield%20Register&schemacolumn=Ref&resolution=1&UID=H2026,yes,not owned by a public authority,permissioned,other,,53.328892,-2.696394,2.32,18,63,2017-12-31,,"Potential capacity based on a density multiplier with the minimum based on 40dph and maximum based on Prior Approval. Existing development on site.. ""Proposed change of use from former office building to residential (use class C3), creating 63 dwellings comprising of 2 No. 1 bedroom apartments, 55 No. 2 bedroom apartments and 6 No. 3 bedroom apartments."". http://map.halton.gov.uk/WebMapLayers8External/map.aspx?MapName=Planning&overlayname=All&schemacolumn=REFVAL&UID=15/00155/P3JPA&resolution=1&initialDialog=layersDialog",1e676ab6544457f0c926c787f10159e952c78c3be221eb5cd94cc005791042c4
