entry-date,organisation,site,site-address,site-plan-url,deliverable,ownership,planning-permission-status,planning-permission-type,hazardous-substances,latitude,longitude,hectares,minimum-net-dwellings,maximum-net-dwellings,start-date,end-date,notes,resource
2019-12-17,national-park-authority:Q72617669,BR-001,"Former Primary School, Claver Close, Swainby",http://www.northyorkmoors.org.uk/planning/framework/brownfield-land-register/brownfield-land-register-map?inspect_query=brno&inspect_value=BR-001&show_viewfinder=true,yes,not owned by a public authority,not permissioned,,,54.409096,-1.264784,0.49,,,2017-12-14,,"The Local Plan for the North York Moors National Park Authority was at Examination in November 2019 and is expected to be adopted early 2020. When adopted the Local Plan will supersede the policies in the LDF referred to in the ‘Development Description’ column . Any planning applications for the sites on the Register will be assessed in accordance with the prevailing policies at that time.
Former Primary School, Swainby, (no relevant planning history). 8 to 10 affordable dwellings in total, 2 or 3 bedroomed dwellings as an exceptions site (Core policy K of the LDF) with road frontages on to Claver Close and an area of open space in the southern area of the site to maintain the open character of the site.",2f47e9072a8b5af86323d2e6af463b897189e27d1939ebf767e07929aa5e1993
2019-12-17,national-park-authority:Q72617669,BR-002,"Former British Legion Club, High Street, Hinderwell",http://www.northyorkmoors.org.uk/planning/framework/brownfield-land-register/brownfield-land-register-map?inspect_query=brno&inspect_value=BR-002&show_viewfinder=true,,,not permissioned,,,54.534216,-0.776159,0.4,,,2017-12-14,,"The Local Plan for the North York Moors National Park Authority was at Examination in November 2019 and is expected to be adopted early 2020. When adopted the Local Plan will supersede the policies in the LDF referred to in the ‘Development Description’ column . Any planning applications for the sites on the Register will be assessed in accordance with the prevailing policies at that time.
Land between Station Road and Coronation Avenue, Hinderwell, (previous outline planning consent for residential development, 8 dwellings). 8 affordable dwellings in total, 2 and 3 bedroomed dwellings as an exceptions site (Core policy K of the LDF) with highway access from A174 only.",2f47e9072a8b5af86323d2e6af463b897189e27d1939ebf767e07929aa5e1993
2019-12-17,national-park-authority:Q72617669,BR-003,"Former NYCC Depot, West Ayton",http://www.northyorkmoors.org.uk/planning/framework/brownfield-land-register/brownfield-land-register-map?inspect_query=brno&inspect_value=BR-003&show_viewfinder=true,yes,owned by a public authority,not permissioned,,,54.245064,-0.490664,0.72,,,2017-12-14,,"Part of site within Scarborough Borough Council. Since planning permission site within the Conservation Area. The Local Plan for the North York Moors National Park Authority was at Examination in November 2019 and is expected to be adopted early 2020. When adopted the Local Plan will supersede the policies in the LDF referred to in the ‘Development Description’ column . Any planning applications for the sites on the Register will be assessed in accordance with the prevailing policies at that time.
Former NYCC Depot, West Ayton (previous outline planning consent for open market housing development with planning brief.) Site straddles the National Park boundary and being split between the National Park and Scarborough Borough Council. 10 open market dwellings in total on the whole site, two and three bedroomed dwellings. 40% affordable housing requirement under Core policy J of the LDF. Development to take account of planning brief and more recent Conservation Area status. Development will require the retention of the Station House/office, platform and Goods Warehouse.",2f47e9072a8b5af86323d2e6af463b897189e27d1939ebf767e07929aa5e1993
2019-12-17,national-park-authority:Q72617669,BR-004,"Blue Bank Garage, Coach Road, Sleights",http://www.northyorkmoors.org.uk/planning/framework/brownfield-land-register/brownfield-land-register-map?inspect_query=brno&inspect_value=BR-004&show_viewfinder=true,yes,not owned by a public authority,permissioned,full planning permission,,54.44901,-0.665742,0.26,,,2018-11-29,,"The Local Plan for the North York Moors National Park Authority was at Examination in November 2019 and is expected to be adopted early 2020. When adopted the Local Plan will supersede the policies in the LDF referred to in the ‘Development Description’ column . Any planning applications for the sites on the Register will be assessed in accordance with the prevailing policies at that time.
Demolition of existing dwelling (No 171) and garage buildings and construction of 4 no dwellings with associated access, parking and landscaping works.",2f47e9072a8b5af86323d2e6af463b897189e27d1939ebf767e07929aa5e1993
