entry-date,organisation,site,site-address,site-plan-url,deliverable,ownership,planning-permission-status,planning-permission-type,hazardous-substances,latitude,longitude,hectares,minimum-net-dwellings,maximum-net-dwellings,start-date,end-date,notes,resource
2018-11-22,local-authority-eng:OLD,HLA1863,Land at Flint Street Derker,http://maps.oldham.gov.uk/WebMapLayers8/?x=394005.370244132&y=405944.26979495&resolution=0.2&MapName=Brownfield,,not owned by a public authority,not permissioned,,,53.550112,-2.091945,0.07,6,6,2017-12-22,,PA/334264/13; previously received planning permission for residential. Erection of 6 no dwellings,525f39c89244d18d060245336a883f8429b79f0e816177245ef6365e90b18c7b
2018-11-22,local-authority-eng:OLD,HLA2088,"Bailey Mill, Delph",http://maps.oldham.gov.uk/WebMapLayers8/?x=398575.502055683&y=407350.426378091&resolution=0.2&MapName=Brownfield,,not owned by a public authority,not permissioned,,,53.535126,-2.145506,0.86,50,50,2017-12-22,,Phase 1 housing allocation. H1.1.15 - Phase 1 allocation.,525f39c89244d18d060245336a883f8429b79f0e816177245ef6365e90b18c7b
2018-11-22,local-authority-eng:OLD,HLA2091(2),"Frenches Wharf, adjacent to Knoll Mill, Greenfield",http://maps.oldham.gov.uk/WebMapLayers8/?x=399408.372091666&y=404832.370720256&resolution=0.2&MapName=Brownfield,yes,not owned by a public authority,permissioned,full planning permission,,53.564656,-2.078592,0.59,26,26,2017-12-22,,PA/338869/16; Extant planning permission for residential. Erection of 26no. dwellings (use class: C3) and 369.44m (gross external) of commercial space (use class: A1/A2/A3/B1).,525f39c89244d18d060245336a883f8429b79f0e816177245ef6365e90b18c7b
2018-11-22,local-authority-eng:OLD,HLA2101,Land off Ripponden Road / Cornhill Street,http://maps.oldham.gov.uk/WebMapLayers8/?x=394540.013346063&y=406542.941735292&resolution=0.2&MapName=Brownfield,,not owned by a public authority,not permissioned,,,53.562784,-2.022976,0.22,14,14,2017-12-22,,"PA/054903/08; previously received planning permission for residential, development not commenced. Revised scheme for 5 houses and 9 flats on former garage plot",525f39c89244d18d060245336a883f8429b79f0e816177245ef6365e90b18c7b
2018-11-22,local-authority-eng:OLD,HLA2118,Estate St/Panmure St,http://maps.oldham.gov.uk/WebMapLayers8/?x=392754.344007672&y=403720.187240554&resolution=0.2&MapName=Brownfield,,owned by a public authority,not permissioned,,,53.506834,-2.169059,0.06,5,5,2017-12-22,,PA/040865/00; previously received planning permission for residential. Five dewellings in a terraced row,525f39c89244d18d060245336a883f8429b79f0e816177245ef6365e90b18c7b
2018-11-22,local-authority-eng:OLD,HLA2147,"Land off Wellyhole Street, Oldham",http://maps.oldham.gov.uk/WebMapLayers8/?x=394804.262751678&y=404770.268469688&resolution=0.2&MapName=Brownfield,,not owned by a public authority,not permissioned,,,53.540154,-2.010396,0.9,56,56,2017-12-22,,"PA/055366/08; previously received planning permission for residential, development not commenced. Revised scheme for 41 two and three storey terrace houses and 15 three storey 2 bed flats.",525f39c89244d18d060245336a883f8429b79f0e816177245ef6365e90b18c7b
2018-11-22,local-authority-eng:OLD,HLA2207,"Land adj., 306 Waterloo Street, Oldham, OL4 1ER (formely Land adj. 308, Waterloo St)",http://maps.oldham.gov.uk/WebMapLayers8/?x=393648.46908672&y=404297.095876788&resolution=0.2&MapName=Brownfield,,not owned by a public authority,not permissioned,,,53.555499,-2.083887,0.06,5,5,2017-12-22,,"PA/055303/08; previously received planning permission for residential, development not commenced. Erection of 5 no. dwellinghouses",525f39c89244d18d060245336a883f8429b79f0e816177245ef6365e90b18c7b
2018-11-22,local-authority-eng:OLD,HLA2234,"Land at Springhey Mill, Huddersfield Road",http://maps.oldham.gov.uk/WebMapLayers8/?x=394923.054752312&y=405892.94178121&resolution=0.2&MapName=Brownfield,,not owned by a public authority,not permissioned,,,53.523836,-2.097669,0.33,30,30,2017-12-22,,PA/047612/04; previously received planning permission for residential. Phase 1 housing allocation H1.1.21,525f39c89244d18d060245336a883f8429b79f0e816177245ef6365e90b18c7b
2018-11-22,local-authority-eng:OLD,HLA2338(1),"Land Fronting Rochdale Road, Royton. Site of C&A motors and stadium works.",http://maps.oldham.gov.uk/WebMapLayers8/?x=391797.001622603&y=408206.534356589&resolution=0.2&MapName=Brownfield,,not owned by a public authority,not permissioned,,,53.51909,-2.099463,0.55,22,22,2017-12-22,,Part of Phase 1 housing allocation. One of two remaining portions of the Sandy Mill housing land allocation (H1.1.24) without planning permission,525f39c89244d18d060245336a883f8429b79f0e816177245ef6365e90b18c7b
2018-11-22,local-authority-eng:OLD,HLA2351,"Pretoria Road, Oldham",http://maps.oldham.gov.uk/WebMapLayers8/?x=391498.201179307&y=403251.938194114&resolution=0.2&MapName=Brownfield,,not owned by a public authority,not permissioned,,,53.526587,-2.087044,0.46,14,14,2017-12-22,,Phase 1 housing allocation. H1.1.23 - Phase 1 housing allocation.,525f39c89244d18d060245336a883f8429b79f0e816177245ef6365e90b18c7b
2018-11-22,local-authority-eng:OLD,HLA2352,"Jowett Street, Oldham",http://maps.oldham.gov.uk/WebMapLayers8/?x=394406.22912436&y=406523.499331522&resolution=0.2&MapName=Brownfield,,not owned by a public authority,not permissioned,,,53.551414,-2.097015,0.66,26,26,2017-12-22,,Phase 1 housing allocation. H1.1.25 - Phase 1 housing allocation.,525f39c89244d18d060245336a883f8429b79f0e816177245ef6365e90b18c7b
2018-11-22,local-authority-eng:OLD,HLA2353,"Huddersfield Road/Dunkerley Street, Oldham",http://maps.oldham.gov.uk/WebMapLayers8/?x=394257.893670238&y=405541.887710594&resolution=0.2&MapName=Brownfield,,not owned by a public authority,not permissioned,,,53.550447,-2.098609,2.61,50,50,2017-12-22,,Phase 1 mixed use allocation including residential. M4 - Phase 1 mixed use allocation.,525f39c89244d18d060245336a883f8429b79f0e816177245ef6365e90b18c7b
2018-11-22,local-authority-eng:OLD,HLA2368,"Birshaw Farm, Oldham Rd, Shaw",http://maps.oldham.gov.uk/WebMapLayers8/?x=393832.118325058&y=408105.846192714&resolution=0.2&MapName=Brownfield,,not owned by a public authority,not permissioned,,,53.535302,-2.097298,0.6,5,5,2017-12-22,,PA/049096/05; previously received planning permission for residential. Change of use of barns to 5 no. dwellings and installation of biotec plant,525f39c89244d18d060245336a883f8429b79f0e816177245ef6365e90b18c7b
2018-11-22,local-authority-eng:OLD,HLA2377,"Bank Mill, Huxley Street, Oldham OL4 5JX",http://maps.oldham.gov.uk/WebMapLayers8/?x=394324.747313646&y=404583.215037872&resolution=0.2&MapName=Brownfield,,not owned by a public authority,not permissioned,,,53.521683,-2.106092,0.12,21,21,2017-12-22,,PA/049748/05; previously received planning permission for residential. Conversion of Mill into 21 dwellings. Conversion of Mill into 21 dwellings.,525f39c89244d18d060245336a883f8429b79f0e816177245ef6365e90b18c7b
2018-11-22,local-authority-eng:OLD,HLA2409,Land off Booth Hill Lane,http://maps.oldham.gov.uk/WebMapLayers8/?x=392341.349972266&y=406369.475323291&resolution=0.2&MapName=Brownfield,,not owned by a public authority,not permissioned,,,53.549661,-2.078094,0.42,17,17,2017-12-22,,PA/049768/05; previously received planning permission for residential. Outline application for residential development comprising 11 no. houses and apartment block,525f39c89244d18d060245336a883f8429b79f0e816177245ef6365e90b18c7b
2018-11-22,local-authority-eng:OLD,HLA2445,Corner of Gainsborough Avenue (Clydesdale Works),http://maps.oldham.gov.uk/WebMapLayers8/?x=392325.577982876&y=403581.680800938&resolution=0.2&MapName=Brownfield,,not owned by a public authority,not permissioned,,,53.576055,-2.093546,0.15,8,8,2017-12-22,,PA/050656/06; previously received planning permission for residential. Conversion of 1st floor existing warehouse into 8 apartments.,525f39c89244d18d060245336a883f8429b79f0e816177245ef6365e90b18c7b
2018-11-22,local-authority-eng:OLD,HLA2449,"Holden Fold Lane, Royton",http://maps.oldham.gov.uk/WebMapLayers8/?x=391439.161153472&y=406850.522218664&resolution=0.2&MapName=Brownfield,yes,not owned by a public authority,permissioned,outline planning permission,,53.570415,-2.125336,0.4,12,12,2017-12-22,,PA/338137/16; Extant outline planning permission for residential. Outline application for the proposed demolition of fire damaged warehouse and construction of 7 No. 3 bedroom dwellings including access and layout.,525f39c89244d18d060245336a883f8429b79f0e816177245ef6365e90b18c7b
2018-11-22,local-authority-eng:OLD,HLA2516,"Land at Hartshead Street, Lees. Oldham",http://maps.oldham.gov.uk/WebMapLayers8/?x=395551.281833968&y=404502.94247671&resolution=0.2&MapName=Brownfield,,not owned by a public authority,not permissioned,,,53.555323,-2.085906,0.04,9,9,2017-12-22,,PA/052249/06; previously received planning permission for residential. Apartment block to replace existing office building.  9 flats,525f39c89244d18d060245336a883f8429b79f0e816177245ef6365e90b18c7b
2018-11-22,local-authority-eng:OLD,HLA2650,"Byron Street Social Club, Byron Street, Hollinwood, Oldham, OL8 4QT",http://maps.oldham.gov.uk/WebMapLayers8/?x=390887.844604984&y=402932.528034551&resolution=0.2&MapName=Brownfield,,not owned by a public authority,not permissioned,,,53.546498,-2.088127,0.07,12,12,2017-12-22,,PA/051141/06; previously received planning permission for residential. Change of use of existing club premises to create 12 no apartments by refurbishment and extension of existing building including some demolition and retention of bowling green and associated ancillary facilities,525f39c89244d18d060245336a883f8429b79f0e816177245ef6365e90b18c7b
2018-11-22,local-authority-eng:OLD,HLA2659,"Land at North Werneth Zone 2, Land east of St Johns bounded by Alfred St, Featherstall Rd South and Porter St",http://maps.oldham.gov.uk/WebMapLayers8/?x=391425.211783706&y=404484.349424043&resolution=0.2&MapName=Brownfield,,owned by a public authority,not permissioned,,,53.569539,-2.094603,0.49,30,30,2017-12-22,,PA/051333/06; previously received planning permission for residential. Outline application for residential development and associated works.,525f39c89244d18d060245336a883f8429b79f0e816177245ef6365e90b18c7b
2018-11-22,local-authority-eng:OLD,HLA2661,"Land at North Werneth Zone 4, Land bounded by Suthers Street to the north, Edward Street to the south and the railway line to the west.",http://maps.oldham.gov.uk/WebMapLayers8/?x=391178.737794583&y=404650.927550263&resolution=0.2&MapName=Brownfield,,owned by a public authority,not permissioned,,,53.537882,-2.0871,1,62,62,2017-12-22,,PA/051333/06; previously received planning permission for residential. Outline application for residential development and associated works.,525f39c89244d18d060245336a883f8429b79f0e816177245ef6365e90b18c7b
2018-11-22,local-authority-eng:OLD,HLA2662,"Land at North Werneth Zone 5, Land bounded by Hartford Mill to the west, Edward Street to the north, and Milne Street to the east",http://maps.oldham.gov.uk/WebMapLayers8/?x=391179.810106815&y=404477.774390604&resolution=0.2&MapName=Brownfield,,mixed ownership,not permissioned,,,53.529923,-2.127015,1.39,72,72,2017-12-22,,PA/051333/06; previously received planning permission for residential. Outline application for residential development and associated works.,525f39c89244d18d060245336a883f8429b79f0e816177245ef6365e90b18c7b
2018-11-22,local-authority-eng:OLD,HLA2663,"Land at North Werneth Zone 6 (Hartford Mill, Edward St)",http://maps.oldham.gov.uk/WebMapLayers8/?x=391089.211252789&y=404560.307013537&resolution=0.2&MapName=Brownfield,,mixed ownership,not permissioned,,,53.553911,-2.11707,2.7,158,158,2017-12-22,,PA/051332/06; previously received planning permission for residential. Change of use from industry to residential accomodation and associated works,525f39c89244d18d060245336a883f8429b79f0e816177245ef6365e90b18c7b
2018-11-22,local-authority-eng:OLD,HLA2664,"Land at Derker (Abbotsford Road Site), Abbotsford Road/Vulcan Street, Derker, Oldham",http://maps.oldham.gov.uk/WebMapLayers8/?x=393884.543490059&y=406153.447115866&resolution=0.2&MapName=Brownfield,,mixed ownership,not permissioned,,,53.528854,-2.11724,1.18,65,65,2017-12-22,,PA/051328/06; outline application approved then quashed in High Court. Outline application for residential development and associated facilities.,525f39c89244d18d060245336a883f8429b79f0e816177245ef6365e90b18c7b
2018-11-22,local-authority-eng:OLD,HLA2771,"Land off Royley, Royton (former garage court)",http://maps.oldham.gov.uk/WebMapLayers8/?x=391300.09401564&y=407238.917460159&resolution=0.2&MapName=Brownfield,,not owned by a public authority,pending decision,,,53.558221,-2.130702,0.29,20,20,2017-12-22,,PA/053258/07; previously received planning permission for residential - new application PA/340555/17 pending decision. 1) Erection of 12 No. dwellings constructed in either a semi-detached or detached form 2) Erection of  a 4 storey apartment block equalling a total of 20 units.,525f39c89244d18d060245336a883f8429b79f0e816177245ef6365e90b18c7b
2018-11-22,local-authority-eng:OLD,HLA2785,"Thornham Mill, Oozewood Road, Royton, OL2 5SJ",http://maps.oldham.gov.uk/WebMapLayers8/?x=391471.471145226&y=408581.244203677&resolution=0.2&MapName=Brownfield,,not owned by a public authority,not permissioned,,,53.550084,-2.11788,0.42,71,71,2017-12-22,,PA/052296/06; previously received planning permission for residential. Residential development of two to five storey building to provide 71 apartments with car parking.,525f39c89244d18d060245336a883f8429b79f0e816177245ef6365e90b18c7b
2018-11-22,local-authority-eng:OLD,HLA2796,"169 Union Street, Oldham",http://maps.oldham.gov.uk/WebMapLayers8/?x=393087.592460413&y=405024.646933027&resolution=0.2&MapName=Brownfield,,not owned by a public authority,not permissioned,,,53.537173,-2.068592,0.03,30,30,2017-12-22,,PA/053332/07; previously received planning permission for residential. Demolition of existing building and replacement with 9 storey apartment block with retail units at ground floor level.,525f39c89244d18d060245336a883f8429b79f0e816177245ef6365e90b18c7b
2018-11-22,local-authority-eng:OLD,HLA2821,"Corner of Edge Lane Street/High Barn Street, Royton",http://maps.oldham.gov.uk/WebMapLayers8/?x=392230.728530837&y=407705.890892587&resolution=0.2&MapName=Brownfield,,not owned by a public authority,not permissioned,,,53.542801,-2.09993,0.8,63,63,2017-12-22,,PA/052622/07; application finally disposed of - status reverted to potential site. Proposal for 63 dwellings and 6 office units.,525f39c89244d18d060245336a883f8429b79f0e816177245ef6365e90b18c7b
2018-11-22,local-authority-eng:OLD,HLA2831,"53-55 King Street (formerly Riley Snooker Club and Megson and Ponsonby Solicitors), Oldham, OL8 1EU",http://maps.oldham.gov.uk/WebMapLayers8/?x=392409.293656913&y=404724.407632079&resolution=0.2&MapName=Brownfield,,not owned by a public authority,not permissioned,,,53.522996,-2.13891,0.15,126,126,2017-12-22,,PA/053985/07; previously received planning permission for residential. Mixed use development rising from six to fifteen storeys and comprising of basement car park; ground floor retail; office space; and 126 no.residential apartments.,525f39c89244d18d060245336a883f8429b79f0e816177245ef6365e90b18c7b
2018-11-22,local-authority-eng:OLD,HLA2835,"Land at Dunbar Street, Oldham",http://maps.oldham.gov.uk/WebMapLayers8/?x=392039.340799076&y=405654.163883971&resolution=0.2&MapName=Brownfield,yes,not owned by a public authority,permissioned,outline planning permission,,53.536953,-2.130847,0.1,8,8,2017-12-22,,PA/336682/15; Extant outline planning permission for residential. Erection of 8 no. 4 bedroomed dwellings with associated car parking.,525f39c89244d18d060245336a883f8429b79f0e816177245ef6365e90b18c7b
2018-11-22,local-authority-eng:OLD,HLA2836,"Shaw Band Club, Dale Street, Shaw, OL2 8RN",http://maps.oldham.gov.uk/WebMapLayers8/?x=393823.730948833&y=408673.264060686&resolution=0.2&MapName=Brownfield,,not owned by a public authority,not permissioned,,,53.538446,-2.13457,0.09,10,10,2017-12-22,,PA/053784/07; previously received planning permission for residential. Conversion of existing building into 10 no. flats.,525f39c89244d18d060245336a883f8429b79f0e816177245ef6365e90b18c7b
2018-11-22,local-authority-eng:OLD,HLA2840,"Corporation Depot, Andrew Street, Chadderton, OL9 0JN",http://maps.oldham.gov.uk/WebMapLayers8/?x=390590.617143859&y=405533.225112876&resolution=0.2&MapName=Brownfield,,not owned by a public authority,not permissioned,,,53.53689,-2.134549,0.1,6,6,2017-12-22,,PA/053860/07; previously received planning permission for residential. Outline application for the development of six residential properties with associated parking.,525f39c89244d18d060245336a883f8429b79f0e816177245ef6365e90b18c7b
2018-11-22,local-authority-eng:OLD,HLA2842,"Land off Hale Lane/Hughes Close, Failsworth, Manchester",http://maps.oldham.gov.uk/WebMapLayers8/?x=389375.91473022&y=401725.115299749&resolution=0.2&MapName=Brownfield,,not owned by a public authority,not permissioned,,,53.53763,-2.135919,0.42,18,18,2017-12-22,,"PA/337710/15; S106 not agreed, decision not dispatched. Erection of 18 no. new dwellings and associated external works:",525f39c89244d18d060245336a883f8429b79f0e816177245ef6365e90b18c7b
2018-11-22,local-authority-eng:OLD,HLA2856,"Former Territorial Army Centre, Rifle Street",http://maps.oldham.gov.uk/WebMapLayers8/?x=392586.485362213&y=405564.80738092&resolution=0.2&MapName=Brownfield,,not owned by a public authority,not permissioned,,,53.535012,-2.082965,0.4,30,30,2017-12-22,,PA/053576/07; application finally disposed of - status reverted to potential site,525f39c89244d18d060245336a883f8429b79f0e816177245ef6365e90b18c7b
2018-11-22,local-authority-eng:OLD,HLA2872,"The Smithy, 1053-1055 Ashton Road, Bardsley, Oldham",http://maps.oldham.gov.uk/WebMapLayers8/?x=393024.885945619&y=401400.439592096&resolution=0.2&MapName=Brownfield,,not owned by a public authority,not permissioned,,,53.551991,-2.093773,0.2,10,10,2017-12-22,,PA/059469/11; previously received planning permission for residential. Demolition of existing building and erection of 10 no. dwelling houses,525f39c89244d18d060245336a883f8429b79f0e816177245ef6365e90b18c7b
2018-11-22,local-authority-eng:OLD,HLA2893,"Land adj to Westlands Cottage Day Nursery, Springbank Street, Werneth OL8 4LH",http://maps.oldham.gov.uk/WebMapLayers8/?x=391259.513267919&y=403656.542101084&resolution=0.2&MapName=Brownfield,,not owned by a public authority,not permissioned,,,53.56171,-2.132812,0.07,5,5,2017-12-22,,PA/055153/08; previously received planning permission for residential. Part demolition of day nursery and redevelopment of site for 5. no. dwellings.,525f39c89244d18d060245336a883f8429b79f0e816177245ef6365e90b18c7b
2018-11-22,local-authority-eng:OLD,HLA2902,"Land adj., 63 Meldrum Street, Oldham OL8 1NU",http://maps.oldham.gov.uk/WebMapLayers8/?x=393023.3045449&y=403712.0845092&resolution=0.2&MapName=Brownfield,yes,not owned by a public authority,permissioned,full planning permission,,53.573778,-2.130262,0.06,6,6,2017-12-22,,PA/336693/15; Extant planning permission for residential. Erection of 6 semi-detached properties,525f39c89244d18d060245336a883f8429b79f0e816177245ef6365e90b18c7b
2018-11-22,local-authority-eng:OLD,HLA2923,"Former Roundabout Tyres, Crompton Way, Shaw",http://maps.oldham.gov.uk/WebMapLayers8/?x=393647.603495195&y=408769.471050071&resolution=0.2&MapName=Brownfield,,not owned by a public authority,not permissioned,,,53.547398,-2.073887,0.07,6,6,2017-12-22,,PA/055796/08; application finally disposed of - status reverted to potential site,525f39c89244d18d060245336a883f8429b79f0e816177245ef6365e90b18c7b
2018-11-22,local-authority-eng:OLD,HLA2965,"Money Controls Ltd, New Coin Street, Royton, OL2 6JZ",http://maps.oldham.gov.uk/WebMapLayers8/?x=391875.375975272&y=407268.902582278&resolution=0.2&MapName=Brownfield,,not owned by a public authority,not permissioned,,,53.547477,-2.121611,2.53,139,139,2017-12-22,,PA/056551/09; previously received planning permission for residential. Outline planning application for the demolition of Delta Mill and residential redevelopment.,525f39c89244d18d060245336a883f8429b79f0e816177245ef6365e90b18c7b
2018-11-22,local-authority-eng:RCH,HLA2989.1,"Land at Schofield Street, Ashton Road and Copsterhill Road, Oldham (Phase 2)",http://maps.oldham.gov.uk/WebMapLayers8/?x=391875.375975272&y=407268.902582278&resolution=0.2&MapName=Brownfield,,owned by a public authority,not permissioned,,,53.530334,-2.11422,1.88,25,25,2017-12-22,,PA/058539/10. The site represents Phase 2. Application for the demolition of the existing buildings and full planning permission for the erection of 121 dwellings public open space and other associated works (Phase 1) APPROVED  and outline planning permission (All Matters Reserved) for the erection of dwellings and commercial floorspace (A1A2B1 & B2) and other associated works (Phase 2),525f39c89244d18d060245336a883f8429b79f0e816177245ef6365e90b18c7b
2018-11-22,local-authority-eng:OLD,HLA3008,"Site of The Brookdale, Coronation Road, Failsworth, M35 0LT",http://maps.oldham.gov.uk/WebMapLayers8/?x=389267.147592004&y=400654.281539441&resolution=0.2&MapName=Brownfield,yes,not owned by a public authority,permissioned,full planning permission,,53.574639,-2.094742,0.22,16,16,2017-12-22,,PA/337058/15; Extant planning permission for residential. Demolition of the existing public house and erection of 16 No. dwellinghouses,525f39c89244d18d060245336a883f8429b79f0e816177245ef6365e90b18c7b
2018-11-22,local-authority-eng:OLD,HLA3028,"P & D Northern Steels Ltd, Mosshey Street, Shaw, OL2 8QL",http://maps.oldham.gov.uk/WebMapLayers8/?x=394126.583842179&y=408561.598398509&resolution=0.2&MapName=Brownfield,yes,not owned by a public authority,permissioned,outline planning permission,,53.546366,-2.143471,1.93,80,80,2017-12-22,,PA/057631/10; Extant outline planning permission for residential. Outline application for demolition of existing buildings and erection of 80 no. residential units.,525f39c89244d18d060245336a883f8429b79f0e816177245ef6365e90b18c7b
2018-11-22,local-authority-eng:OLD,HLA3051,"25 High Street, Uppermill, Oldham OL3 6HS",http://maps.oldham.gov.uk/WebMapLayers8/?x=399606.00876618&y=405582.57860962&resolution=0.2&MapName=Brownfield,yes,not owned by a public authority,permissioned,full planning permission,,53.512114,-2.161673,0.04,5,5,2017-12-22,,PA/335747/14; Extant planning permission for residential. 1) Erection of three storey building to rear of 23-25 High Street to form 2 no. retail units and 4 no. 1 bed flats.  2) Change of use of first floor of existing building to form 2 bed flat 3) Demolition of buildings/structures to rear,525f39c89244d18d060245336a883f8429b79f0e816177245ef6365e90b18c7b
2018-11-22,local-authority-eng:OLD,HLA3082,"Cabaret Club, 2 Bridge Street, Oldham, OL1 1EA",http://maps.oldham.gov.uk/WebMapLayers8/?x=393013.532341217&y=404915.808023251&resolution=0.2&MapName=Brownfield,,not owned by a public authority,not permissioned,,,53.546682,-2.113351,0.36,16,16,2017-12-22,,PA/334020/13; previously received planning permission for residential. Outline application for the erection of five storey mixed use buildingconsisting of commercial use on the ground floor (183 sq. mtrs offcie floorspace) and 16 no. apartments,525f39c89244d18d060245336a883f8429b79f0e816177245ef6365e90b18c7b
2018-11-22,local-authority-eng:OLD,HLA3102,"10 Sharples Hall Street, Oldham, OL4 2QZ",http://maps.oldham.gov.uk/WebMapLayers8/?x=394704.553990844&y=405868.770768664&resolution=0.2&MapName=Brownfield,yes,not owned by a public authority,permissioned,full planning permission,,53.509258,-2.106642,0.04,9,9,2017-12-22,,PA/336308/14; Extant planning permission for residential. 1) Roof extension to form 2) 3 x self contained flats 3) Associated works,525f39c89244d18d060245336a883f8429b79f0e816177245ef6365e90b18c7b
2018-11-22,local-authority-eng:OLD,HLA3104,"3-5 Hamilton Street, Oldham, OL4 1DA",http://maps.oldham.gov.uk/WebMapLayers8/?x=393648.04473397&y=405092.851114731&resolution=0.2&MapName=Brownfield,,not owned by a public authority,not permissioned,,,53.52951,-2.133324,0.02,11,11,2017-12-22,,PA/332755/12; previously received planning permission for residential. Change of use from HMO to 11 no. self contained flats and 2 no. bedsits,525f39c89244d18d060245336a883f8429b79f0e816177245ef6365e90b18c7b
2018-11-22,local-authority-eng:OLD,HLA3118,"Land at, Woodhall Street, Failsworth, Oldham, M35 0DD",http://maps.oldham.gov.uk/WebMapLayers8/?x=389605.874527859&y=401705.489669998&resolution=0.2&MapName=Brownfield,,not owned by a public authority,not permissioned,,,53.530036,-2.106717,0.32,18,18,2017-12-22,,PA/332094/12; previously received planning permission for residential. Outline application for 12 no. dwellings and 6 no. apartments.,525f39c89244d18d060245336a883f8429b79f0e816177245ef6365e90b18c7b
2018-11-22,local-authority-eng:OLD,HLA3120,"Phoenix Mill, Cheetham Street, Failsworth, Manchester, M35 9DS",http://maps.oldham.gov.uk/WebMapLayers8/?x=390125.715142213&y=401907.362160495&resolution=0.2&MapName=Brownfield,yes,not owned by a public authority,permissioned,outline planning permission,,53.575501,-2.097403,1.46,86,86,2017-12-22,,PA/334553/13; Extant outline planning permission for residential. Outline application for the demolition of all the existing buildings and the erection of 89 dwellings.  Access to be considered. All other matters reserved.,525f39c89244d18d060245336a883f8429b79f0e816177245ef6365e90b18c7b
