entry-date,organisation,site,site-address,site-plan-url,deliverable,ownership,planning-permission-status,planning-permission-type,hazardous-substances,latitude,longitude,hectares,minimum-net-dwellings,maximum-net-dwellings,start-date,end-date,notes,resource
2018-11-22,local-authority-eng:OLD,SHA1080,"Our Lady's RC High School, Roman Rd, Royton",http://maps.oldham.gov.uk/WebMapLayers8/?x=391780.623753397&y=405043.490402522&resolution=0.2&MapName=Brownfield,,owned by a public authority,not permissioned,,,53.551952,-2.100823,1.43,33,33,2017-12-22,,"Potential site identified as suitable, available and achievable in the published SHLAA; Site area does not include open space",525f39c89244d18d060245336a883f8429b79f0e816177245ef6365e90b18c7b
2018-11-22,local-authority-eng:OLD,SHA1084,"Royton Health Centre (former), Royton",http://maps.oldham.gov.uk/WebMapLayers8/?x=391780.623753397&y=405043.490402522&resolution=0.2&MapName=Brownfield,,owned by a public authority,not permissioned,,,53.572076,-1.989133,0.28,8,8,2017-12-22,,"Potential site identified as suitable, available and achievable in the published SHLAA",525f39c89244d18d060245336a883f8429b79f0e816177245ef6365e90b18c7b
2018-11-22,local-authority-eng:OLD,SHA1128,"Bridge House, Lees Road",http://maps.oldham.gov.uk/WebMapLayers8/?x=391780.623753397&y=405043.490402522&resolution=0.2&MapName=Brownfield,,not owned by a public authority,not permissioned,,,53.567441,-2.07258,0.1,5,5,2017-12-22,,"Potential site identified as suitable, available and achievable in the published SHLAA",525f39c89244d18d060245336a883f8429b79f0e816177245ef6365e90b18c7b
2018-11-22,local-authority-eng:OLD,SHA1217,"Harrop Court Mill, Harrop Court Rd, Diggle",http://maps.oldham.gov.uk/WebMapLayers8/?x=391780.623753397&y=405043.490402522&resolution=0.2&MapName=Brownfield,,not owned by a public authority,not permissioned,,,53.511938,-2.151477,0.8,22,22,2017-12-22,,"Potential site identified as suitable, available and achievable in the published SHLAA",525f39c89244d18d060245336a883f8429b79f0e816177245ef6365e90b18c7b
2018-11-22,local-authority-eng:OLD,SHA1225,"Land-Higher Memorial Park, Joseph St, Failsworth",http://maps.oldham.gov.uk/WebMapLayers8/?x=391780.623753397&y=405043.490402522&resolution=0.2&MapName=Brownfield,,owned by a public authority,not permissioned,,,53.518847,-2.139301,0.26,10,10,2017-12-22,,"Potential site identified as suitable, available and achievable in the published SHLAA",525f39c89244d18d060245336a883f8429b79f0e816177245ef6365e90b18c7b
2018-11-22,local-authority-eng:OLD,SHA1314,"Mecca Bingo Block, Cnr Union St, King St, Oldham",http://maps.oldham.gov.uk/WebMapLayers8/?x=391780.623753397&y=405043.490402522&resolution=0.2&MapName=Brownfield,,mixed ownership,not permissioned,,,53.550289,-2.004865,1.77,142,142,2017-12-22,,"Potential site identified as suitable, available and achievable in the published SHLAA",525f39c89244d18d060245336a883f8429b79f0e816177245ef6365e90b18c7b
2018-11-22,local-authority-eng:OLD,SHA1331,"Orme Mill/ Longrange Mill, Greenacres Road, Lees",http://maps.oldham.gov.uk/WebMapLayers8/?x=391780.623753397&y=405043.490402522&resolution=0.2&MapName=Brownfield,,not owned by a public authority,not permissioned,,,53.53005,-1.98845,1.22,36,36,2017-12-22,,"Potential site identified as suitable, available and achievable in the published SHLAA",525f39c89244d18d060245336a883f8429b79f0e816177245ef6365e90b18c7b
2018-11-22,local-authority-eng:OLD,SHA1332,"Majestic Mill, Greenacres Road, Lees",http://maps.oldham.gov.uk/WebMapLayers8/?x=391780.623753397&y=405043.490402522&resolution=0.2&MapName=Brownfield,,not owned by a public authority,not permissioned,,,53.542777,-2.10537,0.96,36,36,2017-12-22,,"Potential site identified as suitable, available and achievable in the published SHLAA",525f39c89244d18d060245336a883f8429b79f0e816177245ef6365e90b18c7b
2018-11-22,local-authority-eng:OLD,SHA1370,"Bus turnaround, High Street, Uppermill",http://maps.oldham.gov.uk/WebMapLayers8/?x=391780.623753397&y=405043.490402522&resolution=0.2&MapName=Brownfield,,owned by a public authority,not permissioned,,,53.54585,-2.064204,0.13,7,7,2017-12-22,,"Potential site identified as suitable, available and achievable in the published SHLAA",525f39c89244d18d060245336a883f8429b79f0e816177245ef6365e90b18c7b
2018-11-22,local-authority-eng:OLD,SHA1372,"Former Lancaster House, Rochdale Rd, Royton",http://maps.oldham.gov.uk/WebMapLayers8/?x=391780.623753397&y=405043.490402522&resolution=0.2&MapName=Brownfield,,owned by a public authority,not permissioned,,,53.541777,-2.104872,0.1,5,5,2017-12-22,,"Potential site identified as suitable, available and achievable in the published SHLAA",525f39c89244d18d060245336a883f8429b79f0e816177245ef6365e90b18c7b
2018-11-22,local-authority-eng:OLD,SHA1384,"Former CPD Centre, Rosary Road",http://maps.oldham.gov.uk/WebMapLayers8/?x=391780.623753397&y=405043.490402522&resolution=0.2&MapName=Brownfield,,owned by a public authority,not permissioned,,,53.551681,-2.119429,1.71,51,51,2017-12-22,,"Potential site identified as suitable, available and achievable in the published SHLAA",525f39c89244d18d060245336a883f8429b79f0e816177245ef6365e90b18c7b
2018-11-22,local-authority-eng:OLD,SHA1599,"Austerlands Mill, Austerlands",http://maps.oldham.gov.uk/WebMapLayers8/?x=391780.623753397&y=405043.490402522&resolution=0.2&MapName=Brownfield,,not owned by a public authority,not permissioned,,,53.526197,-2.10635,0.91,58,58,2017-12-22,,"Potential site identified as suitable, available and achievable in the published SHLAA",525f39c89244d18d060245336a883f8429b79f0e816177245ef6365e90b18c7b
2018-11-22,local-authority-eng:OLD,SHA1606,"Maple Mill 1, Cardwell Street",http://maps.oldham.gov.uk/WebMapLayers8/?x=391780.623753397&y=405043.490402522&resolution=0.2&MapName=Brownfield,,not owned by a public authority,not permissioned,,,53.549923,-2.099995,2.19,123,123,2017-12-22,,"Potential site identified as suitable, available and achievable in the published SHLAA",525f39c89244d18d060245336a883f8429b79f0e816177245ef6365e90b18c7b
2018-11-22,local-authority-eng:OLD,SHA1630,"Former Cromford Mill site, Oldham",http://maps.oldham.gov.uk/WebMapLayers8/?x=391780.623753397&y=405043.490402522&resolution=0.2&MapName=Brownfield,,owned by a public authority,not permissioned,,,53.524208,-2.127448,0.63,25,25,2017-12-22,,"Potential site identified as suitable, available and achievable in the published SHLAA",525f39c89244d18d060245336a883f8429b79f0e816177245ef6365e90b18c7b
2018-11-22,local-authority-eng:OLD,SHA1660,"Heron Mill, Heron St, Hollinwood",http://maps.oldham.gov.uk/WebMapLayers8/?x=391780.623753397&y=405043.490402522&resolution=0.2&MapName=Brownfield,,not owned by a public authority,not permissioned,,,53.595405,-2.087684,1.92,108,108,2017-12-22,,"Potential site identified as suitable, available and achievable in the published SHLAA",525f39c89244d18d060245336a883f8429b79f0e816177245ef6365e90b18c7b
2018-11-22,local-authority-eng:OLD,SHA1667,"Jubilee (Woodbottom) Mill, Milnrow Rd, Shaw",http://maps.oldham.gov.uk/WebMapLayers8/?x=391780.623753397&y=405043.490402522&resolution=0.2&MapName=Brownfield,,not owned by a public authority,not permissioned,,,53.532329,-2.139405,0.92,52,52,2017-12-22,,"Potential site identified as suitable, available and achievable in the published SHLAA",525f39c89244d18d060245336a883f8429b79f0e816177245ef6365e90b18c7b
2018-11-22,local-authority-eng:OLD,SHA1716,"United Mill, Werneth",http://maps.oldham.gov.uk/WebMapLayers8/?x=391780.623753397&y=405043.490402522&resolution=0.2&MapName=Brownfield,,not owned by a public authority,not permissioned,,,53.538757,-2.010084,0.2,11,11,2017-12-22,,"Potential site identified as suitable, available and achievable in the published SHLAA",525f39c89244d18d060245336a883f8429b79f0e816177245ef6365e90b18c7b
2018-11-22,local-authority-eng:OLD,SHA1723,"Wellington Mills (Knoll Mill), Greenfield",http://maps.oldham.gov.uk/WebMapLayers8/?x=391780.623753397&y=405043.490402522&resolution=0.2&MapName=Brownfield,,not owned by a public authority,not permissioned,,,53.550008,-2.12446,0.17,10,10,2017-12-22,,"Potential site identified as suitable, available and achievable in the published SHLAA",525f39c89244d18d060245336a883f8429b79f0e816177245ef6365e90b18c7b
2018-11-22,local-authority-eng:OLD,SHA1725,"Werneth Mills, Henley St, Werneth",http://maps.oldham.gov.uk/WebMapLayers8/?x=391780.623753397&y=405043.490402522&resolution=0.2&MapName=Brownfield,,not owned by a public authority,not permissioned,,,53.543654,-2.104432,2.47,139,139,2017-12-22,,"Potential site identified as suitable, available and achievable in the published SHLAA",525f39c89244d18d060245336a883f8429b79f0e816177245ef6365e90b18c7b
2018-11-22,local-authority-eng:OLD,SHA1792,"Land at Regent, Beech, Wallshaw & Partington Sts",http://maps.oldham.gov.uk/WebMapLayers8/?x=391780.623753397&y=405043.490402522&resolution=0.2&MapName=Brownfield,,not owned by a public authority,not permissioned,,,53.539993,-2.116826,0.31,25,25,2017-12-22,,"Potential site identified as suitable, available and achievable in the published SHLAA",525f39c89244d18d060245336a883f8429b79f0e816177245ef6365e90b18c7b
2018-11-22,local-authority-eng:OLD,SHA1797,"Kings House, King St, Oldham",http://maps.oldham.gov.uk/WebMapLayers8/?x=391780.623753397&y=405043.490402522&resolution=0.2&MapName=Brownfield,,not owned by a public authority,not permissioned,,,53.544274,-2.123916,0.01,10,10,2017-12-22,,"Potential site identified as suitable, available and achievable in the published SHLAA",525f39c89244d18d060245336a883f8429b79f0e816177245ef6365e90b18c7b
2018-11-22,local-authority-eng:OLD,SHA1858,"Land off Mark St., West End St, Oldham",http://maps.oldham.gov.uk/WebMapLayers8/?x=391780.623753397&y=405043.490402522&resolution=0.2&MapName=Brownfield,,owned by a public authority,not permissioned,,,53.536492,-2.008816,0.07,6,6,2017-12-22,,"Potential site identified as suitable, available and achievable in the published SHLAA",525f39c89244d18d060245336a883f8429b79f0e816177245ef6365e90b18c7b
2018-11-22,local-authority-eng:OLD,SHA1992,"Greenfield Conservative Club, Chew Valley Rd",http://maps.oldham.gov.uk/WebMapLayers8/?x=391780.623753397&y=405043.490402522&resolution=0.2&MapName=Brownfield,,not owned by a public authority,not permissioned,,,53.530516,-2.111596,0.17,7,7,2017-12-22,,"Potential site identified as suitable, available and achievable in the published SHLAA",525f39c89244d18d060245336a883f8429b79f0e816177245ef6365e90b18c7b
2018-11-22,local-authority-eng:OLD,SHA1997,"Boston House, Broadway Street",http://maps.oldham.gov.uk/WebMapLayers8/?x=391780.623753397&y=405043.490402522&resolution=0.2&MapName=Brownfield,,owned by a public authority,not permissioned,,,53.542743,-2.117513,0.51,14,14,2017-12-22,,"Potential site identified as suitable, available and achievable in the published SHLAA",525f39c89244d18d060245336a883f8429b79f0e816177245ef6365e90b18c7b
2018-11-22,local-authority-eng:OLD,SHA2000,Town Centre Western Gateway-SITE A,http://maps.oldham.gov.uk/WebMapLayers8/?x=391780.623753397&y=405043.490402522&resolution=0.2&MapName=Brownfield,,owned by a public authority,not permissioned,,,53.541288,-2.116951,2.12,329,329,2017-12-22,,"Potential site identified as suitable, available and achievable in the published SHLAA",525f39c89244d18d060245336a883f8429b79f0e816177245ef6365e90b18c7b
2018-11-22,local-authority-eng:OLD,SHA2001,Town Centre Western Gateway-SITE B,http://maps.oldham.gov.uk/WebMapLayers8/?x=391780.623753397&y=405043.490402522&resolution=0.2&MapName=Brownfield,,not owned by a public authority,not permissioned,,,53.542922,-2.10867,1.27,495,495,2017-12-22,,"Potential site identified as suitable, available and achievable in the published SHLAA",525f39c89244d18d060245336a883f8429b79f0e816177245ef6365e90b18c7b
2018-11-22,local-authority-eng:OLD,SHA2002,Rock Street Site-SITE C,http://maps.oldham.gov.uk/WebMapLayers8/?x=391780.623753397&y=405043.490402522&resolution=0.2&MapName=Brownfield,,mixed ownership,not permissioned,,,53.543222,-2.104974,1.27,147,147,2017-12-22,,"Potential site identified as suitable, available and achievable in the published SHLAA",525f39c89244d18d060245336a883f8429b79f0e816177245ef6365e90b18c7b
2018-11-22,local-authority-eng:OLD,SHA2015,"Land Between Beever St and Regent St, Oldham",http://maps.oldham.gov.uk/WebMapLayers8/?x=391780.623753397&y=405043.490402522&resolution=0.2&MapName=Brownfield,,not owned by a public authority,not permissioned,,,53.540168,-2.103639,0.46,37,37,2017-12-22,,"Potential site identified as suitable, available and achievable in the published SHLAA",525f39c89244d18d060245336a883f8429b79f0e816177245ef6365e90b18c7b
2018-11-22,local-authority-eng:OLD,SHA2016,Southlink-land at,http://maps.oldham.gov.uk/WebMapLayers8/?x=391780.623753397&y=405043.490402522&resolution=0.2&MapName=Brownfield,,mixed ownership,not permissioned,,,53.565625,-2.120234,5.76,450,450,2017-12-22,,"Potential site identified as suitable, available and achievable in the published SHLAA",525f39c89244d18d060245336a883f8429b79f0e816177245ef6365e90b18c7b
2018-11-22,local-authority-eng:OLD,SHA2017,"Land at Flint St, Marble St, Oldham",http://maps.oldham.gov.uk/WebMapLayers8/?x=391780.623753397&y=405043.490402522&resolution=0.2&MapName=Brownfield,,owned by a public authority,not permissioned,,,53.561761,-2.121818,0.26,10,10,2017-12-22,,"Potential site identified as suitable, available and achievable in the published SHLAA",525f39c89244d18d060245336a883f8429b79f0e816177245ef6365e90b18c7b
2018-11-22,local-authority-eng:OLD,SHA2019,"Highbarn House, Royton Site H",http://maps.oldham.gov.uk/WebMapLayers8/?x=391780.623753397&y=405043.490402522&resolution=0.2&MapName=Brownfield,,owned by a public authority,not permissioned,,,53.540408,-2.106521,0.28,11,11,2017-12-22,,"Potential site identified as suitable, available and achievable in the published SHLAA",525f39c89244d18d060245336a883f8429b79f0e816177245ef6365e90b18c7b
2018-11-22,local-authority-eng:OLD,SHA2031,"Land to S. of 64 Bridge Street, Rhodes Bank",http://maps.oldham.gov.uk/WebMapLayers8/?x=391780.623753397&y=405043.490402522&resolution=0.2&MapName=Brownfield,,not owned by a public authority,not permissioned,,,53.523934,-2.146829,0.08,6,6,2017-12-22,,"Potential site identified as suitable, available and achievable in the published SHLAA",525f39c89244d18d060245336a883f8429b79f0e816177245ef6365e90b18c7b
2018-11-22,local-authority-eng:OLD,SHA2032,Sellers Business Park,http://maps.oldham.gov.uk/WebMapLayers8/?x=391780.623753397&y=405043.490402522&resolution=0.2&MapName=Brownfield,,not owned by a public authority,not permissioned,,,53.582874,-2.110541,2.19,61,61,2017-12-22,,"Potential site identified as suitable, available and achievable in the published SHLAA",525f39c89244d18d060245336a883f8429b79f0e816177245ef6365e90b18c7b
2018-11-22,local-authority-eng:OLD,SHA2043,"Car Park, Rear 394-410 Rochdale Rd (Waggon and Horses), Shaw",http://maps.oldham.gov.uk/WebMapLayers8/?x=391780.623753397&y=405043.490402522&resolution=0.2&MapName=Brownfield,,owned by a public authority,not permissioned,,,53.578639,-2.091499,0.17,5,5,2017-12-22,,"Potential site identified as suitable, available and achievable in the published SHLAA",525f39c89244d18d060245336a883f8429b79f0e816177245ef6365e90b18c7b
2018-11-22,local-authority-eng:OLD,SHA2046,"M K Pilling Ltd, Hayden Street, Crossley Street, Shaw, OL2 8EN",http://maps.oldham.gov.uk/WebMapLayers8/?x=391780.623753397&y=405043.490402522&resolution=0.2&MapName=Brownfield,,not owned by a public authority,not permissioned,,,53.52444,-2.101866,0.14,10,10,2017-12-22,,"Potential site identified as suitable, available and achievable in the published SHLAA",525f39c89244d18d060245336a883f8429b79f0e816177245ef6365e90b18c7b
2018-11-22,local-authority-eng:OLD,SHA2047,"Fytton Arms Inn, The Green, Oldham, OL8 2LT",http://maps.oldham.gov.uk/WebMapLayers8/?x=391780.623753397&y=405043.490402522&resolution=0.2&MapName=Brownfield,,not owned by a public authority,not permissioned,,,53.547116,-2.103158,0.2,16,16,2017-12-22,,"Potential site identified as suitable, available and achievable in the published SHLAA",525f39c89244d18d060245336a883f8429b79f0e816177245ef6365e90b18c7b
2018-11-22,local-authority-eng:OLD,SHA2049,"157 Egerton Street, Oldham, OL1 3QJ",http://maps.oldham.gov.uk/WebMapLayers8/?x=391780.623753397&y=405043.490402522&resolution=0.2&MapName=Brownfield,,not owned by a public authority,not permissioned,,,53.542429,-2.107537,0.03,7,7,2017-12-22,,"Potential site identified as suitable, available and achievable in the published SHLAA",525f39c89244d18d060245336a883f8429b79f0e816177245ef6365e90b18c7b
2018-11-22,local-authority-eng:OLD,SHA2051,"87-89 Yorkshire Street, Oldham, OL1 3ST",http://maps.oldham.gov.uk/WebMapLayers8/?x=391780.623753397&y=405043.490402522&resolution=0.2&MapName=Brownfield,,not owned by a public authority,not permissioned,,,53.592726,-2.087784,0.04,12,12,2017-12-22,,"Potential site identified as suitable, available and achievable in the published SHLAA",525f39c89244d18d060245336a883f8429b79f0e816177245ef6365e90b18c7b
2018-11-22,local-authority-eng:OLD,SHA2052,"Jubilee Inn, Milnrow Road, Shaw, OL2 8BL",http://maps.oldham.gov.uk/WebMapLayers8/?x=391780.623753397&y=405043.490402522&resolution=0.2&MapName=Brownfield,,not owned by a public authority,not permissioned,,,53.536393,-2.065804,0.1,5,5,2017-12-22,,"Potential site identified as suitable, available and achievable in the published SHLAA",525f39c89244d18d060245336a883f8429b79f0e816177245ef6365e90b18c7b
2018-11-22,local-authority-eng:OLD,SHA2055,"Wood End House, Atherton Street, Springhead, OL4 5TQ",http://maps.oldham.gov.uk/WebMapLayers8/?x=391780.623753397&y=405043.490402522&resolution=0.2&MapName=Brownfield,,not owned by a public authority,not permissioned,,,53.548719,-2.075105,0.19,9,9,2017-12-22,,"Potential site identified as suitable, available and achievable in the published SHLAA",525f39c89244d18d060245336a883f8429b79f0e816177245ef6365e90b18c7b
2018-11-22,local-authority-eng:OLD,SHA2058,"Land bounded by Brideoake/Heywood St./Greenacres Rd., Waterhead (PEZ 19 Greenacres Road)",http://maps.oldham.gov.uk/WebMapLayers8/?x=391780.623753397&y=405043.490402522&resolution=0.2&MapName=Brownfield,,not owned by a public authority,not permissioned,,,53.506383,-2.165027,0.88,35,35,2017-12-22,,"Potential site identified as suitable, available and achievable in the published SHLAA",525f39c89244d18d060245336a883f8429b79f0e816177245ef6365e90b18c7b
2018-11-22,local-authority-eng:OLD,SHA2059,"Land off Beresford St., Failsworth (PEZ 1 West Failsworth)",http://maps.oldham.gov.uk/WebMapLayers8/?x=391780.623753397&y=405043.490402522&resolution=0.2&MapName=Brownfield,,not owned by a public authority,not permissioned,,,53.505883,-2.168734,0.84,34,34,2017-12-22,,"Potential site identified as suitable, available and achievable in the published SHLAA",525f39c89244d18d060245336a883f8429b79f0e816177245ef6365e90b18c7b
2018-11-22,local-authority-eng:OLD,SHA2060,"Land adj. Ivy House, Oldham Rd., Failsworth (PEZ 1 West Failsworth)",http://maps.oldham.gov.uk/WebMapLayers8/?x=391780.623753397&y=405043.490402522&resolution=0.2&MapName=Brownfield,,not owned by a public authority,not permissioned,,,53.554254,-2.137409,0.23,9,9,2017-12-22,,"Potential site identified as suitable, available and achievable in the published SHLAA",525f39c89244d18d060245336a883f8429b79f0e816177245ef6365e90b18c7b
