entry-date,organisation,site,site-address,site-plan-url,deliverable,ownership,planning-permission-status,planning-permission-type,hazardous-substances,latitude,longitude,hectares,minimum-net-dwellings,maximum-net-dwellings,start-date,end-date,notes,resource
2019-12-03,local-authority-eng:RCC,464,"Bridge House, Bridge Court, Normanby",https://wca.redclev.net/resident/planning-and-building/local-plan/Local%20Plan%20Documents/Brownfield%20Land%20Register%202019/464_19.pdf,yes,not owned by a public authority,permissioned,full planning permission,,54.555829,-1.159834,0.17,12,12,2017-11-10,2019-12-03,Permission expired June 2019. Building remains in use as care home.,81e38899e7e04a506c4406843728bcd4fc0c0875a70dbf93abe9fbbeb8e2a7a8
2019-12-03,local-authority-eng:RCC,136,"Wilton Lane, Guisborough",https://wca.redclev.net/resident/planning-and-building/local-plan/Local%20Plan%20Documents/Brownfield%20Land%20Register%202019/136_19.pdf,yes,not owned by a public authority,permissioned,full planning permission,,54.539524,-1.054712,0.27,14,14,2017-11-10,2019-12-03,Site under development.,81e38899e7e04a506c4406843728bcd4fc0c0875a70dbf93abe9fbbeb8e2a7a8
2019-12-03,local-authority-eng:RCC,387,"Land Adjacent Ryehills School, Redcar",https://wca.redclev.net/resident/planning-and-building/local-plan/Local%20Plan%20Documents/Brownfield%20Land%20Register%202019/387_19.pdf,yes,owned by a public authority,permissioned,full planning permission,,54.605045,-1.057576,1.4,49,49,2017-11-10,2019-12-03,Site under development.,81e38899e7e04a506c4406843728bcd4fc0c0875a70dbf93abe9fbbeb8e2a7a8
2019-12-03,local-authority-eng:RCC,360,"Former Rosecroft School, Rosecroft Lane, Loftus",https://wca.redclev.net/resident/planning-and-building/local-plan/Local%20Plan%20Documents/Brownfield%20Land%20Register%202019/360_19.pdf,yes,owned by a public authority,permissioned,full planning permission,,54.550708,-0.891035,1.38,69,69,2017-11-10,2019-12-03,Site under development.,81e38899e7e04a506c4406843728bcd4fc0c0875a70dbf93abe9fbbeb8e2a7a8
2019-12-03,local-authority-eng:RCC,389,"Hummersea Hills Phase 1, Loftus",https://wca.redclev.net/resident/planning-and-building/local-plan/Local%20Plan%20Documents/Brownfield%20Land%20Register%202019/389_19.pdf,,not owned by a public authority,permissioned,full planning permission,,54.557688,-0.886763,0.41,17,17,2017-11-10,,Comprises remaining development area on extant consent at phase 1 .,81e38899e7e04a506c4406843728bcd4fc0c0875a70dbf93abe9fbbeb8e2a7a8
2019-12-03,local-authority-eng:RCC,392,"Hummersea Hills Phase 2, Loftus",https://wca.redclev.net/resident/planning-and-building/local-plan/Local%20Plan%20Documents/Brownfield%20Land%20Register%202019/392_19.pdf,,not owned by a public authority,permissioned,full planning permission,,54.557402,-0.889832,3.11,104,104,2017-11-10,,"Site excludes 1.0ha associated public open space which is part of the planning permission and is adjacent to the site.
Comprises remaining dwellings on phase 2 and excludes separate permission on part of the site for 60 extra-care apartments which is expected to lapse in June 2018. The figure of 104 includes 34 dwellings previously proposed on the apartment permission site.",81e38899e7e04a506c4406843728bcd4fc0c0875a70dbf93abe9fbbeb8e2a7a8
2019-12-03,local-authority-eng:RCC,457,"Former Abattoir Site, Boosbeck",https://wca.redclev.net/resident/planning-and-building/local-plan/Local%20Plan%20Documents/Brownfield%20Land%20Register%202019/457_19.pdf,,not owned by a public authority,permissioned,outline planning permission,,54.54464,-0.983966,0.81,31,31,2017-11-10,,"Local Plan Housing Allocation
https://www.redcar-cleveland.gov.uk/resident/planning-and-building/strategic%20planning/Documents/Local%20Plan%20Adopted%20May%202018.pdf
Part of larger allocation site (4.3ha.) site with outline permission for 69 dwellings. Rest of allocation is currently Council owned open space.",81e38899e7e04a506c4406843728bcd4fc0c0875a70dbf93abe9fbbeb8e2a7a8
2019-12-03,local-authority-eng:RCC,456,"Former Handale Primary School, Loftus",https://wca.redclev.net/resident/planning-and-building/local-plan/Local%20Plan%20Documents/Brownfield%20Land%20Register%202019/456_19.pdf,,owned by a public authority,permissioned,,,54.554237,-0.892609,0.28,10,10,2017-11-10,2019-12-03,Permission granted October 2019 for non-resiodential uses.,81e38899e7e04a506c4406843728bcd4fc0c0875a70dbf93abe9fbbeb8e2a7a8
2019-12-03,local-authority-eng:RCC,376,"Land at Park Lane, Guisborough",https://wca.redclev.net/resident/planning-and-building/local-plan/Local%20Plan%20Documents/Brownfield%20Land%20Register%202019/376_19.pdf,,owned by a public authority,not permissioned,,,54.536596,-1.057268,0.48,20,20,2017-11-10,,"Local Plan Housing Allocation
https://www.redcar-cleveland.gov.uk/resident/planning-and-building/strategic%20planning/Documents/Local%20Plan%20Adopted%20May%202018.pdf",81e38899e7e04a506c4406843728bcd4fc0c0875a70dbf93abe9fbbeb8e2a7a8
2019-12-03,local-authority-eng:RCC,405,"Land at Stanghow Road, Skelton",https://wca.redclev.net/resident/planning-and-building/local-plan/Local%20Plan%20Documents/Brownfield%20Land%20Register%202019/405_19.pdf,,not owned by a public authority,not permissioned,,,54.560263,-0.972613,0.33,10,10,2017-11-10,,"Local Plan Housing Allocation
https://www.redcar-cleveland.gov.uk/resident/planning-and-building/strategic%20planning/Documents/Local%20Plan%20Adopted%20May%202018.pdf",81e38899e7e04a506c4406843728bcd4fc0c0875a70dbf93abe9fbbeb8e2a7a8
2019-12-03,local-authority-eng:RCC,472,"Former Salvation Army Hall, Bolckow Street, Eston",https://wca.redclev.net/resident/planning-and-building/local-plan/Local%20Plan%20Documents/Brownfield%20Land%20Register%202019/472_19.pdf,yes,not owned by a public authority,permissioned,full planning permission,,54.557763,-1.140837,0.18,6,6,2017-11-10,2019-12-03,Permission expired 2019.  Building remains in use as storage depot.,81e38899e7e04a506c4406843728bcd4fc0c0875a70dbf93abe9fbbeb8e2a7a8
2019-12-03,local-authority-eng:RCC,135,"Low Grange Farm (part), South Bank",https://wca.redclev.net/resident/planning-and-building/local-plan/Local%20Plan%20Documents/Brownfield%20Land%20Register%202019/135_19.pdf,,not owned by a public authority,permissioned,outline planning permission,,54.576737,-1.165608,11.2,438,438,2018-12-11,,"Local Plan Housing Allocation
https://www.redcar-cleveland.gov.uk/resident/planning-and-building/strategic%20planning/Documents/Local%20Plan%20Adopted%20May%202018.pdf
This site comprises a cleared housing area and a former landfill site and forms part of a larger (32ha.) area of land at Low Grange Farm with outline planning permission for up to 1,250 dwellings which was granted for a period of 10 years, to 2026, to reflect the scale and market location of the site.",81e38899e7e04a506c4406843728bcd4fc0c0875a70dbf93abe9fbbeb8e2a7a8
2019-12-03,local-authority-eng:RCC,452,"Former Eston Park School (part), Teesville",https://wca.redclev.net/resident/planning-and-building/local-plan/Local%20Plan%20Documents/Brownfield%20Land%20Register%202019/452_19.pdf,,owned by a public authority,not permissioned,,,54.566107,-1.159298,1.15,40,40,2018-12-11,,"The site comprises an area of cleared former school buildings abutting the former school playing field area (3ha) which is also in public (Council) ownership and allocated for approximately 100 dwellings in Policy H3.9 of the Local Plan. The brownfield site became available following plan adoption, but It is anticipated that both sites would logically come forward as a single development scheme.",81e38899e7e04a506c4406843728bcd4fc0c0875a70dbf93abe9fbbeb8e2a7a8
2019-12-03,local-authority-eng:RCC,413,"Wykeham Close, Redcar",https://wca.redclev.net/resident/planning-and-building/local-plan/Local%20Plan%20Documents/Brownfield%20Land%20Register%202019/413_19.pdf,,not owned by a public authority,permissioned,,,54.596019,-1.07464,0.55,25,25,2018-12-11,2019-12-03,Site under development.,81e38899e7e04a506c4406843728bcd4fc0c0875a70dbf93abe9fbbeb8e2a7a8
2019-12-03,local-authority-eng:RCC,476,"Layland House, North Skelton",https://wca.redclev.net/resident/planning-and-building/local-plan/Local%20Plan%20Documents/Brownfield%20Land%20Register%202019/476_19.pdf,yes,not owned by a public authority,permissioned,outline planning permission,,54.558091,-0.964549,0.18,6,6,2018-12-11,,The layout attached to the outline permission shows 6 no. semi-detached dwellings.,81e38899e7e04a506c4406843728bcd4fc0c0875a70dbf93abe9fbbeb8e2a7a8
2019-12-03,local-authority-eng:RCC,519,"1 Pearl Street, Saltburn",https://wca.redclev.net/resident/planning-and-building/local-plan/Local%20Plan%20Documents/Brownfield%20Land%20Register%202019/519_19.pdf,yes,not owned by a public authority,permissioned,full planning permission,,54.58453,-0.972868,0.02,10,10,2018-12-11,,Permission is for conversion from HMO to 10 flats.,81e38899e7e04a506c4406843728bcd4fc0c0875a70dbf93abe9fbbeb8e2a7a8
2019-12-03,local-authority-eng:RCC,460,"Parklands Public House, Normanby",https://wca.redclev.net/resident/planning-and-building/local-plan/Local%20Plan%20Documents/Brownfield%20Land%20Register%202019/460_19.pdf,,not owned by a public authority,not permissioned,,,54.556625,-1.164364,0.46,12,12,2018-12-11,,Yield assumes 12 no semi-detached dwellings and access road.,81e38899e7e04a506c4406843728bcd4fc0c0875a70dbf93abe9fbbeb8e2a7a8
2019-12-03,local-authority-eng:RCC,18,"Spencerbeck Farrm (part), Ormesby",https://wca.redclev.net/resident/planning-and-building/local-plan/Local%20Plan%20Documents/Brownfield%20Land%20Register%202019/018_19.pdf,,not owned by a public authority,not permissioned,,,54.55328,-1.168035,0.96,20,20,2018-12-11,,"Local Plan Housing Allocation
https://www.redcar-cleveland.gov.uk/resident/planning-and-building/strategic%20planning/Documents/Local%20Plan%20Adopted%20May%202018.pdf
Site comprises former farm cottages, workshop shed and hardstandings. There is an associated and a grazing area to the rear which is the subject of a separate outline permission but both sites are being marketed as a single development opportunity and form part of the same Local Plan housing allocation under Policy H3.6.",81e38899e7e04a506c4406843728bcd4fc0c0875a70dbf93abe9fbbeb8e2a7a8
2019-12-03,local-authority-eng:RCC,345,"Former Olympia Gym, Redcar",https://wca.redclev.net/resident/planning-and-building/local-plan/Local%20Plan%20Documents/Brownfield%20Land%20Register%202019/345_19.pdf,yes,not owned by a public authority,permissioned,full planning permission,,54.62039,-1.072136,0.09,10,10,2018-12-11,2019-12-03,Site under development.,81e38899e7e04a506c4406843728bcd4fc0c0875a70dbf93abe9fbbeb8e2a7a8
2019-12-03,local-authority-eng:RCC,529,"Former Royal Standard Public House, Redcar",https://wca.redclev.net/resident/planning-and-building/local-plan/Local%20Plan%20Documents/Brownfield%20Land%20Register%202019/529_19.pdf,yes,not owned by a public authority,permissioned,full planning permission,,54.618096,-1.068347,0.02,3,3,2018-12-11,2019-12-03,Site was added in error - net gain would be  <5 units.,81e38899e7e04a506c4406843728bcd4fc0c0875a70dbf93abe9fbbeb8e2a7a8
2019-12-03,local-authority-eng:RCC,530,"Former Cleveland Bay Public House, Eston",https://wca.redclev.net/resident/planning-and-building/local-plan/Local%20Plan%20Documents/Brownfield%20Land%20Register%202019/530_19.pdf,yes,not owned by a public authority,permissioned,full planning permission,,54.557684,-1.14107,0.01,6,6,2018-12-11,,Permission is for conversion of pub and HMO into flats.,81e38899e7e04a506c4406843728bcd4fc0c0875a70dbf93abe9fbbeb8e2a7a8
2019-12-03,local-authority-eng:RCC,531,"Former RAFA Club, Redcar",https://wca.redclev.net/resident/planning-and-building/local-plan/Local%20Plan%20Documents/Brownfield%20Land%20Register%202019/531_19.pdf,yes,not owned by a public authority,permissioned,full planning permission,,54.619986,-1.074607,0.02,6,6,2018-12-11,,Permission is for conversion of social club into flats.,81e38899e7e04a506c4406843728bcd4fc0c0875a70dbf93abe9fbbeb8e2a7a8
2019-12-03,local-authority-eng:RCC,528,"Land South of The Dunes, Redcar",https://wca.redclev.net/resident/planning-and-building/local-plan/Local%20Plan%20Documents/Brownfield%20Land%20Register%202019/528_19.pdf,,owned by a public authority,permissioned,full planning permission,,54.598827,-0.958185,0.19,9,9,2018-12-11,2019-12-03,Site under development.,81e38899e7e04a506c4406843728bcd4fc0c0875a70dbf93abe9fbbeb8e2a7a8
2019-12-03,local-authority-eng:RCC,532,"Former Bulls Head Hotel, North Skelton",https://wca.redclev.net/resident/planning-and-building/local-plan/Local%20Plan%20Documents/Brownfield%20Land%20Register%202019/532_19.pdf,,not owned by a public authority,not permissioned,,,54.557848,-0.958185,0.14,8,8,2018-12-11,,Housing estimate assumes 90% net developable area and a gross density of 60 dwellings per hectare to reflect site and resiodential location characteristics.,81e38899e7e04a506c4406843728bcd4fc0c0875a70dbf93abe9fbbeb8e2a7a8
2019-12-03,local-authority-eng:RCC,539,Church Lane North Estate,https://wca.redclev.net/resident/planning-and-building/local-plan/Local%20Plan%20Documents/Brownfield%20Land%20Register%202019/539_19.pdf,,not owned by a public authority,not permissioned,,,54.570464,-1.149173,8.79,32,32,2019-12-03,,Yield refers to net gain from proposed estate renewal.,81e38899e7e04a506c4406843728bcd4fc0c0875a70dbf93abe9fbbeb8e2a7a8
2019-12-03,local-authority-eng:RCC,488,Saltburn Riding Stables,https://wca.redclev.net/resident/planning-and-building/local-plan/Local%20Plan%20Documents/Brownfield%20Land%20Register%202019/488_19.pdf,,not owned by a public authority,permissioned,outline planning permission,,54.581305,-0.997377,1.36,15,15,2019-12-03,,Outline permission is for redevelopment of stable buildings footprint.,81e38899e7e04a506c4406843728bcd4fc0c0875a70dbf93abe9fbbeb8e2a7a8
2019-12-03,local-authority-eng:RCC,540,Woodhouse Road,https://wca.redclev.net/resident/planning-and-building/local-plan/Local%20Plan%20Documents/Brownfield%20Land%20Register%202019/540_19.pdf,yes,not owned by a public authority,permissioned,full planning permission,,54.535199,-1.064468,0.21,7,7,2019-12-03,,Permission for proposed conversion of housing office and new build development.,81e38899e7e04a506c4406843728bcd4fc0c0875a70dbf93abe9fbbeb8e2a7a8
