entry-date,organisation,site,site-address,site-plan-url,deliverable,ownership,planning-permission-status,planning-permission-type,hazardous-substances,latitude,longitude,hectares,minimum-net-dwellings,maximum-net-dwellings,start-date,end-date,notes,resource
2019-12-15,local-authority-eng:NWL,BLR2,Jubilee Business Park Snarestone Road Appleby Magna,https://www.nwleics.gov.uk/pages/brownfield_land_register,,not owned by a public authority,not permissioned,,,52.683435,-1.528403,2.02,38,38,,,,8cd2737491d4098bc4d7bbdd2b9b2b82d7636a14a9f9ce807e0d0b2eadfff0d8
2019-12-15,local-authority-eng:NWL,BLR4,Breedon Priory Nursery Ashby Road Breedon on the Hill,https://www.nwleics.gov.uk/pages/brownfield_land_register,,not owned by a public authority,pending decision,full planning permission,,52.802754,-1.404222,2.55,35,35,,,"18/02198/FULM application site 5.8ha B/F element 1.95ha| Previous outstanding application is 16/01120/FULM application site 3.93ha - B/F element 2.55ha. Demolition of existing buildings and redevelopment for 43 dwellings, a new village hall, formation of vehicular and pedestrian access points and associated infrastructure",8cd2737491d4098bc4d7bbdd2b9b2b82d7636a14a9f9ce807e0d0b2eadfff0d8
2019-12-15,local-authority-eng:NWL,BLR5,Stevenson House Ashby Road Coalville,https://www.nwleics.gov.uk/pages/brownfield_land_register,,not owned by a public authority,not permissioned,,,52.72711,-1.380436,0.28,14,14,,,13/00107/OUTM expired 2019/12/20. Demolition of existing structures and the change of use of the land to residential with the erection 14 dwellings (Outline - All Matters reserved),8cd2737491d4098bc4d7bbdd2b9b2b82d7636a14a9f9ce807e0d0b2eadfff0d8
2019-12-15,local-authority-eng:NWL,BLR6,Former Needle Factory Wolsey Road Coalville,https://www.nwleics.gov.uk/pages/brownfield_land_register,,not owned by a public authority,not permissioned,,,52.727335,-1.375383,2.06,38,38,,,,8cd2737491d4098bc4d7bbdd2b9b2b82d7636a14a9f9ce807e0d0b2eadfff0d8
2019-12-15,local-authority-eng:NWL,BLR7,The Piggeries North of Standard Hill Coalville,https://www.nwleics.gov.uk/pages/brownfield_land_register,,not owned by a public authority,pending decision,full planning permission,,52.717114,-1.383953,0.65,15,15,,,"19/02159/FULM application site 2.53ha B/F element 0.65ha. Demolition of existing buildings and erection of 85 dwellings with associated infrastructure, landscaping and drainage features",8cd2737491d4098bc4d7bbdd2b9b2b82d7636a14a9f9ce807e0d0b2eadfff0d8
2019-12-15,local-authority-eng:NWL,BLR8,Workspace 17 Highfield Street Coalville,https://www.nwleics.gov.uk/pages/brownfield_land_register,,owned by a public authority,permissioned,outline planning permission,,52.717387,-1.376014,0.56,18,18,,,two applications approved on the same date 16/00414/OUTM is all residential 16/00415/OUTM has a retail element and some Discharge of Conditions. Demolition of existing buildings and erection of up to 20 dwellings (outline - details of part access included) | Demolition of existing buildings and erection of up to 18 dwellings and retail convenience store (A1) (outline - details of part access included),8cd2737491d4098bc4d7bbdd2b9b2b82d7636a14a9f9ce807e0d0b2eadfff0d8
2019-12-15,local-authority-eng:NWL,BLR11,Car Park Moira Road Doninsthorpe,https://www.nwleics.gov.uk/pages/brownfield_land_register,,owned by a public authority,not permissioned,,,52.725865,-1.52802,0.25,18,18,,,,8cd2737491d4098bc4d7bbdd2b9b2b82d7636a14a9f9ce807e0d0b2eadfff0d8
2019-12-15,local-authority-eng:NWL,BLR12,MTS Logistics Mill Lane Heather,https://www.nwleics.gov.uk/pages/brownfield_land_register,,not owned by a public authority,pending decision,full planning permission,,52.6921,-1.415035,1.05,14,14,,,19/00824/FULM pending decision | 14/00396/FULM permission lapsed 2019-03-04. Re-development of existing site (including demolition) to provide 14 residential dwellings with associated off-street parking and landscaping,8cd2737491d4098bc4d7bbdd2b9b2b82d7636a14a9f9ce807e0d0b2eadfff0d8
2019-12-15,local-authority-eng:NWL,BLR13,Former Garage 112-128 Melbourne Road Ibstock,https://www.nwleics.gov.uk/pages/brownfield_land_register,,not owned by a public authority,not permissioned,,,52.687906,-1.401421,0.21,12,12,,,07/01200/OUT for 12 dwellings approved but has since lapsed. Residential development - erection of 12 no. dwellings (Outline - layout and access),8cd2737491d4098bc4d7bbdd2b9b2b82d7636a14a9f9ce807e0d0b2eadfff0d8
2019-12-15,local-authority-eng:NWL,BLR14,Brooks Machine Tools Derby Road Kegworth,https://www.nwleics.gov.uk/pages/brownfield_land_register,,not owned by a public authority,permissioned,full planning permission,,52.836272,-1.278624,0.11,16,16,,,05/00405/FUL The site was granted planning permission in 2007 at appeal for the development of 16 flats. Whilst this development has been started none of the dwellings have been completed.. Erection of 16 Flats,8cd2737491d4098bc4d7bbdd2b9b2b82d7636a14a9f9ce807e0d0b2eadfff0d8
2019-12-15,local-authority-eng:NWL,BLR17,The Holly Bush Inn Main Street Oakthorpe,https://www.nwleics.gov.uk/pages/brownfield_land_register,,not owned by a public authority,permissioned,full planning permission,,52.714383,-1.523022,0.18,5,5,,,19/00763/FUL. Change of use and partial demolition and alteration of pub building to form two dwellings and erection of three dwellings,8cd2737491d4098bc4d7bbdd2b9b2b82d7636a14a9f9ce807e0d0b2eadfff0d8
2019-12-15,local-authority-eng:NWL,BLR18,Beasleys Nurseries Heather Lane Ravenstone,https://www.nwleics.gov.uk/pages/brownfield_land_register,,not owned by a public authority,permissioned,outline planning permission,,52.716864,-1.407258,1.59,36,36,,,19/01581/REMM under consideration for 34 dwellings |19/01236/DEM prior notification of demolition | 16/01151/OUTM | Whole site 2.2ha - B/F element Circa 1.59ha. Outline application for up to 37 dwellings together with associated public open space surface water attenuation and access (details of part access included),8cd2737491d4098bc4d7bbdd2b9b2b82d7636a14a9f9ce807e0d0b2eadfff0d8
2019-12-15,local-authority-eng:NWL,BLR21,Garage 45 Tamworth Road Ashby De La Zouch,https://www.nwleics.gov.uk/pages/brownfield_land_register,,not owned by a public authority,permissioned,full planning permission,,52.740334,-1.47971,0.18,5,5,,,"18/01007/FUL with discharge of conditions in 2019. "" Demolition of Existing buildings, extensions and access to No 45 Tamworth Road and Erection of 5 no. dwellings and associated access""",8cd2737491d4098bc4d7bbdd2b9b2b82d7636a14a9f9ce807e0d0b2eadfff0d8
2019-12-15,local-authority-eng:NWL,BLR22,The Oak Of Whitwick 27 Talbot Street Whitwick,https://www.nwleics.gov.uk/pages/brownfield_land_register,,not owned by a public authority,permissioned,outline planning permission,,52.744769,-1.363935,0.16,12,12,,,16/01428/OUTM. Demolition of former public house and erection of up to 12 apartments with associated parking area,8cd2737491d4098bc4d7bbdd2b9b2b82d7636a14a9f9ce807e0d0b2eadfff0d8
2019-12-15,local-authority-eng:NWL,BLR24,118 Station Road Kegworth,https://www.nwleics.gov.uk/pages/brownfield_land_register,,not owned by a public authority,permissioned,outline planning permission,,52.839968,-1.271452,0.35,14,14,,,17/01576/OUTM. Residential development (outline - all matters reserved),8cd2737491d4098bc4d7bbdd2b9b2b82d7636a14a9f9ce807e0d0b2eadfff0d8
2019-12-15,local-authority-eng:NWL,BLR25,The Plough Leicester Road Ravenstone,https://www.nwleics.gov.uk/pages/brownfield_land_register,,not owned by a public authority,permissioned,full planning permission,,52.71903,-1.403498,0.3,14,14,,,18/00959/FULM with discharge of conditions in 2019. Demolition of existing public house and outbuildings and erection of 14 dwellings with alterations to existing access and provision of off-street parking and landscaping,8cd2737491d4098bc4d7bbdd2b9b2b82d7636a14a9f9ce807e0d0b2eadfff0d8
2019-12-15,local-authority-eng:NWL,BLR26,Canalside Patios 7 Shortheath Road Moira,https://www.nwleics.gov.uk/pages/brownfield_land_register,,not owned by a public authority,permissioned,outline planning permission,,52.735733,-1.53637,0.13,5,5,,,19/02060/REM under consideration| 14/01099/OUT. Erection of five dwellings (outline - access and layout only),8cd2737491d4098bc4d7bbdd2b9b2b82d7636a14a9f9ce807e0d0b2eadfff0d8
2019-12-15,local-authority-eng:NWL,BLR27,Saltersford Farm Measham Road Acresford,https://www.nwleics.gov.uk/pages/brownfield_land_register,,not owned by a public authority,permissioned,full planning permission,,52.709113,-1.542928,0.63,5,5,,,"17/01805/FUL. ""Conversion of barns to two dwellings, erection of three detached dwellings, demolition of existing buildings and associated works.""",8cd2737491d4098bc4d7bbdd2b9b2b82d7636a14a9f9ce807e0d0b2eadfff0d8
2019-12-15,local-authority-eng:NWL,BLR28,117 London Road Coalville,https://www.nwleics.gov.uk/pages/brownfield_land_register,,not owned by a public authority,permissioned,other,,52.721398,-1.361136,0.05,15,15,,,18/01631/PDNOTR. Prior approval notification for change of use of offices to 15 self-contained apartments including associated off street parking,8cd2737491d4098bc4d7bbdd2b9b2b82d7636a14a9f9ce807e0d0b2eadfff0d8
2019-12-15,local-authority-eng:NWL,BLR29,Crusher Yard Site Pipeyard Lane Works Pipeyard Lane Newbold,https://www.nwleics.gov.uk/pages/brownfield_land_register,,not owned by a public authority,permissioned,outline planning permission,,52.770035,-1.410316,0.38,6,6,,,"18/01534/OUT. ""Mixed use development comprising B1 (Office) premises and residential development of 6 no. dwellings, garaging and associated infrastructure (outline - access only)""",8cd2737491d4098bc4d7bbdd2b9b2b82d7636a14a9f9ce807e0d0b2eadfff0d8
2019-12-15,local-authority-eng:NWL,BLR30,Snibston Discovery Park Ashby Road Coalville,https://www.nwleics.gov.uk/pages/brownfield_land_register,,owned by a public authority,permissioned,outline planning permission,,52.725852,-1.385799,2.98,144,144,,,"17/01424/FULM (Hybrid application) | this is a hybrid application with the housing as the outline element. ""Residential development of up to 144 dwellings (Outline - all matters reserved) and erection of an extension to existing theatre to provide a cafe/visitor centre/rangers' office, installation of a play area, public realm works, landscaping and car parks (full)""",8cd2737491d4098bc4d7bbdd2b9b2b82d7636a14a9f9ce807e0d0b2eadfff0d8
