entry-date,organisation,site,site-address,site-plan-url,deliverable,ownership,planning-permission-status,planning-permission-type,hazardous-substances,latitude,longitude,hectares,minimum-net-dwellings,maximum-net-dwellings,start-date,end-date,notes,resource
2017-12-20,local-authority-eng:KIR,BLR_047,"Hinchcliffe Mill, Water Street, Holmbridge, Holmfirth, HD9 2NX",https://mapping.kirklees.gov.uk/connect/analyst/mobile/#/main?mapcfg=Kirklees%20Brownfield%20Land%20Register,yes,not owned by a public authority,not permissioned,,,53.56012,-1.80986,1.339,0,0,2017-12-20,,. Existing mill site potentially suitable for housing-led redevelopment.,93f7961f5e90ed8e26b632353221a0cc955a70fdbe3b0130c3d70ef03c5bb356
2017-12-20,local-authority-eng:KIR,BLR_046,"Former Midlothian Garage, New Mill Road, Holmfirth",https://mapping.kirklees.gov.uk/connect/analyst/mobile/#/main?mapcfg=Kirklees%20Brownfield%20Land%20Register,yes,not owned by a public authority,permissioned,outline planning permission,,53.57973,-1.7775,1.266,0,0,2017-12-20,,"Part of a larger site that includes some greenfield land, including woodland.. Outline permission for erection of 56 dwellings with associated car parking.",93f7961f5e90ed8e26b632353221a0cc955a70fdbe3b0130c3d70ef03c5bb356
2017-12-20,local-authority-eng:KIR,BLR_065,"Former Gees Garage, New Hey Road, Outlane, Huddersfield",https://mapping.kirklees.gov.uk/connect/analyst/mobile/#/main?mapcfg=Kirklees%20Brownfield%20Land%20Register,yes,not owned by a public authority,not permissioned,,,53.65924,-1.86773,0.374,0,0,2017-12-20,,Part of a larger site that contains some greenfield land.. Former commercial/industrial site potentially suitable for housing-led redevelopment.,93f7961f5e90ed8e26b632353221a0cc955a70fdbe3b0130c3d70ef03c5bb356
2017-12-20,local-authority-eng:KIR,BLR_059,"Park Mill, Manor Road, Clayton West",https://mapping.kirklees.gov.uk/connect/analyst/mobile/#/main?mapcfg=Kirklees%20Brownfield%20Land%20Register,yes,not owned by a public authority,not permissioned,,,53.60042,-1.60557,2.713,0,0,2017-12-20,,Part of a larger site that contains some greenfield land.. Former mill site potentially suitable for housing-led redevelopment.,93f7961f5e90ed8e26b632353221a0cc955a70fdbe3b0130c3d70ef03c5bb356
2017-12-20,local-authority-eng:KIR,BLR_053,"Former Storthes Hall Hospital, Storthes Hall Lane, Kirkburton, Huddersfield, HD8 0WA",https://mapping.kirklees.gov.uk/connect/analyst/mobile/#/main?mapcfg=Kirklees%20Brownfield%20Land%20Register,yes,not owned by a public authority,permissioned,reserved matters approval,,53.60875,-1.73017,28.839,0,0,2017-12-20,,Permission for 300 homes plus residential care home on southern part of site.. Part of site has permission for erection of continuing care retirement community of approx 300 units.,93f7961f5e90ed8e26b632353221a0cc955a70fdbe3b0130c3d70ef03c5bb356
2017-12-20,local-authority-eng:KIR,BLR_055,"Bank Bottom Mills, Mount Road, Marsden",https://mapping.kirklees.gov.uk/connect/analyst/mobile/#/main?mapcfg=Kirklees%20Brownfield%20Land%20Register,yes,not owned by a public authority,not permissioned,,,53.5968,-1.9295,3.26,0,0,2017-12-20,,". Former mill redevelopment site, suitable for mixed uses including dwellings.",93f7961f5e90ed8e26b632353221a0cc955a70fdbe3b0130c3d70ef03c5bb356
2017-12-20,local-authority-eng:KIR,BLR_051,"New Mills, Brougham Road, Marsden",https://mapping.kirklees.gov.uk/connect/analyst/mobile/#/main?mapcfg=Kirklees%20Brownfield%20Land%20Register,yes,not owned by a public authority,not permissioned,,,53.60183,-1.9256,1.716,0,0,2017-12-20,,. Former mill site potentially suitable for housing-led redevelopment.,93f7961f5e90ed8e26b632353221a0cc955a70fdbe3b0130c3d70ef03c5bb356
2017-12-20,local-authority-eng:KIR,BLR_045,"Dobroyd Mills, Hepworth Road, New Mill, Holmfirth, HD9 1AF",https://mapping.kirklees.gov.uk/connect/analyst/mobile/#/main?mapcfg=Kirklees%20Brownfield%20Land%20Register,yes,not owned by a public authority,pending decision,,,53.56137,-1.75443,2.546,0,0,2017-12-20,,"Part of a larger site that includes some greenfield land.. Pending application for demolition of existing buildings and change of use of existing mill building, including C3 (dwellinghouses).",93f7961f5e90ed8e26b632353221a0cc955a70fdbe3b0130c3d70ef03c5bb356
2018-12-18,local-authority-eng:KIR,BLR_062,"Holme Mills, West Slaithwaite Road, Slaithwaite",https://mapping.kirklees.gov.uk/connect/analyst/mobile/#/main?mapcfg=Kirklees%20Brownfield%20Land%20Register,,not owned by a public authority,not permissioned,,,53.61316,-1.90654,1.741,0,0,2017-12-20,,"Previously developed site in green belt. Any development would need to comply with NPPF Paragraphs 143-145.. Former industrial site in green belt, potentially suitable for housing-led redevelopment.",93f7961f5e90ed8e26b632353221a0cc955a70fdbe3b0130c3d70ef03c5bb356
2017-12-20,local-authority-eng:KIR,BLR_064,"Land to the east of, Abbey Road North, Shepley",https://mapping.kirklees.gov.uk/connect/analyst/mobile/#/main?mapcfg=Kirklees%20Brownfield%20Land%20Register,,not owned by a public authority,not permissioned,,,53.58543,-1.7019,0.371,0,0,2017-12-20,,". Former mill site, potentially suitable for housing-led redevelopment.",93f7961f5e90ed8e26b632353221a0cc955a70fdbe3b0130c3d70ef03c5bb356
2017-12-20,local-authority-eng:KIR,BLR_039,"Cellars Clough Mill, Manchester Road, Marsden, Huddersfield, HD7 6LY",https://mapping.kirklees.gov.uk/connect/analyst/mobile/#/main?mapcfg=Kirklees%20Brownfield%20Land%20Register,yes,not owned by a public authority,pending decision,,,53.60931,-1.91321,0.832,0,0,2017-12-20,,. Redundant mill site potentially suitable for housing-led redevelopment.,93f7961f5e90ed8e26b632353221a0cc955a70fdbe3b0130c3d70ef03c5bb356
2017-12-20,local-authority-eng:KIR,BLR_067,"Dene Bottom, Kirkburton, Huddersfield, HD8 0PP",https://mapping.kirklees.gov.uk/connect/analyst/mobile/#/main?mapcfg=Kirklees%20Brownfield%20Land%20Register,yes,not owned by a public authority,permissioned,full planning permission,,53.61586,-1.71581,0.354,0,0,2017-12-20,,". Permission for part demolition, conversion and extension of existing buildings to 9 residential units with associated car parking.",93f7961f5e90ed8e26b632353221a0cc955a70fdbe3b0130c3d70ef03c5bb356
2017-12-20,local-authority-eng:KIR,BLR_063,"Denby Dale Nursery School, Wakefield Road, Denby Dale, Huddersfield, HD8 8RX",https://mapping.kirklees.gov.uk/connect/analyst/mobile/#/main?mapcfg=Kirklees%20Brownfield%20Land%20Register,yes,not owned by a public authority,permissioned,full planning permission,,53.57384,-1.65372,0.17,0,0,2017-12-20,,". Permission for change of use of former nursery school to 4 apartments, conversion of former headmaster's house to dwelling and erection of 1 detached dwelling.",93f7961f5e90ed8e26b632353221a0cc955a70fdbe3b0130c3d70ef03c5bb356
2017-12-20,local-authority-eng:KIR,BLR_069,"444, Bradford Road, Batley, WF17 5LW",https://mapping.kirklees.gov.uk/connect/analyst/mobile/#/main?mapcfg=Kirklees%20Brownfield%20Land%20Register,,not owned by a public authority,permissioned,outline planning permission,,53.71441,-1.62811,0.366,0,0,2017-12-20,,. Outline permission for erection of residential development.,93f7961f5e90ed8e26b632353221a0cc955a70fdbe3b0130c3d70ef03c5bb356
2017-12-20,local-authority-eng:KIR,BLR_071,"Cleckheaton Mills, Bradford Road, Cleckheaton, BD19 5BD",https://mapping.kirklees.gov.uk/connect/analyst/mobile/#/main?mapcfg=Kirklees%20Brownfield%20Land%20Register,,not owned by a public authority,permissioned,full planning permission,,53.71952,-1.70667,2.66,0,0,2017-12-20,,. Former mill site with permission for proposed residential development.,93f7961f5e90ed8e26b632353221a0cc955a70fdbe3b0130c3d70ef03c5bb356
2017-12-20,local-authority-eng:KIR,BLR_085,"The Whitcliffe Hotel, Prospect Road, Cleckheaton",https://mapping.kirklees.gov.uk/connect/analyst/mobile/#/main?mapcfg=Kirklees%20Brownfield%20Land%20Register,yes,not owned by a public authority,permissioned,full planning permission,,53.72468,-1.71855,0.599,0,0,2017-12-20,,. Permission for demolition of existing hotel and erection of 15 dwellings.,93f7961f5e90ed8e26b632353221a0cc955a70fdbe3b0130c3d70ef03c5bb356
2017-12-20,local-authority-eng:KIR,BLR_090,"Calder Mould Services, Headlands Road, Liversedge, WF15 7NT",https://mapping.kirklees.gov.uk/connect/analyst/mobile/#/main?mapcfg=Kirklees%20Brownfield%20Land%20Register,,not owned by a public authority,permissioned,outline planning permission,,53.70651,-1.69624,1.197,0,0,2017-12-20,,,93f7961f5e90ed8e26b632353221a0cc955a70fdbe3b0130c3d70ef03c5bb356
2017-12-20,local-authority-eng:KIR,BLR_088,"Former Valley Works, Union Street, Heckmondwike",https://mapping.kirklees.gov.uk/connect/analyst/mobile/#/main?mapcfg=Kirklees%20Brownfield%20Land%20Register,yes,not owned by a public authority,permissioned,reserved matters approval,,53.70677,-1.68047,0.855,0,0,2017-12-20,,. Reserved matters approval for erection of 34 dwellings.,93f7961f5e90ed8e26b632353221a0cc955a70fdbe3b0130c3d70ef03c5bb356
2017-12-20,local-authority-eng:KIR,BLR_092,"Land to the east of, Hightown Road, Cleckheaton",https://mapping.kirklees.gov.uk/connect/analyst/mobile/#/main?mapcfg=Kirklees%20Brownfield%20Land%20Register,,not owned by a public authority,permissioned,reserved matters approval,,53.72128,-1.71521,1.327,0,0,2017-12-20,,. Reserved matters approval pursuant to outline permission 2015/90035 for erection of 44 dwellings,93f7961f5e90ed8e26b632353221a0cc955a70fdbe3b0130c3d70ef03c5bb356
2017-12-20,local-authority-eng:KIR,BLR_083,"Land east of, Boundary Street, Heckmondwike",https://mapping.kirklees.gov.uk/connect/analyst/mobile/#/main?mapcfg=Kirklees%20Brownfield%20Land%20Register,yes,not owned by a public authority,not permissioned,,,53.70816,-1.6805,0.596,0,0,2017-12-20,,"Part of a larger site that includes some greenfield land.. Redevelopment site potentially suitable for housing-led development, currently in use as surface car park.",93f7961f5e90ed8e26b632353221a0cc955a70fdbe3b0130c3d70ef03c5bb356
2017-12-20,local-authority-eng:KIR,BLR_076,"Land at, Squirrel Hill Reservoir, Staincliffe Road, Dewsbury Moor, Dewsbury",https://mapping.kirklees.gov.uk/connect/analyst/mobile/#/main?mapcfg=Kirklees%20Brownfield%20Land%20Register,,not owned by a public authority,not permissioned,,,53.70292,-1.65419,0.878,0,0,2017-12-20,,. Former covered reservoir redevelopment site.,93f7961f5e90ed8e26b632353221a0cc955a70fdbe3b0130c3d70ef03c5bb356
2017-12-20,local-authority-eng:KIR,BLR_079,"Spenborough Industrial Estate, Parker Street, Liversedge, WF15 7JX",https://mapping.kirklees.gov.uk/connect/analyst/mobile/#/main?mapcfg=Kirklees%20Brownfield%20Land%20Register,,not owned by a public authority,permissioned,full planning permission,,53.70558,-1.68176,0.516,0,0,2017-12-20,,". Redevelopment site, currently in industrial use. Permission for erection of 28 dwellings, formation of adopted roads and parking courts.",93f7961f5e90ed8e26b632353221a0cc955a70fdbe3b0130c3d70ef03c5bb356
2017-12-20,local-authority-eng:KIR,BLR_093,"Former Woodwell House, Mayman Lane, Mount Pleasant, Batley",https://mapping.kirklees.gov.uk/connect/analyst/mobile/#/main?mapcfg=Kirklees%20Brownfield%20Land%20Register,,owned by a public authority,not permissioned,,,53.71352,-1.64112,0.561,0,0,2017-12-20,,,93f7961f5e90ed8e26b632353221a0cc955a70fdbe3b0130c3d70ef03c5bb356
2017-12-20,local-authority-eng:KIR,BLR_091,"Land south west of Wards Hill, Batley",https://mapping.kirklees.gov.uk/connect/analyst/mobile/#/main?mapcfg=Kirklees%20Brownfield%20Land%20Register,yes,owned by a public authority,not permissioned,,,53.71268,-1.63132,0.549,0,0,2017-12-20,,". Former job centre and car park site, potentially suitable for housing-led redevelopment.",93f7961f5e90ed8e26b632353221a0cc955a70fdbe3b0130c3d70ef03c5bb356
2018-12-18,local-authority-eng:KIR,BLR_080,"Land at Moor Top, Far Common Road, Mirfield",https://mapping.kirklees.gov.uk/connect/analyst/mobile/#/main?mapcfg=Kirklees%20Brownfield%20Land%20Register,,not owned by a public authority,not permissioned,,,53.69404,-1.70899,0.805,0,0,2017-12-20,,"Previously developed (industrial) site in green belt. Any development would need to comply with NPPF Paragraphs 143-145.. Previously developed industrial site in green belt, potentially suitable for housing-led redevelopment.",93f7961f5e90ed8e26b632353221a0cc955a70fdbe3b0130c3d70ef03c5bb356
2018-12-18,local-authority-eng:KIR,BLR_089,"Land at, Serpentine Road, Cleckheaton, BD19 3NA",https://mapping.kirklees.gov.uk/connect/analyst/mobile/#/main?mapcfg=Kirklees%20Brownfield%20Land%20Register,,not owned by a public authority,permissioned,outline planning permission,,53.72586,-1.71494,1.383,0,0,2017-12-20,,". Erection of 43 retirement living apartments, 83 bed care home with provision of communal facilities, landscaping and car parking and erection of 7 affordable dwellings",93f7961f5e90ed8e26b632353221a0cc955a70fdbe3b0130c3d70ef03c5bb356
2017-12-20,local-authority-eng:KIR,BLR_075,"Brook House Mill, Balme Road, Cleckheaton",https://mapping.kirklees.gov.uk/connect/analyst/mobile/#/main?mapcfg=Kirklees%20Brownfield%20Land%20Register,,not owned by a public authority,not permissioned,,,53.73115,-1.71202,0.364,0,0,2017-12-20,,Part of a larger site that includes some greenfield land.. Former commercial/light industrial site potentially suitable for housing-led redevelopment..,93f7961f5e90ed8e26b632353221a0cc955a70fdbe3b0130c3d70ef03c5bb356
2018-12-18,local-authority-eng:KIR,BLR_078,"Former White Lee Colliery, Leeds Road, Heckmondwike",https://mapping.kirklees.gov.uk/connect/analyst/mobile/#/main?mapcfg=Kirklees%20Brownfield%20Land%20Register,,not owned by a public authority,not permissioned,,,53.72261,-1.66917,0.314,0,0,2017-12-20,,"Previously developed (former colliery) site in green belt. Any development would need to comply with NPPF Paragraphs 143-145.. Former colliery/industrial site, potentially suitable for housing-led development.",93f7961f5e90ed8e26b632353221a0cc955a70fdbe3b0130c3d70ef03c5bb356
2017-12-20,local-authority-eng:KIR,BLR_077,"Land west of, 19 Staincliffe Hall Road, Staincliffe, Batley",https://mapping.kirklees.gov.uk/connect/analyst/mobile/#/main?mapcfg=Kirklees%20Brownfield%20Land%20Register,,not owned by a public authority,not permissioned,,,53.70766,-1.65396,0.674,0,0,2017-12-20,,. Former covered reservoir site potentially suitable for housing-led redevelopment.,93f7961f5e90ed8e26b632353221a0cc955a70fdbe3b0130c3d70ef03c5bb356
2017-12-20,local-authority-eng:KIR,BLR_074,"Land adjacent, South Parade, Cleckheaton",https://mapping.kirklees.gov.uk/connect/analyst/mobile/#/main?mapcfg=Kirklees%20Brownfield%20Land%20Register,,not owned by a public authority,not permissioned,,,53.72303,-1.72472,0.372,0,0,2017-12-20,,Part of a larger site that includes some greenfield land.,93f7961f5e90ed8e26b632353221a0cc955a70fdbe3b0130c3d70ef03c5bb356
2018-12-18,local-authority-eng:KIR,BLR_072,"Land adjacent, Mayman Lane, Mount Pleasant, Batley",https://mapping.kirklees.gov.uk/connect/analyst/mobile/#/main?mapcfg=Kirklees%20Brownfield%20Land%20Register,yes,owned by a public authority,not permissioned,,,53.71312,-1.64201,1.189,0,0,2017-12-20,,. Transport depot site potentially suitable for housing-led redevelopment.,93f7961f5e90ed8e26b632353221a0cc955a70fdbe3b0130c3d70ef03c5bb356
2017-12-20,local-authority-eng:KIR,BLR_084,"Land south of Westgate, Cleckheaton",https://mapping.kirklees.gov.uk/connect/analyst/mobile/#/main?mapcfg=Kirklees%20Brownfield%20Land%20Register,yes,not owned by a public authority,not permissioned,,,53.72131,-1.72291,6.938,0,0,2017-12-20,,". Housing-led, mixed use redevelopment site.",93f7961f5e90ed8e26b632353221a0cc955a70fdbe3b0130c3d70ef03c5bb356
2018-12-18,local-authority-eng:KIR,BLR_094,"Land adjacent, Halifax Road, Hightown, Liversedge",https://mapping.kirklees.gov.uk/connect/analyst/mobile/#/main?mapcfg=Kirklees%20Brownfield%20Land%20Register,yes,not owned by a public authority,not permissioned,,,53.71031,-1.70157,0.362,0,0,2017-12-20,,Part of a larger site that includes some greenfield land.,93f7961f5e90ed8e26b632353221a0cc955a70fdbe3b0130c3d70ef03c5bb356
2018-12-18,local-authority-eng:KIR,BLR_095,"Former Parkham Foods Site, 395, Halifax Road, Liversedge, WF15 8DU",https://mapping.kirklees.gov.uk/connect/analyst/mobile/#/main?mapcfg=Kirklees%20Brownfield%20Land%20Register,yes,not owned by a public authority,permissioned,full planning permission,,53.71179,-1.71934,0.656,0,0,2017-12-20,,. Permission for erection of 14 dwellings with integral garages.,93f7961f5e90ed8e26b632353221a0cc955a70fdbe3b0130c3d70ef03c5bb356
2017-12-20,local-authority-eng:KIR,BLR_097,"Highgrove Beds Ltd, Spen Lane, Gomersal, Cleckheaton",https://mapping.kirklees.gov.uk/connect/analyst/mobile/#/main?mapcfg=Kirklees%20Brownfield%20Land%20Register,,not owned by a public authority,not permissioned,,,53.72944,-1.69437,1.453,0,0,2017-12-20,,,93f7961f5e90ed8e26b632353221a0cc955a70fdbe3b0130c3d70ef03c5bb356
2017-12-20,local-authority-eng:KIR,BLR_073,"Spafield Mills, Upper Road, Batley, WF17 7LR",https://mapping.kirklees.gov.uk/connect/analyst/mobile/#/main?mapcfg=Kirklees%20Brownfield%20Land%20Register,,not owned by a public authority,permissioned,outline planning permission,,53.70169,-1.63939,0.757,0,0,2017-12-20,,. Outline permission for residential development.,93f7961f5e90ed8e26b632353221a0cc955a70fdbe3b0130c3d70ef03c5bb356
2017-12-20,local-authority-eng:KIR,BLR_081,"Heaton Avenue First and Nursery School, Westcliffe Road, Cleckheaton, BD19 3EP",https://mapping.kirklees.gov.uk/connect/analyst/mobile/#/main?mapcfg=Kirklees%20Brownfield%20Land%20Register,yes,not owned by a public authority,permissioned,outline planning permission,,53.72551,-1.72366,0.355,0,0,2017-12-20,,. Outline permission for demolition of existing school building and erection of residential development.,93f7961f5e90ed8e26b632353221a0cc955a70fdbe3b0130c3d70ef03c5bb356
2017-12-20,local-authority-eng:KIR,BLR_082,"Land at, Gomersal Primary School, Oxford Road, Gomersal",https://mapping.kirklees.gov.uk/connect/analyst/mobile/#/main?mapcfg=Kirklees%20Brownfield%20Land%20Register,,owned by a public authority,not permissioned,,,53.73297,-1.6859,0.403,0,0,2017-12-20,,Part of a larger site that includes some greenfield land.,93f7961f5e90ed8e26b632353221a0cc955a70fdbe3b0130c3d70ef03c5bb356
2018-12-18,local-authority-eng:KIR,BLR_096,"Land Adjacent, Highmoor Lane, Hartshead",https://mapping.kirklees.gov.uk/connect/analyst/mobile/#/main?mapcfg=Kirklees%20Brownfield%20Land%20Register,yes,owned by a public authority,not permissioned,,,53.71782,-1.74275,1.624,0,0,2017-12-20,,". Former school site (demolished), potentially suitable for redevelopment as housing.",93f7961f5e90ed8e26b632353221a0cc955a70fdbe3b0130c3d70ef03c5bb356
2018-12-18,local-authority-eng:KIR,BLR_068,"Healey Nursery School, Healey Lane, Batley",https://mapping.kirklees.gov.uk/connect/analyst/mobile/#/main?mapcfg=Kirklees%20Brownfield%20Land%20Register,yes,owned by a public authority,permissioned,outline planning permission,,53.71182,-1.65737,0.558,0,0,2017-12-20,,. Outline permission for residential development (15 dwellings),93f7961f5e90ed8e26b632353221a0cc955a70fdbe3b0130c3d70ef03c5bb356
2017-12-20,local-authority-eng:KIR,BLR_087,"Site of former Atlas Works, Halifax Road, Liversedge, WF15 8HG",https://mapping.kirklees.gov.uk/connect/analyst/mobile/#/main?mapcfg=Kirklees%20Brownfield%20Land%20Register,yes,not owned by a public authority,permissioned,full planning permission,,53.71653,-1.73568,0.248,0,0,2017-12-20,,. Permission for erection of 10 dwellings.,93f7961f5e90ed8e26b632353221a0cc955a70fdbe3b0130c3d70ef03c5bb356
2017-12-20,local-authority-eng:KIR,BLR_086,"Hardy And Hanson Ltd Summit Works, Longlands Road, Dewsbury, WF13 4AB",https://mapping.kirklees.gov.uk/connect/analyst/mobile/#/main?mapcfg=Kirklees%20Brownfield%20Land%20Register,yes,not owned by a public authority,permissioned,full planning permission,,53.70257,-1.64719,0.227,0,0,2017-12-20,,. Permission for demolition of factory and erection of 8 dwellings.,93f7961f5e90ed8e26b632353221a0cc955a70fdbe3b0130c3d70ef03c5bb356
2018-12-18,local-authority-eng:KIR,BLR_102,"â€œWarwick Mills, Warwick Road, Batley, WF17 6BSâ€",https://mapping.kirklees.gov.uk/connect/analyst/mobile/#/main?mapcfg=Kirklees%20Brownfield%20Land%20Register,yes,not owned by a public authority,permissioned,full planning permission,,53.70494,-1.6306,0.165,0,0,2018-12-18,,. Part demolition and conversion of mill to form 18 residential units,93f7961f5e90ed8e26b632353221a0cc955a70fdbe3b0130c3d70ef03c5bb356
2018-12-18,local-authority-eng:KIR,BLR_103,"Denby Dale Nursery School, Wakefield Road, Denby Dale, Huddersfield, HD8 8RX ",https://mapping.kirklees.gov.uk/connect/analyst/mobile/#/main?mapcfg=Kirklees%20Brownfield%20Land%20Register,yes,owned by a public authority,permissioned,full planning permission,,53.57384,-1.65372,0.17,0,0,2018-12-18,,". Change of use of former nursery school to 4 apartments, conversion of former headmaster's house to dwelling and erection of 1 detached dwelling",93f7961f5e90ed8e26b632353221a0cc955a70fdbe3b0130c3d70ef03c5bb356
2018-12-18,local-authority-eng:KIR,BLR_100,"Land at, Ossett Lane, Earlsheaton, Dewsbury, WF12 8LY ",https://mapping.kirklees.gov.uk/connect/analyst/mobile/#/main?mapcfg=Kirklees%20Brownfield%20Land%20Register,yes,not owned by a public authority,permissioned,outline planning permission,,53.68622,-1.61197,0.249,0,0,2018-12-18,,. Outline application for erection of 10 dwellings,93f7961f5e90ed8e26b632353221a0cc955a70fdbe3b0130c3d70ef03c5bb356
2018-12-18,local-authority-eng:KIR,BLR_099,"Vale Works, 25, Morley Lane, Milnsbridge, Huddersfield, HD3 4NS",https://mapping.kirklees.gov.uk/connect/analyst/mobile/#/main?mapcfg=Kirklees%20Brownfield%20Land%20Register,yes,not owned by a public authority,permissioned,full planning permission,,53.63915,-1.82732,0.138,0,0,2018-12-18,,. Demolition of existing industrial buildings and erection of 18 apartments,93f7961f5e90ed8e26b632353221a0cc955a70fdbe3b0130c3d70ef03c5bb356
2018-12-18,local-authority-eng:KIR,BLR_098,"Oakroyd Hall, West Yorkshire Fire And Rescue Service Headquarters, Bradford Road, Birkenshaw, BD11 2DY",https://mapping.kirklees.gov.uk/connect/analyst/mobile/#/main?mapcfg=Kirklees%20Brownfield%20Land%20Register,yes,owned by a public authority,permissioned,full planning permission,,53.74866,-1.69509,0.455,0,0,2018-12-20,,Part of a larger site that includes some greenfield land.. Demolition of existing buildings and erection of 30 dwellings with associated garages and parking,93f7961f5e90ed8e26b632353221a0cc955a70fdbe3b0130c3d70ef03c5bb356
2018-12-18,local-authority-eng:KIR,BLR_101,"The Old Tannery, 224, Spen Lane, Gomersal, BD19 4PJ ",https://mapping.kirklees.gov.uk/connect/analyst/mobile/#/main?mapcfg=Kirklees%20Brownfield%20Land%20Register,yes,not owned by a public authority,permissioned,full planning permission,,53.72804,-1.69923,0.15,0,0,2018-12-18,,Previously developed site in green belt. Any development would need to comply with NPPF Paragraphs 143-145.. Change of use of part of commercial site for erection of 5 houses with associated access and demolition of existing extensions to commercial building,93f7961f5e90ed8e26b632353221a0cc955a70fdbe3b0130c3d70ef03c5bb356
2018-12-18,local-authority-eng:KIR,BLR_105,"Puma Distribution Unit, Grange Road, Batley",https://mapping.kirklees.gov.uk/connect/analyst/mobile/#/main?mapcfg=Kirklees%20Brownfield%20Land%20Register,yes,not owned by a public authority,not permissioned,,,53.70993,-1.61638,2.181,0,0,2018-12-18,,The site is located within an area designated in the emerging Local Plan as a Priority Employment Area (B&S1).  Development of the site for housing would need to comply with Policy PLP 8 of the emerging Local Plan.. The site is located within an area designated within the emerging Local Plan as a Priority Employment Area (B&S1).  Development of the site for housing would need to comply with Policy PLP 8 of the emerging Local Plan (B&S1).,93f7961f5e90ed8e26b632353221a0cc955a70fdbe3b0130c3d70ef03c5bb356
2018-12-18,local-authority-eng:KIR,BLR_104,"Pennine Garden Centre site, Huddersfield Road near Shelley",https://mapping.kirklees.gov.uk/connect/analyst/mobile/#/main?mapcfg=Kirklees%20Brownfield%20Land%20Register,yes,not owned by a public authority,not permissioned,,,53.5968,-1.68356,1.5,0,0,2018-12-18,,Previously developed site in green belt. Any development would need to comply with NPPF Paragraphs 143-145.. The site is a previously developed site within the green belt.  Re-development of the site could take place subject to satisfying paragraphs 143-145 of NPPF.,93f7961f5e90ed8e26b632353221a0cc955a70fdbe3b0130c3d70ef03c5bb356
