entry-date,organisation,site,site-address,site-plan-url,deliverable,ownership,planning-permission-status,planning-permission-type,hazardous-substances,latitude,longitude,hectares,minimum-net-dwellings,maximum-net-dwellings,start-date,end-date,resource
,local-authority-eng:CHW,MAR/0019,"Land north of Chapel Street, Wincham",http://consult.cheshirewestandchester.gov.uk/portal/cwc_ldf/land/blr?tab=files,,not owned by a public authority,not permissioned,,,53.273377,-2.490547,1.97,,,2017-12-21,,a28ab5b077b2881b307a9055ca692b548784af55fdeb821da957363d6d356d6b
,local-authority-eng:CHW,MAR/0039,"Land to rear of The Cedars, Chapel Lane, Wincham",http://consult.cheshirewestandchester.gov.uk/portal/cwc_ldf/land/blr?tab=files,,,not permissioned,,,53.270679,-2.486648,,,,2018-12-30,,a28ab5b077b2881b307a9055ca692b548784af55fdeb821da957363d6d356d6b
2018-12-30,local-authority-eng:CHW,MAR/0059(a),"Land at 7 Tunnel Road, Barnton, Northwich",http://consult.cheshirewestandchester.gov.uk/portal/cwc_ldf/land/blr?tab=files,,not owned by a public authority,not permissioned,,,53.268937,-2.548163,,,,2017-12-21,,a28ab5b077b2881b307a9055ca692b548784af55fdeb821da957363d6d356d6b
2018-12-30,local-authority-eng:CHW,MAR/0061,"Land to rear of Brown Owl PH car park, Church Road, Barnton, Northwich",http://consult.cheshirewestandchester.gov.uk/portal/cwc_ldf/land/blr?tab=files,,not owned by a public authority,not permissioned,,,53.270137,-2.545404,,,,2017-12-21,,a28ab5b077b2881b307a9055ca692b548784af55fdeb821da957363d6d356d6b
,local-authority-eng:CHW,MAR/0062,"Malvern House (adjacent to Daisy Bank), Old Road, Anderton with Marbury, Northwich. CW9 6AG",http://consult.cheshirewestandchester.gov.uk/portal/cwc_ldf/land/blr?tab=files,yes,not owned by a public authority,permissioned,outline planning permission,,53.273588,-2.533452,0.63,,,2017-12-21,,a28ab5b077b2881b307a9055ca692b548784af55fdeb821da957363d6d356d6b
,local-authority-eng:CHW,MAR/0063,"Garage site off Townfield Lane, Barnton, Northwich",http://consult.cheshirewestandchester.gov.uk/portal/cwc_ldf/land/blr?tab=files,yes,not owned by a public authority,permissioned,full planning permission,,53.27615,-2.553264,0.214,,,2018-12-30,,a28ab5b077b2881b307a9055ca692b548784af55fdeb821da957363d6d356d6b
,local-authority-eng:CHW,MAR/0104,"Black Greyhound Hotel, Hall Lane, Wincham, Northwich. CW9 6DG",http://consult.cheshirewestandchester.gov.uk/portal/cwc_ldf/land/blr?tab=files,yes,not owned by a public authority,permissioned,outline planning permission,,53.278252,-2.47874,0.78,,,2018-12-30,,a28ab5b077b2881b307a9055ca692b548784af55fdeb821da957363d6d356d6b
,local-authority-eng:CHW,NES/0034,"8 to 30 Brook Street, Neston",http://consult.cheshirewestandchester.gov.uk/portal/cwc_ldf/land/blr?tab=files,,mixed ownership,not permissioned,,,53.289837,-3.062921,0.14,,,2017-12-21,,a28ab5b077b2881b307a9055ca692b548784af55fdeb821da957363d6d356d6b
,local-authority-eng:CHW,NET/0005(a),"Land off Netherpool Road, Ellesmere Port",http://consult.cheshirewestandchester.gov.uk/portal/cwc_ldf/land/blr?tab=files,,not owned by a public authority,not permissioned,,,53.2921,-2.920619,0.38,,,2017-12-21,,a28ab5b077b2881b307a9055ca692b548784af55fdeb821da957363d6d356d6b
,local-authority-eng:CHW,NET/0013,"Site of former Foxfields Public House, Poole Hall Road, Ellesmere Port",http://consult.cheshirewestandchester.gov.uk/portal/cwc_ldf/land/blr?tab=files,,owned by a public authority,not permissioned,,,53.294593,-2.920162,0.71,,,2017-12-21,,a28ab5b077b2881b307a9055ca692b548784af55fdeb821da957363d6d356d6b
,local-authority-eng:CHW,NEW/,"Land off Liverpool Road (Total Fitness site), Chester",http://consult.cheshirewestandchester.gov.uk/portal/cwc_ldf/land/blr?tab=files,yes,not owned by a public authority,not permissioned,,,53.201493,-2.895396,0.98,,,2018-12-30,,a28ab5b077b2881b307a9055ca692b548784af55fdeb821da957363d6d356d6b
,local-authority-eng:CHW,PAR/0032,"24-28 Bridge Street, Neston, CH64 9UL",http://consult.cheshirewestandchester.gov.uk/portal/cwc_ldf/land/blr?tab=files,,,not permissioned,,,53.288412,-3.062451,,,,2018-12-30,,a28ab5b077b2881b307a9055ca692b548784af55fdeb821da957363d6d356d6b
,local-authority-eng:CHW,ROS/0002,"Rossfield Park Development (Sites 2C, 3 and 4), Rossfield Road, Ellesmere Port",http://consult.cheshirewestandchester.gov.uk/portal/cwc_ldf/land/blr?tab=files,,not owned by a public authority,permissioned,outline planning permission,,53.284014,-2.906,5.64,,,2017-12-21,,a28ab5b077b2881b307a9055ca692b548784af55fdeb821da957363d6d356d6b
,local-authority-eng:CHW,ROS/0010,"Land at Crescent Road, off Meadow Lane, Ellesmere Port",http://consult.cheshirewestandchester.gov.uk/portal/cwc_ldf/land/blr?tab=files,,owned by a public authority,not permissioned,,,53.283875,-2.892183,0.7,,,2017-12-21,,a28ab5b077b2881b307a9055ca692b548784af55fdeb821da957363d6d356d6b
,local-authority-eng:CHW,ROS/0027,"Rossfield Park Development (Site 5:Rossbank Road), Ellesmere Port (Persimmon)",http://consult.cheshirewestandchester.gov.uk/portal/cwc_ldf/land/blr?tab=files,,not owned by a public authority,permissioned,outline planning permission,,53.287058,-2.90992,4.87,,,2017-12-21,,a28ab5b077b2881b307a9055ca692b548784af55fdeb821da957363d6d356d6b
,local-authority-eng:CHW,ROS/0028,"Land at Rosswood Road / Rossfield Road, Ellesmere Port",http://consult.cheshirewestandchester.gov.uk/portal/cwc_ldf/land/blr?tab=files,,not owned by a public authority,not permissioned,,,53.284861,-2.910368,0.65,,,2017-12-21,,a28ab5b077b2881b307a9055ca692b548784af55fdeb821da957363d6d356d6b
,local-authority-eng:CHW,ROS/0029,"Land at Rossmore Road East / Rossfield Road North, Ellesmere Port",http://consult.cheshirewestandchester.gov.uk/portal/cwc_ldf/land/blr?tab=files,,not owned by a public authority,not permissioned,,,53.289285,-2.908992,1.39,,,2017-12-21,,a28ab5b077b2881b307a9055ca692b548784af55fdeb821da957363d6d356d6b
,local-authority-eng:CHW,ROS/0031,"Land south of Meadow Lane (former Van Leer / Hansteen site), Ellesmere Port",http://consult.cheshirewestandchester.gov.uk/portal/cwc_ldf/land/blr?tab=files,,not owned by a public authority,permissioned,outline planning permission,,53.282768,-2.891215,3.94,,,2017-12-21,,a28ab5b077b2881b307a9055ca692b548784af55fdeb821da957363d6d356d6b
,local-authority-eng:CHW,ROS/0032,"Rear of 70-88 Grace Road, New Grosvenor Road, Ellesmere Port",http://consult.cheshirewestandchester.gov.uk/portal/cwc_ldf/land/blr?tab=files,,not owned by a public authority,not permissioned,,,53.286708,-2.901572,0.42,,,2017-12-21,,a28ab5b077b2881b307a9055ca692b548784af55fdeb821da957363d6d356d6b
,local-authority-eng:CHW,SAM/0083a,"Mollington Grange Business Park, Parkgate Road, Mollington, Chester",http://consult.cheshirewestandchester.gov.uk/portal/cwc_ldf/land/blr?tab=files,yes,not owned by a public authority,permissioned,,,53.21793,-2.918308,,,,2018-12-30,,a28ab5b077b2881b307a9055ca692b548784af55fdeb821da957363d6d356d6b
,local-authority-eng:CHW,SHA/0002,"413 Manchester Road, Lostock Gralam, Northwich",http://consult.cheshirewestandchester.gov.uk/portal/cwc_ldf/land/blr?tab=files,,not owned by a public authority,not permissioned,,,53.271069,-2.465525,0.53,,,2017-12-21,,a28ab5b077b2881b307a9055ca692b548784af55fdeb821da957363d6d356d6b
,local-authority-eng:CHW,SHA/0089,"Goostrey Business Park, New Platt Lane, Allostock, Northwich CW4 8NN",http://consult.cheshirewestandchester.gov.uk/portal/cwc_ldf/land/blr?tab=files,yes,not owned by a public authority,permissioned,full planning permission,,53.229013,-2.37814,0.36,,,2017-12-21,,a28ab5b077b2881b307a9055ca692b548784af55fdeb821da957363d6d356d6b
,local-authority-eng:CHW,SHA/0106,"411 Manchester Road, Lostock Gralam, Northwich",http://consult.cheshirewestandchester.gov.uk/portal/cwc_ldf/land/blr?tab=files,yes,not owned by a public authority,permissioned,full planning permission,,53.270577,-2.467094,0.78,,,2018-12-30,,a28ab5b077b2881b307a9055ca692b548784af55fdeb821da957363d6d356d6b
,local-authority-eng:CHW,STP/0002,"Eccleston Avenue (garage court), Ellesmere Port",http://consult.cheshirewestandchester.gov.uk/portal/cwc_ldf/land/blr?tab=files,,owned by a public authority,not permissioned,,,53.279252,-2.924452,0.24,,,2017-12-21,,a28ab5b077b2881b307a9055ca692b548784af55fdeb821da957363d6d356d6b
,local-authority-eng:CHW,STP/0003,"Overpool Road (garage court), Ellesmere Port",http://consult.cheshirewestandchester.gov.uk/portal/cwc_ldf/land/blr?tab=files,,owned by a public authority,not permissioned,,,53.281749,-2.924596,0.23,,,2017-12-21,,a28ab5b077b2881b307a9055ca692b548784af55fdeb821da957363d6d356d6b
,local-authority-eng:CHW,STP/0005,"The Sutton Way PH, Sutton Way, Ellesmere Port",http://consult.cheshirewestandchester.gov.uk/portal/cwc_ldf/land/blr?tab=files,,not owned by a public authority,not permissioned,,,53.2762,-2.926186,0.28,,,2017-12-21,,a28ab5b077b2881b307a9055ca692b548784af55fdeb821da957363d6d356d6b
,local-authority-eng:CHW,STP/0006,"Sutton High School, Woodchurch Lane /Mill Lane, Ellesmere Port",http://consult.cheshirewestandchester.gov.uk/portal/cwc_ldf/land/blr?tab=files,,owned by a public authority,not permissioned,,,53.281682,-2.927459,1.39,,,2017-12-21,,a28ab5b077b2881b307a9055ca692b548784af55fdeb821da957363d6d356d6b
,local-authority-eng:CHW,STP/0034,"Land at Chester Road, Ellesmere Port, CH66 3RJ",http://consult.cheshirewestandchester.gov.uk/portal/cwc_ldf/land/blr?tab=files,,not owned by a public authority,not permissioned,,,53.281329,-2.941565,0.26,,,2017-12-21,,a28ab5b077b2881b307a9055ca692b548784af55fdeb821da957363d6d356d6b
,local-authority-eng:CHW,STP/0040,"Rivacre Business Centre, Mill Lane, Great Sutton, Ellesmere Port CH66 3TL",http://consult.cheshirewestandchester.gov.uk/portal/cwc_ldf/land/blr?tab=files,,owned by a public authority,not permissioned,,,53.280266,-2.926919,1.37,,,2017-12-21,,a28ab5b077b2881b307a9055ca692b548784af55fdeb821da957363d6d356d6b
,local-authority-eng:CHW,STR/0007,"Chester Road Garden Centre, Great Sutton, Ellesmere Port",http://consult.cheshirewestandchester.gov.uk/portal/cwc_ldf/land/blr?tab=files,,not owned by a public authority,not permissioned,,,53.259534,-2.927325,1.17,,,2017-12-21,,a28ab5b077b2881b307a9055ca692b548784af55fdeb821da957363d6d356d6b
,local-authority-eng:CHW,SUT/0004,"Garage Court, Carlyle Crescent, Ellesmere Port",http://consult.cheshirewestandchester.gov.uk/portal/cwc_ldf/land/blr?tab=files,,not owned by a public authority,not permissioned,,,53.273938,-2.925687,0.28,,,2017-12-21,,a28ab5b077b2881b307a9055ca692b548784af55fdeb821da957363d6d356d6b
,local-authority-eng:CHW,TAK/0020A,"Land at former Haulage Yard site, Chester Road, Oakmere, Northwich",http://consult.cheshirewestandchester.gov.uk/portal/cwc_ldf/land/blr?tab=files,yes,not owned by a public authority,permissioned,full planning permission,,53.212555,-2.652472,1.14,,,2017-12-21,,a28ab5b077b2881b307a9055ca692b548784af55fdeb821da957363d6d356d6b
,local-authority-eng:CHW,TAK/0020B,"Land at former Haulage Yard site, off Shakerley Close, Oakmere, Northwich",http://consult.cheshirewestandchester.gov.uk/portal/cwc_ldf/land/blr?tab=files,yes,not owned by a public authority,permissioned,outline planning permission,,53.213087,-2.652166,0.28,,,2017-12-21,,a28ab5b077b2881b307a9055ca692b548784af55fdeb821da957363d6d356d6b
,local-authority-eng:CHW,TAK/0070,"Chester Road Nursery, Chester Road, Kelsall, CW6 0RN",http://consult.cheshirewestandchester.gov.uk/portal/cwc_ldf/land/blr?tab=files,yes,not owned by a public authority,permissioned,full planning permission,,53.207165,-2.723435,0.35,,,2018-12-30,,a28ab5b077b2881b307a9055ca692b548784af55fdeb821da957363d6d356d6b
,local-authority-eng:CHW,TAK/0115,Ottersbank Farm Fishpool Road Delamere Northwich Cheshire CW8 2HP,http://consult.cheshirewestandchester.gov.uk/portal/cwc_ldf/land/blr?tab=files,yes,not owned by a public authority,permissioned,full planning permission,,53.199193,-2.648242,0.14,,,2017-12-21,,a28ab5b077b2881b307a9055ca692b548784af55fdeb821da957363d6d356d6b
,local-authority-eng:CHW,TAK/0137,"The Gables, Chester Road, Oakmere, Northwich CW8 2HB",http://consult.cheshirewestandchester.gov.uk/portal/cwc_ldf/land/blr?tab=files,yes,not owned by a public authority,permissioned,outline planning permission,,53.213144,-2.65323,0.32,,,2017-12-21,,a28ab5b077b2881b307a9055ca692b548784af55fdeb821da957363d6d356d6b
,local-authority-eng:CHW,TAT/0026(a),"Beeston Cattle Auction site, Whitchurch Road, Beeston, Chester Cheshire",http://consult.cheshirewestandchester.gov.uk/portal/cwc_ldf/land/blr?tab=files,,not owned by a public authority,permissioned,outline planning permission,,53.132465,-2.669746,4.72,,,2017-12-21,,a28ab5b077b2881b307a9055ca692b548784af55fdeb821da957363d6d356d6b
,local-authority-eng:CHW,TAT/0047(a),"Blackham Reclamation Yard, Tattenhall Road, Newton by Tattenhall, Chester, CH3 9QQ",http://consult.cheshirewestandchester.gov.uk/portal/cwc_ldf/land/blr?tab=files,yes,not owned by a public authority,permissioned,reserved matters approval,,53.137465,-2.756434,0.48,,,2017-12-21,,a28ab5b077b2881b307a9055ca692b548784af55fdeb821da957363d6d356d6b
,local-authority-eng:CHW,TAT/0090,"Land at The Oak Room, Tattenhall Road, Newton by Tattenhall, CH3 9BD",http://consult.cheshirewestandchester.gov.uk/portal/cwc_ldf/land/blr?tab=files,yes,not owned by a public authority,permissioned,full planning permission,,53.137576,-2.758753,0.78,,,2017-12-21,,a28ab5b077b2881b307a9055ca692b548784af55fdeb821da957363d6d356d6b
,local-authority-eng:CHW,TAT/0097,"The former Oak Room Public House, Tattenhall Road, Newton By Tattenhall Chester",http://consult.cheshirewestandchester.gov.uk/portal/cwc_ldf/land/blr?tab=files,yes,not owned by a public authority,permissioned,full planning permission,,53.137381,-2.758361,0.16,,,2017-12-21,,a28ab5b077b2881b307a9055ca692b548784af55fdeb821da957363d6d356d6b
,local-authority-eng:CHW,UPT/0005(a),"Former The Gamekeeper PH, (Plush Spice) Newhall Road, Upton, Chester, CH2 1TB",http://consult.cheshirewestandchester.gov.uk/portal/cwc_ldf/land/blr?tab=files,yes,not owned by a public authority,permissioned,outline planning permission,,53.214329,-2.879805,0.13,,,2017-12-21,,a28ab5b077b2881b307a9055ca692b548784af55fdeb821da957363d6d356d6b
2018-12-30,local-authority-eng:CHW,UPT/0047,"UPTON DENE (Phase 3): Land off Upton Grange, Liverpool Road, Chester",http://consult.cheshirewestandchester.gov.uk/portal/cwc_ldf/land/blr?tab=files,yes,not owned by a public authority,permissioned,full planning permission,,53.212626,-2.900764,3.11,,,2017-12-21,,a28ab5b077b2881b307a9055ca692b548784af55fdeb821da957363d6d356d6b
,local-authority-eng:CHW,WEC/0006,"Briar Lane garage court, Weaverham",http://consult.cheshirewestandchester.gov.uk/portal/cwc_ldf/land/blr?tab=files,,not owned by a public authority,not permissioned,,,53.255743,-2.570928,0.26,,,2017-12-21,,a28ab5b077b2881b307a9055ca692b548784af55fdeb821da957363d6d356d6b
,local-authority-eng:CHW,WEC/0054,"Mere Brow, Sandy Lane, Weaverham, Northwich, CW8 3PX",http://consult.cheshirewestandchester.gov.uk/portal/cwc_ldf/land/blr?tab=files,yes,not owned by a public authority,permissioned,full planning permission,,53.268731,-2.591373,,,,2018-12-30,,a28ab5b077b2881b307a9055ca692b548784af55fdeb821da957363d6d356d6b
2018-12-30,local-authority-eng:CHW,WHI/0016(a),"Site of former Royal British Legion, Stanney Lane, Whitby, Ellesmere Port",http://consult.cheshirewestandchester.gov.uk/portal/cwc_ldf/land/blr?tab=files,,not owned by a public authority,not permissioned,,,53.27148,-2.899212,,,,2017-12-21,,a28ab5b077b2881b307a9055ca692b548784af55fdeb821da957363d6d356d6b
,local-authority-eng:CHW,WHI/0017,"Mealors Yard, rear of 94 Chester Road, Whitby, Ellesmere Port, CH65 6RY",http://consult.cheshirewestandchester.gov.uk/portal/cwc_ldf/land/blr?tab=files,yes,not owned by a public authority,permissioned,outline planning permission,,53.269779,-2.911322,,,,2018-12-30,,a28ab5b077b2881b307a9055ca692b548784af55fdeb821da957363d6d356d6b
,local-authority-eng:CHW,WIC/0007,"Land east of Winnington Avenue, Winnington",http://consult.cheshirewestandchester.gov.uk/portal/cwc_ldf/land/blr?tab=files,,not owned by a public authority,not permissioned,,,53.255491,-2.540137,6.02,,,2017-12-21,,a28ab5b077b2881b307a9055ca692b548784af55fdeb821da957363d6d356d6b
,local-authority-eng:CHW,WIC/0009(a),"Land at Lock Street, Northwich",http://consult.cheshirewestandchester.gov.uk/portal/cwc_ldf/land/blr?tab=files,,,not permissioned,,,53.260988,-2.516715,0.21,,,2017-12-21,,a28ab5b077b2881b307a9055ca692b548784af55fdeb821da957363d6d356d6b
,local-authority-eng:CHW,WIC/0010,"British Waterways site, Navigation Road, Northwich",http://consult.cheshirewestandchester.gov.uk/portal/cwc_ldf/land/blr?tab=files,,not owned by a public authority,not permissioned,,,53.257131,-2.516953,1.26,,,2017-12-21,,a28ab5b077b2881b307a9055ca692b548784af55fdeb821da957363d6d356d6b
,local-authority-eng:CHW,WIC/0032,"Land at Weaver Shipyard, Saxons Lane, Northwich",http://consult.cheshirewestandchester.gov.uk/portal/cwc_ldf/land/blr?tab=files,,not owned by a public authority,not permissioned,,,53.248189,-2.52254,2.98,,,2017-12-21,,a28ab5b077b2881b307a9055ca692b548784af55fdeb821da957363d6d356d6b
,local-authority-eng:CHW,WIC/0045,"Yoxalls Joinery, Winnington Avenue, Northwich, CW8 4EE",http://consult.cheshirewestandchester.gov.uk/portal/cwc_ldf/land/blr?tab=files,yes,not owned by a public authority,permissioned,outline planning permission,,53.261973,-2.53779,,,,2018-12-30,,a28ab5b077b2881b307a9055ca692b548784af55fdeb821da957363d6d356d6b
,local-authority-eng:CHW,WIC/0049,"TATA Works site, land at Winnington Works, Northwich",http://consult.cheshirewestandchester.gov.uk/portal/cwc_ldf/land/blr?tab=files,,,not permissioned,,,53.268324,-2.528708,58.55,,,2017-12-21,,a28ab5b077b2881b307a9055ca692b548784af55fdeb821da957363d6d356d6b
2018-12-30,local-authority-eng:CHW,WIC/0050,"Land at Winnington Business Park, Winnington Avenue, Northwich",http://consult.cheshirewestandchester.gov.uk/portal/cwc_ldf/land/blr?tab=files,yes,,pending decision,,,53.257235,-2.53806,6.15,,,2017-12-21,,a28ab5b077b2881b307a9055ca692b548784af55fdeb821da957363d6d356d6b
,local-authority-eng:CHW,WIC/0058(a),"Castleleigh Centre, David Street, Northwich",http://consult.cheshirewestandchester.gov.uk/portal/cwc_ldf/land/blr?tab=files,,owned by a public authority,not permissioned,,,53.254415,-2.521327,0.62,,,2017-12-21,,a28ab5b077b2881b307a9055ca692b548784af55fdeb821da957363d6d356d6b
,local-authority-eng:CHW,WIC/0062,"Land to the north of Watling Street, Northwich",http://consult.cheshirewestandchester.gov.uk/portal/cwc_ldf/land/blr?tab=files,,,not permissioned,,,53.261247,-2.512925,2.28,,,2017-12-21,,a28ab5b077b2881b307a9055ca692b548784af55fdeb821da957363d6d356d6b
,local-authority-eng:CHW,WIC/0072,"Land at Station Road, Northwich",http://consult.cheshirewestandchester.gov.uk/portal/cwc_ldf/land/blr?tab=files,,not owned by a public authority,not permissioned,,,53.261852,-2.501629,1.78,,,2017-12-21,,a28ab5b077b2881b307a9055ca692b548784af55fdeb821da957363d6d356d6b
,local-authority-eng:CHW,WIC/0073(a),"Land south of Chester Road, Northwich",http://consult.cheshirewestandchester.gov.uk/portal/cwc_ldf/land/blr?tab=files,,not owned by a public authority,not permissioned,,,53.262774,-2.498371,0.73,,,2017-12-21,,a28ab5b077b2881b307a9055ca692b548784af55fdeb821da957363d6d356d6b
,local-authority-eng:CHW,WIC/0075,"Watling Street (Council offices), Northwich",http://consult.cheshirewestandchester.gov.uk/portal/cwc_ldf/land/blr?tab=files,,owned by a public authority,not permissioned,,,53.260276,-2.513018,0.7,,,2017-12-21,,a28ab5b077b2881b307a9055ca692b548784af55fdeb821da957363d6d356d6b
,local-authority-eng:CHW,WIC/0076,"Weaver Shopping extension, Chester Way, Northwich",http://consult.cheshirewestandchester.gov.uk/portal/cwc_ldf/land/blr?tab=files,,,not permissioned,,,53.261457,-2.510109,0.72,,,2017-12-21,,a28ab5b077b2881b307a9055ca692b548784af55fdeb821da957363d6d356d6b
,local-authority-eng:CHW,WIC/0077,"Land to west of Warrington Street, Northwich",http://consult.cheshirewestandchester.gov.uk/portal/cwc_ldf/land/blr?tab=files,,not owned by a public authority,not permissioned,,,53.263462,-2.505801,3.17,,,2017-12-21,,a28ab5b077b2881b307a9055ca692b548784af55fdeb821da957363d6d356d6b
,local-authority-eng:CHW,WIC/0078,"Land at Leicester Street, Northwich",http://consult.cheshirewestandchester.gov.uk/portal/cwc_ldf/land/blr?tab=files,,,not permissioned,,,53.263537,-2.502983,1.81,,,2017-12-21,,a28ab5b077b2881b307a9055ca692b548784af55fdeb821da957363d6d356d6b
,local-authority-eng:CHW,WIC/0082(a),"Land west of Queen Street, Northwich",http://consult.cheshirewestandchester.gov.uk/portal/cwc_ldf/land/blr?tab=files,,not owned by a public authority,not permissioned,,,53.25749,-2.514934,1.12,,,2017-12-21,,a28ab5b077b2881b307a9055ca692b548784af55fdeb821da957363d6d356d6b
,local-authority-eng:CHW,WIC/0086,"Land at Chester Way, Victoria Bridge, Northwich",http://consult.cheshirewestandchester.gov.uk/portal/cwc_ldf/land/blr?tab=files,,not owned by a public authority,permissioned,full planning permission,,53.259559,-2.512425,0.29,,,2017-12-21,,a28ab5b077b2881b307a9055ca692b548784af55fdeb821da957363d6d356d6b
,local-authority-eng:CHW,WIC/0088,Dane House Chester Way Northwich Cheshire CW9 5JG ,http://consult.cheshirewestandchester.gov.uk/portal/cwc_ldf/land/blr?tab=files,yes,not owned by a public authority,permissioned,planning permission granted under an order,,53.259236,-2.512316,0.11,,,2017-12-21,,a28ab5b077b2881b307a9055ca692b548784af55fdeb821da957363d6d356d6b
,local-authority-eng:CHW,WIC/0142,"Rear of 56-58 Church Road, Northwich, CW9 5NY",http://consult.cheshirewestandchester.gov.uk/portal/cwc_ldf/land/blr?tab=files,yes,not owned by a public authority,permissioned,outline planning permission,,53.261292,-2.500243,,,,2018-12-30,,a28ab5b077b2881b307a9055ca692b548784af55fdeb821da957363d6d356d6b
,local-authority-eng:CHW,WIR/0031(a),"School Road North (former coal yard), Rudheath",http://consult.cheshirewestandchester.gov.uk/portal/cwc_ldf/land/blr?tab=files,,not owned by a public authority,not permissioned,,,53.250844,-2.476756,0.19,,,2017-12-21,,a28ab5b077b2881b307a9055ca692b548784af55fdeb821da957363d6d356d6b
,local-authority-eng:CHW,WIR/0033,"Land to the rear of Farmers Arms PH, Middlewich Road, Northwich (Phase II)",http://consult.cheshirewestandchester.gov.uk/portal/cwc_ldf/land/blr?tab=files,,not owned by a public authority,not permissioned,,,53.25788,-2.486158,2.47,,,2017-12-21,,a28ab5b077b2881b307a9055ca692b548784af55fdeb821da957363d6d356d6b
,local-authority-eng:CHW,WIR/0047,"Bridge View, King Street, Rudheath, Northwich, CW9 7RW",http://consult.cheshirewestandchester.gov.uk/portal/cwc_ldf/land/blr?tab=files,yes,not owned by a public authority,permissioned,full planning permission,,53.253663,-2.475408,,,,2018-12-30,,a28ab5b077b2881b307a9055ca692b548784af55fdeb821da957363d6d356d6b
,local-authority-eng:CHW,WIT/0021,"Cane House, Waterworks Lane, Hooton, Ellesmere Port",http://consult.cheshirewestandchester.gov.uk/portal/cwc_ldf/land/blr?tab=files,yes,not owned by a public authority,permissioned,outline planning permission,,53.297391,-2.976413,0.3,,,2017-12-21,,a28ab5b077b2881b307a9055ca692b548784af55fdeb821da957363d6d356d6b
,local-authority-eng:CHW,WIT/0023,"Land at Hooton Road, Willaston, Neston, CH64 1SJ",http://consult.cheshirewestandchester.gov.uk/portal/cwc_ldf/land/blr?tab=files,,not owned by a public authority,not permissioned,,,53.292689,-3.004631,0.25,,,2017-12-21,,a28ab5b077b2881b307a9055ca692b548784af55fdeb821da957363d6d356d6b
,local-authority-eng:CHW,WIT/0032,"Roften Works site, Hooton Road, Hooton, Ellesmere Port",http://consult.cheshirewestandchester.gov.uk/portal/cwc_ldf/land/blr?tab=files,yes,not owned by a public authority,permissioned,,,53.294508,-2.979378,17.6,,,2018-12-30,,a28ab5b077b2881b307a9055ca692b548784af55fdeb821da957363d6d356d6b
,local-authority-eng:CHW,WIW/0004,"Securicor Ltd, Wharton Road, Winsford CW7 3AP",http://consult.cheshirewestandchester.gov.uk/portal/cwc_ldf/land/blr?tab=files,yes,not owned by a public authority,permissioned,outline planning permission,,53.200224,-2.50796,0.34,,,2017-12-21,,a28ab5b077b2881b307a9055ca692b548784af55fdeb821da957363d6d356d6b
,local-authority-eng:CHW,WIW/0020,"476 Rookery Rise, Station Road, Winsford",http://consult.cheshirewestandchester.gov.uk/portal/cwc_ldf/land/blr?tab=files,,not owned by a public authority,not permissioned,,,53.190118,-2.497917,0.49,,,2017-12-21,,a28ab5b077b2881b307a9055ca692b548784af55fdeb821da957363d6d356d6b
,local-authority-eng:CHW,WIW/0030,"S Cooper and Sons Ltd, Warehouse One, Nat Lane, Winsford, CW7 3BS",http://consult.cheshirewestandchester.gov.uk/portal/cwc_ldf/land/blr?tab=files,,not owned by a public authority,permissioned,outline planning permission,,53.198972,-2.510684,4.94,,,2017-12-21,,a28ab5b077b2881b307a9055ca692b548784af55fdeb821da957363d6d356d6b
,local-authority-eng:CHW,WIW/0034,"Wharton Road (Reposessions UK Ltd), Winsford. CW7 3BQ",http://consult.cheshirewestandchester.gov.uk/portal/cwc_ldf/land/blr?tab=files,,not owned by a public authority,permissioned,outline planning permission,,53.197309,-2.510769,4.4,,,2017-12-21,,a28ab5b077b2881b307a9055ca692b548784af55fdeb821da957363d6d356d6b
,local-authority-eng:CHW,WIW/0048(a),"Land at Wharton Green, Deakins Road / Bostock Road, Winsford",http://consult.cheshirewestandchester.gov.uk/portal/cwc_ldf/land/blr?tab=files,,not owned by a public authority,not permissioned,,,53.206792,-2.506585,1.2,,,2017-12-21,,a28ab5b077b2881b307a9055ca692b548784af55fdeb821da957363d6d356d6b
,local-authority-eng:CHW,WIW/0050(a),"Former coal yard site, Station Road, Winsford",http://consult.cheshirewestandchester.gov.uk/portal/cwc_ldf/land/blr?tab=files,,not owned by a public authority,not permissioned,,,53.191233,-2.49567,0.23,,,2017-12-21,,a28ab5b077b2881b307a9055ca692b548784af55fdeb821da957363d6d356d6b
