entry-date,organisation,site,site-address,site-plan-url,deliverable,ownership,planning-permission-status,planning-permission-type,hazardous-substances,latitude,longitude,hectares,minimum-net-dwellings,maximum-net-dwellings,start-date,end-date,resource
,local-authority-eng:CHW,WIW/0059,"Meadow Island, Bradford Road, Winsford",http://consult.cheshirewestandchester.gov.uk/portal/cwc_ldf/land/blr?tab=files,,not owned by a public authority,not permissioned,,,53.19831,-2.522457,2.44,,,2017-12-21,,a28ab5b077b2881b307a9055ca692b548784af55fdeb821da957363d6d356d6b
,local-authority-eng:CHW,WIW/0061,"North of Middlewich Road, Winsford",http://consult.cheshirewestandchester.gov.uk/portal/cwc_ldf/land/blr?tab=files,,not owned by a public authority,pending decision,,,53.190868,-2.483857,,,,2018-12-30,,a28ab5b077b2881b307a9055ca692b548784af55fdeb821da957363d6d356d6b
,local-authority-eng:CHW,WOV/0045(a),"Handley Hill School, Beeston Drive, Winsford",http://consult.cheshirewestandchester.gov.uk/portal/cwc_ldf/land/blr?tab=files,,owned by a public authority,not permissioned,,,53.186287,-2.5397,1.09,,,2017-12-21,,a28ab5b077b2881b307a9055ca692b548784af55fdeb821da957363d6d356d6b
,local-authority-eng:CHW,WOV/0066,"Land and buildings off Sadler Road, Winsford",http://consult.cheshirewestandchester.gov.uk/portal/cwc_ldf/land/blr?tab=files,,not owned by a public authority,not permissioned,,,53.192934,-2.526657,0.57,,,2017-12-21,,a28ab5b077b2881b307a9055ca692b548784af55fdeb821da957363d6d356d6b
,local-authority-eng:CHW,WOV/0070(a),"Land north of former Richmond Packaging, New Road, Winsford",http://consult.cheshirewestandchester.gov.uk/portal/cwc_ldf/land/blr?tab=files,,not owned by a public authority,not permissioned,,,53.195269,-2.521028,0.81,,,2017-12-21,,a28ab5b077b2881b307a9055ca692b548784af55fdeb821da957363d6d356d6b
,local-authority-eng:CHW,WOV/0071(a),"Car park off Church Street, Winsford",http://consult.cheshirewestandchester.gov.uk/portal/cwc_ldf/land/blr?tab=files,,owned by a public authority,not permissioned,,,53.19345,-2.519614,0.43,,,2017-12-21,,a28ab5b077b2881b307a9055ca692b548784af55fdeb821da957363d6d356d6b
,local-authority-eng:CHW,WOV/0072,"Land at Manchester House Carpets, 56 High Street, Winsford",http://consult.cheshirewestandchester.gov.uk/portal/cwc_ldf/land/blr?tab=files,,not owned by a public authority,not permissioned,,,53.192932,-2.520925,0.13,,,2017-12-21,,a28ab5b077b2881b307a9055ca692b548784af55fdeb821da957363d6d356d6b
,local-authority-eng:CHW,WOV/0074,"Greedy Pig site, New Road, Winsford",http://consult.cheshirewestandchester.gov.uk/portal/cwc_ldf/land/blr?tab=files,,not owned by a public authority,not permissioned,,,53.193789,-2.518241,,,,2018-12-30,,a28ab5b077b2881b307a9055ca692b548784af55fdeb821da957363d6d356d6b
,local-authority-eng:CHW,WOV/0078,"Pimletts and adjacent car park, Church Street / High Street, Winsford",http://consult.cheshirewestandchester.gov.uk/portal/cwc_ldf/land/blr?tab=files,,not owned by a public authority,not permissioned,,,53.193069,-2.520477,0.18,,,2017-12-21,,a28ab5b077b2881b307a9055ca692b548784af55fdeb821da957363d6d356d6b
,local-authority-eng:CHW,WOV/0084,"Sadler Road (Former Winsford Clio Centre), Winsford",http://consult.cheshirewestandchester.gov.uk/portal/cwc_ldf/land/blr?tab=files,,not owned by a public authority,not permissioned,outline planning permission,,53.193145,-2.527782,0.12,,,2017-12-21,,a28ab5b077b2881b307a9055ca692b548784af55fdeb821da957363d6d356d6b
,local-authority-eng:CHW,WOV/0100,Meadow Home Park Mill Lane Whitegate Winsford Cheshire ,http://consult.cheshirewestandchester.gov.uk/portal/cwc_ldf/land/blr?tab=files,yes,not owned by a public authority,permissioned,full planning permission,,53.215283,-2.526213,0.47,,,2017-12-21,,a28ab5b077b2881b307a9055ca692b548784af55fdeb821da957363d6d356d6b
,local-authority-eng:CHW,WOV/0112,"Land at Grange Yard, Grange Lane, Winsford, CW7 2BP",http://consult.cheshirewestandchester.gov.uk/portal/cwc_ldf/land/blr?tab=files,,not owned by a public authority,pending decision,,,53.193238,-2.533157,,,,2018-12-30,,a28ab5b077b2881b307a9055ca692b548784af55fdeb821da957363d6d356d6b
,local-authority-eng:CHW,WSD/0014,"Winsford Shopping Centre, Dene's Drive, Winsford",http://consult.cheshirewestandchester.gov.uk/portal/cwc_ldf/land/blr?tab=files,,not owned by a public authority,not permissioned,,,53.19173,-2.528648,3.15,,,2017-12-21,,a28ab5b077b2881b307a9055ca692b548784af55fdeb821da957363d6d356d6b
,local-authority-eng:CHW,WSD/0027,"Car park off Dene Street, Winsford",http://consult.cheshirewestandchester.gov.uk/portal/cwc_ldf/land/blr?tab=files,,owned by a public authority,not permissioned,,,53.19178,-2.531448,0.79,,,2017-12-21,,a28ab5b077b2881b307a9055ca692b548784af55fdeb821da957363d6d356d6b
,local-authority-eng:CHW,WSD/0028,"Site of former Civic Hall, High Street, Winsford",http://consult.cheshirewestandchester.gov.uk/portal/cwc_ldf/land/blr?tab=files,,owned by a public authority,not permissioned,,,53.192414,-2.530453,0.25,,,2017-12-21,,a28ab5b077b2881b307a9055ca692b548784af55fdeb821da957363d6d356d6b
,local-authority-eng:CHW,WSD/0030,"Winsford Library and Dingle Recreation Centre, High Street, Winsford",http://consult.cheshirewestandchester.gov.uk/portal/cwc_ldf/land/blr?tab=files,,owned by a public authority,not permissioned,,,53.192486,-2.528448,0.26,,,2017-12-21,,a28ab5b077b2881b307a9055ca692b548784af55fdeb821da957363d6d356d6b
,local-authority-eng:CHW,WSD/0031,"Land at High Street / Dingle Lane, Winsford",http://consult.cheshirewestandchester.gov.uk/portal/cwc_ldf/land/blr?tab=files,,not owned by a public authority,not permissioned,,,53.192071,-2.526692,0.27,,,2017-12-21,,a28ab5b077b2881b307a9055ca692b548784af55fdeb821da957363d6d356d6b
,local-authority-eng:CHW,WSD/0034,"Land to rear of Weaver Street, off Winnington Street, Winsford",http://consult.cheshirewestandchester.gov.uk/portal/cwc_ldf/land/blr?tab=files,,not owned by a public authority,not permissioned,,,53.191343,-2.520427,0.36,,,2017-12-21,,a28ab5b077b2881b307a9055ca692b548784af55fdeb821da957363d6d356d6b
,local-authority-eng:CHW,WSD/0044,"The Hollies, Darnhall School Lane, Winsford CW7 1LH",http://consult.cheshirewestandchester.gov.uk/portal/cwc_ldf/land/blr?tab=files,,not owned by a public authority,permissioned,full planning permission,,53.176473,-2.535163,0.17,,,2017-12-21,,a28ab5b077b2881b307a9055ca692b548784af55fdeb821da957363d6d356d6b
,local-authority-eng:CHW,WSD/0052,"Former Drill Hall, Dingle Lane, Winsford CW7 1AB",http://consult.cheshirewestandchester.gov.uk/portal/cwc_ldf/land/blr?tab=files,yes,not owned by a public authority,permissioned,full planning permission,,53.19173,-2.528648,0.25,,,2017-12-21,,a28ab5b077b2881b307a9055ca692b548784af55fdeb821da957363d6d356d6b
