entry-date,organisation,site,site-address,site-plan-url,deliverable,ownership,planning-permission-status,planning-permission-type,hazardous-substances,latitude,longitude,hectares,minimum-net-dwellings,maximum-net-dwellings,start-date,end-date,notes,resource
2018-12-22,local-authority-eng:BRA,BCBG144,"Carier Site, East Street, Braintree",https://braintree.maps.arcgis.com/apps/webappviewer/index.html?id=2cb158cfa90841e5be176e0ddbea3865,yes,not owned by a public authority,permissioned,reserved matters approval,,51.878839,0.563915,2.13,74,74,2017-12-22,,"18/00613/REM - Application for approval of Reserved Matters for 'Access', 'Appearance', 'Landscaping', 'Layout', and 'Scale' for erection of 74 dwellings pursuant to outline planning permission",a35c5896fb7a45845600cc174647477930ea07f326de797897a22cdde9975729
2019-12-18,local-authority-eng:BRA,BRS35,"The Rose and Crown, Masefield Road, Braintree",https://braintree.maps.arcgis.com/apps/webappviewer/index.html?id=2cb158cfa90841e5be176e0ddbea3865,yes,not owned by a public authority,not permissioned,,,51.868169,0.555406,0.09,14,14,2017-12-22,,Allocated in emerging Local Plan. Previous application 14/01115/FUL has expired.,a35c5896fb7a45845600cc174647477930ea07f326de797897a22cdde9975729
2019-12-18,local-authority-eng:BRA,GRYE 275,"Hunnable Industrial Estate, Great Yeldham",https://braintree.maps.arcgis.com/apps/webappviewer/index.html?id=2cb158cfa90841e5be176e0ddbea3865,yes,not owned by a public authority,permissioned,reserved matters approval,,52.013376,0.562537,2.19,60,60,2017-12-22,2019-12-18,Site is now under construction,a35c5896fb7a45845600cc174647477930ea07f326de797897a22cdde9975729
2019-12-18,local-authority-eng:BRA,15/01103/OUT,"Universal Garage, The Street, Hatfield Peverel",https://braintree.maps.arcgis.com/apps/webappviewer/index.html?id=2cb158cfa90841e5be176e0ddbea3865,yes,not owned by a public authority,permissioned,reserved matters approval,,51.776791,0.598066,0.22,9,9,2017-12-22,,"Demolish workshop and vehicle sales buildings, cease vehicle sales use and erection of 7 no. two storey terrace dwellings and 2 no. detached dwellings, formation of new vehicular access on the The Street, layout parking spaces and form private amenity areas.",a35c5896fb7a45845600cc174647477930ea07f326de797897a22cdde9975729
2017-12-22,local-authority-eng:BRA,16/00850/FUL,"Former Courtauld Boiler Building Factory, Lane West, Halstead",https://braintree.maps.arcgis.com/apps/webappviewer/index.html?id=2cb158cfa90841e5be176e0ddbea3865,yes,not owned by a public authority,permissioned,full planning permission,,51.941767,0.637769,0.3,22,22,2017-12-22,,"Change of use of existing former Courtauld boiler buildings to create 22 flats together with commercial storage, landscaping and car parking",a35c5896fb7a45845600cc174647477930ea07f326de797897a22cdde9975729
2017-12-22,local-authority-eng:BRA,16/01525/OUT,"4 Helions Road, Steeple Bumpstead",https://braintree.maps.arcgis.com/apps/webappviewer/index.html?id=2cb158cfa90841e5be176e0ddbea3865,yes,not owned by a public authority,permissioned,outline planning permission,,52.041388,0.440652,0.84,9,9,2017-12-22,,Application for outline planning permission with all matters reserved - redevelopment of an agricultural machinery depot to residential development of 9no. three bedroom dwellings with associated works,a35c5896fb7a45845600cc174647477930ea07f326de797897a22cdde9975729
2019-12-18,local-authority-eng:BRA,16/00661/FUL,"Garage Site, Lancaster Way, Braintree",https://braintree.maps.arcgis.com/apps/webappviewer/index.html?id=2cb158cfa90841e5be176e0ddbea3865,yes,not owned by a public authority,permissioned,full planning permission,,51.886136,0.543869,0.14,9,9,2017-12-22,,19/01797/FUL - Demolition of existing garages and erection of 9 no. apartments,a35c5896fb7a45845600cc174647477930ea07f326de797897a22cdde9975729
2017-12-22,local-authority-eng:BRA,17/01340/FUL,"28-30 Trinity Street, Halstead",https://braintree.maps.arcgis.com/apps/webappviewer/index.html?id=2cb158cfa90841e5be176e0ddbea3865,yes,not owned by a public authority,permissioned,full planning permission,,51.943806,0.63265,0.02,6,6,2017-12-22,,"Change of use of building from commercial to 6 no. one bedroom flats and a commercial unit at ground floor level, together with internal and external alterations",a35c5896fb7a45845600cc174647477930ea07f326de797897a22cdde9975729
2019-12-18,local-authority-eng:BRA,16/00418/FUL,"Units 1 and 2 Tey Grove, Gt Domseys Farm, Domsey Chase, Feering",https://braintree.maps.arcgis.com/apps/webappviewer/index.html?id=2cb158cfa90841e5be176e0ddbea3865,yes,not owned by a public authority,permissioned,full planning permission,,51.862368,0.740376,0.26,11,11,2017-12-22,2019-12-18,Completed,a35c5896fb7a45845600cc174647477930ea07f326de797897a22cdde9975729
2017-12-22,local-authority-eng:BRA,16/01470/FUL,"Bardfield Centre, Braintree Road, Great Bardfield",https://braintree.maps.arcgis.com/apps/webappviewer/index.html?id=2cb158cfa90841e5be176e0ddbea3865,yes,not owned by a public authority,permissioned,full planning permission,,51.944817,0.439289,0.41,8,8,2017-12-22,,"The conversion of existing commercial buildings to form 8 no. residential units with associated landscaping, creation of vehicular access and demolition of Unit 13 and a storage building to facilitate amended car parking provision",a35c5896fb7a45845600cc174647477930ea07f326de797897a22cdde9975729
2017-12-22,local-authority-eng:BRA,17/00119/OUT,"10 And Land Rear Of, New Road, Gosfield",https://braintree.maps.arcgis.com/apps/webappviewer/index.html?id=2cb158cfa90841e5be176e0ddbea3865,yes,not owned by a public authority,permissioned,outline planning permission,,51.926796,0.59318,0.48,8,8,2017-12-22,,Application for outline planning permission with some matters reserved - Demolition of existing buildings and hardstanding and construction of 8 no. new dwellings together with new vehicular access onto New Road and associated development,a35c5896fb7a45845600cc174647477930ea07f326de797897a22cdde9975729
2017-12-22,local-authority-eng:BRA,16/02096/OUT,Former Arla Dairy Site Bury Lane Hatfield Peverel,https://braintree.maps.arcgis.com/apps/webappviewer/index.html?id=2cb158cfa90841e5be176e0ddbea3865,yes,not owned by a public authority,permissioned,outline planning permission,,51.7783,0.589975,3.83,145,145,2017-12-22,,"Outline planning application for residential development for up to 145 dwellings (Use Class C3) with public open space, vehicular access and associated infrastructure",a35c5896fb7a45845600cc174647477930ea07f326de797897a22cdde9975729
2017-12-22,local-authority-eng:BRA,BOB1,"Tabor House, Bocking, Braintree (phase 2)",https://braintree.maps.arcgis.com/apps/webappviewer/index.html?id=2cb158cfa90841e5be176e0ddbea3865,,not owned by a public authority,not permissioned,,,51.880304,0.552781,0.33,16,16,2017-12-22,,"The site is allocated in the draft New Local Plan for residentail development. Phase one of the site has planning permission (14/00702/FUL) and has commenced. Therefore, this site relates to phase 2 only.",a35c5896fb7a45845600cc174647477930ea07f326de797897a22cdde9975729
2017-12-22,local-authority-eng:BRA,BRE17H,"302 Cressing Road, Braintree",https://braintree.maps.arcgis.com/apps/webappviewer/index.html?id=2cb158cfa90841e5be176e0ddbea3865,,not owned by a public authority,not permissioned,,,51.871448,0.578255,0.59,10,10,2017-12-22,,The site is allocated in the draft New Local Plan for residentail development.,a35c5896fb7a45845600cc174647477930ea07f326de797897a22cdde9975729
2019-12-18,local-authority-eng:BRA,BRC77,Timber Yard East of Crossman House Station Approach,https://braintree.maps.arcgis.com/apps/webappviewer/index.html?id=2cb158cfa90841e5be176e0ddbea3865,yes,not owned by a public authority,permissioned,full planning permission,,51.875854,0.558907,0.08,10,10,2017-12-22,2019-12-18,18/01432/FUL - now under construction,a35c5896fb7a45845600cc174647477930ea07f326de797897a22cdde9975729
2017-12-22,local-authority-eng:BRA,WITN425,"Land East of Chipping Hill, Witham",https://braintree.maps.arcgis.com/apps/webappviewer/index.html?id=2cb158cfa90841e5be176e0ddbea3865,,not owned by a public authority,not permissioned,,,51.80647,0.637535,0.41,30,30,2017-12-22,,The site is allocated in the draft New Local Plan for residentail development.,a35c5896fb7a45845600cc174647477930ea07f326de797897a22cdde9975729
2017-12-22,local-authority-eng:BRA,BRC34,Land rear of 138-142 (Kwik Fit) South Street,https://braintree.maps.arcgis.com/apps/webappviewer/index.html?id=2cb158cfa90841e5be176e0ddbea3865,,not owned by a public authority,not permissioned,,,51.876107,0.555536,0.22,10,10,2017-12-22,,The site is allocated in the draft New Local Plan for residentail development.,a35c5896fb7a45845600cc174647477930ea07f326de797897a22cdde9975729
2017-12-22,local-authority-eng:BRA,BOCS 700,"Braintree College, Braintree",https://braintree.maps.arcgis.com/apps/webappviewer/index.html?id=2cb158cfa90841e5be176e0ddbea3865,,not owned by a public authority,not permissioned,,,51.890164,0.557584,1.69,30,30,2017-12-22,,The site is allocated in the draft New Local Plan for residentail development.,a35c5896fb7a45845600cc174647477930ea07f326de797897a22cdde9975729
2019-12-18,local-authority-eng:BRA,16/00211/FUL,"Cox's Yard, Land north of Rayne Road, south of Bunyan Road",https://braintree.maps.arcgis.com/apps/webappviewer/index.html?id=2cb158cfa90841e5be176e0ddbea3865,yes,not owned by a public authority,permissioned,full planning permission,,51.880082,0.549775,0.18,12,12,2018-12-22,,"Redevelopment of Cox's Yard for residential development for the provision of 12 flats to be accessed from Rayne Road and one detached dwelling to be accessed from Panfield Lane, including demolition of redundant building, parking, landscaping and amenity areas.  Works to 16-18 Rayne Road including replacement of the existing showroom with residential accommodation and a retail frontage, and refurbishment of the existing shop with accommodation over.",a35c5896fb7a45845600cc174647477930ea07f326de797897a22cdde9975729
2018-12-22,local-authority-eng:BRA,18/01272/COUPA,"Unit 6 The Mazes, East Street, Braintree",https://braintree.maps.arcgis.com/apps/webappviewer/index.html?id=2cb158cfa90841e5be176e0ddbea3865,yes,not owned by a public authority,permissioned,full planning permission,,51.877642,0.563557,0.06,8,8,2018-12-22,,Notification for prior approval for a proposed change of use of a building from Office Use (Class B1 (a)) to 8 one bedroom flats (Class C3).,a35c5896fb7a45845600cc174647477930ea07f326de797897a22cdde9975729
2019-12-18,local-authority-eng:BRA,18/00581/FUL,"Pound End Mill, South Street, Braintree",https://braintree.maps.arcgis.com/apps/webappviewer/index.html?id=2cb158cfa90841e5be176e0ddbea3865,yes,not owned by a public authority,permissioned,full planning permission,,51.876664,0.552284,0.07,8,8,2018-12-22,2019-12-18,Under construction,a35c5896fb7a45845600cc174647477930ea07f326de797897a22cdde9975729
2019-12-18,local-authority-eng:BRA,17/01894/FUL,"Baverstocks Manor Place, Albert Road, Braintree",https://braintree.maps.arcgis.com/apps/webappviewer/index.html?id=2cb158cfa90841e5be176e0ddbea3865,yes,not owned by a public authority,permissioned,full planning permission,,51.877889,0.561304,0.07,5,5,2018-12-22,2019-12-18,Completed,a35c5896fb7a45845600cc174647477930ea07f326de797897a22cdde9975729
2019-12-18,local-authority-eng:BRA,BLAN 633,"Filling station site, adjacent 203 London Road, Braintree",https://braintree.maps.arcgis.com/apps/webappviewer/index.html?id=2cb158cfa90841e5be176e0ddbea3865,,not owned by a public authority,not permissioned,,,51.860707,0.535404,0.15,5,5,2018-12-22,,The site is allocated in the draft New Local Plan for residentail development. Brownfield part of site only. Application for part of the site pending consideration - 19/01575/FUL,a35c5896fb7a45845600cc174647477930ea07f326de797897a22cdde9975729
2019-12-18,local-authority-eng:BRA,COGG 506,"Dutch Nursery, West Street (brownfield part only)",https://braintree.maps.arcgis.com/apps/webappviewer/index.html?id=2cb158cfa90841e5be176e0ddbea3865,yes,not owned by a public authority,permissioned,reserved matters approval,,51.869517,0.674767,1.28,30,36,2019-12-18,,Application for 48 dwellings - estimated that brownfield section has capacity for 30 - 36 units.,a35c5896fb7a45845600cc174647477930ea07f326de797897a22cdde9975729
2019-12-18,local-authority-eng:BRA,BRC6H,"Land to rear of Gordon House, 22 Rayne Road",https://braintree.maps.arcgis.com/apps/webappviewer/index.html?id=2cb158cfa90841e5be176e0ddbea3865,yes,not owned by a public authority,permissioned,full planning permission,,51.879644,0.549213,0.17,9,9,2019-12-18,,19/00733/FUL - Creation of 9 new cottages with amenity space and parking on the land to the rear of Gordon House,a35c5896fb7a45845600cc174647477930ea07f326de797897a22cdde9975729
2019-12-18,local-authority-eng:BRA,18/00601/FUL,"13-17 Bank Street, Braintree",https://braintree.maps.arcgis.com/apps/webappviewer/index.html?id=2cb158cfa90841e5be176e0ddbea3865,yes,not owned by a public authority,permissioned,full planning permission,,51.879457,0.550786,0.03,6,6,2019-12-18,,Change of use and extension from commercial premise to commercial premise with  6 apartments  above  and associated external alterations and landscaping.,a35c5896fb7a45845600cc174647477930ea07f326de797897a22cdde9975729
2019-12-18,local-authority-eng:BRA,18/00460/FUL,"Unit F Ground Floor And First Floor, New Mills, Silks Way, Braintree",https://braintree.maps.arcgis.com/apps/webappviewer/index.html?id=2cb158cfa90841e5be176e0ddbea3865,yes,not owned by a public authority,permissioned,full planning permission,,51.876105,0.552354,0.18,7,7,2019-12-18,,"Change of use B1 Office to 6 x 2 bed and 1 x 1 bed C3 residential flats (7 units) with associated parking, cycle parking and refuse storage.",a35c5896fb7a45845600cc174647477930ea07f326de797897a22cdde9975729
2019-12-18,local-authority-eng:BRA,18/00011/FUL,"The Old Pool Club, 49 Braintree Road, Witham, Essex",https://braintree.maps.arcgis.com/apps/webappviewer/index.html?id=2cb158cfa90841e5be176e0ddbea3865,yes,not owned by a public authority,permissioned,full planning permission,,51.807163,0.637517,0.08,10,10,2019-12-18,,"Redevelopment of the site to provide 8 one bedroom flats and 2 two bedroom flats (10 units total) incorporating the remodelling of the existing building to provide a three storey building with associated landscaping, parking & cycle parking",a35c5896fb7a45845600cc174647477930ea07f326de797897a22cdde9975729
