entry-date,organisation,site,site-address,site-plan-url,deliverable,ownership,planning-permission-status,planning-permission-type,hazardous-substances,latitude,longitude,hectares,minimum-net-dwellings,maximum-net-dwellings,start-date,end-date,notes,resource
2018-12-17,national-park-authority:Q72617669,BR-001,"Former Primary School, Claver Close, Swainby",http://www.northyorkmoors.org.uk/planning/framework/brownfield-land-register/brownfield-land-register-map?inspect_query=brno&inspect_value=BR-001&show_viewfinder=true,yes,not owned by a public authority,not permissioned,,,54.409096,-1.264784,0.49,,,2017-12-14,,"
Former Primary School, Swainby, (no relevant planning history). 8 to 10 affordable dwellings in total, 2 or 3 bedroomed dwellings as an exceptions site (Core policy K of the LDF) with road frontages on to Claver Close and an area of open space in the southern area of the site to maintain the open character of the site.
",c8f7273214684659af76edb9ff20dde82d191e11effdf9ea0024b319ca81de8d
2018-12-17,national-park-authority:Q72617669,BR-002,"Former British Legion Club, High Street, Hinderwell",http://www.northyorkmoors.org.uk/planning/framework/brownfield-land-register/brownfield-land-register-map?inspect_query=brno&inspect_value=BR-002&show_viewfinder=true,,,not permissioned,,,54.534216,-0.776159,0.4,,,2017-12-14,,"
Land between Station Road and Coronation Avenue, Hinderwell, (previous outline planning consent for residential development, 8 dwellings). 8 affordable dwellings in total, 2 and 3 bedroomed dwellings as an exceptions site (Core policy K of the LDF) with highway access from A174 only.
",c8f7273214684659af76edb9ff20dde82d191e11effdf9ea0024b319ca81de8d
2018-12-17,national-park-authority:Q72617669,BR-003,"Former NYCC Depot, West Ayton",http://www.northyorkmoors.org.uk/planning/framework/brownfield-land-register/brownfield-land-register-map?inspect_query=brno&inspect_value=BR-003&show_viewfinder=true,yes,owned by a public authority,not permissioned,,,54.245064,-0.490664,0.72,,,2017-12-14,,"Part of site within Scarborough Borough Council. Since planning permission site within the Conservation Area
Former NYCC Depot, West Ayton (previous outline planning consent for open market housing development with planning brief.) Site straddles the National Park boundary and being split between the National Park and Scarborough Borough Council. 10 open market dwellings in total on the whole site, two and three bedroomed dwellings. 40% affordable housing requirement under Core policy J of the LDF. Development to take account of planning brief and more recent Conservation Area status. Development will require the retention of the Station House/office, platform and Goods Warehouse.
",c8f7273214684659af76edb9ff20dde82d191e11effdf9ea0024b319ca81de8d
2018-12-17,national-park-authority:Q72617669,BR-004,"Blue Bank Garage, Coach Road, Sleights",http://www.northyorkmoors.org.uk/planning/framework/brownfield-land-register/brownfield-land-register-map?inspect_query=brno&inspect_value=BR-004&show_viewfinder=true,yes,not owned by a public authority,permissioned,full planning permission,,54.44901,-0.665742,0.26,,,2018-11-29,,"
Demolition of existing dwelling (No 171) and garage buildings and construction of 4 no dwellings with associated access, parking and landscaping works.
",c8f7273214684659af76edb9ff20dde82d191e11effdf9ea0024b319ca81de8d
