entry-date,organisation,site,site-address,site-plan-url,deliverable,ownership,planning-permission-status,planning-permission-type,hazardous-substances,latitude,longitude,hectares,minimum-net-dwellings,maximum-net-dwellings,start-date,end-date,notes,resource
2017-12-22,local-authority-eng:SHR,10/00540/OUT,"Land Between 94A Willow Street and Oak Street, Oswestry",https://shropshire.maps.arcgis.com/apps/webappviewer/index.html?id=25b8fd6ba2fb4c878775a1aaea210576,,not owned by a public authority,not permissioned,,,,,0.06,6,6,2017-12-22,,". ""Lapsed Outline Planning Permission previously granted for 6 dwellings.""",d5049b03ac10ee85dc62fcb7126676754df97918c593f49b21b2aba2a9ffcb32
2017-12-22,local-authority-eng:SHR,10/00968/FUL,"Phoenix Garage, Great Hales Street, Market Drayton",https://shropshire.maps.arcgis.com/apps/webappviewer/index.html?id=25b8fd6ba2fb4c878775a1aaea210576,,not owned by a public authority,not permissioned,,,,,0.31,14,14,2017-12-22,,". ""Lapsed Full Planning Permission previously granted for a residential development of 14 dwellings.""",d5049b03ac10ee85dc62fcb7126676754df97918c593f49b21b2aba2a9ffcb32
2017-12-22,local-authority-eng:SHR,10/01319/FUL,"Land At 1 Pinkham, Cleobury Mortimer",https://shropshire.maps.arcgis.com/apps/webappviewer/index.html?id=25b8fd6ba2fb4c878775a1aaea210576,,not owned by a public authority,not permissioned,,,,,0.3,9,9,2017-12-22,,". ""Lapsed Full Planning Permission previously granted for a residential development of 9 dwellings.""",d5049b03ac10ee85dc62fcb7126676754df97918c593f49b21b2aba2a9ffcb32
2017-12-22,local-authority-eng:SHR,10/04143/OUT,"Pentons Haulage And Coldstore, School Road, Ruyton XI Towns, Shrewsbury, Shropshire, SY4 1JT",https://shropshire.maps.arcgis.com/apps/webappviewer/index.html?id=25b8fd6ba2fb4c878775a1aaea210576,,not owned by a public authority,not permissioned,,,,,4.77,80,80,2017-12-22,,"""Outline Planning Permission previously granted on the 2011-12-23 (10/04143/OUT) for 94 dwellings. The application subsequently lapsed. |There remains a known interest in bringing this site forward for residential development."". ""Lapsed Outline Planning Permission previously granted for 80 dwellings.""",d5049b03ac10ee85dc62fcb7126676754df97918c593f49b21b2aba2a9ffcb32
2017-12-22,local-authority-eng:SHR,11/00983/FUL,"6 St Marys Street, Market Drayton",https://shropshire.maps.arcgis.com/apps/webappviewer/index.html?id=25b8fd6ba2fb4c878775a1aaea210576,,not owned by a public authority,not permissioned,,,,,0.03,5,5,2017-12-22,,". ""Lapsed Full Planning Permission previously granted for a residential development of 5 dwellings.""",d5049b03ac10ee85dc62fcb7126676754df97918c593f49b21b2aba2a9ffcb32
2017-12-22,local-authority-eng:SHR,11/02325/FUL,"Land at 1 Forge Way, Dorrington, Shrewsbury",https://shropshire.maps.arcgis.com/apps/webappviewer/index.html?id=25b8fd6ba2fb4c878775a1aaea210576,,not owned by a public authority,not permissioned,,,,,0.05,5,5,2017-12-22,,". ""Lapsed Full Planning Permission previously granted for a residential development of 5 dwellings.""",d5049b03ac10ee85dc62fcb7126676754df97918c593f49b21b2aba2a9ffcb32
2017-12-22,local-authority-eng:SHR,11/03859/OUT,"Coach Garage, Village Road, Childs Ercall, Market Drayton",https://shropshire.maps.arcgis.com/apps/webappviewer/index.html?id=25b8fd6ba2fb4c878775a1aaea210576,,not owned by a public authority,not permissioned,,,,,0.19,5,5,2017-12-22,,". ""Lapsed Outline Planning Permission previously granted for 5 dwellings.""",d5049b03ac10ee85dc62fcb7126676754df97918c593f49b21b2aba2a9ffcb32
2017-12-22,local-authority-eng:SHR,11/04508/FUL,"7 Claremont Street, Shrewsbury",https://shropshire.maps.arcgis.com/apps/webappviewer/index.html?id=25b8fd6ba2fb4c878775a1aaea210576,,not owned by a public authority,not permissioned,,,,,0.04,7,7,2017-12-22,,". ""Lapsed Full Planning Permission previously granted for a residential development of 7 dwellings.""",d5049b03ac10ee85dc62fcb7126676754df97918c593f49b21b2aba2a9ffcb32
2017-12-22,local-authority-eng:SHR,13/00022/OUT,"Bromfield, 66 Spring Gardens, Shrewsbury, Shropshire, SY1 2TE",https://shropshire.maps.arcgis.com/apps/webappviewer/index.html?id=25b8fd6ba2fb4c878775a1aaea210576,yes,not owned by a public authority,permissioned,outline planning permission,,,,0.13,9,9,2017-12-22,,". ""Outline application for the erection of nine open market one affordable dwelling to include layout and access following demolition of existing dwelling.""",d5049b03ac10ee85dc62fcb7126676754df97918c593f49b21b2aba2a9ffcb32
2017-12-22,local-authority-eng:SHR,13/00097/FUL,"McKeand Smith & Co Ltd, Station Road, Albrighton, Wolverhampton, WV7 3EA",https://shropshire.maps.arcgis.com/apps/webappviewer/index.html?id=25b8fd6ba2fb4c878775a1aaea210576,yes,not owned by a public authority,permissioned,full planning permission,,,,0.17,9,9,2017-12-22,,"""New Planning Application (17/02469/FUL) pending consideration on the site."". ""Change of use from B1 to C3 (dwelling houses); Demolition of outbuildings and office block; Conversion of existing workshop buildings to form 2 no. 2 bed dwellings; Erection of 4 no. 3 bed dwellings, 1 no. 2 bed dwelling and 1 no. 2 bed flat above garaging; Access improvements; Parking provision; and Outside waste storage.""",d5049b03ac10ee85dc62fcb7126676754df97918c593f49b21b2aba2a9ffcb32
2017-12-22,local-authority-eng:SHR,13/01854/OUT,"Land West Of Mill Green, Knighton, Powys",https://shropshire.maps.arcgis.com/apps/webappviewer/index.html?id=25b8fd6ba2fb4c878775a1aaea210576,yes,not owned by a public authority,permissioned,outline planning permission,,,,1.06,26,26,2017-12-22,,". ""Residential re-development. A proportion of this site is located within Powys, the equivalent proportion of the dwellings proposed on this site (10) have been discounted for this site.""",d5049b03ac10ee85dc62fcb7126676754df97918c593f49b21b2aba2a9ffcb32
2017-12-22,local-authority-eng:SHR,13/02550/OUT,"Dale House, Newport Road, Hinstock, Market Drayton, TF9 2TH",https://shropshire.maps.arcgis.com/apps/webappviewer/index.html?id=25b8fd6ba2fb4c878775a1aaea210576,yes,not owned by a public authority,permissioned,outline planning permission,,,,0.15,5,5,2017-12-22,,". ""Outline application for the erection of five dwellings to include means of access following demolition of existing sheds.""",d5049b03ac10ee85dc62fcb7126676754df97918c593f49b21b2aba2a9ffcb32
2017-12-22,local-authority-eng:SHR,13/02623/FUL,"Land At Broseley Social Club, Bank House, High Street, Broseley, Shropshire, TF12 5EZ",https://shropshire.maps.arcgis.com/apps/webappviewer/index.html?id=25b8fd6ba2fb4c878775a1aaea210576,yes,not owned by a public authority,permissioned,full planning permission,,,,0.14,6,6,2017-12-22,,"""The site has the benefit of a Full planning permission. | Part of the site is brownfield (Approx 65%) and part is greenfield (Approx 35%). | The brownfield element of the site is approximately 0.14ha, whilst the total site size is some 0.21ha. | It is anticipated that the brownfield component of the site has a capacity for all the 6 dwellings proposed within the development. | The site is considered deliverable. | The map shows the full extent of the site and not only the brownfield area."". ""Erection of 6 dwellings and associated parking. | Part of the site is brownfield (Approx 65%) and part is greenfield (Approx 35%). | The brownfield element of the site is approximately 0.14ha whilst the total site size is some 0.21ha. | It is anticipated that the brownfield component of the site has a capacity for all the 6 dwellings proposed within the development.""",d5049b03ac10ee85dc62fcb7126676754df97918c593f49b21b2aba2a9ffcb32
2017-12-22,local-authority-eng:SHR,13/03051/FUL,"117 Cheshire Street, Market Drayton, Shropshire, TF9 1AE",https://shropshire.maps.arcgis.com/apps/webappviewer/index.html?id=25b8fd6ba2fb4c878775a1aaea210576,yes,not owned by a public authority,permissioned,full planning permission,,,,0.02,6,6,2017-12-22,,". ""Change of use to form 6 apartments.""",d5049b03ac10ee85dc62fcb7126676754df97918c593f49b21b2aba2a9ffcb32
2017-12-22,local-authority-eng:SHR,13/03205/P3JPA,"28 Castle Street, Shrewsbury, Shropshire, SY1 2BQ",https://shropshire.maps.arcgis.com/apps/webappviewer/index.html?id=25b8fd6ba2fb4c878775a1aaea210576,yes,not owned by a public authority,permissioned,other,,,,0.14,6,6,2017-12-22,,". ""Prior Approval under Part 3 Class J of the Town & Country Planning (General Permitted Development) Order 2013 for the change of use first and second floor offices to six apartments.""",d5049b03ac10ee85dc62fcb7126676754df97918c593f49b21b2aba2a9ffcb32
2017-12-22,local-authority-eng:SHR,13/03415/FUL,"Evans And Stubbs Building, Dale Street, Craven Arms, Shropshire, SY7 9NY",https://shropshire.maps.arcgis.com/apps/webappviewer/index.html?id=25b8fd6ba2fb4c878775a1aaea210576,yes,not owned by a public authority,permissioned,full planning permission,,,,0.1,7,7,2017-12-22,,". ""Conversion of existing building into five residential units and construction of two new units; insertion of sunpipes and solar panels to rear elevation.""",d5049b03ac10ee85dc62fcb7126676754df97918c593f49b21b2aba2a9ffcb32
2017-12-22,local-authority-eng:SHR,13/03481/OUT,"Storage Land And Premises (former Dairy), Mile Bank Road, Whitchurch, Shropshire",https://shropshire.maps.arcgis.com/apps/webappviewer/index.html?id=25b8fd6ba2fb4c878775a1aaea210576,yes,not owned by a public authority,permissioned,outline planning permission,,,,3.93,70,70,2017-12-22,,". ""Outline application (all matters reserved) for residential development; vehicular access and estate roads; diversion of Public Right of Way; associated highway and landscape works.""",d5049b03ac10ee85dc62fcb7126676754df97918c593f49b21b2aba2a9ffcb32
2017-12-22,local-authority-eng:SHR,13/03521/FUL,"Lea Manor, Holyhead Road, Albrighton, Wolverhampton, WV7 3BX",https://shropshire.maps.arcgis.com/apps/webappviewer/index.html?id=25b8fd6ba2fb4c878775a1aaea210576,yes,not owned by a public authority,permissioned,full planning permission,,,,0.57,7,7,2017-12-22,,". ""Erection of seven dwellings (following demolition of all buildings).""",d5049b03ac10ee85dc62fcb7126676754df97918c593f49b21b2aba2a9ffcb32
2017-12-22,local-authority-eng:SHR,14/00030/OUT,"Davro Iron & Steel Co Ltd, Ridgewell Works, Stourbridge Road, Wootton, Bridgnorth, WV15 6ED",https://shropshire.maps.arcgis.com/apps/webappviewer/index.html?id=25b8fd6ba2fb4c878775a1aaea210576,yes,not owned by a public authority,permissioned,outline planning permission,,,,1.02,11,11,2017-12-22,,"""The site has the benefit of an Outline planning permission. | Part of the site is brownfield (Approx 70%) and part is greenfield (Approx 30%). | The brownfield element of the site is approximately 1.02ha, whilst the total site size is some 1.46ha. | It is anticipated that the brownfield component of the site has a capacity for approximately 11 dwellings, whilst the total site capacity is some 16 dwellings. | The site is considered deliverable. | The map shows the full extent of the site and not only the brownfield area."". ""Outline application (access for approval) for erection of up to 16 dwellings and garages. | Part of the site is brownfield (Approx 70%) and part is greenfield (Approx 30%). | The brownfield element of the site is approximately 1.02ha, whilst the total site size is some 1.46ha. | It is anticipated that the brownfield component of the site has a capacity for approximately 11 dwellings, whilst the total site capacity is some 16 dwellings.""",d5049b03ac10ee85dc62fcb7126676754df97918c593f49b21b2aba2a9ffcb32
2017-12-22,local-authority-eng:SHR,14/01744/OUT,"Old Station Yard, Brownlow Road, Ellesmere, Shropshire",https://shropshire.maps.arcgis.com/apps/webappviewer/index.html?id=25b8fd6ba2fb4c878775a1aaea210576,yes,not owned by a public authority,permissioned,outline planning permission,,,,1.47,56,56,2017-12-22,,". ""Outline application (all matters reserved) for mixed residential development and formation of estate roads.""",d5049b03ac10ee85dc62fcb7126676754df97918c593f49b21b2aba2a9ffcb32
2017-12-22,local-authority-eng:SHR,14/02286/OUT,"Shropshire Stone & Granite, Station Road, Baschurch, Shrewsbury, SY4 2BQ",https://shropshire.maps.arcgis.com/apps/webappviewer/index.html?id=25b8fd6ba2fb4c878775a1aaea210576,yes,not owned by a public authority,permissioned,outline planning permission,,,,1.49,30,30,2017-12-22,,"""The site has the benefit of an Outline planning permission. | Part of the site is brownfield (Approx 60%) and part is greenfield (Approx 40%). | The brownfield element of the site is approximately 1.49ha, whilst the total site size is some 2.48ha. | It is anticipated that the brownfield component of the site has a capacity for approximately 30 dwellings, whilst the total site capacity is some 50 dwellings. | The site is considered deliverable. | The map shows the full extent of the site and not only the brownfield area."". ""Outline application (access for approval) for a mixed use development including 30 dwellings. | Part of the site is brownfield (Approx 60%) and part is greenfield (Approx 40%). | The brownfield element of the site is approximately 1.49ha, whilst the total site size is some 2.48ha. | It is anticipated that the brownfield component of the site has a capacity for approximately 30 dwellings, whilst the total site capacity is some 50 dwellings.""",d5049b03ac10ee85dc62fcb7126676754df97918c593f49b21b2aba2a9ffcb32
2017-12-22,local-authority-eng:SHR,14/02693/OUT,"Shropshire Council Offices, Westgate, Bridgnorth, Shropshire, WV16 5AA",https://shropshire.maps.arcgis.com/apps/webappviewer/index.html?id=25b8fd6ba2fb4c878775a1aaea210576,yes,owned by a public authority,pending decision,,,,,0.96,40,40,2017-12-22,,"""Outline application pending decision for a residential development on a Council owned site. | Positive consultation is ongoing regarding the disposal of this site."". ""Outline application pending decision for a residential development on a Council owned site. | Positive consultation is ongoing regarding the disposal of this site.""",d5049b03ac10ee85dc62fcb7126676754df97918c593f49b21b2aba2a9ffcb32
2017-12-22,local-authority-eng:SHR,14/02846/OUT,"Coach Depot, Fishmore Road, Ludlow, Shropshire, SY8 2LU",https://shropshire.maps.arcgis.com/apps/webappviewer/index.html?id=25b8fd6ba2fb4c878775a1aaea210576,yes,not owned by a public authority,permissioned,outline planning permission,,,,0.42,20,20,2017-12-22,,". ""Outline permission for the redevelopment of existing coach depot to residential development (all matters reserved).""",d5049b03ac10ee85dc62fcb7126676754df97918c593f49b21b2aba2a9ffcb32
2017-12-22,local-authority-eng:SHR,14/03091/OUT,"Shropshire Building Supplies, New Road, Ludlow, Shropshire, SY8 2LS",https://shropshire.maps.arcgis.com/apps/webappviewer/index.html?id=25b8fd6ba2fb4c878775a1aaea210576,yes,not owned by a public authority,permissioned,outline planning permission,,,,0.77,26,26,2017-12-22,,". ""Outline Planning application for residential development of 26no units to include erection of 20no houses and 6no apartments (to include access and layout).""",d5049b03ac10ee85dc62fcb7126676754df97918c593f49b21b2aba2a9ffcb32
2017-12-22,local-authority-eng:SHR,14/03475/OUT,"Salop Music Centre, St Michaels Street, Shrewsbury, Shropshire, SY1 2DE",https://shropshire.maps.arcgis.com/apps/webappviewer/index.html?id=25b8fd6ba2fb4c878775a1aaea210576,yes,not owned by a public authority,permissioned,outline planning permission,,,,0.31,24,24,2017-12-22,,". ""Outline application for residential development to include means of access.""",d5049b03ac10ee85dc62fcb7126676754df97918c593f49b21b2aba2a9ffcb32
2017-12-22,local-authority-eng:SHR,14/04383/FUL,"Princess House, The Square, Shrewsbury, Shropshire",https://shropshire.maps.arcgis.com/apps/webappviewer/index.html?id=25b8fd6ba2fb4c878775a1aaea210576,yes,not owned by a public authority,permissioned,full planning permission,,,,0.22,50,50,2017-12-22,,". ""Conversion of the existing office space and extension to provide a mixed use development including 50No residential apartments together with secure storage facilities.""",d5049b03ac10ee85dc62fcb7126676754df97918c593f49b21b2aba2a9ffcb32
2017-12-22,local-authority-eng:SHR,14/04772/OUT,"Land North Of Robin Hill, Lower Road, Myddle, Shropshire",https://shropshire.maps.arcgis.com/apps/webappviewer/index.html?id=25b8fd6ba2fb4c878775a1aaea210576,yes,not owned by a public authority,permissioned,outline planning permission,,,,0.39,5,5,2017-12-22,,". ""Outline application for the erection of three open market dwellings and two affordable dwellings (to include access).""",d5049b03ac10ee85dc62fcb7126676754df97918c593f49b21b2aba2a9ffcb32
2017-12-22,local-authority-eng:SHR,14/04891/OUT,"Rosewood Pet Products Ltd, 45 Coalport Road, Broseley, Shropshire, TF12 5AN",https://shropshire.maps.arcgis.com/apps/webappviewer/index.html?id=25b8fd6ba2fb4c878775a1aaea210576,yes,not owned by a public authority,permissioned,outline planning permission,,,,0.65,21,21,2017-12-22,,". ""Outline application for demolition of existing B8 warehouses and redevelopment for residential purposes (up to 21 dwellings) and associated access.""",d5049b03ac10ee85dc62fcb7126676754df97918c593f49b21b2aba2a9ffcb32
2017-12-22,local-authority-eng:SHR,14/04926/OUT,"Land Adjoining Towers Lawn, Market Drayton, Shropshire, TF9 3AA",https://shropshire.maps.arcgis.com/apps/webappviewer/index.html?id=25b8fd6ba2fb4c878775a1aaea210576,yes,not owned by a public authority,permissioned,outline planning permission,,,,0.21,30,30,2017-12-22,,". ""Outline planning application for residential development to include access and scale following demolition of all buildings on site.""",d5049b03ac10ee85dc62fcb7126676754df97918c593f49b21b2aba2a9ffcb32
2017-12-22,local-authority-eng:SHR,15/00415/OUT,"Land At 18 Dutton Close, Stoke Heath, Market Drayton, Shropshire, TF9 2JN",https://shropshire.maps.arcgis.com/apps/webappviewer/index.html?id=25b8fd6ba2fb4c878775a1aaea210576,yes,not owned by a public authority,permissioned,outline planning permission,,,,0.19,9,9,2017-12-22,,"""The site has the benefit of an Outline planning permission. | Part of the site is brownfield (Approx 25%) and part is greenfield (Approx 75%). | The brownfield element of the site is approximately 0.19ha, whilst the total site size is some 0.76ha. | It is anticipated that the brownfield component of the site has a capacity for approximately 9 dwellings, whilst the total site capacity is some 25 dwellings. | The site is considered deliverable. | The map shows the full extent of the site and not only the brownfield area."". ""Outline application for the erection of 25 dwellings (all matters reserved). | Site allocated within the SAMDev Plan (STH002). | Part of the site is brownfield (Approx 25%) and part is greenfield (Approx 75%). | The brownfield element of the site is approximately 0.19ha, whilst the total site size is some 0.76ha. | It is anticipated that the brownfield component of the site has a capacity for approximately 9 dwellings, whilst the total site capacity is some 25 dwellings.""",d5049b03ac10ee85dc62fcb7126676754df97918c593f49b21b2aba2a9ffcb32
2017-12-22,local-authority-eng:SHR,15/00949/FUL,"Ludford House, Overton Road, Ludford, Ludlow, SY8 1PJ",https://shropshire.maps.arcgis.com/apps/webappviewer/index.html?id=25b8fd6ba2fb4c878775a1aaea210576,yes,not owned by a public authority,permissioned,full planning permission,,,,0.25,7,7,2017-12-22,,". ""Conversion of existing buildings to create seven dwellings; including insertion of rooflights and glazed roofing.""",d5049b03ac10ee85dc62fcb7126676754df97918c593f49b21b2aba2a9ffcb32
2017-12-22,local-authority-eng:SHR,15/01786/FUL,"Prospect House, Belle Vue Road, Shrewsbury, Shropshire, SY3 7NR",https://shropshire.maps.arcgis.com/apps/webappviewer/index.html?id=25b8fd6ba2fb4c878775a1aaea210576,yes,not owned by a public authority,permissioned,full planning permission,,,,0.45,34,34,2017-12-22,,". ""Change of use from (Use Class) B1 office use to (Use Class) C3 residential use (34 apartments) with minor external alterations"".",d5049b03ac10ee85dc62fcb7126676754df97918c593f49b21b2aba2a9ffcb32
2017-12-22,local-authority-eng:SHR,15/02536/FUL,"36 Castle Street, Shrewsbury, Shropshire, SY1 2BW",https://shropshire.maps.arcgis.com/apps/webappviewer/index.html?id=25b8fd6ba2fb4c878775a1aaea210576,yes,not owned by a public authority,permissioned,full planning permission,,,,0.01,5,5,2017-12-22,,". ""Alterations to existing first floor flat; creation of five apartments.""",d5049b03ac10ee85dc62fcb7126676754df97918c593f49b21b2aba2a9ffcb32
2017-12-22,local-authority-eng:SHR,15/02552/FUL,"4 King Street, Ludlow, Shropshire, SY8 1AQ",https://shropshire.maps.arcgis.com/apps/webappviewer/index.html?id=25b8fd6ba2fb4c878775a1aaea210576,yes,not owned by a public authority,permissioned,full planning permission,,,,0.03,6,6,2017-12-22,,". ""Conversion of upper floors to create six flats and erection of rear extension at second floor.""",d5049b03ac10ee85dc62fcb7126676754df97918c593f49b21b2aba2a9ffcb32
2017-12-22,local-authority-eng:SHR,15/03969/OUT,"Stoke Heath Camp, Warrant Road, Stoke Heath, Shropshire",https://shropshire.maps.arcgis.com/apps/webappviewer/index.html?id=25b8fd6ba2fb4c878775a1aaea210576,yes,not owned by a public authority,permissioned,outline planning permission,,,,3.7,26,26,2017-12-22,,"""The site has the benefit of an Outline planning permission. | Part of the site is brownfield (Approx 75%) and part is greenfield (Approx 25%). | The brownfield element of the site is approximately 3.70ha, whilst the total site size is some 5.08ha. | It is anticipated that the brownfield component of the site has a capacity for approximately 26 dwellings, whilst the total site capacity is some 38 dwellings. | The site is considered deliverable. | The map shows the full extent of the site and not only the brownfield area."". ""Outline application for residential development (up to 38 no. dwellings) to include means of access; demolition of existing buildings and structures; remediation of site with associated highways and drainage infrastructure and other accommodation works. | Part of the site is brownfield (Approx 75%) and part is greenfield (Approx 25%). | The brownfield element of the site is approximately 3.70ha, whilst the total site size is some 5.08ha. | It is anticipated that the brownfield component of the site has a capacity for approximately 26 dwellings, whilst the total site capacity is some 38 dwellings.""",d5049b03ac10ee85dc62fcb7126676754df97918c593f49b21b2aba2a9ffcb32
2017-12-22,local-authority-eng:SHR,15/04613/REM,"Land North Of The Miners Arms, Morda Bank, Morda, Shropshire",https://shropshire.maps.arcgis.com/apps/webappviewer/index.html?id=25b8fd6ba2fb4c878775a1aaea210576,yes,not owned by a public authority,permissioned,reserved matters approval,,,,0.04,8,8,2017-12-22,,"""The site has the benefit of an Reserved matters approval. | Part of the site is brownfield (Approx 65%) and part is greenfield (Approx 45%). | The brownfield element of the site is approximately 0.04ha, whilst the total site size is some 0.06ha. |  The development involves the creation of 12 apartments, referencing the land split, approximately 8 of these apartments are located on the brownfield element of the site. | The site is considered deliverable.  | The map shows the full extent of the site and not only the brownfield area."". ""Approval of Reserved Matters pursuant to permission 12/05181/OUT for residential development of 12 apartments. | Part of the site is brownfield (Approx 65%) and part is greenfield (Approx 45%). | The brownfield element of the site is approximately 0.04ha, whilst the total site size is some 0.06ha. | The development involves the creation of 12 apartments, referencing the land split, approximately 8 of these apartments are located on the brownfield element of the site.""",d5049b03ac10ee85dc62fcb7126676754df97918c593f49b21b2aba2a9ffcb32
2017-12-22,local-authority-eng:SHR,15/05307/REM,"Gro Continental Ltd, Heathwood Road, Higher Heath, Whitchurch",https://shropshire.maps.arcgis.com/apps/webappviewer/index.html?id=25b8fd6ba2fb4c878775a1aaea210576,yes,not owned by a public authority,permissioned,reserved matters approval,,,,4.6,115,115,2017-12-22,,". ""Approval of Reserved Matters (access, appearance, landscaping, layout and scale) pursuant to permission NS/09/00111/OUT for the erection of 115 dwellings and associated public open space.""",d5049b03ac10ee85dc62fcb7126676754df97918c593f49b21b2aba2a9ffcb32
2017-12-22,local-authority-eng:SHR,15/05357/OUT,"Former Central Garage, Kidderminster Road, Alveley, Shropshire, WV15 6LL",https://shropshire.maps.arcgis.com/apps/webappviewer/index.html?id=25b8fd6ba2fb4c878775a1aaea210576,yes,not owned by a public authority,permissioned,outline planning permission,,,,0.66,19,19,2017-12-22,,". ""Outline application (all matters reserved) for residential development on the former Central Garage site.""",d5049b03ac10ee85dc62fcb7126676754df97918c593f49b21b2aba2a9ffcb32
