entry-date,organisation,site,site-address,site-plan-url,deliverable,ownership,planning-permission-status,planning-permission-type,hazardous-substances,latitude,longitude,hectares,minimum-net-dwellings,maximum-net-dwellings,start-date,end-date,notes,resource
2017-12-22,local-authority-eng:SHR,SHR003,"Richmond House, Harlescott, Shrewsbury",https://shropshire.maps.arcgis.com/apps/webappviewer/index.html?id=25b8fd6ba2fb4c878775a1aaea210576,,owned by a public authority,not permissioned,,,,,0.4,16,16,2017-12-22,,"""The site is being considered within the Strategic Land Availability Assessment (SLAA). | Site is considered suitable, likely to become available, achievable and viable."". ""Residential development for around 16 dwellings.""",d5049b03ac10ee85dc62fcb7126676754df97918c593f49b21b2aba2a9ffcb32
2017-12-22,local-authority-eng:SHR,SHR008,"Garages, Off Belvidere Lane, Shrewsbury",https://shropshire.maps.arcgis.com/apps/webappviewer/index.html?id=25b8fd6ba2fb4c878775a1aaea210576,,mixed ownership,not permissioned,,,,,0.2,5,5,2017-12-22,,"""The site is being considered within the Strategic Land Availability Assessment (SLAA). | Site is considered suitable, likely to become available, achievable and viable."". ""Redevelopment of the site for around 5 dwellings.""",d5049b03ac10ee85dc62fcb7126676754df97918c593f49b21b2aba2a9ffcb32
2017-12-22,local-authority-eng:SHR,SHR009,"Shrewsbury Prison, Dana, Shrewsbury",https://shropshire.maps.arcgis.com/apps/webappviewer/index.html?id=25b8fd6ba2fb4c878775a1aaea210576,yes,not owned by a public authority,permissioned,outline planning permission,,,,1.1,78,78,2017-12-22,,"""The site is being considered within the Strategic Land Availability Assessment (SLAA). | Site has recently been granted Outline Planning Permission (17/02809/OUT) for a mixed use development, including the formation of 78 dwellings. | Planning Permission was granted after 31st March 2017, the base date for the current Housing Land Supply. | Site is considered suitable, available, achievable and viable."". ""Redevelopment of the Dana Prison through a mixed use development including converting the existing prison buildings into student accommodation and residential dwellings.""",d5049b03ac10ee85dc62fcb7126676754df97918c593f49b21b2aba2a9ffcb32
2017-12-22,local-authority-eng:SHR,SHR014,"New Zealand House, Abbey Foregate",https://shropshire.maps.arcgis.com/apps/webappviewer/index.html?id=25b8fd6ba2fb4c878775a1aaea210576,yes,not owned by a public authority,not permissioned,,,,,0.27,30,30,2017-12-22,,"""The site is being considered within the Strategic Land Availability Assessment (SLAA). | Site is considered suitable, available, achievable and viable."". ""Conversion of the existing building to 30 apartments.""",d5049b03ac10ee85dc62fcb7126676754df97918c593f49b21b2aba2a9ffcb32
2017-12-22,local-authority-eng:SHR,SHR015,"Land at Whitehall, Shrewsbury",https://shropshire.maps.arcgis.com/apps/webappviewer/index.html?id=25b8fd6ba2fb4c878775a1aaea210576,,not owned by a public authority,not permissioned,,,,,0.9,45,45,2017-12-22,,"""The site is being considered within the Strategic Land Availability Assessment (SLAA). | Site is considered suitable, likely to become available, achievable and viable."". ""Redevelopment of land at Whitehall for residential development.""",d5049b03ac10ee85dc62fcb7126676754df97918c593f49b21b2aba2a9ffcb32
2017-12-22,local-authority-eng:SHR,SHR016,"Shrewsbury Training and Development Centre, Racecourse Crescent, Shrewsbury",https://shropshire.maps.arcgis.com/apps/webappviewer/index.html?id=25b8fd6ba2fb4c878775a1aaea210576,yes,owned by a public authority,not permissioned,,,,,0.3,16,16,2017-12-22,,"""The site is being considered within the Strategic Land Availability Assessment (SLAA). | Site is considered suitable, likely to become available, achievable and viable."". ""Redevelopment of Shrewsbury Training and Development Centre, Racecourse Crescent - this site does not include the car park to the rear of the site associated with the recreation ground.""",d5049b03ac10ee85dc62fcb7126676754df97918c593f49b21b2aba2a9ffcb32
2017-12-22,local-authority-eng:SHR,TER001,"Clive Barracks at Tern Hill, Shropshire",https://shropshire.maps.arcgis.com/apps/webappviewer/index.html?id=25b8fd6ba2fb4c878775a1aaea210576,,owned by a public authority,not permissioned,,,,,5E+1,500,500,2017-12-22,,"""The site is a strategic site that has been identified within the Local Plan Review. | The majority of the 50ha site is brownfield. It is anticipated that it has capacity for around 500 dwellings; 12ha of employment land; and appropriate community and leisure facilities associated with a development of this scale.  | It is anticipated that much of the delivery on this site will occur beyond the next 15 years."". ""Significant mixed use redevelopment, including around 500 dwellings. | It is anticipated that only a small element of this site will be delivered within the next 15 years.""",d5049b03ac10ee85dc62fcb7126676754df97918c593f49b21b2aba2a9ffcb32
2017-12-22,local-authority-eng:SHR,WHT001,"Garages on Wayland Close, Whitchurch",https://shropshire.maps.arcgis.com/apps/webappviewer/index.html?id=25b8fd6ba2fb4c878775a1aaea210576,,not owned by a public authority,not permissioned,,,,,0.06,5,5,2017-12-22,,"""The site is being considered within the Strategic Land Availability Assessment (SLAA). | Site is considered suitable, likely to become available, achievable and viable."". ""Redevelopment of the site for around 5 dwellings.""",d5049b03ac10ee85dc62fcb7126676754df97918c593f49b21b2aba2a9ffcb32
2017-12-22,local-authority-eng:SHR,WRN016,"Land at the Sawmills, Rhoswiel",https://shropshire.maps.arcgis.com/apps/webappviewer/index.html?id=25b8fd6ba2fb4c878775a1aaea210576,yes,not owned by a public authority,not permissioned,,,,,1.2,33,33,2017-12-22,,"""The site is allocated within the SAMDev Plan. The site is 100% brownfield and has a capacity for some 33 dwellings. | The site is considered deliverable."". ""The site is allocated within the SAMDev Plan. The site is 100% brownfield and has a capacity for some 33 dwellings.""",d5049b03ac10ee85dc62fcb7126676754df97918c593f49b21b2aba2a9ffcb32
