entry-date,organisation,site,site-address,site-plan-url,deliverable,ownership,planning-permission-status,planning-permission-type,hazardous-substances,latitude,longitude,hectares,minimum-net-dwellings,maximum-net-dwellings,start-date,end-date,notes,resource
2017-12-22,local-authority-eng:SHR,16/00725/FUL,"Mytton Mill, Forton Heath, Montford Bridge, Shrewsbury, SY4 1HA",https://shropshire.maps.arcgis.com/apps/webappviewer/index.html?id=25b8fd6ba2fb4c878775a1aaea210576,yes,not owned by a public authority,permissioned,full planning permission,,,,0.46,10,10,2017-12-22,,"""The site has the benefit of a Full planning permission. | Part of the site is brownfield (Approx 10%) and part is greenfield (Approx 90%). | The brownfield element of the site is approximately 0.46ha, whilst the total site size is some 4.62ha. | It is anticipated that the brownfield component of the site has a capacity for approximately 10 dwellings, whilst the total site capacity is some 12 dwellings. | The site is considered deliverable. | The map shows the full extent of the site and not only the brownfield area."". ""Conversion of redundant mill building into 10No residential units and erection of 2No detached dwellings including associated access and parking. | Part of the site is brownfield (Approx 10%) and part is greenfield (Approx 90%). | The brownfield element of the site is approximately 0.46ha, whilst the total site size is some 4.62ha. | It is anticipated that the brownfield component of the site has a capacity for approximately 10 dwellings, whilst the total site capacity is some 12 dwellings.""",d5049b03ac10ee85dc62fcb7126676754df97918c593f49b21b2aba2a9ffcb32
2017-12-22,local-authority-eng:SHR,16/00761/FUL,"Harvest House, Portcullis Lane, Ludlow, Shropshire, SY8 1PZ",https://shropshire.maps.arcgis.com/apps/webappviewer/index.html?id=25b8fd6ba2fb4c878775a1aaea210576,yes,not owned by a public authority,permissioned,full planning permission,,,,0.36,11,11,2017-12-22,,". ""Demolition of Harvest House and entrance/reception to Marston Mill; erection of 4-storey residential block comprising of 11 apartments; erection of single storey extension to Mill building with glazed link; elevational alterations; formation of courtyards and landscaping scheme.""",d5049b03ac10ee85dc62fcb7126676754df97918c593f49b21b2aba2a9ffcb32
2017-12-22,local-authority-eng:SHR,16/00902/REM,"Land Including Storage Buildings/Offices, Argoed Road, Kinnerley, Oswestry, Shropshire, SY10 8DH",https://shropshire.maps.arcgis.com/apps/webappviewer/index.html?id=25b8fd6ba2fb4c878775a1aaea210576,yes,not owned by a public authority,permissioned,reserved matters approval,,,,0.88,18,18,2017-12-22,,". ""Approval of reserved matters (scale, appearance, landscaping and layout) pursuant to 14/01703/OUT for the residential development of 18 properties (including affordable), detached garages, public open space, estate roads.""",d5049b03ac10ee85dc62fcb7126676754df97918c593f49b21b2aba2a9ffcb32
2017-12-22,local-authority-eng:SHR,16/01651/OUT,"Land Off Washford Road, Shrewsbury, Shropshire",https://shropshire.maps.arcgis.com/apps/webappviewer/index.html?id=25b8fd6ba2fb4c878775a1aaea210576,yes,not owned by a public authority,permissioned,outline planning permission,,,,0.23,6,6,2017-12-22,,". ""Outline application for residential development to include access.""",d5049b03ac10ee85dc62fcb7126676754df97918c593f49b21b2aba2a9ffcb32
2017-12-22,local-authority-eng:SHR,16/02684/FUL,"Land At 67 Mytton Oak Road, Shrewsbury, SY3 8UQ",https://shropshire.maps.arcgis.com/apps/webappviewer/index.html?id=25b8fd6ba2fb4c878775a1aaea210576,yes,not owned by a public authority,permissioned,full planning permission,,,,0.17,9,9,2017-12-22,,". ""Erection of  8 no. residential dwellings and 1 no. part conversion/new build dwelling; erection of detached garage for plot 2; formation of new vehicular access, car parking and associated landscaping following demolition of industrial shed and ancillary building.""",d5049b03ac10ee85dc62fcb7126676754df97918c593f49b21b2aba2a9ffcb32
2017-12-22,local-authority-eng:SHR,16/03096/OUT,"Land at Fishmore Road, Ludlow",https://shropshire.maps.arcgis.com/apps/webappviewer/index.html?id=25b8fd6ba2fb4c878775a1aaea210576,,not owned by a public authority,not permissioned,,,,,2.14,74,74,2017-12-22,,"""Outline Planning Permission previously granted on the 2011-12-21 (10/02056/OUT) for 94 dwellings. The application subsequently lapsed.|Outline Planning Application pending consideration (16/03096/OUT) for 74 dwellings."". ""Outline Planning Application pending consideration for 74 dwellings.""",d5049b03ac10ee85dc62fcb7126676754df97918c593f49b21b2aba2a9ffcb32
2017-12-22,local-authority-eng:SHR,16/03659/FUL,"Holland Broadbridge Agriculture House, 5 Barker Street, Shrewsbury, SY1 1QJ",https://shropshire.maps.arcgis.com/apps/webappviewer/index.html?id=25b8fd6ba2fb4c878775a1aaea210576,yes,not owned by a public authority,permissioned,full planning permission,,,,0.04,10,10,2017-12-22,,". ""Change of Use of the first and second floors from office use to residential use to form 10 apartments, to include an extension of the third floor.""",d5049b03ac10ee85dc62fcb7126676754df97918c593f49b21b2aba2a9ffcb32
2017-12-22,local-authority-eng:SHR,16/04426/FUL,"The Smithfield Hotel, 1 Salop Road, Oswestry, SY11 2NR",https://shropshire.maps.arcgis.com/apps/webappviewer/index.html?id=25b8fd6ba2fb4c878775a1aaea210576,yes,not owned by a public authority,permissioned,full planning permission,,,,0.05,7,7,2017-12-22,,". ""Conversion of hotel into seven residential apartments.""",d5049b03ac10ee85dc62fcb7126676754df97918c593f49b21b2aba2a9ffcb32
2017-12-22,local-authority-eng:SHR,16/04846/FUL,"Land At Former Garage Site, Manor Place, Higher Heath, Whitchurch, Shropshire",https://shropshire.maps.arcgis.com/apps/webappviewer/index.html?id=25b8fd6ba2fb4c878775a1aaea210576,yes,not owned by a public authority,permissioned,full planning permission,,,,0.14,5,5,2017-12-22,,". ""Erection of five dwellings and associated access"".",d5049b03ac10ee85dc62fcb7126676754df97918c593f49b21b2aba2a9ffcb32
2017-12-22,local-authority-eng:SHR,ALB003,"Caravan Storage, Station Road, Albrighton",https://shropshire.maps.arcgis.com/apps/webappviewer/index.html?id=25b8fd6ba2fb4c878775a1aaea210576,,not owned by a public authority,not permissioned,,,,,0.22,10,10,2017-12-22,,"""The site is being considered within the Strategic Land Availability Assessment (SLAA). | Site is considered suitable, likely to become available, achievable and viable."". ""Redevelopment of the site for around 10 dwellings.""",d5049b03ac10ee85dc62fcb7126676754df97918c593f49b21b2aba2a9ffcb32
2017-12-22,local-authority-eng:SHR,BRID001/BRID020b,"Land North of Wenlock Road, Tasley, Bridgnorth",https://shropshire.maps.arcgis.com/apps/webappviewer/index.html?id=25b8fd6ba2fb4c878775a1aaea210576,yes,not owned by a public authority,not permissioned,,,,,3.35,60,60,2017-12-22,,"""The site is allocated within the SAMDev Plan. Part of the site is brownfield (Approx 30%) and part is greenfield (Approx 70%). The brownfield element of the site is approximately 3.35ha, whilst the total site size is some 11.8ha. It is anticipated that the brownfield component of the site has a capacity for some 60 dwellings, whilst the total site capacity is some 200 dwellings. | The site is considered deliverable. | The map shows the full extent of the site and not only the brownfield area."". ""The site is allocated within the SAMDev Plan. | Part of the site is brownfield (Approx 30%) and part is greenfield (Approx 70%). | The brownfield element of the site is approximately 3.35ha, whilst the total site size is some 11.8ha. | It is anticipated that the brownfield component of the site has a capacity for some 60 dwellings, whilst the total site capacity is some 200 dwellings.""",d5049b03ac10ee85dc62fcb7126676754df97918c593f49b21b2aba2a9ffcb32
2017-12-22,local-authority-eng:SHR,BUCK001,"Timber/Station Yard, Bucknell",https://shropshire.maps.arcgis.com/apps/webappviewer/index.html?id=25b8fd6ba2fb4c878775a1aaea210576,yes,not owned by a public authority,not permissioned,,,,,1.72,50,50,2017-12-22,,"""The site is allocated within the SAMDev Plan. Part of the site is brownfield (Approx 65%) and part is greenfield (Approx 35%). The brownfield element of the site is approximately 1.72ha, whilst the total site size is some 3.63ha. It is anticipated that the brownfield component of the site has a capacity for some 50 dwellings, whilst the total site capacity is some 70 dwellings. | A Planning Application (13/03241/FUL) is currently pending consideration on this site. The application primarily consists of brownfield land and covers all of the brownfield land within the site allocation. | Development of the site is linked to the delivery of employment on the adjacent allocated employment site. | The site is at least in part linked to planned improvements to the Clun Catchment sewerage treatment works programmed for 2018. | The site is considered deliverable. | The map shows the full extent of the site and not only the brownfield area."". ""The site is allocated within the SAMDev Plan. | Part of the site is brownfield (Approx 65%) and part is greenfield (Approx 35%). | The brownfield element of the site is approximately 1.72ha, whilst the total site size is some 2.64ha. | It is anticipated that the brownfield component of the site has a capacity for some 50 dwellings, whilst the total site capacity is some 70 dwellings.""",d5049b03ac10ee85dc62fcb7126676754df97918c593f49b21b2aba2a9ffcb32
2017-12-22,local-authority-eng:SHR,CRA001,"Abbatoir Site, Corvedale Road, Craven Arms",https://shropshire.maps.arcgis.com/apps/webappviewer/index.html?id=25b8fd6ba2fb4c878775a1aaea210576,,not owned by a public authority,not permissioned,,,,,0.85,10,10,2017-12-22,,"""The site is being considered within the Strategic Land Availability Assessment (SLAA). | Site is considered suitable, likely to become available, achievable and viable."". ""Mixed use development opportunity following implementation of the planned relocation of the abattoir to Newington Farm, Craven Arms Employment Site. | It is expected that the residential element of the site would result in the formation of around 10 dwellings.""",d5049b03ac10ee85dc62fcb7126676754df97918c593f49b21b2aba2a9ffcb32
2017-12-22,local-authority-eng:SHR,CRA029,"GA Motor Services and Dawson Funeral Services, Corvedale Road, Craven Arms",https://shropshire.maps.arcgis.com/apps/webappviewer/index.html?id=25b8fd6ba2fb4c878775a1aaea210576,,not owned by a public authority,not permissioned,,,,,0.27,10,10,2017-12-22,,"""The site is being considered within the Strategic Land Availability Assessment (SLAA). | Site is considered suitable, likely to become available, achievable and viable."". ""Redevelopment opportunity to create around 10 dwellings.""",d5049b03ac10ee85dc62fcb7126676754df97918c593f49b21b2aba2a9ffcb32
2017-12-22,local-authority-eng:SHR,CST001,"Church Stretton Car Sales, Burway Road, Church Stretton",https://shropshire.maps.arcgis.com/apps/webappviewer/index.html?id=25b8fd6ba2fb4c878775a1aaea210576,,not owned by a public authority,not permissioned,,,,,0.1,8,8,2017-12-22,,"""The site is being considered within the Strategic Land Availability Assessment (SLAA). | Site is considered suitable, likely to become available, achievable and viable."". ""Redevelopment of the site for around 8 dwellings.""",d5049b03ac10ee85dc62fcb7126676754df97918c593f49b21b2aba2a9ffcb32
2017-12-22,local-authority-eng:SHR,CST002,"Crown Carpets, Burway Road, Church Stretton",https://shropshire.maps.arcgis.com/apps/webappviewer/index.html?id=25b8fd6ba2fb4c878775a1aaea210576,,not owned by a public authority,not permissioned,,,,,0.1,8,8,2017-12-22,,"""The site is being considered within the Strategic Land Availability Assessment (SLAA). | Site is considered suitable, likely to become available, achievable and viable."". ""Redevelopment of the site for around 8 dwellings.""",d5049b03ac10ee85dc62fcb7126676754df97918c593f49b21b2aba2a9ffcb32
2017-12-22,local-authority-eng:SHR,DUDH006,"Ravenscroft Haulage Site, Dudleston Heath",https://shropshire.maps.arcgis.com/apps/webappviewer/index.html?id=25b8fd6ba2fb4c878775a1aaea210576,yes,not owned by a public authority,not permissioned,,,,,0.48,7,7,2017-12-22,,"""The site is allocated within the SAMDev Plan. Part of the site is brownfield (Approx 35%) and part is greenfield (Approx 65%). The brownfield element of the site is approximately 0.48ha, whilst the total site size is some 1.39ha. It is anticipated that the brownfield component of the site has a capacity for some 7 dwellings, whilst the total site capacity is some 20 dwellings. | The site is considered deliverable. | The map shows the full extent of the site and not only the brownfield area."". ""The site is allocated within the SAMDev Plan. | Part of the site is brownfield (Approx 35%) and part is greenfield (Approx 65%). | The brownfield element of the site is approximately 0.48ha, whilst the total site size is some 1.39ha. | It is anticipated that the brownfield component of the site has a capacity for some 7 dwellings, whilst the total site capacity is some 20 dwellings.""",d5049b03ac10ee85dc62fcb7126676754df97918c593f49b21b2aba2a9ffcb32
2017-12-22,local-authority-eng:SHR,IRN001,"Former Ironbridge Power Station, Buildwas Road, Shropshire",https://shropshire.maps.arcgis.com/apps/webappviewer/index.html?id=25b8fd6ba2fb4c878775a1aaea210576,,not owned by a public authority,not permissioned,,,,,43.42,200,200,2017-12-22,,"""The site is a strategic site that has been identified within the Local Plan Review. | Part of the site is brownfield (Approx 30%) and part is greenfield (Approx 70%). | The brownfield element of the site is approximately ha, whilst the total site size is some 142ha. | It is anticipated that the brownfield component of the site has a capacity for around 200 dwellings, whilst the total site has capacity for around 1,000 dwellings. | Development of the site will involve significant employment development. | The site is considered deliverable in accordance with the timescales detailed in the Masterplan. | The map shows the full extent of the site and not only the brownfield area."". ""Significant mixed use redevelopment, including around 1,000 dwellings. | The brownfield element of the site is approximately 43.42ha, whilst the total site size is some 142ha. | It is anticipated that the brownfield component of the site has a capacity for approximately 200 dwellings, whilst the total site capacity is some 1,000 dwellings. |It is anticipated that much of the delivery on this site will occur beyond the next 15 years.""",d5049b03ac10ee85dc62fcb7126676754df97918c593f49b21b2aba2a9ffcb32
2017-12-22,local-authority-eng:SHR,LUD022,"Morris Bufton, Galdeford, Ludlow",https://shropshire.maps.arcgis.com/apps/webappviewer/index.html?id=25b8fd6ba2fb4c878775a1aaea210576,yes,not owned by a public authority,not permissioned,,,,,1.36,30,30,2017-12-22,,"""Part of the site has recently been granted Planning Permission for a new commercial unit and associated infrastructure. | Much of the remainder of the site is currently occupied, however it is considered that the site will become available for residential development in the future. The site is considered suitable, achievable and viable"".. ""Redevelopment of land for a mixture of uses including residential dwellings.""",d5049b03ac10ee85dc62fcb7126676754df97918c593f49b21b2aba2a9ffcb32
2017-12-22,local-authority-eng:SHR,MDR001,"77-83 Shropshire Street, Market Drayton",https://shropshire.maps.arcgis.com/apps/webappviewer/index.html?id=25b8fd6ba2fb4c878775a1aaea210576,yes,not owned by a public authority,not permissioned,,,,,0.08,5,5,2017-12-22,,"""The site is being considered within the Strategic Land Availability Assessment (SLAA). | Site is considered suitable, likely to become available, achievable and viable."". ""Redevelopment of the site for around 5 dwellings.""",d5049b03ac10ee85dc62fcb7126676754df97918c593f49b21b2aba2a9ffcb32
2017-12-22,local-authority-eng:SHR,MDR002,"Car Sales Area, Salisbury Road, Market Drayton",https://shropshire.maps.arcgis.com/apps/webappviewer/index.html?id=25b8fd6ba2fb4c878775a1aaea210576,,not owned by a public authority,not permissioned,,,,,0.14,5,5,2017-12-22,,"""The site is being considered within the Strategic Land Availability Assessment (SLAA). | Site is considered suitable, likely to become available, achievable and viable."". ""Redevelopment of the site for around 5 dwellings.""",d5049b03ac10ee85dc62fcb7126676754df97918c593f49b21b2aba2a9ffcb32
2017-12-22,local-authority-eng:SHR,MDR003,"Haulage Yard, Market Drayton",https://shropshire.maps.arcgis.com/apps/webappviewer/index.html?id=25b8fd6ba2fb4c878775a1aaea210576,,not owned by a public authority,not permissioned,,,,,0.19,10,10,2017-12-22,,"""The site is being considered within the Strategic Land Availability Assessment (SLAA). | Part of the site is brownfield (Approx 85%) and part is greenfield (Approx 15%). The brownfield element of the site is approximately 0.19ha, whilst the total site size is some 0.23ha. Redevelopment of the brownfield element of the site for around 10 dwellings, whilst the total site capacity is some 12 dwellings. |Site is considered suitable, likely to become available, achievable and viable."". ""Redevelopment of the brownfield element of the site for around 10 dwellings, whilst the total site capacity is some 12 dwellings.""",d5049b03ac10ee85dc62fcb7126676754df97918c593f49b21b2aba2a9ffcb32
2017-12-22,local-authority-eng:SHR,MDR004,"Cricket Club, Betton Road, Market Drayton",https://shropshire.maps.arcgis.com/apps/webappviewer/index.html?id=25b8fd6ba2fb4c878775a1aaea210576,,not owned by a public authority,not permissioned,,,,,0.29,11,11,2017-12-22,,"""The site is being considered within the Strategic Land Availability Assessment (SLAA). | Site is considered suitable, likely to become available, achievable and viable."". ""Opportunity to redevelop the brownfield element of the site only. | Suitable for a mixed use development including medium density residential development typically comprising a mix of detached, semi-detached and terraced dwellings.""",d5049b03ac10ee85dc62fcb7126676754df97918c593f49b21b2aba2a9ffcb32
2017-12-22,local-authority-eng:SHR,MDR026,"Pet Market, Shrewsbury Road, Market Drayton",https://shropshire.maps.arcgis.com/apps/webappviewer/index.html?id=25b8fd6ba2fb4c878775a1aaea210576,yes,not owned by a public authority,not permissioned,,,,,0.14,5,5,2017-12-22,,"""The site is being considered within the Strategic Land Availability Assessment (SLAA). | Site is considered suitable, available, achievable and viable."". ""Redevelopment of the site for around 5 dwellings.""",d5049b03ac10ee85dc62fcb7126676754df97918c593f49b21b2aba2a9ffcb32
2017-12-22,local-authority-eng:SHR,MIN004,"The Garage, Minsterley, Shrewsbury, Shropshire, SY5 0BW",https://shropshire.maps.arcgis.com/apps/webappviewer/index.html?id=25b8fd6ba2fb4c878775a1aaea210576,yes,not owned by a public authority,not permissioned,,,,,0.56,13,13,2017-12-22,,"""The site is being considered within the Strategic Land Availability Assessment (SLAA). | Site is considered suitable, available, achievable and viable."". ""Mixed use development including 13 dwellings.""",d5049b03ac10ee85dc62fcb7126676754df97918c593f49b21b2aba2a9ffcb32
2017-12-22,local-authority-eng:SHR,MUW001,"Smithfield Works, Much Wenlock",https://shropshire.maps.arcgis.com/apps/webappviewer/index.html?id=25b8fd6ba2fb4c878775a1aaea210576,,not owned by a public authority,not permissioned,,,,,0.55,10,10,2017-12-22,,"""The site is being considered within the Strategic Land Availability Assessment (SLAA). | Site is considered suitable, likely to become available, achievable and viable."". ""Redevelopment opportunity to create around 10 dwellings.""",d5049b03ac10ee85dc62fcb7126676754df97918c593f49b21b2aba2a9ffcb32
2017-12-22,local-authority-eng:SHR,OSW002,"Health Centre/ Adult Training Centre, Victoria Rd, Oswestry",https://shropshire.maps.arcgis.com/apps/webappviewer/index.html?id=25b8fd6ba2fb4c878775a1aaea210576,yes,owned by a public authority,not permissioned,,,,,0.73,22,22,2017-12-22,,"""The site is being considered within the Strategic Land Availability Assessment (SLAA). | Site is considered suitable, available, achievable and viable."". ""Redevelopment of land for a mixture of uses including residential dwellings.""",d5049b03ac10ee85dc62fcb7126676754df97918c593f49b21b2aba2a9ffcb32
2017-12-22,local-authority-eng:SHR,OSW005,"Roy Evans Garage, Oak Street, Oswestry",https://shropshire.maps.arcgis.com/apps/webappviewer/index.html?id=25b8fd6ba2fb4c878775a1aaea210576,,not owned by a public authority,not permissioned,,,,,0.07,5,5,2017-12-22,,"""The site is being considered within the Strategic Land Availability Assessment (SLAA). | Site is considered suitable, likely to become available, achievable and viable."". ""Redevelopment of the site for around 5 dwellings.""",d5049b03ac10ee85dc62fcb7126676754df97918c593f49b21b2aba2a9ffcb32
2017-12-22,local-authority-eng:SHR,OSW006,"Garages site, Whittington Road, Oswestry",https://shropshire.maps.arcgis.com/apps/webappviewer/index.html?id=25b8fd6ba2fb4c878775a1aaea210576,,not owned by a public authority,not permissioned,,,,,0.23,7,7,2017-12-22,,"""The site is being considered within the Strategic Land Availability Assessment (SLAA). | Site is considered suitable, likely to become available, achievable and viable."". ""Redevelopment of the site for around 7 dwellings.""",d5049b03ac10ee85dc62fcb7126676754df97918c593f49b21b2aba2a9ffcb32
2017-12-22,local-authority-eng:SHR,OSW042,"Richard Burbidge, Oswestry",https://shropshire.maps.arcgis.com/apps/webappviewer/index.html?id=25b8fd6ba2fb4c878775a1aaea210576,yes,not owned by a public authority,permissioned,full planning permission,,,,4.25,183,183,2017-12-22,,"""The site is brownfield and has been allocated within the SAMDev Plan. | Part of the site benefits from Planning Permission granted on the 18/02/2016 (15/03727/FUL) for 53 dwellings. |The remainder of the site does not yet have Planning Permission but has a capacity for around 130 dwellings. |All elements of the site are considered deliverable."". ""SAMDev Plan allocation. | Part of the site benefits from Planning Permission granted on the 18/02/2016 (15/03727/FUL) for 53 dwellings. |The remainder of the site does not yet have Planning Permission but has a capacity for around 130 dwellings.""",d5049b03ac10ee85dc62fcb7126676754df97918c593f49b21b2aba2a9ffcb32
2017-12-22,local-authority-eng:SHR,SHF003,"Former Magistrates Court and Fire Station, Shifnal",https://shropshire.maps.arcgis.com/apps/webappviewer/index.html?id=25b8fd6ba2fb4c878775a1aaea210576,yes,not owned by a public authority,permissioned,full planning permission,,,,0.09,7,7,2017-12-22,,"""The site is being considered within the Strategic Land Availability Assessment (SLAA). | Site has recently been granted Full Planning Permission (17/01565/FUL) for the erection of 7 apartments (in 2 blocks). | Planning Permission was granted after 31st March 2017, the base date for the current Housing Land Supply. | Site is considered suitable, available, achievable and viable."". ""Erection of 7 apartments (2 blocks) following demolition of existing building, associated parking and amenity space.""",d5049b03ac10ee85dc62fcb7126676754df97918c593f49b21b2aba2a9ffcb32
2017-12-22,local-authority-eng:SHR,SHF004,"Land to the rear of Jaspers, Shrewsbury Road, Shifnal",https://shropshire.maps.arcgis.com/apps/webappviewer/index.html?id=25b8fd6ba2fb4c878775a1aaea210576,,not owned by a public authority,not permissioned,,,,,0.11,5,5,2017-12-22,,"""The site is being considered within the Strategic Land Availability Assessment (SLAA). | Site is considered suitable, likely to become available, achievable and viable."". ""Redevelopment of the site for around 5 dwellings.""",d5049b03ac10ee85dc62fcb7126676754df97918c593f49b21b2aba2a9ffcb32
2017-12-22,local-authority-eng:SHR,SHF027,"Garage off Bradford Street, Shifnal",https://shropshire.maps.arcgis.com/apps/webappviewer/index.html?id=25b8fd6ba2fb4c878775a1aaea210576,yes,not owned by a public authority,not permissioned,,,,,0.23,5,5,2017-12-22,,"""The site is being considered within the Strategic Land Availability Assessment (SLAA). | Site is considered suitable, available, achievable and viable."". ""Redevelopment of the site including 5 dwellings.""",d5049b03ac10ee85dc62fcb7126676754df97918c593f49b21b2aba2a9ffcb32
2017-12-22,local-authority-eng:SHR,SHR002,"The Hollies, Sutton Road, Shrewsbury",https://shropshire.maps.arcgis.com/apps/webappviewer/index.html?id=25b8fd6ba2fb4c878775a1aaea210576,yes,not owned by a public authority,not permissioned,,,,,0.3,18,18,2017-12-22,,"""The site is being considered within the Strategic Land Availability Assessment (SLAA). | The site is considered suitable, available, achievable and viable for development. | Part of the site is brownfield (Approx 70%) and part is greenfield (Approx 30%). | The brownfield element of the site is approximately 0.30ha, whilst the total site size is some 0.42ha. | The site is located within a conservation area and contains an attractive older building, which it is anticipated would be retained and converted to dwellings. | It is anticipated that all the development would occur on the brownfield component of the site which has a capacity for around 18 dwellings. | The map shows the full extent of the site and not only the brownfield area."". ""Conversion of the existing building to 18 apartments.""",d5049b03ac10ee85dc62fcb7126676754df97918c593f49b21b2aba2a9ffcb32
