entry-date,organisation,site,site-address,site-plan-url,deliverable,ownership,planning-permission-status,planning-permission-type,hazardous-substances,latitude,longitude,hectares,minimum-net-dwellings,maximum-net-dwellings,start-date,end-date,notes,resource
2019-12-19,local-authority-eng:WOI,BLR2019001,"Part of Barnsbury Site 2, Hawthorn Road, Woking, GU22 0BN",http://www.woking2027.info/ldfregisters,,owned by a public authority,not permissioned,,,51.305,-0.566,0.31,8,8,2018-12-20,,Amended version of pre-existing site.,d86d8d0dfc5ae7426838a785d05257aff9f72d0d1c02823d517a99908e9178e3
2019-12-19,local-authority-eng:WOI,BLR2019002,"101-111 Chertsey Road, Woking, GU21 5BW",http://www.woking2027.info/ldfregisters,,not owned by a public authority,permissioned,other,,51.322,-0.554,0.24,64,64,2018-12-20,,"Amended version of pre-existing site. 111 Chertsey Road planning history is detailed. 101 Chertsey Road: no planning history.. 111 Chertsey Road: ""Prior notification for a proposed change of use of offices (B1) to dwelling (C3) to create 5 no. self-contained apartments"" (PLAN/2019/0038); ""Prior Notification for proposed Change of Use from Office Use (Use Class B1(a)) to Dwellinghouse Use (Use Class C3) to provide 49x one bed self-contained flats"" (PLAN/2018/1167); ""Prior notification for a proposed change of use of offices (B1) to dwellings (C3) - conversion of existing office building into residential to provide 27No. apartments (24No. x 1 bed and 3No. x 2 bed)."" (PLAN/2017/0800).",d86d8d0dfc5ae7426838a785d05257aff9f72d0d1c02823d517a99908e9178e3
2019-12-19,local-authority-eng:WOI,BLR2019003,"The Crescent, Heathside Crescent, Woking, GU22 7AG",http://www.woking2027.info/ldfregisters,,not owned by a public authority,not permissioned,,,51.317,-0.557,0.06,10,10,2018-12-20,,Amended version of pre-existing site.,d86d8d0dfc5ae7426838a785d05257aff9f72d0d1c02823d517a99908e9178e3
2019-12-19,local-authority-eng:WOI,BLR2019004,"Station Plaza, Station Approach, Woking",http://www.woking2027.info/ldfregisters,,owned by a public authority,not permissioned,,,51.318,-0.557,0.38,200,200,2019-12-19,,No planning history to date.,d86d8d0dfc5ae7426838a785d05257aff9f72d0d1c02823d517a99908e9178e3
2019-12-19,local-authority-eng:WOI,NSHLAASJT001,"Edbrooke House, 11-13 St John's Road, St John's, GU21 7SE",http://www.woking2027.info/ldfregisters,yes,not owned by a public authority,permissioned,full planning permission,,51.312,-5.951,0.04,5,5,2018-12-20,,PLAN/2017/0774. New entry in 2018.,d86d8d0dfc5ae7426838a785d05257aff9f72d0d1c02823d517a99908e9178e3
2019-12-19,local-authority-eng:WOI,SHLAABWB012,"Library, 71 High Road, Byfleet, KT14 7QN",http://www.woking2027.info/ldfregisters,,owned by a public authority,not permissioned,,,54.396,-5.681,0.13,12,12,2017-12-20,,Site is in Flood Zone 2,d86d8d0dfc5ae7426838a785d05257aff9f72d0d1c02823d517a99908e9178e3
2019-12-19,local-authority-eng:WOI,SHLAABWB022,"Land at Station Approach, West Byfleet KT14 6NG",http://www.woking2027.info/ldfregisters,,not owned by a public authority,permissioned,outline planning permission,,54.378,-5.682,0.91,214,214,2017-12-20,,"PLAN/2017/0128 granted at Planning committee, pending signed S106 agreement. Relates the part of the site east of Station Approach.. ""Outline planning application (all matters reserved except for access) for demolition of all buildings on the site and retail and leisure led mixed use redevelopment comprising up to 5,000 sqm GIA of retail and leisure uses (Use Classes A1/A2/A3/A4/A5), up to 2,000 sqm GIA of commercial use (Use Class B1a), up to 20,500sq m GIA residential (or maximum of 255 units) (Use Class C2/C3 or C3), up to 300 sqm GIA of community use (Use Class D1), together with the provision of basement space, car and cycle parking, highway works, public realm improvements and associated works (amended plans relating to north-west corner of Building B1).""",d86d8d0dfc5ae7426838a785d05257aff9f72d0d1c02823d517a99908e9178e3
2019-12-19,local-authority-eng:WOI,SHLAABWB024,"Camphill Club and Scout Hut, Camphill Road, West Byfleet KT14 6EF",http://www.woking2027.info/ldfregisters,,not owned by a public authority,not permissioned,,,54.381,-5.677,0.38,28,28,2017-12-20,,No planning history to date.,d86d8d0dfc5ae7426838a785d05257aff9f72d0d1c02823d517a99908e9178e3
2019-12-19,local-authority-eng:WOI,SHLAABWB025,"1, 3, 5, 7, 9, 11, 13 and 15, Old Woking Road, West Byfleet, KT14 6LW",http://www.woking2027.info/ldfregisters,yes,not owned by a public authority,permissioned,full planning permission,,54.378,-5.683,0.14,8,8,2017-12-20,,"There are a number of permissions on this site: PLAN/2016/1019 approved for 2 flats; PLAN/2011/0680 for 3 flats; PLAN/2015/1362 for 5 flats (the latter permission is detailed under DevelopmentDescription, and is under construction).. ""Part retrospective application for change of use into five self contained flats (4No. 1 Bed & 1No. 2 Bed) with retention of 2No. reduced size retail units on the ground floor. Associated erection of 2No. rear dormers, alterations to side and rear fenestration, formation of additional doorway to front elevation, demolition of existing single storey rear extensions, formation of courtyard and provision of five car parking spaces and bin and cycle storage with soft landscaping.""",d86d8d0dfc5ae7426838a785d05257aff9f72d0d1c02823d517a99908e9178e3
2019-12-19,local-authority-eng:WOI,SHLAABWB027,"Globe House, Lavender Park Road, West Byfleet KT14 6ND",http://www.woking2027.info/ldfregisters,,not owned by a public authority,permissioned,full planning permission,,51.339,-0.505,0.08,6,6,2017-12-20,,"PLAN/2016/0990 permitted subject to legal agreement. PLAN/2016/0180 refused.. ""Extension of the existing Globe House to increase living space on existing apartments and to create 6no self contained flats (3no studio and 3no 1 bed units) with associated landscaping works (Amended Description) (Amended Plans).""",d86d8d0dfc5ae7426838a785d05257aff9f72d0d1c02823d517a99908e9178e3
2019-12-19,local-authority-eng:WOI,SHLAABWB032,"3 Claremont Road, West Byfleet, KT14 6DY",http://www.woking2027.info/ldfregisters,,not owned by a public authority,permissioned,full planning permission,,54.377,-5.679,0.06,6,6,2017-12-20,,"PLAN/2017/0761 permitted subject to legal agreement.. ""Change of use and sub-division of existing office (B1a use) building into 3x three storey dwellings (2x bed), erection of two storey rear extension, insertion of side-facing windows and associated external alterations plus erection of 3x two storey terraced dwellings (1x bed) to the rear plus associated parking and landscaping following demolition of existing garage (Amended Plans & Description)""",d86d8d0dfc5ae7426838a785d05257aff9f72d0d1c02823d517a99908e9178e3
2019-12-19,local-authority-eng:WOI,SHLAACAN001,"Trizancia House and Woodstead House, 72 Chertsey Road, Woking, GU21 5BJ",http://www.woking2027.info/ldfregisters,,not owned by a public authority,not permissioned,,,54.346,-5.708,0.15,50,50,2017-12-20,,References for planning history PLAN/2015/0545 and PLAN/2014/0759,d86d8d0dfc5ae7426838a785d05257aff9f72d0d1c02823d517a99908e9178e3
2019-12-19,local-authority-eng:WOI,SHLAACAN002,"The Cornerstone, The Broadway and Elizabeth House, Duke Street, Woking, GU21 5AS",http://www.woking2027.info/ldfregisters,yes,not owned by a public authority,permissioned,full planning permission,,54.346,-5.712,0.21,94,94,2017-12-20,,"Site yield is based on the most recent prior approval (PLAN/2019/0645).. ""Prior notification for a proposed change of use - conversion of Elizabeth House and The Cornerstone office buildings (Class B1a) to create 70 residential units (Class C3) (PLAN/2016/0423); Prior notification for a proposed change of use from office (Use Class B1a) to 94x residential units (Use Class C3). (PLAN/2019/0645)""",d86d8d0dfc5ae7426838a785d05257aff9f72d0d1c02823d517a99908e9178e3
2019-12-19,local-authority-eng:WOI,SHLAACAN004,"2-24 and 13-28 Commercial Way and High Street, Woking, GU21 6BW",http://www.woking2027.info/ldfregisters,,mixed ownership,not permissioned,,,54.343,-5.714,0.45,50,50,2017-12-20,,,d86d8d0dfc5ae7426838a785d05257aff9f72d0d1c02823d517a99908e9178e3
2019-12-19,local-authority-eng:WOI,SHLAACAN006,"1-12 and 26-34 High Street and Commercial Way, Woking GU21 6EN",http://www.woking2027.info/ldfregisters,,mixed ownership,not permissioned,,,54.344,-5.713,0.58,149,149,2017-12-20,,,d86d8d0dfc5ae7426838a785d05257aff9f72d0d1c02823d517a99908e9178e3
2019-12-19,local-authority-eng:WOI,SHLAACAN007,"Regent House, 19-20, The Broadway, Woking, GU21 5AP",http://www.woking2027.info/ldfregisters,yes,not owned by a public authority,permissioned,full planning permission,,54.345,-5.712,0.04,15,15,2017-12-20,,"PLAN/2017/0070 prior approval given in DevelopmentDescription.  In this case, the min net dwellings is based on indicative density from the SHLAA Methodology 2017 Appendix 4 rather than the prior notification. Also PLAN/2017/0583: Proposed re-fenestration of upper floors of building to facilitate implementation of prior approval for residential use [Plan/2017/0070] and the construction of a new service core, infilling of ground floor and small rear extension to allow: the creation of an additional retail unit at ground floor level, both ground floor units to be in flexible retail use [A1, A2 and A3]. ""Prior notification for a proposed change of use of offices (B1) to dwelling (C3) - conversion of the upper floors to provide 15 apartments (12 x studios and 3 x 1 bed flats)"" (PLAN/2017/0070)",d86d8d0dfc5ae7426838a785d05257aff9f72d0d1c02823d517a99908e9178e3
2019-12-19,local-authority-eng:WOI,SHLAACAN011,"95-105 Maybury Road, Woking GU21 5JL",http://www.woking2027.info/ldfregisters,,not owned by a public authority,not permissioned,,,54.35,-5.707,0.81,61,61,2017-12-20,,,d86d8d0dfc5ae7426838a785d05257aff9f72d0d1c02823d517a99908e9178e3
2019-12-19,local-authority-eng:WOI,SHLAACAN015,"33-35 Portugal Road, Woking, GU21 5JE",http://www.woking2027.info/ldfregisters,,not owned by a public authority,permissioned,full planning permission,,54.348,-5.709,0.32,30,30,2017-12-20,,"PLAN/2017/0317 detailed is not for residential use, but for a car show room. However the site has potential for residential development and the min net dwellings is based on indicative density from the SHLAA Methodology 2017 Appendix 4.. ""To convert garages to a showroom use (ancillary to Class B1 use of the building) with addition of a pitched roof.""",d86d8d0dfc5ae7426838a785d05257aff9f72d0d1c02823d517a99908e9178e3
2019-12-19,local-authority-eng:WOI,SHLAACAN017,"Walton Road Youth Centre, Walton Road, Woking GU21 5DL",http://www.woking2027.info/ldfregisters,,owned by a public authority,permissioned,other,,54.346,-5.709,0.08,31,31,2017-12-20,,"PLAN/2017/0241 (formal consultation for prior approval for demolition of existing building). ""Consultation from Surrey County Council for prior approval for demolition of existing building on the former Youth Centre.""",d86d8d0dfc5ae7426838a785d05257aff9f72d0d1c02823d517a99908e9178e3
2019-12-19,local-authority-eng:WOI,SHLAACAN018,"29-31 Walton Road, Woking, GU21 5DL",http://www.woking2027.info/ldfregisters,yes,not owned by a public authority,permissioned,full planning permission,,54.347,-5.709,0.05,10,10,2017-12-20,,"PLAN/2017/0146 and PLAN/2009/0281. ""Demolition of the existing building and the erection of a 4 storey building comprising 14 apartments (6x one bed, 5x two bed and 3x three bed) with associated parking.""",d86d8d0dfc5ae7426838a785d05257aff9f72d0d1c02823d517a99908e9178e3
2019-12-19,local-authority-eng:WOI,SHLAACAN020,"27 North Road, Woking GU21 5DT",http://www.woking2027.info/ldfregisters,yes,not owned by a public authority,not permissioned,,,54.349,-5.704,0.06,7,7,2017-12-20,,PLAN/2014/1333 permitted subject to legal agreement has expired.,d86d8d0dfc5ae7426838a785d05257aff9f72d0d1c02823d517a99908e9178e3
2019-12-19,local-authority-eng:WOI,SHLAACAN027,"30-32 Woking Railway and Athletic Club, Systems House, Bridge House, Goldsworth Road, Woking, GU21 6JT",http://www.woking2027.info/ldfregisters,yes,not owned by a public authority,pending decision,,,54.341,-5.716,0.72,125,125,2017-12-20,,"PLAN/2016/0742 pending signed legal agreement, resolution to grant. Historic permissions PLAN/2007/1298 and PLAN/2008/1350. ""Demolition and clearance of the site and erection of a phased development comprising 560 residential units, 10,582 sqm of offices, 843 sqm of retail and gym use (A1-A4 and D2) with 395 parking spaces, public realm improvements and highway works to Goldsworth Road. Block A to comprise ground plus 34 storeys, Block B comprising ground plus 25 and 20 storeys, and Block C comprising ground plus 17, 14 and 10 storeys.""",d86d8d0dfc5ae7426838a785d05257aff9f72d0d1c02823d517a99908e9178e3
2019-12-19,local-authority-eng:WOI,SHLAACAN028,"1-7 Victoria Way and 1-29 Goldsworth Road, Woking GU21 6JZ",http://www.woking2027.info/ldfregisters,,not owned by a public authority,not permissioned,,,54.341,-5.715,0.3,55,55,2017-12-20,,No planning history to date.,d86d8d0dfc5ae7426838a785d05257aff9f72d0d1c02823d517a99908e9178e3
2019-12-19,local-authority-eng:WOI,SHLAACAN030,"The Big Apple American Amusements Ltd, HG Wells Conference Centre, the former Rat and Parrot PH, 48-58 Chertsey Road, Woking GU21 5AJ",http://www.woking2027.info/ldfregisters,,mixed ownership,permissioned,full planning permission,,54.345,-5.71,0.69,67,67,2017-12-20,,"PLAN/2017/0802 granted subject to S106 agreement (12/12/2017 Planning Committee). This application relates to one part of the site - the former Rat and Parrot public house. There is a pending planning application at Crown Place for ""Demolition of all existing buildings including existing footbridge to Victoria Way Car Park and redevelopment of site to provide a new building ranging from 5x to 28x storeys plus basement level comprising up to 366x residential units (Use Class C3),  commercial (Use Classes A1/A2/A3) and community uses (Use Classes D1/D2) at ground floor and first floor level and associated internal and external amenity spaces, basement level car parking, cycle parking, bin storage, ancillary facilities, plant, new public realm, landscaping and highway works."" (PLAN/2019/1141). ""Erection of a 12x storey building comprising 68x self-contained flats (50x one bed, 16x two bed & 2x three bed) including associated landscaping and parking following demolition of existing vacant Public House (Use Class A4).""",d86d8d0dfc5ae7426838a785d05257aff9f72d0d1c02823d517a99908e9178e3
2019-12-19,local-authority-eng:WOI,SHLAACAN033,"The former Goldsworth Arms Public House, Goldsworth Road, Woking, GU21 6LQ",http://www.woking2027.info/ldfregisters,yes,not owned by a public authority,not permissioned,,,54.339,-5.716,0.12,43,43,2017-12-20,,"PLAN/2016/0927: No Further Action (""Erection of a 5 and 6 storey building containing 43no. affordable residential flats (x32no. 2 bedroom and x11no. 1 bedroom) over a flexible use unit (Class A1, A2 or D1), car parking, cycle parking and amenity space."")",d86d8d0dfc5ae7426838a785d05257aff9f72d0d1c02823d517a99908e9178e3
2019-12-19,local-authority-eng:WOI,SHLAACAN035,"Chester House, 76-78 Chertsey Road, Woking, GU21 5BJ",http://www.woking2027.info/ldfregisters,yes,not owned by a public authority,permissioned,full planning permission,,54.346,-5.707,0.15,14,14,2017-12-20,,"PLAN/2015/0912 detailed, but non-residential; PLAN/2016/0561 prior approval refused; PLAN/2014/0759 non-determined application for offices and 64 flats, appeal dismissed.. ""Erection of an eight storey office building to provide 6,500 sqm of office floorspace (Use Class B1a) plus basement level ancillary accommodation, following the demolition of the existing building""",d86d8d0dfc5ae7426838a785d05257aff9f72d0d1c02823d517a99908e9178e3
2019-12-19,local-authority-eng:WOI,SHLAACAN037,"Parrington Autos, rear of 12 and 12-16, Portugal Road, Maybury, GU21 5JE",http://www.woking2027.info/ldfregisters,,not owned by a public authority,permissioned,full planning permission,,54.347,-5.709,0.12,8,8,2017-12-20,,"PLAN/2016/0412 pending decision, resolution to grant.. ""Proposed erection of a 3-4 storey building containing 18x self-contained flats (2x 1x bed and 16x 2xbed) following demolition of existing buildings including Nos 12-16 Portugal Road with associated car parking, landscaping, bin and cycle storage (AMENDED PLANS)""",d86d8d0dfc5ae7426838a785d05257aff9f72d0d1c02823d517a99908e9178e3
2019-12-19,local-authority-eng:WOI,SHLAACAN039,"Church Gate, 9-11 Church Street West, Woking, GU21 6DJ",http://www.woking2027.info/ldfregisters,yes,not owned by a public authority,permissioned,full planning permission,,54.34,-5.715,0.09,32,32,2017-12-20,,"PLAN/2016/0438,  PLAN/2018/0741: approved. PLAN/2019/1090: pending prior notification. detailed in DevelopmentDescription.. ""Prior notification for a proposed change of use - conversion of office building (Class B1a) to create 32 dwellings (Class C3) (PLAN/2016/0438); Construction of two storey extension across building to form x9 dwellings (x3 one bedroom, x4 two bedroom and x2 three bedroom) and roof terrace, with associated cycle storage and refuse/recycling storage (amended plans) (PLAN/2018/0741)",d86d8d0dfc5ae7426838a785d05257aff9f72d0d1c02823d517a99908e9178e3
2019-12-19,local-authority-eng:WOI,SHLAACAN041,"Premier House, 15-19 Church Street West, Woking, GU21 6DJ",http://www.woking2027.info/ldfregisters,yes,not owned by a public authority,permissioned,full planning permission,,54.34,-5.715,0.09,29,29,2017-12-20,,"PLAN/2017/0165 prior approval detailed.. ""Prior approval for a proposed change of use from Office (Class B1(a)) to dwellinghouse (Class C3) to provide 29no. 1 bedroom dwellings.""",d86d8d0dfc5ae7426838a785d05257aff9f72d0d1c02823d517a99908e9178e3
2019-12-19,local-authority-eng:WOI,SHLAACAN042,"BHS/British Heart Foundation, 2, Crown Square, Chobham Road, Woking, GU21 6HR",http://www.woking2027.info/ldfregisters,,not owned by a public authority,not permissioned,,,54.344,-5.711,0.3,98,98,2017-12-20,,"PLAN/2019/0611: pending application (""Demolition of existing buildings and erection of a building ranging from 2 to 39 storeys in height comprising 310 no. (Class C3) residential units, with communal residential and operational spaces, bar (Class A4) (circa 259 sq.m GIA) and office accommodation (Class B1(a)) (circa 444 sq.m GIA), with associated vehicular and pedestrian accesses, car and cycle parking, refuse storage and plant space, landscaping and public realm works."")",d86d8d0dfc5ae7426838a785d05257aff9f72d0d1c02823d517a99908e9178e3
2019-12-19,local-authority-eng:WOI,SHLAAHEA005,"Lyndhurst-Langsett, Brookwood Lye Road, Brookwood, GU24 0HB",http://www.woking2027.info/ldfregisters,,not owned by a public authority,not permissioned,,,51.305,-0.625,0.59,10,10,2017-12-20,,No planning history to date,d86d8d0dfc5ae7426838a785d05257aff9f72d0d1c02823d517a99908e9178e3
2019-12-19,local-authority-eng:WOI,SHLAAHEA012,"1-5 Egley Road, Woking, GU22 0AU",http://www.woking2027.info/ldfregisters,,not owned by a public authority,not permissioned,,,54.338,-5.733,0.36,5,5,2017-12-20,,"PLAN/2008/1290 expired (4 houses, net 2)",d86d8d0dfc5ae7426838a785d05257aff9f72d0d1c02823d517a99908e9178e3
2019-12-19,local-authority-eng:WOI,SHLAAHOE001,"Woking Football Club Woking Gymnastic Club, Woking Snooker Club, Westfield Avenue, Woking GU22 9AA",http://www.woking2027.info/ldfregisters,,mixed ownership,not permissioned,,,54.343,-5.735,4.64,126,126,2017-12-20,,"Pending application: ""Redevelopment of site following demolition of all existing buildings and structures to provide replacement stadium with ancillary facilities including flexible retail, hospitality and community spaces, independent retail floorspace (Classes A1/A2/A3) and medical centre (Class D1) and vehicle parking plus residential accommodation comprising of 1,048 dwellings (Class C3) within 5 buildings of varying heights of between 3 and 11 storeys (plus lower ground floor and partial basement levels) on the south and west sides of the site together with hard and soft landscaping, highway works, vehicle parking, bin storage, cycle storage, plant and other ancillary works including ancillary structures and fencing/gates and provision of detached residential concierge building (Environmental Statement submitted)"" (PLAN/2019/1176)",d86d8d0dfc5ae7426838a785d05257aff9f72d0d1c02823d517a99908e9178e3
2019-12-19,local-authority-eng:WOI,SHLAAHOE010,"Hoe Valley School Temporary Site, Woking Park, Woking, GU22 9BA",http://www.woking2027.info/ldfregisters,,owned by a public authority,not permissioned,,,54.343,-5.728,0.16,6,6,2017-12-20,,No planning history to date,d86d8d0dfc5ae7426838a785d05257aff9f72d0d1c02823d517a99908e9178e3
2019-12-19,local-authority-eng:WOI,SHLAAHOE019,"Sherpa House, Kingfield Road, Kingfield, Woking GU22 9EH",http://www.woking2027.info/ldfregisters,,not owned by a public authority,permissioned,full planning permission,,54.347,-5.739,0.06,10,10,2017-12-20,,"Permission (ref PLAN/2017/0343) to change use from retail to a veterinary practice. This is not considered to preclude residential development in the longer term.. ""Change of use from retail to veterinary, with small window and ramp alterations.""",d86d8d0dfc5ae7426838a785d05257aff9f72d0d1c02823d517a99908e9178e3
2019-12-19,local-authority-eng:WOI,SHLAAHOE15,"Ian Allan Motors, 63-65, High Street, Old Woking, GU22 9JN",http://www.woking2027.info/ldfregisters,,not owned by a public authority,permissioned,,yes,54.35,-5.741,0.28,24,24,2017-12-20,,"PLAN/2017/0153 permitted subject to legal agreement. Visible contamination sources - existing use & adjacent petrol station. PLAN/2018/0708: withdrawn. PLAN/2019/0146: refused.. ""Outline planning application (reserving matters of appearance and landscaping) for the demolition of all existing buildings and erection of 1No. part four, part three storey building, 1No. part three, part two storey building and the erection of 1No. two storey terrace, providing 24No. residential units (7No. 1 bedroom units, 8No. 2 bedroom units and 9No. 3 bedroom units) together with car parking, landscaping and incidental works (amended proposed site plan and flood risk assessment received 20.09.2017).""",d86d8d0dfc5ae7426838a785d05257aff9f72d0d1c02823d517a99908e9178e3
2019-12-19,local-authority-eng:WOI,SHLAAHOR001,"Timber Yard, Horsell Moor, Woking GU21 4NQ",http://www.woking2027.info/ldfregisters,,not owned by a public authority,not permissioned,,,54.336,-5.714,0.83,67,67,2017-12-20,,No planning history to date.,d86d8d0dfc5ae7426838a785d05257aff9f72d0d1c02823d517a99908e9178e3
2019-12-19,local-authority-eng:WOI,SHLAAHOR005,"Garages to rear of 3-9 and 11-41 Pares Close, Woking, GU21 4QL",http://www.woking2027.info/ldfregisters,,owned by a public authority,not permissioned,,,54.336,-5.704,0.18,5,5,2017-12-20,,"PLAN/2009/0413 refused and appeal dismissed (June 2010) for 8 dwellings, as 2 units and private gardens would be overshadowed by trees. The other 6 units were acceptable.",d86d8d0dfc5ae7426838a785d05257aff9f72d0d1c02823d517a99908e9178e3
2019-12-19,local-authority-eng:WOI,SHLAAKNA001,"1 and 3 High Street, Knaphill, GU21 2PG",http://www.woking2027.info/ldfregisters,,not owned by a public authority,permissioned,other,,51.319,-0.616,0.06,4,4,2019-12-19,,". ""Prior notification for a proposed change of use of offices (B1) to dwelling (C3) at first and second floors to provide 4 apartments."" PLAN/2017/1036 and PLAN/2018/0624 refused.",d86d8d0dfc5ae7426838a785d05257aff9f72d0d1c02823d517a99908e9178e3
2019-12-19,local-authority-eng:WOI,SHLAAKNA006,"Ambulance Station, Bagshot Road, Brookwood, GU21 2RP",http://www.woking2027.info/ldfregisters,,owned by a public authority,not permissioned,,,51.31,-0.627,0.15,6,6,2017-12-20,,No planning history,d86d8d0dfc5ae7426838a785d05257aff9f72d0d1c02823d517a99908e9178e3
2019-12-19,local-authority-eng:WOI,SHLAAKNA012,"Co-op, 26 High Street, Knaphill, GU21 2PE",http://www.woking2027.info/ldfregisters,,not owned by a public authority,not permissioned,,,54.307,-5.713,0.07,13,13,2017-12-20,,No planning history to date,d86d8d0dfc5ae7426838a785d05257aff9f72d0d1c02823d517a99908e9178e3
2019-12-19,local-authority-eng:WOI,SHLAAKNA013,"Land to the rear of Co-Op, Englefield Road, Knaphill, GU21 2PE",http://www.woking2027.info/ldfregisters,,not owned by a public authority,not permissioned,,,54.307,-5.713,0.06,11,11,2017-12-20,,PLAN/2017/1309 and PLAN/2019/0276 refused.,d86d8d0dfc5ae7426838a785d05257aff9f72d0d1c02823d517a99908e9178e3
2019-12-19,local-authority-eng:WOI,SHLAAKNA014,"Anchor Crescent, High Street, Knaphill, GU21 2HP",http://www.woking2027.info/ldfregisters,,not owned by a public authority,permissioned,full planning permission,,54.308,-5.712,0.28,24,24,2017-12-20,,PLAN/2018/0515 approved,d86d8d0dfc5ae7426838a785d05257aff9f72d0d1c02823d517a99908e9178e3
2019-12-19,local-authority-eng:WOI,SHLAAMHM001,"Royal Mail Sorting/ Delivery Office, White Rose Lane, Woking GU22 7AJ",http://www.woking2027.info/ldfregisters,,not owned by a public authority,not permissioned,,,54.345,-5.715,0.36,88,88,2017-12-20,,No planning history to date.,d86d8d0dfc5ae7426838a785d05257aff9f72d0d1c02823d517a99908e9178e3
2019-12-19,local-authority-eng:WOI,SHLAAMHM002,"Woking Police Station, Station Approach, Woking, GU21 7SY",http://www.woking2027.info/ldfregisters,,,not permissioned,,,54.343,-5.718,0.86,282,282,2017-12-20,,No planning history to date. Overlaps with Coroners Court site (UA47). Police station - building of townscape merit. Surface water management plan depressions in centre and south west of the site.,d86d8d0dfc5ae7426838a785d05257aff9f72d0d1c02823d517a99908e9178e3
