entry-date,organisation,site,site-address,site-plan-url,deliverable,ownership,planning-permission-status,planning-permission-type,hazardous-substances,latitude,longitude,hectares,minimum-net-dwellings,maximum-net-dwellings,start-date,end-date,notes,resource
2017-12-31,local-authority-eng:REI,RBBCBLR046,"Reigate Library, Bancroft Road, Reigate",http://www.reigate-banstead.gov.uk/downloads/file/3866/rbbcblr046,,owned by a public authority,not permissioned,,,51.236793,-0.203152,0.22,25,25,2017-12-31,,"Borough Local Plan (2005) policy Cf1 resists the loss of community uses unless there is no longer a need for them, or adequate alternative provision is to be made elsewhere in the locality; and no other community facilities or service can make use of the premises or site. 
Development of the site would be dependent upon the reprovision of the community facilities or relocation to alternative suitable premises.   The site has been identified in the Regulation 19 Development Management Plan, as part of a wider site, as a potential town centre opportunity site for library, community uses, retail, commercial and residential development (REI1).
The site is partially affected by Flood Zones 2 and 3.",debc0d5bf94db70a816f0eaea1001e8bdc462db5ded561606e0ad606857e9a60
2017-12-31,local-authority-eng:REI,RBBCBLR047,"Millennium House, 99 Bell Street, Reigate",http://www.reigate-banstead.gov.uk/downloads/file/3870/rbbcblr047,yes,not owned by a public authority,permissioned,other,,51.234519,-0.203771,0.1,19,19,2017-12-31,,. Change of use from office (B1(A)) to residential (C3).,debc0d5bf94db70a816f0eaea1001e8bdc462db5ded561606e0ad606857e9a60
2017-12-31,local-authority-eng:REI,RBBCBLR048,"Park House, 77-83 Bell Street, Reigate",http://www.reigate-banstead.gov.uk/downloads/file/3867/rbbcblr048,yes,not owned by a public authority,permissioned,other,,51.235134,-0.204005,0.06,13,13,2017-12-31,,. Prior approval under Class J for a change of use from offices (Use Class B1(A)) to dwelling houses (Use Class C3).,debc0d5bf94db70a816f0eaea1001e8bdc462db5ded561606e0ad606857e9a60
2017-12-31,local-authority-eng:REI,RBBCBLR049,"Castlefield House, 3-5 Castlefield Road, Reigate",http://www.reigate-banstead.gov.uk/downloads/file/3865/rbbcblr049,yes,not owned by a public authority,permissioned,other,,51.239614,-0.204131,0.4,41,41,2017-12-31,,. Proposed change of use from Class B1(A) to Class C3 residential use.,debc0d5bf94db70a816f0eaea1001e8bdc462db5ded561606e0ad606857e9a60
2017-12-31,local-authority-eng:REI,RBBCBLR050,"Acacia House, Reigate Hill, Reigate",http://www.reigate-banstead.gov.uk/downloads/file/3880/rbbcblr050,yes,not owned by a public authority,permissioned,outline planning permission,,51.245331,-0.203952,0.29,22,22,2017-12-31,,. Proposed change of use from Class B1(A) to Class C3 residential use.,debc0d5bf94db70a816f0eaea1001e8bdc462db5ded561606e0ad606857e9a60
2017-12-31,local-authority-eng:REI,RBBCBLR051,"New Pond Farm, Woodhatch Road, Reigate",http://www.reigate-banstead.gov.uk/downloads/file/3882/rbbcblr051,,owned by a public authority,not permissioned,,,51.219209,-0.186052,1.22,30,30,2017-12-31,,,debc0d5bf94db70a816f0eaea1001e8bdc462db5ded561606e0ad606857e9a60
2017-12-31,local-authority-eng:REI,RBBCBLR052,"Hartswood Nursery, Dovers Green Road, Reigate",http://www.reigate-banstead.gov.uk/downloads/file/3871/rbbcblr052,yes,not owned by a public authority,not permissioned,,,51.216124,-0.204057,0.04,5,5,2017-12-31,,"The site, as part of a wider site, has been identified in the Regulation 19 Development Management Plan as a Sustainable Urban Extension (SSW2). 
Upon adoption, its delivery will be subject to phasing policy (MLS1).",debc0d5bf94db70a816f0eaea1001e8bdc462db5ded561606e0ad606857e9a60
2017-12-31,local-authority-eng:REI,RBBCBLR053,"Former Garage Block, Atherfield Road, Reigate",http://www.reigate-banstead.gov.uk/downloads/file/3878/rbbcblr053,yes,not owned by a public authority,not permissioned,,,51.223139,-0.194733,0.03,5,5,2017-12-31,,,debc0d5bf94db70a816f0eaea1001e8bdc462db5ded561606e0ad606857e9a60
2017-12-31,local-authority-eng:REI,RBBCBLR054,"High Street Car Park, Horley",http://www.reigate-banstead.gov.uk/downloads/file/3879/rbbcblr054,yes,owned by a public authority,not permissioned,,,51.172454,-0.161222,0.43,30,30,2017-12-31,,"The site has been allocated for development in the 2005 Borough Local Plan. 
The site has been identified in the Regulation 19 Development Management Plan for mixed-use retail/ leisure and residential development. 
Release of the site would be dependent upon public car parking needs within the town centre.",debc0d5bf94db70a816f0eaea1001e8bdc462db5ded561606e0ad606857e9a60
2017-12-31,local-authority-eng:REI,RBBCBLR055,"Central Car Park, Consort Way East, Horley",http://www.reigate-banstead.gov.uk/downloads/file/3872/rbbcblr055,,owned by a public authority,not permissioned,,,51.171764,-0.161936,0.42,30,30,2017-12-31,,"Policy Hr28 of the Borough Local Plan (2005) retains the car park for parking uses. 
Release of the site would be dependent upon public car parking needs within the town centre.",debc0d5bf94db70a816f0eaea1001e8bdc462db5ded561606e0ad606857e9a60
2017-12-31,local-authority-eng:REI,RBBCBLR056,"Horley Library, Kings Road, Horley",http://www.reigate-banstead.gov.uk/downloads/file/3877/rbbcblr056,yes,owned by a public authority,not permissioned,,,51.173061,-0.165461,0.35,35,35,2017-12-31,,"Borough Local Plan (2005) policy Cf1 resists the loss of community buildings or uses unless there is no longer a need for them, or adequate alternative provision is to be made elsewhere in the locality and no other community facility or service can make use of the premises or site. 
Surrey County Council has recently agreed to relocate the library to the former Newman House site. 
The site has been identified in the Regulation 19 Development Management Plan for mixed-use community, car parking and residential development (HOR5).
Land to the rear of the library is partially at risk of surface water flooding.",debc0d5bf94db70a816f0eaea1001e8bdc462db5ded561606e0ad606857e9a60
2017-12-31,local-authority-eng:REI,RBBCBLR057,"Horley Police Station, Massetts Road, Horley",http://www.reigate-banstead.gov.uk/downloads/file/3874/rbbcblr057,yes,owned by a public authority,not permissioned,,,51.171116,-0.164208,0.15,20,20,2017-12-31,,"Borough Local Plan (2005) policy Cf1 resists the loss of community buildings or uses unless there is no longer a need for them, or adequate alternative provision is to be made elsewhere in the locality and no other community facility or service can make use of the premises or site. 
The site is owned by the Police Crime Commissioner for Surrey. The landowner has indicated that the site is no longer required for operational purposes. The site has been identified in the Regulation 19 Development Management Plan for housing development.",debc0d5bf94db70a816f0eaea1001e8bdc462db5ded561606e0ad606857e9a60
2017-12-31,local-authority-eng:REI,RBBCBLR058,"T Northeast Ltd. 4 Station Road, Horley",http://www.reigate-banstead.gov.uk/downloads/file/3855/rbbcblr058,yes,not owned by a public authority,not permissioned,,,51.173597,-0.160118,0.04,6,6,2017-12-31,,"The site lies within an Area for Small Business. 
Borough Local Plan (2005) policy Em6 requires proposals to complement the character of the area. The surrounding area is comprised of retail ground floor uses and residential on upper floors.",debc0d5bf94db70a816f0eaea1001e8bdc462db5ded561606e0ad606857e9a60
2017-12-31,local-authority-eng:REI,RBBCBLR059,"R/O 43-49 High Street, Horley",http://www.reigate-banstead.gov.uk/downloads/file/3853/rbbcblr059,yes,not owned by a public authority,permissioned,full planning permission,,51.173056,-0.161742,0.5,6,6,2017-12-31,,. Erection of first and second floor additions to the rear of the existing building to provide six flats.,debc0d5bf94db70a816f0eaea1001e8bdc462db5ded561606e0ad606857e9a60
2017-12-31,local-authority-eng:REI,RBBCBLR060,"Woodside Works, Horley",http://www.reigate-banstead.gov.uk/downloads/file/3860/rbbcblr060,yes,not owned by a public authority,not permissioned,,,51.162886,-0.146971,0.66,13,13,2017-12-31,,"The site, as part of a wider site, has been identified in the Regulation 19 Development Management Plan as a Sustainable Urban Extension (SEH4). 
Upon adoption, its delivery will be subject to phasing policy (MLS1).",debc0d5bf94db70a816f0eaea1001e8bdc462db5ded561606e0ad606857e9a60
2017-12-31,local-authority-eng:REI,RBBCBLR061,"Sangers House, Horley",http://www.reigate-banstead.gov.uk/downloads/file/3858/rbbcblr061,yes,not owned by a public authority,permissioned,full planning permission,,51.181359,-0.164731,0.16,8,8,2017-12-31,,. Conversion of existing buildings to provide 8 flats.,debc0d5bf94db70a816f0eaea1001e8bdc462db5ded561606e0ad606857e9a60
2017-12-31,local-authority-eng:REI,RBBCBLR062,"The Gables, 17 Massetts Road, Horley",http://www.reigate-banstead.gov.uk/downloads/file/3858/rbbcblr061,yes,not owned by a public authority,permissioned,other,,51.184122,-0.163204,0.15,25,25,2017-12-31,,. The development is the change of use of offices to 25 self-contained flats.,debc0d5bf94db70a816f0eaea1001e8bdc462db5ded561606e0ad606857e9a60
2017-12-31,local-authority-eng:REI,RBBCBLR063,"Don Ruffles, 138 Victoria Road, Horley",http://www.reigate-banstead.gov.uk/downloads/file/3863/rbbcblr063,yes,not owned by a public authority,permissioned,full planning permission,,51.17371,-0.16904,0.04,5,5,2017-12-31,,. To extend existing building with two storey and single storey extension and to convert existing shop/ office building including extension into 5 flats.,debc0d5bf94db70a816f0eaea1001e8bdc462db5ded561606e0ad606857e9a60
2017-12-31,local-authority-eng:REI,RBBCBLR064,"1 Yattendon Road, Horley",http://www.reigate-banstead.gov.uk/downloads/file/3862/rbbcblr064,yes,not owned by a public authority,permissioned,full planning permission,,51.173331,-0.161259,0.02,5,5,2017-12-31,,. Conversion of existing building to form 5 residential self-contained units.,debc0d5bf94db70a816f0eaea1001e8bdc462db5ded561606e0ad606857e9a60
