entry-date,organisation,site,site-address,site-plan-url,deliverable,ownership,planning-permission-status,planning-permission-type,hazardous-substances,latitude,longitude,hectares,minimum-net-dwellings,maximum-net-dwellings,start-date,end-date,notes,resource
2017-10-26,local-authority-eng:WLA,WL002,"Former Hope High School, Tanhouse Road, Skelmersdale",,yes,owned by a public authority,not permissioned,,,53.544701,-2.751925,1.8,27,27,2016-08-03,,". """" Site promoted through the SHELAA, it is partly covered by a policy EN3 (green / open recreational space) designation.  However, the remainder of the site can be developed for residential development.  Yield of 27 reflects the net developable area.""""",fea579a9805f6b23a047035ac8bfa7857f3d30a98fff45205e49bfb2bea1877f
2018-12-11,local-authority-eng:WLA,WL004,"Land at Findon, Skelmersdale",,yes,not owned by a public authority,permissioned,planning permission granted under an order,,53.553449,-2.771123,3.34,128,128,2016-08-03,,". """"Site has a Local Development Order: 2015/1328/LDO with a figure of upto 128 dwellings on the site.""""",fea579a9805f6b23a047035ac8bfa7857f3d30a98fff45205e49bfb2bea1877f
2018-12-11,local-authority-eng:WLA,WL005,"Site of Former Sports Centre, Digmoor Road, Skelmersdale",,yes,not owned by a public authority,permissioned,planning permission granted under an order,,53.541465,-2.768379,2.56,45,45,2016-08-03,,". """"Site has a Local Development Order 2015/1327/LDO with the figure of 45 dwellings on the site.""""",fea579a9805f6b23a047035ac8bfa7857f3d30a98fff45205e49bfb2bea1877f
2018-11-08,local-authority-eng:WLA,WL006,"Site of Former Greaves Hall Hospital, Greaves Hall Avenue, Banks",,yes,not owned by a public authority,permissioned,outline planning permission,,53.676507,-2.91439,10.26,128,128,2016-08-04,,"""""2016/0706/ARM For 128 dwellings light industrial units and assoicated road and infrastructure including details of appearance landscaping layout and scale - Pending decision."""". """"Site promoted through the SHELAA. Outline consent granted, and Reserved Matters has since been approved (2016/0706/ARM) some conditions discharged. 2018/0732/CON still awaiting decision.""""",fea579a9805f6b23a047035ac8bfa7857f3d30a98fff45205e49bfb2bea1877f
2018-11-08,local-authority-eng:WLA,WL007,"Longreach Warpers Moss Lane, Burscough",,yes,not owned by a public authority,permissioned,outline planning permission,,53.607522,-2.836296,0.51,6,6,2016-08-04,,". """"Site promoted through SHELAA and has outline planning permission (2013/0517/OUT) for 6 residential dwellings, and outline permission for 2 dwellings (2017/0103/OUT).  Application to vary conditions on the 2013 consent has been approved (2017/0351/FUL). Not started on site as outline consent.""""",fea579a9805f6b23a047035ac8bfa7857f3d30a98fff45205e49bfb2bea1877f
2017-10-26,local-authority-eng:WLA,WL008," Site of Former 111 Aughton Street, Ormskirk",,yes,not owned by a public authority,not permissioned,,,53.564807,-2.889392,0.26,6,6,2016-08-04,,"""""2013/1002/OUT erection of mixed use residential and office building including details of landscaping expired 29/10/2016."""". """"Expired planning permission for 6 apartments and ground floor commercial units (2013/0975/OUT).""""",fea579a9805f6b23a047035ac8bfa7857f3d30a98fff45205e49bfb2bea1877f
2018-11-08,local-authority-eng:WLA,WL010,"Bull And Dog Inn, 5 Liverpool Road South, Burscough",,yes,not owned by a public authority,permissioned,full planning permission,,53.588021,-2.862039,0.27,7,7,2016-08-04,,"""""2014/0079/FUL construction of 6 new build dwellings and conversion of existing barn to 1 4 bed dwelling plus associated parking driveways and landscaping. """". """"Site promoted through the SHELAA.  The site had planning permission for the construction of 6 new dwellings, but this has now expired (2014/0079/FUL).""""",fea579a9805f6b23a047035ac8bfa7857f3d30a98fff45205e49bfb2bea1877f
2018-11-08,local-authority-eng:WLA,WL012,"Downholland Bridge Business Park, Mairscough Lane, Downholland",,yes,not owned by a public authority,not permissioned,,,53.553569,-2.958746,0.26,6,6,2016-08-05,,"""""2015/0959/OUT construction of six dwellings following demolition of existing commercial premises including details of access layout and scale."""". """"Site promoted through the SHELAA.  Outline permission for 6 dwellings (2015/0959/OUT) expired 06/11/2018, no discharge of conditions applications submitted.""""",fea579a9805f6b23a047035ac8bfa7857f3d30a98fff45205e49bfb2bea1877f
2018-11-08,local-authority-eng:WLA,WL013,"The Barrons 104 Church Road, Tarleton",,yes,not owned by a public authority,permissioned,full planning permission,,53.679616,-2.829326,0.76,7,7,2016-08-05,,"""""2015/0951/FUL residential development including 4 three bedroom detached dwellings and associated external works."""". """"Site promoted through the SHELAA.  Full planning permission for 7 dwellings (2015/0951/FUL).  Conditions have been discharged (2018/0545/CON).  Not started.""""",fea579a9805f6b23a047035ac8bfa7857f3d30a98fff45205e49bfb2bea1877f
2018-11-08,local-authority-eng:WLA,WL014,"Land to the rear of 69-75 Town Green Lane, Aughton",,yes,not owned by a public authority,permissioned,outline planning permission,,53.542832,-2.905238,0.23,5,5,2016-08-05,,"""""2015/06/1186/OUT residential development to provide up to 5 dwtached dwellings including details of access."""". """"Site promoted through the SHELAA.  Outline planning permission for 5 dwellings (2015/1186/OUT).  Consent expires 27/06/2019.""""",fea579a9805f6b23a047035ac8bfa7857f3d30a98fff45205e49bfb2bea1877f
2018-11-08,local-authority-eng:WLA,WL015,"The Almond Tree, Abbeystead, Digmoor, Skelmersdale",,yes,not owned by a public authority,permissioned,outline planning permission,,53.540033,-2.770818,0.17,12,12,2016-08-05,,"""""2015/0723/OUT development of 12 residential flats with associated car parking and green space following the demolition of the existing public house."""". """"Site promoted through the SHELAA.  Outline planning permission for 12 apartments (2015/0723/OUT).  Discharge of conditions submitted (2018/0959/CON); awaiting determination.""""",fea579a9805f6b23a047035ac8bfa7857f3d30a98fff45205e49bfb2bea1877f
2018-11-08,local-authority-eng:WLA,WL028,"The Comrades Club, Witham Road, Skelmersdale",,yes,not owned by a public authority,permissioned,full planning permission,,53.550898,-2.805693,0.1,12,12,2017-06-13,,"""""2013/0823/FUL demolition of existing social club and erection of two 3 storey apartment blocks comprising 12 2 bedroom self contained flats and provision for 15 car parking spaces."""". """"Site promoted through SHELAA. Had full planning permission for 12 self contained flats (2013/0823/FUL) but this has expired.  The premesis still functions as a bar/nightclub.""""",fea579a9805f6b23a047035ac8bfa7857f3d30a98fff45205e49bfb2bea1877f
2018-11-08,local-authority-eng:WLA,WL029,"Land the The Stiles, Ormskirk",,yes,not owned by a public authority,permissioned,full planning permission,,53.568479,-2.88653,0.12,17,17,2017-06-13,,""""" 2011/0148/FUL mixed use development comprising 2 commercial units and 17 3 bed aprtments with associated amenity space and car parking."""". """"Site promoted throught SHELAA.  Site is parked due to multiple ownership constraints.  Site had PP for a mixed use development for ground floor commercial units and 17 apartments (2011/0148/FUL) but this has now expired.""""",fea579a9805f6b23a047035ac8bfa7857f3d30a98fff45205e49bfb2bea1877f
2018-11-08,local-authority-eng:WLA,WL038,"Former Silver Birch Hotel, Floron, Birch Green, Skelmersdale",,yes,not owned by a public authority,permissioned,full planning permission,,53.553586,-2.762776,0.22,18,18,2017-06-13,,""""" 2016/0832/FUL demolition of existing vacant commercial building and construction of mixed use development comprising 4 retail/commercial units and 18 self contained apartments with associated car parking and landscaping."""". """"Site has permission for 4 commercial units and 18 self contained apartments (2016/0832/FUL); expires 12/2019.  All conditions require discharging.""""",fea579a9805f6b23a047035ac8bfa7857f3d30a98fff45205e49bfb2bea1877f
2018-11-08,local-authority-eng:WLA,WL040,"Garages to the east of Arnian Court, Molyneux Road, Skelmersdale",,yes,not owned by a public authority,permissioned,full planning permission,,53.542849,-2.903018,0.15,7,7,2017-06-13,,"""""2017/0185/OUT demolition of 31 lock up garages and outline application including means of access for the redevelopment of the site to provide up to 7 dwellings."""". """"Site has outline permission for the erection of 7 dwellings (2017/0185/OUT).  Approval of Reserved Matters application has been submitted for 4 dwellings (2017/1139/ARM) which is awaiting determination. """"",fea579a9805f6b23a047035ac8bfa7857f3d30a98fff45205e49bfb2bea1877f
2018-12-07,local-authority-eng:WLA,WL064,"Land at New Lane, Crossens",,yes,not owned by a public authority,not permissioned,,,53.669536,-2.943646,0.9,15,15,2018-12-06,,". """"Site submitted in SHELAA Call for Sites 2017.""""",fea579a9805f6b23a047035ac8bfa7857f3d30a98fff45205e49bfb2bea1877f
