OrganisationURI,OrganisationLabel,SiteReference,SiteNameAddress,GeoX,GeoY,SiteplanURL,Hectares,OwnershipStatus,HazardousSubstances,PlanningStatus,PermissionType,PermissionDate,PlanningHistory,NetDwellingsRangeFrom,NetDwellingsRangeTo,Deliverable,Notes,FirstAddedDate,LastUpdatedDate,EndDate
http://opendatacommunities.org/id/district-council/woking,Woking Borough Council,SHLAABWB012,"""Library, 71 High Road, Byfleet, KT14 7QN""",54.396,-5.681,http://www.woking2027.info/ldfregisters,0.13,owned by a public authority,,not permissioned,,,,,,,Site is in Flood Zone 2,20/12/2017,20/12/2017,
http://opendatacommunities.org/id/district-council/woking,Woking Borough Council,SHLAACAN001,"""Trizancia House, Thomsen House and Woodstead House, 72 Chertsey Road, Woking, GU21 5BJ""",54.346,-5.708,http://www.woking2027.info/ldfregisters,0.23,not owned by a public authority,,not permissioned,,,https://www.woking.gov.uk/planning/publicaccess,,,,References for planning history PLAN/2015/0545 and PLAN/2014/0759,20/12/2017,20/12/2017,
http://opendatacommunities.org/id/district-council/woking,Woking Borough Council,SHLAACAN035,"""Chester House, 76-78 Chertsey Road, Woking, GU21 5BJ""",54.346,-5.707,http://www.woking2027.info/ldfregisters,0.13,not owned by a public authority,,permissioned,full planning permission,01/12/2015,https://www.woking.gov.uk/planning/publicaccess,,,yes,"PLAN/2015/0912 detailed, but non-residential; PLAN/2016/0561 prior approval refused; PLAN/2014/0759 non-determined application for offices and 64 flats, appeal dismissed.",20/12/2017,20/12/2017,
http://opendatacommunities.org/id/district-council/woking,Woking Borough Council,SHLAACAN003,"""King's Court, Church Street East, Woking, GU21 6HA""",54.346,-5.708,http://www.woking2027.info/ldfregisters,0.17,not owned by a public authority,,permissioned,full planning permission,15/02/2016,https://www.woking.gov.uk/planning/publicaccess,,,yes,PLAN/2014/1263 under construction. PLAN/2016/0514 prior approval not required.,20/12/2017,20/12/2017,
http://opendatacommunities.org/id/district-council/woking,Woking Borough Council,SHLAACAN002,"""The Cornerstone, The Broadway and Elizabeth House, Duke Street, Woking, GU21 5AS""",54.346,-5.712,http://www.woking2027.info/ldfregisters,0.21,not owned by a public authority,,permissioned,full planning permission,31/05/2016,https://www.woking.gov.uk/planning/publicaccess,,,yes,"Min net dwellings is based on the draft Site Allocation which includes offices on the site rather than the prior notification, which sees the loss of all offices to residential. See PLAN/2016/0423, PLAN/2016/1433 and PLAN/2017/0654. Two 2016 prior approval applications approved, 2017 planning application for a 3rd and 4th floor extension pending consideration.",20/12/2017,20/12/2017,
http://opendatacommunities.org/id/district-council/woking,Woking Borough Council,SHLAACAN046,"""Land at Albion House, High Street, Woking, GU21 6BD""",51.319,-0.557,http://www.woking2027.info/ldfregisters,0.2,not owned by a public authority,,pending decision,full planning permission,,https://www.woking.gov.uk/planning/publicaccess,,,,"PLAN/2017/0582 stated in DevelopmentDescription, pending decision. Full permission granted for PLAN/2015/0809 for changes to retail floorspace and other alterations. PLAN/2016/0388 for canopy/public realm permission.",20/12/2017,20/12/2017,
http://opendatacommunities.org/id/district-council/woking,Woking Borough Council,SHLAACAN006,"""1-12 and 26-34 High Street and Commercial Way, Woking GU21 6EN""",54.344,-5.713,http://www.woking2027.info/ldfregisters,0.58,mixed ownership,,not permissioned,,,,,,,,20/12/2017,20/12/2017,
http://opendatacommunities.org/id/district-council/woking,Woking Borough Council,SHLAACAN004,"""2-24 and 13-28 Commercial Way and High Street, Woking, GU21 6BW""",54.343,-5.714,http://www.woking2027.info/ldfregisters,0.45,mixed ownership,,not permissioned,,,,,,,,20/12/2017,20/12/2017,
http://opendatacommunities.org/id/district-council/woking,Woking Borough Council,SHLAACAN005,"""Victoria Square Development, Church Street West, Woking, GU21 6HD""",54.342,-5.715,http://www.woking2027.info/ldfregisters,1.59,mixed ownership,,permissioned,full planning permission,26/03/2015,https://www.woking.gov.uk/planning/publicaccess,,,yes,NetDwellingsRangeTo is based on the extant permission.  Reference for planning history PLAN/2014/0014,20/12/2017,20/12/2017,
http://opendatacommunities.org/id/district-council/woking,Woking Borough Council,SHLAACAN022,"""The Coign Church, Church Street West, Woking, GU21 6DJ",54.34,-5.715,http://www.woking2027.info/ldfregisters,0.4,not owned by a public authority,,permissioned,full planning permission,,https://www.woking.gov.uk/planning/publicaccess,,,yes,"References for planning history PLAN/2014/0941. An earlier application was withdrawn - the S106 Agreement not signed (ref PLAN/2013/1207). Min net dwellings of 78 is the net figure, rather than gross of 85 referred to in the Development Description.",20/12/2017,20/12/2017,
http://opendatacommunities.org/id/district-council/woking,Woking Borough Council,SHLAACAN033,"""The former Goldsworth Arms Public House, Goldsworth Road, Woking, GU21 6LQ""",54.339,-5.716,http://www.woking2027.info/ldfregisters,0.12,not owned by a public authority,,pending decision,,,https://www.woking.gov.uk/planning/publicaccess,,,yes,Reference for planning history PLAN/2016/0927. Permission granted by Planning committee subject to signing of S106 Agreement.,20/12/2017,20/12/2017,
http://opendatacommunities.org/id/district-council/woking,Woking Borough Council,SHLAASTJ002,"""113-129 Goldsworth Road, Woking, GU21 6LR""",51.317,-0.567,http://www.woking2027.info/ldfregisters,0.32,not owned by a public authority,,not permissioned,,,,,,,No planning history to date.,20/12/2017,20/12/2017,
http://opendatacommunities.org/id/district-council/woking,Woking Borough Council,SHLAACAN028,"""1-7 Victoria Way and 1-29 Goldsworth Road, Woking GU21 6JZ""",54.341,-5.715,http://www.woking2027.info/ldfregisters,0.3,not owned by a public authority,,not permissioned,,,,,,,No planning history to date.,20/12/2017,20/12/2017,
http://opendatacommunities.org/id/district-council/woking,Woking Borough Council,SHLAACAN027,"""30-32 Woking Railway and Athletic Club, Systems House, Bridge House, Goldsworth Road, Woking, GU21 6JT""",54.341,-5.716,http://www.woking2027.info/ldfregisters,0.72,not owned by a public authority,,pending decision,,,https://www.woking.gov.uk/planning/publicaccess,,,yes,PLAN/2016/0742 pending signed legal agreement. Historic permissions PLAN/2007/1298 and PLAN/2008/1350,20/12/2017,20/12/2017,
http://opendatacommunities.org/id/district-council/woking,Woking Borough Council,SHLAACAN030,"""The Big Apple American Amusements Ltd, HG Wells Conference Centre, the former Rat and Parrot PH, 48-58 Chertsey Road, Woking GU21 5AJ""",54.345,-5.71,http://www.woking2027.info/ldfregisters,0.69,mixed ownership,,pending decision,full planning permission,,https://www.woking.gov.uk/planning/publicaccess,,,,PLAN/2017/0802 resolution to grant subject to S106 agreement (12 Dec Planning Committee). This application relates to one part of the site - the former Rat and Parrot public house.,20/12/2017,20/12/2017,
http://opendatacommunities.org/id/district-council/woking,Woking Borough Council,SHLAACAN021,"""Spectrum House, 56 Goldsworth Road, Woking GU21 6LE""",54.34,-5.716,http://www.woking2027.info/ldfregisters,0.08,not owned by a public authority,,permissioned,full planning permission,18/10/2017,https://www.woking.gov.uk/planning/publicaccess,,,yes,PLAN/2017/1000 for 29 1bed units - Granted prior approval. PLAN/2016/1422 (Creation of additional storey to the roof to provide 8 flats (1 x studio and 7 x 1-bed 1-person) - permitted subject to legal agreement and installation of fire escape staircase; PLAN/2015/1002 (4No 2 bed and 8No 1 bed flats) - granted.,20/12/2017,20/12/2017,
http://opendatacommunities.org/id/district-council/woking,Woking Borough Council,SHLAAHOR001,"""Timber Yard, Horsell Moor, Woking GU21 4NQ""",54.336,-5.714,http://www.woking2027.info/ldfregisters,0.9,not owned by a public authority,,not permissioned,,,https://www.woking.gov.uk/planning/publicaccess,,,,No planning history to date.,20/12/2017,20/12/2017,
http://opendatacommunities.org/id/district-council/woking,Woking Borough Council,SHLAAHEA009 and SHLAAHEA010,"""Backland gardens of houses facing Ash Road, Hawthorn Road, Willow Way and Laburnum Road (Barnsbury sites 1 & 2), Barnsbury Farm Estate, Woking GU22 0BN""",54.337,-5.736,http://www.woking2027.info/ldfregisters,1.9,mixed ownership,,permissioned,outline planning permission,23/06/2006,https://www.woking.gov.uk/planning/publicaccess,,,,Historic outline permissions PLAN/2006/0386 and PLAN/2006/0387. While this is mainly Council owned there are some private properties (through Right to Buy).,20/12/2017,20/12/2017,
http://opendatacommunities.org/id/district-council/woking,Woking Borough Council,SHLAAHEA011,"""Backland gardens of houses facing Laburnum Road, Ash Road and Ash Close (Barnsbury Site 3), Barnsbury, Woking GU22 0BU""",54.338,-5.739,http://www.woking2027.info/ldfregisters,0.3,mixed ownership,,permissioned,outline planning permission,23/06/2006,https://www.woking.gov.uk/planning/publicaccess,,,,Reference for planning history PLAN/2006/0388. While this is mainly Council owned there are some private properties (through Right to Buy).,20/12/2017,20/12/2017,
http://opendatacommunities.org/id/district-council/woking,Woking Borough Council,SHLAAHOE004,"""Elmbridge House, 18 Elmbridge Lane, Kingfield Woking GU22 9AW""",54.345,-5.732,http://www.woking2027.info/ldfregisters,0.19,not owned by a public authority,,permissioned,full planning permission,05/09/2008,https://www.woking.gov.uk/planning/publicaccess,,,,References for planning history: PLAN/2008/0630; PLAN/2011/0255; and PLAN/2014/0880,20/12/2017,20/12/2017,
http://opendatacommunities.org/id/district-council/woking,Woking Borough Council,SHLAAHOE019,"""Sherpa House, Kingfield Road, Kingfield, Woking GU22 9EH""",54.347,-5.739,http://www.woking2027.info/ldfregisters,0.06,not owned by a public authority,,permissioned,full planning permission,03/07/2017,https://www.woking.gov.uk/planning/publicaccess,,,,"Current permission (ref PLAN/2017/0343) to change use from retail to a veterinary practice, but this is not considered to preclude residential development in the longer term.",20/12/2017,20/12/2017,
http://opendatacommunities.org/id/district-council/woking,Woking Borough Council,SHLAACAN026,"""Land within Sheerwater Priority Place, Albert Drive, Woking GU21 5RE""",54.366,-5.691,http://www.woking2027.info/ldfregisters,33,mixed ownership,,permissioned,full planning permission,27/07/2016,https://www.woking.gov.uk/planning/publicaccess,,,yes,Reference PLAN/2015/1260 (current permission).,20/12/2017,20/12/2017,
http://opendatacommunities.org/id/district-council/woking,Woking Borough Council,SHLAACAN016,"""101-121 Chertsey Road, Woking GU21 5BW""",54.346,-5.708,http://www.woking2027.info/ldfregisters,0.39,not owned by a public authority,,pending decision,full planning permission,,https://www.woking.gov.uk/planning/publicaccess,,,yes,111 Chertsey Road: PLAN/2017/0800 prior notification for 27 flats; PLAN/2015/0765 permission for office development. Waterman House:  PLAN/2012/0461 for 5 storey office building.,20/12/2017,20/12/2017,
http://opendatacommunities.org/id/district-council/woking,Woking Borough Council,SHLAACAN018,"""29-31 Walton Road, Woking, GU21 5DL""",54.347,-5.709,http://www.woking2027.info/ldfregisters,0.05,not owned by a public authority,,pending decision,full planning permission,,https://www.woking.gov.uk/planning/publicaccess,,,yes,PLAN/2017/0146 and PLAN/2009/0281,20/12/2017,20/12/2017,
http://opendatacommunities.org/id/district-council/woking,Woking Borough Council,SHLAACAN011,"95-105 Maybury Road, Woking GU21 5JL""",54.35,-5.707,http://www.woking2027.info/ldfregisters,0.77,not owned by a public authority,,pending decision,full planning permission,,https://www.woking.gov.uk/planning/publicaccess,,,,Elliot Court: PLAN/2015/0500 granted subject to legal agreement; PLAN/2014/0289 and PLAN/2013/0484 applications both withdrawn.,20/12/2017,20/12/2017,
http://opendatacommunities.org/id/district-council/woking,Woking Borough Council,SHLAACAN017,"""Walton Road Youth Centre, Walton Road, Woking GU21 5DL""",54.346,-5.709,http://www.woking2027.info/ldfregisters,0.08,owned by a public authority,,permissioned,other,,https://www.woking.gov.uk/planning/publicaccess,,,,PLAN/2017/0241 (formal consultation for prior approval for demolition of existing building),20/12/2017,20/12/2017,
http://opendatacommunities.org/id/district-council/woking,Woking Borough Council,SHLAAMHM001,"""Royal Mail Sorting/ Delivery Office, White Rose Lane, Woking GU22 7AJ""",54.345,-5.715,http://www.woking2027.info/ldfregisters,0.36,not owned by a public authority,,not permissioned,,,,,,,No planning history to date.,20/12/2017,20/12/2017,
http://opendatacommunities.org/id/district-council/woking,Woking Borough Council,SHLAAMHM003,"""Car Park (east), Oriental Road, Woking GU22 8BD""",54.348,-5.711,http://www.woking2027.info/ldfregisters,1.22,owned by a public authority,,not permissioned,,,,,,,No planning history to date.,20/12/2017,20/12/2017,
http://opendatacommunities.org/id/district-council/woking,Woking Borough Council,SHLAAMHM005,"""Coal Yard /Aggregates Yard site adjacent to railway line, Guildford Road, Bradfield Close, Woking GU22 7QE""",54.341,-5.718,http://www.woking2027.info/ldfregisters,1.09,owned by a public authority,,not permissioned,,,,,,,No planning history to date.,20/12/2017,20/12/2017,
http://opendatacommunities.org/id/district-council/woking,Woking Borough Council,SHLAAMHM007,"""11-15 Guildford Road / Southern House/Jubilee House/ Lynton House, Station Approach, Woking GU22 7PX""",54.343,-5.718,http://www.woking2027.info/ldfregisters,0.44,not owned by a public authority,,not permissioned,,,,,,,No planning history to date.,20/12/2017,20/12/2017,
http://opendatacommunities.org/id/district-council/woking,Woking Borough Council,SHLAAMHM008,"""St Dunstans, White Rose Lane, Woking GU22 7AG""",54.345,-5.717,http://www.woking2027.info/ldfregisters,0.21,not owned by a public authority,,permissioned,full planning permission,31/05/2017,https://www.woking.gov.uk/planning/publicaccess,,,yes,"As well as the 2016 permission (
PLAN/2016/1064), which is subject to legal agreement, there are 2012 and 2017 applications: PLAN/2012/0063 outline permission for 91 flats, 161sqm of A1 retail floor space, permitted subject to legal agreement; and PLAN/2017/0644 for 147 flats and other uses, which is pending decision, and includes Owen House, part of a neighbouring site.",20/12/2017,20/12/2017,
http://opendatacommunities.org/id/district-council/woking,Woking Borough Council,SHLAAMHM009,"""Owen House, The Crescent, Heathside Crescent and White Rose Court, Heathside Crescent, Woking GU22 7AG""",54.344,-5.717,http://www.woking2027.info/ldfregisters,0.1,not owned by a public authority,,pending decision,full planning permission,,https://www.woking.gov.uk/planning/publicaccess,,,,Reference PLAN/2017/1108 (pending consideration).,20/12/2017,20/12/2017,
http://opendatacommunities.org/id/district-council/woking,Woking Borough Council,SHLAAMHM012,"""Somerset House, 1-18 Oriental Road, Woking GU22 7BG""",54.344,-5.716,http://www.woking2027.info/ldfregisters,0.17,not owned by a public authority,,not permissioned,,,,,,,No planning history to date.,20/12/2017,20/12/2017,
http://opendatacommunities.org/id/district-council/woking,Woking Borough Council,SHLAAMHM010,"""Coroner’s Court (former Woking Magistrate's Court) Station Approach, Woking GU22 7YL""",54.344,-5.717,http://www.woking2027.info/ldfregisters,0.32,not owned by a public authority,,not permissioned,,,,,,,No planning history to date.,20/12/2017,20/12/2017,
http://opendatacommunities.org/id/district-council/woking,Woking Borough Council,SHLAASJT004,"""Corner Garage, 16-18 St John's Road, St John's, GU21 7SA""",51.312,-0.594,http://www.woking2027.info/ldfregisters,0.12,not owned by a public authority,,not permissioned,,,,,,,No planning history to date.,20/12/2017,20/12/2017,
http://opendatacommunities.org/id/district-council/woking,Woking Borough Council,SHLAABWB021,"""Car Park to east of Enterprise House, Station Approach, West Byfleet KT14 6NW/ KT14 6PA""",54.377,-5.68,http://www.woking2027.info/ldfregisters,0.05,not owned by a public authority,,permissioned,outline planning permission,14/10/2014,https://www.woking.gov.uk/planning/publicaccess,,,yes,PLAN/2011/0945 - permitted subject to legal agreement. PLAN/2007/0028 for retail and office.,20/12/2017,20/12/2017,
http://opendatacommunities.org/id/district-council/woking,Woking Borough Council,SHLAABWB022,"""Land at Station Approach, West Byfleet KT14 6NG""",54.378,-5.682,http://www.woking2027.info/ldfregisters,0.91,not owned by a public authority,,pending decision,outline planning permission,,https://www.woking.gov.uk/planning/publicaccess,,,,"PLAN/2017/0128 granted at Planning committee, pending signed S106 agreement. Relates the part of the site east of Station Approach.",20/12/2017,20/12/2017,
http://opendatacommunities.org/id/district-council/woking,Woking Borough Council,SHLAABWB024,"""Camphill Club and Scout Hut, Camphill Road, West Byfleet KT14 6EF""",54.381,-5.677,http://www.woking2027.info/ldfregisters,0.38,not owned by a public authority,,not permissioned,,,,,,,No planning history to date.,20/12/2017,20/12/2017,
http://opendatacommunities.org/id/district-council/woking,Woking Borough Council,SHLAAHOE001,"""Woking Football Club Woking Gymnastic Club, Woking Snooker Club, Westfield Avenue, Woking GU22 9AA""",54.343,-5.735,http://www.woking2027.info/ldfregisters,2.44,not owned by a public authority,,not permissioned,,,,,,,No planning history to date.,20/12/2017,20/12/2017,
http://opendatacommunities.org/id/district-council/woking,Woking Borough Council,SHLAABWB009,"""85 Chertsey Road, Byfleet, KT14 7AU""",54.392,-5.672,http://www.woking2027.info/ldfregisters,0.21,not owned by a public authority,,permissioned,full planning permission,25/10/2015,https://www.woking.gov.uk/planning/publicaccess,,,yes,Current permission PLAN/2016/0748 subject to legal agreement,20/12/2017,20/12/2017,
http://opendatacommunities.org/id/district-council/woking,Woking Borough Council,SHLAABWB019,"""Phoenix House, Pyrford Road, West Byfleet KT14 6RA""",54.377,-5.686,http://www.woking2027.info/ldfregisters,0.12,not owned by a public authority,,permissioned,full planning permission,28/03/2011,https://www.woking.gov.uk/planning/publicaccess,,,,Expired permission PLAN/2010/1116; unimplemented.,20/12/2017,20/12/2017,
http://opendatacommunities.org/id/district-council/woking,Woking Borough Council,SHLAACAN012,"""Garages adj. to 28-30 Albert Drive, Woking GU21 5LA""",54.362,-5.695,http://www.woking2027.info/ldfregisters,0.19,owned by a public authority,,permissioned,outline planning permission,23/06/2006,https://www.woking.gov.uk/planning/publicaccess,,,,Historic outline permission PLAN/2006/0473 (for means of access only),20/12/2017,20/12/2017,
http://opendatacommunities.org/id/district-council/woking,Woking Borough Council,SHLAACAN014,"""Garage at 74-76 Maybury Road, Woking GU21 5JD""",54.348,-5.709,http://www.woking2027.info/ldfregisters,0.11,not owned by a public authority,,permissioned,full planning permission,11/06/2017,https://www.woking.gov.uk/planning/publicaccess,,,yes,"Current permission PLAN/2016/1192 subject to legal agreement. In this case, the min net dwellings is based on indicative density from the SHLAA Methodology 2017 Appendix 4 rather than the current permission.",20/12/2017,20/12/2017,
http://opendatacommunities.org/id/district-council/woking,Woking Borough Council,SHLAACAN019,"""Woking Liberal Club, 23-27 Walton Road, Woking GU21 5DL""",54.347,-5.709,http://www.woking2027.info/ldfregisters,0.07,not owned by a public authority,,permissioned,full planning permission,14/12/2016,https://www.woking.gov.uk/planning/publicaccess,,,yes,Current permission PLAN/2016/0105 subject to legal agreeement,20/12/2017,20/12/2017,
http://opendatacommunities.org/id/district-council/woking,Woking Borough Council,SHLAACAN020,"""27 North Road, Woking GU21 5DT""",54.349,-5.704,http://www.woking2027.info/ldfregisters,0.06,not owned by a public authority,,permissioned,full planning permission,17/07/2015,https://www.woking.gov.uk/planning/publicaccess,,,yes,"PLAN/2014/1333 permitted subject to legal agreement, PLAN/2014/0370 refused",20/12/2017,20/12/2017,
http://opendatacommunities.org/id/district-council/woking,Woking Borough Council,SHLAACAN023,"""26 and 28 Monument Road, Woking GU21 5LT""",54.353,-5.702,http://www.woking2027.info/ldfregisters,0.04,not owned by a public authority,,permissioned,full planning permission,28/04/2015,https://www.woking.gov.uk/planning/publicaccess,,,yes,PLAN/2014/0762 permitted subject to legal agreement,20/12/2017,20/12/2017,
http://opendatacommunities.org/id/district-council/woking,Woking Borough Council,SHLAAHEA032,"""Garages to the rear of 7 - 21 Hawthorn Road, Woking GU22 9PT""",54.337,-5.741,http://www.woking2027.info/ldfregisters,0.16,not owned by a public authority,,permissioned,full planning permission,05/07/2017,https://www.woking.gov.uk/planning/publicaccess,,,yes,PLAN/2015/0379 permitted subject to legal agreement. Small part of site in flood zones 2 & 3.,20/12/2017,20/12/2017,
http://opendatacommunities.org/id/district-council/woking,Woking Borough Council,SHLAAHOE006,"""Land adj. to 134 High Street, Old Woking GU22 9JN""",54.351,-5.74,http://www.woking2027.info/ldfregisters,0.06,not owned by a public authority,,permissioned,full planning permission,04/12/2015,https://www.woking.gov.uk/planning/publicaccess,,,yes,"Northern section of site PLAN/2014/1315 for 3 flats; AND southern section of the site PLAN/2014/1411 for 6 flats, both permitted subject to S106 agreement; PLAN/2016/0761 ""Variation to Unilateral Undertaking to vary the terms of the obligation for Affordable Housing and SAMM (PLAN/2014/1411)""",20/12/2017,20/12/2017,
http://opendatacommunities.org/id/district-council/woking,Woking Borough Council,SHLAAHOE12,"""Grosvenor Court, Hipley Street, Old Woking GU22 9LP""",54.351,-5.74,http://www.woking2027.info/ldfregisters,0.23,not owned by a public authority,,permissioned,full planning permission,13/06/2017,https://www.woking.gov.uk/planning/publicaccess,,,yes,"Prior approval granted 
PLAN/2017/0545 for 19 flats; also PLAN/2017/0017 for 18 flats.  In this case, the min net dwellings is based on indicative density from the SHLAA Methodology 2017 Appendix 4 rather than the current prior approval.",20/12/2017,20/12/2017,
http://opendatacommunities.org/id/district-council/woking,Woking Borough Council,SHLAAMHM004,"""Land at Bradfield Close and 7 York Road, Woking GU22 7QD""",54.341,-5.72,http://www.woking2027.info/ldfregisters,1.32,not owned by a public authority,,pending decision,full planning permission,,https://www.woking.gov.uk/planning/publicaccess,,,,PLAN/2016/0834 pending decision,20/12/2017,20/12/2017,
http://opendatacommunities.org/id/district-council/woking,Woking Borough Council,SHLAASTJ010,"""Land r/o 143 Goldsworth Road, Woking GU21 6LS""",51.318,-0.568,http://www.woking2027.info/ldfregisters,0.13,not owned by a public authority,,permissioned,full planning permission,24/03/2014,https://www.woking.gov.uk/planning/publicaccess,,,yes,PLAN/2013/0172 permitted subject to S106 agreeement,20/12/2017,20/12/2017,
http://opendatacommunities.org/id/district-council/woking,Woking Borough Council,SHLAABWB020,"""Domus Sheerwater Road, West Byfleet KT14 6AA""",54.373,-5.689,http://www.woking2027.info/ldfregisters,0.18,not owned by a public authority,,not permissioned,,,,,,,No planning history to date,20/12/2017,20/12/2017,
http://opendatacommunities.org/id/district-council/woking,Woking Borough Council,SHLAABWB023,"""Telephone Exchange, Highfield Road, West Byfleet, KT14 6QU""",54.379,-5.683,http://www.woking2027.info/ldfregisters,0.39,not owned by a public authority,,not permissioned,,,,,,,No planning history to date. Unlikely to be available.,20/12/2017,20/12/2017,
http://opendatacommunities.org/id/district-council/woking,Woking Borough Council,SHLAABWB026,"""Roxburghe House, Lavender Park Road, West Byfleet KT14 6LD""",54.378,-5.682,http://www.woking2027.info/ldfregisters,0.07,not owned by a public authority,,permissioned,full planning permission,05/10/2015,https://www.woking.gov.uk/planning/publicaccess,,,yes,"PLAN/2015/0869 Prior approval, implemented. Also PLAN/2016/0045 for 5 duplex apartments permitted (on 2016-10-03) subject to legal agreeement",20/12/2017,20/12/2017,
http://opendatacommunities.org/id/district-council/woking,Woking Borough Council,SHLAABWB027,"""Globe House, Lavender Park Road, West Byfleet KT14 6ND""",51.339,-0.505,http://www.woking2027.info/ldfregisters,0.08,not owned by a public authority,,pending decision,full planning permission,,https://www.woking.gov.uk/planning/publicaccess,,,,PLAN/2016/0990 pending decision. PLAN/2016/0180 refused.,20/12/2017,20/12/2017,
http://opendatacommunities.org/id/district-council/woking,Woking Borough Council,SHLAABWB031,"""Rosemount House, Rosemount Avenue, West Byfleet, KT14 6LB""",54.377,-5.687,http://www.woking2027.info/ldfregisters,0.35,not owned by a public authority,,not permissioned,,,,,,,"No planning history to date. The min net dwelling figure is very much a lower estimate for this site, and is based on the lower range density given in the SHLAA Methodology Appendix 4.",20/12/2017,20/12/2017,
