OrganisationURI,OrganisationLabel,SiteReference,SiteNameAddress,GeoX,GeoY,SiteplanURL,Hectares,OwnershipStatus,HazardousSubstances,PlanningStatus,PermissionType,PermissionDate,PlanningHistory,NetDwellingsRangeFrom,NetDwellingsRangeTo,Deliverable,Notes,FirstAddedDate,LastUpdatedDate,EndDate
http://opendatacommunities.org/id/metropolitan-district-council/kirklees,Kirklees Council,BLR_089,"""Land north of, Tesco Superstore, Northgate, Cleckheaton""",-1.71493,53.72581,https://mapping.kirklees.gov.uk/connect/analyst/mobile/#/main?mapcfg=Kirklees%20Brownfield%20Land%20Register,1.38,not owned by a public authority,,pending decision,,,http://www.kirklees.gov.uk/beta/planning-applications/search-for-planning-applications/detail.aspx?id=2017/91677,0,0,,,20/12/2017,20/12/2017,
http://opendatacommunities.org/id/metropolitan-district-council/kirklees,Kirklees Council,BLR_090,"""Calder Mould Services, Headlands Road, Liversedge, WF15 7NT""",-1.69623,53.70654,https://mapping.kirklees.gov.uk/connect/analyst/mobile/#/main?mapcfg=Kirklees%20Brownfield%20Land%20Register,1.19,not owned by a public authority,,permissioned,outline planning permission,01/03/2017,http://www.kirklees.gov.uk/beta/planning-applications/search-for-planning-applications/detail.aspx?id=2016%2f93112,0,0,,,20/12/2017,20/12/2017,
http://opendatacommunities.org/id/metropolitan-district-council/kirklees,Kirklees Council,BLR_091,"""Land south west of Wards Hill, Batley""",-1.6314,53.71261,https://mapping.kirklees.gov.uk/connect/analyst/mobile/#/main?mapcfg=Kirklees%20Brownfield%20Land%20Register,0.55,owned by a public authority,,not permissioned,,,,0,0,yes,". Former job centre and car park site, potentially suitable for housing-led redevelopment.",20/12/2017,20/12/2017,
http://opendatacommunities.org/id/metropolitan-district-council/kirklees,Kirklees Council,BLR_092,"Land to the east of, Hightown Road, Cleckheaton",-1.71528,53.72126,https://mapping.kirklees.gov.uk/connect/analyst/mobile/#/main?mapcfg=Kirklees%20Brownfield%20Land%20Register,1.32,not owned by a public authority,,permissioned,reserved matters approval,19/12/2016,http://www.kirklees.gov.uk/beta/planning-applications/search-for-planning-applications/detail.aspx?id=2016%2f92535|http://www.kirklees.gov.uk/beta/planning-applications/search-for-planning-applications/detail.aspx?id=2015%2f90035,0,0,,. Reserved matters approval pursuant to outline permission 2015/90035 for erection of 44 dwellings,20/12/2017,20/12/2017,
http://opendatacommunities.org/id/metropolitan-district-council/kirklees,Kirklees Council,BLR_093,"""Former Woodwell House, Mayman Lane, Mount Pleasant, Batley""",-1.64112,53.71352,https://mapping.kirklees.gov.uk/connect/analyst/mobile/#/main?mapcfg=Kirklees%20Brownfield%20Land%20Register,0.56,owned by a public authority,,not permissioned,,,,0,0,,,20/12/2017,20/12/2017,
http://opendatacommunities.org/id/metropolitan-district-council/kirklees,Kirklees Council,BLR_094,"""Land adjacent, Halifax Road, Hightown, Liversedge""",-1.70151,53.71024,https://mapping.kirklees.gov.uk/connect/analyst/mobile/#/main?mapcfg=Kirklees%20Brownfield%20Land%20Register,0.36,not owned by a public authority,,not permissioned,,,,0,0,,Part of a larger site that includes some greenfield land.,20/12/2017,20/12/2017,
http://opendatacommunities.org/id/metropolitan-district-council/kirklees,Kirklees Council,BLR_095,"""Former Parkham Foods Site, 395, Halifax Road, Liversedge, WF15 8DU""",-1.71943,53.71175,https://mapping.kirklees.gov.uk/connect/analyst/mobile/#/main?mapcfg=Kirklees%20Brownfield%20Land%20Register,0.65,not owned by a public authority,,permissioned,full planning permission,19/10/2017,http://www.kirklees.gov.uk/beta/planning-applications/search-for-planning-applications/detail.aspx?id=2015%2f90435,0,0,,. Permission for erection of 14 dwellings with integral garages.,20/12/2017,20/12/2017,
http://opendatacommunities.org/id/metropolitan-district-council/kirklees,Kirklees Council,BLR_096,"""Land Adjacent, Highmoor Lane, Hartshead""",-1.74279,53.71783,https://mapping.kirklees.gov.uk/connect/analyst/mobile/#/main?mapcfg=Kirklees%20Brownfield%20Land%20Register,1.62,owned by a public authority,,not permissioned,,,,0,0,,". Former school site (demolished), potentially suitable for redevelopment as housing.",20/12/2017,20/12/2017,
http://opendatacommunities.org/id/metropolitan-district-council/kirklees,Kirklees Council,BLR_097,"Highgrove Beds Ltd, Spen Lane, Gomersal, Cleckheaton",-1.69444,53.72941,https://mapping.kirklees.gov.uk/connect/analyst/mobile/#/main?mapcfg=Kirklees%20Brownfield%20Land%20Register,1.45,not owned by a public authority,,not permissioned,,,,0,0,,,20/12/2017,20/12/2017,
