OrganisationURI,OrganisationLabel,SiteReference,SiteNameAddress,GeoX,GeoY,SiteplanURL,Hectares,OwnershipStatus,HazardousSubstances,PlanningStatus,PermissionType,PermissionDate,PlanningHistory,MinNetDwellings,NetDwellingsRangeFrom,NetDwellingsRangeTo,Deliverable,Notes,FirstAddedDate,LastUpdatedDate,EndDate
http://opendatacommunities.org/id/district? council/northampton,,BFR0171,"Quinton Road, Wootton",476591.3016,255848.2594,https://www.northampton.gov.uk/download/downloads/id/10720/bfr0171,1.16,Not owned by a public authority,,not permissioned,,,,,19,19,yes,"Part of Former Wootton Sewage Works. Part of the site is within Floodzone 2,3 and 3B. Allocated in emerging Local Plan (Part 2)",20/12/2018,18/12/2019,
http://opendatacommunities.org/id/district? council/northampton,,BFR0181,Ransome Road/Nunn Mills Road,475984.6975,259438.2136,https://www.northampton.gov.uk/download/downloads/id/10716/bfr0181,11.58,Owned by a public authority,,not permissioned,,,,,500,500 plus,yes,Site allocated in CAAP and Emerging Local Plan (Part 2) for residential development,13/12/2017,18/12/2019,
http://opendatacommunities.org/id/district? council/northampton,,BFR0191,"Blackthorn Middle School, Blackthorn Road",481018.3643,264117.647,https://www.northampton.gov.uk/download/downloads/id/10049/bfr0191,3.23,Not owned by a public authority,,permissioned,full planning permission,30/09/2019,,,115,115,yes,Site was formerly Blackthorn Middle School and now vacant.  N/2018/0848 - full permission,13/12/2017,18/12/2019,
http://opendatacommunities.org/id/district? council/northampton,,BFR0205,"Parklands Middle School, Devon Way",476912.465,264253.6108,https://www.northampton.gov.uk/download/downloads/id/10046/bfr0205,4.93,Owned by a public authority,,permissioned,reserved matters approval,24/10/2019,,,132,132,yes,N/2006/1052 (WNDC app) Outline App for residential development withdrawn (23 Jan 2012).  N/2018/0904 Outline application with all matters reserved except access for up to 132no dwellings (approved 21/3/19).  N/2019/0923 RM for 132 dwellings withdrawn. N/2019/0591 Reserved matter application for 132 dwellings approved (24/10/2019),13/12/2017,18/12/2019,
http://opendatacommunities.org/id/district? council/northampton,,BFR0288,Railway Station Car Park,474831.7144,260503.1206,https://www.northampton.gov.uk/download/downloads/id/10048/bfr0288,2.12,Owned by a public authority,,not permissioned,,,,,68,68,yes,Forms part of Policy 19 (Castle Station) in the Central Area Action Plan (adopted 2013) and emerging Local Plan (Part 2).,13/12/2017,18/12/2019,
http://opendatacommunities.org/id/district? council/northampton,,BFR0335,Chronicle & Echo North,475854.005,261102.0467,https://www.northampton.gov.uk/download/downloads/id/10053/bfr0335,1.03,Not owned by a public authority,,permissioned,full planning permission,03/12/2018,,,42,42,yes,"Allocated in CAAP and emerging Local Plan (Part 2)N/2016/1434 (temporary car park, Great Russell Street) proposed construction of 12 dwellings (approved). N/2016/0319 (temporary car park, Great Russell Street) erect 24 maisonettes (refused). N/2014/1279 (former Top of the Town Nightclub) Construction of three storey building to provide offices, 12 flats and basement parking.  N/2018/1162 The Cuckoo’s Nest change of use of Public House to 6 flats, approved 3/12/18.  N/2019/0426 (former Top of the Town Nightclub) Construction of four storey building (including basement) to provide 14no flats and basement parking - no decision 11/10/2019",13/12/2017,18/12/2019,
http://opendatacommunities.org/id/district? council/northampton,,BFR0336,Chronicle & Echo South,475807.9188,261017.6892,https://www.northampton.gov.uk/download/downloads/id/10721/bfr0336,0.32,Not owned by a public authority,,permissioned,outline planning permission,18/03/2016,,,19,19,yes,"Allocated in CAAP and emerging Local Plan (Part 2). N/2015/0333 Hybrid planning application comprising (a) Full Planning Application for the erection of 1810m2 new retail food store with associated access from Earl Street, landscaping and car parking; and (b) Outline Planning Application with all matters reserved except access (from Great Russell Street) of up to 19 residential dwellings.  2018 update Aldi foodstore completed, outline amended. Reserved matter Application N/2019/0357 for 14 dwellings in progress.",13/12/2017,18/12/2019,
http://opendatacommunities.org/id/district? council/northampton,,BFR0338,Countess Road,472290.4264,262371.5087,https://www.northampton.gov.uk/download/downloads/id/10056/bfr0338,2.46,Not owned by a public authority,,permissioned,full planning permission,25/09/2019,,,68,68,yes,"Allocated in emerging Local Plan (Part 2). N/2015/1021 approval for part demolition of existing factory building and conversion of existing factory building into 45 apartments and the erection of dwellings.  N/2017/0401 0025 Barker Buildings, approved 27/9/18, 64 no compliant residential units, ranging in size from studio to two bedrooms.  N/2019/0563 Barker Buildings, part demolition and conversion of the existing factory building to 54no apartments and the erection of a new 3-storey building to provide 14no apartments, together with bin and cycle storage and parking (approved 25/9/19).",29/06/2016,18/12/2019,
http://opendatacommunities.org/id/district? council/northampton,,BFR0355,Balmoral Road (rear),475236.1852,262254.1573,https://www.northampton.gov.uk/download/downloads/id/10715/bfr0355,0.24,Not owned by a public authority,,not permissioned,,,,,10,10,yes,"Part of the site has been built on, the remaining site is operational. No evidence for this site to be available.",13/12/2017,11/10/2019,18/12/2019
http://opendatacommunities.org/id/district? council/northampton,,BFR0496,57 Artizan Road,476540.9694,261184.6789,https://www.northampton.gov.uk/download/downloads/id/10055/bfr0496,0.05,Not owned by a public authority,,permissioned,full planning permission,06/09/2019,,,10,10,yes,"N/2015/0390 Approved for demolition of part single, two storey and three storey rear element of the building. Change of use of existing factory/storage to 10no. One bed self contained flats (2no. Mobility Units) together with 8no. On site parking bays (2no. Mobility bays), refuse bin area and cycle storage areas. Resubmission of planning application N/2010/0019.  N/2018/0834, conversion into 10 NO.1 bed flats, approved.  Superseded by N/2018/0834, approved 6/9/2018.  Under construction 1/4/2019.",29/06/2016,18/12/2019,
http://opendatacommunities.org/id/district? council/northampton,,BFR0497,12 Duke Street,475679.0673,261218.3662,https://www.northampton.gov.uk/download/downloads/id/10109/bfr0497,0.04,Not owned by a public authority,,permissioned,full planning permission,08/08/2014,,,14,14,,"Permission for 14no. flats N/2014/0431, development completed",29/06/2016,18/12/2019,18/12/2019
http://opendatacommunities.org/id/district? council/northampton,,BFR0507,"Former Semilong Service Station, St Andrews Road",474929.7967,261129.0539,https://www.northampton.gov.uk/download/downloads/id/10072/bfr0507,0.08,Not owned by a public authority,,permissioned,full planning permission,13/12/2012,,,24,24,yes,N/2005/0797 planning permission for 24 flats. N/2012/0905 planning permission for 22 unit residential care home (C2). Both proposals involve offices on the ground floor. Construction works have started on site.,29/06/2016,13/12/2017,
http://opendatacommunities.org/id/district? council/northampton,,BFR0510,"Bective Works/Jabez House, Bective Road/Yelvertoft Road",475276.4365,263479.3109,https://www.northampton.gov.uk/download/downloads/id/10062/bfr0510,0.52,Not owned by a public authority,,permissioned,full planning permission,30/07/2015,,,117,117,yes,"A longstanding application from 2012 to extend previous residential permission has had no activity for years. In the meantime permissions have been granted for student accommodation in 2015 - N/2015/0419.  N/2019/0612 Erection of purpose-built student accommodation comprising 385no rooms with 420no bed-spaces , following partial demolition of existing buildings - no decision, 11/10/19",13/12/2017,18/12/2019,
http://opendatacommunities.org/id/district? council/northampton,,BFR0594,Sixfields East,473144.0819,260366.9011,https://www.northampton.gov.uk/download/downloads/id/10060/bfr0594,10.18,mixed ownership,,pending decision,,,,,255,255,yes,Allocated in emerging Local Plan (Part 2). N/2014/0596 outline planning application for mixed use development  including 255 dwellings.,29/06/2016,18/12/2019,
http://opendatacommunities.org/id/district? council/northampton,,BFR0624,Southbridge/Nunn  Mills,475693.1921,259842.7971,https://www.northampton.gov.uk/download/downloads/id/10063/bfr0624,0.17,mixed ownership,,not permissioned,,,,,94,94,yes,"Allocated in emerging Local Plan (Part 2). All planning history associated with residential development of this site now largely completed. However, 94 dwellings (part affordable housing) are left to be completed on two parts of the site. process is underway to transfer these two parcels of land to Northampton Borough Council.",13/12/2017,18/12/2019,
http://opendatacommunities.org/id/district? council/northampton,,BFR0666,171 - 180 St Andrews Road,474901.2929,261670.1888,https://www.northampton.gov.uk/download/downloads/id/10061/bfr0666,0.16,Not owned by a public authority,,permissioned,reserved matters approval permission approval,03/02/2017,,,22,22,yes,"Allocated in emerging Local Plan (Part 2). N/2010/0785 Outline application for the demolition of existing B8 Business units and erection of 14no. bed and 8no. bed apartments, formation of new access and parking areas (access, layout scale for approval). N/2016/0979 Reserved Matters application pursuant to outline planning permission N/2010/0785 (demolition of existing business units and erection of 14no. bed and 8no. bed apartments, formation of new access and parking areas) for approval of appearance and landscaping.",13/12/2017,18/12/2019,
http://opendatacommunities.org/id/district? council/northampton,,BFR0689,"Nene Enterprise Centre, Freehold Street",475439.7998,261925.7178,https://www.northampton.gov.uk/download/downloads/id/10067/bfr0689,0.36,Not owned by a public authority,,not permissioned,,,,,14,14,yes,This site is identified as 'not suitable for development' by SAMLAA.,13/12/2017,18/12/2019,18/12/2019
http://opendatacommunities.org/id/district? council/northampton,,BFR0719,"Car Garage Workshops, 409 Harlestone Road",472207.714,262424.0874,https://www.northampton.gov.uk/download/downloads/id/10066/bfr0719,1.09,Not owned by a public authority,,not permissioned,,,,,35,35,yes,Allocated in emerging Local Plan (Part 2).,13/12/2017,18/12/2019,
http://opendatacommunities.org/id/district? council/northampton,,BFR0730,"20 - 22 St Giles St (upper and rear) and Newspaper House, Derngate",475686.5393,260445.0871,https://www.northampton.gov.uk/download/downloads/id/10064/bfr0730,0.18,Not owned by a public authority,,permissioned,full planning permission,29/03/2019,,,57,57,yes,"2016/0406 Approval for 57 apartments, 2016/1548 Additional retail floorspace, 2017/0012 Change of apartment mix of pp 2016/0406. Also, for Newspaper House part of the site, N/2015/0738 demolition of part of the existing building, conversion of the rest and erection of two new floors to form 64no. flats. N/2018/0835 Addition of rooftop extension to form two additional apartments",13/12/2017,21/12/2018,
http://opendatacommunities.org/id/district? council/northampton,,BFR0814,32 Great Russell Street,475881.6283,261106.7466,https://www.northampton.gov.uk/download/downloads/id/10071/bfr0814,0.15,Not owned by a public authority,,permissioned,full planning permission,08/09/2017,,,12,12,yes,"Current planning approval N/2016/1434, under construction",13/12/2017,21/12/2018,
http://opendatacommunities.org/id/district? council/northampton,,BFR0896,"Former St Crispin’s Hospital, St Crispin Drive",471261.2446,261079.0275,https://www.northampton.gov.uk/download/downloads/id/10069/bfr0896,2.74,Not owned by a public authority,,permissioned,full planning permission,08/05/2017,,,235,235,yes,"This site is currently under construction for residential development. N/2004/1542 has been partly implemented. Application N/2015/1454 for the rest of the site approved. Demolition of the existing ward blocks. Restoration of the clock tower and conversion to residential use comprising 13no apartments, restoration of the administration building and conversion to residential use to provide 4no apartments, the erection of 120no apartments and 98 houses (235no dwellings total) with associated roads and underground car parks.",13/12/2017,13/12/2017,
http://opendatacommunities.org/id/district? council/northampton,,BFR0903,"Hawkins Shoe Factory, Overstone Road, and 4 - 12 Dunster Street",475859.2722,260910.2539,https://www.northampton.gov.uk/download/downloads/id/10077/bfr0903,0.26,Not owned by a public authority,,permissioned,full planning permission,28/07/2016,,,105,105,yes,"Allocated in emerging Local Plan (Part 2). N/2015/0673 Conversion and alterations of factory premises to form 105 apartments with associated parking both on site and on street, replacement of windows and new roof lights, proposed infill extension on Dunster Street facade including new roof terrace.",29/06/2016,18/12/2019,
http://opendatacommunities.org/id/district? council/northampton,,BFR0915,118 - 122 Wellingborough Road,476355.2711,260896.5781,https://www.northampton.gov.uk/download/downloads/id/10073/bfr0915,0.1,Not owned by a public authority,,not permissioned,,,,,12,12,yes,"No longer considered to be suitable for development.  (No live applications, No evidence of availability and the properties fronting Wellingborough Road are operational, not recommended for allocation by SAMLAA.)",29/06/2016,18/12/2019,18/12/2019
http://opendatacommunities.org/id/district? council/northampton,,BFR1001,Former Emmanuel Middle School,479635.1999,263005.841,https://www.northampton.gov.uk/download/downloads/id/10080/bfr1001,2.24,Not owned by a public authority,,permissioned,full planning permission,29/03/2018,,,83,83,yes,Planning permission to extend the original Outline (109) was granted on 08.10.2014 with RM to be submitted within years. N/2017/1097 erection of 83no dwellings approved 29/3/18.  Under construction as of 1/4/2019,29/06/2016,18/12/2019,
http://opendatacommunities.org/id/district? council/northampton,,BFR1002,Former Lings Upper School,479719.3124,262878.5076,https://www.northampton.gov.uk/download/downloads/id/10074/bfr1002,1.43,Owned by a public authority,,permissioned,outline planning,07/07/2017,,,60,60,yes,Allocated in emerging Local Plan (Part 2). Outline permission (N/2015/0019) granted on 07.07.2017 for up to 60 dwellings.,13/12/2017,18/12/2019,
http://opendatacommunities.org/id/district? council/northampton,,BFR1010,Land at St Peters Way/ Court Road/ Freeschool Street,475085.4126,260309.805,https://www.northampton.gov.uk/download/downloads/id/10075/bfr1010,1.17,mixed ownership,,not permissioned,,,,,37,37,yes,Allocated for mixed use including residential in Policy 33 Central Area Action Plan (2013) and Northampton Local Plan Part 2 Submission Draft (2019).,13/12/2017,18/12/2019,
http://opendatacommunities.org/id/district? council/northampton,,BFR1013,University of Northampton Park Campus,476346.9968,264482.9572,https://www.northampton.gov.uk/download/downloads/id/10086/bfr1013,27.5,Not owned by a public authority,,permissioned,reserved matters approval,19/09/2014,,,800,800,yes,"Allocated in emerging Local Plan (Part 2). N/2014/0475 planning approval for outline application (all matters reserved except access) for the demolition of the University facilities and erection of new buildings comprising residential accommodation up to 800 units, associated car parking, retail unit, landscaping and open space with accesses from Boughton Green Road.  RM N/2018/0688 phase 1 - 147 dwellings approved 10/9/18, now under construction.",13/12/2017,18/12/2019,
http://opendatacommunities.org/id/district? council/northampton,,BFR1014,University of Northampton Avenue Campus,475799.936,262025.6003,https://www.northampton.gov.uk/download/downloads/id/10079/bfr1014,6.02,Owned by a public authority,,pending decision,,,,,200,200,yes,"Allocated in emerging Local Plan (Part 2). N/2016/0810 outline application with reserved matters for demolition and conversion of existing university buildings, demolition of existing university facilities and outline planning permission for erection of new buildings comprising residential up to 200 units, associated car parking, landscaping and open space (in progress).",13/12/2017,18/12/2019,
http://opendatacommunities.org/id/district? council/northampton,,BFR1022,"Belgrave House, Grosvenor Shopping Centre",475476.1874,260695.4255,https://www.northampton.gov.uk/download/downloads/id/10078/bfr1022,0.21,Not owned by a public authority,,permissioned,full planning permission,15/02/2018,,,99,99,yes,"Allocated in emerging Local Plan (Part 2). N/2017/1144 Change of Use of Belgrave House from offices to student accommodation - approved 15/2/2018.  N/2019/0755 Change of Use to Residential (Use Class C3), for social housing. Scale of development is within the building envelope with the addition of two new upper floors, to create 124no apartments. Changes to fenestration and alterations to external facade - in progress 11/10/2019.",13/12/2017,18/12/2019,
http://opendatacommunities.org/id/district? council/northampton,,BFR1024,Great Houghton Independent School,479032.3714,259100.6085,https://www.northampton.gov.uk/download/downloads/id/10083/bfr1024,6.92,Not owned by a public authority,,not permissioned,,,,,221,221,yes,No longer suitable for development. SAMLAA identified this site not to be recommended for allocation.,13/12/2017,18/12/2019,18/12/2019
http://opendatacommunities.org/id/district? council/northampton,,BFR1034,Witham Way garage site,473846.5395,262269.0779,https://www.northampton.gov.uk/download/downloads/id/10082/bfr1034,0.15,Owned by a public authority,,,,,,,4,4,,Removed as below threshold,13/12/2017,18/12/2019,18/12/2019
http://opendatacommunities.org/id/district? council/northampton,,BFR1035,West Oval garage site,473705.0715,262273.4698,https://www.northampton.gov.uk/download/downloads/id/10085/bfr1035,0.18,Owned by a public authority,,not permissioned,,,,,7,7,yes,"N/2016/0704 Prior notification of proposed demolition of garage blocks at Swale Drive, Derwent Drive, West Oval and Witham Way.  N/2018/0923, development of 4no semi-detached dwellings with associated parking under construction April 2019.",13/12/2017,18/12/2019,
http://opendatacommunities.org/id/district? council/northampton,,BFR1036,Derwent Drive garage site,474005.0176,262516.957,https://www.northampton.gov.uk/download/downloads/id/10087/bfr1036,0.2,Owned by a public authority,,not permissioned,,,,,8,8,yes,"Allocated in emerging Local Plan (Part 2). N/2016/0704 Prior notification of proposed demolition of garage blocks at Swale Drive, Derwent Drive, West Oval and Witham Way.",13/12/2017,18/12/2019,
http://opendatacommunities.org/id/district? council/northampton,,BFR1037,Swale Drive garage site and rear/unused land,473693.5999,262959.1374,https://www.northampton.gov.uk/download/downloads/id/10088/bfr1037,0.27,Owned by a public authority,,permissioned,full planning permission,20/03/2019,,,6,6,yes,"Allocated in emerging Local Plan (Part 2). N/2016/0704 Prior notification of proposed demolition of garage blocks at Swale Drive, Derwent Drive, West Oval and Witham Way Approved and implemented.  N/2018/1594 Development of 6no new dwellings with associated parking, approved 20/3/19.",13/12/2017,18/12/2019,
http://opendatacommunities.org/id/district? council/northampton,,BFR1068,"Garage site in The Briars, Briar Hill",474199.106,259185.0234,https://www.northampton.gov.uk/download/downloads/id/10093/bfr1068,0.13,Owned by a public authority,,,,,,,2,2,,Removed as below threshold,13/12/2017,18/12/2019,18/12/2019
http://opendatacommunities.org/id/district? council/northampton,,BFR1078,Land at Chapel Place,475998.6837,260863.3368,https://www.northampton.gov.uk/download/downloads/id/10089/bfr1078,0.08,Owned by a public authority,,not permissioned,,,,,12,12,yes,This site is identified not to be recommended for allocation by SAMLAA.,13/12/2017,18/12/2019,18/12/2019
http://opendatacommunities.org/id/district? council/northampton,,BFR1108,"Former Dairy Crest Depot, Horsley Road",475001.6392,262167.9108,https://www.northampton.gov.uk/download/downloads/id/10104/brf1108,1.1,Not owned by a public authority,,not permissioned,,,,,35,35,yes,"Allocated in emerging Local Plan (Part 2). N/2019/0223, Prior Notification of Demolition of industrial units and office building, approved 21/3/2019.",13/12/2017,18/12/2019,
http://opendatacommunities.org/id/district? council/northampton,,BFR1113,Greyfriars,475523.4564,260767.6101,https://www.northampton.gov.uk/download/downloads/id/10090/bfr1113,1.74,Owned by a public authority,,not permissioned,,,,,400,400,yes,Site is allocated in the Central Area Action Plan and emerging LPP2 for mixed use which include residential.,13/12/2017,13/12/2017,
http://opendatacommunities.org/id/district? council/northampton,,BFR1114,"Cedarwood Nursing Home, 492 Kettering Road",477567.2243,263575.4339,https://www.northampton.gov.uk/download/downloads/id/10095/bfr1114,0.19,Not owned by a public authority,,,,,,,2,2,,Removed as below threshold,13/12/2017,18/12/2019,18/12/2019
http://opendatacommunities.org/id/district? council/northampton,,BFR1116,194 - 200 Kingsthorpe Grove,475721.3383,262539.7348,https://www.northampton.gov.uk/download/downloads/id/10102/bfr1116,0.15,Not owned by a public authority,,permissioned,full planning permission,03/07/2018,,,9,9,yes,N/2018/0630 Alterations and extensions to provide 9no additional apartments including parking and landscaping.,13/12/2017,18/12/2019,
http://opendatacommunities.org/id/district? council/northampton,,BFR1117,133 Queens Park Terrace,475176.4096,262846.438,https://www.northampton.gov.uk/download/downloads/id/10094/bfr1117,0.06,Owned by a public authority,,permissioned,full planning permission,28/11/2018,,,6,6,yes,Allocated in emerging Local Plan (Part 2). N/2017/1695 Proposed 6no one bedroom apartments and associated parking.,13/12/2017,18/12/2019,
http://opendatacommunities.org/id/district? council/northampton,,BFR1118,135 Harlestone Road,473260.9045,261640.4479,https://www.northampton.gov.uk/download/downloads/id/10092/bfr1118,0.71,Not owned by a public authority,,permissioned,reserved matters approval,15/08/2018,,,8,8,yes,Allocated in emerging Local Plan (Part 2). N/2016/0083 outline. Demolish house and erect up to 12 dwellings. N/2018/0460 Reserved matters application approved 2018.,29/06/2016,18/12/2019,
http://opendatacommunities.org/id/district? council/northampton,,BFR1119,"Silver Coronet PH site, Welland Way",473884.8221,262654.4366,https://www.northampton.gov.uk/download/downloads/id/10110/bfr1119,0.16,Not owned by a public authority,,permissioned,full planning permission,05/09/2018,,,12,12,yes,"N/2018/0476 full permission erection of 14no bedroom dwellings approved, under construction April 2019",13/12/2017,18/12/2019,
http://opendatacommunities.org/id/district? council/northampton,,BFR1123,83 - 103 Trinity Avenue,475718.0972,262516.4867,https://www.northampton.gov.uk/download/downloads/id/10108/bfr1123,0.19,Not owned by a public authority,,permissioned,full planning permission,03/07/2019,,,9,9,yes,"Allocated in emerging Local Plan (Part 2). N/2015/0637, superseded by N/2018/0630 - alterations and extensions to provide 9no. additional apartments, including parking and landscaping at 81-103 Trinity Avenue and 162-168 Stanhope Road, approved 3/7/2019.",13/12/2017,18/12/2019,
http://opendatacommunities.org/id/district? council/northampton,,BFR1124,41 - 43 Derngate,475768.4849,260372.0483,https://www.northampton.gov.uk/download/downloads/id/10099/bfr1124,0.08,Not owned by a public authority,,permissioned,full planning permission,06/05/2015,,,7,7,yes,Allocated in emerging Local Plan (Part 2). N/2014/0694 Demolition of 41 Derngate and construction of 7no. town houses with on site parking spaces (as per amended plans received 07/11/14) approved.  N/2018/1645 Castillian Chambers Demolition of existing buildings and creation of 95no apartments and studios not yet decided (as of October 2019),29/06/2016,18/12/2019,
http://opendatacommunities.org/id/district? council/northampton,,BFR1126,Adj 5 Primrose Hill,475284.4082,261747.3513,https://www.northampton.gov.uk/download/downloads/id/10097/bfr1126,0.04,Not owned by a public authority,,permissioned,full planning permission,27/03/2015,,,6,6,yes,Allocated in emerging Local Plan (Part 2). N/2014/1387  demolition of garage and erection of 6no. flats.,29/06/2016,18/12/2019,
http://opendatacommunities.org/id/district? council/northampton,,BFR1127,"Connaught House, 32 Connaught Street",475606.384,261078.8932,https://www.northampton.gov.uk/download/downloads/id/10100/bfr1127,0.03,Not owned by a public authority,,not permissioned,,,,,6,6,yes,"No longer suitable for development. No permission, SAMLAA identified this site is not recommended for allocation.",29/06/2016,18/12/2019,18/12/2019
http://opendatacommunities.org/id/district? council/northampton,,BFR1129,104 - 104A Abington Street,475901.4748,260708.6442,https://www.northampton.gov.uk/download/downloads/id/10103/bfr1129,0.01,Not owned by a public authority,,,,,,,5,5,,Removed as site has been developed.,13/12/2017,18/12/2019,18/12/2019
