{"id": null, "meta_data": {"headers_expected": ["OrganisationURI", "SiteReference", "SiteNameAddress", "GeoX", "GeoY", "SiteplanURL", "Hectares", "OwnershipStatus", "PlanningStatus", "PermissionType", "PermissionDate", "PlanningHistory", "Deliverable", "NetDwellingsRangeFrom", "NetDwellingsRangeTo", "HazardousSubstances", "Notes", "FirstAddedDate", "LastUpdatedDate", "EndDate"], "headers_found": ["OrganisationURI", "OrganisationLabel", "SiteReference", "PreviouslyPartOf", "SiteNameAddress", "SiteplanURL", "CoordinateReferenceSystem", "GeoX", "GeoY", "Hectares", "OwnershipStatus", "Deliverable", "PlanningStatus", "PermissionType", "PermissionDate", "PlanningHistory", "ProposedForPIP", "MinNetDwellings", "DevelopmentDescription", "NonHousingDevelopment", "Part2", "NetDwellingsRangeFrom", "NetDwellingsRangeTo", "HazardousSubstances", "SiteInformation", "Notes", "FirstAddedDate", "LastUpdatedDate"], "missing_headers": ["EndDate"], "additional_headers": ["CoordinateReferenceSystem", "ProposedForPIP", "PreviouslyPartOf", "MinNetDwellings", "Part2", "NonHousingDevelopment", "OrganisationLabel", "DevelopmentDescription", "SiteInformation"], "media_type": "text/csv", "suffix": ".csv"}, "errors_by_row": [{"OrganisationURI": {"value": "http://opendatacommunities.org/id/district-council/allerdale", "error": null, "row": 1}, "SiteReference": {"value": "BR/ABB/01H", "error": null, "row": 1}, "SiteNameAddress": {"value": "Land to the north of Laurel Terrace, Laurel Terrace, Abbeytown", "error": null, "row": 1}, "GeoX": {"value": "317284", "error": {"message": "317284 isn't a longitude using the WGS84 or ETRS89 coordinate systems", "fix": null}, "row": 1}, "GeoY": {"value": "550804", "error": {"message": "550804 isn't a latitude using the WGS84 or ETRS89 coordinate systems", "fix": null}, "row": 1}, "SiteplanURL": {"value": "http://mapping.allerdale.gov.uk/myallerdale.aspx", "error": null, "row": 1}, "Hectares": {"value": "0.28", "error": null, "row": 1}, "OwnershipStatus": {"value": "Not owned by a public authority", "error": null, "row": 1}, "PlanningStatus": {"value": "Not Permissioned", "error": null, "row": 1}, "PermissionType": {"value": "", "error": null, "row": 1}, "PermissionDate": {"value": "", "error": null, "row": 1}, "PlanningHistory": {"value": "", "error": null, "row": 1}, "Deliverable": {"value": "", "error": null, "row": 1}, "NetDwellingsRangeFrom": {"value": "5", "error": null, "row": 1}, "NetDwellingsRangeTo": {"value": "10", "error": null, "row": 1}, "HazardousSubstances": {"value": "", "error": null, "row": 1}, "Notes": {"value": "", "error": null, "row": 1}, "FirstAddedDate": {"value": "2017-12-20", "error": null, "row": 1}, "LastUpdatedDate": {"value": "", "error": null, "row": 1}}, {"OrganisationURI": {"value": "http://opendatacommunities.org/id/district-council/allerdale", "error": null, "row": 2}, "SiteReference": {"value": "BR/BRM/01H", "error": null, "row": 2}, "SiteNameAddress": {"value": "Land at former Broughton Moor RNAD, Moor Road, Broughton Moor", "error": null, "row": 2}, "GeoX": {"value": "306461", "error": {"message": "306461 isn't a longitude using the WGS84 or ETRS89 coordinate systems", "fix": null}, "row": 2}, "GeoY": {"value": "532113", "error": {"message": "532113 isn't a latitude using the WGS84 or ETRS89 coordinate systems", "fix": null}, "row": 2}, "SiteplanURL": {"value": "http://mapping.allerdale.gov.uk/myallerdale.aspx", "error": null, "row": 2}, "Hectares": {"value": "4.3", "error": null, "row": 2}, "OwnershipStatus": {"value": "Owned by a public authority", "error": null, "row": 2}, "PlanningStatus": {"value": "Permissioned", "error": null, "row": 2}, "PermissionType": {"value": "Outline Planning Permission", "error": null, "row": 2}, "PermissionDate": {"value": "06.05.2015", "error": {"message": "The date 06.05.2015 should be entered as 2015-06-05", "fix": "2015-06-05"}, "row": 2}, "PlanningHistory": {"value": "http://planning.allerdale.gov.uk/portal/servlets/ApplicationSearchServlet?PKID=123998", "error": null, "row": 2}, "Deliverable": {"value": "Yes", "error": null, "row": 2}, "NetDwellingsRangeFrom": {"value": "24", "error": null, "row": 2}, "NetDwellingsRangeTo": {"value": "30", "error": null, "row": 2}, "HazardousSubstances": {"value": "", "error": null, "row": 2}, "Notes": {"value": "24 selfbuild plots and demolition of 3 buildings", "error": null, "row": 2}, "FirstAddedDate": {"value": "2017-12-20", "error": null, "row": 2}, "LastUpdatedDate": {"value": "", "error": null, "row": 2}}, {"OrganisationURI": {"value": "http://opendatacommunities.org/id/district-council/allerdale", "error": null, "row": 3}, "SiteReference": {"value": "BR/FLI/01H", "error": null, "row": 3}, "SiteNameAddress": {"value": "Former Flimby Garage, Church Road, Flimby", "error": null, "row": 3}, "GeoX": {"value": "302381", "error": {"message": "302381 isn't a longitude using the WGS84 or ETRS89 coordinate systems", "fix": null}, "row": 3}, "GeoY": {"value": "533419", "error": {"message": "533419 isn't a latitude using the WGS84 or ETRS89 coordinate systems", "fix": null}, "row": 3}, "SiteplanURL": {"value": "http://mapping.allerdale.gov.uk/myallerdale.aspx", "error": null, "row": 3}, "Hectares": {"value": "0.17", "error": null, "row": 3}, "OwnershipStatus": {"value": "Not owned by a public authority", "error": null, "row": 3}, "PlanningStatus": {"value": "Not Permissioned", "error": null, "row": 3}, "PermissionType": {"value": "", "error": null, "row": 3}, "PermissionDate": {"value": "", "error": null, "row": 3}, "PlanningHistory": {"value": "http://planning.allerdale.gov.uk/portal/servlets/ApplicationSearchServlet?PKID=108925", "error": null, "row": 3}, "Deliverable": {"value": "", "error": null, "row": 3}, "NetDwellingsRangeFrom": {"value": "5", "error": null, "row": 3}, "NetDwellingsRangeTo": {"value": "6", "error": null, "row": 3}, "HazardousSubstances": {"value": "", "error": null, "row": 3}, "Notes": {"value": "", "error": null, "row": 3}, "FirstAddedDate": {"value": "2017-12-20", "error": null, "row": 3}, "LastUpdatedDate": {"value": "", "error": null, "row": 3}}, {"OrganisationURI": {"value": "http://opendatacommunities.org/id/district-council/allerdale", "error": null, "row": 4}, "SiteReference": {"value": "BR/GRC/02H", "error": null, "row": 4}, "SiteNameAddress": {"value": "Land at William Street, Great Clifton", "error": null, "row": 4}, "GeoX": {"value": "303964", "error": {"message": "303964 isn't a longitude using the WGS84 or ETRS89 coordinate systems", "fix": null}, "row": 4}, "GeoY": {"value": "529858", "error": {"message": "529858 isn't a latitude using the WGS84 or ETRS89 coordinate systems", "fix": null}, "row": 4}, "SiteplanURL": {"value": "http://mapping.allerdale.gov.uk/myallerdale.aspx", "error": null, "row": 4}, "Hectares": {"value": "0.52", "error": null, "row": 4}, "OwnershipStatus": {"value": "Not owned by a public authority", "error": null, "row": 4}, "PlanningStatus": {"value": "Permissioned", "error": null, "row": 4}, "PermissionType": {"value": "Full Planning Permission", "error": null, "row": 4}, "PermissionDate": {"value": "19.09.2012", "error": {"message": "The date 19.09.2012 should be entered as 2012-09-19", "fix": "2012-09-19"}, "row": 4}, "PlanningHistory": {"value": "http://planning.allerdale.gov.uk/portal/servlets/ApplicationSearchServlet?PKID=96500", "error": null, "row": 4}, "Deliverable": {"value": "Yes", "error": null, "row": 4}, "NetDwellingsRangeFrom": {"value": "15", "error": null, "row": 4}, "NetDwellingsRangeTo": {"value": "18", "error": null, "row": 4}, "HazardousSubstances": {"value": "", "error": null, "row": 4}, "Notes": {"value": "18 dwellings", "error": null, "row": 4}, "FirstAddedDate": {"value": "2017-12-20", "error": null, "row": 4}, "LastUpdatedDate": {"value": "", "error": null, "row": 4}}, {"OrganisationURI": {"value": "http://opendatacommunities.org/id/district-council/allerdale", "error": null, "row": 5}, "SiteReference": {"value": "BR/KBR/01H", "error": null, "row": 5}, "SiteNameAddress": {"value": "Land adjacent to Rodway, West Lane, Kirkbride", "error": null, "row": 5}, "GeoX": {"value": "322802", "error": {"message": "322802 isn't a longitude using the WGS84 or ETRS89 coordinate systems", "fix": null}, "row": 5}, "GeoY": {"value": "556235", "error": {"message": "556235 isn't a latitude using the WGS84 or ETRS89 coordinate systems", "fix": null}, "row": 5}, "SiteplanURL": {"value": "http://mapping.allerdale.gov.uk/myallerdale.aspx", "error": null, "row": 5}, "Hectares": {"value": "0.6", "error": null, "row": 5}, "OwnershipStatus": {"value": "Not owned by a public authority", "error": null, "row": 5}, "PlanningStatus": {"value": "Permissioned", "error": null, "row": 5}, "PermissionType": {"value": "Full Planning Permission", "error": null, "row": 5}, "PermissionDate": {"value": "12.11.2010", "error": {"message": "The date 12.11.2010 should be entered as 2010-12-11", "fix": "2010-12-11"}, "row": 5}, "PlanningHistory": {"value": "http://planning.allerdale.gov.uk/portal/servlets/ApplicationSearchServlet?PKID=77252", "error": null, "row": 5}, "Deliverable": {"value": "Yes", "error": null, "row": 5}, "NetDwellingsRangeFrom": {"value": "5", "error": null, "row": 5}, "NetDwellingsRangeTo": {"value": "19", "error": null, "row": 5}, "HazardousSubstances": {"value": "", "error": null, "row": 5}, "Notes": {"value": "19 dwellings", "error": null, "row": 5}, "FirstAddedDate": {"value": "2017-12-20", "error": null, "row": 5}, "LastUpdatedDate": {"value": "", "error": null, "row": 5}}, {"OrganisationURI": {"value": "http://opendatacommunities.org/id/district-council/allerdale", "error": null, "row": 6}, "SiteReference": {"value": "BR/MAR/01H", "error": null, "row": 6}, "SiteNameAddress": {"value": "Land at Ropery Street, Maryport", "error": null, "row": 6}, "GeoX": {"value": "303302", "error": {"message": "303302 isn't a longitude using the WGS84 or ETRS89 coordinate systems", "fix": null}, "row": 6}, "GeoY": {"value": "535961", "error": {"message": "535961 isn't a latitude using the WGS84 or ETRS89 coordinate systems", "fix": null}, "row": 6}, "SiteplanURL": {"value": "http://mapping.allerdale.gov.uk/myallerdale.aspx", "error": null, "row": 6}, "Hectares": {"value": "0.8", "error": null, "row": 6}, "OwnershipStatus": {"value": "Not owned by a public authority", "error": null, "row": 6}, "PlanningStatus": {"value": "Permissioned", "error": null, "row": 6}, "PermissionType": {"value": "Outline Planning Permission", "error": null, "row": 6}, "PermissionDate": {"value": "16.06.2014", "error": {"message": "The date 16.06.2014 should be entered as 2014-06-16", "fix": "2014-06-16"}, "row": 6}, "PlanningHistory": {"value": "http://planning.allerdale.gov.uk/portal/servlets/ApplicationSearchServlet?PKID=114404", "error": null, "row": 6}, "Deliverable": {"value": "Yes", "error": null, "row": 6}, "NetDwellingsRangeFrom": {"value": "12", "error": null, "row": 6}, "NetDwellingsRangeTo": {"value": "20", "error": null, "row": 6}, "HazardousSubstances": {"value": "", "error": null, "row": 6}, "Notes": {"value": "Use of land for residential development", "error": null, "row": 6}, "FirstAddedDate": {"value": "2017-12-20", "error": null, "row": 6}, "LastUpdatedDate": {"value": "", "error": null, "row": 6}}, {"OrganisationURI": {"value": "http://opendatacommunities.org/id/district-council/allerdale", "error": null, "row": 7}, "SiteReference": {"value": "BR/MAR/02H", "error": null, "row": 7}, "SiteNameAddress": {"value": "Land at The Netherdales, Ellenborough Road, Maryport", "error": null, "row": 7}, "GeoX": {"value": "304410", "error": {"message": "304410 isn't a longitude using the WGS84 or ETRS89 coordinate systems", "fix": null}, "row": 7}, "GeoY": {"value": "536130", "error": {"message": "536130 isn't a latitude using the WGS84 or ETRS89 coordinate systems", "fix": null}, "row": 7}, "SiteplanURL": {"value": "http://mapping.allerdale.gov.uk/myallerdale.aspx", "error": null, "row": 7}, "Hectares": {"value": "0.3", "error": null, "row": 7}, "OwnershipStatus": {"value": "Not owned by a public authority", "error": null, "row": 7}, "PlanningStatus": {"value": "Permissioned", "error": null, "row": 7}, "PermissionType": {"value": "Outline Planning Permission", "error": null, "row": 7}, "PermissionDate": {"value": "14.05.2015", "error": {"message": "The date 14.05.2015 should be entered as 2015-05-14", "fix": "2015-05-14"}, "row": 7}, "PlanningHistory": {"value": "http://planning.allerdale.gov.uk/portal/servlets/ApplicationSearchServlet?PKID=124486", "error": null, "row": 7}, "Deliverable": {"value": "Yes", "error": null, "row": 7}, "NetDwellingsRangeFrom": {"value": "5", "error": null, "row": 7}, "NetDwellingsRangeTo": {"value": "9", "error": null, "row": 7}, "HazardousSubstances": {"value": "", "error": null, "row": 7}, "Notes": {"value": "9 dwellings", "error": null, "row": 7}, "FirstAddedDate": {"value": "2017-12-20", "error": null, "row": 7}, "LastUpdatedDate": {"value": "", "error": null, "row": 7}}, {"OrganisationURI": {"value": "http://opendatacommunities.org/id/district-council/allerdale", "error": null, "row": 8}, "SiteReference": {"value": "BR/MAR/03H", "error": null, "row": 8}, "SiteNameAddress": {"value": "Land to the east of Marine Road, Maryport", "error": null, "row": 8}, "GeoX": {"value": "300309", "error": {"message": "300309 isn't a longitude using the WGS84 or ETRS89 coordinate systems", "fix": null}, "row": 8}, "GeoY": {"value": "303645", "error": {"message": "303645 isn't a latitude using the WGS84 or ETRS89 coordinate systems", "fix": null}, "row": 8}, "SiteplanURL": {"value": "http://mapping.allerdale.gov.uk/myallerdale.aspx", "error": null, "row": 8}, "Hectares": {"value": "1.53", "error": null, "row": 8}, "OwnershipStatus": {"value": "owned by a public authority", "error": null, "row": 8}, "PlanningStatus": {"value": "not permissioned", "error": null, "row": 8}, "PermissionType": {"value": "", "error": null, "row": 8}, "PermissionDate": {"value": "", "error": null, "row": 8}, "PlanningHistory": {"value": "", "error": null, "row": 8}, "Deliverable": {"value": "", "error": null, "row": 8}, "NetDwellingsRangeFrom": {"value": "30", "error": null, "row": 8}, "NetDwellingsRangeTo": {"value": "50", "error": null, "row": 8}, "HazardousSubstances": {"value": "", "error": null, "row": 8}, "Notes": {"value": "", "error": null, "row": 8}, "FirstAddedDate": {"value": "2017-12-20", "error": null, "row": 8}, "LastUpdatedDate": {"value": "", "error": null, "row": 8}}, {"OrganisationURI": {"value": "http://opendatacommunities.org/id/district-council/allerdale", "error": null, "row": 9}, "SiteReference": {"value": "BR/PRO/01H", "error": null, "row": 9}, "SiteNameAddress": {"value": "Prospect Garage, Main Road (A596), Prospect", "error": null, "row": 9}, "GeoX": {"value": "312057", "error": {"message": "312057 isn't a longitude using the WGS84 or ETRS89 coordinate systems", "fix": null}, "row": 9}, "GeoY": {"value": "541023", "error": {"message": "541023 isn't a latitude using the WGS84 or ETRS89 coordinate systems", "fix": null}, "row": 9}, "SiteplanURL": {"value": "http://mapping.allerdale.gov.uk/myallerdale.aspx", "error": null, "row": 9}, "Hectares": {"value": "0.6", "error": null, "row": 9}, "OwnershipStatus": {"value": "Not owned by a public authority", "error": null, "row": 9}, "PlanningStatus": {"value": "Not Permissioned", "error": null, "row": 9}, "PermissionType": {"value": "", "error": null, "row": 9}, "PermissionDate": {"value": "", "error": null, "row": 9}, "PlanningHistory": {"value": "http://planning.allerdale.gov.uk/portal/servlets/ApplicationSearchServlet?PKID=152298", "error": null, "row": 9}, "Deliverable": {"value": "", "error": null, "row": 9}, "NetDwellingsRangeFrom": {"value": "12", "error": null, "row": 9}, "NetDwellingsRangeTo": {"value": "20", "error": null, "row": 9}, "HazardousSubstances": {"value": "", "error": null, "row": 9}, "Notes": {"value": "", "error": null, "row": 9}, "FirstAddedDate": {"value": "2017-12-20", "error": null, "row": 9}, "LastUpdatedDate": {"value": "", "error": null, "row": 9}}, {"OrganisationURI": {"value": "http://opendatacommunities.org/id/district-council/allerdale", "error": null, "row": 10}, "SiteReference": {"value": "BR/SIL/01H", "error": null, "row": 10}, "SiteNameAddress": {"value": "Former Fisons Factory, Skiddaw Street, Silloth", "error": null, "row": 10}, "GeoX": {"value": "311145", "error": {"message": "311145 isn't a longitude using the WGS84 or ETRS89 coordinate systems", "fix": null}, "row": 10}, "GeoY": {"value": "553175", "error": {"message": "553175 isn't a latitude using the WGS84 or ETRS89 coordinate systems", "fix": null}, "row": 10}, "SiteplanURL": {"value": "http://mapping.allerdale.gov.uk/myallerdale.aspx", "error": null, "row": 10}, "Hectares": {"value": "8.7", "error": null, "row": 10}, "OwnershipStatus": {"value": "Not owned by a public authority", "error": null, "row": 10}, "PlanningStatus": {"value": "Permissioned", "error": null, "row": 10}, "PermissionType": {"value": "Outline Planning Permission", "error": null, "row": 10}, "PermissionDate": {"value": "23.05.2011", "error": {"message": "The date 23.05.2011 should be entered as 2011-05-23", "fix": "2011-05-23"}, "row": 10}, "PlanningHistory": {"value": "http://planning.allerdale.gov.uk/portal/servlets/ApplicationSearchServlet?PKID=74376", "error": null, "row": 10}, "Deliverable": {"value": "Yes", "error": null, "row": 10}, "NetDwellingsRangeFrom": {"value": "170", "error": null, "row": 10}, "NetDwellingsRangeTo": {"value": "254", "error": null, "row": 10}, "HazardousSubstances": {"value": "", "error": null, "row": 10}, "Notes": {"value": "Residential development (first phase - 22 dwellings)", "error": null, "row": 10}, "FirstAddedDate": {"value": "2017-12-20", "error": null, "row": 10}, "LastUpdatedDate": {"value": "", "error": null, "row": 10}}, {"OrganisationURI": {"value": "http://opendatacommunities.org/id/district-council/allerdale", "error": null, "row": 11}, "SiteReference": {"value": "BR/WIG/02H", "error": null, "row": 11}, "SiteNameAddress": {"value": "Former Brookside Works, Brookside, Wigton", "error": null, "row": 11}, "GeoX": {"value": "325675", "error": {"message": "325675 isn't a longitude using the WGS84 or ETRS89 coordinate systems", "fix": null}, "row": 11}, "GeoY": {"value": "548343", "error": {"message": "548343 isn't a latitude using the WGS84 or ETRS89 coordinate systems", "fix": null}, "row": 11}, "SiteplanURL": {"value": "http://mapping.allerdale.gov.uk/myallerdale.aspx", "error": null, "row": 11}, "Hectares": {"value": "0.1", "error": null, "row": 11}, "OwnershipStatus": {"value": "Not owned by a public authority", "error": null, "row": 11}, "PlanningStatus": {"value": "Permissioned", "error": null, "row": 11}, "PermissionType": {"value": "Full Planning Permission", "error": null, "row": 11}, "PermissionDate": {"value": "27.05.2015", "error": {"message": "The date 27.05.2015 should be entered as 2015-05-27", "fix": "2015-05-27"}, "row": 11}, "PlanningHistory": {"value": "http://planning.allerdale.gov.uk/portal/servlets/ApplicationSearchServlet?PKID=116991", "error": null, "row": 11}, "Deliverable": {"value": "Yes", "error": null, "row": 11}, "NetDwellingsRangeFrom": {"value": "5", "error": null, "row": 11}, "NetDwellingsRangeTo": {"value": "10", "error": null, "row": 11}, "HazardousSubstances": {"value": "", "error": null, "row": 11}, "Notes": {"value": "9 flats and 1 dwelling", "error": null, "row": 11}, "FirstAddedDate": {"value": "2017-12-20", "error": null, "row": 11}, "LastUpdatedDate": {"value": "", "error": null, "row": 11}}, {"OrganisationURI": {"value": "http://opendatacommunities.org/id/district-council/allerdale", "error": null, "row": 12}, "SiteReference": {"value": "BR/WOR/01H", "error": null, "row": 12}, "SiteNameAddress": {"value": "Former Workington Fire Station, Guard Street, Workington", "error": null, "row": 12}, "GeoX": {"value": "300672", "error": {"message": "300672 isn't a longitude using the WGS84 or ETRS89 coordinate systems", "fix": null}, "row": 12}, "GeoY": {"value": "528392", "error": {"message": "528392 isn't a latitude using the WGS84 or ETRS89 coordinate systems", "fix": null}, "row": 12}, "SiteplanURL": {"value": "http://mapping.allerdale.gov.uk/myallerdale.aspx", "error": null, "row": 12}, "Hectares": {"value": "0.5", "error": null, "row": 12}, "OwnershipStatus": {"value": "Owned by a public authority", "error": null, "row": 12}, "PlanningStatus": {"value": "Not Permissioned", "error": null, "row": 12}, "PermissionType": {"value": "", "error": null, "row": 12}, "PermissionDate": {"value": "", "error": null, "row": 12}, "PlanningHistory": {"value": "", "error": null, "row": 12}, "Deliverable": {"value": "", "error": null, "row": 12}, "NetDwellingsRangeFrom": {"value": "12", "error": null, "row": 12}, "NetDwellingsRangeTo": {"value": "50", "error": null, "row": 12}, "HazardousSubstances": {"value": "", "error": null, "row": 12}, "Notes": {"value": "", "error": null, "row": 12}, "FirstAddedDate": {"value": "2017-12-20", "error": null, "row": 12}, "LastUpdatedDate": {"value": "", "error": null, "row": 12}}, {"OrganisationURI": {"value": "http://opendatacommunities.org/id/district-council/allerdale", "error": null, "row": 13}, "SiteReference": {"value": "BR/WOR/02H", "error": null, "row": 13}, "SiteNameAddress": {"value": "Land off Curwen Road, Curwen Road, Workington", "error": null, "row": 13}, "GeoX": {"value": "299095", "error": {"message": "299095 isn't a longitude using the WGS84 or ETRS89 coordinate systems", "fix": null}, "row": 13}, "GeoY": {"value": "529007", "error": {"message": "529007 isn't a latitude using the WGS84 or ETRS89 coordinate systems", "fix": null}, "row": 13}, "SiteplanURL": {"value": "http://mapping.allerdale.gov.uk/myallerdale.aspx", "error": null, "row": 13}, "Hectares": {"value": "1.8", "error": null, "row": 13}, "OwnershipStatus": {"value": "Not owned by a public authority", "error": null, "row": 13}, "PlanningStatus": {"value": "Permissioned", "error": null, "row": 13}, "PermissionType": {"value": "Reserved Matters Approval", "error": null, "row": 13}, "PermissionDate": {"value": "13.04.2016", "error": {"message": "The date 13.04.2016 should be entered as 2016-04-13", "fix": "2016-04-13"}, "row": 13}, "PlanningHistory": {"value": "http://planning.allerdale.gov.uk/portal/servlets/ApplicationSearchServlet?PKID=134609", "error": null, "row": 13}, "Deliverable": {"value": "Yes", "error": null, "row": 13}, "NetDwellingsRangeFrom": {"value": "80", "error": null, "row": 13}, "NetDwellingsRangeTo": {"value": "120", "error": null, "row": 13}, "HazardousSubstances": {"value": "", "error": null, "row": 13}, "Notes": {"value": "94 residential units", "error": null, "row": 13}, "FirstAddedDate": {"value": "2017-12-20", "error": null, "row": 13}, "LastUpdatedDate": {"value": "", "error": null, "row": 13}}, {"OrganisationURI": {"value": "http://opendatacommunities.org/id/district-council/allerdale", "error": null, "row": 14}, "SiteReference": {"value": "BR/WOR/03H", "error": null, "row": 14}, "SiteNameAddress": {"value": "Land at Stanley Street, Workington", "error": null, "row": 14}, "GeoX": {"value": "299380", "error": {"message": "299380 isn't a longitude using the WGS84 or ETRS89 coordinate systems", "fix": null}, "row": 14}, "GeoY": {"value": "528881", "error": {"message": "528881 isn't a latitude using the WGS84 or ETRS89 coordinate systems", "fix": null}, "row": 14}, "SiteplanURL": {"value": "http://mapping.allerdale.gov.uk/myallerdale.aspx", "error": null, "row": 14}, "Hectares": {"value": "0.8", "error": null, "row": 14}, "OwnershipStatus": {"value": "Not owned by a public authority", "error": null, "row": 14}, "PlanningStatus": {"value": "Not Permissioned", "error": null, "row": 14}, "PermissionType": {"value": "", "error": null, "row": 14}, "PermissionDate": {"value": "", "error": null, "row": 14}, "PlanningHistory": {"value": "", "error": null, "row": 14}, "Deliverable": {"value": "", "error": null, "row": 14}, "NetDwellingsRangeFrom": {"value": "40", "error": null, "row": 14}, "NetDwellingsRangeTo": {"value": "90", "error": null, "row": 14}, "HazardousSubstances": {"value": "", "error": null, "row": 14}, "Notes": {"value": "", "error": null, "row": 14}, "FirstAddedDate": {"value": "2017-12-20", "error": null, "row": 14}, "LastUpdatedDate": {"value": "", "error": null, "row": 14}}, {"OrganisationURI": {"value": "http://opendatacommunities.org/id/district-council/allerdale", "error": null, "row": 15}, "SiteReference": {"value": "BR/WOR/04H", "error": null, "row": 15}, "SiteNameAddress": {"value": "Former Senhouse Terrace, Senhouse Street, Workington", "error": null, "row": 15}, "GeoX": {"value": "299786", "error": {"message": "299786 isn't a longitude using the WGS84 or ETRS89 coordinate systems", "fix": null}, "row": 15}, "GeoY": {"value": "528787", "error": {"message": "528787 isn't a latitude using the WGS84 or ETRS89 coordinate systems", "fix": null}, "row": 15}, "SiteplanURL": {"value": "http://mapping.allerdale.gov.uk/myallerdale.aspx", "error": null, "row": 15}, "Hectares": {"value": "0.1", "error": null, "row": 15}, "OwnershipStatus": {"value": "Not owned by a public authority", "error": null, "row": 15}, "PlanningStatus": {"value": "Permissioned", "error": null, "row": 15}, "PermissionType": {"value": "Full Planning Permission", "error": null, "row": 15}, "PermissionDate": {"value": "19.01.2016", "error": {"message": "The date 19.01.2016 should be entered as 2016-01-19", "fix": "2016-01-19"}, "row": 15}, "PlanningHistory": {"value": "http://planning.allerdale.gov.uk/portal/servlets/ApplicationSearchServlet?PKID=125499", "error": null, "row": 15}, "Deliverable": {"value": "Yes", "error": null, "row": 15}, "NetDwellingsRangeFrom": {"value": "5", "error": null, "row": 15}, "NetDwellingsRangeTo": {"value": "14", "error": null, "row": 15}, "HazardousSubstances": {"value": "", "error": null, "row": 15}, "Notes": {"value": "14 flats", "error": null, "row": 15}, "FirstAddedDate": {"value": "2017-12-20", "error": null, "row": 15}, "LastUpdatedDate": {"value": "", "error": null, "row": 15}}, {"OrganisationURI": {"value": "http://opendatacommunities.org/id/district-council/allerdale", "error": null, "row": 16}, "SiteReference": {"value": "BR/WOR/06H", "error": null, "row": 16}, "SiteNameAddress": {"value": "Land off Mossbay Road, Workington", "error": null, "row": 16}, "GeoX": {"value": "299216", "error": {"message": "299216 isn't a longitude using the WGS84 or ETRS89 coordinate systems", "fix": null}, "row": 16}, "GeoY": {"value": "527272", "error": {"message": "527272 isn't a latitude using the WGS84 or ETRS89 coordinate systems", "fix": null}, "row": 16}, "SiteplanURL": {"value": "http://mapping.allerdale.gov.uk/myallerdale.aspx", "error": null, "row": 16}, "Hectares": {"value": "0.32", "error": null, "row": 16}, "OwnershipStatus": {"value": "Owned by a public authority", "error": null, "row": 16}, "PlanningStatus": {"value": "Not Permissioned", "error": null, "row": 16}, "PermissionType": {"value": "", "error": null, "row": 16}, "PermissionDate": {"value": "", "error": null, "row": 16}, "PlanningHistory": {"value": "", "error": null, "row": 16}, "Deliverable": {"value": "", "error": null, "row": 16}, "NetDwellingsRangeFrom": {"value": "5", "error": null, "row": 16}, "NetDwellingsRangeTo": {"value": "10", "error": null, "row": 16}, "HazardousSubstances": {"value": "", "error": null, "row": 16}, "Notes": {"value": "", "error": null, "row": 16}, "FirstAddedDate": {"value": "2017-12-20", "error": null, "row": 16}, "LastUpdatedDate": {"value": "", "error": null, "row": 16}}, {"OrganisationURI": {"value": "http://opendatacommunities.org/id/district-council/allerdale", "error": null, "row": 17}, "SiteReference": {"value": "BR/WOR/07H", "error": null, "row": 17}, "SiteNameAddress": {"value": "Former Southfield School, Moorclose Road, Workington", "error": null, "row": 17}, "GeoX": {"value": "299676", "error": {"message": "299676 isn't a longitude using the WGS84 or ETRS89 coordinate systems", "fix": null}, "row": 17}, "GeoY": {"value": "526616", "error": {"message": "526616 isn't a latitude using the WGS84 or ETRS89 coordinate systems", "fix": null}, "row": 17}, "SiteplanURL": {"value": "http://mapping.allerdale.gov.uk/myallerdale.aspx", "error": null, "row": 17}, "Hectares": {"value": "2.7", "error": null, "row": 17}, "OwnershipStatus": {"value": "Owned by a public authority", "error": null, "row": 17}, "PlanningStatus": {"value": "Not Permissioned", "error": null, "row": 17}, "PermissionType": {"value": "", "error": null, "row": 17}, "PermissionDate": {"value": "", "error": null, "row": 17}, "PlanningHistory": {"value": "", "error": null, "row": 17}, "Deliverable": {"value": "", "error": null, "row": 17}, "NetDwellingsRangeFrom": {"value": "50", "error": null, "row": 17}, "NetDwellingsRangeTo": {"value": "70", "error": null, "row": 17}, "HazardousSubstances": {"value": "", "error": null, "row": 17}, "Notes": {"value": "", "error": null, "row": 17}, "FirstAddedDate": {"value": "2017-12-20", "error": null, "row": 17}, "LastUpdatedDate": {"value": "", "error": null, "row": 17}}, {"OrganisationURI": {"value": "http://opendatacommunities.org/id/district-council/allerdale", "error": null, "row": 18}, "SiteReference": {"value": "BR/WOR/08H", "error": null, "row": 18}, "SiteNameAddress": {"value": "Land at Duke Street, Workington", "error": null, "row": 18}, "GeoX": {"value": "299943", "error": {"message": "299943 isn't a longitude using the WGS84 or ETRS89 coordinate systems", "fix": null}, "row": 18}, "GeoY": {"value": "528960", "error": {"message": "528960 isn't a latitude using the WGS84 or ETRS89 coordinate systems", "fix": null}, "row": 18}, "SiteplanURL": {"value": "http://mapping.allerdale.gov.uk/myallerdale.aspx", "error": null, "row": 18}, "Hectares": {"value": "0.1", "error": null, "row": 18}, "OwnershipStatus": {"value": "Not owned by a public authority", "error": null, "row": 18}, "PlanningStatus": {"value": "Permissioned", "error": null, "row": 18}, "PermissionType": {"value": "Full Planning Permission", "error": null, "row": 18}, "PermissionDate": {"value": "03.12.2013", "error": {"message": "The date 03.12.2013 should be entered as 2013-03-12", "fix": "2013-03-12"}, "row": 18}, "PlanningHistory": {"value": "http://planning.allerdale.gov.uk/portal/servlets/ApplicationSearchServlet?PKID=106364", "error": null, "row": 18}, "Deliverable": {"value": "Yes", "error": null, "row": 18}, "NetDwellingsRangeFrom": {"value": "12", "error": null, "row": 18}, "NetDwellingsRangeTo": {"value": "15", "error": null, "row": 18}, "HazardousSubstances": {"value": "", "error": null, "row": 18}, "Notes": {"value": "Demolition of former hall and erection of 14 flats", "error": null, "row": 18}, "FirstAddedDate": {"value": "2017-12-20", "error": null, "row": 18}, "LastUpdatedDate": {"value": "", "error": null, "row": 18}}, {"OrganisationURI": {"value": "http://opendatacommunities.org/id/district-council/allerdale", "error": null, "row": 19}, "SiteReference": {"value": "BR/WOR/09H", "error": null, "row": 19}, "SiteNameAddress": {"value": "Mermaid Tavern, Derwent Street, Workington", "error": null, "row": 19}, "GeoX": {"value": "299997", "error": {"message": "299997 isn't a longitude using the WGS84 or ETRS89 coordinate systems", "fix": null}, "row": 19}, "GeoY": {"value": "529010", "error": {"message": "529010 isn't a latitude using the WGS84 or ETRS89 coordinate systems", "fix": null}, "row": 19}, "SiteplanURL": {"value": "http://mapping.allerdale.gov.uk/myallerdale.aspx", "error": null, "row": 19}, "Hectares": {"value": "0.06", "error": null, "row": 19}, "OwnershipStatus": {"value": "Not owned by a public authority", "error": null, "row": 19}, "PlanningStatus": {"value": "Permissioned", "error": null, "row": 19}, "PermissionType": {"value": "Full Planning Permission", "error": null, "row": 19}, "PermissionDate": {"value": "13.04.2010", "error": {"message": "The date 13.04.2010 should be entered as 2010-04-13", "fix": "2010-04-13"}, "row": 19}, "PlanningHistory": {"value": "http://planning.allerdale.gov.uk/portal/servlets/ApplicationSearchServlet?PKID=74263", "error": null, "row": 19}, "Deliverable": {"value": "", "error": null, "row": 19}, "NetDwellingsRangeFrom": {"value": "5", "error": null, "row": 19}, "NetDwellingsRangeTo": {"value": "5", "error": null, "row": 19}, "HazardousSubstances": {"value": "", "error": null, "row": 19}, "Notes": {"value": "5 bedsits", "error": null, "row": 19}, "FirstAddedDate": {"value": "2017-12-20", "error": null, "row": 19}, "LastUpdatedDate": {"value": "", "error": null, "row": 19}}, {"OrganisationURI": {"value": "http://opendatacommunities.org/id/district-council/allerdale", "error": null, "row": 20}, "SiteReference": {"value": "BR/WOR/010H", "error": null, "row": 20}, "SiteNameAddress": {"value": "Land south of Isabella Road, Workington", "error": null, "row": 20}, "GeoX": {"value": "298714", "error": {"message": "298714 isn't a longitude using the WGS84 or ETRS89 coordinate systems", "fix": null}, "row": 20}, "GeoY": {"value": "529086", "error": {"message": "529086 isn't a latitude using the WGS84 or ETRS89 coordinate systems", "fix": null}, "row": 20}, "SiteplanURL": {"value": "http://mapping.allerdale.gov.uk/myallerdale.aspx", "error": null, "row": 20}, "Hectares": {"value": "3", "error": null, "row": 20}, "OwnershipStatus": {"value": "Not owned by a public authority", "error": null, "row": 20}, "PlanningStatus": {"value": "Not Permissioned", "error": null, "row": 20}, "PermissionType": {"value": "", "error": null, "row": 20}, "PermissionDate": {"value": "", "error": null, "row": 20}, "PlanningHistory": {"value": "", "error": null, "row": 20}, "Deliverable": {"value": "", "error": null, "row": 20}, "NetDwellingsRangeFrom": {"value": "80", "error": null, "row": 20}, "NetDwellingsRangeTo": {"value": "120", "error": null, "row": 20}, "HazardousSubstances": {"value": "", "error": null, "row": 20}, "Notes": {"value": "", "error": null, "row": 20}, "FirstAddedDate": {"value": "2017-12-20", "error": null, "row": 20}, "LastUpdatedDate": {"value": "", "error": null, "row": 20}}], "errors_by_column": {"GeoX": {"rows": [1, 2, 3, 4, 5, 6, 7, 8, 9, 10, 11, 12, 13, 14, 15, 16, 17, 18, 19, 20], "errors": [{"message": "317284 isn't a longitude using the WGS84 or ETRS89 coordinate systems", "row": 1, "fix": null, "value": "317284"}, {"message": "306461 isn't a longitude using the WGS84 or ETRS89 coordinate systems", "row": 2, "fix": null, "value": "306461"}, {"message": "302381 isn't a longitude using the WGS84 or ETRS89 coordinate systems", "row": 3, "fix": null, "value": "302381"}, {"message": "303964 isn't a longitude using the WGS84 or ETRS89 coordinate systems", "row": 4, "fix": null, "value": "303964"}, {"message": "322802 isn't a longitude using the WGS84 or ETRS89 coordinate systems", "row": 5, "fix": null, "value": "322802"}, {"message": "303302 isn't a longitude using the WGS84 or ETRS89 coordinate systems", "row": 6, "fix": null, "value": "303302"}, {"message": "304410 isn't a longitude using the WGS84 or ETRS89 coordinate systems", "row": 7, "fix": null, "value": "304410"}, {"message": "300309 isn't a longitude using the WGS84 or ETRS89 coordinate systems", "row": 8, "fix": null, "value": "300309"}, {"message": "312057 isn't a longitude using the WGS84 or ETRS89 coordinate systems", "row": 9, "fix": null, "value": "312057"}, {"message": "311145 isn't a longitude using the WGS84 or ETRS89 coordinate systems", "row": 10, "fix": null, "value": "311145"}, {"message": "325675 isn't a longitude using the WGS84 or ETRS89 coordinate systems", "row": 11, "fix": null, "value": "325675"}, {"message": "300672 isn't a longitude using the WGS84 or ETRS89 coordinate systems", "row": 12, "fix": null, "value": "300672"}, {"message": "299095 isn't a longitude using the WGS84 or ETRS89 coordinate systems", "row": 13, "fix": null, "value": "299095"}, {"message": "299380 isn't a longitude using the WGS84 or ETRS89 coordinate systems", "row": 14, "fix": null, "value": "299380"}, {"message": "299786 isn't a longitude using the WGS84 or ETRS89 coordinate systems", "row": 15, "fix": null, "value": "299786"}, {"message": "299216 isn't a longitude using the WGS84 or ETRS89 coordinate systems", "row": 16, "fix": null, "value": "299216"}, {"message": "299676 isn't a longitude using the WGS84 or ETRS89 coordinate systems", "row": 17, "fix": null, "value": "299676"}, {"message": "299943 isn't a longitude using the WGS84 or ETRS89 coordinate systems", "row": 18, "fix": null, "value": "299943"}, {"message": "299997 isn't a longitude using the WGS84 or ETRS89 coordinate systems", "row": 19, "fix": null, "value": "299997"}, {"message": "298714 isn't a longitude using the WGS84 or ETRS89 coordinate systems", "row": 20, "fix": null, "value": "298714"}], "messages": ["GeoX or GeoY should represent a point in UK using the WGS84 or ETRS89 coordinate systems."]}, "GeoY": {"rows": [1, 2, 3, 4, 5, 6, 7, 8, 9, 10, 11, 12, 13, 14, 15, 16, 17, 18, 19, 20], "errors": [{"message": "550804 isn't a latitude using the WGS84 or ETRS89 coordinate systems", "row": 1, "fix": null, "value": "550804"}, {"message": "532113 isn't a latitude using the WGS84 or ETRS89 coordinate systems", "row": 2, "fix": null, "value": "532113"}, {"message": "533419 isn't a latitude using the WGS84 or ETRS89 coordinate systems", "row": 3, "fix": null, "value": "533419"}, {"message": "529858 isn't a latitude using the WGS84 or ETRS89 coordinate systems", "row": 4, "fix": null, "value": "529858"}, {"message": "556235 isn't a latitude using the WGS84 or ETRS89 coordinate systems", "row": 5, "fix": null, "value": "556235"}, {"message": "535961 isn't a latitude using the WGS84 or ETRS89 coordinate systems", "row": 6, "fix": null, "value": "535961"}, {"message": "536130 isn't a latitude using the WGS84 or ETRS89 coordinate systems", "row": 7, "fix": null, "value": "536130"}, {"message": "303645 isn't a latitude using the WGS84 or ETRS89 coordinate systems", "row": 8, "fix": null, "value": "303645"}, {"message": "541023 isn't a latitude using the WGS84 or ETRS89 coordinate systems", "row": 9, "fix": null, "value": "541023"}, {"message": "553175 isn't a latitude using the WGS84 or ETRS89 coordinate systems", "row": 10, "fix": null, "value": "553175"}, {"message": "548343 isn't a latitude using the WGS84 or ETRS89 coordinate systems", "row": 11, "fix": null, "value": "548343"}, {"message": "528392 isn't a latitude using the WGS84 or ETRS89 coordinate systems", "row": 12, "fix": null, "value": "528392"}, {"message": "529007 isn't a latitude using the WGS84 or ETRS89 coordinate systems", "row": 13, "fix": null, "value": "529007"}, {"message": "528881 isn't a latitude using the WGS84 or ETRS89 coordinate systems", "row": 14, "fix": null, "value": "528881"}, {"message": "528787 isn't a latitude using the WGS84 or ETRS89 coordinate systems", "row": 15, "fix": null, "value": "528787"}, {"message": "527272 isn't a latitude using the WGS84 or ETRS89 coordinate systems", "row": 16, "fix": null, "value": "527272"}, {"message": "526616 isn't a latitude using the WGS84 or ETRS89 coordinate systems", "row": 17, "fix": null, "value": "526616"}, {"message": "528960 isn't a latitude using the WGS84 or ETRS89 coordinate systems", "row": 18, "fix": null, "value": "528960"}, {"message": "529010 isn't a latitude using the WGS84 or ETRS89 coordinate systems", "row": 19, "fix": null, "value": "529010"}, {"message": "529086 isn't a latitude using the WGS84 or ETRS89 coordinate systems", "row": 20, "fix": null, "value": "529086"}], "messages": ["GeoX or GeoY should represent a point in UK using the WGS84 or ETRS89 coordinate systems."]}, "PermissionDate": {"rows": [2, 4, 5, 6, 7, 10, 11, 13, 15, 18, 19], "errors": [{"message": "The date 06.05.2015 should be entered as 2015-06-05", "row": 2, "fix": "2015-06-05", "value": "06.05.2015"}, {"message": "The date 19.09.2012 should be entered as 2012-09-19", "row": 4, "fix": "2012-09-19", "value": "19.09.2012"}, {"message": "The date 12.11.2010 should be entered as 2010-12-11", "row": 5, "fix": "2010-12-11", "value": "12.11.2010"}, {"message": "The date 16.06.2014 should be entered as 2014-06-16", "row": 6, "fix": "2014-06-16", "value": "16.06.2014"}, {"message": "The date 14.05.2015 should be entered as 2015-05-14", "row": 7, "fix": "2015-05-14", "value": "14.05.2015"}, {"message": "The date 23.05.2011 should be entered as 2011-05-23", "row": 10, "fix": "2011-05-23", "value": "23.05.2011"}, {"message": "The date 27.05.2015 should be entered as 2015-05-27", "row": 11, "fix": "2015-05-27", "value": "27.05.2015"}, {"message": "The date 13.04.2016 should be entered as 2016-04-13", "row": 13, "fix": "2016-04-13", "value": "13.04.2016"}, {"message": "The date 19.01.2016 should be entered as 2016-01-19", "row": 15, "fix": "2016-01-19", "value": "19.01.2016"}, {"message": "The date 03.12.2013 should be entered as 2013-03-12", "row": 18, "fix": "2013-03-12", "value": "03.12.2013"}, {"message": "The date 13.04.2010 should be entered as 2010-04-13", "row": 19, "fix": "2010-04-13", "value": "13.04.2010"}], "messages": ["Some dates in the file are not in the format YYYY-MM-DD. For example 13/12/2019 should be 2019-12-13"]}}, "result": {"time": 0.105, "valid": false, "error-count": 53, "table-count": 1, "tables": [{"time": 0.017, "valid": false, "error-count": 53, "row-count": 20, "source": "inline", "headers": ["Deliverable", "FirstAddedDate", "GeoX", "GeoY", "HazardousSubstances", "Hectares", "LastUpdatedDate", "NetDwellingsRangeFrom", "NetDwellingsRangeTo", "Notes", "OrganisationURI", "OwnershipStatus", "PermissionDate", "PermissionType", "PlanningHistory", "PlanningStatus", "SiteNameAddress", "SiteReference", "SiteplanURL"], "format": "inline", "schema": "table-schema", "errors": [{"code": "blank-header", "column-number": 20, "message": "Header in column 20 is blank", "message-data": {}}, {"code": "missing-header", "column-number": 20, "message": "There is a missing header in column 20", "message-data": {"field_name": "EndDate"}}, {"code": "geo-error", "row-number": 1, "column-number": 3, "message": "317284 isn't a longitude using the WGS84 or ETRS89 coordinate systems", "message-data": {"value": "317284"}}, {"code": "geo-error", "row-number": 1, "column-number": 4, "message": "550804 isn't a latitude using the WGS84 or ETRS89 coordinate systems", "message-data": {"value": "550804"}}, {"code": "geo-error", "row-number": 2, "column-number": 3, "message": "306461 isn't a longitude using the WGS84 or ETRS89 coordinate systems", "message-data": {"value": "306461"}}, {"code": "geo-error", "row-number": 2, "column-number": 4, "message": "532113 isn't a latitude using the WGS84 or ETRS89 coordinate systems", "message-data": {"value": "532113"}}, {"code": "type-or-format-error", "row-number": 2, "column-number": 13, "message": "The value \"06.05.2015\" in row 2 and column 13 is not type \"date\" and format \"default\"", "message-data": {"value": "06.05.2015", "field_type": "date", "field_format": "default"}}, {"code": "geo-error", "row-number": 3, "column-number": 3, "message": "302381 isn't a longitude using the WGS84 or ETRS89 coordinate systems", "message-data": {"value": "302381"}}, {"code": "geo-error", "row-number": 3, "column-number": 4, "message": "533419 isn't a latitude using the WGS84 or ETRS89 coordinate systems", "message-data": {"value": "533419"}}, {"code": "geo-error", "row-number": 4, "column-number": 3, "message": "303964 isn't a longitude using the WGS84 or ETRS89 coordinate systems", "message-data": {"value": "303964"}}, {"code": "geo-error", "row-number": 4, "column-number": 4, "message": "529858 isn't a latitude using the WGS84 or ETRS89 coordinate systems", "message-data": {"value": "529858"}}, {"code": "type-or-format-error", "row-number": 4, "column-number": 13, "message": "The value \"19.09.2012\" in row 4 and column 13 is not type \"date\" and format \"default\"", "message-data": {"value": "19.09.2012", "field_type": "date", "field_format": "default"}}, {"code": "geo-error", "row-number": 5, "column-number": 3, "message": "322802 isn't a longitude using the WGS84 or ETRS89 coordinate systems", "message-data": {"value": "322802"}}, {"code": "geo-error", "row-number": 5, "column-number": 4, "message": "556235 isn't a latitude using the WGS84 or ETRS89 coordinate systems", "message-data": {"value": "556235"}}, {"code": "type-or-format-error", "row-number": 5, "column-number": 13, "message": "The value \"12.11.2010\" in row 5 and column 13 is not type \"date\" and format \"default\"", "message-data": {"value": "12.11.2010", "field_type": "date", "field_format": "default"}}, {"code": "geo-error", "row-number": 6, "column-number": 3, "message": "303302 isn't a longitude using the WGS84 or ETRS89 coordinate systems", "message-data": {"value": "303302"}}, {"code": "geo-error", "row-number": 6, "column-number": 4, "message": "535961 isn't a latitude using the WGS84 or ETRS89 coordinate systems", "message-data": {"value": "535961"}}, {"code": "type-or-format-error", "row-number": 6, "column-number": 13, "message": "The value \"16.06.2014\" in row 6 and column 13 is not type \"date\" and format \"default\"", "message-data": {"value": "16.06.2014", "field_type": "date", "field_format": "default"}}, {"code": "geo-error", "row-number": 7, "column-number": 3, "message": "304410 isn't a longitude using the WGS84 or ETRS89 coordinate systems", "message-data": {"value": "304410"}}, {"code": "geo-error", "row-number": 7, "column-number": 4, "message": "536130 isn't a latitude using the WGS84 or ETRS89 coordinate systems", "message-data": {"value": "536130"}}, {"code": "type-or-format-error", "row-number": 7, "column-number": 13, "message": "The value \"14.05.2015\" in row 7 and column 13 is not type \"date\" and format \"default\"", "message-data": {"value": "14.05.2015", "field_type": "date", "field_format": "default"}}, {"code": "geo-error", "row-number": 8, "column-number": 3, "message": "300309 isn't a longitude using the WGS84 or ETRS89 coordinate systems", "message-data": {"value": "300309"}}, {"code": "geo-error", "row-number": 8, "column-number": 4, "message": "303645 isn't a latitude using the WGS84 or ETRS89 coordinate systems", "message-data": {"value": "303645"}}, {"code": "geo-error", "row-number": 9, "column-number": 3, "message": "312057 isn't a longitude using the WGS84 or ETRS89 coordinate systems", "message-data": {"value": "312057"}}, {"code": "geo-error", "row-number": 9, "column-number": 4, "message": "541023 isn't a latitude using the WGS84 or ETRS89 coordinate systems", "message-data": {"value": "541023"}}, {"code": "geo-error", "row-number": 10, "column-number": 3, "message": "311145 isn't a longitude using the WGS84 or ETRS89 coordinate systems", "message-data": {"value": "311145"}}, {"code": "geo-error", "row-number": 10, "column-number": 4, "message": "553175 isn't a latitude using the WGS84 or ETRS89 coordinate systems", "message-data": {"value": "553175"}}, {"code": "type-or-format-error", "row-number": 10, "column-number": 13, "message": "The value \"23.05.2011\" in row 10 and column 13 is not type \"date\" and format \"default\"", "message-data": {"value": "23.05.2011", "field_type": "date", "field_format": "default"}}, {"code": "geo-error", "row-number": 11, "column-number": 3, "message": "325675 isn't a longitude using the WGS84 or ETRS89 coordinate systems", "message-data": {"value": "325675"}}, {"code": "geo-error", "row-number": 11, "column-number": 4, "message": "548343 isn't a latitude using the WGS84 or ETRS89 coordinate systems", "message-data": {"value": "548343"}}, {"code": "type-or-format-error", "row-number": 11, "column-number": 13, "message": "The value \"27.05.2015\" in row 11 and column 13 is not type \"date\" and format \"default\"", "message-data": {"value": "27.05.2015", "field_type": "date", "field_format": "default"}}, {"code": "geo-error", "row-number": 12, "column-number": 3, "message": "300672 isn't a longitude using the WGS84 or ETRS89 coordinate systems", "message-data": {"value": "300672"}}, {"code": "geo-error", "row-number": 12, "column-number": 4, "message": "528392 isn't a latitude using the WGS84 or ETRS89 coordinate systems", "message-data": {"value": "528392"}}, {"code": "geo-error", "row-number": 13, "column-number": 3, "message": "299095 isn't a longitude using the WGS84 or ETRS89 coordinate systems", "message-data": {"value": "299095"}}, {"code": "geo-error", "row-number": 13, "column-number": 4, "message": "529007 isn't a latitude using the WGS84 or ETRS89 coordinate systems", "message-data": {"value": "529007"}}, {"code": "type-or-format-error", "row-number": 13, "column-number": 13, "message": "The value \"13.04.2016\" in row 13 and column 13 is not type \"date\" and format \"default\"", "message-data": {"value": "13.04.2016", "field_type": "date", "field_format": "default"}}, {"code": "geo-error", "row-number": 14, "column-number": 3, "message": "299380 isn't a longitude using the WGS84 or ETRS89 coordinate systems", "message-data": {"value": "299380"}}, {"code": "geo-error", "row-number": 14, "column-number": 4, "message": "528881 isn't a latitude using the WGS84 or ETRS89 coordinate systems", "message-data": {"value": "528881"}}, {"code": "geo-error", "row-number": 15, "column-number": 3, "message": "299786 isn't a longitude using the WGS84 or ETRS89 coordinate systems", "message-data": {"value": "299786"}}, {"code": "geo-error", "row-number": 15, "column-number": 4, "message": "528787 isn't a latitude using the WGS84 or ETRS89 coordinate systems", "message-data": {"value": "528787"}}, {"code": "type-or-format-error", "row-number": 15, "column-number": 13, "message": "The value \"19.01.2016\" in row 15 and column 13 is not type \"date\" and format \"default\"", "message-data": {"value": "19.01.2016", "field_type": "date", "field_format": "default"}}, {"code": "geo-error", "row-number": 16, "column-number": 3, "message": "299216 isn't a longitude using the WGS84 or ETRS89 coordinate systems", "message-data": {"value": "299216"}}, {"code": "geo-error", "row-number": 16, "column-number": 4, "message": "527272 isn't a latitude using the WGS84 or ETRS89 coordinate systems", "message-data": {"value": "527272"}}, {"code": "geo-error", "row-number": 17, "column-number": 3, "message": "299676 isn't a longitude using the WGS84 or ETRS89 coordinate systems", "message-data": {"value": "299676"}}, {"code": "geo-error", "row-number": 17, "column-number": 4, "message": "526616 isn't a latitude using the WGS84 or ETRS89 coordinate systems", "message-data": {"value": "526616"}}, {"code": "geo-error", "row-number": 18, "column-number": 3, "message": "299943 isn't a longitude using the WGS84 or ETRS89 coordinate systems", "message-data": {"value": "299943"}}, {"code": "geo-error", "row-number": 18, "column-number": 4, "message": "528960 isn't a latitude using the WGS84 or ETRS89 coordinate systems", "message-data": {"value": "528960"}}, {"code": "type-or-format-error", "row-number": 18, "column-number": 13, "message": "The value \"03.12.2013\" in row 18 and column 13 is not type \"date\" and format \"default\"", "message-data": {"value": "03.12.2013", "field_type": "date", "field_format": "default"}}, {"code": "geo-error", "row-number": 19, "column-number": 3, "message": "299997 isn't a longitude using the WGS84 or ETRS89 coordinate systems", "message-data": {"value": "299997"}}, {"code": "geo-error", "row-number": 19, "column-number": 4, "message": "529010 isn't a latitude using the WGS84 or ETRS89 coordinate systems", "message-data": {"value": "529010"}}, {"code": "type-or-format-error", "row-number": 19, "column-number": 13, "message": "The value \"13.04.2010\" in row 19 and column 13 is not type \"date\" and format \"default\"", "message-data": {"value": "13.04.2010", "field_type": "date", "field_format": "default"}}, {"code": "geo-error", "row-number": 20, "column-number": 3, "message": "298714 isn't a longitude using the WGS84 or ETRS89 coordinate systems", "message-data": {"value": "298714"}}, {"code": "geo-error", "row-number": 20, "column-number": 4, "message": "529086 isn't a latitude using the WGS84 or ETRS89 coordinate systems", "message-data": {"value": "529086"}}]}], "warnings": [], "preset": "table"}}
