OrganisationURI,OrganisationLabel,SiteReference,SiteNameAddress,GeoX,GeoY,SiteplanURL,Hectares,OwnershipStatus,PlanningStatus,PermissionType,PermissionDate,PlanningHistory,Deliverable,NetDwellingsRangeFrom,NetDwellingsRangeTo,HazardousSubstances,Notes,FirstAddedDate,LastUpdatedDate,EndDate
http://opendatacommunities.org/id/metropolitan-district-council/doncaster,Doncaster MBC,111,"Land at Stevens Road, Balby",-1.150374,53.512336,http://dmbc.maps.arcgis.com/apps/webappviewer/index.html?id=2ac0d9b40cc34eb2b05e80a122b7a6e2,2.47,not owned by a public authority,pending decision,,,http://www.doncaster.gov.uk/services/planning/planning-applications-online-public-access,yes,,,,"11/00246/EXTM - Erection of 112 houses and 84 apartments (being extension of time on planning application 06/00014/FULM, granted on 09/04/2008). Application approved by Planning Committee subject to S106",2017-12-31,2018-12-31,
http://opendatacommunities.org/id/metropolitan-district-council/doncaster,Doncaster MBC,253,"Former Bloodstock Sales Site, Carr House Road",-1.111185,53.517875,http://dmbc.maps.arcgis.com/apps/webappviewer/index.html?id=2ac0d9b40cc34eb2b05e80a122b7a6e2,1.74,owned by a public authority,pending decision,,,http://www.doncaster.gov.uk/services/planning/planning-applications-online-public-access,yes,46,58,,18/02614/4FULM - pending,2017-12-31,2018-12-31,
http://opendatacommunities.org/id/metropolitan-district-council/doncaster,Doncaster MBC,261,"Plot 5A, off Carolina Way / Lakeside Boulevard",-1.103768,53.504858,http://dmbc.maps.arcgis.com/apps/webappviewer/index.html?id=2ac0d9b40cc34eb2b05e80a122b7a6e2,2,owned by a public authority,not permissioned,,,http://www.doncaster.gov.uk/services/planning/planning-applications-online-public-access,yes,53,66,,,2017-12-31,2018-12-31,
http://opendatacommunities.org/id/metropolitan-district-council/doncaster,Doncaster MBC,262,"Plot 6, Lakeside Boulevard",-1.10271,53.508572,http://dmbc.maps.arcgis.com/apps/webappviewer/index.html?id=2ac0d9b40cc34eb2b05e80a122b7a6e2,3.11,owned by a public authority,not permissioned,,,http://www.doncaster.gov.uk/services/planning/planning-applications-online-public-access,yes,87,109,,"Has previously been granted planning permission (Ref:06/02537/FULA)  for the erection of 308 apartments in 4 complexes, each varying in height between 2 and 4 storeys with limited 5 storey elements, with associated public open space, landscaped areas and car parking, together with a building for Class A3 use",2017-12-31,2018-12-31,
http://opendatacommunities.org/id/metropolitan-district-council/doncaster,Doncaster MBC,375,"Barnburgh House, Edlington Lane, New Edlington",-1.186665,53.486656,http://dmbc.maps.arcgis.com/apps/webappviewer/index.html?id=2ac0d9b40cc34eb2b05e80a122b7a6e2,0.24,owned by a public authority,not permissioned,,,http://www.doncaster.gov.uk/services/planning/planning-applications-online-public-access,yes,7,9,,,2017-12-31,2018-12-31,
http://opendatacommunities.org/id/metropolitan-district-council/doncaster,Doncaster MBC,379,"Garden Street, Mexborough",-1.292033,53.494328,http://dmbc.maps.arcgis.com/apps/webappviewer/index.html?id=2ac0d9b40cc34eb2b05e80a122b7a6e2,0.51,owned by a public authority,not permissioned,,,http://www.doncaster.gov.uk/services/planning/planning-applications-online-public-access,,15,19,,,2017-12-31,2018-12-31,
http://opendatacommunities.org/id/metropolitan-district-council/doncaster,Doncaster MBC,414,"Windhill, Whinhill Avenue, Mexborough",-1.271756,53.497991,http://dmbc.maps.arcgis.com/apps/webappviewer/index.html?id=2ac0d9b40cc34eb2b05e80a122b7a6e2,3.33,owned by a public authority,not permissioned,,,http://www.doncaster.gov.uk/services/planning/planning-applications-online-public-access,,112,140,,Former housing area that has been cleared of existing housing stock under housing renewal programme.  Permission 17/02056/FULM,2017-12-31,2018-12-31,
http://opendatacommunities.org/id/metropolitan-district-council/doncaster,Doncaster MBC,415,"Woodland View, Edwin Road, Woodlands",-1.196765,53.563109,http://dmbc.maps.arcgis.com/apps/webappviewer/index.html?id=2ac0d9b40cc34eb2b05e80a122b7a6e2,0.61,owned by a public authority,permissioned,full planning permission,2017-11-01,http://www.doncaster.gov.uk/services/planning/planning-applications-online-public-access,,,,,17/02056/FULM,2017-12-31,2018-12-31,
http://opendatacommunities.org/id/metropolitan-district-council/doncaster,Doncaster MBC,440,"Civic And Cultural Quarter, Waterdale",-1.130694,53.519709,http://dmbc.maps.arcgis.com/apps/webappviewer/index.html?id=2ac0d9b40cc34eb2b05e80a122b7a6e2,11.26,owned by a public authority,permissioned,outline planning permission,2010-03-30,http://www.doncaster.gov.uk/services/planning/planning-applications-online-public-access,yes,,,,"""08/02535/OUTA - This is a large mixed use Outline permission, a significant proportion has now come forward with Reserved Matters and indeed built. There is a 1ha site (Scarborough House) identified for residential uses that has not yet had Reserved Matters.  Although this site has been temporary greened over, it previosuly contained Council Offices and car parking so is considered to be Brownfield. The capacity in this register reflects this part of the scheme only. Other residential elements are under construction (see 12/02500/REMM) and the original capacity of 450 units is no longer expected to materialise with a revised total of 130 units now expected""",2017-12-31,2018-12-31,
http://opendatacommunities.org/id/metropolitan-district-council/doncaster,Doncaster MBC,569,"Askern Saw Mills, High Street, Askern",-1.1507,53.611356,http://dmbc.maps.arcgis.com/apps/webappviewer/index.html?id=2ac0d9b40cc34eb2b05e80a122b7a6e2,15.08,not owned by a public authority,permissioned,outline planning permission,2013-07-11,http://www.doncaster.gov.uk/services/planning/planning-applications-online-public-access,yes,,,,08/01077/OUTA - Reserved Matters now submitted (16/01651/REMM) but not yet determined.,2017-12-31,2018-12-31,
http://opendatacommunities.org/id/metropolitan-district-council/doncaster,Doncaster MBC,602,"28 Cow House Lane, Armthorpe",-1.0458,53.535556,http://dmbc.maps.arcgis.com/apps/webappviewer/index.html?id=2ac0d9b40cc34eb2b05e80a122b7a6e2,0.26,not owned by a public authority,permissioned,full planning permission,2015-09-01,http://www.doncaster.gov.uk/services/planning/planning-applications-online-public-access,yes,,,,15/00828/FUL,2017-12-31,2018-12-31,
http://opendatacommunities.org/id/metropolitan-district-council/doncaster,Doncaster MBC,629,"Land off Bankwood Lane, Rossington",-1.084883,53.480742,http://dmbc.maps.arcgis.com/apps/webappviewer/index.html?id=2ac0d9b40cc34eb2b05e80a122b7a6e2,0.53,not owned by a public authority,not permissioned,,,http://www.doncaster.gov.uk/services/planning/planning-applications-online-public-access,,43,54,,Previous planning permission (Ref: 11/01655/EXTM) but now lapsed. Subsequent temporary change of use from former factory and factory outlet to HGV parking for a period of 18 months (Retrospective - 16/02386/COUM) pending decision.,2017-12-31,2018-12-31,
http://opendatacommunities.org/id/metropolitan-district-council/doncaster,Doncaster MBC,633,"Land At 41 Sandford Road, Balby",-1.14785,53.505828,http://dmbc.maps.arcgis.com/apps/webappviewer/index.html?id=2ac0d9b40cc34eb2b05e80a122b7a6e2,1.11,not owned by a public authority,not permissioned,,,http://www.doncaster.gov.uk/services/planning/planning-applications-online-public-access,,36,45,,Previous planning permission (Ref: 11/02159/EXTM) but now lapsed. This was for a high density 3 x blocks apartment scheme totalling 125 units.,2017-12-31,2018-12-31,
http://opendatacommunities.org/id/metropolitan-district-council/doncaster,Doncaster MBC,646,"Site At Former Yorkshire Main Colliery , Broomhouse Lane, Balby",-1.173685,53.489164,http://dmbc.maps.arcgis.com/apps/webappviewer/index.html?id=2ac0d9b40cc34eb2b05e80a122b7a6e2,17.6,not owned by a public authority,pending decision,,,http://www.doncaster.gov.uk/services/planning/planning-applications-online-public-access,yes,,,,18/02100/OUTM,2017-12-31,2018-12-31,
http://opendatacommunities.org/id/metropolitan-district-council/doncaster,Doncaster MBC,654,"163 Balby Road, Balby",-1.147747,53.507939,http://dmbc.maps.arcgis.com/apps/webappviewer/index.html?id=2ac0d9b40cc34eb2b05e80a122b7a6e2,0.16,not owned by a public authority,permissioned,full planning permission,2018-11-13,http://www.doncaster.gov.uk/services/planning/planning-applications-online-public-access,,,,,18/00501/FULM,2017-12-31,2018-12-31,
http://opendatacommunities.org/id/metropolitan-district-council/doncaster,Doncaster MBC,662,"Site Of Former Rossington Colliery, West End Lane, New Rossington",-1.092678,53.479813,http://dmbc.maps.arcgis.com/apps/webappviewer/index.html?id=2ac0d9b40cc34eb2b05e80a122b7a6e2,51.7,not owned by a public authority,permissioned,outline planning permission,2013-10-01,http://www.doncaster.gov.uk/services/planning/planning-applications-online-public-access,yes,,,,12/01107/OUTA - Outline permission capacity has been reduced to reflect subsequent Reserved Matters (15/00008/REMM /16/00871/REMM & 14/02683/REM) approvals and starts on site for initial residential phases of this large development scheme.,2017-12-31,2018-12-31,
http://opendatacommunities.org/id/metropolitan-district-council/doncaster,Doncaster MBC,687,"The Embankment, Leach Lane Industrial Estate, Leach Lane, Mexborough",-1.284917,53.491724,http://dmbc.maps.arcgis.com/apps/webappviewer/index.html?id=2ac0d9b40cc34eb2b05e80a122b7a6e2,0.55,not owned by a public authority,permissioned,full planning permission,2016-01-18,http://www.doncaster.gov.uk/services/planning/planning-applications-online-public-access,,,,,14/02813/FULM - Evidence provided from landowner/developer that site not currently viable as part of evidence submitted to Public Inquiry May 2017 hence excluded from 5YHLS. More recent evidence that the scheme will now go ahead however: http://wearedoncaster.co.uk/news/multimillion-pound-doncaster-waterfront-scheme-set-to-move-ahead/?utm_source=newsletter&amp;utm_medium=email&amp;utm_campaign=Mexborough&amp;utm_content=November%20(2),2017-12-31,2018-12-31,
http://opendatacommunities.org/id/metropolitan-district-council/doncaster,Doncaster MBC,691,"Former Earth Centre Car Park, Kilners Bridge, Denaby Main",-1.238725,53.491412,http://dmbc.maps.arcgis.com/apps/webappviewer/index.html?id=2ac0d9b40cc34eb2b05e80a122b7a6e2,6.63,not owned by a public authority,permissioned,full planning permission,2015-10-15,http://www.doncaster.gov.uk/services/planning/planning-applications-online-public-access,yes,,,,14/02981/FULM,2017-12-31,2018-12-31,
http://opendatacommunities.org/id/metropolitan-district-council/doncaster,Doncaster MBC,790,"Red Lion Hotel, 41 Bank Street, Mexborough",-1.283863,53.492545,http://dmbc.maps.arcgis.com/apps/webappviewer/index.html?id=2ac0d9b40cc34eb2b05e80a122b7a6e2,0.06,not owned by a public authority,not permissioned,,,http://www.doncaster.gov.uk/services/planning/planning-applications-online-public-access,,,,,11/02702/FULM - Planning permission lapsed.  Current application pending for demolition of existing building (18/02022/FUL),2017-12-31,2018-12-31,
http://opendatacommunities.org/id/metropolitan-district-council/doncaster,Doncaster MBC,791,"Bentley House, Jossey Lane, Scawthorpe",-1.156484,53.54712,http://dmbc.maps.arcgis.com/apps/webappviewer/index.html?id=2ac0d9b40cc34eb2b05e80a122b7a6e2,2.28,not owned by a public authority,not permissioned,,,http://www.doncaster.gov.uk/services/planning/planning-applications-online-public-access,yes,,,,Previous permission (12/01046/OUTM) lapsed.,2017-12-31,2018-12-31,
http://opendatacommunities.org/id/metropolitan-district-council/doncaster,Doncaster MBC,794,"Land at Former Industrial Estate, Briars Lane, Stainforth",-1.027463,53.602239,http://dmbc.maps.arcgis.com/apps/webappviewer/index.html?id=2ac0d9b40cc34eb2b05e80a122b7a6e2,4.14,not owned by a public authority,permissioned,full planning permission,2015-02-17,http://www.doncaster.gov.uk/services/planning/planning-applications-online-public-access,yes,,,,13/00897/FULM,2017-12-31,2018-12-31,
http://opendatacommunities.org/id/metropolitan-district-council/doncaster,Doncaster MBC,797,"Land At Doncaster Football Ground, Bawtry Road, Doncaster, DN4 7PD",-1.104409,53.517357,http://dmbc.maps.arcgis.com/apps/webappviewer/index.html?id=2ac0d9b40cc34eb2b05e80a122b7a6e2,3.384,not owned by a public authority,permissioned,full planning permission,2017-09-08,http://www.doncaster.gov.uk/services/planning/planning-applications-online-public-access,Yes,,,,16/02139/FULM,2018-12-31,2018-12-31,
http://opendatacommunities.org/id/metropolitan-district-council/doncaster,Doncaster MBC,805,"The Old Vicarage, Stonegate, Thorne",-0.958528,53.611178,http://dmbc.maps.arcgis.com/apps/webappviewer/index.html?id=2ac0d9b40cc34eb2b05e80a122b7a6e2,0.11,not owned by a public authority,permissioned,full planning permission,2014-12-16,http://www.doncaster.gov.uk/services/planning/planning-applications-online-public-access,yes,,,,14/02119/FULM,2017-12-31,2018-12-31,
http://opendatacommunities.org/id/metropolitan-district-council/doncaster,Doncaster MBC,833,"Sandy Lane, Doncaster",-1.111959,53.514079,http://dmbc.maps.arcgis.com/apps/webappviewer/index.html?id=2ac0d9b40cc34eb2b05e80a122b7a6e2,1.3,not owned by a public authority,not permissioned,,,http://www.doncaster.gov.uk/services/planning/planning-applications-online-public-access,,39,49,,,2017-12-31,2018-12-31,
http://opendatacommunities.org/id/metropolitan-district-council/doncaster,Doncaster MBC,835,"Warmsworth Reservoir, Warmsworth",-1.184635,53.493491,http://dmbc.maps.arcgis.com/apps/webappviewer/index.html?id=2ac0d9b40cc34eb2b05e80a122b7a6e2,0.6,not owned by a public authority,pending decision,,,http://www.doncaster.gov.uk/services/planning/planning-applications-online-public-access,,18,29,,17/00537/OUTM - pending decsion (23 dwellings),2017-12-31,2018-12-31,
http://opendatacommunities.org/id/metropolitan-district-council/doncaster,Doncaster MBC,838,Kirk Street/Ramsden Road/Eden Grove,-1.150979,53.519765,http://dmbc.maps.arcgis.com/apps/webappviewer/index.html?id=2ac0d9b40cc34eb2b05e80a122b7a6e2,21.3,not owned by a public authority,permissioned,full planning permission,2015-02-27,http://www.doncaster.gov.uk/services/planning/planning-applications-online-public-access,yes,,,,"There are several planning approvals for this site (06/03071/OUTM; 11/01077/REMM;14/00616/FULM). The original Outline permission included proposals for a wider mixed use development, but viability issues has subsequently resulted in further approvals for just additional residential uses. The site has had planning permission implemented (development platform created), but that scheme is no longer being delivered and no houses have been built. Likely that a fresh application will be required therefore.",2017-12-31,2018-12-31,
http://opendatacommunities.org/id/metropolitan-district-council/doncaster,Doncaster MBC,850,"Land At Alagu Close ,Off Highwoods Road, Mexborough",-1.30441,53.498805,http://dmbc.maps.arcgis.com/apps/webappviewer/index.html?id=2ac0d9b40cc34eb2b05e80a122b7a6e2,0.24,not owned by a public authority,permissioned,outline planning permission,2015-06-11,http://www.doncaster.gov.uk/services/planning/planning-applications-online-public-access,yes,,,,15/00827/OUT,2017-12-31,2018-12-31,
http://opendatacommunities.org/id/metropolitan-district-council/doncaster,Doncaster MBC,862,"125A, 127, 127A, 129 AND 131A Balby Road, Balby",-1.145451,53.509685,http://dmbc.maps.arcgis.com/apps/webappviewer/index.html?id=2ac0d9b40cc34eb2b05e80a122b7a6e2,0.02,not owned by a public authority,permissioned,full planning permission,2014-12-19,http://www.doncaster.gov.uk/services/planning/planning-applications-online-public-access,yes,,,,14/02130/FULM,2017-12-31,2018-12-31,
http://opendatacommunities.org/id/metropolitan-district-council/doncaster,Doncaster MBC,867,"Campsall and District Working Men's Social Club, The Avenue, Campsall",-1.17831,53.621796,http://dmbc.maps.arcgis.com/apps/webappviewer/index.html?id=2ac0d9b40cc34eb2b05e80a122b7a6e2,0.38,not owned by a public authority,not permissioned,,,http://www.doncaster.gov.uk/services/planning/planning-applications-online-public-access,,14,18,,Previous planning permission (Ref: 12/00308/OUT) but now lapsed.,2017-12-31,2018-12-31,
http://opendatacommunities.org/id/metropolitan-district-council/doncaster,Doncaster MBC,886,"Oswin Avenue, Balby",-1.155199,53.50552,http://dmbc.maps.arcgis.com/apps/webappviewer/index.html?id=2ac0d9b40cc34eb2b05e80a122b7a6e2,0.25,not owned by a public authority,permissioned,full planning permission,2015-10-08,http://www.doncaster.gov.uk/services/planning/planning-applications-online-public-access,yes,,,,13/00522/FULM,2017-12-31,2018-12-31,
http://opendatacommunities.org/id/metropolitan-district-council/doncaster,Doncaster MBC,888,"Former Reservoir, Green Lane, Scawthorpe",-1.178419,53.549169,http://dmbc.maps.arcgis.com/apps/webappviewer/index.html?id=2ac0d9b40cc34eb2b05e80a122b7a6e2,0.86,not owned by a public authority,permissioned,full planning permission,2017-07-11,http://www.doncaster.gov.uk/services/planning/planning-applications-online-public-access,yes,,,,16/03030/FULM,2017-12-31,2018-12-31,
http://opendatacommunities.org/id/metropolitan-district-council/doncaster,Doncaster MBC,890,"Land Rear Of 67 - 79 South End, Station Road, Dunscroft",-1.023263,53.585791,http://dmbc.maps.arcgis.com/apps/webappviewer/index.html?id=2ac0d9b40cc34eb2b05e80a122b7a6e2,0.16,not owned by a public authority,permissioned,full planning permission,2015-06-04,http://www.doncaster.gov.uk/services/planning/planning-applications-online-public-access,yes,,,,14/01809/FUL,2017-12-31,2018-12-31,
http://opendatacommunities.org/id/metropolitan-district-council/doncaster,Doncaster MBC,893,"Land Of The Former Cinema, Edlington Lane, Edlington",-1.187714,53.486159,http://dmbc.maps.arcgis.com/apps/webappviewer/index.html?id=2ac0d9b40cc34eb2b05e80a122b7a6e2,0.11,not owned by a public authority,permissioned,full planning permission,2015-05-22,http://www.doncaster.gov.uk/services/planning/planning-applications-online-public-access,yes,,,,14/02581/FULM,2017-12-31,2018-12-31,
http://opendatacommunities.org/id/metropolitan-district-council/doncaster,Doncaster MBC,894,"Former Nurses Home, Cemetery Road, Mexborough",-1.285402,53.498693,http://dmbc.maps.arcgis.com/apps/webappviewer/index.html?id=2ac0d9b40cc34eb2b05e80a122b7a6e2,0.3,not owned by a public authority,permissioned,outline planning permission,2016-02-08,http://www.doncaster.gov.uk/services/planning/planning-applications-online-public-access,yes,,,,15/02583/OUT,2017-12-31,2018-12-31,
http://opendatacommunities.org/id/metropolitan-district-council/doncaster,Doncaster MBC,897,"Princegate House, Princegate, Doncaster",-1.132441,53.521321,http://dmbc.maps.arcgis.com/apps/webappviewer/index.html?id=2ac0d9b40cc34eb2b05e80a122b7a6e2,0.07,not owned by a public authority,permissioned,full planning permission,2015-04-17,http://www.doncaster.gov.uk/services/planning/planning-applications-online-public-access,yes,,,,14/02938/FUL,2017-12-31,2018-12-31,
http://opendatacommunities.org/id/metropolitan-district-council/doncaster,Doncaster MBC,899,"Site Of Former Rossington Colliery, West End Lane, New Rossington",-1.094966,53.480621,http://dmbc.maps.arcgis.com/apps/webappviewer/index.html?id=2ac0d9b40cc34eb2b05e80a122b7a6e2,2.84,not owned by a public authority,permissioned,reserved matters approval,2015-04-27,http://www.doncaster.gov.uk/services/planning/planning-applications-online-public-access,yes,,,,15/00008/REMM,2017-12-31,2018-12-31,
http://opendatacommunities.org/id/metropolitan-district-council/doncaster,Doncaster MBC,901,"East Lane House, 60 East Lane, Stainforth",-1.026044,53.59758,http://dmbc.maps.arcgis.com/apps/webappviewer/index.html?id=2ac0d9b40cc34eb2b05e80a122b7a6e2,0.17,not owned by a public authority,permissioned,full planning permission,2015-04-28,http://www.doncaster.gov.uk/services/planning/planning-applications-online-public-access,yes,,,,15/00219/FULM,2017-12-31,2018-12-31,
http://opendatacommunities.org/id/metropolitan-district-council/doncaster,Doncaster MBC,902,"Snooker Club, 21 - 27 St Sepulchre Gate, Doncaster",-1.135998,53.522938,http://dmbc.maps.arcgis.com/apps/webappviewer/index.html?id=2ac0d9b40cc34eb2b05e80a122b7a6e2,0.05,not owned by a public authority,permissioned,full planning permission,2015-04-28,http://www.doncaster.gov.uk/services/planning/planning-applications-online-public-access,yes,,,,15/00474/FUL,2017-12-31,2018-12-31,
http://opendatacommunities.org/id/metropolitan-district-council/doncaster,Doncaster MBC,906,"Denison House, 15 South Parade, Doncaster",-1.126968,53.521219,http://dmbc.maps.arcgis.com/apps/webappviewer/index.html?id=2ac0d9b40cc34eb2b05e80a122b7a6e2,0.16,not owned by a public authority,permissioned,full planning permission,2015-06-25,http://www.doncaster.gov.uk/services/planning/planning-applications-online-public-access,yes,,,,15/01088/FULM,2017-12-31,2018-12-31,
http://opendatacommunities.org/id/metropolitan-district-council/doncaster,Doncaster MBC,913,"Armthorpe Shopping Centre, Mill Street, Armthorpe",-1.050924,53.53583,http://dmbc.maps.arcgis.com/apps/webappviewer/index.html?id=2ac0d9b40cc34eb2b05e80a122b7a6e2,0.36,not owned by a public authority,permissioned,full planning permission,2015-12-11,http://www.doncaster.gov.uk/services/planning/planning-applications-online-public-access,yes,,,,15/02042/COU,2017-12-31,2018-12-31,
http://opendatacommunities.org/id/metropolitan-district-council/doncaster,Doncaster MBC,914,"Land South Of Armthorpe Shopping Centre, Mill Street, Armthorpe",-1.051147,53.535284,http://dmbc.maps.arcgis.com/apps/webappviewer/index.html?id=2ac0d9b40cc34eb2b05e80a122b7a6e2,0.28,not owned by a public authority,permissioned,reserved matters approval,2018-03-01,http://www.doncaster.gov.uk/services/planning/planning-applications-online-public-access,yes,,,,17/01854/FULM,2017-12-31,2018-12-31,
http://opendatacommunities.org/id/metropolitan-district-council/doncaster,Doncaster MBC,915,"Land North Of Armthorpe Shopping Centre, Mill Street, Armthorpe",-1.050186,53.536418,http://dmbc.maps.arcgis.com/apps/webappviewer/index.html?id=2ac0d9b40cc34eb2b05e80a122b7a6e2,0.18,not owned by a public authority,permissioned,full planning permission,2018-04-27,http://www.doncaster.gov.uk/services/planning/planning-applications-online-public-access,yes,,,,18/00153/FUL,2017-12-31,2018-12-31,
http://opendatacommunities.org/id/metropolitan-district-council/doncaster,Doncaster MBC,916,"Belmont Works, 3 Havelock Road, Balby",-1.140863,53.512079,http://dmbc.maps.arcgis.com/apps/webappviewer/index.html?id=2ac0d9b40cc34eb2b05e80a122b7a6e2,0.1,not owned by a public authority,permissioned,outline planning permission,2015-10-21,http://www.doncaster.gov.uk/services/planning/planning-applications-online-public-access,yes,,,,15/02051/OUT,2017-12-31,2018-12-31,
http://opendatacommunities.org/id/metropolitan-district-council/doncaster,Doncaster MBC,918,"Barnby Dun Car Centre, Top Road, Barnby Dun",-1.06761,53.575754,http://dmbc.maps.arcgis.com/apps/webappviewer/index.html?id=2ac0d9b40cc34eb2b05e80a122b7a6e2,0.21,not owned by a public authority,permissioned,outline planning permission,2015-11-18,http://www.doncaster.gov.uk/services/planning/planning-applications-online-public-access,yes,,,,15/02336/OUT,2017-12-31,2018-12-31,
http://opendatacommunities.org/id/metropolitan-district-council/doncaster,Doncaster MBC,922,"Garage Site, Maple Road, Mexborough",-1.293702,53.499992,http://dmbc.maps.arcgis.com/apps/webappviewer/index.html?id=2ac0d9b40cc34eb2b05e80a122b7a6e2,0.21,not owned by a public authority,permissioned,full planning permission,2016-02-15,http://www.doncaster.gov.uk/services/planning/planning-applications-online-public-access,yes,,,,15/02546/FUL,2017-12-31,2018-12-31,
http://opendatacommunities.org/id/metropolitan-district-council/doncaster,Doncaster MBC,923,"Electricity Sub Station, Young Street, Doncaster",-1.132874,53.52154,http://dmbc.maps.arcgis.com/apps/webappviewer/index.html?id=2ac0d9b40cc34eb2b05e80a122b7a6e2,0.03,not owned by a public authority,permissioned,full planning permission,2016-02-15,http://www.doncaster.gov.uk/services/planning/planning-applications-online-public-access,yes,,,,15/02624/FULM,2017-12-31,2018-12-31,
http://opendatacommunities.org/id/metropolitan-district-council/doncaster,Doncaster MBC,944,"Land On Part Of Former Brodsworth Colliery Site, Long Lands Lane, Brodsworth",-1.205979,53.564456,http://dmbc.maps.arcgis.com/apps/webappviewer/index.html?id=2ac0d9b40cc34eb2b05e80a122b7a6e2,12.67,not owned by a public authority,permissioned,reserved matters approval,2017-10-10,http://www.doncaster.gov.uk/services/planning/planning-applications-online-public-access,yes,,,,17/00826/REMM,2017-12-31,2018-12-31,
http://opendatacommunities.org/id/metropolitan-district-council/doncaster,Doncaster MBC,945,"Tadcaster Arms Hotel, Doncaster Road, Armthorpe",-1.063961,53.53783,http://dmbc.maps.arcgis.com/apps/webappviewer/index.html?id=2ac0d9b40cc34eb2b05e80a122b7a6e2,0.33,not owned by a public authority,permissioned,full planning permission,2017-02-24,http://www.doncaster.gov.uk/services/planning/planning-applications-online-public-access,yes,,,,12/02053/FULM,2017-12-31,2018-12-31,
http://opendatacommunities.org/id/metropolitan-district-council/doncaster,Doncaster MBC,946,"Land Off Station Road, Dunscroft",-1.012093,53.582212,http://dmbc.maps.arcgis.com/apps/webappviewer/index.html?id=2ac0d9b40cc34eb2b05e80a122b7a6e2,0.14,not owned by a public authority,permissioned,outline planning permission,2017-01-27,http://www.doncaster.gov.uk/services/planning/planning-applications-online-public-access,yes,,,,14/00484/OUT,2017-12-31,2018-12-31,
