OrganisationURI,SiteReference,SiteNameAddress,GeoX,GeoY,SiteplanURL,Hectares,OwnershipStatus,HazardousSubstances,PlanningStatus,PermissionType,PermissionDate,PlanningHistory,NetDwellingsRangeFrom,NetDwellingsRangeTo,Deliverable,Notes,FirstAddedDate,LastUpdatedDate,EndDate
http://opendatacommunities.org/id/district-council/guildford,BLR_003,"Land at Guildford Park Road Surface Car Park, Guildford GU2 7NF",-0.583505,51.239766,https://www.guildford.gov.uk/media/26679/Land-at-Guildford-Park-Road-Surface-Car-Park-Guildford-GU2-7NF/pdf/BFLR2017_003,2.15,owned by a public authority,,permissioned,full planning permission,2017-01-23,http://www2.guildford.gov.uk/publicaccess/applicationDetails.do?activeTab=summary&keyVal=_GUILD_DCAPR_171221,160,160,yes,"""Application ref. 16/P/01290"". ""Demolition of existing garage buildings and redevelopment of the site to provide 160 residential apartments and houses (Use Class C3) with new infrastructure, parking, access, landscaping, cycle storage and associated facilities including private and communal amenity space together with a five storey 541 space multi-storey public car park (Sui Generis) and 825 sqm. (GEFA) flexible commercial floorspace (Use Class A1, B1 and D2) on the ground floor of the multi-storey car park""",2017-09-27,2017-09-27,
http://opendatacommunities.org/id/district-council/guildford,BLR_005,"Land to the rear of 57, Manor Road, Tongham, GU10 1BA",-0.728854,51.238647,https://www.guildford.gov.uk/media/26681/Land-to-the-rear-of-57-Manor-Road-Tongham-GU10-1BA/pdf/BFLR2017_005,0.31,mixed ownership,,permissioned,full planning permission,2016-11-30,http://www2.guildford.gov.uk/publicaccess/applicationDetails.do?activeTab=documents&keyVal=_GUILD_DCAPR_173208,9,9,yes,"""Application ref. 16/P/01913"". ""Erection of 9 dwellings with associated access garages, carports and parking""",2017-09-27,2017-09-27,
http://opendatacommunities.org/id/district-council/guildford,BLR_007,"The Flat, Dental Care, 26 Farnham Road, Guildford, GU2 4JN",-0.581497,51.235192,https://www.guildford.gov.uk/media/26683/The-Flat-Dental-Care-26-Farnham-Road-Guildford-GU2-4JN/pdf/BFLR2017_007,0.28,not owned by a public authority,,permissioned,full planning permission,2017-04-05,http://www2.guildford.gov.uk/publicaccess/applicationDetails.do?activeTab=documents&keyVal=_GUILD_DCAPR_175672,1,1,yes,"""Application ref. 17/P/00051"". ""Increase in ridge height to enable the addition of a two bedroom second floor flat. New external access stairs and door, dormer window and six rooflights to side elevations and Juliette balcony to rear (description amended 13/01/2017).""",2017-09-27,2017-09-27,
http://opendatacommunities.org/id/district-council/guildford,BLR_012,"Land to the rear of Woodbridge Hill Filling Station, Aldershot Road, Guildford, GU2 8AG",-0.592679,51.250848,https://www.guildford.gov.uk/media/26688/Land-to-the-rear-of-Woodbridge-Hill-Filling-Station-Aldershot-Road-Guildford-GU2-8AG/pdf/BFLR2017_012,0.22,not owned by a public authority,,permissioned,full planning permission,2017-03-01,http://www2.guildford.gov.uk/publicaccess/applicationDetails.do?activeTab=documents&keyVal=_GUILD_DCAPR_172891,8,8,yes,"""Application ref. 16/P/01824"". ""Erection of four two bedroom houses and two pairs of semi-detached three bedroom houses with rooms in the roof associated parking and access from Aldershot Road.""",2017-09-27,2017-09-27,
http://opendatacommunities.org/id/district-council/guildford,BLR_015,"Works, Poyle Road, Tongham, GU10 1DS",-0.731398,51.233127,https://www.guildford.gov.uk/media/26691/Works-Poyle-Road-Tongham-GU10-1DS/pdf/BFLR2017_015,0.12,not owned by a public authority,,not permissioned,,,,10,10,,,2017-09-27,2017-09-27,
http://opendatacommunities.org/id/district-council/guildford,BLR_016,"Public House, Oxenden Road, Tongham",-0.732669,51.236414,https://www.guildford.gov.uk/media/26692/Public-House-Oxenden-Road-Tongham/pdf/BFLR2017_016,0.17,not owned by a public authority,,not permissioned,,,,15,15,,,2017-09-27,2017-09-27,
http://opendatacommunities.org/id/district-council/guildford,BLR_017,"Builders Yard (Elms Garden), Glaziers Lane, Normandy",-0.666377,51.251711,https://www.guildford.gov.uk/media/26693/Builders-Yard-Elms-Garden-Glaziers-Lane-Normandy/pdf/BFLR2017_018,1.25,not owned by a public authority,,not permissioned,,,,15,15,yes,,2017-09-27,2017-09-27,
http://opendatacommunities.org/id/district-council/guildford,BLR_019,"Slyfield Area Regeneration Project, Guildford",-0.564657,51.257549,https://www.guildford.gov.uk/media/26695/Slyfield-Area-Regeneration-Project-Guildford/pdf/BFLR2017_019,4E+1,mixed ownership,,not permissioned,,,,1000,1000,,"""2017 Submission Local Plan allocation ref. A24""",2017-09-27,2017-09-27,
http://opendatacommunities.org/id/district-council/guildford,BLR_020,"Land at Westway, off Aldershot Road, Guildford",-0.601427,51.250593,https://www.guildford.gov.uk/media/26696/Land-at-Westway-off-Aldershot-Road-Guildford/pdf/BFLR2017_020,0.56,not owned by a public authority,,not permissioned,,,,38,38,yes,"""2017 Submission Local Plan allocation ref. A19""",2017-09-27,2017-09-27,
http://opendatacommunities.org/id/district-council/guildford,BLR_021,"Land at Guildford Cathedral, Alresford Road, Guildford",-0.589994,51.240708,https://www.guildford.gov.uk/media/26697/Land-at-Guildford-Cathedral-Alresford-Road-Guildford/pdf/BFLR2017_021,3.28,not owned by a public authority,,not permissioned,,,,93,93,,"""2017 Submission Local Plan allocation ref. A15""",2017-09-27,2017-09-27,
http://opendatacommunities.org/id/district-council/guildford,BLR_022,"The Plaza, Portsmouth Road, Guildford",-0.578025,51.233963,https://www.guildford.gov.uk/media/26698/The-Plaza-Portsmouth-Road-Guildford/pdf/BFLR2017_022,0.38,not owned by a public authority,,not permissioned,,,,90,90,yes,"""2017 Submission Local Plan allocation ref. A1""",2017-09-27,2017-09-27,
http://opendatacommunities.org/id/district-council/guildford,BLR_023,"Jewsons, Walnut Tree Close, Guildford",-0.582017,51.241088,https://www.guildford.gov.uk/media/26699/Jewsons-Walnut-Tree-Close-Guildford/pdf/BFLR2017_023,0.64,not owned by a public authority,,not permissioned,,,,175,175,,"""2017 Submission Local Plan allocation ref. A5""",2017-09-27,2017-09-27,
http://opendatacommunities.org/id/district-council/guildford,BLR_024,"Surrey Police Headquarters, Mount Browne, Sandy Lane, Guildford",-0.585445,51.222282,https://www.guildford.gov.uk/media/26700/Surrey-Police-Headquarters-Mount-Browne-Sandy-Lane-Guildford/pdf/BFLR2017_024,5.9,not owned by a public authority,,not permissioned,,,,116,116,,"""2017 Submission Local Plan allocation ref. A32""",2017-09-27,2017-09-27,
http://opendatacommunities.org/id/district-council/guildford,BLR_025,"Former Pond Meadow School, Pond Meadow, Guildford",-0.608353,51.246638,https://www.guildford.gov.uk/media/26701/Former-Pond-Meadow-School-Pond-Meadow-Guildford/pdf/BFLR2017_025,0.6,owned by a public authority,,not permissioned,,,,11,11,yes,"""2017 Submission Local Plan allocation ref. A20""",2017-09-27,2017-09-27,
http://opendatacommunities.org/id/district-council/guildford,BLR_026,"Land between Farnham Road and the Mount, Guildford",-0.57977,51.234991,https://www.guildford.gov.uk/media/26702/Land-between-Farnham-Road-and-the-Mount-Guildford/pdf/BFLR2017_026,0.64,not owned by a public authority,,not permissioned,,,,70,70,,"""2017 Submission Local Plan allocation ref. A3""",2017-09-27,2017-09-27,
http://opendatacommunities.org/id/district-council/guildford,BLR_027,"Land at Coltsfoot Drive, 1 Bryony Road and garages, Guildford",-0.54489,51.257233,https://www.guildford.gov.uk/media/26703/Land-at-Coltsfoot-Drive-1-Bryony-Road-and-garages-Guildford/pdf/BFLR2017_027,0.64,not owned by a public authority,,not permissioned,,,,18,18,,,2017-09-27,2017-09-27,
http://opendatacommunities.org/id/district-council/guildford,BLR_028,"Land between Gill Avenue and Rosalind Frankin Close, Guildford",-0.609722,51.239253,https://www.guildford.gov.uk/media/26704/Land-between-Gill-Avenue-and-Rosalind-Frankin-Close-Guildford/pdf/BFLR2017_028,2.36,not owned by a public authority,,not permissioned,,,,61,61,,"""2017 Submission Local Plan allocation ref. A16""",2017-09-27,2017-09-27,
http://opendatacommunities.org/id/district-council/guildford,BLR_029,"Former Tyrrell site, Long Reach, Ockham",-0.461294,51.285192,https://www.guildford.gov.uk/media/26705/Former-Tyrrell-site-Long-Reach-Ockham/pdf/BFLR2017_029,1.98,not owned by a public authority,,not permissioned,,,,12,12,yes,"""Application 17/P/02488 refused on 14 March 2018 - Demolition of existing buildings and erection of 25 x dwellings. Site is PDL in the Green Belt.""",2017-09-27,2018-12-03,
http://opendatacommunities.org/id/district-council/guildford,BLR_030,"The Shed Factory, Portsmouth Road, Ripley",-0.501625,51.293799,https://www.guildford.gov.uk/media/26706/The-Shed-Factory-Portsmouth-Road-Ripley/pdf/BFLR2017_030,0.4,not owned by a public authority,,not permissioned,,,,12,12,,,2017-09-27,2017-09-27,
http://opendatacommunities.org/id/district-council/guildford,BLR_031,"Former scrap yard, Aldershot Road, Worplesdon",-0.633294,51.265627,https://www.guildford.gov.uk/media/26707/Former-scrap-yard-Aldershot-Road-Worplesdon/pdf/BFLR2017_031,1.7,not owned by a public authority,,permissioned,full planning permission,2017-10-17,http://www2.guildford.gov.uk/publicaccess/applicationDetails.do?activeTab=summary&keyVal=_GUILD_DCAPR_165613,45,45,yes,"""Application ref. 15/P/01987 """,2017-09-27,2017-12-05,
http://opendatacommunities.org/id/district-council/guildford,BLR_032,"Land and buildings at Guildford Railway Station, Guildford ",-0.580679,51.237106,https://www.guildford.gov.uk/media/26708/Land-and-buildings-at-Guildford-Railway-Station-Guildford-/pdf/BFLR2017_032,2.2,not owned by a public authority,,permissioned,,,http://www2.guildford.gov.uk/publicaccess/applicationDetails.do?activeTab=summary&keyVal=_GUILD_DCAPR_157038,438,438,,"""2017 Submission Local Plan allocation ref. A7. Application 14/P/02168 refused 30/6/16; appeal APP/Y3615/W/16/3161412 allowed (corrected decision issued on 27/2/18)."". ""Mixed use redevelopment comprising 438 dwellings (Class C3); retail/financial and professional services/food and drink and leisure floorspace (Class A1/A2/A3/Sui Generis and D2 uses); station and general office floorspace (Sui Generis and Class B1 uses); station improvements including new station building with booking hall and concourse (Sui Generis); replacement station and office car parking, new residential car parking, cycle parking, a Station Plaza including new public realm with hard and soft landscaping, new access and servicing arrangements, plant and associated works.""",2017-09-27,2017-11-30,
http://opendatacommunities.org/id/district-council/guildford,BLR_033,"Bright Hill Car Park, Sydenham Road, Guildford",-0.568444,51.235761,https://www.guildford.gov.uk/media/26709/Bright-Hill-Car-Park-Sydenham-Road-Guildford/pdf/BFLR2017_033,0.47,owned by a public authority,,not permissioned,,,,40,40,,"""2017 Submission Local Plan allocation ref. A12""",2017-09-27,2017-09-27,
http://opendatacommunities.org/id/district-council/guildford,BLR_034,"North Street redevelopment, Guildford",-0.57536,51.237231,https://www.guildford.gov.uk/media/26710/North-Street-redevelopment-Guildford/pdf/BFLR2017_034,3.47,mixed ownership,,not permissioned,,,,400,400,,"""2017 Submission Local Plan allocation ref. A6. Mixed ownership as GBC owns freehold, however M&G have a long leasehold over much of the site and there are multiple shorter leases on other parts.""",2017-09-27,2017-09-27,
http://opendatacommunities.org/id/district-council/guildford,BLR_035,"Treetops Boarding Kennels and Loxhill Nursery, Old Portsmouth Road, Peasmarsh, Guildford, GU3 1LN",-0.578534,51.221155,https://www.guildford.gov.uk/media/26711/Treetops-Kennels-and-Loxhill-Nursery-Old-Portsmouth-Road-Guildford/pdf/BFLR2017_035,2,not owned by a public authority,,permissioned,full planning permission,2018-02-20,http://www2.guildford.gov.uk/publicaccess/applicationDetails.do?activeTab=summary&keyVal=_GUILD_DCAPR_177231,39,39,yes,"""Application 17/P/00801 proposes 39 dwellings plus demolition of existing buildings (boarding kennels, cattery and operator's dwelling).  Appeal APP/Y3615/W/17/3180620 allowed subject to conditions 18 June 2018."". ""Full application for the development of 39 residential dwellings with associated vehicular access, public open space, ancillary works and associated infrastructure plus demolition of existing buildings.""",2017-12-05,2018-10-19,
http://opendatacommunities.org/id/district-council/guildford,BLR_036,"Kernal Court, Walnut Tree Close, Guildford",-0.582131,51.242511,https://www.guildford.gov.uk/media/26712/Kernal-Court-Walnut-Tree-Close-Guildford/pdf/BFLR2017_036,0.55,not owned by a public authority,,not permissioned,,,,100,100,yes,"""2017 Submission Local Plan allocation ref. A13""",2017-09-27,2017-09-27,
http://opendatacommunities.org/id/district-council/guildford,BLR_037,"Old Reservoir, Oxford Terrace off Sydenham Road, Guildford",-0.570552,51.234771,https://www.guildford.gov.uk/media/26713/Old-Reservoir-Oxford-Terrace-off-Sydenham-Road-Guildford/pdf/BFLR2017_037,0.1,not owned by a public authority,,not permissioned,,,,5,5,,,2017-09-27,2017-09-27,
http://opendatacommunities.org/id/district-council/guildford,BLR_038,"The Forge, 129 Ash Street, Ash",-0.721556,51.247165,https://www.guildford.gov.uk/media/26714/The-Forge-129-Ash-Street-Ash/pdf/BFLR2017_038,0.13,not owned by a public authority,,not permissioned,,,,5,5,,,2017-09-27,2017-09-27,
http://opendatacommunities.org/id/district-council/guildford,BLR_039,"1 Ward Street, Guildford",-0.57216,51.237408,https://www.guildford.gov.uk/media/26715/1-Ward-Street-Guildford/pdf/BFLR2017_039,0.02,not owned by a public authority,,permissioned,full planning permission,2018-04-06,http://www2.guildford.gov.uk/publicaccess/simpleSearchResults.do?action=firstPage,8,8,,"""Application ref. 17/P/02566"". ""Change of use to the first and second floors from Use Class D2 to Use Class C3 and addition of one extra floor to
provide 8no. residential flats.""",2017-09-27,2018-12-03,
http://opendatacommunities.org/id/district-council/guildford,BLR_040,"Kingdom Hall, 236 High Street, Guildford",-0.567897,51.236753,https://www.guildford.gov.uk/media/26716/Kingdom-Hall-236-High-Street-Guildford/pdf/BFLR2017_040,0.03,not owned by a public authority,,not permissioned,,,http://www2.guildford.gov.uk/publicaccess/simpleSearchResults.do?action=firstPage,6,6,,"""Application 08/P/00884 refused on 6 August 2008 - Erection of six storey building comprising 10 flats with 6 cycle spaces and replacement meeting hall following demolition of existing building.""",2017-09-27,2018-12-03,
http://opendatacommunities.org/id/district-council/guildford,BLR_041,"Finance House, Park Street, Guildford ",-0.578352,51.234974,https://www.guildford.gov.uk/media/26717/Finance-House-Park-Street-Guildford-/pdf/BFLR2017_041,0.04,not owned by a public authority,,not permissioned,,,,6,6,,,2017-09-27,2017-09-27,
http://opendatacommunities.org/id/district-council/guildford,BLR_042,"Stadium Works, Oxenden Road, Tongham",-0.734996,51.24036,https://www.guildford.gov.uk/media/26718/Stadium-Works-Oxenden-Road-Tongham/pdf/BFLR2017_042,0.1,not owned by a public authority,,permissioned,full planning permission,2017-09-20,http://www2.guildford.gov.uk/publicaccess/applicationDetails.do?activeTab=summary&keyVal=_GUILD_DCAPR_177211,6,6,yes,". ""Erection of a two storey detached building comprising of four x two bedroom flats and two x one bedroom flats with associated parking and landscaping following demolition of existing building.""",2017-09-27,2017-09-27,
http://opendatacommunities.org/id/district-council/guildford,BLR_043,"White Lion Walk, High Street, Guildford",-0.575379,51.235711,https://www.guildford.gov.uk/media/26719/White-Lion-Walk-High-Street-Guildford/pdf/BFLR2017_043,0.39,not owned by a public authority,,not permissioned,,,,50,50,,,2017-10-20,2017-10-20,
http://opendatacommunities.org/id/district-council/guildford,BLR_044,"111 Epsom Road, Guildford",-0.548709,51.241085,https://www.guildford.gov.uk/media/26720/111-Epsom-Road-Guildford/pdf/BFLR2017_044,0.14,not owned by a public authority,,not permissioned,,,,6,6,yes,,2017-10-20,2017-10-20,
http://opendatacommunities.org/id/district-council/guildford,BLR_045,"Land off Easington Place, Guildford",-0.556857,51.239378,https://www.guildford.gov.uk/media/26721/Land-off-Easington-Place-Guildford/pdf/BFLR2017_045,0.51,not owned by a public authority,,not permissioned,,,,10,10,yes,,2017-10-20,2017-10-20,
http://opendatacommunities.org/id/district-council/guildford,BLR_046,"Land at Guildford Fire Station, 14a to 18 Ladymead, Guildford, GU1 1DL",-0.573616,51.247785,https://www.guildford.gov.uk/media/26722/Land-at-Guildford-Fire-Station-14a-to-18-Ladymead-Guildford-GU1-1DL/pdf/BFLR2017_046,0.13,owned by a public authority,,permissioned,full planning permission,2018-07-27,http://www2.guildford.gov.uk/publicaccess/applicationDetails.do?activeTab=documents&keyVal=_GUILD_DCAPR_177096,6,6,yes,". ""Proposed erection of twelve one-bedroom flats with associated parking, following demolition of existing residential and storage premises.""",2017-10-20,2018-12-03,
http://opendatacommunities.org/id/district-council/guildford,BLR_047,"13, Lower Edgeborough Road, Guildford, GU1 2DX",-0.558029,51.239455,https://www.guildford.gov.uk/media/26723/13-Lower-Edgeborough-Road-Guildford-GU1-2DX/pdf/BFLR2017_047,0.13,not owned by a public authority,,not permissioned,,,http://www2.guildford.gov.uk/publicaccess/applicationDetails.do?activeTab=summary&keyVal=_GUILD_DCAPR_173761,10,10,yes,"""Application 16/P/02070 dismissed at appeal (ref. APP/Y3615/W/17/3169598) - Erection of 14 flats (Decision issued 7 July 2017).""",2017-10-20,2017-10-20,
http://opendatacommunities.org/id/district-council/guildford,BLR_048,"Garage, 92 Send Road, Send, GU23 7EZ",-0.529902,51.290848,https://www.guildford.gov.uk/media/26724/Garage-92-Send-Road-Send-GU23-7EZ/pdf/BFLR2017_048,0.16,not owned by a public authority,,not permissioned,,,http://www2.guildford.gov.uk/publicaccess/applicationDetails.do?activeTab=summary&keyVal=_GUILD_DCAPR_176826,20,20,yes,"""Application 17/P/00566 refused on 27 June  2017 - Demolition of existing buildings and erection of 8 x dwellings. Site is PDL in the Green Belt""",2017-10-20,2017-10-20,
http://opendatacommunities.org/id/district-council/guildford,BLR_049,"HM Prison Send, Ripley Road, Send, GU23 7LJ",-0.49136,51.274414,https://www.guildford.gov.uk/media/26725/HM-Prison-Send-Ripley-Road-Send-GU23-7LJ/pdf/BFLR2017_049,8.24,not owned by a public authority,,not permissioned,,,,150,150,,"""Site is PDL in the Green Belt""",2017-10-20,2017-10-20,
http://opendatacommunities.org/id/district-council/guildford,BLR_050,"Land at Oak Hill, Wood Street Village",-0.628047,51.252149,https://www.guildford.gov.uk/media/26726/Land-at-Oak-Hill-Wood-Street-Village/pdf/BFLR2017_050,4.4,not owned by a public authority,,not permissioned,,,,22,22,yes,"""Part of site is PDL in the Green Belt; remainder is PDL within the current village inset boundary.""",2017-10-20,2017-10-20,
http://opendatacommunities.org/id/district-council/guildford,BLR_051,"Dryden Court, Lower Edgeborough Road, Guildford",-0.560773,51.239669,https://www.guildford.gov.uk/media/26727/Dryden-Court-Lower-Edgeborough-Road-Guildford/pdf/BFLR2017_051,0.12,not owned by a public authority,,not permissioned,,,,6,6,yes,,2017-10-20,2017-10-20,
http://opendatacommunities.org/id/district-council/guildford,BLR_052,"Guildford Adult Education Centre, Sydenham Road, Guildford",-0.567845,51.236141,https://www.guildford.gov.uk/media/26728/Guildford-Adult-Education-Centre-Sydenham-Road-Guildford/pdf/BFLR2017_052,0.41,owned by a public authority,,not permissioned,,,,15,15,,"""Site is owned by Surrey County Council which has indicated it is likely to become available within the period covered by the Submission Local Plan.""",2017-10-20,2018-12-03,
http://opendatacommunities.org/id/district-council/guildford,BLR_053,"Pewley Hill Centre, Guildford",-0.570465,51.234338,https://www.guildford.gov.uk/media/26729/Pewley-Hill-Centre-Guildford/pdf/BFLR2017_053,0.22,owned by a public authority,,not permissioned,,,,6,6,,"""Site is owned by Surrey County Council which has indicated it is likely to become available within the period covered by the Submission Local Plan.""",2017-10-20,2018-12-03,
http://opendatacommunities.org/id/district-council/guildford,BLR_054,"City View Place, 67 Sydenham Road, Guildford, GU1 3RY",-0.56651,51.23715,https://www.guildford.gov.uk/media/29004/BLR-054/pdf/BLR_054.pdf,0.04,not owned by a public authority,,permissioned,full planning permission,2017-11-10,http://www2.guildford.gov.uk/publicaccess/applicationDetails.do?activeTab=summary&keyVal=_GUILD_DCAPR_177895,9,9,,"""Application ref. 17/P/01179"". ""Proposed change of use of existing building from B1a offices to C3 residential (9 flats), changes to front and rear elevations, extensions and alterations to fourth floor level, additional floor space at first floor level, provision of park lift stacking system and creation of 8 parking spaces with turning space.""",2018-10-19,2018-10-19,
http://opendatacommunities.org/id/district-council/guildford,BLR_055,"Howard of Effingham School & Lodge Farm, Lower Rd & Browns Field, Browns Lane, Effingham, Leatherhead, KT24",-0.3978,51.275222,https://www.guildford.gov.uk/media/29005/BLR-055/pdf/BLR_055.pdf,3.7,not owned by a public authority,,permissioned,other,2018-03-21,http://www2.guildford.gov.uk/publicaccess/applicationDetails.do?activeTab=summary&keyVal=_GUILD_DCAPR_156829,99,99,,"""Application ref. 14/P/02109"". ""Hybrid planning application for outline permission (only access to be considered) for the erection of a
replacement secondary school for Howard of Effingham and up to 258 residential dwellings with means of access at Howard of Effingham School and Lodge Farm, Lower Road following demolition of all existing buildings; and full permission for the erection of 37 dwellings, with access, parking and landscaping works on land at Brown's Field, Brown's Lane, Effingham.""",2018-10-19,2018-10-19,
http://opendatacommunities.org/id/district-council/guildford,BLR_056,"Hitherbury House, 97 Portsmouth Road, Guildford, GU2 4DL",-0.577811,51.229752,https://www.guildford.gov.uk/media/29006/BLR-056/pdf/BLR_056.pdf,0.12,not owned by a public authority,,permissioned,full planning permission,2016-05-12,http://www2.guildford.gov.uk/publicaccess/applicationDetails.do?activeTab=summary&keyVal=_GUILD_DCAPR_168373,7,7,,"""Application ref. 16/P/00402"". ""Restoration, refurbishment and conversion of the existing office building, erection of three storey side extension
to provide seven flats (3x1 bed, 3x2bed & 1x3 bed), landscaping, 9 parking spaces and 12 cycle parking spaces.""",2018-10-19,2018-10-19,
http://opendatacommunities.org/id/district-council/guildford,BLR_057,"Land at, 120-124 Ash Street, Ash, Guildford, GU12 6LL",-0.720069,51.246537,https://www.guildford.gov.uk/media/29007/BLR-057/pdf/BLR_057.pdf,0.2,not owned by a public authority,,permissioned,outline planning permission,2017-02-10,http://www2.guildford.gov.uk/publicaccess/simpleSearchResults.do?action=firstPage,9,9,,"""Application ref. 16/P/00454"". ""Outline application for the erection of nine residential dwellings following demolition of existing dwellings and
outbuildings (all matters reserved).""",2018-10-19,2018-10-19,
http://opendatacommunities.org/id/district-council/guildford,BLR_058,"Land to the East of South Cottage, White Horse Lane, Ripley, GU23 6BB",-0.489882,51.30113,https://www.guildford.gov.uk/media/29008/BLR-058/pdf/BLR_058.pdf,0.95,not owned by a public authority,,permissioned,full planning permission,2016-06-22,http://www2.guildford.gov.uk/publicaccess/simpleSearchResults.do?action=firstPage,26,26,,"""Application ref. 16/P/00608. Allowed at appeal, ref. APP/Y3615/W/16/3164814 (Decision date 23 August 2017)"". ""Outline planning application for the demolition of existing petrol filling station, car sales buildings and dilapidated
workshops and the construction of up to 26 residential units to the rear and 2 retail/commercial units on the High Street frontage (for flexible A1, A2, A3 or A4 use) and associated car parking and landscaping all matters reserved except access.""",2018-10-19,2018-10-19,
http://opendatacommunities.org/id/district-council/guildford,BLR_059,"Hare And Hounds, 57 Broad Street, Guildford, GU3 3BG",-0.607707,51.252367,https://www.guildford.gov.uk/media/29009/BLR-059/pdf/BLR_059.pdf,0.2,not owned by a public authority,,permissioned,full planning permission,2017-01-16,http://www2.guildford.gov.uk/publicaccess/applicationDetails.do?activeTab=summary&keyVal=_GUILD_DCAPR_169687,10,10,,"""Application ref. 16/P/00805"". ""Demolition of existing restaurant/bar and the construction of 10 new houses (8 x 3 bed and 1 x 4 bed) with
associated parking and landscaping.""",2018-10-19,2018-10-19,
http://opendatacommunities.org/id/district-council/guildford,BLR_061,"Stonechat, Silkmore Lane, West Horsley, Leatherhead, KT24 6JB",-0.456351,51.270945,https://www.guildford.gov.uk/media/29011/BLR-061/pdf/BLR_061.pdf,0.29,not owned by a public authority,,permissioned,full planning permission,2017-01-06,http://www2.guildford.gov.uk/publicaccess/simpleSearchResults.do?action=firstPage,1,1,,"""Application ref. 17/P/02144 "". ""Erection of two five bedroom dwellings together with associated works following the demolition of the existing dwelling and detached garage (revision of 16/P/01709). """,2018-10-19,2018-10-19,
