OrganisationURI,SiteReference,SiteNameAddress,GeoX,GeoY,SiteplanURL,Hectares,OwnershipStatus,HazardousSubstances,PlanningStatus,PermissionType,PermissionDate,PlanningHistory,NetDwellingsRangeFrom,NetDwellingsRangeTo,Deliverable,Notes,FirstAddedDate,LastUpdatedDate,EndDate
http://opendatacommunities.org/id/district-council/guildford,BLR_062,"The Legion, Millbrook, Guildford, GU1 3YA",-0.574303,51.2339,https://www.guildford.gov.uk/media/29012/BLR-062/pdf/BLR_062.pdf,0.03,not owned by a public authority,,permissioned,full planning permission,2017-12-18,http://www2.guildford.gov.uk/publicaccess/simpleSearchResults.do?action=firstPage,6,6,,"""Application ref. 17/P/00907"". ""Change of use and conversion of the existing bar/nightclub building, including partial realignment of second front fa´┐Żade, to create six residential units (Use Class C3).""",2018-10-19,2018-10-19,
http://opendatacommunities.org/id/district-council/guildford,BLR_063,"Builders Yard, 9 Down Road, Guildford, GU1 2PX",-0.542342,51.241734,https://www.guildford.gov.uk/media/29013/BLR-063/pdf/BLR_063.pdf,0.36,not owned by a public authority,,permissioned,full planning permission,2017-10-27,http://www2.guildford.gov.uk/publicaccess/simpleSearchResults.do?action=firstPage,2,2,,"""Application ref. 17/P/01191"". ""Erection of a pair of semi-detached dwellings with associated off-street parking and gardens following the change of use of the existing buiilders' yard and demolition of the existing building.""",2018-10-19,2018-10-19,
http://opendatacommunities.org/id/district-council/guildford,BLR_064,"Bell And Colvill (Horsley), Epsom Road, West Horsley, Leatherhead, KT24 6AU",-0.455083,51.260902,https://www.guildford.gov.uk/media/29014/BLR-064/pdf/BLR_064.pdf,1.4,not owned by a public authority,,permissioned,full planning permission,2018-01-25,http://www2.guildford.gov.uk/publicaccess/simpleSearchResults.do?action=firstPage,7,7,,"""Application ref. 17/P/01580"". ""Erection of ten dwellings (three pairs of 3-bed semi-detached, two pairs of 4 bed semi-detached) with associated access improvements, car parking and landscaping following demolition of existing workshop, showroom, three residential properties and removal of hardstanding.""",2018-10-19,2018-10-19,
http://opendatacommunities.org/id/district-council/guildford,BLR_065,"Mount Manor House, 16 The Mount, Guildford, GU2 4HN",-0.57911,51.234552,https://www.guildford.gov.uk/media/29015/BLR-065/pdf/BLR_065.pdf,0.13,not owned by a public authority,,permissioned,full planning permission,2018-02-21,http://www2.guildford.gov.uk/publicaccess/simpleSearchResults.do?action=firstPage,8,8,,"""Application ref. 17/P/01960"". ""Change of use from B1 Office to C3 Residential and creation of 1 x 2 bed apartment, 6 x 1 bedroom apartments
and a 4 bedroom house. Construction of a new infill single storey rear extension with basement.""",2018-10-19,2018-10-19,
http://opendatacommunities.org/id/district-council/guildford,BLR_066,"Hill Villa, Coopers Yard, Frog Grove Lane, Wood Street Village, Guildford, GU3 3HD",-0.638038,51.264181,https://www.guildford.gov.uk/media/29016/BLR-066/pdf/BLR_066.pdf,0.26,not owned by a public authority,,permissioned,full planning permission,2017-11-17,http://www2.guildford.gov.uk/publicaccess/simpleSearchResults.do?action=firstPage,2,2,,"""Application ref. 17/P/01970"". ""Demolition of existing buildings and redevelopment to form 2 No houses and associated garaging and parking.""",2018-10-19,2018-10-19,
http://opendatacommunities.org/id/district-council/guildford,BLR_067,"The Founders Studio, The Guildford School Of Acting, Millbrook, Guildford",-0.574453,51.234135,https://www.guildford.gov.uk/media/29017/BLR-067/pdf/BLR_067.pdf,0.03,not owned by a public authority,,permissioned,full planning permission,2018-03-14,http://www2.guildford.gov.uk/publicaccess/simpleSearchResults.do?action=firstPage,6,6,,"""Application ref. 17/P/02214"". ""The erection of 3 storey building comprising A1, A2 and B1a uses on the ground floor and 4 x 1 bed and 2 x 2 bed
flats above following demolition of existing building.""",2018-10-19,2018-10-19,
http://opendatacommunities.org/id/district-council/guildford,BLR_069,"Stoke Mill, Woking Road, Guildford, GU1 1QA",-0.571036,51.249642,https://www.guildford.gov.uk/media/29019/BLR-069/pdf/BLR_069.pdf,0.45,not owned by a public authority,,permissioned,full planning permission,2017-12-28,http://www2.guildford.gov.uk/publicaccess/simpleSearchResults.do?action=firstPage,23,23,,"""Application ref. 17/W/00095"". ""Application for notification for prior approval for a proposed change of use of a building from Office Use (Class B1(a)) to a Dwellinghouse (Class C3), comprising 23 residential units.""",2018-10-19,2018-10-19,
http://opendatacommunities.org/id/district-council/guildford,BLR_070,"Stoughton Social Club, 172 Worplesdon Road, Guildford",-0.593548,51.255696,https://www.guildford.gov.uk/media/29020/BLR-070/pdf/BLR_070.pdf,0.14,not owned by a public authority,,permissioned,full planning permission,2018-06-11,http://www2.guildford.gov.uk/publicaccess/applicationDetails.do?activeTab=summary&keyVal=_GUILD_DCAPR_180626,14,14,,"""Application ref. 18/P/00043"". ""Extension, refurbishment and change of use of a vacant social club to 14 flats, including associated landscaping works, construction of a refuse and cycle store and parking provision.""",2018-10-19,2018-10-19,
http://opendatacommunities.org/id/district-council/guildford,BLR_071,"Day Nursery, 56 Epsom Road, Guildford, GU4 7AA",-0.561487,51.237448,https://www.guildford.gov.uk/media/29021/BLR-071/pdf/BLR_071.pdf,0.08,not owned by a public authority,,permissioned,full planning permission,2018-08-15,http://www2.guildford.gov.uk/publicaccess/simpleSearchResults.do?action=firstPage,6,6,,"""Application ref. 18/P/00323"". ""Creation of six flats following change of use from D1 (Nursery) to C3 (Residential) use. Internal alterations and
erection of a three storey extension on the eastern elevation with associated landscaping, parking and associated works.""",2018-10-19,2018-10-19,
http://opendatacommunities.org/id/district-council/guildford,BLR_072,"Roseberry, Keens Lane, Guildford, GU3 3JS",-0.598822,51.261838,https://www.guildford.gov.uk/media/29022/BLR-072/pdf/BLR_072.pdf,0.26,not owned by a public authority,,permissioned,full planning permission,2018-03-09,http://www2.guildford.gov.uk/publicaccess/applicationDetails.do?activeTab=summary&keyVal=_GUILD_DCAPR_180657,7,7,,"""Application ref. 18/P/00058"". ""Proposed erection of eight two storey dwellinghouses (one detached dwelling, two pairs of semi-detached dwellings and a terrace of three dwellings) with associated parking, landscaping and access improvement works, following demolition of existing buildings""",2018-12-04,2018-12-04,
http://opendatacommunities.org/id/district-council/guildford,BLR_073,"Inner Court, Pewley Hill, Guildford, GU1 3SP",-0.564701,51.231741,https://www.guildford.gov.uk/media/29023/BLR-073/pdf/BLR_073.pdf,0.03,not owned by a public authority,,not permissioned,,,,2,2,,,2018-10-31,2018-10-31,
http://opendatacommunities.org/id/district-council/guildford,BLR_074,"Oldlands Field Yard, Garlicks Arch Copse, Portsmouth Road, Ripley, GU2 6EL",-0.506413,51.285021,https://www.guildford.gov.uk/media/29024/BLR-074/pdf/BLR_074.pdf,0.32,not owned by a public authority,,not permissioned,,,,10,10,,,2018-11-02,2018-11-02,
