OrganisationURI,SiteReference,SiteNameAddress,GeoX,GeoY,SiteplanURL,Hectares,OwnershipStatus,HazardousSubstances,PlanningStatus,PermissionType,PermissionDate,PlanningHistory,NetDwellingsRangeFrom,NetDwellingsRangeTo,Deliverable,Notes,FirstAddedDate,LastUpdatedDate,EndDate
http://opendatacommunities.org/id/national-park-authority/new-forest,BFS1,"Former Magistrates’ Court, Pikes Hill, Lyndhurst, SO43 7AY",-1.57827,50.877638,https://www.newforestnpa.gov.uk/planning/brownfield-sites-register/,0.04,owned by a public authority,,not permissioned,,,07/91127,5,5,yes,"""An element of residential use would be considered alongside employment as part of a mixed use redevelopment of this employment site""",2017-12-20,2019-12-11,
http://opendatacommunities.org/id/national-park-authority/new-forest,BFS2,"Garage Site, Foldsgate Close, Lyndhurst SO43 7BY",-1.578666,50.877882,https://www.newforestnpa.gov.uk/planning/brownfield-sites-register/,0.02,owned by a public authority,,not permissioned,,,,2,2,yes,,2017-12-20,2019-12-11,
http://opendatacommunities.org/id/national-park-authority/new-forest,BFS3,"Redmayne Engineering Site, Station Approach, Brockenhurst, SO42 7TW",-1.57353,50.81754,https://www.newforestnpa.gov.uk/planning/brownfield-sites-register/,0.39,not owned by a public authority,,permissioned,full planning permission,2018-11-20,18/00497,9,9,yes,"""Demolition of redundant industrial buildings and construction of mixed use development including 9no dwellings, 4no office/retail units on ground floor and 5 no office units at first floor level, carports, parking and landscaping. Existing access retained.""",2017-12-20,2019-12-11,
http://opendatacommunities.org/id/national-park-authority/new-forest,BFS4,"Land at Railway Station, Brockenhurst, SO42 7TW",-1.575547,50.814319,https://www.newforestnpa.gov.uk/planning/brownfield-sites-register/,0.35,,,not permissioned,,,,10,10,yes,,2017-12-20,2019-12-11,
http://opendatacommunities.org/id/national-park-authority/new-forest,BFS5,"Former Service Station, 128 Lyndhurst Road, Ashurst, SO40 7AS",-1.522698,50.892675,https://www.newforestnpa.gov.uk/planning/brownfield-sites-register/,0.05,not owned by a public authority,,not permissioned,,,07/91926,2,2,yes,,2017-12-20,2019-12-11,
http://opendatacommunities.org/id/national-park-authority/new-forest,BFS6,"Land adjoining Cranleigh Paddock Residential Home, Calpe Avenue, Lyndhurst, SO43 7EP",-1.579084,50.875707,https://www.newforestnpa.gov.uk/planning/brownfield-sites-register/,0.35,not owned by a public authority,,not permissioned,,,NFDC/78/11767,18,18,yes,,2017-12-20,2019-12-11,
http://opendatacommunities.org/id/national-park-authority/new-forest,BFS7,"Lyndhurst Park Hotel, 78 High Street, Lyndhurst, SO43 7NL",-1.572011,50.87204,https://www.newforestnpa.gov.uk/planning/brownfield-sites-register/,1.61,not owned by a public authority,,not permissioned,,,17/00732,50,50,yes,"""allocated in adopted local plan""",2017-12-20,2019-12-11,
http://opendatacommunities.org/id/national-park-authority/new-forest,BFS8,"Oak Lodge Dental Surgery, Rhinefield Road, Brockenhurst, SO42 7SR",-1.581436,50.82238,https://www.newforestnpa.gov.uk/planning/brownfield-sites-register/,0.15,not owned by a public authority,,permissioned,full planning permission,2005-08-15,04/82430,1,1,yes,"""Planning application partly implemented; demolition of existing, new access""",2017-12-20,2019-12-11,
http://opendatacommunities.org/id/national-park-authority/new-forest,BFS9,"Watersplash Hotel, The Rise, Brockenhurst, SO42 7ZP",-1.578147,50.818753,https://www.newforestnpa.gov.uk/planning/brownfield-sites-register/,0.5,not owned by a public authority,,permissioned,full planning permission,2017-04-26,16/00307,26,26,yes,"""3 villas to create 24 age restricted apartments; construction commenced 2018""",2017-12-20,2019-12-11,2019-03-31
http://opendatacommunities.org/id/national-park-authority/new-forest,BFS10,"First and Second Floor, 49-49A High Street, Lyndhurst, SO43 7BE",-1.575217,50.872708,https://www.newforestnpa.gov.uk/planning/brownfield-sites-register/,0.03,not owned by a public authority,,permissioned,other,2016-08-15,16/00508,6,6,yes,"""Change of use of office building to 6 apartments""",2017-12-20,2019-12-11,2019-03-31
http://opendatacommunities.org/id/national-park-authority/new-forest,BFS12,"Land To The Rear Of 35 High Street, Lyndhurst, SO43 7BE",-1.575727,50.872826,https://www.newforestnpa.gov.uk/planning/brownfield-sites-register/,0.02,not owned by a public authority,,permissioned,full planning permission,2016-06-21,16/00284,1,1,yes,"""New dwelling; associated landscaping; not started as at 31/3/19""",2017-12-20,2019-12-11,
http://opendatacommunities.org/id/national-park-authority/new-forest,BFS13,"Burwood Lodge, 27 Romsey Road, Lyndhurst, SO43 7AA",-1.576711,50.874053,https://www.newforestnpa.gov.uk/planning/brownfield-sites-register/,0.19,not owned by a public authority,,permissioned,full planning permission,2016-09-15,15/00805,1,1,yes,"""Conversion of Bed and Breakfast to create 2 dwellings; under construction as at 31/3/2019""",2017-12-20,2019-12-11,
http://opendatacommunities.org/id/national-park-authority/new-forest,BFS14,"Land Of Forest Park Hotel, Forest Park Road, Brockenhurst, SO42 7SW",-1.585894,50.822441,https://www.newforestnpa.gov.uk/planning/brownfield-sites-register/,0.39,not owned by a public authority,,permissioned,full planning permission,2016-09-08,16/00506,1,1,yes,"""New dwelling and garage""",2017-12-20,2019-12-11,
http://opendatacommunities.org/id/national-park-authority/new-forest,BFS16,"Lloyds Tsb, Sway Road, Brockenhurst, SO42 7ZH",-1.575505,50.818959,https://www.newforestnpa.gov.uk/planning/brownfield-sites-register/,0.06,not owned by a public authority,,permissioned,full planning permission,2017-03-21,17/00036,2,2,yes,"""Change of use to dental practice; 2 flats; Internal alterations""",2017-12-20,2019-12-11,
http://opendatacommunities.org/id/national-park-authority/new-forest,BFS17,"Rufus House Hotel, Southampton Road, Lyndhurst, SO43 7BQ",-1.573245,50.873599,https://www.newforestnpa.gov.uk/planning/brownfield-sites-register/,0.14,not owned by a public authority,,permissioned,full planning permission,2017-02-14,15/00763,2,2,yes,"""Conversion of owners accommodation to create 2 separate units of accommodation; not started as at 31/3/19""",2017-12-20,2019-12-11,
http://opendatacommunities.org/id/national-park-authority/new-forest,BFS18,"3No. Flats, 68 High Street, Lyndhurst, SO43 7BJ",-1.573245,50.872262,https://www.newforestnpa.gov.uk/planning/brownfield-sites-register/,0.18,not owned by a public authority,,permissioned,full planning permission,2016-11-10,16/00774,2,2,yes,"""Conversion of flat, including loft space, to create 3No. Flats; 3 dwellings under construction as at 31/3/2019""",2018-12-06,2019-12-11,
http://opendatacommunities.org/id/national-park-authority/new-forest,BFS19,"17 Forest Gardens, Lyndhurst, SO43 7AF",-1.578861,50.875149,https://www.newforestnpa.gov.uk/planning/brownfield-sites-register/,0.1,not owned by a public authority,,permissioned,full planning permission,2018-06-11,18/00071,1,1,yes,"""Conversion from outbuilding to 1 dwelling""",2019-12-02,2019-12-02,
http://opendatacommunities.org/id/national-park-authority/new-forest,BFS20,"Care home, Empress Rd, Lyndhurst, SO43 7AE",-1.575274,50.874201,https://www.newforestnpa.gov.uk/planning/brownfield-sites-register/,0.05,not owned by a public authority,,permissioned,full planning permission,2018-10-12,18/00569,4,4,yes,"""Conversion to 4 flats""",2019-12-02,2019-12-02,
http://opendatacommunities.org/id/national-park-authority/new-forest,BFS21,"The Barn, Cadnam, SO40 2NP",-1.58239,50.922219,https://www.newforestnpa.gov.uk/planning/brownfield-sites-register/,0.08,not owned by a public authority,,permissioned,full planning permission,2018-07-09,18/00302,1,1,yes,"""Conversion from office to 1 dwelling""",2019-12-02,2019-12-02,
http://opendatacommunities.org/id/national-park-authority/new-forest,BFS22,"Tatchbury Manor, Winsor, SO40 2HA",-1.535184,50.925188,https://www.newforestnpa.gov.uk/planning/brownfield-sites-register/,1.54,not owned by a public authority,,permissioned,full planning permission,2018-03-20,17/00939,10,10,yes,"""Conversion of care home to 10 dwellings""",2019-12-02,2019-12-02,
http://opendatacommunities.org/id/national-park-authority/new-forest,BFS23,"66 & 68 Brookley Rd, Brockenhurst, SO42 7RA",-1.577773,50.819327,https://www.newforestnpa.gov.uk/planning/brownfield-sites-register/,0.02,not owned by a public authority,,permissioned,full planning permission,2018-10-29,18/00579,1,1,yes,"""1 new dwelling""",2019-12-02,2019-12-02,
http://opendatacommunities.org/id/national-park-authority/new-forest,BFS24,"Builders Yard, Sway, SO41 6BA",-1.606953,50.784564,https://www.newforestnpa.gov.uk/planning/brownfield-sites-register/,0.11,not owned by a public authority,,permissioned,full planning permission,2018-11-21,18/00608,3,3,yes,"""3 new dwellings""",2019-12-02,2019-12-02,
http://opendatacommunities.org/id/national-park-authority/new-forest,BFS25,"Hazlehurst Farm, Sway, SO41 6DN",-1.59684,50.769584,https://www.newforestnpa.gov.uk/planning/brownfield-sites-register/,0.07,not owned by a public authority,,permissioned,full planning permission,2018-03-27,18/00045,2,2,yes,"""Conversion from office to 2 new dwellings""",2019-12-02,2019-12-02,
http://opendatacommunities.org/id/national-park-authority/new-forest,BFS26,"Ashurst Hospital, Lyndhurst Road, Ashurst, SO40 7AR",-1.523184,50.891031,https://www.newforestnpa.gov.uk/planning/brownfield-sites-register/,2.82,not owned by a public authority,,not permissioned,,,,30,30,yes,"""allocated in adopted local plan""",2019-12-02,2019-12-02,
