OrganisationURI,SiteReference,SiteNameAddress,GeoX,GeoY,SiteplanURL,Hectares,OwnershipStatus,HazardousSubstances,PlanningStatus,PermissionType,PermissionDate,PlanningHistory,NetDwellingsRangeFrom,NetDwellingsRangeTo,Deliverable,Notes,FirstAddedDate,LastUpdatedDate,EndDate
http://opendatacommunities.org/id/district-council/copeland,CBR001,"Adj Mill Hill Phase 2, Mill Hill, Cleator Moor",-3.531349,54.530872,https://www.copeland.gov.uk/sites/default/files/attachments/cbr001_mill_hill_phase_2.pdf,1.34,not owned by a public authority,,permissioned,full planning permission,2018-04-11,,16,16,yes,. 16 Dwellings,2017-12-22,2017-12-22,
http://opendatacommunities.org/id/district-council/copeland,CBR003,County Highways Depot Holborn Hill,-3.276897,54.21236,https://www.copeland.gov.uk/sites/default/files/attachments/cbr003_former_highways_depot.pdf,0.35,not owned by a public authority,,permissioned,reserved matters approval,2017-01-13,,8,8,yes,. Reserved Matters For Full Development Details (8 Dwellings),2017-12-22,2017-12-22,
http://opendatacommunities.org/id/district-council/copeland,CBR004,Former Ashburners Compound Millom Road,-3.264386,54.211917,https://www.copeland.gov.uk/sites/default/files/attachments/cbr004_former_ashburners_compound.pdf,0.16,not owned by a public authority,,permissioned,full planning permission,2009-01-08,,9,9,yes,. Demolition Of Existing Commercial Building & Erection Of Nine Dwellings (Resubmission Of 4/08/2146/0),2017-12-22,2017-12-22,
http://opendatacommunities.org/id/district-council/copeland,CBR005,Former Cinema Buildings Bookwell Street,-3.530048,54.480781,https://www.copeland.gov.uk/sites/default/files/attachments/crb005_former_cinema_egremont.pdf,0.14,not owned by a public authority,,permissioned,reserved matters approval,2018-05-01,,8,8,yes,. Reserved Matters For Full Development Details (8 Dwellings),2017-12-22,2018-12-17,
http://opendatacommunities.org/id/district-council/copeland,CBR006,Former Lakeland Laundry,-3.58712,54.535941,https://www.copeland.gov.uk/sites/default/files/attachments/cbr006_former_lakeland_laundary.pdf,1.31,not owned by a public authority,,permissioned,full planning permission,2007-02-07,,48,48,yes,. 48 Dwellings,2017-12-22,2017-12-22,
http://opendatacommunities.org/id/district-council/copeland,CBR007,Former Nightclub Meadow Road,-3.581813,54.532218,https://www.copeland.gov.uk/sites/default/files/attachments/cbr007_former_nightclub_whitehaven.pdf,0.25,not owned by a public authority,,pending decision,,,,28,28,yes,. 21 Apartments and 7 Bungalows for residents for 55+,2017-12-22,2018-12-17,
http://opendatacommunities.org/id/district-council/copeland,CBR008,Former Outbuildings Seacote Hotel,-3.602662,54.49041,https://www.copeland.gov.uk/sites/default/files/attachments/cbr008_former_outbuildings_0.pdf,0.46,not owned by a public authority,,permissioned,full planning permission,2013-09-23,,8,8,yes,". Improved Vehicle Access & Proposed Alterations To Car Park, Plus Construction Of 8 New Houses",2017-12-22,2017-12-22,
http://opendatacommunities.org/id/district-council/copeland,CBR009,Former Sekers Factory Main Street,-3.560663,54.539306,https://www.copeland.gov.uk/sites/default/files/attachments/cbr009_former_sekers_factory_site_0.pdf,1.26,not owned by a public authority,,permissioned,full planning permission,2017-03-31,,60,60,yes,. 60 Bed Care Home with the other half of the site proposed for housing,2017-12-22,2018-12-17,
http://opendatacommunities.org/id/district-council/copeland,CBR010,"Land at East Road, Egremont",-3.528062,54.486307,https://www.copeland.gov.uk/sites/default/files/attachments/cbr010_land_at_east_road_egremont.pdf,0.46,not owned by a public authority,,pending decision,,,,25,25,,. ERECTION OF 28 NO. APARTMENTS OVER 3.5 STOREYS AND 13 NO. DWELLINGS OVER 2.5 STOREYS WITH ASSOCIATED LANDSCAPING AND CAR PARKING,2017-12-22,2018-12-17,
http://opendatacommunities.org/id/district-council/copeland,CBR011,Land rear to Rusper Drive,-3.544758,54.514766,https://www.copeland.gov.uk/sites/default/files/attachments/cbr011_land_rear_to_rusper_drive_0.pdf,1.55,not owned by a public authority,,permissioned,outline planning permission,2017-08-15,,26,26,yes,. Outline Application For The Erection Of 26 Dwellings,2018-01-31,2017-12-22,
http://opendatacommunities.org/id/district-council/copeland,CBR012,"Old Welfare Home, Whitehaven",-3.585176,54.531644,https://www.copeland.gov.uk/sites/default/files/attachments/cbr012_old_welfare_home_0.pdf,3.38,not owned by a public authority,,permissioned,full planning permission,2015-04-20,,107,107,yes,. Residential Development (107 Dwellings),2017-12-22,2017-12-22,
http://opendatacommunities.org/id/district-council/copeland,CBR013,"Poolside, Haverigg",-3.285679,54.197401,https://www.copeland.gov.uk/sites/default/files/attachments/cbr013_poolside_haverigg.pdf,3,not owned by a public authority,,permissioned,full planning permission,2016-04-13,,81,81,yes,. New Housing Development of 81 Dwellings,2017-12-22,2017-12-22,
http://opendatacommunities.org/id/district-council/copeland,CBR014,"Romar Site, Main Street",-3.56278,54.53846,https://www.copeland.gov.uk/sites/default/files/attachments/cbr014_romar_site_whitehaven_0.pdf,0.91,not owned by a public authority,,permissioned,outline planning permission,2017-07-05,,29,29,yes,. Demolition Of Factory And Outline Planning For Erection Of Dwellings,2017-12-22,2017-12-22,
http://opendatacommunities.org/id/district-council/copeland,CBR015,St Michaels Chapel Moresby Parks Road,-3.552059,54.558579,https://www.copeland.gov.uk/sites/default/files/attachments/cbr015_st_michaels_chapel_moresby.pdf,0.1,not owned by a public authority,,pending decision,,,,5,5,yes,. Construction of 5 No. Detached Dwellings,2017-12-22,2018-12-17,
http://opendatacommunities.org/id/district-council/copeland,CBR016,"Station Yard, Millom",-3.267311,54.212291,https://www.copeland.gov.uk/sites/default/files/attachments/cbr016_station_yard_millom.pdf,0.62,not owned by a public authority,,permissioned,full planning permission,1993-09-02,,25,25,yes,. 25 Residential Units,2017-12-22,2017-12-22,
http://opendatacommunities.org/id/district-council/copeland,CBR017,"Station Yard, Moor Row",-3.536084,54.517034,https://www.copeland.gov.uk/sites/default/files/attachments/cbr017_station_yard_moor_row.pdf,1.19,not owned by a public authority,,permissioned,outline planning permission,2017-01-13,,73,73,yes,. Outline Application For Residential Development,2017-12-22,2017-12-22,
http://opendatacommunities.org/id/district-council/copeland,CBR018,Trafalgar Square Yeathouse Road,-3.489359,54.54016,https://www.copeland.gov.uk/sites/default/files/attachments/cbr018_trafalgar_square_frizington.pdf,0.31,not owned by a public authority,,permissioned,reserved matters approval,2017-10-18,,9,9,yes,. Outline Application For Erection Of Nine Detached Two Storey Dwellings,2017-12-22,2017-12-22,
http://opendatacommunities.org/id/district-council/copeland,CBR019,Whites Row,-3.582436,54.567874,https://www.copeland.gov.uk/sites/default/files/attachments/cbr019_whites_row_parton.pdf,0.44,not owned by a public authority,,permissioned,outline planning permission,2017-03-15,,7,7,yes,. Outline Application For Seven Dwellings,2017-12-22,2017-12-22,
http://opendatacommunities.org/id/district-council/copeland,CBR020,"Distressed Sailors Inn, Egremont Road",-3.568662,54.531419,https://www.copeland.gov.uk/attachments/cbr020-distressed-sailors-inn-egremont-road,0.1,not owned by a public authority,,permissioned,outline planning permission,2018-10-29,,7,7,yes,. Outline Application erection of Seven Dwellings,2018-12-19,2018-12-19,
http://opendatacommunities.org/id/district-council/copeland,CBR021,"Land to Rear of Ennerdale View, Birks Road",-3.511751,54.523695,https://www.copeland.gov.uk/attachments/cbr021-land-rear-ennerdale-view,3.06,not owned by a public authority,,permissioned,outline planning permission,2017-06-07,,9,9,yes,. Phase 1 Comprising Of Nine Dwellings,2018-12-19,2018-12-19,
http://opendatacommunities.org/id/district-council/copeland,CBR022,"Kells and District Royal British Legion Club, Hill Top Road, Kells",-3.593602,54.537672,https://www.copeland.gov.uk/attachments/cbr022-kells-royal-british-legion,0.22,not owned by a public authority,,permissioned,full planning permission,2018-06-06,,10,10,yes,. Proposal Demolition of Existing Club and the Redevelopment of The Site with 10 No. Dwellings,2018-12-19,2018-12-19,
http://opendatacommunities.org/id/district-council/copeland,CBR023,"Former Concrete batching pland, Old goods yard Distington",-3.532347,54.574819,https://www.copeland.gov.uk/attachments/cbr023-former-concrete-batching-plant,2.72,not owned by a public authority,,permissioned,outline planning permission,2018-08-29,,52,52,yes,. Demolition of former railway structures and outline planning permission for residential development of up to 52 dwellings with full details of access,2019-12-24,2019-12-24,
http://opendatacommunities.org/id/district-council/copeland,CBR024,"Whitehaven Medical Centre, 3 Catherine Street, Whitehaven",-3.584977,54.546863,https://www.copeland.gov.uk/attachments/cbr024-whitehaven-medical-centre,0.02,not owned by a public authority,,permissioned,full planning permission,2019-10-21,,6,6,yes,". Installation of new windows & doors to principal elevation, erection of first floor side extension with rear dormer along with internal alterations (demolition works and new construction) to facilitate change of use of building to form 6 flats",2019-12-24,2019-12-24,
