OrganisationURI,SiteReference,SiteNameAddress,GeoX,GeoY,SiteplanURL,Hectares,OwnershipStatus,HazardousSubstances,PlanningStatus,PermissionType,PermissionDate,PlanningHistory,NetDwellingsRangeFrom,NetDwellingsRangeTo,Deliverable,Notes,FirstAddedDate,LastUpdatedDate,EndDate
http://opendatacommunities.org/id/district-council/welwyn-hatfield,WGC104b,Welwyn Garden City-Broadwater Road West SPD Site (North),-0.201087,51.800701,http://www.welhat.gov.uk/map?getmap=true&scale=5000&location=524150.149902344^212847.925292969&layersidentifier=316953772e564d9d929d7fb83f9f0308&menuconfig=Live,9.09,not owned by a public authority,,permissioned,outline planning permission,2017-08-18,Permission reference N6/2015/0294/PP | http://planning.welhat.gov.uk/plandisp.aspx?recno=17483,850,1340,yes,New application for 1340 dwellings 6/2018/0171/MAJ awaiting determination.,2017-12-15,2018-12-13,
http://opendatacommunities.org/id/district-council/welwyn-hatfield,WGC104c,Welwyn Garden City-Broadwater Road West SPD Site (West),-0.203185,51.799349,http://www.welhat.gov.uk/map?getmap=true&scale=2500&location=523981.846191406^212683.924804688&layersidentifier=be9550819e5646d1a440e3cc9227984d&menuconfig=Live,2.07,not owned by a public authority,,not permissioned,,,Assessed in 2016 HELAA - Site Pea02c | Proposed allocation in Submission Local Plan - Site SDS4,171,171,,,2017-12-15,2017-12-15,
http://opendatacommunities.org/id/district-council/welwyn-hatfield,WGC135e,Welwyn Garden City-Xerox Campus Bessemer Road (New build-West Blocks X2 and X3),-0.19958,51.806137,http://www.welhat.gov.uk/map?getmap=true&scale=750&location=524228.666015625^213445.471969504&layersidentifier=413defcc58484fc0b9dc9938242d79c7&menuconfig=Live,1.2,not owned by a public authority,,permissioned,reserved matters approval,2016-12-16,Permission reference 6/2016/1975/RM | http://planning.welhat.gov.uk/plandisp.aspx?recno=65660,125,125,yes,,2017-12-15,2017-12-15,
http://opendatacommunities.org/id/district-council/welwyn-hatfield,WGC120a,Welwyn Garden City-Former QEII Hospital Howlands,-0.186303,51.782724,http://www.welhat.gov.uk/map?getmap=true&scale=2500&location=525215.892089844^210892.827636719&layersidentifier=1830c827bc494cf6b189166713265796&menuconfig=Live,4.92,not owned by a public authority,,permissioned,reserved matters approval,2016-02-15,Permission reference 6/2015/1901/RM | http://planning.welhat.gov.uk/plandisp.aspx?recno=63027,124,124,yes,Total site capacity 163 dwellings - 39 dwellings completed as of 31 March 2018.,2017-12-15,2018-12-13,
http://opendatacommunities.org/id/district-council/welwyn-hatfield,WGC109,Welwyn Garden City-Ratcliff Tail Lift Site Bessemer Road,-0.191128,51.81035,http://www.welhat.gov.uk/map?getmap=true&scale=1250&location=524806.500488281^213966.249511719&layersidentifier=f0629b073daa49948b798fee2ad92ac5&menuconfig=Live,2.19,not owned by a public authority,,not permissioned,,,Assessed in 2016 HELAA - Site Hal03| Proposed allocation in Submission Local Plan - Site HS4,110,110,yes,,2017-12-15,2017-12-15,
http://opendatacommunities.org/id/district-council/welwyn-hatfield,WGC135d,Welwyn Garden City-Xerox Campus Bessemer Road (New build-East Blocks X1 and X4),-0.196909,51.805799,http://www.welhat.gov.uk/map?getmap=true&scale=1250&location=524438.274902344^213443.649902344&layersidentifier=8db43eaf2123442b8a114741c922fc7f&menuconfig=Live,1.25,not owned by a public authority,,permissioned,reserved matters approval,2016-12-16,Permission reference 6/2016/1176/RM | http://planning.welhat.gov.uk/plandisp.aspx?recno=64862,110,110,yes,,2017-12-15,2017-12-15,
http://opendatacommunities.org/id/district-council/welwyn-hatfield,WGC123,Welwyn Garden City-Town Centre North SPD Site,-0.2056,51.802839,http://www.welhat.gov.uk/map?getmap=true&scale=1250&location=523815.785644531^213104.564453125&layersidentifier=cd2dc7b5df9549c7b1c22115c60731ce&menuconfig=Live,1.42,mixed ownership,,not permissioned,,,Assessed in 2016 HELAA - Site Han40 | Proposed allocation in Submission Local Plan - Site MUS1,100,100,,The majority of the site is owned by a public authority but parts are privately owned.,2017-12-15,2017-12-15,
http://opendatacommunities.org/id/district-council/welwyn-hatfield,Hat102,Hatfield-Highview (Hilltop) SPD Site,-0.234075,51.748552,http://www.welhat.gov.uk/map?getmap=true&scale=1250&location=521998.476074219^207011.575195313&layersidentifier=66ec249f742a4b63bf602a976b97d6ba&menuconfig=Live,1.85,owned by a public authority,,not permissioned,,,Assessed in 2016 HELAA - Site HW100 | Proposed allocation in Submission Local Plan - Site MUS3,87,87,yes,,2017-12-15,2017-12-15,
http://opendatacommunities.org/id/district-council/welwyn-hatfield,WGC135a,Welwyn Garden City-Xerox Campus Bessemer Road (Bus/Entp/Devt Centre-Prior approval),-0.197862,51.806272,http://www.welhat.gov.uk/map?getmap=true&scale=1250&location=524344.780761719^213483.504394531&layersidentifier=25bf402c65224a4ea43af149a6092910&menuconfig=Live,1.51,not owned by a public authority,,permissioned,other,2015-07-09,Permission reference N6/2015/1049/OR | http://planning.welhat.gov.uk/plandisp.aspx?recno=28608,70,70,yes,Total site capacity 210 dwellings - 140 dwellings completed as of 31 March 2018.,2017-12-15,2018-12-13,
http://opendatacommunities.org/id/district-council/welwyn-hatfield,Hat101b,Hatfield-1-9 Town Centre,-0.224762,51.763618,http://www.welhat.gov.uk/map?getmap=true&scale=750&location=522602.906738281^208700.045898438&layersidentifier=d3e2470c97bf416aabc90767d6f9230c&menuconfig=Live,0.82,owned by a public authority,,pending decision,,,Assessed in 2016 HELAA - Site HC100b | Proposed allocation in Submission Local Plan - Site MUS2,66,66,yes,,2017-12-15,2017-12-15,
http://opendatacommunities.org/id/district-council/welwyn-hatfield,Hat136,Hatfield-Comet Hotel St Albans Road West,-0.244511,51.759967,http://www.welhat.gov.uk/map?getmap=true&scale=1250&location=521250.819335938^208244.749755859&layersidentifier=8c48c07399474e11bed7ec4cda5a267c&menuconfig=Live,1.6,not owned by a public authority,,permissioned,full planning permission,2016-10-13,Permission reference 6/2016/1739/MAJ | http://planning.welhat.gov.uk/plandisp.aspx?recno=65424,124,124,yes,"""310 bed spaces, equal to 124 dwelling equivalents when applying the 2.5:1 ratio as outlined in the Housing Delivery Measurement Rulebook, published by MHCLG in July 2018.""",2017-12-15,2017-12-15,
http://opendatacommunities.org/id/district-council/welwyn-hatfield,Hat111,Hatfield-L Kahn Manufacturing Wellfield Road,-0.227115,51.766432,http://www.welhat.gov.uk/map?getmap=true&scale=750&location=522441.875^209011.300292969&layersidentifier=6ea3977c36b244e8856d939d3981e24f&menuconfig=Live,0.88,not owned by a public authority,,not permissioned,,,Assessed in 2016 HELAA - Site HE23 | Proposed allocation in Submission Local Plan - Site HS14,62,62,,,2017-12-15,2017-12-15,
http://opendatacommunities.org/id/district-council/welwyn-hatfield,WGC140,Welwyn Garden City-Inspira House Martinfield,-0.191705,51.801358,http://www.welhat.gov.uk/map?getmap=true&scale=750&location=524779.609375^212956.903320313&layersidentifier=6b2f822adc13427981d5796897636ca4&menuconfig=Live,0.42,not owned by a public authority,,permissioned,other,2017-05-30,Permission reference 6/2017/0818/PN11 | http://planning.welhat.gov.uk/plandisp.aspx?recno=84241,54,54,yes,,2017-12-15,2017-12-15,
http://opendatacommunities.org/id/district-council/welwyn-hatfield,WGC141,Welwyn Garden City-51 Bridge Road East,-0.1946,51.80122,http://www.welhat.gov.uk/map?getmap=true&scale=750&location=524590.975097656^212935.649902344&layersidentifier=fa4181689b2b4a8f93018ce0edaa0c20&menuconfig=Live,0.64,not owned by a public authority,,permissioned,other,2018-05-29,Permission reference 6/2017/2104/MAJ | http://planning.welhat.gov.uk/plandisp.aspx?recno=85571,54,54,yes,"""Included previously under permission reference 6/2017/1301/PN11, new permission was granted in May 2018, net dwellings increased from 38 to 54 to reflect new permission.""",2017-12-15,2018-12-13,
http://opendatacommunities.org/id/district-council/welwyn-hatfield,WGC135c,Welwyn Garden City-Xerox Campus Bessemer Road (Entp/Devt Centre-Additional units),-0.197378,51.806058,http://www.welhat.gov.uk/map?getmap=true&scale=750&location=524380.348632813^213471.460449219&layersidentifier=89143ac42fc74f159c77bdfa23724b1a&menuconfig=Live,0.4,not owned by a public authority,,permissioned,full planning permission,2016-06-02,Permission reference 6/2015/2213/MAJ | http://planning.welhat.gov.uk/plandisp.aspx?recno=63338,44,44,yes,,2017-12-15,2017-12-15,
http://opendatacommunities.org/id/district-council/welwyn-hatfield,WGC137,Welwyn Garden City-Mercury House 1 Broadwater Road,-0.198293,51.801648,http://www.welhat.gov.uk/map?getmap=true&scale=750&location=524328.954589844^212977.604492188&layersidentifier=9db8764537464c999c492322bd600d05&menuconfig=Live,0.24,not owned by a public authority,,permissioned,full planning permission,2017-08-17,Permission reference 6/2016/2624/MAJ | http://planning.welhat.gov.uk/plandisp.aspx?recno=83309,43,43,yes,,2017-12-15,2017-12-15,
http://opendatacommunities.org/id/district-council/welwyn-hatfield,WGC135g,Welwyn Garden City-Rank Xerox Technical Centre Bessemer Road Block X6,-0.200454,51.784319,http://www.welhat.gov.uk/map?getmap=true&scale=750&location=524216.335037279^213511.180076774&layersidentifier=07a4245f591f48b3a69be6396ca0a205&menuconfig=Live,0.57,not owned by a public authority,,permissioned,full planning permission,2018-01-30,Permission reference 6/2017/1568/MAJ | http://planning.welhat.gov.uk/plandisp.aspx?recno=85033,38,38,yes,,2018-12-13,2018-12-13,
http://opendatacommunities.org/id/district-council/welwyn-hatfield,WGC104d,Welwyn Garden City-Broadwater Road West SPD Site (Central-Roche Building),-0.20126,51.79812,http://www.welhat.gov.uk/map?getmap=true&scale=750&location=524133.881835938^212579.763671875&layersidentifier=90a82cfc591d4947992a019cf99e4c7d&menuconfig=Live,0.61,not owned by a public authority,,pending decision,,,Permission reference 6/2016/1882/FULL | http://planning.welhat.gov.uk/plandisp.aspx?recno=65567,34,34,yes,,2017-12-15,2017-12-15,
http://opendatacommunities.org/id/district-council/welwyn-hatfield,WGC114,Welwyn Garden City-80 Bridge Road East,-0.192979,51.799597,http://www.welhat.gov.uk/map?getmap=true&scale=750&location=524702.3359375^212757.813964844&layersidentifier=cd7dcbc906654a41828207972abceb4b&menuconfig=Live,0.45,not owned by a public authority,,not permissioned,,,Assessed in 2016 HELAA - Site Pea08 | Proposed allocation in Submission Local Plan - Site HS3,32,32,yes,,2017-12-15,2017-12-15,
http://opendatacommunities.org/id/district-council/welwyn-hatfield,WGC135f,Welwyn Garden City-Xerox Campus Bessemer Road (New Build-Central Block X5),-0.198611,51.80569,http://www.welhat.gov.uk/map?getmap=true&scale=750&location=524291.400390625^213429.729003906&layersidentifier=d53c88addd5e433ba318ed2765050be8&menuconfig=Live,0.26,not owned by a public authority,,permissioned,full planning permission,2017-04-20,Permission reference 6/2016/2690/MAJ | http://planning.welhat.gov.uk/plandisp.aspx?recno=83375,30,30,yes,,2017-12-15,2017-12-15,
http://opendatacommunities.org/id/district-council/welwyn-hatfield,Wel007d,Welwyn-The Frythe (Phase 4-West),-0.223975,51.820221,http://www.welhat.gov.uk/map?getmap=true&scale=2500&location=522530.536621094^214996.601074219&layersidentifier=67784ae318784358b16ef499a38ab6c2&menuconfig=Live,5.92,not owned by a public authority,,permissioned,reserved matters approval,2014-10-14,Permission reference N6/2014/0208/DE | http://planning.welhat.gov.uk/plandisp.aspx?recno=57341,27,27,yes,Total site capacity 104 - 77 dwellings completed as of 31 March 2018.,2017-12-15,2018-12-13,
http://opendatacommunities.org/id/district-council/welwyn-hatfield,WGC136,Welwyn Garden City-37 Broadwater Road,-0.200142,51.797819,http://www.welhat.gov.uk/map?getmap=true&scale=750&location=524211.540039063^212549.925292969&layersidentifier=0ab6284e08fe438ea46b63a1a202e0a9&menuconfig=Live,0.22,not owned by a public authority,,permissioned,full planning permission,2017-04-27,Permission reference 6/2016/2497/MAJ | http://planning.welhat.gov.uk/plandisp.aspx?recno=66179,24,24,yes,,2017-12-15,2017-12-15,
http://opendatacommunities.org/id/district-council/welwyn-hatfield,WGC132b,Welwyn Garden City-Highways House 41-45 Broadwater Road (North),-0.200363,51.797381,http://www.welhat.gov.uk/map?getmap=true&scale=750&location=524197.021972656^212501.4453125&layersidentifier=327b0f8b8a004cc8a1f1b4f746240f05&menuconfig=Live,0.38,not owned by a public authority,,permissioned,full planning permission,2015-11-20,Permission reference N6/2015/0034/MA | http://planning.welhat.gov.uk/plandisp.aspx?recno=12842,23,23,yes,,2017-12-15,2017-12-15,
http://opendatacommunities.org/id/district-council/welwyn-hatfield,Hat107,Hatfield-Garages off Garden Avenue,-0.23116,51.743095,http://www.welhat.gov.uk/map?getmap=true&scale=750&location=522217.899902344^206400.209228516&layersidentifier=a97b63c7a8e940ecbf9f3a9cc37987d9&menuconfig=Live,0.34,owned by a public authority,,permissioned,full planning permission,2015-03-05,Permission reference S6/2014/2179/MA | http://planning.welhat.gov.uk/plandisp.aspx?recno=61084,22,22,yes,,2017-12-15,2017-12-15,
http://opendatacommunities.org/id/district-council/welwyn-hatfield,WGC119,Welwyn Garden City-St Michaels House Holwell Road,-0.193635,51.794077,http://www.welhat.gov.uk/map?getmap=true&scale=750&location=524670.550292969^212146.875&layersidentifier=a608a75f8f8c41758cbee59a9f565682&menuconfig=Live,0.43,owned by a public authority,,not permissioned,,,Assessed in 2016 HELAA - Site Pea24 | Proposed allocation in Submission Local Plan - Site HS8,22,22,,,2017-12-15,2017-12-15,
http://opendatacommunities.org/id/district-council/welwyn-hatfield,Hat126,Hatfield-Colonial House 87 Great North Road,-0.215374,51.768322,http://www.welhat.gov.uk/map?getmap=true&scale=750&location=523243.050292969^209251.699707031&layersidentifier=3d20bf20b45b46f790d718afc1ff6707&menuconfig=Live,0.11,not owned by a public authority,,permissioned,full planning permission,2014-12-05,Permission reference S6/2014/1541/MA | http://planning.welhat.gov.uk/plandisp.aspx?recno=59793,20,20,yes,,2017-12-15,2017-12-15,
http://opendatacommunities.org/id/district-council/welwyn-hatfield,Hat129b,Hatfield-GE Site Great North Road (South),-0.215304,51.766433,http://www.welhat.gov.uk/map?getmap=true&scale=250&location=523251.448730469^209034.600097656&layersidentifier=72c9b8e3a6c44fd4a5aa410c7a64a1be&menuconfig=Live,0.1,not owned by a public authority,,permissioned,full planning permission,2016-08-18,Permission reference 6/2015/1774/MAJ | http://planning.welhat.gov.uk/plandisp.aspx?recno=62898,18,18,yes,,2017-12-15,2017-12-15,
http://opendatacommunities.org/id/district-council/welwyn-hatfield,Hat104,Hatfield-Car park and shops north of Salisbury Square,-0.214316,51.76319,http://www.welhat.gov.uk/map?getmap=true&scale=1250&location=523330.073242188^208661.104492188&layersidentifier=f393f8aef6e64cec90f5172198f8bf52&menuconfig=Live,0.94,,,permissioned,full planning permission,2013-01-30,Permission reference S6/2011/1994/MA | http://planning.welhat.gov.uk/plandisp.aspx?recno=55173,17,17,,"""The ownership of the majority of the site is known, those parts being Mixed Ownership - however, Certificate C was completed when planning permission was applied for meaning that some landowners are unknown.""",2017-12-15,2017-12-15,
http://opendatacommunities.org/id/district-council/welwyn-hatfield,WGC139,Welwyn Garden City-Accord House 28 Bridge Road East,-0.197761,51.801523,http://www.welhat.gov.uk/map?getmap=true&scale=750&location=524364.785644531^212966.635742188&layersidentifier=db31cb457c53498bb7f164971501791a&menuconfig=Live,0.19,not owned by a public authority,,permissioned,other,2017-05-23,Permission reference 6/2017/0525/PN11 | http://planning.welhat.gov.uk/plandisp.aspx?recno=83953,17,17,yes,,2017-12-15,2017-12-15,
http://opendatacommunities.org/id/district-council/welwyn-hatfield,WGC116,Welwyn Garden City-Hyde Valley House Hyde Valley,-0.191894,51.790831,http://www.welhat.gov.uk/map?getmap=true&scale=750&location=524799.1796875^211784.1328125&layersidentifier=df6530db25104743890a168c42a4e670&menuconfig=Live,0.25,mixed ownership,,not permissioned,,,Assessed in 2016 HELAA - Site Hol19 | Proposed allocation in Submission Local Plan - Site HS5,17,17,yes,"""The freeholder of the site is a public authority, but the site also has an outstanding lease to a private body for a period in excess of 15 years - that private body is therefore also an owner in accordance with Regulation 4 of the Brownfield Land Register Regulations 2017. As such, the site has mixed ownership.""",2017-12-15,2017-12-15,
http://opendatacommunities.org/id/district-council/welwyn-hatfield,Hat139a,Hatfield-36 Salisbury Square (First and second floor conversion),-0.214927,51.763145,http://www.welhat.gov.uk/map?getmap=true&scale=250&location=523286.124023438^208667.524902344&layersidentifier=36ad39dd50a746c58b3529c74d8e78ac&menuconfig=Live,0.07,not owned by a public authority,,permissioned,other,2017-08-31,Permission reference 6/2017/1176/PN11 | http://planning.welhat.gov.uk/plandisp.aspx?recno=84633,16,16,yes,,2017-12-15,2017-12-15,
http://opendatacommunities.org/id/district-council/welwyn-hatfield,Hat137,Hatfield-41-43 Roe Green Lane,-0.239364,51.760411,http://www.welhat.gov.uk/map?getmap=true&scale=750&location=521607.600097656^208324.125&layersidentifier=842a4eb9c59743a3a79efd3f22b32ebe&menuconfig=Live,0.12,not owned by a public authority,,permissioned,full planning permission,2017-03-15,Permission reference 6/2016/0345/MAJ | http://planning.welhat.gov.uk/plandisp.aspx?recno=64045,14,14,yes,,2017-12-15,2017-12-15,
http://opendatacommunities.org/id/district-council/welwyn-hatfield,Hat113,Hatfield-Garages at Hollyfield,-0.229522,51.74459,http://www.welhat.gov.uk/map?getmap=true&scale=750&location=522328.491699219^206574.243896484&layersidentifier=55f04ae1683b4184956dfcd69ddec4a8&menuconfig=Live,0.27,owned by a public authority,,not permissioned,,,Assessed in 2016 HELAA - Site HS31 | Proposed allocation in Submission Local Plan - Site HS10,14,14,yes,,2017-12-15,2017-12-15,
http://opendatacommunities.org/id/district-council/welwyn-hatfield,WGC138a,Welwyn Garden City-Fountain House Howardsgate (Office to residential conversion),-0.20803,51.80238,http://www.welhat.gov.uk/map?getmap=true&scale=250&location=523665.80078125^213044.854492188&layersidentifier=d83cdd31fd56427e8b23a318bd601563&menuconfig=Live,0.05,not owned by a public authority,,permissioned,other,2017-09-25,Permission reference 6/2017/1687/FULL | http://planning.welhat.gov.uk/plandisp.aspx?recno=85150,14,14,yes,,2017-12-15,2017-12-15,
http://opendatacommunities.org/id/district-council/welwyn-hatfield,BrP105,Brookmans Park-Land north of Green Close,-0.204539,51.722908,http://www.welhat.gov.uk/map?getmap=true&scale=750&location=524117.610839844^204198.153808594&layersidentifier=2151d6fe46344ed198e3efc47ac70a9e&menuconfig=Live,0.16,not owned by a public authority,,permissioned,full planning permission,2016-08-16,Permission reference 6/2016/0192/MAJ | http://planning.welhat.gov.uk/plandisp.aspx?recno=63892,12,12,yes,,2017-12-15,2017-12-15,
http://opendatacommunities.org/id/district-council/welwyn-hatfield,Cuf108,Cuffley-Cuffley Motor Company Station Road,-0.108555,51.708424,http://www.welhat.gov.uk/map?getmap=true&scale=250&location=530785.150390625^202768.388061523&layersidentifier=ecb3fa95504042948118231c62d59866&menuconfig=Live,0.1,not owned by a public authority,,permissioned,,,Permission reference 6/2016/0887/MAJ | http://planning.welhat.gov.uk/plandisp.aspx?recno=64574,12,12,yes,,2017-12-15,2017-12-15,
http://opendatacommunities.org/id/district-council/welwyn-hatfield,Wel007c,Welwyn-The Frythe (Phase 3-Main House Conversion),-0.223595,51.820287,http://www.welhat.gov.uk/map?getmap=true&scale=750&location=522528.846191406^215006.518066406&layersidentifier=802c4d52c2314f21ba5677bba39832a9&menuconfig=Live,0.39,not owned by a public authority,,permissioned,reserved matters approval,2014-04-04,Permission reference N6/2013/2727/DE | http://planning.welhat.gov.uk/plandisp.aspx?recno=56939,12,12,yes,,2017-12-15,2017-12-15,
http://opendatacommunities.org/id/district-council/welwyn-hatfield,WGC131b,Welwyn Garden City-Stonehills House Stonehills (Additional units),-0.205141,51.801968,http://www.welhat.gov.uk/map?getmap=true&scale=750&location=523855.199707031^213003.350097656&layersidentifier=213589a9c4d14d80b5a732bb78f4099e&menuconfig=Live,0.13,not owned by a public authority,,permissioned,full planning permission,2016-09-08,Permission reference 6/2016/0818/MAJ | http://planning.welhat.gov.uk/plandisp.aspx?recno=64505,12,12,yes,,2017-12-15,2017-12-15,
http://opendatacommunities.org/id/district-council/welwyn-hatfield,Hat106,Hatfield-Meridian House The Common,-0.230383,51.762938,http://www.welhat.gov.uk/map?getmap=true&scale=750&location=522219.183105469^208619.217773438&layersidentifier=7b4eb5c42b3245919054b957a8f4c95e&menuconfig=Live,0.1,owned by a public authority,,not permissioned,,,Assessed in 2016 HELAA - Site HC11,9,9,yes,"""In relation to OwnershipStatus, under Schedule 19 of the Equalities Act 2010 the owner of this site is a public authority by virtue of being an institution within the higher education sector.""",2017-12-15,2017-12-15,
http://opendatacommunities.org/id/district-council/welwyn-hatfield,WGC145,Welwyn Garden City-Diocesan Education Centre Hall Grove,-0.180607,51.789756,http://www.welhat.gov.uk/map?getmap=true&scale=750&location=525579.170724238^211691.657842843&layersidentifier=2dbf04e4d8cf4d3fb59092ee590055a6&menuconfig=Live,0.25,not owned by a public authority,,permissioned,full planning permission,2018-10-12,Permission reference 6/2018/1029/FULL | http://planning.welhat.gov.uk/plandisp.aspx?recno=87574,9,9,yes,,2018-12-13,2018-12-13,
http://opendatacommunities.org/id/district-council/welwyn-hatfield,Hat127,Hatfield-Garages off Hillcrest,-0.230453,51.758542,http://www.welhat.gov.uk/map?getmap=true&scale=750&location=522223.556640625^208131.649902344&layersidentifier=cea443b308414ab79a359f139dcb6aa0&menuconfig=Live,0.26,not owned by a public authority,,permissioned,full planning permission,2016-03-31,Permission reference S6/2015/1035/FP | http://planning.welhat.gov.uk/plandisp.aspx?recno=28408,8,8,yes,,2017-12-15,2017-12-15,
http://opendatacommunities.org/id/district-council/welwyn-hatfield,WGC138b,Welwyn Garden City-Fountain House Howardsgate (Extension),-0.20803,51.80238,http://www.welhat.gov.uk/map?getmap=true&scale=250&location=523665.80078125^213044.854492188&layersidentifier=99c69b4f1f9f41eab211bb0d95717dd6&menuconfig=Live,0.05,not owned by a public authority,,permissioned,full planning permission,2017-11-13,Permission reference 6/2017/0400/FULL | http://planning.welhat.gov.uk/plandisp.aspx?recno=83829,8,8,yes,,2017-12-15,2017-12-15,
http://opendatacommunities.org/id/district-council/welwyn-hatfield,BrP033,Rural Areas-Swan Lodge Bell Lane Brookmans Park,-0.187835,51.733316,http://www.welhat.gov.uk/map?getmap=true&scale=250&location=525237.1796875^205401.375&layersidentifier=bbfe4f46e5d74b26ae501217953482be&menuconfig=Live,0.15,not owned by a public authority,,permissioned,full planning permission,2016-07-21,Permission reference 6/2016/0168/FULL | http://planning.welhat.gov.uk/plandisp.aspx?recno=63868,7,7,yes,,2017-12-15,2017-12-15,
http://opendatacommunities.org/id/district-council/welwyn-hatfield,NgS101,Rural Areas-Ponsbourne Riding School Ponsbourne Park Newgate Street,-0.112302,51.729671,http://www.welhat.gov.uk/map?getmap=true&scale=750&location=530456.970703125^205131.469970703&layersidentifier=a9fa5189edce49f2918d23e84fdbc47c&menuconfig=Live,0.51,not owned by a public authority,,permissioned,full planning permission,2018-08-23,Permission reference 6/2018/0598/MAJ | http://planning.welhat.gov.uk/plandisp.aspx?recno=87154,7,7,yes,"""Included previously under permission reference S6/2016/2706/MAJ, new permission was granted in August 2018 and net dwellings increased from 6 to 7 to reflect new permission.""",2017-12-15,2018-12-13,
http://opendatacommunities.org/id/district-council/welwyn-hatfield,WGC144,Welwyn Garden City-The East Great North Road,-0.224656,51.784687,http://www.welhat.gov.uk/map?getmap=true&scale=750&location=522556.525919323^211053.224625371&layersidentifier=330c76bb33034d5ab3016c389d937287&menuconfig=Live,0.24,not owned by a public authority,,permissioned,full planning permission,2018-07-17,Permission reference 6/2018/0494/FULL | http://planning.welhat.gov.uk/plandisp.aspx?recno=87050,7,7,yes,,2018-12-13,2018-12-13,
http://opendatacommunities.org/id/district-council/welwyn-hatfield,Cuf107,Cuffley-Land adjacent to 17 Station Road,-0.112509,51.708344,http://www.welhat.gov.uk/map?getmap=true&scale=250&location=530512.681640625^202753.42199707&layersidentifier=474041f35f1e40ed934f8dbc3b9854db&menuconfig=Live,0.02,not owned by a public authority,,permissioned,full planning permission,2016-02-04,Permission reference 6/2015/2333/FULL | http://planning.welhat.gov.uk/plandisp.aspx?recno=63458,5,5,yes,,2017-12-15,2017-12-15,
http://opendatacommunities.org/id/district-council/welwyn-hatfield,Hat138,Hatfield-Garages at Little Mead,-0.222714,51.771491,http://www.welhat.gov.uk/map?getmap=true&scale=750&location=522723.518066406^209582.928222656&layersidentifier=e62ba14c43ed4645bd6966f34ebe24fb&menuconfig=Live,0.16,owned by a public authority,,permissioned,full planning permission,2017-08-17,Permission reference 6/2017/0546/FULL | http://planning.welhat.gov.uk/plandisp.aspx?recno=83973,5,5,yes,,2017-12-15,2017-12-15,
