OrganisationURI,SiteReference,SiteNameAddress,GeoX,GeoY,SiteplanURL,Hectares,OwnershipStatus,HazardousSubstances,PlanningStatus,PermissionType,PermissionDate,PlanningHistory,NetDwellingsRangeFrom,NetDwellingsRangeTo,Deliverable,Notes,FirstAddedDate,LastUpdatedDate,EndDate
http://opendatacommunities.org/id/metropolitan-district-council/walsall,SHA0905,"Duke Mill, Refuge St, Shaw",-2.092789,53.574647,http://maps.oldham.gov.uk/WebMapLayers8/?x=391780.623753397&y=405043.490402522&resolution=0.2&MapName=Brownfield,1.54,not owned by a public authority,,not permissioned,,,,86,86,,"Potential site identified as suitable, available and achievable in the published SHLAA",2017-12-22,2018-11-22,
http://opendatacommunities.org/id/metropolitan-district-council/wolverhampton,SHA1002,"Land at jct Belmont and Franklin Sts, Oldham",-2.117661,53.54703,http://maps.oldham.gov.uk/WebMapLayers8/?x=391780.623753397&y=405043.490402522&resolution=0.2&MapName=Brownfield,0.59,owned by a public authority,,not permissioned,,,,24,24,,"Potential site identified as suitable, available and achievable in the published SHLAA",2017-12-22,2018-11-22,
http://opendatacommunities.org/id/metropolitan-district-council/oldham,SHA1006,"Land at Mosshey St, Shaw",-2.154928,53.535333,http://maps.oldham.gov.uk/WebMapLayers8/?x=391780.623753397&y=405043.490402522&resolution=0.2&MapName=Brownfield,0.27,not owned by a public authority,,not permissioned,,,,8,8,,"Potential site identified as suitable, available and achievable in the published SHLAA",2017-12-22,2018-11-22,
http://opendatacommunities.org/id/metropolitan-district-council/oldham,SHA1026,"Vernon Works (Fir Mill), Highbarn Rd, Royton",-2.119501,53.545333,http://maps.oldham.gov.uk/WebMapLayers8/?x=391780.623753397&y=405043.490402522&resolution=0.2&MapName=Brownfield,2.19,not owned by a public authority,,not permissioned,,,,40,40,,"Potential site identified as suitable, available and achievable in the published SHLAA",2017-12-22,2018-11-22,
http://opendatacommunities.org/id/metropolitan-district-council/oldham,SHA1066,"Land btw Prince St, Rhodes Bank, Union St, Oldham",-2.092128,53.549968,http://maps.oldham.gov.uk/WebMapLayers8/?x=391780.623753397&y=405043.490402522&resolution=0.2&MapName=Brownfield,0.12,mixed ownership,,not permissioned,,,,15,15,,"Potential site identified as suitable, available and achievable in the published SHLAA",2017-12-22,2018-11-22,
http://opendatacommunities.org/id/metropolitan-district-council/calderdale,SHA1067,"Land at Roscoe St, Oldham",-2.105467,53.541029,http://maps.oldham.gov.uk/WebMapLayers8/?x=391780.623753397&y=405043.490402522&resolution=0.2&MapName=Brownfield,0.23,mixed ownership,,not permissioned,,,,18,18,,"Potential site identified as suitable, available and achievable in the published SHLAA",2017-12-22,2018-11-22,
http://opendatacommunities.org/id/metropolitan-district-council/kirklees,SHA1068,"Corner of Bridge St and Roscoe St, Oldham",-2.105918,53.540669,http://maps.oldham.gov.uk/WebMapLayers8/?x=391780.623753397&y=405043.490402522&resolution=0.2&MapName=Brownfield,0.25,not owned by a public authority,,not permissioned,,,,20,20,,"Potential site identified as suitable, available and achievable in the published SHLAA",2017-12-22,2018-11-22,
http://opendatacommunities.org/id/metropolitan-district-council/leeds,SHA1069,"CAB, Bridge St, Oldham",-2.120556,53.567485,http://maps.oldham.gov.uk/WebMapLayers8/?x=391780.623753397&y=405043.490402522&resolution=0.2&MapName=Brownfield,0.03,not owned by a public authority,,not permissioned,,,,9,9,,"Potential site identified as suitable, available and achievable in the published SHLAA",2017-12-22,2018-11-22,
http://opendatacommunities.org/id/metropolitan-district-council/oldham,SHA1080,"Our Lady's RC High School, Roman Rd, Royton",-2.100823,53.551952,http://maps.oldham.gov.uk/WebMapLayers8/?x=391780.623753397&y=405043.490402522&resolution=0.2&MapName=Brownfield,1.43,owned by a public authority,,not permissioned,,,,33,33,,"Potential site identified as suitable, available and achievable in the published SHLAA; Site area does not include open space",2017-12-22,2018-11-22,
http://opendatacommunities.org/id/metropolitan-district-council/oldham,SHA1084,"Royton Health Centre (former), Royton",-1.989133,53.572076,http://maps.oldham.gov.uk/WebMapLayers8/?x=391780.623753397&y=405043.490402522&resolution=0.2&MapName=Brownfield,0.28,owned by a public authority,,not permissioned,,,,8,8,,"Potential site identified as suitable, available and achievable in the published SHLAA",2017-12-22,2018-11-22,
http://opendatacommunities.org/id/metropolitan-district-council/oldham,SHA1128,"Bridge House, Lees Road",-2.07258,53.567441,http://maps.oldham.gov.uk/WebMapLayers8/?x=391780.623753397&y=405043.490402522&resolution=0.2&MapName=Brownfield,0.1,not owned by a public authority,,not permissioned,,,,5,5,,"Potential site identified as suitable, available and achievable in the published SHLAA",2017-12-22,2018-11-22,
http://opendatacommunities.org/id/metropolitan-district-council/oldham,SHA1217,"Harrop Court Mill, Harrop Court Rd, Diggle",-2.151477,53.511938,http://maps.oldham.gov.uk/WebMapLayers8/?x=391780.623753397&y=405043.490402522&resolution=0.2&MapName=Brownfield,0.8,not owned by a public authority,,not permissioned,,,,22,22,,"Potential site identified as suitable, available and achievable in the published SHLAA",2017-12-22,2018-11-22,
http://opendatacommunities.org/id/metropolitan-district-council/oldham,SHA1225,"Land-Higher Memorial Park, Joseph St, Failsworth",-2.139301,53.518847,http://maps.oldham.gov.uk/WebMapLayers8/?x=391780.623753397&y=405043.490402522&resolution=0.2&MapName=Brownfield,0.26,owned by a public authority,,not permissioned,,,,10,10,,"Potential site identified as suitable, available and achievable in the published SHLAA",2017-12-22,2018-11-22,
http://opendatacommunities.org/id/metropolitan-district-council/oldham,SHA1314,"Mecca Bingo Block, Cnr Union St, King St, Oldham",-2.004865,53.550289,http://maps.oldham.gov.uk/WebMapLayers8/?x=391780.623753397&y=405043.490402522&resolution=0.2&MapName=Brownfield,1.77,mixed ownership,,not permissioned,,,,142,142,,"Potential site identified as suitable, available and achievable in the published SHLAA",2017-12-22,2018-11-22,
http://opendatacommunities.org/id/metropolitan-district-council/oldham,SHA1331,"Orme Mill/ Longrange Mill, Greenacres Road, Lees",-1.98845,53.53005,http://maps.oldham.gov.uk/WebMapLayers8/?x=391780.623753397&y=405043.490402522&resolution=0.2&MapName=Brownfield,1.22,not owned by a public authority,,not permissioned,,,,36,36,,"Potential site identified as suitable, available and achievable in the published SHLAA",2017-12-22,2018-11-22,
http://opendatacommunities.org/id/metropolitan-district-council/oldham,SHA1332,"Majestic Mill, Greenacres Road, Lees",-2.10537,53.542777,http://maps.oldham.gov.uk/WebMapLayers8/?x=391780.623753397&y=405043.490402522&resolution=0.2&MapName=Brownfield,0.96,not owned by a public authority,,not permissioned,,,,36,36,,"Potential site identified as suitable, available and achievable in the published SHLAA",2017-12-22,2018-11-22,
http://opendatacommunities.org/id/metropolitan-district-council/oldham,SHA1370,"Bus turnaround, High Street, Uppermill",-2.064204,53.54585,http://maps.oldham.gov.uk/WebMapLayers8/?x=391780.623753397&y=405043.490402522&resolution=0.2&MapName=Brownfield,0.13,owned by a public authority,,not permissioned,,,,7,7,,"Potential site identified as suitable, available and achievable in the published SHLAA",2017-12-22,2018-11-22,
http://opendatacommunities.org/id/metropolitan-district-council/oldham,SHA1372,"Former Lancaster House, Rochdale Rd, Royton",-2.104872,53.541777,http://maps.oldham.gov.uk/WebMapLayers8/?x=391780.623753397&y=405043.490402522&resolution=0.2&MapName=Brownfield,0.1,owned by a public authority,,not permissioned,,,,5,5,,"Potential site identified as suitable, available and achievable in the published SHLAA",2017-12-22,2018-11-22,
http://opendatacommunities.org/id/metropolitan-district-council/oldham,SHA1384,"Former CPD Centre, Rosary Road",-2.119429,53.551681,http://maps.oldham.gov.uk/WebMapLayers8/?x=391780.623753397&y=405043.490402522&resolution=0.2&MapName=Brownfield,1.71,owned by a public authority,,not permissioned,,,,51,51,,"Potential site identified as suitable, available and achievable in the published SHLAA",2017-12-22,2018-11-22,
http://opendatacommunities.org/id/metropolitan-district-council/oldham,SHA1599,"Austerlands Mill, Austerlands",-2.10635,53.526197,http://maps.oldham.gov.uk/WebMapLayers8/?x=391780.623753397&y=405043.490402522&resolution=0.2&MapName=Brownfield,0.91,not owned by a public authority,,not permissioned,,,,58,58,,"Potential site identified as suitable, available and achievable in the published SHLAA",2017-12-22,2018-11-22,
http://opendatacommunities.org/id/metropolitan-district-council/oldham,SHA1606,"Maple Mill 1, Cardwell Street",-2.099995,53.549923,http://maps.oldham.gov.uk/WebMapLayers8/?x=391780.623753397&y=405043.490402522&resolution=0.2&MapName=Brownfield,2.19,not owned by a public authority,,not permissioned,,,,123,123,,"Potential site identified as suitable, available and achievable in the published SHLAA",2017-12-22,2018-11-22,
http://opendatacommunities.org/id/metropolitan-district-council/oldham,SHA1630,"Former Cromford Mill site, Oldham",-2.127448,53.524208,http://maps.oldham.gov.uk/WebMapLayers8/?x=391780.623753397&y=405043.490402522&resolution=0.2&MapName=Brownfield,0.63,owned by a public authority,,not permissioned,,,,25,25,,"Potential site identified as suitable, available and achievable in the published SHLAA",2017-12-22,2018-11-22,
http://opendatacommunities.org/id/metropolitan-district-council/oldham,SHA1660,"Heron Mill, Heron St, Hollinwood",-2.087684,53.595405,http://maps.oldham.gov.uk/WebMapLayers8/?x=391780.623753397&y=405043.490402522&resolution=0.2&MapName=Brownfield,1.92,not owned by a public authority,,not permissioned,,,,108,108,,"Potential site identified as suitable, available and achievable in the published SHLAA",2017-12-22,2018-11-22,
http://opendatacommunities.org/id/metropolitan-district-council/oldham,SHA1667,"Jubilee (Woodbottom) Mill, Milnrow Rd, Shaw",-2.139405,53.532329,http://maps.oldham.gov.uk/WebMapLayers8/?x=391780.623753397&y=405043.490402522&resolution=0.2&MapName=Brownfield,0.92,not owned by a public authority,,not permissioned,,,,52,52,,"Potential site identified as suitable, available and achievable in the published SHLAA",2017-12-22,2018-11-22,
http://opendatacommunities.org/id/metropolitan-district-council/oldham,SHA1716,"United Mill, Werneth",-2.010084,53.538757,http://maps.oldham.gov.uk/WebMapLayers8/?x=391780.623753397&y=405043.490402522&resolution=0.2&MapName=Brownfield,0.2,not owned by a public authority,,not permissioned,,,,11,11,,"Potential site identified as suitable, available and achievable in the published SHLAA",2017-12-22,2018-11-22,
http://opendatacommunities.org/id/metropolitan-district-council/oldham,SHA1723,"Wellington Mills (Knoll Mill), Greenfield",-2.12446,53.550008,http://maps.oldham.gov.uk/WebMapLayers8/?x=391780.623753397&y=405043.490402522&resolution=0.2&MapName=Brownfield,0.17,not owned by a public authority,,not permissioned,,,,10,10,,"Potential site identified as suitable, available and achievable in the published SHLAA",2017-12-22,2018-11-22,
http://opendatacommunities.org/id/metropolitan-district-council/oldham,SHA1725,"Werneth Mills, Henley St, Werneth",-2.104432,53.543654,http://maps.oldham.gov.uk/WebMapLayers8/?x=391780.623753397&y=405043.490402522&resolution=0.2&MapName=Brownfield,2.47,not owned by a public authority,,not permissioned,,,,139,139,,"Potential site identified as suitable, available and achievable in the published SHLAA",2017-12-22,2018-11-22,
http://opendatacommunities.org/id/metropolitan-district-council/oldham,SHA1792,"Land at Regent, Beech, Wallshaw & Partington Sts",-2.116826,53.539993,http://maps.oldham.gov.uk/WebMapLayers8/?x=391780.623753397&y=405043.490402522&resolution=0.2&MapName=Brownfield,0.31,not owned by a public authority,,not permissioned,,,,25,25,,"Potential site identified as suitable, available and achievable in the published SHLAA",2017-12-22,2018-11-22,
http://opendatacommunities.org/id/metropolitan-district-council/oldham,SHA1797,"Kings House, King St, Oldham",-2.123916,53.544274,http://maps.oldham.gov.uk/WebMapLayers8/?x=391780.623753397&y=405043.490402522&resolution=0.2&MapName=Brownfield,0.01,not owned by a public authority,,not permissioned,,,,10,10,,"Potential site identified as suitable, available and achievable in the published SHLAA",2017-12-22,2018-11-22,
http://opendatacommunities.org/id/metropolitan-district-council/oldham,SHA1858,"Land off Mark St., West End St, Oldham",-2.008816,53.536492,http://maps.oldham.gov.uk/WebMapLayers8/?x=391780.623753397&y=405043.490402522&resolution=0.2&MapName=Brownfield,0.07,owned by a public authority,,not permissioned,,,,6,6,,"Potential site identified as suitable, available and achievable in the published SHLAA",2017-12-22,2018-11-22,
http://opendatacommunities.org/id/metropolitan-district-council/oldham,SHA1992,"Greenfield Conservative Club, Chew Valley Rd",-2.111596,53.530516,http://maps.oldham.gov.uk/WebMapLayers8/?x=391780.623753397&y=405043.490402522&resolution=0.2&MapName=Brownfield,0.17,not owned by a public authority,,not permissioned,,,,7,7,,"Potential site identified as suitable, available and achievable in the published SHLAA",2017-12-22,2018-11-22,
http://opendatacommunities.org/id/metropolitan-district-council/oldham,SHA1997,"Boston House, Broadway Street",-2.117513,53.542743,http://maps.oldham.gov.uk/WebMapLayers8/?x=391780.623753397&y=405043.490402522&resolution=0.2&MapName=Brownfield,0.51,owned by a public authority,,not permissioned,,,,14,14,,"Potential site identified as suitable, available and achievable in the published SHLAA",2017-12-22,2018-11-22,
http://opendatacommunities.org/id/metropolitan-district-council/oldham,SHA2000,Town Centre Western Gateway-SITE A,-2.116951,53.541288,http://maps.oldham.gov.uk/WebMapLayers8/?x=391780.623753397&y=405043.490402522&resolution=0.2&MapName=Brownfield,2.12,owned by a public authority,,not permissioned,,,,329,329,,"Potential site identified as suitable, available and achievable in the published SHLAA",2017-12-22,2018-11-22,
http://opendatacommunities.org/id/metropolitan-district-council/oldham,SHA2001,Town Centre Western Gateway-SITE B,-2.10867,53.542922,http://maps.oldham.gov.uk/WebMapLayers8/?x=391780.623753397&y=405043.490402522&resolution=0.2&MapName=Brownfield,1.27,not owned by a public authority,,not permissioned,,,,495,495,,"Potential site identified as suitable, available and achievable in the published SHLAA",2017-12-22,2018-11-22,
http://opendatacommunities.org/id/metropolitan-district-council/oldham,SHA2002,Rock Street Site-SITE C,-2.104974,53.543222,http://maps.oldham.gov.uk/WebMapLayers8/?x=391780.623753397&y=405043.490402522&resolution=0.2&MapName=Brownfield,1.27,mixed ownership,,not permissioned,,,,147,147,,"Potential site identified as suitable, available and achievable in the published SHLAA",2017-12-22,2018-11-22,
http://opendatacommunities.org/id/metropolitan-district-council/oldham,SHA2015,"Land Between Beever St and Regent St, Oldham",-2.103639,53.540168,http://maps.oldham.gov.uk/WebMapLayers8/?x=391780.623753397&y=405043.490402522&resolution=0.2&MapName=Brownfield,0.46,not owned by a public authority,,not permissioned,,,,37,37,,"Potential site identified as suitable, available and achievable in the published SHLAA",2017-12-22,2018-11-22,
http://opendatacommunities.org/id/metropolitan-district-council/oldham,SHA2016,Southlink-land at,-2.120234,53.565625,http://maps.oldham.gov.uk/WebMapLayers8/?x=391780.623753397&y=405043.490402522&resolution=0.2&MapName=Brownfield,5.76,mixed ownership,,not permissioned,,,,450,450,,"Potential site identified as suitable, available and achievable in the published SHLAA",2017-12-22,2018-11-22,
http://opendatacommunities.org/id/metropolitan-district-council/oldham,SHA2017,"Land at Flint St, Marble St, Oldham",-2.121818,53.561761,http://maps.oldham.gov.uk/WebMapLayers8/?x=391780.623753397&y=405043.490402522&resolution=0.2&MapName=Brownfield,0.26,owned by a public authority,,not permissioned,,,,10,10,,"Potential site identified as suitable, available and achievable in the published SHLAA",2017-12-22,2018-11-22,
http://opendatacommunities.org/id/metropolitan-district-council/oldham,SHA2019,"Highbarn House, Royton Site H",-2.106521,53.540408,http://maps.oldham.gov.uk/WebMapLayers8/?x=391780.623753397&y=405043.490402522&resolution=0.2&MapName=Brownfield,0.28,owned by a public authority,,not permissioned,,,,11,11,,"Potential site identified as suitable, available and achievable in the published SHLAA",2017-12-22,2018-11-22,
http://opendatacommunities.org/id/metropolitan-district-council/oldham,SHA2031,"Land to S. of 64 Bridge Street, Rhodes Bank",-2.146829,53.523934,http://maps.oldham.gov.uk/WebMapLayers8/?x=391780.623753397&y=405043.490402522&resolution=0.2&MapName=Brownfield,0.08,not owned by a public authority,,not permissioned,,,,6,6,,"Potential site identified as suitable, available and achievable in the published SHLAA",2017-12-22,2018-11-22,
http://opendatacommunities.org/id/metropolitan-district-council/oldham,SHA2032,Sellers Business Park,-2.110541,53.582874,http://maps.oldham.gov.uk/WebMapLayers8/?x=391780.623753397&y=405043.490402522&resolution=0.2&MapName=Brownfield,2.19,not owned by a public authority,,not permissioned,,,,61,61,,"Potential site identified as suitable, available and achievable in the published SHLAA",2017-12-22,2018-11-22,
http://opendatacommunities.org/id/metropolitan-district-council/oldham,SHA2043,"Car Park, Rear 394-410 Rochdale Rd (Waggon and Horses), Shaw",-2.091499,53.578639,http://maps.oldham.gov.uk/WebMapLayers8/?x=391780.623753397&y=405043.490402522&resolution=0.2&MapName=Brownfield,0.17,owned by a public authority,,not permissioned,,,,5,5,,"Potential site identified as suitable, available and achievable in the published SHLAA",2017-12-22,2018-11-22,
http://opendatacommunities.org/id/metropolitan-district-council/oldham,SHA2046,"M K Pilling Ltd, Hayden Street, Crossley Street, Shaw, OL2 8EN",-2.101866,53.52444,http://maps.oldham.gov.uk/WebMapLayers8/?x=391780.623753397&y=405043.490402522&resolution=0.2&MapName=Brownfield,0.14,not owned by a public authority,,not permissioned,,,,10,10,,"Potential site identified as suitable, available and achievable in the published SHLAA",2017-12-22,2018-11-22,
http://opendatacommunities.org/id/metropolitan-district-council/oldham,SHA2047,"Fytton Arms Inn, The Green, Oldham, OL8 2LT",-2.103158,53.547116,http://maps.oldham.gov.uk/WebMapLayers8/?x=391780.623753397&y=405043.490402522&resolution=0.2&MapName=Brownfield,0.2,not owned by a public authority,,not permissioned,,,,16,16,,"Potential site identified as suitable, available and achievable in the published SHLAA",2017-12-22,2018-11-22,
http://opendatacommunities.org/id/metropolitan-district-council/oldham,SHA2049,"157 Egerton Street, Oldham, OL1 3QJ",-2.107537,53.542429,http://maps.oldham.gov.uk/WebMapLayers8/?x=391780.623753397&y=405043.490402522&resolution=0.2&MapName=Brownfield,0.03,not owned by a public authority,,not permissioned,,,,7,7,,"Potential site identified as suitable, available and achievable in the published SHLAA",2017-12-22,2018-11-22,
http://opendatacommunities.org/id/metropolitan-district-council/oldham,SHA2051,"87-89 Yorkshire Street, Oldham, OL1 3ST",-2.087784,53.592726,http://maps.oldham.gov.uk/WebMapLayers8/?x=391780.623753397&y=405043.490402522&resolution=0.2&MapName=Brownfield,0.04,not owned by a public authority,,not permissioned,,,,12,12,,"Potential site identified as suitable, available and achievable in the published SHLAA",2017-12-22,2018-11-22,
http://opendatacommunities.org/id/metropolitan-district-council/oldham,SHA2052,"Jubilee Inn, Milnrow Road, Shaw, OL2 8BL",-2.065804,53.536393,http://maps.oldham.gov.uk/WebMapLayers8/?x=391780.623753397&y=405043.490402522&resolution=0.2&MapName=Brownfield,0.1,not owned by a public authority,,not permissioned,,,,5,5,,"Potential site identified as suitable, available and achievable in the published SHLAA",2017-12-22,2018-11-22,
http://opendatacommunities.org/id/metropolitan-district-council/oldham,SHA2055,"Wood End House, Atherton Street, Springhead, OL4 5TQ",-2.075105,53.548719,http://maps.oldham.gov.uk/WebMapLayers8/?x=391780.623753397&y=405043.490402522&resolution=0.2&MapName=Brownfield,0.19,not owned by a public authority,,not permissioned,,,,9,9,,"Potential site identified as suitable, available and achievable in the published SHLAA",2017-12-22,2018-11-22,
http://opendatacommunities.org/id/metropolitan-district-council/oldham,SHA2058,"Land bounded by Brideoake/Heywood St./Greenacres Rd., Waterhead (PEZ 19 Greenacres Road)",-2.165027,53.506383,http://maps.oldham.gov.uk/WebMapLayers8/?x=391780.623753397&y=405043.490402522&resolution=0.2&MapName=Brownfield,0.88,not owned by a public authority,,not permissioned,,,,35,35,,"Potential site identified as suitable, available and achievable in the published SHLAA",2017-12-22,2018-11-22,
http://opendatacommunities.org/id/metropolitan-district-council/oldham,SHA2059,"Land off Beresford St., Failsworth (PEZ 1 West Failsworth)",-2.168734,53.505883,http://maps.oldham.gov.uk/WebMapLayers8/?x=391780.623753397&y=405043.490402522&resolution=0.2&MapName=Brownfield,0.84,not owned by a public authority,,not permissioned,,,,34,34,,"Potential site identified as suitable, available and achievable in the published SHLAA",2017-12-22,2018-11-22,
http://opendatacommunities.org/id/metropolitan-district-council/oldham,SHA2060,"Land adj. Ivy House, Oldham Rd., Failsworth (PEZ 1 West Failsworth)",-2.137409,53.554254,http://maps.oldham.gov.uk/WebMapLayers8/?x=391780.623753397&y=405043.490402522&resolution=0.2&MapName=Brownfield,0.23,not owned by a public authority,,not permissioned,,,,9,9,,"Potential site identified as suitable, available and achievable in the published SHLAA",2017-12-22,2018-11-22,
