OrganisationURI,SiteReference,SiteNameAddress,GeoX,GeoY,SiteplanURL,Hectares,OwnershipStatus,HazardousSubstances,PlanningStatus,PermissionType,PermissionDate,PlanningHistory,NetDwellingsRangeFrom,NetDwellingsRangeTo,Deliverable,Notes,FirstAddedDate,LastUpdatedDate,EndDate
http://opendatacommunities.org/id/district-council/rushmoor,SHELAA ID: 8,"Union Street West Car Park, Union Street, Farnborough",-0.758112,51.295747,http://www.rushmoor.gov.uk/article/10524/Brownfield-land-register,0.25,owned by a public authority,,not permissioned,,,,40,40,yes,,2018-12-10,2019-12-09,
http://opendatacommunities.org/id/district-council/rushmoor,SHELAA ID: 9,"Union Street East Car Park, Union Street, Farnborough",-0.754301,51.295581,http://www.rushmoor.gov.uk/article/10524/Brownfield-land-register,0.08,owned by a public authority,,not permissioned,,,,8,8,,,2017-12-11,2019-12-09,
http://opendatacommunities.org/id/district-council/rushmoor,SHELAA ID: 15,"Farnborough Civic Quarter, Farnborough",-0.757203,51.289569,http://www.rushmoor.gov.uk/article/10524/Brownfield-land-register,4.27,mixed ownership,,pending decision,,,,700,700,yes,Decision pending on an outline application for the erection of up to 174 units across 8 storeys at the former Police Station site (ref: 18/00367/OUTPP).  Note that areas of non-brownfield land have been excluded,2017-12-11,2019-12-09,
http://opendatacommunities.org/id/district-council/rushmoor,SHELAA ID: 102,"Willow House, 23 Grosvenor Road, Aldershot",-0.766873,51.248701,http://www.rushmoor.gov.uk/article/10524/Brownfield-land-register,0.06,not owned by a public authority,,not permissioned,,,,23,23,,,2017-12-11,2019-12-09,
http://opendatacommunities.org/id/district-council/rushmoor,SHELAA ID: 110,"Progress House and Penmark House, Albert Road, Aldershot",-0.758301,51.247244,http://www.rushmoor.gov.uk/article/10524/Brownfield-land-register,0.07,not owned by a public authority,,not permissioned,,,,50,50,,,2017-12-11,2019-12-09,
http://opendatacommunities.org/id/district-council/rushmoor,SHELAA ID: 284,"Former Laundry, 53 Rectory Road, Farnborough",-0.744322,51.294935,http://www.rushmoor.gov.uk/article/10524/Brownfield-land-register,0.14,,,not permissioned,,,,5,5,,,2017-12-11,2019-12-09,
http://opendatacommunities.org/id/district-council/rushmoor,SHELAA ID: 304,"69 Gordon Road, Aldershot",-0.763784,51.245809,http://www.rushmoor.gov.uk/article/10524/Brownfield-land-register,0.06,not owned by a public authority,,permissioned,full planning permission,2018-07-13,,9,9,yes,Planning permission granted in July 2018 for the conversion of the existing building to provide 9 dwellings (ref. 18/00400/FULPP),2018-12-10,2019-12-09,2019-12-09
http://opendatacommunities.org/id/district-council/rushmoor,SHELAA ID: 320,"Car Park next to Scout Hall, Fleet Road, Farnborough",-0.778693,51.295236,http://www.rushmoor.gov.uk/article/10524/Brownfield-land-register,0.1,owned by a public authority,,not permissioned,,,,5,5,,,2017-12-11,2019-12-09,
http://opendatacommunities.org/id/district-council/rushmoor,SHELAA ID: 409,"16 Union Street, Aldershot",-0.766668,51.249382,http://www.rushmoor.gov.uk/article/10524/Brownfield-land-register,0.01,not owned by a public authority,,not permissioned,,,,6,6,,Active ground floor and town centre uses will be required as part of any development proposals,2018-12-10,2012-12-09,
http://opendatacommunities.org/id/district-council/rushmoor,SHELAA ID: 516,"The Crescent, Southwood Business Park, Summit Avenue, Farnborough",-0.78435,51.292831,http://www.rushmoor.gov.uk/article/10524/Brownfield-land-register,4.26,not owned by a public authority,,permissioned,full planning permission,2019-03-19,,159,159,yes,"Planning permission granted in March 2019 for the comprehensive redevelopment of the site, including the demolition of the existing buildings and the erection of 159 residential units (ref. 16/00837/FULPP)",2017-12-11,2019-12-09,
http://opendatacommunities.org/id/district-council/rushmoor,SHELAA ID: 518,"Meudon House, Meudon Avenue, Farnborough",-0.755828,51.287909,http://www.rushmoor.gov.uk/article/10524/Brownfield-land-register,2.04,not owned by a public authority,,permissioned,full planning permission,2019-03-08,,205,205,yes,Planning permission granted in March 2019 for the demolition of the existing building and the erection of 205 dwellings (ref. 18/00140/FULPP),2017-12-11,2019-12-09,
http://opendatacommunities.org/id/district-council/rushmoor,SHELAA ID: 548,"Ayling Hill/York Road, Aldershot",-0.773331,51.244003,http://www.rushmoor.gov.uk/article/10524/Brownfield-land-register,0.26,not owned by a public authority,,not permissioned,,,,24,24,,,2017-12-11,2019-12-09,
http://opendatacommunities.org/id/district-council/rushmoor,SHELAA ID: 550,"Former Garage Site at Bideford Close and Carmarthen Close, Farnborough",-0.767669,51.307898,http://www.rushmoor.gov.uk/article/10524/Brownfield-land-register,0.1,not owned by a public authority,,not permissioned,,,,5,5,,,2017-12-11,2019-12-09,
http://opendatacommunities.org/id/district-council/rushmoor,SHELAA ID: 554,"The Galleries Shopping Centre, High Street Multi-Storey Car Park and The Arcade, Aldershot",-0.763054,51.249524,http://www.rushmoor.gov.uk/article/10524/Brownfield-land-register,1.77,mixed ownership,,not permissioned,,,,500,500,yes,Active ground floor and town centre uses will be required as part of any development proposals,2017-12-11,2019-12-09,
http://opendatacommunities.org/id/district-council/rushmoor,SHELAA ID: 557,"Briarwood, Sorrel Close, Broadhurst, Farnborough",-0.794925,51.298686,http://www.rushmoor.gov.uk/article/10524/Brownfield-land-register,0.64,not owned by a public authority,,not permissioned,,,,14,14,,,2017-12-11,2019-12-09,
http://opendatacommunities.org/id/district-council/rushmoor,SHELAA ID: 563,"30 Grosvenor Road, Aldershot",-0.767287,51.248229,http://www.rushmoor.gov.uk/article/10524/Brownfield-land-register,0.08,owned by a public authority,,not permissioned,,,,11,11,,,2017-12-11,2019-12-09,2019-12-09
http://opendatacommunities.org/id/district-council/rushmoor,SHELAA ID: 572,"Blandford House and Malta Barracks, Shoe Lane, Aldershot",-0.764055,51.267232,http://www.rushmoor.gov.uk/article/10524/Brownfield-land-register,5.19,owned by a public authority,,pending decision,,,,165,165,,"The Council resolved to grant outline permission for up to 180 dwellings at the site in November 2019, subject to the completion of an s106 agreement (ref. 17/00914/OUTPP).  Note that areas of non-brownfield land have been excluded",2017-12-11,2019-12-09,
http://opendatacommunities.org/id/district-council/rushmoor,SHELAA ID: 575,"Meadowcroft, Whitchurch Close, Aldershot",-0.747004,51.232196,http://www.rushmoor.gov.uk/article/10524/Brownfield-land-register,0.28,owned by a public authority,,not permissioned,,,,9,9,,,2017-12-11,2019-12-09,
http://opendatacommunities.org/id/district-council/rushmoor,SHELAA ID: 577,"The Wellington Centre, Victoria Road, Aldershot",-0.764962,51.248897,http://www.rushmoor.gov.uk/article/10524/Brownfield-land-register,0.93,owned by a public authority,,not permissioned,,,,25,25,,"Proposals would need to be built upon the existing fabric of the building, and active ground floor and town centre uses would be expected to support the viability and vitality of the town centre",2017-12-11,2019-12-09,
http://opendatacommunities.org/id/district-council/rushmoor,SHELAA ID: 580,"Aldershot Bus Station, 3 Station Road, Aldershot",-0.760813,51.246533,http://www.rushmoor.gov.uk/article/10524/Brownfield-land-register,0.21,not owned by a public authority,,permissioned,full planning permission,2019-02-26,,32,32,yes,"Planning permission granted in February 2019 for the demolition of the existing bus station and the redevelopment of the site, with the erection of a mixed-use building comprising three commercial units on the ground floor and upper-floor residential use comprising 32 residential flats (ref. 16/00981/FULPP)",2017-12-11,2019-12-09,
http://opendatacommunities.org/id/district-council/rushmoor,SHELAA ID: 582,"Hippodrome House, Birchett Road, Aldershot",-0.762055,51.247778,http://www.rushmoor.gov.uk/article/10524/Brownfield-land-register,0.19,not owned by a public authority,,not permissioned,,,,70,70,,"Ground floor uses should continue to reflect the town centre designation, with an active mix of uses",2017-12-11,2019-12-09,
http://opendatacommunities.org/id/district-council/rushmoor,SHELAA ID: 583,"208 Farnborough Road, Farnborough",-0.752783,51.292337,http://www.rushmoor.gov.uk/article/10524/Brownfield-land-register,0.09,not owned by a public authority,,not permissioned,,,,7,7,,The existing doctors' surgery would need to be provided in an alternative location,2017-12-11,2019-12-09,
http://opendatacommunities.org/id/district-council/rushmoor,SHELAA ID: 584,"2 Salisbury Road, Farnborough",-0.752028,51.293713,http://www.rushmoor.gov.uk/article/10524/Brownfield-land-register,0.07,not owned by a public authority,,not permissioned,,,,6,6,,The existing doctors' surgery would need to be provided in an alternative location,2017-12-11,2019-12-09,2019-12-09
http://opendatacommunities.org/id/district-council/rushmoor,SHELAA ID: 590,"124 Victoria Road, Farnborough",-0.760458,51.292229,http://www.rushmoor.gov.uk/article/10524/Brownfield-land-register,1.73,not owned by a public authority,,not permissioned,,,,175,175,,,2017-12-11,2019-12-09,
http://opendatacommunities.org/id/district-council/rushmoor,SHELAA ID: 596,"117 Farnborough Road, Farnborough",-0.753974,51.287017,http://www.rushmoor.gov.uk/article/10524/Brownfield-land-register,1.09,not owned by a public authority,,permissioned,full planning permission,2019-10-03,,113,113,,Permission granted on appeal in October 2019 for the erection of extensions and alterations to the existing building to facilitate conversion and change of use to provide 113 dwellings (ref. 18/00466/FULPP),2017-12-11,2019-12-09,
http://opendatacommunities.org/id/district-council/rushmoor,SHELAA ID: 597,"DIO Accommodation Offices, Ordnance Road, Aldershot",-0.745609,51.25396,http://www.rushmoor.gov.uk/article/10524/Brownfield-land-register,0.43,owned by a public authority,,not permissioned,,,,15,15,,,2017-12-11,2019-12-09,
http://opendatacommunities.org/id/district-council/rushmoor,SHELAA ID: 598,"Aldershot Distribution Outlet, Ordnance Road, Aldershot",-0.742753,51.256241,http://www.rushmoor.gov.uk/article/10524/Brownfield-land-register,2.65,owned by a public authority,,not permissioned,,,,80,80,,,2017-12-11,2019-12-09,
http://opendatacommunities.org/id/district-council/rushmoor,SHELAA ID: 603,"1 Clockhouse Road, Farnborough",-0.753588,51.294369,http://www.rushmoor.gov.uk/article/10524/Brownfield-land-register,0.08,not owned by a public authority,,not permissioned,,,,6,6,,,2017-12-11,2019-12-09,2019-12-09
http://opendatacommunities.org/id/district-council/rushmoor,SHELAA ID: 604,"149-165 Victoria Road, Aldershot",-0.76542,51.24838,http://www.rushmoor.gov.uk/article/10524/Brownfield-land-register,0.15,not owned by a public authority,,not permissioned,,,,6,6,,,2017-12-11,2019-12-09,2019-12-09
http://opendatacommunities.org/id/district-council/rushmoor,SHELAA ID: 605,"73-77 High Street, Aldershot",-0.763447,51.249807,http://www.rushmoor.gov.uk/article/10524/Brownfield-land-register,0.07,not owned by a public authority,,permissioned,full planning permission,2017-12-20,,5,5,,Planning permission granted in December 2017 for the erection of first-floor and second-floor rear extensions and a rear-facing dormer and for the conversion of existing office space to provide 5 additional flats and 1 reconfigured flat (ref. 17/00824/FULPP),2017-12-11,2019-12-09,2019-12-09
http://opendatacommunities.org/id/district-council/rushmoor,SHELAA ID: 607,"Land at 68-70 Hawley Lane, Farnborough",-0.75496,51.311019,http://www.rushmoor.gov.uk/article/10524/Brownfield-land-register,0.35,not owned by a public authority,,not permissioned,,,,10,10,,,2017-12-11,2019-12-09,
http://opendatacommunities.org/id/district-council/rushmoor,SHELAA ID: 610,"The Old Warehouse, Star Yard, 182-192 Victoria Road, and 3 Cross Street, Aldershot",-0.766399,51.248741,http://www.rushmoor.gov.uk/article/10524/Brownfield-land-register,0.1,not owned by a public authority,,permissioned,full planning permission,2018-11-08,,14,14,yes,Planning permission granted in November 2018 for a two-storey extension and conversion of upper floors at 182-192 Victoria Road to provide 7 flats; the conversion of the existing warehouse building to provide 4 flats on the upper floors; and an extension to the Old Warehouse building to provide a further 3 flats (14 flats in total) (ref. 18/00481/FULPP),2018-12-10,2019-12-09,
http://opendatacommunities.org/id/district-council/rushmoor,SHELAA ID: 612,"Land adjacent to Green Hedges, Hawley Road, Farnborough",-0.766933,51.31878,http://www.rushmoor.gov.uk/article/10524/Brownfield-land-register,0.33,not owned by a public authority,,permissioned,full planning permission,2018-12-31,,10,10,yes,"Planning permission granted in December 2018 for the redevelopment of the site to provide 10 dwellings, comprising 6 two-bedroom and 4 three-bedroom units (ref. 18/00709/FULPP)",2018-12-10,2019-12-09,
http://opendatacommunities.org/id/district-council/rushmoor,SHELAA ID: 616,"Parsons Barracks Car Par, Ordnance Road, Aldershot",-0.757059,51.249191,http://www.rushmoor.gov.uk/article/10524/Brownfield-land-register,0.54,owned by a public authority,,not permissioned,,,,200,200,yes,,2018-12-10,2019-12-09,
http://opendatacommunities.org/id/district-council/rushmoor,SHELAA ID: 618,"Block 3 Queensmead, Farnborough",-0.755061,51.292433,http://www.rushmoor.gov.uk/article/10524/Brownfield-land-register,0.55,owned by a public authority,,permissioned,full planning permission,2019-07-23,,99,99,yes,"Planning permission granted in July 2019 for the partial demolition of Kingsmead Shopping Centre, the erection of an extension comprising retail use on the ground floor (3,108 sq. m) and 99 apartments over nine floors (19/00103/FUL)",2018-12-10,2019-12-09,
