OrganisationURI,OrganisationLabel,SiteReference,SiteNameAddress,GeoX,GeoY,SiteplanURL,Hectares,OwnershipStatus,HazardousSubstances,PlanningStatus,PermissionType,PermissionDate,PlanningHistory,NetDwellingsRangeFrom,NetDwellingsRangeTo,Deliverable,Notes,FirstAddedDate,LastUpdatedDate,EndDate
http://opendatacommunities.org/id/district-council/basildon,Basildon Borough Council,BAS0001,"Wickford Car Park, rear of High Street and Ladygate Centre",0.522207,51.612672,http://www.basildon.gov.uk/CHttpHandler.ashx?id=8535&p=0,0.78,owned by a public authority,,not permissioned,,,,19,19,yes,Deliverable within 4 years. 18/07/17. 24/08/18.,2017-07-18,2018-08-24,
http://opendatacommunities.org/id/district-council/basildon,Basildon Borough Council,BAS0002,"Car park 14, Laindon Link, South West of Roundacre, SS15 5UN",0.450125,51.568506,http://www.basildon.gov.uk/CHttpHandler.ashx?id=8536&p=0,1.35,not owned by a public authority,,not permissioned,,,,28,37,yes,Deliverable within 4 years. 19/07/17. 24/08/18.,2017-07-19,2018-08-24,
http://opendatacommunities.org/id/district-council/basildon,Basildon Borough Council,BAS0003,Land north of Dry Street (Area of Special Reserve – Saved Policy BAS S3),0.446296,51.555185,http://www.basildon.gov.uk/CHttpHandler.ashx?id=8537&p=0,3.52,not owned by a public authority,,permissioned,reserved matters approval,2015-08-27,https://planning.basildon.gov.uk/online-applications/search.do?action=simple&searchType=Application,80,80,yes,Permission already granted for a mixed scheme including housing which this site forms only a part of. Work commenced. Deliverable within 3 years. Only to be removed once completed. 19/07/17. 24/08/18.,2017-07-19,2018-08-24,
http://opendatacommunities.org/id/district-council/basildon,Basildon Borough Council,BAS0004,Thurrock and Basildon College Nethermayne Campus,0.449646,51.561401,http://www.basildon.gov.uk/CHttpHandler.ashx?id=8538&p=0,3.49,not owned by a public authority,,permissioned,reserved matters approval,2017-07-13,https://planning.basildon.gov.uk/online-applications/search.do?action=simple&searchType=Application,150,150,yes,Permission for housing granted for which this site forms only a part of. Works commenced. Only to be removed once completed. Deliverable within 5 years. 19/07/17. 24/08/18.,2017-07-19,2018-08-24,
http://opendatacommunities.org/id/district-council/basildon,Basildon Borough Council,BAS0005,"Community Hall off Witchards and Open Space rear of 26-45 Gun Hill Place and rear of 41-58 Wickham Place, Kingswood",0.465392,51.564195,http://www.basildon.gov.uk/CHttpHandler.ashx?id=8539&p=0,0.45,owned by a public authority,,not permissioned,,,,13,20,yes,Site area from HELAA reduced to Brownfield land only. Deliverable within 4 years. 19/07/17. 24/08/18.,2017-07-19,2018-08-24,
http://opendatacommunities.org/id/district-council/basildon,Basildon Borough Council,BAS0006,"Basildon Integrated Support Service (Lincewood County Infants School Annexe) High Road, Langdon Hills",0.422651,51.561971,http://www.basildon.gov.uk/CHttpHandler.ashx?id=8540&p=0,0.36,owned by a public authority,,not permissioned,,,,5,19,yes,Deliverable within 3 years. 19/07/17. 24/08/18.,2017-07-19,2018-08-24,
http://opendatacommunities.org/id/district-council/basildon,Basildon Borough Council,BAS0007,"Former Fryerns School and Social Services Offices, Broadmayne, Craylands, Basildon",0.486092,51.576211,http://www.basildon.gov.uk/CHttpHandler.ashx?id=8541&p=0,2.45,owned by a public authority,,not permissioned,,,,52,82,yes,Site area from HELAA reduced to Brownfield land only. Deliverable within 5 years. 20/07/17. 24/08/18.,2017-07-19,2018-08-24,
http://opendatacommunities.org/id/district-council/basildon,Basildon Borough Council,BAS0008,"1-31 Runwell Road, Wickford",0.523755,51.615382,http://www.basildon.gov.uk/CHttpHandler.ashx?id=8542&p=0,0.31,not owned by a public authority,,permissioned,full planning permission,2007-05-24,https://planning.basildon.gov.uk/online-applications/search.do?action=simple&searchType=Application,84,84,yes,Site area amended to match pp. Permission for housing granted and works commenced. Only to be removed once completed. Deliverable within 3 years. 20/07/17. 24/08/18.,2017-07-19,2018-08-24,
http://opendatacommunities.org/id/district-council/basildon,Basildon Borough Council,BAS0010,"Dipple Medical Centre and land east of Medical Centre, rear of 2-22 Gifford Green",0.505467,51.567642,http://www.basildon.gov.uk/CHttpHandler.ashx?id=8544&p=0,0.59,not owned by a public authority,,not permissioned,,,,8,26,yes,Site area from HELAA reduced to Brownfield land only. Deliverable within 3 years. 20/07/17. 24/08/18.,2017-07-20,2018-08-24,
http://opendatacommunities.org/id/district-council/basildon,Basildon Borough Council,BAS0011,"The Wickford Education Centre, Alderney Gardens, Wickford",0.518163,51.620044,http://www.basildon.gov.uk/CHttpHandler.ashx?id=8545&p=0,0.84,owned by a public authority,,not permissioned,,,,16,23,yes,Site area from HELAA reduced to Brownfield land only. Deliverable within 4 years. 21/07/17. 24/08/18.,2017-07-21,2018-08-24,
http://opendatacommunities.org/id/district-council/basildon,Basildon Borough Council,BAS0012,"Land at 157-167 Nevendon Road, Wickford",0.516439,51.604306,http://www.basildon.gov.uk/CHttpHandler.ashx?id=8546&p=0,0.54,owned by a public authority,,permissioned,full planning permission,2017-04-24,https://planning.basildon.gov.uk/online-applications/search.do?action=simple&searchType=Application,6,6,yes,Permission for housing granted on part of the site. Works commenced. Only to be removed once completed. Deliverable within 1 year. 21/07/17. 24/08/18.,2017-07-21,2018-08-24,
http://opendatacommunities.org/id/district-council/basildon,Basildon Borough Council,BAS0013,"Laindon Town Centre/shopping centre, Laindon High Road",0.423021,51.574086,http://www.basildon.gov.uk/CHttpHandler.ashx?id=8547&p=0,5.78,,,permissioned,full planning permission,2017-10-04,https://planning.basildon.gov.uk/online-applications/search.do?action=simple&searchType=Application,224,224,,Site area amended to match pp. Planning Permission granted. Expires 04/10/2020. Only to be removed once expired or completed. Deliverable within 6 years. 24/10/17. 24/08/18.,2017-07-21,2018-08-24,
http://opendatacommunities.org/id/district-council/basildon,Basildon Borough Council,BAS0014,"Alpha Garden Centre, London Road, Wickford",0.497056,51.611056,http://www.basildon.gov.uk/CHttpHandler.ashx?id=8548&p=0,1.94,not owned by a public authority,,not permissioned,,,,8,10,,Site area from HELAA reduced to Brownfield land only.  Deliverable within 6 years. 25/07/17. 24/08/18.,2017-07-21,2018-08-24,
http://opendatacommunities.org/id/district-council/basildon,Basildon Borough Council,BAS0015,"Basildon zoo site, London Road, Vange",0.471136,51.554592,http://www.basildon.gov.uk/CHttpHandler.ashx?id=8549&p=0,0.88,not owned by a public authority,,not permissioned,,,,5,5,,Site area from HELAA reduced to Brownfield land only.  Deliverable within 6 years. 25/07/17. 24/08/18.,2017-07-25,2018-08-24,
http://opendatacommunities.org/id/district-council/basildon,Basildon Borough Council,BAS0017,"Land at junction of Pound Land and Clarence Road, Basildon",0.533228,51.547026,http://www.basildon.gov.uk/CHttpHandler.ashx?id=8551&p=0,0.53,not owned by a public authority,,not permissioned,,,,5,5,,Deliverable within 6 years. 1no. existing dwelling. 26/07/17. 24/08/18.,2017-07-26,2018-08-24,
http://opendatacommunities.org/id/district-council/basildon,Basildon Borough Council,BAS0018,"Land south of Clarence Road, Bowers Gifford, Basildon",0.533816,51.574012,http://www.basildon.gov.uk/CHttpHandler.ashx?id=8552&p=0,0.31,not owned by a public authority,,not permissioned,,,,1,1,,Deliverable within 6 years. 1no. existing dwelling. 31/07/17. 24/08/18.,2017-07-31,2018-08-24,
http://opendatacommunities.org/id/district-council/basildon,Basildon Borough Council,BAS0019,"Land at The Elms, Cranfield Park Road, Wickford, SS12 9EP",0.526544,51.597983,http://www.basildon.gov.uk/CHttpHandler.ashx?id=8553&p=0,1.89,not owned by a public authority,,not permissioned,,,,8,8,,Deliverable within 6 years. 1no. existing dwelling. 02/08/17. 24/08/18.,2017-08-02,2018-08-24,
http://opendatacommunities.org/id/district-council/basildon,Basildon Borough Council,BAS0021,"245 Pound Lane, Bowers Gifford",0.531807,51.576807,http://www.basildon.gov.uk/CHttpHandler.ashx?id=8555&p=0,0.38,not owned by a public authority,,not permissioned,,,,2,2,,Deliverable within 6 years. 1no. existing dwelling. LDC granted for land use. 07/08/17. 24/08/18.,2017-08-07,2018-08-24,
http://opendatacommunities.org/id/district-council/basildon,Basildon Borough Council,BAS0022,"Land at Long Lynderswood, Basildon. SS15 5UN",0.451101,51.569959,http://www.basildon.gov.uk/CHttpHandler.ashx?id=8556&p=0,0.42,owned by a public authority,,permissioned,full planning permission,2017-01-24,https://planning.basildon.gov.uk/online-applications/search.do?action=simple&searchType=Application,20,20,yes,Planning Permission granted. Works commenced. Only to be removed once completed. Deliverable within 2 years. 07/08/17. 24/08/18.,2017-08-07,2018-08-24,
http://opendatacommunities.org/id/district-council/basildon,Basildon Borough Council,BAS0023,"1-30 Roman Way, Billericay. CM12 9LJ",0.418258,51.619195,http://www.basildon.gov.uk/CHttpHandler.ashx?id=8557&p=0,0.51,owned by a public authority,,permissioned,full planning permission,2017-02-15,https://planning.basildon.gov.uk/online-applications/search.do?action=simple&searchType=Application,-15,-15,yes,"Planning Permission granted. Works have commenced, Only to be removed once completed. 30no. existing dwellings. Deliverable within 2 years. 07/08/17. 24/08/18.",2017-08-07,2018-08-24,
http://opendatacommunities.org/id/district-council/basildon,Basildon Borough Council,BAS0024,"Land north west of 40-48 Cedar Avenue, Wickford",0.518132,51.603317,http://www.basildon.gov.uk/CHttpHandler.ashx?id=8558&p=0,0.16,owned by a public authority,,permissioned,full planning permission,2017-04-24,https://planning.basildon.gov.uk/online-applications/search.do?action=simple&searchType=Application,4,4,yes,Planning Permission granted. Works have not commenced and permission expires 24/04/2020. Only to be removed once completed or expired.  Deliverable within 1 year. 07/08/17. 24/08/18.,2017-08-07,2018-08-24,
http://opendatacommunities.org/id/district-council/basildon,Basildon Borough Council,BAS0025,"35 Glenmere, Basildon. SS16 4QR",0.479708,51.554915,http://www.basildon.gov.uk/CHttpHandler.ashx?id=8559&p=0,0.13,owned by a public authority,,permissioned,full planning permission,2017-11-08,https://planning.basildon.gov.uk/online-applications/search.do?action=simple&searchType=Application,5,5,yes,Planning permission granted. Works have not commenced and permission expires 8/11/20. Deliverable within 1 year. 09/11/17. 24/08/18.,2017-08-07,2018-08-24,
http://opendatacommunities.org/id/district-council/basildon,Basildon Borough Council,BAS0026,"Land including 1-35 Littlethorpe, Basildon. SS16 4LH",0.489033,51.56124,http://www.basildon.gov.uk/CHttpHandler.ashx?id=8560&p=0,0.51,owned by a public authority,,not permissioned,,,,7,16,yes,Deliverable within 4 years. 7no. existing dwellings. 07/08/17. 24/08/18.,2017-08-07,2018-08-24,
http://opendatacommunities.org/id/district-council/basildon,Basildon Borough Council,BAS0027,"Pitsea Housing Office/The Place, Northlands Pavement, Basildon. SS13 3DU",0.503796,51.566913,http://www.basildon.gov.uk/CHttpHandler.ashx?id=8561&p=0,0.71,owned by a public authority,,not permissioned,,,,17,31,yes,Deliverable within 4 years. 07/08/17. 24/08/18.,2017-08-07,2018-08-24,
http://opendatacommunities.org/id/district-council/basildon,Basildon Borough Council,BAS0028,"Swan Mead Centre, Church Road, Basildon. SS16 4AG",0.474641,51.568143,http://www.basildon.gov.uk/CHttpHandler.ashx?id=8562&p=0,0.32,owned by a public authority,,not permissioned,,,,9,10,yes,Site area from HELAA reduced to Brownfield land only. Deliverable within 4 years. 07/08/17. 24/08/18.,2017-08-07,2018-08-24,
http://opendatacommunities.org/id/district-council/basildon,Basildon Borough Council,BAS0029,"St Chad's Church, Clay Hill Road, Basildon",0.486281,51.56031,http://www.basildon.gov.uk/CHttpHandler.ashx?id=8563&p=0,0.42,owned by a public authority,,not permissioned,,,,11,18,yes,Deliverable within 4 years. 07/08/17. 24/08/18.,2017-08-07,2018-08-24,
http://opendatacommunities.org/id/district-council/basildon,Basildon Borough Council,BAS0030,"Garages located at Downey Close, Basildon. SS14 2NF",0.47199,51.574863,http://www.basildon.gov.uk/CHttpHandler.ashx?id=8564&p=0,0.17,owned by a public authority,,not permissioned,,,,5,5,yes,Deliverable within 3 years. 07/08/17. 31/08/18.,2017-08-07,2018-08-31,
http://opendatacommunities.org/id/district-council/basildon,Basildon Borough Council,BAS0031,"Garages located at Great Knightleys and Swan Close, Basildon. SS15 5GE",0.441382,51.573058,http://www.basildon.gov.uk/CHttpHandler.ashx?id=8565&p=0,0.22,owned by a public authority,,not permissioned,,,,5,7,yes,Deliverable within 3 years. 07/08/17. 31/08/18.,2017-08-07,2018-08-31,
http://opendatacommunities.org/id/district-council/basildon,Basildon Borough Council,BAS0032,"Garages to the south of 13 Falstones, Basildon. SS15 5BU",0.445631,51.571018,http://www.basildon.gov.uk/CHttpHandler.ashx?id=8566&p=0,0.19,owned by a public authority,,not permissioned,,,,4,6,yes,Deliverable within 3 years. 07/08/17. 31/08/18.,2017-08-07,2018-08-31,
http://opendatacommunities.org/id/district-council/basildon,Basildon Borough Council,BAS0033,"Garages to the north of 84 Falstones, Basildon. SS15 5BX",0.443531,51.571421,http://www.basildon.gov.uk/CHttpHandler.ashx?id=8567&p=0,0.15,owned by a public authority,,not permissioned,,,,3,5,yes,Deliverable within 3 years. 07/08/17. 31/08/18.,2017-08-07,2018-08-31,
http://opendatacommunities.org/id/district-council/basildon,Basildon Borough Council,BAS0034,"Garages to the north of 108 Falstones, Basildon. SS15 5DF",0.442107,51.570956,http://www.basildon.gov.uk/CHttpHandler.ashx?id=8568&p=0,0.3,owned by a public authority,,not permissioned,,,,7,10,yes,Deliverable within 3 years. 07/08/17. 31/08/18.,2017-08-07,2018-08-31,
http://opendatacommunities.org/id/district-council/basildon,Basildon Borough Council,BAS0035,"Garages to the north of 86 Paprills, Basildon. SS16 5QX",0.441623,51.565975,http://www.basildon.gov.uk/CHttpHandler.ashx?id=8569&p=0,0.28,owned by a public authority,,not permissioned,,,,4,9,yes,Deliverable within 3 years. 07/08/17. 31/08/18.,2017-08-07,2018-08-31,
http://opendatacommunities.org/id/district-council/basildon,Basildon Borough Council,BAS0036,"Garages north and west of 1 Cadogan Terrace, Basildon. SS13 2BD",0.515851,51.573544,http://www.basildon.gov.uk/CHttpHandler.ashx?id=8570&p=0,0.17,owned by a public authority,,not permissioned,,,,4,9,yes,Deliverable within 3 years. 07/08/17. 31/08/18.,2017-08-07,2018-08-31,
http://opendatacommunities.org/id/district-council/basildon,Basildon Borough Council,BAS0037,"Garages to the south of 11 Culverdown, Basildon. SS14 2AL",0.458822,51.573161,http://www.basildon.gov.uk/CHttpHandler.ashx?id=8571&p=0,0.21,owned by a public authority,,not permissioned,,,,6,7,yes,Deliverable within 3 years. 07/08/17. 31/08/18.,2017-08-07,2018-08-31,
http://opendatacommunities.org/id/district-council/basildon,Basildon Borough Council,BAS0038,"Garages to the west of 85 Great Mistley, Basildon. SS16 4BE",0.471276,51.565435,http://www.basildon.gov.uk/CHttpHandler.ashx?id=8572&p=0,0.17,owned by a public authority,,not permissioned,,,,5,9,yes,Deliverable within 3 years. 07/08/17. 31/08/18.,2017-08-07,2018-08-31,
http://opendatacommunities.org/id/district-council/basildon,Basildon Borough Council,BAS0039,"1A Bruce Grove, Wickford, Essex.",0.539203,51.608493,http://www.basildon.gov.uk/CHttpHandler.ashx?id=8573&p=0,0.94,not owned by a public authority,,permissioned,reserved matters approval,2018-04-18,https://planning.basildon.gov.uk/online-applications/search.do?action=simple&searchType=Application,49,49,yes,Outline and Reserved Matters permission  granted. Permission expires 18/04/2021. Only to be removed once expired or completed. Deliverable within 3 years. 05/09/17. 31/08/18.,2017-09-05,2018-09-03,
http://opendatacommunities.org/id/district-council/basildon,Basildon Borough Council,BAS0043,"Black Horse House, Bentalls, Basildon, Essex. SS14 3BY",0.456473,51.582069,http://www.basildon.gov.uk/CHttpHandler.ashx?id=8577&p=0,0.03,not owned by a public authority,,permissioned,other,2015-04-10,https://planning.basildon.gov.uk/online-applications/search.do?action=simple&searchType=Application,28,28,yes,Prior approval granted. Works have not commenced. Only to be removed once completed or expired 04/10/2020. Deliverable within 2 years. 20/09/17. 31/08/18.,2017-09-20,2018-09-03,
http://opendatacommunities.org/id/district-council/basildon,Basildon Borough Council,BAS0044,"2 Sun Street, Billericay, Essex. CM12 9LN",0.41638,51.621914,http://www.basildon.gov.uk/CHttpHandler.ashx?id=8578&p=0,0.12,not owned by a public authority,,permissioned,full planning permission,2016-02-08,https://planning.basildon.gov.uk/online-applications/search.do?action=simple&searchType=Application,13,13,yes,Planning Permission  granted. Works commenced. Only to be removed once completed. Deliverable within 2 years. 20/09/17.,2017-09-20,2018-09-03,
http://opendatacommunities.org/id/district-council/basildon,Basildon Borough Council,BAS0045,"Barn Farm, Cranfield Park Road, Wickford, Essex. SS12 9ES",0.529371,51.597922,http://www.basildon.gov.uk/CHttpHandler.ashx?id=8579&p=0,0.47,not owned by a public authority,,permissioned,full planning permission,2015-11-06,https://planning.basildon.gov.uk/online-applications/search.do?action=simple&searchType=Application,4,4,yes,Planning Permission granted. Works commenced. Only to be removed once completed. Deliverable within 1 year. 06/09/17. 31/08/18.,2017-09-06,2018-09-03,
http://opendatacommunities.org/id/district-council/basildon,Basildon Borough Council,BAS0046,"Northgate House, High Pavement, Basildon, Essex. SS14 1EA",0.457289,51.570585,http://www.basildon.gov.uk/CHttpHandler.ashx?id=8580&p=0,0.12,not owned by a public authority,,permissioned,other,2016-03-16,https://planning.basildon.gov.uk/online-applications/search.do?action=simple&searchType=Application,87,87,yes,Prior approval granted. Works commenced. Only to be removed once completed. Deliverable within 3 years. 20/09/17. 31/08/18.,2017-09-20,2018-09-03,
http://opendatacommunities.org/id/district-council/basildon,Basildon Borough Council,BAS0048,"21 Cavell Road, Billericay, Essex. CM11 2HR",0.432995,51.624071,http://www.basildon.gov.uk/CHttpHandler.ashx?id=8582&p=0,0.07,not owned by a public authority,,permissioned,full planning permission,2015-10-09,https://planning.basildon.gov.uk/online-applications/search.do?action=simple&searchType=Application,6,6,yes,Planning Permission  granted. Works have not commenced. Only to be removed once completed or expired 10/09/2018. Deliverable within 1 year. 20/09/17. 31/08/18.,2017-09-20,2018-09-03,
http://opendatacommunities.org/id/district-council/basildon,Basildon Borough Council,BAS0049,"Raybourne Cottage, Rectory Road, Billericay, Essex. CM12 9UA",0.410785,51.591848,http://www.basildon.gov.uk/CHttpHandler.ashx?id=8583&p=0,0.6,not owned by a public authority,,permissioned,full planning permission,2016-05-19,https://planning.basildon.gov.uk/online-applications/search.do?action=simple&searchType=Application,1,1,yes,Planning Permission  granted. Permission expires 19/05/2019. Only to be removed once expired or completed. Deliverable within 1 year. 06/09/17. 31/08/18.,2017-09-06,2018-09-03,
http://opendatacommunities.org/id/district-council/basildon,Basildon Borough Council,BAS0050,"Willowdale Centre, High Street, Wickford, Essex. SS12 0RA",0.519989,51.613367,http://www.basildon.gov.uk/CHttpHandler.ashx?id=8584&p=0,0.02,not owned by a public authority,,permissioned,full planning permission,2015-11-18,https://planning.basildon.gov.uk/online-applications/search.do?action=simple&searchType=Application,7,7,yes,Planning Permission  granted. Works commenced. Only to be removed once completed. Deliverable within 1 year. 20/09/17. 31/08/18.,2017-09-20,2018-09-03,
http://opendatacommunities.org/id/district-council/basildon,Basildon Borough Council,BAS0051,"78 High Street, Billericay, Essex. CM12 9BT",0.417832,51.62504,http://www.basildon.gov.uk/CHttpHandler.ashx?id=8585&p=0,0.08,not owned by a public authority,,permissioned,full planning permission,2016-04-12,https://planning.basildon.gov.uk/online-applications/search.do?action=simple&searchType=Application,5,5,yes,Planning Permission  granted. Permission expires 12/04/2019. Only to be removed once expired or completed. Deliverable within 1 year. 20/09/17. 31/08/18.,2017-09-20,2018-09-03,
http://opendatacommunities.org/id/district-council/basildon,Basildon Borough Council,BAS0052,"Diamond (Mechanical & Electrical) Engineering Services, Elm Court, Southend Road, Wickford, Essex. SS11 8DU",0.529466,51.612615,http://www.basildon.gov.uk/CHttpHandler.ashx?id=8586&p=0,0.16,not owned by a public authority,,permissioned,outline planning permission,2016-07-19,https://planning.basildon.gov.uk/online-applications/search.do?action=simple&searchType=Application,8,8,yes,Outline Permission granted. Permission expires 19/07/2019. Only to be removed once expired or completed. Deliverable within 1.5 years. 20/09/17. 31/08/18.,2017-09-20,2018-09-03,
http://opendatacommunities.org/id/district-council/basildon,Basildon Borough Council,BAS0053,"Independant House, Radford Business Centre, Radford Way, Billericay, Essex. CM12 0BZ",0.410477,51.631559,http://www.basildon.gov.uk/CHttpHandler.ashx?id=8587&p=0,0.03,not owned by a public authority,,permissioned,other,2016-07-15,https://planning.basildon.gov.uk/online-applications/search.do?action=simple&searchType=Application,9,9,yes,Prior approval granted. Works commenced. Only to be removed once completed. Deliverable within 1 year. 20/09/17. 31/08/18.,2017-09-20,2018-09-03,
http://opendatacommunities.org/id/district-council/basildon,Basildon Borough Council,BAS0054,"Craylands Estates And Former Fryerns School Site, Craylands, Basildon, Essex.",0.490931,51.577062,http://www.basildon.gov.uk/CHttpHandler.ashx?id=8588&p=0,35.51,not owned by a public authority,,permissioned,outline planning permission,2017-03-22,https://planning.basildon.gov.uk/online-applications/search.do?action=simple&searchType=Application,587,587,,Outline and Reserved Matters Permission granted. Works commenced. Only to be removed once completed. Deliverable within 8 years. 8.1ha of total is greenfield land. Loss of net dwellings through demolitions has not been included. 21/09/17. 31/08/18.,2017-09-21,2018-09-03,
http://opendatacommunities.org/id/district-council/basildon,Basildon Borough Council,BAS0055,"7-8 Willowdale Centre, High Street, Wickford, Essex. SS12 0RA",0.520029,51.613573,http://www.basildon.gov.uk/CHttpHandler.ashx?id=8590&p=0,0.06,not owned by a public authority,,permissioned,full planning permission,2017-01-16,https://planning.basildon.gov.uk/online-applications/search.do?action=simple&searchType=Application,6,6,yes,Planning Permission granted. Works commenced. Only to be removed once completed. Deliverable within 1 year. 21/09/17. 31/08/18.,2017-09-21,2018-09-03,
http://opendatacommunities.org/id/district-council/basildon,Basildon Borough Council,BAS0056,"Garage Block, Market Avenue, Wickford, Essex.",0.519069,51.614242,http://www.basildon.gov.uk/CHttpHandler.ashx?id=8591&p=0,0.08,not owned by a public authority,,permissioned,full planning permission,2017-03-09,https://planning.basildon.gov.uk/online-applications/search.do?action=simple&searchType=Application,5,5,yes,Planning Permission granted. Works commenced. Only to be removed once completed. Deliverable within 1 year. 21/09/17. 31/08/18.,2017-09-21,2018-09-03,
http://opendatacommunities.org/id/district-council/basildon,Basildon Borough Council,BAS0057,"Ryjo, Thames View, Langdon Hills, Basildon, Essex. SS16 5LN",0.425137,51.549311,http://www.basildon.gov.uk/CHttpHandler.ashx?id=8592&p=0,0.67,not owned by a public authority,,permissioned,full planning permission,2017-01-30,https://planning.basildon.gov.uk/online-applications/search.do?action=simple&searchType=Application,-1,-1,yes,Planning Permission granted. Permission expires 30/01/2020. Only to be removed once expired or completed. Deliverable within 1 year. 21/09/17. 31/08/18.,2017-09-21,2018-09-03,
http://opendatacommunities.org/id/district-council/basildon,Basildon Borough Council,BAS0058,"Superstore and Car Park, Mandeville Way, Laindon, Essex.",0.400022,51.567854,http://www.basildon.gov.uk/CHttpHandler.ashx?id=8680&p=0,2.59,not owned by a public authority,,not permissioned,,,,46,56,,Deliverable within 8 years. 14/09/18.,2018-09-14,2018-09-14,
http://opendatacommunities.org/id/district-council/basildon,Basildon Borough Council,BAS0059,"6, 8, 10, 12, 14 & 16 Pound Lane, Basildon, Essex. SS15 5SZ",0.432931,51.578306,http://www.basildon.gov.uk/CHttpHandler.ashx?id=8681&p=0,0.25,owned by a public authority,,not permissioned,,,,2,2,,Deliverable within 6 years. Six existing dwellings with potential for 8 so net increase of 2. 14/09/18.,2018-09-14,2018-09-14,
http://opendatacommunities.org/id/district-council/basildon,Basildon Borough Council,BAS0060,"Regent House, The Gore, Basildon, Essex. SS14 2DZ",0.455786,51.572665,http://www.basildon.gov.uk/CHttpHandler.ashx?id=8682&p=0,0.4,not owned by a public authority,,permissioned,full planning permission,2018-02-06,https://planning.basildon.gov.uk/online-applications/search.do?action=simple&searchType=Application,106,106,yes,Planning Permission granted. Permission expires 06/02/2021. Only to be removed once expired or completed. Deliverable within 5 years. 14/09/18.,2018-09-14,2018-09-14,
http://opendatacommunities.org/id/district-council/basildon,Basildon Borough Council,BAS0061,"Acorn House, Great Oaks, Basildon. SS14 1AH",0.458227,51.571771,http://www.basildon.gov.uk/CHttpHandler.ashx?id=8683&p=0,0.14,not owned by a public authority,,permissioned,full planning permission,2018-03-06,https://planning.basildon.gov.uk/online-applications/search.do?action=simple&searchType=Application,62,62,yes,Planning Permission granted. Permission expires 06/03/2021. Only to be removed once expired or completed. Deliverable within 3 years. 14/09/18.,2018-09-14,2018-09-14,
http://opendatacommunities.org/id/district-council/basildon,Basildon Borough Council,BAS0062,"1-4 Dunton Court, Aston Road, Laindon, Essex. SS15 6NX",0.421248,51.571547,http://www.basildon.gov.uk/CHttpHandler.ashx?id=8684&p=0,0.09,not owned by a public authority,,permissioned,other,2017-10-20,https://planning.basildon.gov.uk/online-applications/search.do?action=simple&searchType=Application,18,18,yes,Prior Approval granted. Permission expires 20/10/2022. Only to be removed once expired or completed. Deliverable within 2 years. 14/09/18.,2018-09-14,2018-09-14,
http://opendatacommunities.org/id/district-council/basildon,Basildon Borough Council,BAS0063,"31-33 The Broadway, Wickford, Essex. SS11 7AD",0.522599,51.614751,http://www.basildon.gov.uk/CHttpHandler.ashx?id=8685&p=0,0.07,not owned by a public authority,,permissioned,full planning permission,2017-09-04,https://planning.basildon.gov.uk/online-applications/search.do?action=simple&searchType=Application,6,6,yes,Planning Permission granted. Works have commenced. Only to be removed once completed. Deliverable within 1 year. 14/09/18.2,2018-09-14,2018-09-14,
http://opendatacommunities.org/id/district-council/basildon,Basildon Borough Council,BAS0064,"Claremont, London Road, Pitsea, Essex. SS13 2DB",0.515684,51.566099,http://www.basildon.gov.uk/CHttpHandler.ashx?id=8686&p=0,0.16,not owned by a public authority,,permissioned,full planning permission,2017-07-13,https://planning.basildon.gov.uk/online-applications/search.do?action=simple&searchType=Application,3,3,yes,Planning Permission granted. Permission expires 13/07/2020. Only to be removed once expired or completed. Deliverable within 1 year. 20/09/18.,2018-09-20,2018-09-20,
http://opendatacommunities.org/id/district-council/basildon,Basildon Borough Council,BAS0065,"139 Noak Hill Road, Great Burstead, Billericay, Essex. CM12 9UJ",0.422869,51.600529,http://www.basildon.gov.uk/CHttpHandler.ashx?id=8687&p=0,0.27,not owned by a public authority,,permissioned,outline planning permission,2017-10-03,https://planning.basildon.gov.uk/online-applications/search.do?action=simple&searchType=Application,7,7,yes,Planning Permission granted. Permission expires 03/10/2020. Only to be removed once expired or completed. Deliverable within 1 year. 20/09/18.,2018-09-20,2018-09-20,
http://opendatacommunities.org/id/district-council/basildon,Basildon Borough Council,BAS0066,"Pilgrim House, High Street, Billericay, Essex. CM12 9XY",0.415444,51.623251,http://www.basildon.gov.uk/CHttpHandler.ashx?id=8688&p=0,0.17,not owned by a public authority,,permissioned,other,2017-07-07,https://planning.basildon.gov.uk/online-applications/search.do?action=simple&searchType=Application,17,17,yes,Prior Approval granted. Expires 01/09/2022. Only to be removed once expired or completed. Deliverable within 1 year. 20/09/18.,2018-09-20,2018-09-20,
http://opendatacommunities.org/id/district-council/basildon,Basildon Borough Council,BAS0067,"Independant House, Radford Business Centre, Radford Way, Billericay, Essex. CM12 0BZ",0.410477,51.631559,http://www.basildon.gov.uk/CHttpHandler.ashx?id=8689&p=0,0.04,not owned by a public authority,,permissioned,full planning permission,2017-12-20,https://planning.basildon.gov.uk/online-applications/search.do?action=simple&searchType=Application,7,7,yes,Planning Permission granted. Permission expires 20/12/2020. Only to be removed once expired or completed. Deliverable within 1 year. 20/09/18.,2018-09-20,2018-09-20,
http://opendatacommunities.org/id/district-council/basildon,Basildon Borough Council,BAS0068,"Chestnuts Service Garage, Crays Hill, Billericay, Essex. CM11 2YA",0.474195,51.603641,http://www.basildon.gov.uk/CHttpHandler.ashx?id=8690&p=0,0.1,not owned by a public authority,,permissioned,full planning permission,2018-01-23,https://planning.basildon.gov.uk/online-applications/search.do?action=simple&searchType=Application,9,9,yes,Planning Permission granted. Permission expires 23/01/2021. Only to be removed once expired or completed. Deliverable within 1 year. 20/09/18.,2018-09-20,2018-09-20,
http://opendatacommunities.org/id/district-council/basildon,Basildon Borough Council,BAS0069,"Pembroke House, 11 Northlands Pavement, Pitsea, Essex. SS13 3DX",0.504271,51.566464,http://www.basildon.gov.uk/CHttpHandler.ashx?id=8691&p=0,0.18,not owned by a public authority,,permissioned,other,2016-06-10,https://planning.basildon.gov.uk/online-applications/search.do?action=simple&searchType=Application,32,32,yes,Prior Approval granted. Permission expires 10/06/2021. Only to be removed once expired or completed. Deliverable within 2 years. 20/09/18.,2018-09-20,2018-09-20,
http://opendatacommunities.org/id/district-council/basildon,Basildon Borough Council,BAS0070,"Pine Lodge, Gardiners Close, Basildon, Essex. SS14 3AN",0.481992,51.587157,http://www.basildon.gov.uk/CHttpHandler.ashx?id=8692&p=0,0.14,not owned by a public authority,,permissioned,full planning permission,2016-08-01,https://planning.basildon.gov.uk/online-applications/search.do?action=simple&searchType=Application,43,43,yes,Planning Permission granted. Works commenced. Only to be removed once completed. Deliverable within 3 years. 20/09/18.,2018-09-20,2018-09-20,
http://opendatacommunities.org/id/district-council/basildon,Basildon Borough Council,BAS0071,"1-29 Lower Southend Road, Wickford, Essex.",0.524594,51.614285,http://www.basildon.gov.uk/CHttpHandler.ashx?id=8693&p=0,0.34,not owned by a public authority,,permissioned,full planning permission,2010-05-14,https://planning.basildon.gov.uk/online-applications/search.do?action=simple&searchType=Application,179,179,,Planning Permission granted. Works commenced. Only to be removed once completed. Deliverable within 6 years. 20/09/18.,2018-09-20,2018-09-20,
