OrganisationURI,SiteReference,SiteNameAddress,GeoX,GeoY,SiteplanURL,Hectares,OwnershipStatus,HazardousSubstances,PlanningStatus,PermissionType,PermissionDate,PlanningHistory,NetDwellingsRangeFrom,NetDwellingsRangeTo,Deliverable,Notes,FirstAddedDate,LastUpdatedDate,EndDate
http://opendatacommunities.org/id/district-council/hastings,BL1,"Site of Mount Pleasant Hospital, Frederick Road, St Leonards",0.599822,50.869646,https://www.hastings.gov.uk/content/planning/planning_policy/pdfs/BL1.pdf,1.84,not owned by a public authority,,not permissioned,,,http://publicaccess.hastings.gov.uk/online-applications/applicationDetails.do?activeTab=summary&keyVal=_HSTBC_DCAPR_114879,40,40,,Refused planning application for half of the proposed site,2017-12-15,2018-12-17,
http://opendatacommunities.org/id/district-council/hastings,BL2,"123-125 West Hill Road, Hastings",0.540465,50.851932,https://www.hastings.gov.uk/content/planning/planning_policy/pdfs/BL2.pdf,0.7,not owned by a public authority,,permissioned,reserved matters approval,1989-09-11,http://publicaccess.hastings.gov.uk/online-applications/applicationDetails.do?activeTab=summary&keyVal=_HSTBC_DCAPR_3205,117,117,,. construction of multi-level apartment block containing 117 residential units with basement car parking,2017-12-15,2018-12-17,
http://opendatacommunities.org/id/district-council/hastings,BL3,"Hastings Station Yard (Part), Hastings (also known as Station Plaza, Station Approach, Devonshire Road)",0.579032,50.858544,https://www.hastings.gov.uk/content/planning/planning_policy/pdfs/BL3.pdf,0.44,not owned by a public authority,,permissioned,full planning permission,2009-11-11,http://publicaccess.hastings.gov.uk/online-applications/applicationDetails.do?activeTab=summary&keyVal=_HSTBC_DCAPR_84409,103,103,yes,Site is part of last uncompleted and unimplemented phase of larger station plaza redevelopment,2017-12-15,2018-12-17,
http://opendatacommunities.org/id/district-council/hastings,BL4,"Former Observer Building, 53 Cambridge Road, Hastings",0.575898,50.855317,https://www.hastings.gov.uk/content/planning/planning_policy/pdfs/BL4.pdf,0.07,not owned by a public authority,,permissioned,full planning permission,2018-06-18,http://publicaccess.hastings.gov.uk/online-applications/applicationDetails.do?activeTab=summary&keyVal=_HSTBC_DCAPR_103671,39,50,,". mixed use development  comprising Artist Studio (Lower Ground), Shared Residents Gymnasium (Mezzanine), Restaurant & Shop (Ground) and 50 flats with private roof terrace. Proposal includes ancillary reception, common facilities and cycle storage/ shared car parking with ancillary plant and servicing facilities and external alterations",2017-12-15,2018-12-17,
http://opendatacommunities.org/id/district-council/hastings,BL5,"Seaside Road, West St Leonards",0.536785,50.850457,https://www.hastings.gov.uk/content/planning/planning_policy/pdfs/BL5.pdf,2.22,owned by a public authority,,not permissioned,,,,120,120,,,2017-12-15,2018-12-17,
http://opendatacommunities.org/id/district-council/hastings,BL6,"Broomgrove Redevelopment area, Former Power Station, Ore Valley, Hastings",0.593313,50.868604,https://www.hastings.gov.uk/content/planning/planning_policy/pdfs/BL6.pdf,2.35,not owned by a public authority,,not permissioned,,,,50,50,,,2017-12-15,2018-12-17,
http://opendatacommunities.org/id/district-council/hastings,BL7,"12-19 Braybrooke Terrace, Hastings",0.574521,50.858272,https://www.hastings.gov.uk/content/planning/planning_policy/pdfs/BL7.pdf,0.23,not owned by a public authority,,not permissioned,,,,25,25,,,2017-12-15,2018-12-17,
http://opendatacommunities.org/id/district-council/hastings,BL8,"Taxi Office, Site of Former social club, St John's Road, St Leonards",0.561204,50.855647,https://www.hastings.gov.uk/content/planning/planning_policy/pdfs/BL8.pdf,0.12,not owned by a public authority,,not permissioned,,,,30,30,,,2017-12-15,2018-12-17,
http://opendatacommunities.org/id/district-council/hastings,BL9,"Site of Former Stills factory, Fellows Road, Ore Valley, Hastings",0.591943,50.869294,https://www.hastings.gov.uk/content/planning/planning_policy/pdfs/BL9.pdf,2.71,not owned by a public authority,,pending decision,,,http://publicaccess.hastings.gov.uk/online-applications/applicationDetails.do?activeTab=summary&keyVal=_HSTBC_DCAPR_114813,75,101,,,2017-12-15,2018-12-17,
http://opendatacommunities.org/id/district-council/hastings,BL10,"Site of former West St Leonards Primary School, Bexhill Road, Hastings",0.53228,50.852693,https://www.hastings.gov.uk/content/planning/planning_policy/pdfs/BL10.pdf,3.92,owned by a public authority,,pending decision,,,http://publicaccess.hastings.gov.uk/online-applications/applicationDetails.do?activeTab=summary&keyVal=_HSTBC_DCAPR_115732,100,100,,Application for health centre on part of the site,2017-12-15,2018-12-17,
http://opendatacommunities.org/id/district-council/hastings,BL11,"Gambier House, 111 West Hill Road, Hastings",0.543834,50.85174,https://www.hastings.gov.uk/content/planning/planning_policy/pdfs/BL11.pdf,0.23,not owned by a public authority,,not permissioned,,,,15,15,,,2017-12-15,2018-12-17,
http://opendatacommunities.org/id/district-council/hastings,BL12,"Site of Hollingsworth Garage, Braybrooke Road, Hastings",0.580382,50.860629,https://www.hastings.gov.uk/content/planning/planning_policy/pdfs/BL12.pdf,0.4,not owned by a public authority,,not permissioned,,,,56,56,,,2017-12-15,2018-12-17,
http://opendatacommunities.org/id/district-council/hastings,BL13,"Former Westerleigh School, Hollington Park Close, Hastings",0.54335,50.861657,https://www.hastings.gov.uk/content/planning/planning_policy/pdfs/BL13.pdf,2.15,not owned by a public authority,,not permissioned,,,,68,68,,,2017-12-15,2018-12-17,
http://opendatacommunities.org/id/district-council/hastings,BL15,"West Hill Road Reservoir, St Leonards",0.547441,50.851959,https://www.hastings.gov.uk/content/planning/planning_policy/pdfs/BL15.pdf,0.19,not owned by a public authority,,not permissioned,,,,14,14,,,2017-12-15,2018-12-17,
http://opendatacommunities.org/id/district-council/hastings,BL16,"Mount Denys, Pine Hill & Ridgeway, The Ridge, Hastings",0.595655,50.877524,https://www.hastings.gov.uk/content/planning/planning_policy/pdfs/BL16.pdf,0.64,owned by a public authority,,not permissioned,,,,31,31,,,2017-12-15,2018-12-17,
http://opendatacommunities.org/id/district-council/hastings,BL17,"Horntye Park, Bohemia Road, Hastings",0.564585,50.860044,https://www.hastings.gov.uk/content/planning/planning_policy/pdfs/BL17.pdf,1.01,not owned by a public authority,,not permissioned,,,,115,115,,,2017-12-15,2018-12-17,
http://opendatacommunities.org/id/district-council/hastings,BL18,"Land at Church Street, Hastings",0.60373,50.872595,https://www.hastings.gov.uk/content/planning/planning_policy/pdfs/BL18.pdf,0.35,not owned by a public authority,,permissioned,reserved matters approval,2017-07-20,http://publicaccess.hastings.gov.uk/online-applications/applicationDetails.do?activeTab=summary&keyVal=_HSTBC_DCAPR_104541,5,5,yes,. Development of site to provide five dwellings,2017-12-15,2018-12-17,
http://opendatacommunities.org/id/district-council/hastings,BL19,"4-5 Stockleigh Road, St Leonards",0.557615,50.854185,https://www.hastings.gov.uk/content/planning/planning_policy/pdfs/BL19.pdf,0.03,not owned by a public authority,,not permissioned,,,,12,12,,,2017-12-15,2018-12-17,
http://opendatacommunities.org/id/district-council/hastings,BL20,"190 Bexhill Road, St Leonards",0.526027,50.851333,https://www.hastings.gov.uk/content/planning/planning_policy/pdfs/BL20.pdf,0.19,not owned by a public authority,,not permissioned,,,,32,32,,,2017-12-15,2018-12-17,
http://opendatacommunities.org/id/district-council/hastings,BL22,"14 Westfield Lane, St Leonards",0.557962,50.892197,https://www.hastings.gov.uk/content/planning/planning_policy/pdfs/BL22.pdf,0.33,owned by a public authority,,not permissioned,,,,14,14,yes,,2017-12-15,2018-12-17,
http://opendatacommunities.org/id/district-council/hastings,BL23,"Century House, Menzies Road, St Leonards",0.548218,50.869501,https://www.hastings.gov.uk/content/planning/planning_policy/pdfs/BL23.pdf,0.1,not owned by a public authority,,not permissioned,,,,37,37,,,2017-12-15,2018-12-17,
http://opendatacommunities.org/id/district-council/hastings,BL27,"12-13 York Buildings, Wellington Place, Hastings",0.58067,50.855701,https://www.hastings.gov.uk/content/planning/planning_policy/pdfs/BL27.pdf,0.02,owned by a public authority,,permissioned,full planning permission,2017-01-20,http://publicaccess.hastings.gov.uk/online-applications/applicationDetails.do?activeTab=summary&keyVal=_HSTBC_DCAPR_103972,6,6,yes,. Alteration works to ground floor stair and to three upper storeys of existing building and conversion into six flats for residential accommodation (Application HS/LB/16/00661 also applies),2017-12-15,2018-12-17,
http://opendatacommunities.org/id/district-council/hastings,BL28,"The Grove School (Former St Leonards Academy, Darwell Campus, Darwell Close), St Leonards",0.534928,50.865733,https://www.hastings.gov.uk/content/planning/planning_policy/pdfs/BL28.pdf,9.4,owned by a public authority,,permissioned,outline planning permission,2017-11-17,http://publicaccess.hastings.gov.uk/online-applications/applicationDetails.do?activeTab=summary&keyVal=_HSTBC_DCAPR_102356,210,240,,". Outline application for the erection of up to 210 dwellings (25% affordable) with associated open space, play areas, landscaping and access.",2017-12-15,2018-12-17,
http://opendatacommunities.org/id/district-council/hastings,BL29,"Kings Head Inn, 61 Rye Road, Hastings",0.613179,50.878957,https://www.hastings.gov.uk/content/planning/planning_policy/pdfs/BL29.pdf,0.17,not owned by a public authority,,permissioned,full planning permission,2018-05-02,http://publicaccess.hastings.gov.uk/online-applications/applicationDetails.do?activeTab=summary&keyVal=_HSTBC_DCAPR_104514,12,12,yes,,2017-12-15,2018-12-17,
http://opendatacommunities.org/id/district-council/hastings,BL31,"1 & 2 Wayside, 490-492 Sedlescombe Road North, St Leonards",0.54987,50.885588,https://www.hastings.gov.uk/content/planning/planning_policy/pdfs/BL31.pdf,0.19,not owned by a public authority,,not permissioned,,,http://publicaccess.hastings.gov.uk/online-applications/applicationDetails.do?activeTab=summary&keyVal=_HSTBC_DCAPR_105013,5,5,yes,Refused planning permission for 6 dwellings,2017-12-15,2018-12-17,
http://opendatacommunities.org/id/district-council/hastings,BL33,"309-311 Harold Road, Hastings",0.608857,50.867595,http://www.hastings.gov.uk/content/planning/planning_policy/pdfs/BL33.pdf,0.09,not owned by a public authority,,permissioned,full planning permission,2018-11-23,http://publicaccess.hastings.gov.uk/online-applications/applicationDetails.do?activeTab=summary&keyVal=_HSTBC_DCAPR_115587,6,7,yes,,2018-12-17,2018-12-17,
http://opendatacommunities.org/id/district-council/hastings,BL34,"Cinques Port Way (Former Stamco Timber Yard and TA Centre), St Leonards",0.533767,50.850528,http://www.hastings.gov.uk/content/planning/planning_policy/pdfs/BL34.pdf,0.65,not owned by a public authority,,not permissioned,,,,25,25,,,2018-12-17,2018-12-17,
http://opendatacommunities.org/id/district-council/hastings,BL35,"Part of the former Spyway School Buildings, Hollington Park School Grounds, Gillsmans Hill, St Leonards-on-sea",0.54886,50.864265,http://www.hastings.gov.uk/content/planning/planning_policy/pdfs/BL35.pdf,0.32,not owned by a public authority,,permissioned,outline planning permission,2018-05-24,http://publicaccess.hastings.gov.uk/online-applications/applicationDetails.do?activeTab=summary&keyVal=_HSTBC_DCAPR_105161,8,8,,,2018-12-17,2018-12-17,
http://opendatacommunities.org/id/district-council/hastings,BL36,"Spyways School, Gillsmans Hill, St Leonards",0.547892,50.864624,http://www.hastings.gov.uk/content/planning/planning_policy/pdfs/BL36.pdf,0.72,not owned by a public authority,,not permissioned,,,,25,25,,,2018-12-17,2018-12-17,
