OrganisationURI,SiteReference,SiteNameAddress,GeoX,GeoY,SiteplanURL,Hectares,OwnershipStatus,HazardousSubstances,PlanningStatus,PermissionType,PermissionDate,PlanningHistory,NetDwellingsRangeFrom,NetDwellingsRangeTo,Deliverable,Notes,FirstAddedDate,LastUpdatedDate,EndDate
http://opendatacommunities.org/id/london-borough-council/barnet,F/04195/11,"Sunningdale, 38 The Bishops Avenue, London",-0.16952,51.581993,https://maps.london.gov.uk/brownfield-site-register,0.54,not owned by a public authority,,permissioned,full planning permission,2012-01-04,,1,1,yes,. Demolition of existing dwelling and detached garage. Erection of two storey detached dwelling including basement and rooms in roofspace. Erection of new detached garage.,2017-12-19,2017-12-19,
http://opendatacommunities.org/id/london-borough-council/barnet,F/01413/13,"R/O 698 Finchley Road, London",-0.196229,51.576364,https://maps.london.gov.uk/brownfield-site-register,0.04,not owned by a public authority,,permissioned,full planning permission,2013-09-12,,9,9,yes,". Erection of a four storey building comprising 9no. self-contained residential units, including 2no car parking spaces, refuse area and cycle storage.",2017-12-19,2017-12-19,
http://opendatacommunities.org/id/london-borough-council/barnet,F/01597/14,"Eastwood, 41 The Bishops Avenue, London",-0.168365,51.581283,https://maps.london.gov.uk/brownfield-site-register,0.27,not owned by a public authority,,permissioned,full planning permission,2014-06-26,,1,1,yes,". Demolition of existing house and erection of a new part two-storey, part three-storey dwelling house with basement level. Associated parking and landscaping.",2017-12-19,2017-12-19,
http://opendatacommunities.org/id/london-borough-council/barnet,F/01319/12,"Chandos Lawn Tennis Club, Chandos Way, Wellgarth Road, London",-0.189427,51.572474,https://maps.london.gov.uk/brownfield-site-register,0.9,not owned by a public authority,,permissioned,full planning permission,2014-09-22,,45,45,yes,". Erection of 45 self-contained units with associated car parking, cycle storage, amenity space, landscaping, refuse/recycling access, following demolition of existing building and structures.",2017-12-19,2017-12-19,
http://opendatacommunities.org/id/london-borough-council/barnet,F/05720/14,"Dryades, The Bishops Avenue, London",-0.170285,51.579128,https://maps.london.gov.uk/brownfield-site-register,0.49,not owned by a public authority,,permissioned,full planning permission,2015-06-29,,9,9,yes,. Demolition of existing dwelling and erection of two storey building comprising of basement level and rooms in roof space to form 9 self-contained  flats.,2017-12-19,2017-12-19,
http://opendatacommunities.org/id/london-borough-council/barnet,F/04857/14,"The Towers, The Bishops Avenue And 1-5 Arden Court Gardens, London",-0.170271,51.577302,https://maps.london.gov.uk/brownfield-site-register,1.67,not owned by a public authority,,permissioned,full planning permission,2015-08-03,,44,44,yes,". Demolition of six existing dwelling houses and erection of two three-storey blocks and one four-storey block to provide 44 residential units (3 x 1-bed, 27 x 2-bed and 14 x 3-bed units) with servicing, refuse/recycling facilities, tennis court, car parki",2017-12-19,2017-12-19,
http://opendatacommunities.org/id/london-borough-council/barnet,16/0852/FUL,"Hammerson House, 50A The Bishops Avenue, London",-0.172045,51.577698,https://maps.london.gov.uk/brownfield-site-register,1.02,not owned by a public authority,,permissioned,full planning permission,2016-11-30,,116,116,yes,. Demolition and rebuild of existing to provide 3 storey Care home with pitched roof (C2 use) providing 116 no. care units with associated amenity space and landscaping,2017-12-19,2017-12-19,
http://opendatacommunities.org/id/london-borough-council/barnet,C/17559/08,Brent Cross Cricklewood Regeneration Area North West London,-0.220778,51.573016,https://maps.london.gov.uk/brownfield-site-register,188.89,not owned by a public authority,,permissioned,outline planning permission,2010-10-28,,7550,7550,yes,". Redevelopment of the Brent Cross Cricklewood regeneration area comprising residential (Use Class C2, C3 and student / special needs / sheltered housing), town centre uses including Use Classes A1-A5, offices, industrial and other business uses (B1-B8), l",2017-12-19,2017-12-19,
http://opendatacommunities.org/id/london-borough-council/barnet,F/01932/11,"Former Parcel Force Depot, Geron Way, London",-0.223517,51.564955,https://maps.london.gov.uk/brownfield-site-register,1.7,not owned by a public authority,,permissioned,full planning permission,2013-04-30,,230,230,yes,". Redevelopment of site to provide for 230 residential units (use class C3) and 888 square metres of commercial accommodation (use classes B1, D1 and D2) in buildings up to seven storeys in height, along with associated car parking, amenity space and new v",2017-12-19,2017-12-19,
http://opendatacommunities.org/id/london-borough-council/barnet,15/00720/RMA,"Land Off Brent Terrace, London, (The Brent Terrace Triangles)",-0.220288,51.566723,https://maps.london.gov.uk/brownfield-site-register,0.86,not owned by a public authority,,permissioned,reserved matters approval,2015-06-09,,47,47,yes,". Reserved Matters application within Phase 1a (North) of the Brent Cross Cricklewood Regeneration Scheme relating to Layout, Scale, Appearance, Access and Landscaping, for the residential development of Plots 53 and 54 comprising 47 Residential Units. Sub",2017-12-19,2017-12-19,
http://opendatacommunities.org/id/london-borough-council/barnet,15/07820/FUL,"Melvin Hall, Golders Green Road, London",-0.208306,51.579364,https://maps.london.gov.uk/brownfield-site-register,0.31,mixed ownership,,permissioned,full planning permission,2016-03-24,,1,1,yes,. Roof extension to accommodate 1 self-contained flat with external balcony. Parking area to the northwest side.,2017-12-19,2017-12-19,
http://opendatacommunities.org/id/london-borough-council/barnet,16/3806/FUL,"290-294 Golders Green Road, London",-0.209272,51.580125,https://maps.london.gov.uk/brownfield-site-register,0.42,not owned by a public authority,,permissioned,full planning permission,2016-09-05,,60,60,yes,". Erection of a part two, part four, part five, part six storey building with lower ground floor and basements providing 60 residential flats with ancillary spa facility; associated car and cycle parking, landscaping and associated other works with access",2017-12-19,2017-12-19,
http://opendatacommunities.org/id/london-borough-council/barnet,H/06101/13,"The Barn, Nan Clarks Lane, London",-0.244383,51.628908,https://maps.london.gov.uk/brownfield-site-register,2.18,not owned by a public authority,,permissioned,full planning permission,2014-02-17,,1,1,yes,. Demolition of the existing dwelling house and erection of a new dwelling house with basement accommodation and a ramped access together with associated landscaping.,2017-12-19,2017-12-19,
http://opendatacommunities.org/id/london-borough-council/barnet,15/03138/FUL,"Land Adjacent Northway And Fairway Primary School, The Fairway, Mill Hill, London",-0.256448,51.627388,https://maps.london.gov.uk/brownfield-site-register,1.89,owned by a public authority,,permissioned,full planning permission,2016-04-08,,120,120,yes,". Development of site to the west of Northway and Fairway Primary School to provide 120 residential units (Use Class C3) comprising 45 houses (2-3 storeys) and two apartment blocks (3-4 storeys) containing a total of 75 flats. Replacement playground, new v",2017-12-19,2017-12-19,
http://opendatacommunities.org/id/london-borough-council/barnet,16/7594/FUL,"The Vicarage, Deans Lane, Edgware",-0.26129,51.614862,https://maps.london.gov.uk/brownfield-site-register,0.29,not owned by a public authority,,permissioned,full planning permission,2017-05-12,,9,9,yes,". Demolition of existing vicarage and garage buildings and redevelopment to provide a replacement vicarage plus 8no. additional two storey dwellinghouses  with associated access, amenity space, hard and soft landscaping, refuse stores and cycle storage.  P",2017-12-19,2017-12-19,
http://opendatacommunities.org/id/london-borough-council/barnet,H/02551/14,"71-73 Church Road, London",-0.223083,51.589768,https://maps.london.gov.uk/brownfield-site-register,0.03,not owned by a public authority,,permissioned,planning permission granted under an order,2014-06-17,,7,7,yes,". Change of use from Class B1(office), to Class C3 (residential) (7 units).",2017-12-19,2017-12-19,
http://opendatacommunities.org/id/london-borough-council/barnet,15/03198/FUL,"Spectrum House, Hillview Gardens, London",-0.213418,51.587751,https://maps.london.gov.uk/brownfield-site-register,0.21,not owned by a public authority,,permissioned,full planning permission,2016-03-01,,27,27,yes,. Demolition of existing buildings and redevelopment of the site to provide a new three storey residential building with basement parking area to provide 27 flats and associated private amenity space,2017-12-19,2017-12-19,
http://opendatacommunities.org/id/london-borough-council/barnet,15/04738/FUL,"Ella And Ridley Jacob House And Sam Beckman Centre, 19-25, Church Road And 29 Babington Road, London",-0.225426,51.58965,https://maps.london.gov.uk/brownfield-site-register,0.22,mixed ownership,,permissioned,full planning permission,2016-04-13,,32,32,yes,". Demolition of existing buildings (Ella & Ridley Jacobs House and Sam Beckman Centre) and the construction of two new buildings, one up to five storeys in height (plus basement) and one two storey building, and associated works, including alterations to a",2017-12-19,2017-12-19,
http://opendatacommunities.org/id/london-borough-council/barnet,17/2709/FUL,"Craymere Cottage And Fordfield Cottage, 9-11 Parson Street, London",-0.221781,51.590593,https://maps.london.gov.uk/brownfield-site-register,0.02,not owned by a public authority,,permissioned,full planning permission,2017-06-21,,6,6,yes,". Conversion of 2 single family dwellings into 5 self contained flats following demolition of existing two storey extension and erection of a part single part two storey rear extension, including partial excavation. Extension to roof including raising of r",2017-12-19,2017-12-19,
http://opendatacommunities.org/id/london-borough-council/barnet,B/05631/14,"Arkley Reservoir, Rowley Green Road, Barnet, Herts",-0.238405,51.646335,https://maps.london.gov.uk/brownfield-site-register,2.08,not owned by a public authority,,permissioned,full planning permission,2014-12-08,,3,3,yes,. Erection of 3no. two storey plus rooms in roof space detached dwellinghouses with associated hard and soft landscaping and amenity space.,2017-12-19,2017-12-19,
http://opendatacommunities.org/id/london-borough-council/barnet,15/01703/FUL,"Dolphin Manor, 105 Camlet Way, Barnet",-0.185957,51.664663,https://maps.london.gov.uk/brownfield-site-register,0.87,not owned by a public authority,,permissioned,full planning permission,2015-05-22,,2,2,yes,. Demolition of the existing house and construction of two self-contained two-storey detached dwellings (Lower ground and ground floor levels). Landscaping and associated works,2017-12-19,2017-12-19,
http://opendatacommunities.org/id/london-borough-council/barnet,15/03343/FUL,"Elmbank, Barnet Road, Barnet",-0.218992,51.651537,https://maps.london.gov.uk/brownfield-site-register,1.29,owned by a public authority,,permissioned,full planning permission,2016-05-25,,114,114,yes,". Demolition of existing buildings and erection of 114 residential dwellings (93 flats and 21 houses), car parking, landscaping and associated works.",2017-12-19,2017-12-19,
http://opendatacommunities.org/id/london-borough-council/barnet,15/07170/FUL,"Rowley Lane Sports Ground, Rowley Lane, Barnet",-0.247132,51.65241,https://maps.london.gov.uk/brownfield-site-register,0.33,not owned by a public authority,,permissioned,full planning permission,2016-10-28,,1,1,yes,". Construction of a two storey Clubhouse providing various essential facilities for the Sports Association including changing rooms, spectator areas and a caretakers flat",2017-12-19,2017-12-19,
http://opendatacommunities.org/id/london-borough-council/barnet,16/2466/FUL,"Brake Shear House, 164 High Street, Barnet",-0.200897,51.65582,https://maps.london.gov.uk/brownfield-site-register,0.48,mixed ownership,,permissioned,full planning permission,2017-02-02,,40,40,yes,". Demolition of existing buildings (Use Class B1(c), Sui Generis, A3 and C3). Erection of new three storey building to provide flexible Use Class B floorspace. Erection of new four storey residential apartment building providing 32 self-contained units and",2017-12-19,2017-12-19,
http://opendatacommunities.org/id/london-borough-council/barnet,17/2058/FUL,"Site Of Former 7, Alston Road, Barnet",-0.208067,51.656217,https://maps.london.gov.uk/brownfield-site-register,0.02,not owned by a public authority,,permissioned,full planning permission,2017-05-26,,5,5,yes,. Demolition of existing building (Class D1) and erection of two-storey building with rooms in roof space to create 5 new self-contained C3 residential units. Associated parking and refuse (alteration to scheme that is under construction that was approved,2017-12-19,2017-12-19,
http://opendatacommunities.org/id/london-borough-council/barnet,H/04017/09,"Inglis Barracks, Mill Hill, London",-0.212737,51.613179,https://maps.london.gov.uk/brownfield-site-register,30.96,not owned by a public authority,,permissioned,outline planning permission,2011-09-22,,2174,2174,yes,". Outline application for the comprehensive redevelopment of the site for residential led mixed use development involving the demolition of all existing buildings (excluding the former officers mess) and ground re-profiling works, to provide 2,174 dwelling",2017-12-19,2017-12-19,
http://opendatacommunities.org/id/london-borough-council/barnet,15/01546/RMA,"Phase 4A, Milbrook Park (Former Inglis Barracks), Mill Hill East, London",-0.208837,51.612095,https://maps.london.gov.uk/brownfield-site-register,6.62,not owned by a public authority,,permissioned,reserved matters approval,2015-07-01,,114,114,yes,"Part of H/04017/09 outline planning application. Reserved matters application seeking approval of appearance, landscaping, layout and scale for Phase 4a of the Mill Hill East development pursuant to Outline planning permission reference H/04017/09 dated: 22/9/2011, involving the erection of 114 units 6",2017-12-19,2017-12-19,
http://opendatacommunities.org/id/london-borough-council/barnet,15/06417/OUT,"Milbrook Park, Mill Hill, London",-0.212737,51.613188,https://maps.london.gov.uk/brownfield-site-register,2.96,not owned by a public authority,,permissioned,outline planning permission,2016-05-13,,66,66,yes,". Outline planning application for up to 66 residential units, 700 sqm of B1 floorspace, 630 sqm energy centre (CHP) and associated car parking and landscaping.",2017-12-19,2017-12-19,
http://opendatacommunities.org/id/london-borough-council/barnet,H/01721/11,"551 Watford Way, London",-0.241643,51.609704,https://maps.london.gov.uk/brownfield-site-register,0.27,not owned by a public authority,,permissioned,full planning permission,2011-06-30,,9,9,yes,. Construction of a 3 storey building including rooms in the roofspace to provide 5 self-contained flats and construction of 3 x two storey plus rooms in the roofspace and 1 x two storey detached dwellinghouses. Associated landscaping and parking spaces.,2017-12-19,2017-12-19,
http://opendatacommunities.org/id/london-borough-council/barnet,15/00568/FUL,"Land At Moreton Close, Mill Hill, London",-0.223401,51.609367,https://maps.london.gov.uk/brownfield-site-register,0.43,owned by a public authority,,permissioned,full planning permission,2015-05-18,,53,53,yes,". Demolition of existing buildings and for the construction of a three storey building with rooms in roofspace to provide extra care residential development (Use Class C2) to provide 51 no. 1 and 2 bedroom flats, served by a new vehicular access off Milesp",2017-12-19,2017-12-19,
http://opendatacommunities.org/id/london-borough-council/barnet,16/8115/FUL,"St Vincents Farm Cottage, The Ridgeway, London",-0.22247,51.619523,https://maps.london.gov.uk/brownfield-site-register,0.4,not owned by a public authority,,permissioned,full planning permission,2017-05-17,,7,7,yes,". Demolition of existing 8no. dwellings and ancillary buildings and erection of a part single storey, part two storey building to provide 7no dwellings. Associated cycle parking, storage, parking and amenity space. Alterations to hard and soft landscaping",2017-12-19,2017-12-19,
http://opendatacommunities.org/id/london-borough-council/barnet,B/03068/11,"Land Off High Road/Chandos Avenue, London And Bretheren Meeting Hall & Well Grove School, Well Grove, London",-0.174765,51.635157,https://maps.london.gov.uk/brownfield-site-register,2.26,mixed ownership,,permissioned,outline planning permission,2012-03-29,,70,70,yes,". Demolition of existing buildings and redevelopment comprising of 70 dwellings (62 houses and 8 flats). Erection of 512sqm building for use class D1 purposes (Non-Residential Institution). Provision of associated car parking, landscaping and open space. U",2017-12-19,2017-12-19,
http://opendatacommunities.org/id/london-borough-council/barnet,B/01990/11,"Groupama House, 17 Station Road, Barnet, Herts",-0.17593,51.649338,https://maps.london.gov.uk/brownfield-site-register,0.12,not owned by a public authority,,permissioned,full planning permission,2012-08-21,,34,34,yes,". Conversion of existing office building to 34 residential units, with 323m2 of B1 (Office Space) at first floor level. Associated alterations and extensions including extensions at rear and roof level. Provision of 34 car parking spaces.",2017-12-19,2017-12-19,
http://opendatacommunities.org/id/london-borough-council/barnet,B/03816/13,"Castle House, 21-23 Station Road, Barnet, Herts",-0.176614,51.649223,https://maps.london.gov.uk/brownfield-site-register,0.21,not owned by a public authority,,permissioned,full planning permission,2013-12-10,,8,8,yes,. Erection of a two-storey roof addition to provide 8 apartments including works comprising of new fire escape stairs at the rear; re-modelling of the front elevation to incorporate new entrance; re-modelling and landscaping of the site including the front,2017-12-19,2017-12-19,
http://opendatacommunities.org/id/london-borough-council/barnet,B/06116/13,"1060A-1072 High Road, London",-0.174969,51.624666,https://maps.london.gov.uk/brownfield-site-register,0.62,not owned by a public authority,,permissioned,full planning permission,2015-11-12,,56,56,yes,". Demolition of the existing buildings and redevelopment of the site to provide 46 no. self-contained residential flats (Use Class C3), 10 no. self contained houses (Use Class C3) and 483 square metres of office (Use Class B1a) floorspace, in buildings ran",2017-12-19,2017-12-19,
http://opendatacommunities.org/id/london-borough-council/barnet,B/05318/14,"Reculver, 63 Totteridge Village, London",-0.206922,51.633566,https://maps.london.gov.uk/brownfield-site-register,1.27,not owned by a public authority,,permissioned,full planning permission,2015-01-30,,1,1,yes,. Demolition of existing dwelling and erection of new single storey house including lower ground floor and basement level.,2017-12-19,2017-12-19,
http://opendatacommunities.org/id/london-borough-council/barnet,B/04309/14,"Land Between Sweets Way And Oakleigh Road North, London",-0.173076,51.628989,https://maps.london.gov.uk/brownfield-site-register,6.21,,,permissioned,outline planning permission,2015-07-24,,288,288,yes,". Demolition of all existing buildings and outline planning permission (with all matters other than access and layout reserved) for new residential dwellings (Use Class C3), comprising up to 201 houses and up to 87 flats (up to 288 new dwellings in total),",2017-12-19,2017-12-19,
http://opendatacommunities.org/id/london-borough-council/barnet,14/07670/FUL,"1201 High Road, London",-0.175284,51.62834,https://maps.london.gov.uk/brownfield-site-register,1.05,not owned by a public authority,,permissioned,full planning permission,2015-12-03,,124,124,yes,". Construction of a new building up to 5-storeys high comprising of 43 self-contained flats (Class C3) and 437sqm of (Class A1) retail space at ground floor level with basement parking. Associated landscaping, refuse stores, cycle stores and amenity space",2017-12-19,2017-12-19,
http://opendatacommunities.org/id/london-borough-council/barnet,15/07359/HSE,"Southern Lea, Wykeham Rise, London",-0.204961,51.633833,https://maps.london.gov.uk/brownfield-site-register,0.3,not owned by a public authority,,permissioned,full planning permission,2016-02-15,,1,1,yes,. Demolition of existing dwelling and erection of new two-storey dwelling house at ground and lower ground level. Associated works,2017-12-19,2017-12-19,
http://opendatacommunities.org/id/london-borough-council/barnet,16/3828/FUL,"Copped Close, 15 Totteridge Village, London",-0.199242,51.630086,https://maps.london.gov.uk/brownfield-site-register,0.34,not owned by a public authority,,permissioned,full planning permission,2016-11-17,,1,1,yes,. Erection of two storey dwelling with basement and rooms in roofspace including garage,2017-12-19,2017-12-19,
http://opendatacommunities.org/id/london-borough-council/barnet,17/1313/PNO,"Barnet House, 1255 High Road, London",-0.175139,51.629426,https://maps.london.gov.uk/brownfield-site-register,0.71,owned by a public authority,,permissioned,planning permission granted under an order,2017-05-11,,254,254,yes,. Change of use Change of use from B1 (Office) to C3 (Residential) (254 Units over 11 Floors),2017-12-19,2017-12-19,
http://opendatacommunities.org/id/london-borough-council/barnet,17/0824/FUL,"Copped Close, 15 Totteridge Village, London",-0.198458,51.630559,https://maps.london.gov.uk/brownfield-site-register,0.27,not owned by a public authority,,permissioned,full planning permission,2017-06-21,,2,2,yes,. Demolition of the existing dwelling and buildings and erection of two detached dwellings and replacement double garage. Associated refuse and recycling area,2017-12-19,2017-12-19,
http://opendatacommunities.org/id/london-borough-council/barnet,17/3135/FUL,"Burnhams, 25 Totteridge Common, London",-0.215166,51.632649,https://maps.london.gov.uk/brownfield-site-register,0.76,not owned by a public authority,,permissioned,full planning permission,2017-07-13,,1,1,yes,. Demolition of the existing house and the erection of a two storey detached dwelling with basement and rooms in roofspace and detached garage.  Alterations to hard and soft landscaping,2017-12-19,2017-12-19,
http://opendatacommunities.org/id/london-borough-council/barnet,17/2982/FUL,"Whitewalls, Totteridge Green, London",-0.196288,51.629528,https://maps.london.gov.uk/brownfield-site-register,0.27,not owned by a public authority,,permissioned,full planning permission,2017-07-28,,2,2,yes,". Demolition of single detached house and erection of 2no detached dwellings. Associated landscaping, hardstanding and refuse storage",2017-12-19,2017-12-19,
http://opendatacommunities.org/id/london-borough-council/barnet,17/3715/FUL,"Ridge Lodge, 30 Totteridge Common, London",-0.21883,51.632794,https://maps.london.gov.uk/brownfield-site-register,0.42,not owned by a public authority,,permissioned,full planning permission,2017-09-12,,1,1,yes,". Demolition of existing dwelling, garage and outbuildings and erection of a two storey dwelling and single storey garage. Associated landscaping and alterations to existing entrance gates",2017-12-19,2017-12-19,
http://opendatacommunities.org/id/london-borough-council/barnet,B/00354/13,"Dollis Valley Estate, Including Former Barnet Hill School, Barnet South Community Association Hall And 131-135 Mays Lane, Barnet",-0.200235,51.646251,https://maps.london.gov.uk/brownfield-site-register,10.74,not owned by a public authority,,permissioned,outline planning permission,2013-10-01,,631,631,yes,". Hybrid planning application for the redevelopment of Dollis Valley Estate to accommodate up to 631 residential units, replacement community space, new open space and infrastructure comprising: Outline permission for the demolition of existing buildings a",2017-12-19,2017-12-19,
http://opendatacommunities.org/id/london-borough-council/barnet,B/02349/14,"Phase 2, Dollis Valley Estate, Barnet, Herts",-0.195706,51.64602,https://maps.london.gov.uk/brownfield-site-register,3.16,not owned by a public authority,,permissioned,reserved matters approval,2014-08-13,,163,163,yes,"Part of B/00354/13 planning permission. Reserved matters application seeking approval of landscaping, appearance, scale, access and layout for Phase 2 of the Dollis Valley Estate Redevelopment pursuant to Condition 7 of the Hybrid planning permission reference B/00354/13 dated 01/10/2013 invol",2017-12-19,2017-12-19,
http://opendatacommunities.org/id/london-borough-council/barnet,14/07124/FUL,"Vale Farm, Mays Lane, Barnet",-0.222199,51.640129,https://maps.london.gov.uk/brownfield-site-register,0.3,not owned by a public authority,,permissioned,full planning permission,2015-06-05,,1,1,yes,". Conversion of existing barn into a single family dwellinghouse with external alterations including insertion of rooflights to facilitate a loft conversion, associated landscaping and off-street car parking following partial demolition of storage building",2017-12-19,2017-12-19,
