OrganisationURI,SiteReference,SiteNameAddress,GeoX,GeoY,SiteplanURL,Hectares,OwnershipStatus,HazardousSubstances,PlanningStatus,PermissionType,PermissionDate,PlanningHistory,NetDwellingsRangeFrom,NetDwellingsRangeTo,Deliverable,Notes,FirstAddedDate,LastUpdatedDate,EndDate
http://opendatacommunities.org/id/london-borough-council/barnet,16/7101/FUL,"Sir Thomas Lipton Memorial Hospital Osidge, 151 Chase Side, Southgate, London",-0.137044,51.634924,https://maps.london.gov.uk/brownfield-site-register,2.01,not owned by a public authority,,permissioned,full planning permission,2017-06-23,,30,30,yes,. Demolition of 3 no. existing buildings and conversion of Osidge House to Class C3 residential use providing 16 no. self-contained flats. Erection of 3-storey apartment building to provide 8 no. self-contained flats. Erection of 3 no. 3-storey townhouses,2017-12-19,2017-12-19,
http://opendatacommunities.org/id/london-borough-council/barnet,15/04442/FUL,"Imperial House, The Hyde, London",-0.260006,51.595554,https://maps.london.gov.uk/brownfield-site-register,0.41,mixed ownership,,permissioned,full planning permission,2017-03-17,,81,81,yes,. Redevelopment of Imperial House comprising the demolition of existing buildings and erection of buildings ranging from 3 to 16 storeys to provide 81 residential units (Use Class C3) and 815sqm of replacement office accommodation (Use Class B1) along with,2017-12-19,2017-12-19,
http://opendatacommunities.org/id/london-borough-council/barnet,F/04474/14,"Granville Road Estate, Granville Road, Childs Hill London",-0.201089,51.56474,https://maps.london.gov.uk/brownfield-site-register,3.73,,,permissioned,full planning permission,2016-08-08,,132,132,yes,". Demolition of Beech Court, garages and other ancillary buildings and the erection of new buildings (including an extension to Nant Court) between two and six storeys in height (with additional basement levels in places) to provide 132 new dwellings in to",2017-12-19,2017-12-19,
http://opendatacommunities.org/id/london-borough-council/barnet,16/0601/FUL,"112-132 Cricklewood Lane, London",-0.209208,51.55972,https://maps.london.gov.uk/brownfield-site-register,0.64,not owned by a public authority,,permissioned,full planning permission,2016-08-30,,122,122,yes,". The erection of a part 3, part 6, part 8 storey building comprising 122 no. residential units and 279 sqm (GIA) of commercial floorspace, including the provision of private and communal amenity space, landscaping, car parking, cycle parking, refuse stora",2017-12-19,2017-12-19,
http://opendatacommunities.org/id/london-borough-council/barnet,15/05969/FUL,"Church Walk House, Church Walk, London",-0.198727,51.561358,https://maps.london.gov.uk/brownfield-site-register,0.42,mixed ownership,,permissioned,full planning permission,2016-12-19,,35,35,yes,. Demolition of existing building and construction of part two part three storey building with additional roof level and basement level to provide 35 no. self-contained units with associated parking and landscaping,2017-12-19,2017-12-19,
http://opendatacommunities.org/id/london-borough-council/barnet,16/5993/FUL,"114-120 West Heath Road, London",-0.192637,51.566139,https://maps.london.gov.uk/brownfield-site-register,0.68,owned by a public authority,,permissioned,full planning permission,2017-03-21,,46,46,yes,". Demolition of existing buildings and comprehensive redevelopment of the site for a building arranged over basement, partial lower ground floor level and four to five floors above to provide up to 46no. Assisted/Independent Living units (class C2 resident",2017-12-19,2017-12-19,
http://opendatacommunities.org/id/london-borough-council/barnet,17/2690/PNO,"220 The Vale, London",-0.213086,51.563089,https://maps.london.gov.uk/brownfield-site-register,0.05,not owned by a public authority,,permissioned,planning permission granted under an order,2017-06-22,,14,14,yes,. Change of use from Use Class B1 (office) to  Use Class C3 (residential) to provide (14 Units),2017-12-19,2017-12-19,
http://opendatacommunities.org/id/london-borough-council/barnet,H/00146/12,"Blocks C5 To C12, Beaufort Park (Land At Former Raf East Camp Site), Aerodrome Road/ Grahame Park Way, Hendon, London",-0.240493,51.594625,https://maps.london.gov.uk/brownfield-site-register,1.52,not owned by a public authority,,permissioned,reserved matters approval,2012-12-21,,560,560,yes,". Reserved matters application seeking approval for appearance, landscaping, layout and design in relation to buildings C5 to C12 comprising 560 homes and 900 sqm of non-residential floorspace, pursuant to condition 6 of outline permission W/00198/AA/04 fo",2017-12-19,2017-12-19,
http://opendatacommunities.org/id/london-borough-council/barnet,14/07064/FUL,"Buildings D3 To D8, Beaufort Park, Aerodrome Road, Colindale",-0.239213,51.594498,https://maps.london.gov.uk/brownfield-site-register,0.82,not owned by a public authority,,permissioned,full planning permission,2015-04-21,,237,237,yes,". Construction of a building of 6 cores of up to 10 storeys to comprise 237 residential homes and 357 sq.m GIA of commercial floorspace (A1 to A4, B1, B2, D1 and D2), including associated car and cycle parking and landscaping (This application is accompani",2017-12-19,2017-12-19,
http://opendatacommunities.org/id/london-borough-council/barnet,16/3652/NMA,"C7-C8A Beaufort Park, Land At Former RAF East Camp, Aerodrome Road/ Grahame Parkway, Hendon, London",-0.240448,51.59466,https://maps.london.gov.uk/brownfield-site-register,0.46,not owned by a public authority,,permissioned,full planning permission,2016-06-09,,177,177,yes,. Non-material amendment to planning permission H/04184/14 dated 13/11/14.  Amendments include internal reconfiguration of blocks C7 - C8a,2017-12-19,2017-12-19,
http://opendatacommunities.org/id/london-borough-council/barnet,W01731JS/04,"Grahame Park Estate-Bounded By Lanacre Avenue To The West, Grahame Park Way To The South And Field Mead To The North London",-0.244862,51.603017,https://maps.london.gov.uk/brownfield-site-register,34.3,not owned by a public authority,,permissioned,outline planning permission,2007-01-17,,2977,2977,yes,". Redevelopment of site involving the demolition of 1314 existing residential units and construction of 2977 new residential units providing a total of 3440 units on the estate, provision of approximately 9074sqm replacement retail (Class A1), office (Clas",2017-12-19,2017-12-19,
http://opendatacommunities.org/id/london-borough-council/barnet,H/00308/11,"Phase 1B, Grahame Park Estate, Colindale, London",-0.245186,51.598364,https://maps.london.gov.uk/brownfield-site-register,4.03,not owned by a public authority,,permissioned,reserved matters approval,2012-02-21,,441,441,yes,"Part of W01731JS/04 outline planning permission. Reserved matters application seeking approval for design, external appearance and landscaping for Phase 1B of the Grahame Park Estate Regeneration comprising 441 residential units (excluding Block A9), 5,483sqm (GEA) of non-residential floorspace includi",2017-12-19,2017-12-19,
http://opendatacommunities.org/id/london-borough-council/barnet,14/07210/FUL,"Development Plot B6 (Grahame Park Estate Regeneration), Lanacre Avenue, Colindale",-0.244032,51.597583,https://maps.london.gov.uk/brownfield-site-register,3.44,owned by a public authority,,permissioned,full planning permission,2015-07-15,,92,92,yes,"Part of W01731JS/04 outline planning permission. Revised application for development of plot B6 comprising buildings between 1 and 6 storeys, to accommodate 92 residential units (84 flats and 8 dwellinghouses); associated vehicle access, highways, parking, landscaping, amenity space, refuse and cycle s",2017-12-19,2017-12-19,
http://opendatacommunities.org/id/london-borough-council/barnet,H/04753/14,"Peel Centre, Peel Drive, Colindale, London",-0.242984,51.593305,https://maps.london.gov.uk/brownfield-site-register,20.36,not owned by a public authority,,permissioned,full planning permission,2015-12-23,,2900,2900,yes,". Hybrid planning application for the phased comprehensive redevelopment of part of the existing Peel Centre site including the demolition of all existing buildings and the provision of a residential-led mixed use development comprising up to 2,900 new res",2017-12-19,2017-12-19,
http://opendatacommunities.org/id/london-borough-council/barnet,16/1683/NMA,"Blocks T And U, Peel Centre, Peel Drive, Colindale, London",-0.239171,51.593355,https://maps.london.gov.uk/brownfield-site-register,0.18,not owned by a public authority,,permissioned,planning permission granted under an order,2016-04-06,,211,211,yes,"Part of H/04753/14 planning application. Non-material amendment pursuant to planning permission H/04753/14 dated 23.12.2015 for ""Hybrid planning application for the phased comprehensive redevelopment of part of the existing Peel Centre site including the demolition of all existing buildings and",2017-12-19,2017-12-19,
http://opendatacommunities.org/id/london-borough-council/barnet,16/5050/S73,"Blocks P and Q, Peel Centre, Aerodrome Road, London",-0.243801,51.592705,https://maps.london.gov.uk/brownfield-site-register,0.71,not owned by a public authority,,permissioned,planning permission granted under an order,2016-12-05,,241,241,yes,Part of H/04753/14 planning application. Minor Material Amendment  to condition  1 (Approved Plans)  of  Planning Permission  for H/04753/14 Hybrid planning application for the phased comprehensive redevelopment of part of the existing Peel Centre site including the demolition of all existing b,2017-12-19,2017-12-19,
http://opendatacommunities.org/id/london-borough-council/barnet,16/7836/S73,"Blocks H, J, K and M, Colindale Gardens (Formerly Peel Centre), Aerodrome Road, Colindale, London",-0.244929,51.593415,https://maps.london.gov.uk/brownfield-site-register,1.82,not owned by a public authority,,permissioned,planning permission granted under an order,2017-05-05,,428,428,yes,Part of H/04753/14 planning application. Minor Material Amendment to condition 1 (Approved Plans) of Planning Permission for H/04753/14 dated 23/12/2015 as amended by S73 Application 16/5050/S73 dated 05.12.2016. Hybrid planning application for the phased comprehensive redevelopment of part of,2017-12-19,2017-12-19,
http://opendatacommunities.org/id/london-borough-council/barnet,17/2564/RMA,"Phases 2A, 2B and 2C, Colindale Gardens (Former Peel Centre), Aerodrome Road, London",-0.246769,51.594755,https://maps.london.gov.uk/brownfield-site-register,2.73,not owned by a public authority,,permissioned,full planning permission,2017-08-02,,483,483,yes,"Part of H/04753/14 planning application. Reserved matters application seeking approval of appearance, landscaping, layout and scale for Phases 2A, 2B and 2C of the Colindale Gardens (Former Peel Centre) development pursuant to outline planning permission reference H/04753/14 dated 23/12/2015 as",2017-12-19,2017-12-19,
http://opendatacommunities.org/id/london-borough-council/barnet,W00198AA/04,"Former Raf East Camp Site, Aerodrome Road, Grahame Park Way, London",-0.241673,51.59547,https://maps.london.gov.uk/brownfield-site-register,13.22,not owned by a public authority,,permissioned,outline planning permission,2005-04-08,,2800,2800,yes,". Redevelopment of site comprising 2800 residential units (Class C3), approximately 7850sqm of retail (Class A1), financial and professional services (Class A2), food and drink (Class A3), business (Class B1), leisure and community (Class D1 and D2) uses a",2017-12-19,2017-12-19,
http://opendatacommunities.org/id/london-borough-council/barnet,H/01259/08,"Former Raf East Camp, Hendon, Block E",-0.237981,51.594264,https://maps.london.gov.uk/brownfield-site-register,1.04,not owned by a public authority,,permissioned,reserved matters approval,2009-07-01,,445,445,yes,"Part of W00198AA/04 outline planning permission. Reserved matters application seeking approval for design and external appearance in relation to the next phase (Block E) of the development, comprising 442 residential units and 639.5 sq. m of commercial accommodation including use classes A1 to A5 or B1",2017-12-19,2017-12-19,
http://opendatacommunities.org/id/london-borough-council/barnet,H/02976/14,"Unit 1 & 2, Colindale Business Centre, 126 Colindale Avenue, London",-0.251601,51.594099,https://maps.london.gov.uk/brownfield-site-register,0.11,not owned by a public authority,,permissioned,planning permission granted under an order,2014-07-30,,5,5,yes,. Change of use of first floor from B1 office to C3 residential (5 Units),2017-12-19,2017-12-19,
http://opendatacommunities.org/id/london-borough-council/barnet,H/05856/13,"British Library Newspapers, 130 Colindale Avenue, London",-0.250439,51.593919,https://maps.london.gov.uk/brownfield-site-register,1.23,not owned by a public authority,,permissioned,full planning permission,2014-12-23,,388,388,yes,". Demolition of all existing buildings; redevelopment to provide 395 flats, 772sqm of retail/financial/professional/restaurant/café uses (Use Classes A1/A2/A3) and 112sqm of floorspace for retail/financial/professional/restaurant/café uses (Use Classes A1/",2017-12-19,2017-12-19,
http://opendatacommunities.org/id/london-borough-council/barnet,H/05915/14,"Hyde House, Rushgrove Avenue, London",-0.248128,51.584938,https://maps.london.gov.uk/brownfield-site-register,0.47,not owned by a public authority,,permissioned,planning permission granted under an order,2014-12-24,,40,40,yes,. Change of use from Class B1 (Office) to Class C3 (Residential) (40 Units) on floors 7 to 11,2017-12-19,2017-12-19,
http://opendatacommunities.org/id/london-borough-council/barnet,H/03551/14,"Barnet And Southgate College, Grahame Park Way, Colindale",-0.242311,51.603645,https://maps.london.gov.uk/brownfield-site-register,5.46,mixed ownership,,permissioned,full planning permission,2015-05-06,,396,396,yes,". Demolition of all existing buildings; redevelopment to provide 396 residential units (266 flats, 56 maisonettes and 74 dwellinghouses) in buildings ranging from 3 to 9 storeys; access from Grahame Park Way and Corner Mead; associated internal street netw",2017-12-19,2017-12-19,
http://opendatacommunities.org/id/london-borough-council/barnet,H/05828/14,"Homebase, Rookery Way, London",-0.246241,51.58446,https://maps.london.gov.uk/brownfield-site-register,2.45,mixed ownership,,permissioned,full planning permission,2015-10-21,,386,386,yes,". Demolition of the existing buildings, and the erection of eight blocks of apartments of 6-8 storeys with a building of 14 storeys adjacent to The Hyde (the A5, Edgware Road) and three terraced blocks comprising housing and duplex apartments, providing 38",2017-12-19,2017-12-19,
http://opendatacommunities.org/id/london-borough-council/barnet,H/05833/14,"126 Colindale Avenue, London",-0.251349,51.593897,https://maps.london.gov.uk/brownfield-site-register,0.26,not owned by a public authority,,permissioned,full planning permission,2016-12-20,,35,35,yes,". Demolition of existing business centre and construction of 2 no. two five storey buildings to provide 35 no. residential flats and 566 m2 of commercial floor space (Use Class B1), including basement car park with 44 car spaces and 70 cycle spaces. Provis",2017-12-19,2017-12-19,
http://opendatacommunities.org/id/london-borough-council/barnet,B/02366/13,"11-13 Approach Road, Barnet, Herts",-0.172404,51.649301,https://maps.london.gov.uk/brownfield-site-register,0.07,mixed ownership,,permissioned,full planning permission,2014-01-20,,15,15,yes,". Erection of 5 storey building and basement floor level to facilitate 15 self-contained residential units, 15 car parking spaces and cycle store at basement level. Provision of solar panels at roof level. Hard and soft landscaping.",2017-12-19,2017-12-19,
http://opendatacommunities.org/id/london-borough-council/barnet,B/04142/14,"142 East Barnet Road, Barnet, Herts",-0.168591,51.647803,https://maps.london.gov.uk/brownfield-site-register,0.03,,,permissioned,outline planning permission,2014-10-01,,5,5,yes,". Change of use of existing shop (Use Class A1) and part two storey, part single storey rear extension and roof extension with rear dormer window to facilitate the creation of 5 flats. Construction of replacement garage to rear of site (Outline Application",2017-12-19,2017-12-19,
http://opendatacommunities.org/id/london-borough-council/barnet,B/04834/14,"Land Formerly Known As British Gas Works Albert Road, East Barnet",-0.173149,51.653053,https://maps.london.gov.uk/brownfield-site-register,2.52,mixed ownership,,permissioned,full planning permission,2015-05-01,,305,305,yes,". Residential-led, mixed-use development of the Former Albert Road Gas Works comprising the erection of 305 residential units (Use Class C3), 116 sq m of Retail floorspace (Use Class A1/A2/A3/A4) and 558 sq m of flexible Commercial floorspace (Use Class A3",2017-12-19,2017-12-19,
http://opendatacommunities.org/id/london-borough-council/barnet,16/3262/FUL,"Land Adjacent To 106-128 Mount Pleasant And 27-37, Langford Road, Barnet",-0.158962,51.65249,https://maps.london.gov.uk/brownfield-site-register,0.23,owned by a public authority,,permissioned,full planning permission,2017-04-20,,12,12,yes,". Demolition of garden walls and erection of two 3-storey buildings comprising of 12no. self-contained flats with associated access, car parking, cycle and refuse storage, amenity space and landscaping",2017-12-19,2017-12-19,
http://opendatacommunities.org/id/london-borough-council/barnet,17/3327/FUL,"181 Victoria Road, Barnet",-0.166819,51.647991,https://maps.london.gov.uk/brownfield-site-register,0.12,not owned by a public authority,,permissioned,full planning permission,2017-09-06,,7,7,yes,. Erection of 4 storey block comprising 7 flats,2017-12-19,2017-12-19,
http://opendatacommunities.org/id/london-borough-council/barnet,F/04402/09,"16 Fortis Green, London",-0.162703,51.58998,https://maps.london.gov.uk/brownfield-site-register,0.03,not owned by a public authority,,permissioned,full planning permission,2010-02-09,,5,5,yes,. Conversion of three flats into five flats following formation of front and rear lightwells at basement level and alterations to roof including two rear dormers to facilitate a loft conversion. Installation of solar panels to rear and front roof slope.,2017-12-19,2017-12-19,
http://opendatacommunities.org/id/london-borough-council/barnet,F/02952/13,"41 Wilmot Close, London",-0.176974,51.598062,https://maps.london.gov.uk/brownfield-site-register,0.18,not owned by a public authority,,permissioned,full planning permission,2013-10-14,,16,16,yes,. Erection of two-storey building to create 16 one bedroom sheltered housing self-contained residential,2017-12-19,2017-12-19,
http://opendatacommunities.org/id/london-borough-council/barnet,16/3252/FUL,"Elmshurst Crescent Garages, Land Adjacent To 90-100 Elmshurst Crescent And 35, Pulham Avenue, London",-0.175131,51.589293,https://maps.london.gov.uk/brownfield-site-register,0.45,owned by a public authority,,permissioned,full planning permission,2017-02-08,,13,13,yes,". Demolition of existing garages and redevelopment to provide a 3-storey building comprising of 11no. self-contained flats and 2no. two-storey semi-detached dwellinghouses  with associated access, amenity space, landscaping, car parking, cycle and refuse s",2017-12-19,2017-12-19,
http://opendatacommunities.org/id/london-borough-council/barnet,17/1409/FUL,"Land Adj To 1-12 Norfolk Close, London",-0.167536,51.592214,https://maps.london.gov.uk/brownfield-site-register,0.41,owned by a public authority,,permissioned,full planning permission,2017-07-31,,8,8,yes,". Erection of four storey detached building comprising 8no residential units with 8no additonal car parking spaces to existing provision, cycle storage, refuse storage and landscaping",2017-12-19,2017-12-19,
http://opendatacommunities.org/id/london-borough-council/barnet,H/00233/13,"Character zones 3 and 8, Stonegrove And Spur Road Estate, Edgware, Middx",-0.289047,51.619973,https://maps.london.gov.uk/brownfield-site-register,2.75,not owned by a public authority,,permissioned,reserved matters approval,2013-05-16,,218,218,yes,". Reserved matters application seeking approval for scale, external appearance and landscaping for character zones 3 and 8 of the redevelopment of Stonegrove and Spur Road estate pursuant to condition 2 of planning permission W13582/07 as renewed by H/0363",2017-12-19,2017-12-19,
http://opendatacommunities.org/id/london-borough-council/barnet,H/05563/14,"2 Ashcombe Gardens, Edgware, Middx",-0.279082,51.621437,https://maps.london.gov.uk/brownfield-site-register,0.08,not owned by a public authority,,permissioned,full planning permission,2015-04-07,,6,6,yes,. Demolition of existing dwelling and construction of a two storey building with rooms in roofspace comprising of 6no. self-contained flats plus 6no. parking spaces in basement level carpark,2017-12-19,2017-12-19,
http://opendatacommunities.org/id/london-borough-council/barnet,15/01294/PNO,"42-46 Station Road, Edgware, Middlesex",-0.277623,51.611506,https://maps.london.gov.uk/brownfield-site-register,0.02,not owned by a public authority,,permissioned,planning permission granted under an order,2015-04-28,,8,8,yes,. Change of use from Use Class B1 (office) to Use Class C3 (residential) to provide 8 Units,2017-12-19,2017-12-19,
http://opendatacommunities.org/id/london-borough-council/barnet,15/03137/FUL,"Land At Broadfields Primary School, Roseberry Drive, Edgware",-0.273686,51.629621,https://maps.london.gov.uk/brownfield-site-register,3.12,owned by a public authority,,permissioned,full planning permission,2016-04-08,,112,112,yes,. Development of site between Broadfields Primary School and Hartland Drive to provide 112 residential units (Use Class C3) comprising 52 houses (2-3 storeys) and an apartment block (3-4 storeys) of 60 flats. New vehicular access incorporating a mini-round,2017-12-19,2017-12-19,
http://opendatacommunities.org/id/london-borough-council/barnet,16/0112/FUL,"102-124 Station Road And Car Park To Rear, Edgware, Middlesex",-0.276751,51.612041,https://maps.london.gov.uk/brownfield-site-register,0.63,owned by a public authority,,permissioned,full planning permission,2016-10-07,,122,122,yes,". Demolition of 120-124 Station Road and full planning permission for the rebuilding and extension of 102-120 Station Road to provide 1,705sqm retail floorspace (Use Class A1/A2) including a new frontage to Approach Road; redevelopment of rear car park for",2017-12-19,2017-12-19,
http://opendatacommunities.org/id/london-borough-council/barnet,17/1065/FUL,"80 The Grove, Edgware",-0.270196,51.621854,https://maps.london.gov.uk/brownfield-site-register,0.17,not owned by a public authority,,permissioned,full planning permission,2017-06-26,,6,6,yes,. Demolition of the existing dwelling and the erection of a two-storey buliding with rooms in roof space and basement level to provide 6 self-contained flats. Provision for parking,2017-12-19,2017-12-19,
http://opendatacommunities.org/id/london-borough-council/barnet,F/03731/14,"239 Regents Park Road, London",-0.198882,51.595756,https://maps.london.gov.uk/brownfield-site-register,0.15,not owned by a public authority,,permissioned,planning permission granted under an order,2014-09-16,,16,16,yes,. Change of use from B1 office to C3 residential (16 Units),2017-12-19,2017-12-19,
http://opendatacommunities.org/id/london-borough-council/barnet,16/3417/PNO,"Dove House, Gadd House And Cooper House, Arcadia Avenue, London",-0.194882,51.599418,https://maps.london.gov.uk/brownfield-site-register,0.21,not owned by a public authority,,permissioned,planning permission granted under an order,2016-07-14,,88,88,yes,". Change of use from Class B1 (Office) at upper levels to Class C3 (Residential) (88 Units)

The existing parking at the lower floor levels of Dove House and Gadd House will be retained and reconfigured to provide a total of 77 car parking spaces (54 spa",2017-12-19,2017-12-19,
http://opendatacommunities.org/id/london-borough-council/barnet,16/3250/FUL,"Garages At Basing Way, Land Between 98-108 And 182-192 Basing Way, London",-0.189304,51.593721,https://maps.london.gov.uk/brownfield-site-register,0.28,owned by a public authority,,permissioned,full planning permission,2017-02-08,,14,14,yes,". Demolition of existing garages and redevelopment to provide a 4-storey building comprising 14no. self-contained flats with associated landscaping, car parking, cycle and refuse storage; and enclosure of existing electrical substation within a new structu",2017-12-19,2017-12-19,
http://opendatacommunities.org/id/london-borough-council/barnet,17/0047/PNO,"298-304 Regents Park Road, London",-0.19552,51.598996,https://maps.london.gov.uk/brownfield-site-register,0.71,not owned by a public authority,,permissioned,planning permission granted under an order,2017-03-17,,130,130,yes,". Change of use from Class B1 (Office) to Class C3 (Residential) (130 Unit), that involves conversion of Upper Ground  to 4th floors of Berkley House & Marlborough House, Lower Ground Floor to 2nd Floors of Molento House and Upper Ground to 2nd Floors of S",2017-12-19,2017-12-19,
http://opendatacommunities.org/id/london-borough-council/barnet,F/00550/11,"698 Finchley Road, London",-0.196374,51.576339,https://maps.london.gov.uk/brownfield-site-register,0.06,not owned by a public authority,,permissioned,full planning permission,2011-05-06,,9,9,yes,. Extension to the time limit for implementing planning permission C/06012/AJ/07 dated 06/05/08 for 'Demolition of building and erection of a 5 storey building with offices (Class A2) at ground floor and 9 self contained flats on upper floors. Provision of,2017-12-19,2017-12-19,
