OrganisationURI,SiteReference,SiteNameAddress,GeoX,GeoY,SiteplanURL,Hectares,OwnershipStatus,HazardousSubstances,PlanningStatus,PermissionType,PermissionDate,PlanningHistory,NetDwellingsRangeFrom,NetDwellingsRangeTo,Deliverable,Notes,FirstAddedDate,LastUpdatedDate,EndDate
http://opendatacommunities.org/id/metropolitan-district-council/calderdale,BLR126,"Stannary Place, Halifax.",-1.866482,53.726903,https://maps.calderdale.gov.uk/map/Aurora.svc/run?script=%5CAurora%5CScripts%5CBrownfield%20Land%20Register%202020.AuroraScript%24&nocache=b3a8172e-c974-a20b-e60c-877a0098b807&resize=always&inspect_query=BLR2020&inspect_value=BLR126,2.71,not owned by a public authority,,permissioned,outline planning permission,2018-06-11,https://portal.calderdale.gov.uk/online-applications/search.do?action=advanced,141,141,yes,"18/00310/OUT - Residential development (Use Class C3), landscaping and associated works - Phase 1 of the Beech Hill Regeneration Scheme (Outline). Granted 11.06.18. This site has also been allocated as a New Housing Site in the Local Plan Publication Dra",2020-05-31,2020-05-31,
http://opendatacommunities.org/id/metropolitan-district-council/calderdale,BLR127,"Grounds of Lands House, New Hey Road, Rastrick, Brighouse.",-1.801858,53.68067,https://maps.calderdale.gov.uk/map/Aurora.svc/run?script=%5CAurora%5CScripts%5CBrownfield%20Land%20Register%202020.AuroraScript%24&nocache=b3a8172e-c974-a20b-e60c-877a0098b807&resize=always&inspect_query=BLR2020&inspect_value=BLR127,0.35,not owned by a public authority,,permissioned,full planning permission,2019-05-15,https://portal.calderdale.gov.uk/online-applications/search.do?action=advanced,7,7,yes,"19/00251/FUL - Construction of two detached dwellings. Granted 15.05.19. 17/01268/FUL - Conversion of Lands House into 11 residential apartments, residential development of five dwellings and block of six apartments to the rear. Granted 02.07.18. The 201",2020-05-31,2020-05-31,
http://opendatacommunities.org/id/metropolitan-district-council/calderdale,BLR128,"Church View Development Site, Church View, Sowerby Bridge.",-1.908916,53.710273,https://maps.calderdale.gov.uk/map/Aurora.svc/run?script=%5CAurora%5CScripts%5CBrownfield%20Land%20Register%202020.AuroraScript%24&nocache=b3a8172e-c974-a20b-e60c-877a0098b807&resize=always&inspect_query=BLR2020&inspect_value=BLR128,1.23,mixed ownership,,permissioned,outline planning permission,2018-07-27,https://portal.calderdale.gov.uk/online-applications/search.do?action=advanced,44,44,,"17/01345/OUT - Residential development of 44 houses (Outline). Granted 27.07.18. This site is also allocated as a New Housing Site in the Local Plan Publication Draft, LP1654.",2020-05-31,2020-05-31,
http://opendatacommunities.org/id/metropolitan-district-council/calderdale,BLR130,"Cal Val Works, Hoo Hole, Cragg Road, Mytholmroyd, Hebden Bridge.",-1.988559,53.724658,https://maps.calderdale.gov.uk/map/Aurora.svc/run?script=%5CAurora%5CScripts%5CBrownfield%20Land%20Register%202020.AuroraScript%24&nocache=b3a8172e-c974-a20b-e60c-877a0098b807&resize=always&inspect_query=BLR2020&inspect_value=BLR130,0.73,not owned by a public authority,,pending decision,,,https://portal.calderdale.gov.uk/online-applications/search.do?action=advanced,21,21,,20/00105/FUL - Demolition of existing works building and construction of 21 residential dwellings (Revised Scheme to 14/00918) (Additional Plans),2020-05-31,2020-05-31,
http://opendatacommunities.org/id/metropolitan-district-council/calderdale,BLR131,"Stansfield Mill, Stansfield Mill Lane, Triangle, Sowerby Bridge.",-1.934909,53.695925,https://maps.calderdale.gov.uk/map/Aurora.svc/run?script=%5CAurora%5CScripts%5CBrownfield%20Land%20Register%202020.AuroraScript%24&nocache=b3a8172e-c974-a20b-e60c-877a0098b807&resize=always&inspect_query=BLR2020&inspect_value=BLR131,0.24,not owned by a public authority,,permissioned,outline planning permission,2018-09-04,https://portal.calderdale.gov.uk/online-applications/search.do?action=advanced,20,20,,"17/00660/OUT - Demolition of Mill Building and construction of 20 apartments in a single block, plus provision of parking area (Outline). Granted 04.09.18",2020-05-31,2020-05-31,
http://opendatacommunities.org/id/metropolitan-district-council/calderdale,BLR132,"The Probation Centre, Spring Hall Lane, Halifax.",-1.8919,53.722147,https://maps.calderdale.gov.uk/map/Aurora.svc/run?script=%5CAurora%5CScripts%5CBrownfield%20Land%20Register%202020.AuroraScript%24&nocache=b3a8172e-c974-a20b-e60c-877a0098b807&resize=always&inspect_query=BLR2020&inspect_value=BLR132,0.33,not owned by a public authority,,permissioned,other,2018-09-06,https://portal.calderdale.gov.uk/online-applications/search.do?action=advanced,36,36,,18/56007/CLAS3O - Prior approval application for a change of use from office use (Class B1a) to form thirty six apartments (Class C3). Granted 06.09.18,2020-05-31,2020-05-31,
http://opendatacommunities.org/id/metropolitan-district-council/calderdale,BLR133,"Crown House, 60 Crown Street, Halifax.",-1.862777,53.72365,https://maps.calderdale.gov.uk/map/Aurora.svc/run?script=%5CAurora%5CScripts%5CBrownfield%20Land%20Register%202020.AuroraScript%24&nocache=b3a8172e-c974-a20b-e60c-877a0098b807&resize=always&inspect_query=BLR2020&inspect_value=BLR133,0.06,not owned by a public authority,,permissioned,other,2018-10-29,https://portal.calderdale.gov.uk/online-applications/search.do?action=advanced,42,42,,18/56013/CLAS3O - Prior approval application for a change of use from offices (B1a) to 42 apartments (C3). Granted 2910.18,2020-05-31,2020-05-31,
http://opendatacommunities.org/id/metropolitan-district-council/calderdale,BLR134,"Building North West Of Princess Works, Birds Royd Lane, Brighouse.",-1.778302,53.698943,https://maps.calderdale.gov.uk/map/Aurora.svc/run?script=%5CAurora%5CScripts%5CBrownfield%20Land%20Register%202020.AuroraScript%24&nocache=b3a8172e-c974-a20b-e60c-877a0098b807&resize=always&inspect_query=BLR2020&inspect_value=BLR134,0.49,mixed ownership,,permissioned,full planning permission,2018-12-04,https://portal.calderdale.gov.uk/online-applications/search.do?action=advanced,100,100,yes,"17/01556/FUL - Demolition of existing buildings and erection of 100 residential units in three blocks plus gymnasium, car parking, public realm, landscaping and ancillary works. (Amended Drawings). Granted 04.12.18. Also allocated as New Housing Site in",2020-05-31,2020-05-31,
http://opendatacommunities.org/id/metropolitan-district-council/calderdale,BLR135,"Old Town Mill, Old Town Mill Lane, Old Town, Hebden Bridge.",-2.003554,53.751952,https://maps.calderdale.gov.uk/map/Aurora.svc/run?script=%5CAurora%5CScripts%5CBrownfield%20Land%20Register%202020.AuroraScript%24&nocache=b3a8172e-c974-a20b-e60c-877a0098b807&resize=always&inspect_query=BLR2020&inspect_value=BLR135,0.48,not owned by a public authority,,permissioned,full planning permission,2018-12-21,https://portal.calderdale.gov.uk/online-applications/search.do?action=advanced,25,25,yes,"18/00045/FUL - Conversion of Mill to create 21 dwellings with small business units and cafe.  Demolition of sheds.  Construction of 4 new dwellings.  Provision of car parking, gardens and landscaped areas.. Granted 21.12.18.",2020-05-31,2020-05-31,
http://opendatacommunities.org/id/metropolitan-district-council/calderdale,BLR136,"6 Carlton Street, Halifax.",-1.862265,53.721376,https://maps.calderdale.gov.uk/map/Aurora.svc/run?script=%5CAurora%5CScripts%5CBrownfield%20Land%20Register%202020.AuroraScript%24&nocache=b3a8172e-c974-a20b-e60c-877a0098b807&resize=always&inspect_query=BLR2020&inspect_value=BLR136,0.03,not owned by a public authority,,permissioned,full planning permission,2019-01-07,https://portal.calderdale.gov.uk/online-applications/search.do?action=advanced,6,6,yes,18/01288/CON - Conversion of existing vacant Office building (Use class B1a) into 6 Residential Units (C3),2020-05-31,2020-05-31,
http://opendatacommunities.org/id/metropolitan-district-council/calderdale,BLR137,"Star Inn, 29 Bridge End, Brighouse.",-1.783207,53.698305,https://maps.calderdale.gov.uk/map/Aurora.svc/run?script=%5CAurora%5CScripts%5CBrownfield%20Land%20Register%202020.AuroraScript%24&nocache=b3a8172e-c974-a20b-e60c-877a0098b807&resize=always&inspect_query=BLR2020&inspect_value=BLR137,0.07,not owned by a public authority,,permissioned,full planning permission,2019-02-13,https://portal.calderdale.gov.uk/online-applications/search.do?action=advanced,10,10,yes,18/00656/FUL - Conversion of  public house (A4 Use) to create 10 self-contained apartments (C3 Use) (Nine 2 bedroom apartments and one 1 bedroom apartment),2020-05-31,2020-05-31,
http://opendatacommunities.org/id/metropolitan-district-council/calderdale,BLR138,"Bailiff Bridge Club House, Bailiff Bridge Bowling Club, Birkby Lane, Bailiff Bridge, Brighouse.",-1.774961,53.722092,https://maps.calderdale.gov.uk/map/Aurora.svc/run?script=%5CAurora%5CScripts%5CBrownfield%20Land%20Register%202020.AuroraScript%24&nocache=b3a8172e-c974-a20b-e60c-877a0098b807&resize=always&inspect_query=BLR2020&inspect_value=BLR138,0.07,not owned by a public authority,,permissioned,full planning permission,2019-02-01,https://portal.calderdale.gov.uk/online-applications/search.do?action=advanced,5,5,yes,18/01132/FUL - Change of use of former club/day nursery to 4no. 2-bed houses and 1no. 2-bed apartment and a pair of semi-detached houses. Granted 01.02.19.,2020-05-31,2020-05-31,
http://opendatacommunities.org/id/metropolitan-district-council/calderdale,BLR139,"Perseverance Works, Dewsbury Road, Elland.",-1.832055,53.683783,https://maps.calderdale.gov.uk/map/Aurora.svc/run?script=%5CAurora%5CScripts%5CBrownfield%20Land%20Register%202020.AuroraScript%24&nocache=b3a8172e-c974-a20b-e60c-877a0098b807&resize=always&inspect_query=BLR2020&inspect_value=BLR139,0.58,not owned by a public authority,,permissioned,outline planning permission,2019-02-21,https://portal.calderdale.gov.uk/online-applications/search.do?action=advanced,90,90,,18/00815/OUT - Demolition of existing buildings to facilitate residential development of up to 90 apartments with associated vehicular access (Outline). Granted 21.02.19. The site has been allocated as a Mixed Use Site in the Local Plan Publication Draft,2020-05-31,2020-05-31,
http://opendatacommunities.org/id/metropolitan-district-council/calderdale,BLR140,"11 to 15 Clare Road, Halifax.",-1.858852,53.719647,https://maps.calderdale.gov.uk/map/Aurora.svc/run?script=%5CAurora%5CScripts%5CBrownfield%20Land%20Register%202020.AuroraScript%24&nocache=b3a8172e-c974-a20b-e60c-877a0098b807&resize=always&inspect_query=BLR2020&inspect_value=BLR140,0.07,not owned by a public authority,,permissioned,other,2019-02-01,https://portal.calderdale.gov.uk/online-applications/search.do?action=advanced,11,11,,18/56015/CLAS3O - Prior Approval application for a change of use from an Office (B1a) to Residential Use (C3)  - 11 Flats. Granted 01.02.19.,2020-05-31,2020-05-31,
http://opendatacommunities.org/id/metropolitan-district-council/calderdale,BLR141,"28 Clare Road, Halifax.",-1.859586,53.719792,https://maps.calderdale.gov.uk/map/Aurora.svc/run?script=%5CAurora%5CScripts%5CBrownfield%20Land%20Register%202020.AuroraScript%24&nocache=b3a8172e-c974-a20b-e60c-877a0098b807&resize=always&inspect_query=BLR2020&inspect_value=BLR141,0.02,not owned by a public authority,,permissioned,other,2019-02-04,https://portal.calderdale.gov.uk/online-applications/search.do?action=advanced,8,8,,18/56016/CLAS3O - Prior Approval application for a change of use from an Office (B1a) to Residential Use (C3) - 8 Flats. Granted 04.02.19.,2020-05-31,2020-05-31,
http://opendatacommunities.org/id/metropolitan-district-council/calderdale,BLR142,"26 Clare Road, Halifax.",-1.859623,53.719849,https://maps.calderdale.gov.uk/map/Aurora.svc/run?script=%5CAurora%5CScripts%5CBrownfield%20Land%20Register%202020.AuroraScript%24&nocache=b3a8172e-c974-a20b-e60c-877a0098b807&resize=always&inspect_query=BLR2020&inspect_value=BLR142,0.02,not owned by a public authority,,permissioned,other,2019-02-04,https://portal.calderdale.gov.uk/online-applications/search.do?action=advanced,6,6,,18/56017/CLAS3O - Prior Approval application for a change of use from an Office (B1a) to Residential Use (C3) - 6 Flats. Granted 04.02.19,2020-05-31,2020-05-31,
http://opendatacommunities.org/id/metropolitan-district-council/calderdale,BLR143,"Site of Business Park, Halifax Road, Hipperholme, Brighouse.",-1.815835,53.726197,https://maps.calderdale.gov.uk/map/Aurora.svc/run?script=%5CAurora%5CScripts%5CBrownfield%20Land%20Register%202020.AuroraScript%24&nocache=b3a8172e-c974-a20b-e60c-877a0098b807&resize=always&inspect_query=BLR2020&inspect_value=BLR143,0.29,not owned by a public authority,,permissioned,full planning permission,2019-03-25,https://portal.calderdale.gov.uk/online-applications/search.do?action=advanced,14,14,yes,18/00800/FUL - Residential development of 14 dwellings and 5 commercial units (Amended). Granted 25.03.19.,2020-05-31,2020-05-31,
http://opendatacommunities.org/id/metropolitan-district-council/calderdale,BLR144,"Hipperholme Grammar Junior School, 45 Wakefield Road, Lightcliffe, Brighouse.",-1.807426,53.725857,https://maps.calderdale.gov.uk/map/Aurora.svc/run?script=%5CAurora%5CScripts%5CBrownfield%20Land%20Register%202020.AuroraScript%24&nocache=b3a8172e-c974-a20b-e60c-877a0098b807&resize=always&inspect_query=BLR2020&inspect_value=BLR144,0.52,not owned by a public authority,,permissioned,full planning permission,2019-03-21,https://portal.calderdale.gov.uk/online-applications/search.do?action=advanced,14,14,yes,18/01044/FUL - Demolition of existing building to facilitate construction of 14 dwellings. (Amended). Granted 21.03.19,2020-05-31,2020-05-31,
http://opendatacommunities.org/id/metropolitan-district-council/calderdale,BLR145,"Stafford Manor Care Home, 1 Stafford Avenue, Halifax.",-1.85938,53.708933,https://maps.calderdale.gov.uk/map/Aurora.svc/run?script=%5CAurora%5CScripts%5CBrownfield%20Land%20Register%202020.AuroraScript%24&nocache=b3a8172e-c974-a20b-e60c-877a0098b807&resize=always&inspect_query=BLR2020&inspect_value=BLR145,0.12,not owned by a public authority,,permissioned,full planning permission,2019-03-15,https://portal.calderdale.gov.uk/online-applications/search.do?action=advanced,6,6,yes,19/00062/CON - Conversion from House in Multiple Occupation (21 beds) to six apartments (amended plan). Granted 15.03.19,2020-05-31,2020-05-31,
http://opendatacommunities.org/id/metropolitan-district-council/calderdale,BLR146,"County Court, Coleridge Street, Halifax.",-1.860006,53.719313,https://maps.calderdale.gov.uk/map/Aurora.svc/run?script=%5CAurora%5CScripts%5CBrownfield%20Land%20Register%202020.AuroraScript%24&nocache=b3a8172e-c974-a20b-e60c-877a0098b807&resize=always&inspect_query=BLR2020&inspect_value=BLR146,0.07,mixed ownership,,permissioned,full planning permission,2019-05-01,https://portal.calderdale.gov.uk/online-applications/search.do?action=advanced,14,14,yes,18/01545/FUL - Conversion of existing County Court building to 14 supported living apartments (Use Class C3b). Granted 01.05.19,2020-05-31,2020-05-31,
http://opendatacommunities.org/id/metropolitan-district-council/calderdale,BLR147,"Littlemoor Farm, Great Edge, Luddenden, Sowerby Bridge.",-1.92229,53.720016,https://maps.calderdale.gov.uk/map/Aurora.svc/run?script=%5CAurora%5CScripts%5CBrownfield%20Land%20Register%202020.AuroraScript%24&nocache=b3a8172e-c974-a20b-e60c-877a0098b807&resize=always&inspect_query=BLR2020&inspect_value=BLR147,0.37,not owned by a public authority,,permissioned,full planning permission,2019-06-24,https://portal.calderdale.gov.uk/online-applications/search.do?action=advanced,5,5,yes,18/01019/FUL - Demolition of existing buildings to facilitate construction of five dwellings (Amended plans). Granted 26.06.19.,2020-05-31,2020-05-31,
http://opendatacommunities.org/id/metropolitan-district-council/calderdale,BLR148,"Adjacebt Yew Tree Inn, 20 Northowram Green, Northowram, Halifax.",-1.830585,53.742434,https://maps.calderdale.gov.uk/map/Aurora.svc/run?script=%5CAurora%5CScripts%5CBrownfield%20Land%20Register%202020.AuroraScript%24&nocache=b3a8172e-c974-a20b-e60c-877a0098b807&resize=always&inspect_query=BLR2020&inspect_value=BLR148,0.08,not owned by a public authority,,permissioned,full planning permission,2019-06-21,https://portal.calderdale.gov.uk/online-applications/search.do?action=advanced,8,8,yes,19/00420/FUL - Development comprising 8 one bedroom supported living apartments and associated works. Granted 21.06.19,2020-05-31,2020-05-31,
http://opendatacommunities.org/id/metropolitan-district-council/calderdale,BLR149,"Old Haugh End Cottage, Haugh End Lane, Sowerby Bridge. HX6 3BJ",-1.921502,53.70424,https://maps.calderdale.gov.uk/map/Aurora.svc/run?script=%5CAurora%5CScripts%5CBrownfield%20Land%20Register%202020.AuroraScript%24&nocache=b3a8172e-c974-a20b-e60c-877a0098b807&resize=always&inspect_query=BLR2020&inspect_value=BLR149,0.67,not owned by a public authority,,permissioned,full planning permission,2019-07-16,https://portal.calderdale.gov.uk/online-applications/search.do?action=advanced,9,9,yes,"18/00783/FUL - The conversion of former staff accommodation, stables and workshops to form 9 dwellings and the construction of 11 new build dwellings including a new access and driveway. Granted 16.07.19. The application relates to a larger site which en",2020-05-31,2020-05-31,
http://opendatacommunities.org/id/metropolitan-district-council/calderdale,BLR150,"Elm Royd Nursing Home, Elmwood Drive, Brighouse. HD6 2AL",-1.79106,53.70484,https://maps.calderdale.gov.uk/map/Aurora.svc/run?script=%5CAurora%5CScripts%5CBrownfield%20Land%20Register%202020.AuroraScript%24&nocache=b3a8172e-c974-a20b-e60c-877a0098b807&resize=always&inspect_query=BLR2020&inspect_value=BLR150,0.49,not owned by a public authority,,permissioned,full planning permission,2019-09-13,https://portal.calderdale.gov.uk/online-applications/search.do?action=advanced,35,35,,19/00544/FUL - Demolition of care home to facilitate block of 35 apartments with parking. Granted 13.09.19,2020-05-31,2020-05-31,
http://opendatacommunities.org/id/metropolitan-district-council/calderdale,BLR151,"Land at, Pear Place, Todmorden.",-2.145227,53.732685,https://maps.calderdale.gov.uk/map/Aurora.svc/run?script=%5CAurora%5CScripts%5CBrownfield%20Land%20Register%202020.AuroraScript%24&nocache=b3a8172e-c974-a20b-e60c-877a0098b807&resize=always&inspect_query=BLR2020&inspect_value=BLR151,0.06,not owned by a public authority,,permissioned,full planning permission,2011-05-13,https://portal.calderdale.gov.uk/online-applications/search.do?action=advanced,5,5,yes,11/00108/FUL - Five terraced dwellings. Granted 13.05.11,2020-05-31,2020-05-31,
http://opendatacommunities.org/id/metropolitan-district-council/calderdale,BLR152,Junction of Grosvener Place Burnley Road Luddenden Foot Halifax,-1.945314,53.723108,https://maps.calderdale.gov.uk/map/Aurora.svc/run?script=%5CAurora%5CScripts%5CBrownfield%20Land%20Register%202020.AuroraScript%24&nocache=b3a8172e-c974-a20b-e60c-877a0098b807&resize=always&inspect_query=BLR2020&inspect_value=BLR152,0.28,not owned by a public authority,,not permissioned,,,https://portal.calderdale.gov.uk/online-applications/search.do?action=advanced,11,11,,This site has been allocated a New Housing Site in the Local Plan Publication Draft LP0253. Capacity of 11 derived from the Local Plan however the owner has confirmed intention to develop as a mixed used with 23 units.,2020-05-31,2020-05-31,
http://opendatacommunities.org/id/metropolitan-district-council/calderdale,BLR153,Car Park Between Well Lane / King Street Halifax,-1.854334,53.724335,https://maps.calderdale.gov.uk/map/Aurora.svc/run?script=%5CAurora%5CScripts%5CBrownfield%20Land%20Register%202020.AuroraScript%24&nocache=b3a8172e-c974-a20b-e60c-877a0098b807&resize=always&inspect_query=BLR2020&inspect_value=BLR153,0.39,not owned by a public authority,,not permissioned,,,https://portal.calderdale.gov.uk/online-applications/search.do?action=advanced,77,77,,"This site has been allocated as a Mixed Use Site in the Local Plan Publication Draft LP0264. A range of uses are suitable for development on this site, including  town centre  (A) , offices (  B1a) , residential (C1, C2,C4) and  leisure/community (D1).",2020-05-31,2020-05-31,
http://opendatacommunities.org/id/metropolitan-district-council/calderdale,BLR154,Land off King Cross Street Halifax HX1 2SH,-1.866094,53.721138,https://maps.calderdale.gov.uk/map/Aurora.svc/run?script=%5CAurora%5CScripts%5CBrownfield%20Land%20Register%202020.AuroraScript%24&nocache=b3a8172e-c974-a20b-e60c-877a0098b807&resize=always&inspect_query=BLR2020&inspect_value=BLR154,0.41,mixed ownership,,not permissioned,,,https://portal.calderdale.gov.uk/online-applications/search.do?action=advanced,32,32,,"This site has been allocated as a Mixed Use Site in the Local Plan Publication Draft LP0254. The preferred use for the site is Mixed use to include, retail, leisure, residential and employment ( B1a). Lapsed Permission for mixed use scheme including resi",2020-05-31,2020-05-31,
http://opendatacommunities.org/id/metropolitan-district-council/calderdale,BLR155,Land off Halifax Road Todmorden OL14 5AT,-2.095432,53.714495,https://maps.calderdale.gov.uk/map/Aurora.svc/run?script=%5CAurora%5CScripts%5CBrownfield%20Land%20Register%202020.AuroraScript%24&nocache=b3a8172e-c974-a20b-e60c-877a0098b807&resize=always&inspect_query=BLR2020&inspect_value=BLR155,0.33,owned by a public authority,,not permissioned,,,https://portal.calderdale.gov.uk/online-applications/search.do?action=advanced,38,38,,"The site is allocated as an Additional Mxed Use Site in the Local Plan Housing Requirement Update and Potential Supply), LP0327. A mix of uses on this site are appropriate for its town centre location, to include residential and a mix of commercail/retai",2020-05-31,2020-05-31,
http://opendatacommunities.org/id/metropolitan-district-council/calderdale,BLR156,Land adjacent Mill Royd Street Mill Royd Street Brighouse HD6,-1.781225,53.700029,https://maps.calderdale.gov.uk/map/Aurora.svc/run?script=%5CAurora%5CScripts%5CBrownfield%20Land%20Register%202020.AuroraScript%24&nocache=b3a8172e-c974-a20b-e60c-877a0098b807&resize=always&inspect_query=BLR2020&inspect_value=BLR156,2.81,mixed ownership,,not permissioned,,,https://portal.calderdale.gov.uk/online-applications/search.do?action=advanced,200,200,,"The site is allocated as an Additional Mixed Use Site in the Local Plan Housing Requirement Update and Potential Supply), LP573. An appropriate mix of uses will be informed by a masterplan.",2020-05-31,2020-05-31,
http://opendatacommunities.org/id/metropolitan-district-council/calderdale,BLR157,126-128 Bradford Road Brighouse,-1.780048,53.708945,https://maps.calderdale.gov.uk/map/Aurora.svc/run?script=%5CAurora%5CScripts%5CBrownfield%20Land%20Register%202020.AuroraScript%24&nocache=b3a8172e-c974-a20b-e60c-877a0098b807&resize=always&inspect_query=BLR2020&inspect_value=BLR157,0.42,not owned by a public authority,,not permissioned,,,https://portal.calderdale.gov.uk/online-applications/search.do?action=advanced,60,60,,"This site is allocated as a Mixed Use Site in the Local Plan Publication Draft, LP0579. The mix of uses to include residential and B1a.",2020-05-31,2020-05-31,
http://opendatacommunities.org/id/metropolitan-district-council/calderdale,BLR158,Stoney Royd Mill Albion Mills Bailey Hall Road Halifax,-1.852849,53.721884,https://maps.calderdale.gov.uk/map/Aurora.svc/run?script=%5CAurora%5CScripts%5CBrownfield%20Land%20Register%202020.AuroraScript%24&nocache=b3a8172e-c974-a20b-e60c-877a0098b807&resize=always&inspect_query=BLR2020&inspect_value=BLR158,1.51,mixed ownership,,not permissioned,,,https://portal.calderdale.gov.uk/online-applications/search.do?action=advanced,79,79,,"The site is allocated as a Mixed Use Site in the Local Plan Publication Draft, LP0749.",2020-05-31,2020-05-31,
http://opendatacommunities.org/id/metropolitan-district-council/calderdale,BLR159,Land Opposite 46-48 Hollins Road Walsden Todmorden OL14 8BJ,-2.104694,53.699953,https://maps.calderdale.gov.uk/map/Aurora.svc/run?script=%5CAurora%5CScripts%5CBrownfield%20Land%20Register%202020.AuroraScript%24&nocache=b3a8172e-c974-a20b-e60c-877a0098b807&resize=always&inspect_query=BLR2020&inspect_value=BLR159,0.15,not owned by a public authority,,not permissioned,,,https://portal.calderdale.gov.uk/online-applications/search.do?action=advanced,11,11,yes,Lapsed Permission for 11 dwellings - 11/01011/OUT. This brownfield site is part of a larger (majority greenfield) New Housing Site allocated in the Local Plan Publication Draft LP0914.,2020-05-31,2020-05-31,
http://opendatacommunities.org/id/metropolitan-district-council/calderdale,BLR160,Former Hebden Bridge Fire Station Valley Road Hebden Bridge HX7 7BY,-2.012574,53.743284,https://maps.calderdale.gov.uk/map/Aurora.svc/run?script=%5CAurora%5CScripts%5CBrownfield%20Land%20Register%202020.AuroraScript%24&nocache=b3a8172e-c974-a20b-e60c-877a0098b807&resize=always&inspect_query=BLR2020&inspect_value=BLR160,0.37,mixed ownership,,not permissioned,,,https://portal.calderdale.gov.uk/online-applications/search.do?action=advanced,11,11,,"The site is allocated as a Mixed Use Site in the Local Plan Publication Draft, LP0922, to include town centre uses and residential. Part of the site has a lapsed permssion for residential - 10/01268/REN.",2020-05-31,2020-05-31,
