OrganisationURI,SiteReference,SiteNameAddress,GeoX,GeoY,SiteplanURL,Hectares,OwnershipStatus,HazardousSubstances,PlanningStatus,PermissionType,PermissionDate,PlanningHistory,NetDwellingsRangeFrom,NetDwellingsRangeTo,Deliverable,Notes,FirstAddedDate,LastUpdatedDate,EndDate
http://opendatacommunities.org/id/district-council/waverley,10a,"Dunsfold Aerodrome, Stovolds Hill, Cranleigh",-0.535632,51.116282,http://85.92.197.215/ishare5.4.web/atsolomap_brownfieldreg.html,214,not owned by a public authority,,permissioned,outline planning permission,2018-03-29,http://planning360.waverley.gov.uk/planning/search-applications?civica.query.FullTextSearch=wa%2F2015%2F2395#VIEW?RefType=GFPlanning&KeyNo=279094&KeyText=Subjecthttp://planning360.waverley.gov.uk/planning/search-applications?civica.query.FullTextSearch=WA%2F2019%2F1278#VIEW?RefType=GFPlanning&KeyNo=371098&KeyText=Subject,2600,2600,yes,"Site forms part of a larger promoted  site which includes elements of greenfield, only the brownfield element has been included. This is a strategic site within the Waverley Local Plan Part 1 with an allocation of 2600 with planning permission granted for 1,800. Planning permission granted for new access road.",2017-12-15,2019-12-04,
http://opendatacommunities.org/id/district-council/waverley,130,"Cranleigh C of E Primary School (Infant), Church Lane, Cranleigh",-0.485114,51.142539,http://85.92.197.215/ishare5.4.web/atsolomap_brownfieldreg.html,0.61,owned by a public authority,,not permissioned,,,http://planning360.waverley.gov.uk/planning/search-applications?civica.query.FullTextSearch=WA%2F2017%2F1389#VIEW?RefType=GFPlanning&KeyNo=309693&KeyText=Subject,20,20,yes,,2017-12-15,2019-12-04,
http://opendatacommunities.org/id/district-council/waverley,132a,"Coal Yard, 6 The Street, Wrecclesham, Farnham",-0.818773,51.199569,http://85.92.197.215/ishare5.4.web/atsolomap_brownfieldreg.html,0.27,not owned by a public authority,,permissioned,full planning permission,2018-09-28,http://planning360.waverley.gov.uk/planning/search-applications?civica.query.FullTextSearch=wa%2F2018%2F0840#VIEW?RefType=GFPlanning&KeyNo=318229&KeyText=Subject|http://planning360.waverley.gov.uk/planning/search-applications?civica.query.FullTextSearch=wa%2F2016%2F1264#VIEW?RefType=GFPlanning&KeyNo=287343&KeyText=Subject,9,9,yes,,2017-12-15,2018-12-12,2019-12-04
http://opendatacommunities.org/id/district-council/waverley,133a,"Colemans Yard, Wrecclesham Road, Farnham",-0.81658,51.199888,http://85.92.197.215/ishare5.4.web/atsolomap_brownfieldreg.html,0.24,not owned by a public authority,,not permissioned,,,,10,10,,The site is an allocation in the Farnham Neighbourhood Plan.,2017-12-15,2019-12-04,
http://opendatacommunities.org/id/district-council/waverley,144,"Central Hindhead, London Road, Hindhead",-0.731194,51.114449,http://85.92.197.215/ishare5.4.web/atsolomap_brownfieldreg.html,1.64,not owned by a public authority,,not permissioned,,,,34,34,yes,,2017-12-15,2018-12-12,
http://opendatacommunities.org/id/district-council/waverley,245,"Site of 5 to 21 Wey Hill, Haslemere",-0.723738,51.08791,http://85.92.197.215/ishare5.4.web/atsolomap_brownfieldreg.html,0.31,not owned by a public authority,,permissioned,full planning permission,2018-11-21,http://planning360.waverley.gov.uk/planning/search-applications?civica.query.FullTextSearch=wa%2F2010%2F1568#VIEW?RefType=GFPlanning&KeyNo=173378&KeyText=Subject|http://planning360.waverley.gov.uk/planning/search-applications?civica.query.FullTextSearch=wa%2F2017%2F0920#VIEW?RefType=GFPlanning&KeyNo=308178&KeyText=Subject,45,45,yes,"Erection of 45 apartments in 2 blocks including associated semi-basement parking, amenity space, landscaping and new access.",2017-12-15,2018-12-12,
http://opendatacommunities.org/id/district-council/waverley,264,"Victoria House, South Street, Farnham",-0.795983,51.214095,http://85.92.197.215/ishare5.4.web/atsolomap_brownfieldreg.html,0.06,not owned by a public authority,,not permissioned,,,,8,8,,,2017-12-15,2017-12-15,
http://opendatacommunities.org/id/district-council/waverley,368,"Wheeler Street Nurseries, Wheeler Lane, Witley, Godalming",-0.649846,51.157423,http://85.92.197.215/ishare5.4.web/atsolomap_brownfieldreg.html,0.71,not owned by a public authority,,permissioned,full planning permission,2019-01-23,http://planning360.waverley.gov.uk/planning/search-applications?civica.query.FullTextSearch=wa%2F2018%2F1688#VIEW?RefType=GFPlanning&KeyNo=326779&KeyText=Subject,18,18,yes,Erection of 18 dwellings (including 5 affordable dwellings following demolition of existing dwelling and all other structures,2017-12-15,2018-12-12,2019-12-04
http://opendatacommunities.org/id/district-council/waverley,383a,"Cranleigh C of E Primary School (Junior), Parsonage Road, Cranleigh",-0.488236,51.142421,http://85.92.197.215/ishare5.4.web/atsolomap_brownfieldreg.html,1.98,mixed ownership,,not permissioned,,,http://planning360.waverley.gov.uk/planning/search-applications?civica.query.FullTextSearch=wa%2F2017%2F1389#VIEW?RefType=GFPlanning&KeyNo=309693&KeyText=Subject,70,70,yes,,2017-12-15,2019-12-04,
http://opendatacommunities.org/id/district-council/waverley,478a,"Part of SSE Farnham Depot, Lower Weybourne Lane, Farnham",-0.770997,51.231888,http://85.92.197.215/ishare5.4.web/atsolomap_brownfieldreg.html,1.79,not owned by a public authority,,not permissioned,,,,52,52,,,2017-12-15,2019-12-04,
http://opendatacommunities.org/id/district-council/waverley,556a,"Guildford Road Service Station, 13 Guildford Road, Farnham",-0.78659,51.219082,http://85.92.197.215/ishare5.4.web/atsolomap_brownfieldreg.html,0.19,not owned by a public authority,,not permissioned,,,http://planning360.waverley.gov.uk/planning/search-applications?civica.query.FullTextSearch=wa%2F2017%2F1485#VIEW?RefType=GFPlanning&KeyNo=308731&KeyText=Subject,5,10,yes,The site is an allocation in the Farnham Neighbourhood Plan.,2017-12-15,2018-12-12,
http://opendatacommunities.org/id/district-council/waverley,619a,"Land at Farnham College, Morley Road, Farnham",-0.794608,51.20789,http://85.92.197.215/ishare5.4.web/atsolomap_brownfieldreg.html,0.47,owned by a public authority,,permissioned,full planning permission,2016-11-17,http://planning360.waverley.gov.uk/planning/search-applications?civica.query.FullTextSearch=wa%2F2014%2F2119#VIEW?RefType=GFPlanning&KeyNo=256780&KeyText=Subject,14,14,yes,"Erection of 14 dwellings together with associated garaging, car parking and landscaping following removal of tennis courts and demolition of storage building; formation of new vehicular access off Firgrove Hill.  The site is an allocation in the Farnham Neighbourhood Plan",2017-12-15,2017-12-15,
http://opendatacommunities.org/id/district-council/waverley,648a,"Woodside Park, Catteshall Lane, Godalming",-0.600203,51.185901,http://85.92.197.215/ishare5.4.web/atsolomap_brownfieldreg.html,1.67,not owned by a public authority,,permissioned,outline planning permission,2017-05-26,http://planning360.waverley.gov.uk/planning/search-applications?civica.query.FullTextSearch=WA%2F1992%2F1212#VIEW?RefType=GFPlanning&KeyNo=289121&KeyText=Subject|http://planning360.waverley.gov.uk/planning/search-applications?civica.query.FullTextSearch=WA%2F1992%2F1212#VIEW?RefType=GFPlanning&KeyNo=279771&KeyText=Subject|http://planning360.waverley.gov.uk/planning/search-applications?civica.query.FullTextSearch=WA%2F1992%2F1212#VIEW?RefType=GFPlanning&KeyNo=265668&KeyText=Subject|http://planning360.waverley.gov.uk/planning/search-\applications?civica.query.FullTextSearch=WA%2F1992%2F1212#VIEW?RefType=GFPlanning&KeyNo=172461&KeyText=Subject|http://planning360.waverley.gov.uk/planning/search-applications?civica.query.FullTextSearch=WA%2F1992%2F1212#VIEW?RefType=GFPlanning&KeyNo=106142&KeyText=Subject|http://planning360.waverley.gov.uk/planning/search-applications?civica.query.FullTextSearch=WA%2F1992%2F1212#VIEW?RefType=GFPlanning&KeyNo=104392&KeyText=Subject|http://planning360.waverley.gov.uk/planning/search-applications?civica.query.FullTextSearch=WA%2F1992%2F1212#VIEW?RefType=GFPlanning&KeyNo=104926&KeyText=Subject|http://planning360.waverley.gov.uk/planning/search-applications?civica.query.FullTextSearch=WA%2F1992%2F1212#VIEW?RefType=GFPlanning&KeyNo=91019&KeyText=Subject|http://planning360.waverley.gov.uk/planning/search-applications?civica.query.FullTextSearch=WA%2F1992%2F1212#VIEW?RefType=GFPlanning&KeyNo=88587&KeyText=Subject|http://planning360.waverley.gov.uk/planning/search-applications?civica.query.FullTextSearch=WA%2F1992%2F1212#VIEW?RefType=GFPlanning&KeyNo=73541&KeyText=Subject,100,100,yes,"Outline application for the erection of up to 100 dwellings, including 17 affordable, together with associated amenity/play space; following demolition of existing buildings except the ambulance station together with associated works. This is a strategic site within the Waverley Plocal Plan Part 1. Reserved matters WA/2018/1675 refused October 2019",2017-12-15,2019-12-04,
http://opendatacommunities.org/id/district-council/waverley,676,"Land south of Franklin Court, Brook Road, Wormley, Witley",-0.647846,51.135681,http://85.92.197.215/ishare5.4.web/atsolomap_brownfieldreg.html,0.34,not owned by a public authority,,not permissioned,,,,5,6,yes,"Site has been promoted for 6-10 dwellings, this would result in a net increase of 4-6 dwellings.",2017-12-15,2017-12-15,
http://opendatacommunities.org/id/district-council/waverley,697,"Land at Wey Hill, Haslemere",-0.724053,51.088808,http://85.92.197.215/ishare5.4.web/atsolomap_brownfieldreg.html,0.98,owned by a public authority,,not permissioned,,,,31,40,yes,,2017-12-15,2017-12-15,
http://opendatacommunities.org/id/district-council/waverley,699a,"Ockford Ridge, Godalming",-0.629229,51.178966,http://85.92.197.215/ishare5.4.web/atsolomap_brownfieldreg.html,3.11,owned by a public authority,,permissioned,reserved matters approval,2017-11-30,http://planning360.waverley.gov.uk/planning/search-applications?civica.query.FullTextSearch=WA%2F2014%2F0932#VIEW?RefType=GFPlanning&KeyNo=247563&KeyText=Subject|http://planning360.waverley.gov.uk/planning/search-applications?civica.query.FullTextSearch=WA%2F2014%2F0932#VIEW?RefType=GFPlanning&KeyNo=312129&KeyText=Subject,12,12,yes,Erection 17 dwellings at site B following the demolition of 14 existing houses. Erection of 30 dwellings at Site C following the demolition of 21 existing houses. In total this represents a net gain of 12 dwellings.  This is a reduction of 2 dwellings due to the redesign of the scheme,2017-12-15,2019-12-04,
http://opendatacommunities.org/id/district-council/waverley,770,"19 Knowle Farm, Old Park Lane, Farnham",-0.811042,51.224917,http://85.92.197.215/ishare5.4.web/atsolomap_brownfieldreg.html,0.91,not owned by a public authority,,permissioned,full planning permission,2017-09-26,http://planning360.waverley.gov.uk/planning/search-applications?civica.query.FullTextSearch=wa%2F2017%2F0137#VIEW?RefType=GFPlanning&KeyNo=303942&KeyText=Subject|http://planning360.waverley.gov.uk/planning/search-applications?civica.query.FullTextSearch=WA%2F2015%2F1694#VIEW?RefType=GFPlanning&KeyNo=273357&KeyText=Subject,9,9,yes,"Erection of 9 dwellings with associated access, parking, amenity space and landscaping following demolition of existing buildings, structures, and hardstanding",2017-12-15,2017-12-15,2019-12-04
http://opendatacommunities.org/id/district-council/waverley,862,"Land at Harts Yard, 114-115 West Street, Farnham",-0.800697,51.21494,http://85.92.197.215/ishare5.4.web/atsolomap_brownfieldreg.html,0.19,not owned by a public authority,,permissioned,full planning permission,2015-06-08,http://planning360.waverley.gov.uk/planning/search-applications?civica.query.FullTextSearch=WA%2F2014%2F0932#VIEW?RefType=GFPlanning&KeyNo=261239&KeyText=Subject,13,13,yes,Erection of buildings to provide 13 residential units and associated parking following partial demolition of existing buildings,2017-12-15,2017-12-15,
http://opendatacommunities.org/id/district-council/waverley,882,"2-3 The Borough, Farnham",-0.799957,51.214954,http://85.92.197.215/ishare5.4.web/atsolomap_brownfieldreg.html,0.12,not owned by a public authority,,permissioned,full planning permission,2016-05-12,http://planning360.waverley.gov.uk/planning/search-applications?civica.query.FullTextSearch=wa%2F2018%2F2185#VIEW?RefType=GFPlanning&KeyNo=277787&KeyText=Subject,11,11,yes,"Change of use, demolition and alterations to provide 12 dwellings. This would represent a net gain of 11 residential units.  Grade II Listed building",2017-12-15,2017-12-15,
http://opendatacommunities.org/id/district-council/waverley,915,"Catteshall Manor, Catteshall Lane, Godalming",-0.590782,51.186272,http://85.92.197.215/ishare5.4.web/atsolomap_brownfieldreg.html,0.05,not owned by a public authority,,not permissioned,,,http://planning360.waverley.gov.uk/planning/search-applications?civica.query.FullTextSearch=cr%2F2016%2F0002#VIEW?RefType=GFPlanning&KeyNo=284385&KeyText=Subject|http://planning360.waverley.gov.uk/planning/search-applications?civica.query.FullTextSearch=cr%2F2016%2F0002#VIEW?RefType=GFPlanning&KeyNo=278599&KeyText=Subject|http://planning360.waverley.gov.uk/planning/search-applications?civica.query.FullTextSearch=wa%2F2018%2F1675#VIEW?RefType=GFPlanning&KeyNo=354136&KeyText=Subject,17,17,yes,"Prior notification application G.P.D.O Part 3, Class O - change of use from Class B1a (office) to Class C3 (residential) use to provide 17 dwellings.",2017-12-15,2019-12-04,
http://opendatacommunities.org/id/district-council/waverley,978,"Standard House, Weyside Park, Godalming",-0.597377,51.188025,http://85.92.197.215/ishare5.4.web/atsolomap_brownfieldreg.html,0.1,not owned by a public authority,,permissioned,full planning permission,2018-08-17,http://planning360.waverley.gov.uk/planning/search-applications?civica.query.FullTextSearch=wa%2F2017%2F1474#VIEW?RefType=GFPlanning&KeyNo=308451&KeyText=Subject|http://planning360.waverley.gov.uk/planning/search-applications?civica.query.FullTextSearch=cr%2F2016%2F0019#VIEW?RefType=GFPlanning&KeyNo=292821&KeyText=Subject,19,19,yes,Prior approval required and granted for the change of use from Class B1a (office) to Class C3 (residential) use to provide 33 dwellings. However it is noted that 7 of the flats are shown within the roof space and could not be constructed within additional roof lights or works to the roof.,2017-12-15,2018-12-12,
http://opendatacommunities.org/id/district-council/waverley,995,"Branksome House, Filmer Grove, Godalming",-0.610675,51.191437,http://85.92.197.215/ishare5.4.web/atsolomap_brownfieldreg.html,0.32,not owned by a public authority,,permissioned,full planning permission,2018-06-28,http://planning360.waverley.gov.uk/planning/search-applications?civica.query.FullTextSearch=cr%2F2018%2F0009#VIEW?RefType=GFPlanning&KeyNo=320517&KeyText=Subject|http://planning360.waverley.gov.uk/planning/search-applications?civica.query.FullTextSearch=cr%2F2018%2F0009#VIEW?RefType=GFPlanning&KeyNo=313287&KeyText=Subject,9,17,yes,Prior approval required and granted for the change of use from office (Use Class B1a) to residential (Use Class C3) to provide 17 dwellings.,2017-12-15,2018-12-12,
http://opendatacommunities.org/id/district-council/waverley,B3,"24 Brighton Road, Godalming",-0.609536,51.184029,http://85.92.197.215/ishare5.4.web/atsolomap_brownfieldreg.html,0.16,not owned by a public authority,,permissioned,full planning permission,2017-12-19,http://planning360.waverley.gov.uk/planning/search-applications?civica.query.FullTextSearch=WA%2F2017%2F1730#VIEW?RefType=GFPlanning&KeyNo=312207&KeyText=Subject|http://planning360.waverley.gov.uk/planning/search-applications?civica.query.FullTextSearch=WA%2F2017%2F1730#VIEW?RefType=GFPlanning&KeyNo=184235&KeyText=Subject|http://planning360.waverley.gov.uk/planning/search-applications?civica.query.FullTextSearch=WA%2F2017%2F1730#VIEW?RefType=GFPlanning&KeyNo=171332&KeyText=Subject|http://planning360.waverley.gov.uk/planning/search-applications?civica.query.FullTextSearch=WA%2F2017%2F1730#VIEW?RefType=GFPlanning&KeyNo=136930&KeyText=Subject|http://planning360.waverley.gov.uk/planning/search-applications?civica.query.FullTextSearch=WA%2F2017%2F1730#VIEW?RefType=GFPlanning&KeyNo=25592&KeyText=Subject,14,14,yes,"Erection of 14 dwellings with parking, associated works and new access.",2017-12-15,2018-12-12,2019-12-04
http://opendatacommunities.org/id/district-council/waverley,772,"Westbrook Mills, Borough Road, Godalming",-0.61758,51.18917,http://85.92.197.215/ishare5.4.web/atsolomap_brownfieldreg.html,1.2,not owned by a public authority,,not permissioned,,,http://planning360.waverley.gov.uk/planning/search-applications?civica.query.FullTextSearch=CR%2F2018%2F0017#VIEW?RefType=GFPlanning&KeyNo=325871&KeyText=Subject|http://planning360.waverley.gov.uk/planning/search-applications?civica.query.FullTextSearch=CR%2F2018%2F0011#VIEW?RefType=GFPlanning&KeyNo=321590&KeyText=Subject|http://planning360.waverley.gov.uk/planning/search-applications?civica.query.FullTextSearch=cr%2F2018%2F0007#VIEW?RefType=GFPlanning&KeyNo=319608&KeyText=Subject,128,128,yes,Prior approval required and granted for the change of use from office (Use Class B1a) to residential (Use Class C3) to provide 128 dwellings with an additional prior approval required and granted for the change of use from office (Use class B1a) to residential (Use Class C3) to provide an additional 29 dwellings,2018-12-12,2018-12-12,
http://opendatacommunities.org/id/district-council/waverley,766,"Thornbrook House, Catteshall Lane, Godalming",-0.597691,51.188524,http://85.92.197.215/ishare5.4.web/atsolomap_brownfieldreg.html,0.48,not owned by a public authority,,permissioned,full planning permission,2018-01-31,http://planning360.waverley.gov.uk/planning/search-applications?civica.query.FullTextSearch=WA%2F2017%2F1798#VIEW?RefType=GFPlanning&KeyNo=312802&KeyText=Subject,5,5,yes,Erection of second and third floor extensions to the existing building to provide 7 flats. This would represent a net gain of 5 residential units.,2018-12-12,2019-12-04,2019-12-04
http://opendatacommunities.org/id/district-council/waverley,796,"Little Park Hatch, Bookhurst Road, Cranleigh",-0.471182,51.14533,http://85.92.197.215/ishare5.4.web/atsolomap_brownfieldreg.html,0.36,not owned by a public authority,,permissioned,full planning permission,2018-01-29,http://planning360.waverley.gov.uk/planning/search-applications?civica.query.FullTextSearch=WA%2F2018%2F0355#VIEW?RefType=GFPlanning&KeyNo=307769&KeyText=Subject|http://planning360.waverley.gov.uk/planning/search-applications?civica.query.FullTextSearch=WA%2F2018%2F0355#VIEW?RefType=GFPlanning&KeyNo=287331&KeyText=Subject|http://planning360.waverley.gov.uk/planning/search-applications?civica.query.FullTextSearch=WA%2F2018%2F0355#VIEW?RefType=GFPlanning&KeyNo=278227&KeyText=Subject|http://planning360.waverley.gov.uk/planning/search-applications?civica.query.FullTextSearch=WA%2F2018%2F0355#VIEW?RefType=GFPlanning&KeyNo=43047&KeyText=Subject,6,6,yes,Erection Of 6 Dwellings With Access Road Including Alterations To Public House Parking.,2018-12-12,2018-12-12,
http://opendatacommunities.org/id/district-council/waverley,B4,"122 Upper Hale Road, Farnham",-0.79954,51.234719,http://85.92.197.215/ishare5.4.web/atsolomap_brownfieldreg.html,0.07,not owned by a public authority,,permissioned,full planning permission,2018-11-20,http://planning360.waverley.gov.uk/planning/search-applications?civica.query.FullTextSearch=CR%2F2018%2F0003#VIEW?RefType=GFPlanning&KeyNo=318360&KeyText=Subject|http://planning360.waverley.gov.uk/planning/search-applications?civica.query.FullTextSearch=wa%2F2017%2F1848#VIEW?RefType=GFPlanning&KeyNo=313077&KeyText=Subject,8,8,yes,Erection of a building to provide 8 flats with associated parking and landscaping following the demolition of the existing office building. Prior approval required and granted for the change of use from office (Use Class B1a) to residential (Use Class C3) to provide 5 dwellings.,2018-12-12,2018-12-12,
http://opendatacommunities.org/id/district-council/waverley,567a,"Riverview House, Weyside Park, Catteshall Lane, Godalming",-0.596419,51.188342,http://85.92.197.215/ishare5.4.web/atsolomap_brownfieldreg.html,0.04,not owned by a public authority,,permissioned,full planning permission,2018-11-30,http://planning360.waverley.gov.uk/planning/search-applications?civica.query.FullTextSearch=cr%2F2018%2F0006#VIEW?RefType=GFPlanning&KeyNo=319318&KeyText=Subject|http://planning360.waverley.gov.uk/planning/search-applications?civica.query.FullTextSearch=wa%2F2018%2F1217#VIEW?RefType=GFPlanning&KeyNo=324254&KeyText=Subject,46,46,yes,Prior approval required and granted for the change of use from office (Use Class B1a) to residential (Use Class C3) to provide 36 dwellings.  Erection of an additional storey to provide 10 flats to existing two storey building together with associated works,2018-12-12,2018-12-12,
http://opendatacommunities.org/id/district-council/waverley,B5,"Weybrook House, Weyside Park, Catteshall",-0.598744,51.188766,http://85.92.197.215/ishare5.4.web/atsolomap_brownfieldreg.html,0.37,not owned by a public authority,,not permissioned,,,http://planning360.waverley.gov.uk/planning/search-applications?civica.query.FullTextSearch=cr%2F2018%2F0008#VIEW?RefType=GFPlanning&KeyNo=319825&KeyText=Subject,22,22,yes,Prior approval required and granted for the change of use from office (Use Class B1a) to residential (Use Class C3) to provide 22 dwellings.,2018-12-12,2018-12-12,
http://opendatacommunities.org/id/district-council/waverley,1014,"The Gate House, Knowle Lane, Cranleigh",-0.490442,51.140571,http://85.92.197.215/ishare5.4.web/atsolomap_brownfieldreg.html,0.04,not owned by a public authority,,permissioned,full planning permission,2018-05-08,http://planning360.waverley.gov.uk/planning/search-applications?civica.query.FullTextSearch=WA%2F2018%2F0355#VIEW?RefType=GFPlanning&KeyNo=318922&KeyText=Subject|http://planning360.waverley.gov.uk/planning/search-applications?civica.query.FullTextSearch=WA%2F2018%2F0355#VIEW?RefType=GFPlanning&KeyNo=312410&KeyText=Subject|http://planning360.waverley.gov.uk/planning/search-applications?civica.query.FullTextSearch=WA%2F2018%2F0355#VIEW?RefType=GFPlanning&KeyNo=276836&KeyText=Subject|http://planning360.waverley.gov.uk/planning/search-applications?civica.query.FullTextSearch=WA%2F2018%2F0355#VIEW?RefType=GFPlanning&KeyNo=94487&KeyText=Subject|http://planning360.waverley.gov.uk/planning/search-applications?civica.query.FullTextSearch=WA%2F2018%2F0355#VIEW?RefType=GFPlanning&KeyNo=85477&KeyText=Subject|http://planning360.waverley.gov.uk/planning/search-applications?civica.query.FullTextSearch=WA%2F2018%2F0355#VIEW?RefType=GFPlanning&KeyNo=81315&KeyText=Subject|http://planning360.waverley.gov.uk/planning/search-applications?civica.query.FullTextSearch=WA%2F2018%2F0355#VIEW?RefType=GFPlanning&KeyNo=80906&KeyText=Subject,5,5,yes,Erection Of A Block Of 5 Flats With Associated Parking And New Access.,2018-12-12,2019-12-04,2019-12-04
http://opendatacommunities.org/id/district-council/waverley,B7,"64A Wey Hill, Haslemere",-0.727594,51.08828,http://85.92.197.215/ishare5.4.web/atsolomap_brownfieldreg.html,0.07,not owned by a public authority,,permissioned,full planning permission,2018-10-03,http://planning360.waverley.gov.uk/planning/search-applications?civica.query.FullTextSearch=wa%2F2018%2F0840#VIEW?RefType=GFPlanning&KeyNo=320804&KeyText=Subject,8,8,yes,"Erection of a block of 8 flats with parking, cycle and bin store following demolition of existing building.",2018-12-12,2018-12-12,
http://opendatacommunities.org/id/district-council/waverley,B8,"Peel House, Upper South View, Farnham Moor Park",-0.796036,51.217544,http://85.92.197.215/ishare5.4.web/atsolomap_brownfieldreg.html,0.74,not owned by a public authority,,permissioned,full planning permission,2018-09-19,http://planning360.waverley.gov.uk/planning/search-applications?civica.query.FullTextSearch=wa%2F2018%2F0551#VIEW?RefType=GFPlanning&KeyNo=319488&KeyText=Subject|http://planning360.waverley.gov.uk/planning/search-applications?civica.query.FullTextSearch=wa%2F2017%2F1532#VIEW?RefType=GFPlanning&KeyNo=310779&KeyText=Subject,6,6,yes,Erection of a building to provide 6 dwellings with parking following demolition of existing offices.,2018-12-12,2018-12-12,
http://opendatacommunities.org/id/district-council/waverley,1049,"M J Coleman & Sons Ltd, Park Drive, Bramley",-0.561487,51.190571,http://85.92.197.215/ishare5.4.web/atsolomap_brownfieldreg.html,0.46,not owned by a public authority,,permissioned,full planning permission,2019-02-18,http://planning360.waverley.gov.uk/planning/search-applications?civica.query.FullTextSearch=wa%2F2018%2F1236#VIEW?RefType=GFPlanning&KeyNo=322829&KeyText=Subject,8,8,yes,,2018-12-12,2019-12-04,2019-12-04
http://opendatacommunities.org/id/district-council/waverley,141a,"Haslemere Key Site, West Street, Haslmere",-0.711258,51.088748,http://85.92.197.215/ishare5.4.web/atsolomap_brownfieldreg.html,2.39,mixed ownership,,not permissioned,,,,50,50,,,2018-12-12,2018-12-12,
http://opendatacommunities.org/id/district-council/waverley,973,"Georgian House Hotel, High Street, Haslemere",-0.709053,51.089211,http://85.92.197.215/ishare5.4.web/atsolomap_brownfieldreg.html,0.45,not owned by a public authority,,pending decision,,,http://planning360.waverley.gov.uk/planning/search-applications?civica.query.FullTextSearch=wa%2F2018%2F0408#VIEW?RefType=GFPlanning&KeyNo=317892&KeyText=Subject,18,19,yes,Grade II Listed Building,2018-12-12,2018-12-12,
