OrganisationURI,SiteReference,SiteNameAddress,GeoX,GeoY,SiteplanURL,Hectares,OwnershipStatus,HazardousSubstances,PlanningStatus,PermissionType,PermissionDate,PlanningHistory,NetDwellingsRangeFrom,NetDwellingsRangeTo,Deliverable,Notes,FirstAddedDate,LastUpdatedDate,EndDate
http://opendatacommunities.org/id/district-council/northampton,BFR0146,"Victoria Business Park, St James Park Road",-0.909323,52.239076,https://www.northampton.gov.uk/downloads/file/10105/bfr0146,0.41,not owned by a public authority,,permissioned,full planning permission,,,44,44,yes,Full planning permission (N/2014/1163) for the erection of 44 flats. Currently under construction.,2017-12-13,2017-12-13,
http://opendatacommunities.org/id/district-council/northampton,BFR0181,Ransome Road/Nunn Mills Road,-0.889384,52.227805,https://www.northampton.gov.uk/downloads/file/10045/bfr0181,13.61,mixed ownership,,not permissioned,,,,1020,1020,yes,Majority of the site is owned by HCA.,2017-12-13,2017-12-13,
http://opendatacommunities.org/id/district-council/northampton,BFR0189,"St Marys Middle School, Grange Road",-0.851218,52.261465,https://www.northampton.gov.uk/downloads/file/10051/bfr0189,2.66,not owned by a public authority,,permissioned,full planning permission,,,31,31,yes,N/2015/1074-Permission for 81 residential units approved and currently under construction.,2016-06-29,2017-12-13,
http://opendatacommunities.org/id/district-council/northampton,BFR0191,"Blackthorn Middle School, Blackthorn Road",-0.814142,52.269257,https://www.northampton.gov.uk/downloads/file/10049/bfr0191,3.23,owned by a public authority,,not permissioned,outline planning permission,,,128,128,yes,Site was formerly Blackthorn Middle School and now vacant. Outline planning permission for residential development has lapsed in October 2017.,2016-06-29,2017-12-13,
http://opendatacommunities.org/id/district-council/northampton,BFR0205,"Parklands Middle School, Devon Way",-0.874267,52.271068,https://www.northampton.gov.uk/downloads/file/10046/bfr0205,4.93,owned by a public authority,,not permissioned,,,,98,98,yes,N/2006/1052 (WNDC app) Outline App for residential development withdrawn (23 Jan 2012),2017-12-13,2017-12-13,
http://opendatacommunities.org/id/district-council/northampton,BFR0211,"Green Oaks Primary, Bective Road",-0.894085,52.265848,https://www.northampton.gov.uk/downloads/file/10047/bfr0211,1.83,not owned by a public authority,,permissioned,permission in principle,,,58,58,yes,N/2016/1007 Full Planning Permission for 82 dwellings granted on 24.02.2017,2016-06-29,2017-12-13,
http://opendatacommunities.org/id/district-council/northampton,BFR0214,"Kingsthorpe Middle School, Northfield Way",-0.904459,52.268849,https://www.northampton.gov.uk/downloads/file/10050/bfr0214,5.57,not owned by a public authority,,permissioned,reserved matters approval,,,179,179,yes,Outline application N/2015/0647 and reserved matters application N/2016/0572 for residential development comprising 195 dwellings were approved in 2016.,2016-06-29,2017-12-13,
http://opendatacommunities.org/id/district-council/northampton,BFR0288,Railway Station Car Park,-0.905585,52.237643,https://www.northampton.gov.uk/downloads/file/10048/bfr0288,2.12,mixed ownership,,not permissioned,,,,270,270,yes,Forms part of Policy 19 (Castle Station) in the Central Area Action Plan (adopted 2013).  No planning history found.,2016-06-29,2017-12-13,
http://opendatacommunities.org/id/district-council/northampton,BFR0326,Orchard Hill,-0.822736,52.248941,https://www.northampton.gov.uk/downloads/file/10052/bfr0326,0.64,,,permissioned,full planning permission,,,20,20,yes,"N/2016/1075 Full planning permission for Wilson House, 2 Orchard Hill, for change of use from office to D1 to include place of worship, day nursery, conference room, bookshop, intenet café, office, parking.",2017-12-13,2017-12-13,
http://opendatacommunities.org/id/district-council/northampton,BFR0335,Chronicle & Echo North,-0.890483,52.242887,https://www.northampton.gov.uk/downloads/file/10053/bfr0335,1.03,mixed ownership,,permissioned,full planning permission,,,24,24,yes,"N/2016/1434 (temporary car park, Great Russell Street): proposed construction of 12 dwellings (approved).  N/2016/0319 (temporary car park, Great Russell Street): erect 24 maisonettes (refused).  N/2014/1279 (former Top of the Town Nightclub): Construction of three storey building to provide offices, 12 flats and basement parking.",2017-12-13,2017-12-13,
http://opendatacommunities.org/id/district-council/northampton,BFR0336,Chronicle & Echo South,-0.891616,52.241607,https://www.northampton.gov.uk/downloads/file/10054/bfr0336,1.17,mixed ownership,,permissioned,outline planning permission,,,19,19,yes,"N/2015/0333 - Hybrid planning application comprising: (a) Full Planning Application for the erection of a 1810m2 new retail food store with associated access from Earl Street, landscaping and car parking; and (b) Outline Planning Application with all matters reserved except access (from Great Russell Street) of up to 19 residential dwellings.",2017-12-13,2017-12-13,
http://opendatacommunities.org/id/district-council/northampton,BFR0337,Pearce & Co,-0.82728,52.257371,https://www.northampton.gov.uk/downloads/file/10057/bfr0337,1.17,not owned by a public authority,,permissioned,full planning permission,,,14,14,yes,"N/2016/0365 Alterations and extension to existing building and conversion to 14 no. flats and offices as part of livework units, provision of bin storage areas and car parking. Approved. Construction has not started.",2017-12-13,2017-12-13,
http://opendatacommunities.org/id/district-council/northampton,BFR0338,Countess Road,-0.913337,52.244493,https://www.northampton.gov.uk/downloads/file/10056/bfr0338,2.54,mixed ownership,,permissioned,full planning permission,,,81,81,yes,N/2015/1021: approval for part demolition of existing factory building and conversion of existing factory building into 45 apartments and the erection of 2 dwellings.,2017-12-13,2017-12-13,
http://opendatacommunities.org/id/district-council/northampton,BFR0355,Balmoral Road (rear),-0.899042,52.253527,https://www.northampton.gov.uk/downloads/file/10058/bfr0355,0.79,not owned by a public authority,,permissioned,full planning permission,,,25,25,yes,"N/2016/1091 Approved for Erection of three residential buildings comprising a total of 80 specialised supported living apartments (Use Class C3), together with associated access, parking, open space, bins and scooter stores",2016-06-29,2017-12-13,
http://opendatacommunities.org/id/district-council/northampton,BFR0496,57 Artizan Road,-0.880405,52.243534,https://www.northampton.gov.uk/downloads/file/10055/bfr0496,0.05,not owned by a public authority,,permissioned,full planning permission,,,10,10,yes,"N/2015/0390 Approved for demolition of part single, two storey and three storey rear element of the building. Change of use of existing factory/storage to 10no. One bed self-contained flats (2no. Mobility Units) together with 8no. On-site parking bays (2no. Mobility bays), refuse bin area and cycle storage areas. Re-submission of planning application N/2010/0019.",2017-12-13,2017-12-13,
http://opendatacommunities.org/id/district-council/northampton,BFR0497,12 Duke Street,-0.893019,52.243956,https://www.northampton.gov.uk/downloads/file/10109/bfr0497,0.04,not owned by a public authority,,not permissioned,,,,14,14,yes,Permission for 14no. flats N/2014/0431 was lapsed in 2017.,2016-06-29,2017-12-13,
http://opendatacommunities.org/id/district-council/northampton,BFR0498,"Arnold House, 56 Lorne Road",-0.896225,52.244851,https://www.northampton.gov.uk/downloads/file/10059/bfr0498,0.03,not owned by a public authority,,permissioned,full planning permission,,,11,11,yes,Permission for 11 flats N/2016/0995,2016-06-29,2017-12-13,
http://opendatacommunities.org/id/district-council/northampton,BFR0507,"Former Semilong Service Station, St Andrews Road",-0.90401,52.243256,https://www.northampton.gov.uk/downloads/file/10072/bfr0507,0.08,not owned by a public authority,,permissioned,full planning permission,,,24,24,yes,N/2005/0797- planning permission for 24 flats. N/2012/0905 - planning permssion for 22 unit residential care home (C2). Both proposals invlove offices on the ground floor. Construction works have started on site.,2016-06-29,2017-12-13,
http://opendatacommunities.org/id/district-council/northampton,BFR0510,"Bective Works/Jabez House, Bective Road/Yelvertoft Road",-0.898411,52.264334,https://www.northampton.gov.uk/downloads/file/10062/bfr0510,0.52,not owned by a public authority,,permissioned,full planning permission,,,16,16,yes,A longstanding application from 2012 to extend a previous residential permission has had no activity for 5 Years. In the meantime permissions have been granted for student accommodation in 2015. N/2015/0419.,2016-06-29,2017-12-13,
http://opendatacommunities.org/id/district-council/northampton,BFR0594,Sixfields East,-0.930323,52.236645,https://www.northampton.gov.uk/downloads/file/10060/bfr0594,10.18,owned by a public authority,,not permissioned,,,,255,255,yes,"N/2014/0664 (land to the north west and east of Sixfields Stadium): EIA screening opinion for up to 255 residential units, 3 retail buildings, a retail parade, hotel and extensiton to the west stand of the stadium (completed)",2017-12-13,2017-12-13,
http://opendatacommunities.org/id/district-council/northampton,BFR0624,Southbridge/Nunn Mills,-0.892813,52.230871,https://www.northampton.gov.uk/downloads/file/10063/bfr0624,0.36,not owned by a public authority,,permissioned,full planning permission,,,94,94,yes,"All planning history associated with residential development of this site now largely completed. However, 94 dwellings (part affordable housing) are left to be completed on two parts of the site. A process is underway to transfer these two parcels of land to Northampton Borough Council.",2016-06-29,2017-12-13,
http://opendatacommunities.org/id/district-council/northampton,BFR0666,171-180 St Andrews Road,-0.904308,52.248124,https://www.northampton.gov.uk/downloads/file/10061/bfr0666,0.16,not owned by a public authority,,permissioned,other,,,22,22,yes,"N/2010/0785 - Outline application for the demolition of existing B8 Business units and erection of 14no. 2 bed and 8no. 1 bed apartments, formation of new access and parking areas (access, layout & scale for approval).  N/2016/0979 - Reserved matters application pursuant to outline planning permission N/2010/0785 (demolition of existing business units and erection of 14no. 2 bed and 8no. 1 bed apartments, formation of new access and parking areas) for approval of appearance and landscaping.",2017-12-13,2017-12-13,
http://opendatacommunities.org/id/district-council/northampton,BFR0689,"Nene Enterprise Centre, Freehold Street",-0.896364,52.250347,https://www.northampton.gov.uk/downloads/file/10067/bfr0689,0.36,not owned by a public authority,,not permissioned,,,,14,14,yes,,2017-12-13,2017-12-13,
http://opendatacommunities.org/id/district-council/northampton,BFR0719,"Car Garage Workshops, 409 Harlestone Road",-0.943593,52.25526,https://www.northampton.gov.uk/downloads/file/10066/bfr0719,1.09,not owned by a public authority,,not permissioned,,,,34,34,yes,,2017-12-13,2017-12-13,
http://opendatacommunities.org/id/district-council/northampton,BFR0730,"20-22 St Giles St (upper and rear) and Newspaper House, Derngate",-0.893082,52.237005,https://www.northampton.gov.uk/downloads/file/10064/bfr0730,0.18,not owned by a public authority,,permissioned,full planning permission,,,74,74,yes,"2016/0406- Approval for 57 apartments, 2016/1548-Additional retail floorspace, 2017/0012- Change of apartment mix of pp 2016/0406.  Also, for Newspaper House part of the site, N/2015/0738 demolition of part of the existing building, conversion of the rest and erection of two new floors to form 64no. Flats",2017-12-13,2017-12-13,
http://opendatacommunities.org/id/district-council/northampton,BFR0744,"The Ridings Arcade, 61-63 St Giles Street (upper floors)",-0.891867,52.237937,https://www.northampton.gov.uk/downloads/file/10065/bfr0744,0.14,not owned by a public authority,,not permissioned,,,,21,21,yes,,2017-12-13,2017-12-13,
http://opendatacommunities.org/id/district-council/northampton,BFR0749,"Compton House, 83-85 Abington Street",-0.889995,52.239658,https://www.northampton.gov.uk/downloads/file/10068/bfr0749,0.06,not owned by a public authority,,permissioned,other,,,94,94,yes,PN/2013/0021 Change of use of vacant offices (Use Class B1) to 94 apartments. Approved. Not implemented (2016).  N/2015/1231 Change of use from offices (B1) into 92 no 1-bed student accommodation units (Sui Generis). Approved.,2016-06-29,2017-12-13,
http://opendatacommunities.org/id/district-council/northampton,BFR0767,46 Spencer Street,-0.914483,52.236229,https://www.northampton.gov.uk/downloads/file/10107/bfr0767,0.14,not owned by a public authority,,permissioned,full planning permission,,,25,25,yes,"N/2013/1300 - Erection of 25no. dwellings comprising 9no. Dwelling houses, a block of 16no. Self contained flats with associated parking and landscaping (as amended by revised plans received on 23/06/2014 & 30/06/2014)",2016-06-29,2017-12-13,
http://opendatacommunities.org/id/district-council/northampton,BFR0814,32 Great Russell Street,-0.890077,52.242925,https://www.northampton.gov.uk/downloads/file/10071/bfr0814,0.15,not owned by a public authority,,permissioned,full planning permission,,,12,12,yes,Current planning application being progressed for 12 dwellings N/2016/1434 (APPROVED),2017-12-13,2017-12-13,
http://opendatacommunities.org/id/district-council/northampton,BFR0826,above 27-27a Drapery,-0.89767,52.237773,https://www.northampton.gov.uk/downloads/file/10070/bfr0826,0.05,not owned by a public authority,,permissioned,full planning permission,,,15,15,yes,"N/2015/1278 - planning permission to turn 1st, 2nd and 3rd storeys to 13no. Flats.  N/2016/1281 - planning permission to turn 4th storey to 2no. flats.",2017-12-13,2017-12-13,
http://opendatacommunities.org/id/district-council/northampton,BFR0896,"Former St Crispin’s Hospital, St Crispin Drive",-0.95774,52.243293,https://www.northampton.gov.uk/downloads/file/10069/bfr0896,2.74,not owned by a public authority,,permissioned,permission in principle,,,235,235,yes,"This site is currently under construction for residential development. N/2004/1542 has been partly implemented. There is a new application N/2015/1454 for the rest of the site which has been approved. Demolition of the existing ward blocks. Restoration of the clock tower and conversion to residential use comprising 13no apartments, restoration of the administration building and conversion to residential use to provide 4no apartments, the erection of 120no apartments and 98 houses (235no dwellings total) with associated roads and underground car parks.",2017-12-13,2017-12-13,
http://opendatacommunities.org/id/district-council/northampton,BFR0903,"Hawkins Shoe Factory, Overstone Road",-0.890553,52.241112,https://www.northampton.gov.uk/downloads/file/10077/bfr0903,0.17,not owned by a public authority,,permissioned,full planning permission,,,105,105,yes,"N/2015/0673: Conversion and alterations of factory premises to form 105 apartments with associated parking both on site and on street, replacement of windows and new roof lights, proposed infill extension on Dunster Street facade including new roof terrace",2017-12-13,2017-12-13,
http://opendatacommunities.org/id/district-council/northampton,BFR0909,Wootton Trading Estate (now known as Brownlee Place),-0.874267,52.206022,https://www.northampton.gov.uk/downloads/file/10076/bfr0909,0.55,not owned by a public authority,,permissioned,full planning permission,,,8,8,yes,8 dwellings are still yet to be built. N/2015/0470,2016-06-29,2017-12-13,
http://opendatacommunities.org/id/district-council/northampton,BFR0915,118-122 Wellingborough Road,-0.883189,52.240971,https://www.northampton.gov.uk/downloads/file/10073/bfr0915,0.1,not owned by a public authority,,not permissioned,full planning permission,,,12,12,yes,"N/2012/0765 (Demolition in a Conservation Area): demolition of industrial units, gates, fences and walls to rear of site to implement proposed development N/2012/0472 and previously approved scheme 09/0051/FULWNN (approved).N/2012/0472: to extend time for the implementation of planning permission 09/0051/FULWNN for the conversion of existing first floor offices to four no residential flats and the erection of 8 flats following demolition of existing industrial units to rear (approved).  All the above have lapsed.",2016-06-29,2017-12-13,
http://opendatacommunities.org/id/district-council/northampton,BFR1001,Former Emmanuel Middle School,-0.834669,52.259466,https://www.northampton.gov.uk/downloads/file/10080/bfr1001,2.24,not owned by a public authority,,pending decision,,,,109,109,yes,Planning permission to extend the original Outline (109) was granted on 08.10.2014 with RM to be submitted within 3 years.N/2017/1097 - Erection of 83no dwellings - in progress.,2016-06-29,2017-12-13,
http://opendatacommunities.org/id/district-council/northampton,BFR1002,Former Lings Upper School,-0.833644,52.258332,https://www.northampton.gov.uk/downloads/file/10074/bfr1002,1.8,mixed ownership,,permissioned,outline planning permission,,,60,60,yes,Outline permission (N/2015/0019) granted on 07.07.2017 for up to 60 dwellings.,2016-06-29,2017-12-13,
http://opendatacommunities.org/id/district-council/northampton,BFR1010,Land at St Peters Way/ Court Road/ Freeschool Street,-0.901913,52.235871,https://www.northampton.gov.uk/downloads/file/10075/bfr1010,1.17,mixed ownership,,not permissioned,,,,139,139,yes,"Included as Policy 33 in the Central Area Action Plan (2013), for
mixed use development including offices, small scale retailing,
restaurants, cafes and residential. Prior to that, the Borough
Council commissioned the preparation of a Masterplan for freeschool Street. It is within the Enterprise Zone.",2017-12-13,2017-12-13,
http://opendatacommunities.org/id/district-council/northampton,BFR1013,University of Northampton Park Campus,-0.882501,52.273208,https://www.northampton.gov.uk/downloads/file/10086/bfr1013,27.5,not owned by a public authority,,permissioned,full planning permission,,,800,800,yes,"N/2014/0475: planning approval for outline application (all matters reserved except access) for the demolition of the University facilities and erection of new buildings comprising residential accommodation up to 800 units, associated car parking, retail unit, landscaping and open space with accesses from Boughton Green Road.",2017-12-13,2017-12-13,
http://opendatacommunities.org/id/district-council/northampton,BFR1014,University of Northampton Avenue Campus,-0.891068,52.251196,https://www.northampton.gov.uk/downloads/file/10079/bfr1014,6.02,not owned by a public authority,,pending decision,,,,200,200,yes,"N/2016/0810: outline application with reserved matters for demolition and conversion of existing university buildings, demolition of existing university facilities and outline planning permission for erection of new buildings comprising residential up to 200 units, associated car parking, landscaping and open space (in progress).",2017-12-13,2017-12-13,
http://opendatacommunities.org/id/district-council/northampton,BFR1022,"Belgrave House, Grosvenor Shopping Centre",-0.896101,52.239253,https://www.northampton.gov.uk/downloads/file/10078/bfr1022,0.21,owned by a public authority,,pending decision,,,,31,31,yes,N/2017/1144 Change of Use of Belgrave House from offices (Use Class B1a) to student accommodation (Sui Generis)- in progress.,2017-12-13,2017-12-13,
http://opendatacommunities.org/id/district-council/northampton,BFR1023,East Island,-0.893599,52.240119,https://www.northampton.gov.uk/downloads/file/10084/bfr1023,0.42,mixed ownership,,not permissioned,,,,42,42,yes,The site is included in Policy 17 (Grosvenor Centre Redevelopment) of the Central Area Action Plan 2013.,2017-12-13,2017-12-13,
http://opendatacommunities.org/id/district-council/northampton,BFR1024,Great Houghton Independent School,-0.844418,52.224425,https://www.northampton.gov.uk/downloads/file/10083/bfr1024,6.92,not owned by a public authority,,not permissioned,,,,240,240,yes,,2017-12-13,2017-12-13,
http://opendatacommunities.org/id/district-council/northampton,BFR1031,Lower Bath Street,-0.904144,52.239412,https://www.northampton.gov.uk/downloads/file/10061/bfr0666,0.12,owned by a public authority,,permissioned,full planning permission,,,18,18,yes,"'N/2016/0703 - Prior notification for demolition of garage blocks. N/2016/0769 - Demolition of 43 garages, erection of 14 dwellings with associated gardens, parking and access ways - approved. The garages have been demolished.",2017-12-13,2017-12-13,
http://opendatacommunities.org/id/district-council/northampton,BFR1032,"Lakeview House, Churchill Avenue",-0.858339,52.267272,https://www.northampton.gov.uk/downloads/file/10081/bfr1032,0.27,owned by a public authority,,permissioned,full planning permission,,,56,56,yes,N/2016/1649 Redevelopment of land to provide 45no. 1 bedroom flats for the elderly with associated facilities and demolition of 10no. existing garages to the north of the site to create overall 31no. car parking bays (including 3 accessible bays).,2017-12-13,2017-12-13,
http://opendatacommunities.org/id/district-council/northampton,BFR1033,Toms Close,-0.899397,52.191897,https://www.northampton.gov.uk/downloads/file/10091/bfr1033,0.52,mixed ownership,,not permissioned,,,,16,16,yes,,2017-12-13,2017-12-13,
http://opendatacommunities.org/id/district-council/northampton,BFR1034,Witham Way garage site,-0.919623,52.253649,https://www.northampton.gov.uk/downloads/file/10082/bfr1034,0.15,owned by a public authority,,not permissioned,,,,6,6,yes,"N/2016/0704 - Prior notification of proposed demolition of garage blocks at Swale Drive, Derwent Drive, West Oval and Witham Way",2017-12-13,2017-12-13,
http://opendatacommunities.org/id/district-council/northampton,BFR1035,West Oval garage site,-0.921694,52.253708,https://www.northampton.gov.uk/downloads/file/10085/bfr1035,0.18,owned by a public authority,,not permissioned,,,,7,7,yes,"N/2016/0704 - Prior notification of proposed demolition of garage blocks at Swale Drive, Derwent Drive, West Oval and Witham Way",2017-12-13,2017-12-13,
http://opendatacommunities.org/id/district-council/northampton,BFR1036,Derwent Drive garage site,-0.917248,52.255856,https://www.northampton.gov.uk/downloads/file/10087/bfr1036,0.2,owned by a public authority,,not permissioned,,,,7,7,yes,"N/2016/0704 - Prior notification of proposed demolition of garage blocks at Swale Drive, Derwent Drive, West Oval and Witham Way",2017-12-13,2017-12-13,
http://opendatacommunities.org/id/district-council/northampton,BFR1037,Swale Drive garage site and rear/unused land,-0.921759,52.260062,https://www.northampton.gov.uk/downloads/file/10088/bfr1037,0.16,owned by a public authority,,not permissioned,,,,6,6,yes,"N/2016/0704 - Prior notification of proposed demolition of garage blocks at Swale Drive, Derwent Drive, West Oval and Witham Way Approved and implemented.",2017-12-13,2017-12-13,
http://opendatacommunities.org/id/district-council/northampton,BFR1068,"Garage site in The Briars, Briar Hill",-0.915142,52.225878,https://www.northampton.gov.uk/downloads/file/10093/bfr1068,0.13,owned by a public authority,,not permissioned,,,,5,5,yes,,2017-12-13,2017-12-13,
http://opendatacommunities.org/id/district-council/northampton,BFR1078,Land at Chapel Place,-0.888427,52.240718,https://www.northampton.gov.uk/downloads/file/10089/bfr1078,0.08,owned by a public authority,,not permissioned,,,,12,12,yes,N/2014/0482: Temporary use of land for car parking to serve 56 - 60 St Michael's Road (approved),2017-12-13,2017-12-13,
http://opendatacommunities.org/id/district-council/northampton,BFR1108,"Former Dairy Crest Depot, Horsley Road",-0.902722,52.252556,https://www.northampton.gov.uk/downloads/file/10104/brf1108,1.1,not owned by a public authority,,not permissioned,,,,35,35,yes,No planning history found.,2017-12-13,2017-12-13,
http://opendatacommunities.org/id/district-council/northampton,BFR1113,Greyfriars,-0.895398,52.239926,https://www.northampton.gov.uk/downloads/file/10090/bfr1113,1.74,owned by a public authority,,not permissioned,,,,266,266,yes,Site is allocated in the Central Area Action Plan for Priority Public Realm Improvement.,2017-12-13,2017-12-13,
http://opendatacommunities.org/id/district-council/northampton,BFR1114,"Cedarwood Nursing Home, 492 Kettering Road",-0.86483,52.26488,https://www.northampton.gov.uk/downloads/file/10095/bfr1114,0.19,not owned by a public authority,,permissioned,full planning permission,,,14,14,yes,N/2017/0627 Demolition of existing Care Home and erection of 14no 2 bedroom apartments - approved.,2017-12-13,2017-12-13,
http://opendatacommunities.org/id/district-council/northampton,BFR1116,194-200 Kingsthorpe Grove,-0.892104,52.255828,https://www.northampton.gov.uk/downloads/file/10102/bfr1116,0.15,not owned by a public authority,,permissioned,full planning permission,,,14,14,yes,N/2015/1228 - full permission. Demolish car showroom and erect building with A1 retail on the ground floor and 14no. flats above.,2017-12-13,2017-12-13,
http://opendatacommunities.org/id/district-council/northampton,BFR1117,133 Queens Park Terrace,-0.900017,52.258659,https://www.northampton.gov.uk/downloads/file/10094/bfr1117,0.06,not owned by a public authority,,not permissioned,,,,18,18,yes,Lapsed planning permission N/2013/0781 for conversion to 18no. C3 bedsits.,2017-12-13,2017-12-13,
