OrganisationURI,SiteReference,SiteNameAddress,GeoX,GeoY,SiteplanURL,Hectares,OwnershipStatus,HazardousSubstances,PlanningStatus,PermissionType,PermissionDate,PlanningHistory,NetDwellingsRangeFrom,NetDwellingsRangeTo,Deliverable,Notes,FirstAddedDate,LastUpdatedDate,EndDate
http://opendatacommunities.org/id/district-council/stafford,16/24628/FUL,"128 North Walls, Stafford",,,https://www.staffordbc.gov.uk/brownfield-land-register,0.02,not owned by a public authority,,permissioned,full planning permission,2016-11-01,http://www.staffordbc.gov.uk/planning-public-access,5,5,yes,Existing terraces (128-130 North Walls) converted into flats and bedsits (5 units) with new external access stair.,2017-11-15,2019-10-15,
http://opendatacommunities.org/id/district-council/staffordshire-moorlands,15/21611/POTH,"69-70 Foregate Street, Stafford",,,https://www.staffordbc.gov.uk/brownfield-land-register,0.13,not owned by a public authority,,permissioned,full planning permission,2015-02-23,http://www.staffordbc.gov.uk/planning-public-access,18,18,yes,Prior approval - change of use from offices to residential (18 apartments),2017-11-15,2019-10-15,
http://opendatacommunities.org/id/district-council/tamworth,15/22735/REM,"Areva Fairway, Stafford",,,https://www.staffordbc.gov.uk/brownfield-land-register,7.52,not owned by a public authority,,permissioned,reserved matters approval,2015-12-02,http://www.staffordbc.gov.uk/planning-public-access,194,194,yes,"Approval of reserved matters for residential development consisting of 194 dwellings, public open space, access, parking and landscaping",2017-11-15,2019-10-15,
http://opendatacommunities.org/id/district-council/babergh,15/23140/FUL,"Land at Elms Business Centre Phase 2, Main Road, Great Haywood",,,https://www.staffordbc.gov.uk/brownfield-land-register,0.2,not owned by a public authority,,permissioned,full planning permission,2016-08-24,http://www.staffordbc.gov.uk/planning-public-access,6,6,yes,Demolish existing commercial units and change of use of existing 2 storey to create 2 two-bedroom units and build an additional attached block of 4 one-bedroom units and 4 two-bedroom units (total number 10 units),2017-11-15,2019-10-15,
http://opendatacommunities.org/id/district-council/forest-heath,18/28018/FUL,"Land at Elms Business Centre, Main Road, Great Haywood",,,https://www.staffordbc.gov.uk/brownfield-land-register,0.33,not owned by a public authority,,permissioned,full planning permission,2015-03-31,http://www.staffordbc.gov.uk/planning-public-access,10,10,yes,RESIDENTIAL DEVLEOPMENT (SIX UNITS) AT REAR OF ELMS BUSINESS CENTRE/ELMS LODGE/ELMS FARMHOUSE INCLUDING DEMOLITION OF ASBESTOS CLAD COMMERCIAL UNIT - RESUBMISSION OF 14/21329/FUL TO INCLUDE ACCESS ROUTE WITHIN RED EDGE,2017-11-15,2019-10-15,
http://opendatacommunities.org/id/district-council/ipswich,18/29526/OUT,"Land at Former Carers Centre, Austin Friars, Stafford",,,https://www.staffordbc.gov.uk/brownfield-land-register,0.08,not owned by a public authority,,permissioned,outline planning permission,2015-10-27,http://www.staffordbc.gov.uk/planning-public-access,8,8,yes,"Eight apartments, access, drying area, parking and associated works",2017-11-15,2019-10-15,
http://opendatacommunities.org/id/district-council/mid-suffolk,15/22060/FUL,"Land at George Street Press and Car Park, Fancy Walk, Stafford",,,https://www.staffordbc.gov.uk/brownfield-land-register,0.18,mixed ownership,,permissioned,full planning permission,2016-04-11,http://www.staffordbc.gov.uk/planning-public-access,20,20,yes,Conversion of Mill building to create twenty two-bedroom apartments with associated car parking,2017-11-15,2019-10-15,
http://opendatacommunities.org/id/district-council/st-edmundsbury,15/23463/FUL,"Land at Silkmore Lane, Stafford",,,https://www.staffordbc.gov.uk/brownfield-land-register,0.5,mixed ownership,,permissioned,full planning permission,2016-05-25,http://www.staffordbc.gov.uk/planning-public-access,76,76,yes,Residential Care Home (Use Class C2). 76 bedroom units with on-suite facilities.,2017-11-15,2019-10-15,
http://opendatacommunities.org/id/district-council/suffolk-coastal,15/21721/OUT,"Land at Yarnfield Park, Yarnfield",,,https://www.staffordbc.gov.uk/brownfield-land-register,2.85,not owned by a public authority,,pending decision,other,2015-06-11,http://www.staffordbc.gov.uk/planning-public-access,45,45,yes,"The provision of dwellings and associated infrastructure, including parking provision and roads. Officer/committee resolution to permit subject to S106 agreement being signed.",2017-11-15,2019-10-15,
http://opendatacommunities.org/id/district-council/waveney,15/23103/FUL,"Land SCC Development Service Parcel 4, Riverway, Stafford",,,https://www.staffordbc.gov.uk/brownfield-land-register,0.18,owned by a public authority,,permissioned,full planning permission,2016-02-03,http://www.staffordbc.gov.uk/planning-public-access,15,15,yes,Erection of three storey block of 15 supported living units with associated open space and car parking,2017-11-15,2019-10-15,
http://opendatacommunities.org/id/district-council/elmbridge,17/27651/REM,"Whitebridge Lane, Stone, Staffordshire",,,https://www.staffordbc.gov.uk/brownfield-land-register,0.36,not owned by a public authority,,permissioned,full planning permission,2015-12-03,http://www.staffordbc.gov.uk/planning-public-access,11,11,yes,Residential development,2017-11-15,2019-10-15,
http://opendatacommunities.org/id/district-council/epsom-and-ewell,16/23671/FUL,"St Johnís Church, Stone",,,https://www.staffordbc.gov.uk/brownfield-land-register,0.16,not owned by a public authority,,not permissioned,full planning permission,,http://www.staffordbc.gov.uk/planning-public-access,9,9,yes,Conversion of Church and erection of rear two-storey extension (following demolition of existing single-storey extension) to provide five residential units and the erection of a 2.5 storey building fronting The Avenue to provide four apartments on the former Church car park,2019-10-15,2019-10-15,
http://opendatacommunities.org/id/district-council/guildford,17/25523/OUT,"Truview, 12 Sandon Road, Stafford",,,https://www.staffordbc.gov.uk/brownfield-land-register,0.13,not owned by a public authority,,not permissioned,outline planning permission,2017-08-22,http://www.staffordbc.gov.uk/planning-public-access,11,11,yes,Construct up to 11 apartments (outline),2019-10-15,2019-10-15,
http://opendatacommunities.org/id/district-council/mole-valley,17/26358/FUL,"The Halsteads, Milwich",,,https://www.staffordbc.gov.uk/brownfield-land-register,0.89,not owned by a public authority,,not permissioned,full planning permission,2017-10-03,http://www.staffordbc.gov.uk/planning-public-access,0,0,yes,"Part-demolition of existing dwelling, construction of replacement dwelling, construction of detached carport and reorientation of residential curtilage",2019-10-15,2019-10-15,
http://opendatacommunities.org/id/district-council/reigate-banstead,17/26714/OUT,"Claremont Garage, Eccleshall",,,https://www.staffordbc.gov.uk/brownfield-land-register,0.42,not owned by a public authority,,not permissioned,outline planning permission,2017-10-05,http://www.staffordbc.gov.uk/planning-public-access,9,9,yes,"Outline application for residential development (including access, all other matters reserved)",2019-10-15,2019-10-15,
http://opendatacommunities.org/id/district-council/runnymede,17/26235/OUT,"43 Eccleshall Road, Stafford",,,https://www.staffordbc.gov.uk/brownfield-land-register,0.05,not owned by a public authority,,not permissioned,outline planning permission,2017-11-15,http://www.staffordbc.gov.uk/planning-public-access,6,6,yes,Demolition of existing buildings; construct building to accommodate 7 apartments.,2019-10-15,2019-10-15,
http://opendatacommunities.org/id/district-council/spelthorne,17/26105/OUT,"Salt Works Farm, Weston",,,https://www.staffordbc.gov.uk/brownfield-land-register,0.16,not owned by a public authority,,not permissioned,outline planning permission,2017-11-21,http://www.staffordbc.gov.uk/planning-public-access,5,5,yes,Proposed residential development of three two storey dwellings and two semi-detached dormer bungalows,2019-10-15,2019-10-15,
http://opendatacommunities.org/id/district-council/surrey-heath,17/27337/FUL,"158 Oulton Road, Stone",,,https://www.staffordbc.gov.uk/brownfield-land-register,0.17,not owned by a public authority,,not permissioned,full planning permission,2018-01-12,http://www.staffordbc.gov.uk/planning-public-access,5,5,yes,Conversion and alteration of existing dwelling to form five apartments and erection of new detached coach house to form one apartment.,2019-10-15,2019-10-15,
http://opendatacommunities.org/id/district-council/tandridge,18/27849/FUL,"Staffordshire Police Headquarters, Stafford",,,https://www.staffordbc.gov.uk/brownfield-land-register,5.07,not owned by a public authority,,permissioned,full planning permission,2018-06-20,http://www.staffordbc.gov.uk/planning-public-access,141,141,yes,"Residential development of 141 dwellings, including balancing pond, play and open space and associated infrastructure.",2019-10-15,2019-10-15,
http://opendatacommunities.org/id/district-council/waverley,18/28212/POR,"Britannia House, 6-7 Eastgate Street, Stafford",,,https://www.staffordbc.gov.uk/brownfield-land-register,0.005,not owned by a public authority,,permissioned,full planning permission,2018-03-16,http://www.staffordbc.gov.uk/planning-public-access,23,23,yes,Notification for prior approval for proposed change of use from office B1(a) to dwellinghouse C3 (32 apartments),2019-10-15,2019-10-15,
http://opendatacommunities.org/id/district-council/woking,,"Land at Bank Top Garage, Gnosall",,,https://www.staffordbc.gov.uk/brownfield-land-register,,,,,,,,,,,,2019-10-15,2019-10-15,
http://opendatacommunities.org/id/district-council/north-warwickshire,,"Former Staffordshire University Campus, Beaconside",,,https://www.staffordbc.gov.uk/brownfield-land-register,,,,,,,,,,,,2019-10-15,2019-10-15,
http://opendatacommunities.org/id/district-council/nuneaton-and-bedworth,,"Land south of Brunswick Terrace, Stafford",,,https://www.staffordbc.gov.uk/brownfield-land-register,,,,,,,,,,,,2019-10-15,2019-10-15,
http://opendatacommunities.org/id/district-council/rugby,,"Land south of Brunswick Terrace, Stafford",,,https://www.staffordbc.gov.uk/brownfield-land-register,,,,,,,,,,,,2019-10-15,2019-10-15,
http://opendatacommunities.org/id/district-council/stratford,,Stafford Police Station,,,https://www.staffordbc.gov.uk/brownfield-land-register,,,,,,,,,,,,2019-10-15,2019-10-15,
http://opendatacommunities.org/id/district-council/warwick,,"Stone Highways Depot, Stone",,,https://www.staffordbc.gov.uk/brownfield-land-register,,,,,,,,,,,,2019-10-15,2019-10-15,
http://opendatacommunities.org/id/district-council/adur,,Stone Police Station,,,https://www.staffordbc.gov.uk/brownfield-land-register,,,,,,,,,,,,2019-10-15,2019-10-15,
http://opendatacommunities.org/id/district-council/arun,17/25983/FUL,Land at Portal Road,,,https://www.staffordbc.gov.uk/brownfield-land-register,0.51,not owned by a public authority,,permissioned,full planning permission,2018-08-09,http://www.staffordbc.gov.uk/planning-public-access,16,16,yes,Construction of 16 dwellings,2019-10-15,2019-10-15,
http://opendatacommunities.org/id/district-council/chichester,18/27978/FUL,Land at Rear of Former Browse Antiques,,,https://www.staffordbc.gov.uk/brownfield-land-register,0.307,not owned by a public authority,,permissioned,full planning permission,2018-09-10,http://www.staffordbc.gov.uk/planning-public-access,23,23,yes,"Demolish buildings; erect 23 dwellings comprising 8 no 3 bedroom houses, 9 no 1 bedroom flats, 6 no 2 bedroom flats with associated car parking, landscaping and access roads",2019-10-15,2019-10-15,
http://opendatacommunities.org/id/district-council/crawley,18/28342/FUL,Chetwynd Centre,,,https://www.staffordbc.gov.uk/brownfield-land-register,0.969,not owned by a public authority,,permissioned,full planning permission,2018-10-18,http://www.staffordbc.gov.uk/planning-public-access,32,32,yes,Proposed change of use of former school to residential use and to a performing arts centre with associated uses along with then new build houses in a terrace,2019-10-15,2019-10-15,
http://opendatacommunities.org/id/district-council/horsham,18/28138/FUL,Land at Riverway,,,https://www.staffordbc.gov.uk/brownfield-land-register,0.67,not owned by a public authority,,permissioned,full planning permission,2018-11-01,http://www.staffordbc.gov.uk/planning-public-access,80,80,yes,Erection of a 4 storey building comprising 80 residential apartments for occupants aged over 55 years old,2019-10-15,2019-10-15,
http://opendatacommunities.org/id/district-council/mid-sussex,18/28965/FUL,Stone Town Council Car Park,,,https://www.staffordbc.gov.uk/brownfield-land-register,0.357,owned by a public authority,,permissioned,full planning permission,2019-01-21,http://www.staffordbc.gov.uk/planning-public-access,1,1,yes,Public house and studio theatre including use of wharfingers cottage; outbuildings; parking; alterations,2019-10-15,2019-10-15,
http://opendatacommunities.org/id/district-council/worthing,18/28418/FUL,National Westminster Bank,,,https://www.staffordbc.gov.uk/brownfield-land-register,0.163,not owned by a public authority,,permissioned,full planning permission,2018-07-30,http://www.staffordbc.gov.uk/planning-public-access,6,6,yes,Change of use from a2 (bank) and school (d1) to mixed uses retail (a1) and residential (c3),2019-10-15,2019-10-15,
http://opendatacommunities.org/id/district-council/east-staffordshire,18/28695/POR,"The Whitehouse, Chapel Street, Stafford",,,https://www.staffordbc.gov.uk/brownfield-land-register,0.04,not owned by a public authority,,permissioned,full planning permission,2018-08-14,http://www.staffordbc.gov.uk/planning-public-access,9,9,yes,Prior approval - change of use from office to 9 flats (class c3),2017-11-15,2017-11-15,
http://opendatacommunities.org/id/district-council/east-staffordshire,18/28296/FUL,"Garages, Highfields",,,https://www.staffordbc.gov.uk/brownfield-land-register,0.2,not owned by a public authority,,permissioned,full planning permission,2018-08-17,http://www.staffordbc.gov.uk/planning-public-access,7,7,yes,Demolition of garages and construction of 7 houses,2019-10-15,2019-10-15,
http://opendatacommunities.org/id/district-council/east-staffordshire,18/29731/FUL,CC4 Greengate Street,,,https://www.staffordbc.gov.uk/brownfield-land-register,0.03,owned by a public authority,,permissioned,full planning permission,2019-02-13,http://www.staffordbc.gov.uk/planning-public-access,8,8,yes,"Conversion of 1st, 2nd, 3rd floors above retail unit to provide eight residential apartments",2019-10-15,2019-10-15,
http://opendatacommunities.org/id/district-council/stafford,18/28772/OUT,Former Stafford College Annex,,,https://www.staffordbc.gov.uk/brownfield-land-register,0.119,not owned by a public authority,,pending decision,other,,http://www.staffordbc.gov.uk/planning-public-access,15,15,yes,Outline application to demolish existing building and build 15 apartments. officer/committee resolution to permit subject to S106 agreement being signed.,2019-10-15,2019-10-15,
http://opendatacommunities.org/id/district-council/bromsgrove,,MoD 4 Site,,,https://www.staffordbc.gov.uk/brownfield-land-register,,,,,,,,,,,,2019-10-15,2019-10-15,
http://opendatacommunities.org/id/district-council/malvern-hills,,St. Maryís Abbey,,,https://www.staffordbc.gov.uk/brownfield-land-register,,,,,,,,,,,,2019-10-15,2019-10-15,
http://opendatacommunities.org/id/district-council/redditch,,Midfield Nurseries Garden Centre,,,https://www.staffordbc.gov.uk/brownfield-land-register,,,,,,,,,,,,2018-11-01,2019-10-15,
http://opendatacommunities.org/id/district-council/worcester,,"Leisure Complex, Yarnfield Park",,,https://www.staffordbc.gov.uk/brownfield-land-register,,,,,,,,,,,,2018-11-01,2019-10-15,
http://opendatacommunities.org/id/district-council/wychavon,,"Silver Birches, Stone Road",,,https://www.staffordbc.gov.uk/brownfield-land-register,,,,,,,,,,,,2018-11-01,2019-10-15,
http://opendatacommunities.org/id/district-council/wyre-forest,,"Wellbeing Park, Yarnfield Lane",,,https://www.staffordbc.gov.uk/brownfield-land-register,,,,,,,,,,,,2018-11-01,2019-10-15,
