OrganisationURI,SiteReference,SiteNameAddress,GeoX,GeoY,SiteplanURL,Hectares,OwnershipStatus,HazardousSubstances,PlanningStatus,PermissionType,PermissionDate,PlanningHistory,NetDwellingsRangeFrom,NetDwellingsRangeTo,Deliverable,Notes,FirstAddedDate,LastUpdatedDate,EndDate
http://opendatacommunities.org/id/district-council/south-oxfordshire,P12/S1424/FUL,Townlands Hospital York Road HENLEY-ON-THAMES RG9 2EB,-0.909224,51.538983,,2.396,not owned by a public authority,,permissioned,full planning permission,2013-03-19,"P15/S2956/FUL (Proposed amendments to the approved scheme ( P12/S1424/FUL), in relation to the assisted living units and associated car parking, landscaping, open space, infrastructure and access works) - approved March 2016.",97,97,yes,"The amended scheme (P15/S2956/FUL) results in an additional assisted unit, therefore the proposal includes a 64 bed care home, 34 assisted living units and 12 key worker apartments which totals 110 units overall. However, a care home (Use Class C2) is calculated as 80% of the total (therefore 0.8*64=51). Therefore the overall capacity is 46+51=97.",2017-12-22,2017-12-22,
http://opendatacommunities.org/id/district-council/south-oxfordshire,"P15/S1880/O
(SHELAA: 184)",Didcot A,-1.262269,51.617487,,9.7,not owned by a public authority,,pending decision,outline planning permission,,,280,280,yes,Minimum net dwellings is based on the planning application(P15/S1880/O) as it has a resolution to grant permission. Only the dwellings within South Oxfordshire have been included in the total.,2017-12-22,2017-12-22,
http://opendatacommunities.org/id/district-council/south-oxfordshire,P15/S2685/FUL,"Woodcote NDP Site 16: Former Reservoir site, Greenmore",-1.068691,51.527292,,0.009,not owned by a public authority,,permissioned,full planning permission,2017-05-03,P17/S4336/FUL - Demolition & clearance of existing development. Change of use of the land to a park home site & the development of all associated infrastructure to allow the siting of 16 residential park homes with landscaping - pending consideration.,20,20,yes,Partially Brownfield site. Forms part of a larger site overall.,2017-12-22,2017-12-22,
http://opendatacommunities.org/id/district-council/south-oxfordshire,P16/S0375/FUL,"Woodcote NDP Site 02: Woodcote Garden Centre, Reading Road",-1.065674,51.534551,,0.06,not owned by a public authority,,permissioned,full planning permission,2017-06-29,,9,9,yes,Partially Brownfield site. Forms part of a larger site overall.,2017-12-22,2017-12-22,
http://opendatacommunities.org/id/district-council/south-oxfordshire,P16/S1227/FUL,JHHNDP Site U: Wilkins Yard Deanfield Avenue HENLEY-ON-THAMES Oxon RG9 1UE,-0.908563,51.535245,,0.148,not owned by a public authority,,permissioned,full planning permission,2017-05-30,,23,23,yes,Partially Brownfield site. Forms part of a larger site overall.,2017-12-22,2017-12-22,
http://opendatacommunities.org/id/district-council/south-oxfordshire,"P16/S3922/FUL
(SHELAA 200)","Atalanta Garage, Beggars bush Hill, Benson OX10 6PL",-1.077913,51.606671,,0.33,not owned by a public authority,,permissioned,full planning permission,2017-04-28,"P15/S4369/FUL - Demolition of garages, workshop and offices and replacement with two detached houses and a terrace of three houses - approved March 2016.  P16/S2592/FUL - Demolition of garages, workshops and offices and replacement with two detached houses and a terrace of three houses - approved October 2016.",6,6,yes,,2017-12-22,2017-12-22,
http://opendatacommunities.org/id/district-council/south-oxfordshire,P16/S4117/FUL,"40 Oakley Road, Chinnor, Oxon, OX39 4ES",-0.914981,51.698737,,0.182,not owned by a public authority,,permissioned,full planning permission,,P15/S1501/PDO - Prior approval for change of use of existing office building to residential provide to provide 12 flats - agreed June 2015.     P15/S3559/FUL - Roof conversion to create an additional floor to accommodate six residential units (Use Class C3) - approved September 2016.  P16/S4085/PDO - Prior Notification requirement under Part O of the GPDO for the change of use of offices (Class B1a) to form 14 apartments - agreed February 2017.,20,20,yes,The minimum number of net dwellings is 20 as it is based on both a prior approval and a permission. The prior approval relates to the change of use of the building to 14 apartments (P16/S4085/PDO) and the permission relates to the conversion of the roof into six flats (P16/S4117/FUL). The two schemes can both be built out on the site.,2017-12-22,2017-12-22,
http://opendatacommunities.org/id/district-council/south-oxfordshire,"P16/S4177/FUL
(SHELAA 401)","Bloom Buildings, West End, Cholsey, OX10 9LR",-1.163409,51.569205,,0.68,not owned by a public authority,,permissioned,full planning permission,2017-05-19,,5,5,yes,,2017-12-22,2017-12-22,
http://opendatacommunities.org/id/district-council/south-oxfordshire,P16/S4234/FUL,"Northfield House, 11 Northfield End, HENLEY-ON-THAMES, RG9 2JG",-0.905187,51.540744,,0.098,not owned by a public authority,,permissioned,full planning permission,2017-05-24,,6,6,yes,,2017-12-22,2017-12-22,
http://opendatacommunities.org/id/district-council/south-oxfordshire,P17/S0259/FUL,The Mill at Sonning (Theatre) Ltd Sonning Eye RG4 6TY,-0.915896,51.476003,,0.525,not owned by a public authority,,permissioned,full planning permission,2017-06-27,,5,5,yes,Partially Brownfield site. Forms part of a larger site overall.,2017-12-22,2017-12-22,
http://opendatacommunities.org/id/district-council/south-oxfordshire,"P17/S0709/FUL
(SHELAA 867)","The Walled Garden, Badgemore Park Golf Club, Badgemore, RG9 4NR",-0.924437,51.542594,,0.5,not owned by a public authority,,permissioned,full planning permission,2017-05-05,P17/S3853/FUL - Removal of existing buildings and erection of five dwelling houses  within existing walled garden (alternative to scheme approved under permission P17/S0709/FUL) - approved December 2017.,5,5,yes,,2017-12-22,2017-12-22,
http://opendatacommunities.org/id/district-council/south-oxfordshire,P17/S1355/FUL,"Innovex House, 309 Reading Road, HENLEY-ON-THAMES, RG9 1EL",-0.895678,51.527931,,0.175,not owned by a public authority,,permissioned,full planning permission,2017-07-21,P16/S3796/PDO - Change of use from Use Class B1a offices to 23 flats - agreed January 2017,30,30,yes,The minimum number of net dwellings is 30 as it is based on both a prior approval and a permission. The prior approval relates to the change of use of the building to 23 apartments (P16/S3796/PDO) and the permission relates to the conversion of the roof into six flats (P17/S1355/FUL). Both of these schemes can be built out on the site.,2017-12-22,2017-12-22,
http://opendatacommunities.org/id/district-council/south-oxfordshire,P17/S2178/PDO,"Girdler House, Quebec Road, Henley on Thames, RG9 1EY",-0.899452,51.531042,,0.05,not owned by a public authority,,permissioned,other,2017-08-10,P17/S3600/FUL - Internal and external alterations to office premises to form five 2-bedroom apartments - pending condsideration.,5,5,yes,,2017-12-22,2017-12-22,
http://opendatacommunities.org/id/district-council/south-oxfordshire,P17/S2446/FUL,"291 Reading Road, HENLEY-ON-THAMES, RG9 1EL",-0.896279,51.528701,,0.101,not owned by a public authority,,permissioned,full planning permission,2017-09-06,,5,5,yes,,2017-12-22,2017-12-22,
http://opendatacommunities.org/id/district-council/south-oxfordshire,SHELAA: 1034,"Oxford Brookes University Campus, Wheatley",-1.129371,51.749623,,7.69,not owned by a public authority,,not permissioned,,,,300,300,yes,Partially Brownfield site. Forms part of a larger site overall. Mininum number of net dwellings is based on the capacity calculated in the SHELAA (Autumn 2017),2017-12-22,2017-12-22,
http://opendatacommunities.org/id/district-council/south-oxfordshire,SHELAA: 1050,"Vanalloys Business Park, Stoke Row (3)",-1.018393,51.550216,,0.995,not owned by a public authority,,not permissioned,,,,25,25,yes,Mininum number of net dwellings is based on the capacity calculated in the SHELAA,2017-12-22,2017-12-22,
http://opendatacommunities.org/id/district-council/south-oxfordshire,SHELAA: 1085,"Land to the rear of Thames Court, Goring",-1.136965,51.523273,,0.33,not owned by a public authority,,not permissioned,,,,8,8,yes,Mininum number of net dwellings is based on the capacity calculated in the SHELAA,2017-12-22,2017-12-22,
http://opendatacommunities.org/id/district-council/south-oxfordshire,SHELAA: 1195,"Land to the north of Fane Drive, Berinsfield (3)",-1.171162,51.666467,,0.461,not owned by a public authority,,not permissioned,,,,12,12,yes,Large majority of site is Brownfield. Mininum number of net dwellings is based on the capacity calculated in the SHELAA,2017-12-22,2017-12-22,
http://opendatacommunities.org/id/district-council/south-oxfordshire,SHELAA: 148,"Land north of B4526, Cray's Pond",-1.069088,51.516298,,0.186,not owned by a public authority,,not permissioned,,,,7,7,yes,Large majority of site is Brownfield. Mininum number of net dwellings is based on the capacity calculated in the SHELAA,2017-12-22,2017-12-22,
http://opendatacommunities.org/id/district-council/south-oxfordshire,P15/S2159/O (SHELAA: 185),Didcot Gateway,-1.242473,51.610168,,4.341,mixed ownership,,pending decision,outline planning permission,,"P12/S1543/FUL - Demolition of existing 2 storey residential / shop building and construction of new 3 storey residential / shop building consisting of 2 shop/ service units and 7 one-bedroom apartments - pending consideration.  P12/S1551/FUL - Erection of 10 x 1 bed apartments and 5 x A1/A2 units with car - withdrawn prior to determination November 2016. P14/S0024/O - Demolition of existing buildings. Outline application for erection of mixed use development comprising residential flats, commercial units (B1 use) and new public open space - pending consideration. P15/S0348/SCO - Scoping Opinion for Didcot Station Gateway issued March 2015.        P15/S2159/O - Outline planning application for demolition of existing buildings and a mixed use development comprised of up to 300 residential units (use class C3), a 70-bed hotel (use class C1), up to 800sqm gym (use class D2), up to 2,400sqm retail uses (A1, A2, A3, A4, A5), up to 1,800 sqm commercial office floorspace (use class B1), a replacement nursery school (use class D1) and a decked car park of up to three levels and supporting infrastructure. All matters are reserved except for new means of vehicular access to the site - pending consideration.",300,300,yes,Minimum net dwellings is based on the planning application (P15/S2159/O ) as it has a resolution to grant permission.,2017-12-22,2017-12-22,
http://opendatacommunities.org/id/district-council/south-oxfordshire,P16/S3525/FUL (SHELAA: 202),"Thames Valley Police Station, Thame",-0.977795,51.749428,,0.323,not owned by a public authority,,pending decision,full planning permission,,P14/S0880/FUL - Demolition of existing police station and redevelopment to form 45 sheltered apartments for the elderly  - appeal dismissed January 2016.,8,8,yes,Minimum net dwellings is based on the capacity calculated in the SHELAA rather than the planning application as there is an appeal pending on the application.,2017-12-22,2017-12-22,
http://opendatacommunities.org/id/district-council/south-oxfordshire,SHELAA: 274,"Vauxhall Barracks, Didcot",-1.253999,51.612714,,8.252,not owned by a public authority,,not permissioned,,,,300,300,yes,Mininum number of net dwellings is based on the capacity calculated in the SHELAA.,2017-12-22,2017-12-22,
http://opendatacommunities.org/id/district-council/south-oxfordshire,P15/S3387/FUL (SHELAA: 302),"CABI, Mongewell",-1.118092,51.589923,,1.617,not owned by a public authority,,permissioned,full planning permission,2017-08-31,"P12/S0436 - Re-development of CABI Wallingford site. Demolition of existing offices and creation of new offices for use by CABI. Creation of care village (new office building (up to 3,108 sq m) (B1 Use Class), A dedicated 'extra care' retirement development up to 17,165 sq m comprising up to 49 extra care units and care home comprising up to 64 bed spaces (C2 Use Class), Up to 56 retirement units (C3 Use Class), Up to 24 key worker flats (C3 Use Class), a community/ leisure use building up to 375 sq m (D1/D2 Use Class), and open space, footpaths and landscaping) - approved January 2014.    P16/S3800/O - Re-development of CABI Wallingford Site - withdrawn prior to determination December 2017.",91,91,yes,Partially Brownfield site. Forms part of a larger site overall.,2017-12-22,2017-12-22,
http://opendatacommunities.org/id/district-council/south-oxfordshire,P17/S2624/PDO (SHELAA: 308),"DAF, Thame",-0.959464,51.740887,,3.756,not owned by a public authority,,permissioned,other,2017-09-08,P17/S4127/PDO - Change of use from offices (Class B1) to residential (Class C3) to comprise 45 flats - pending consideration.,97,97,yes,Large majority of site is Brownfield. The minimum number of net dwellings is based on the capacity calculated on the SHELAA (97) rather than the prior approval (45). This is because the prior approval only relates to the conversion of the building and not the overall site where there is potential for a higher capacity.,2017-12-22,2017-12-22,
http://opendatacommunities.org/id/district-council/south-oxfordshire,P10/W0093 (SHELAA: 335),"Dovehouse Farm, Cuddesdon (1)",-1.130226,51.723195,,1.17,not owned by a public authority,,permissioned,full planning permission,2014-06-06,"P16/S3997/FUL - Variation of conditions of P10/W0093 to allow construction of the site access before agreement of pre commencement conditions. Conversion of traditional buildings into office accommodation and three residential conversions, and five new build residential units - approved February 2017. P17/S2644/LDE - to confirm that the P16/S3997/FUL planning permission has been lawfully commenced at Dovehouse Farm - Certificate of Lawful Use or Development issued September 2017.",8,8,yes,Large majority of site is Brownfield,2017-12-22,2017-12-22,
http://opendatacommunities.org/id/district-council/south-oxfordshire,P15/S3848/FUL (SHELAA: 347),"Goodsons Industrial Mews, Thame",-0.97295,51.745897,,1.013,not owned by a public authority,,permissioned,full planning permission,2016-12-22,,29,29,yes,. `,2017-12-22,2017-12-22,
http://opendatacommunities.org/id/district-council/south-oxfordshire,SHELAA: 360,"Stuart Turner, Greys Road, Henley-on-Thames",-0.90621,51.535979,,0.751,not owned by a public authority,,not permissioned,,,,42,42,yes,Mininum number of net dwellings is based on the capacity calculated in the SHELAA,2017-12-22,2017-12-22,
http://opendatacommunities.org/id/district-council/south-oxfordshire,P15/S3385/FUL (SHELAA: 390),"The Workshop, Newtown Road, Henley-on-Thames",-0.893647,51.528452,,0.345,not owned by a public authority,,permissioned,full planning permission,2016-12-20,,64,64,yes,Large majority of site is Brownfield. Minimum net dwellings for a care home (Use Class C2) is calculated as 80% of the total (therefore 0.8*80=64),2017-12-22,2017-12-22,
http://opendatacommunities.org/id/district-council/south-oxfordshire,P16/S1514/FUL (SHELAA: 395),"13-16 St Martins Street, Wallingford",-1.125902,51.598946,,0.32,not owned by a public authority,,permissioned,full planning permission,2016-10-21,"P12/S2200/FUL - Refurbishment and part change of use of former Waitrose unit to provide a mixed-use development (Class A1, A3 and C3) including 7no. residential units at first floor - approved November 2012. P16/S3952/FUL - Redevelopment of Former Waitrose to create 22 retirement apartments, which provides for continued independent living and two ground floor retail units - withdrawn prior to determination December 2016.",22,22,yes,,2017-12-22,2017-12-22,
http://opendatacommunities.org/id/district-council/south-oxfordshire,P16/S2593/FUL (SHELAA: 398),"Sydney Harrison, House Mill Road, Lower Shiplake",-0.882454,51.509265,,0.429,not owned by a public authority,,permissioned,full planning permission,2017-02-28,,16,16,yes,,2017-12-22,2017-12-22,
http://opendatacommunities.org/id/district-council/south-oxfordshire,P16/S2932/FUL (SHELAA: 399),South Oxford Business Centre Lower Road Garsington,-1.15653,51.701474,,0.642,not owned by a public authority,,permissioned,full planning permission,2016-11-10,,10,10,yes,,2017-12-22,2017-12-22,
http://opendatacommunities.org/id/district-council/south-oxfordshire,P17/S0322/O (SHELAA: 402),"Hughendon Motors, London Road, Milton Common",-1.053878,51.724286,,0.269,not owned by a public authority,,permissioned,outline planning permission,2017-03-23,,5,5,yes,,2017-12-22,2017-12-22,
http://opendatacommunities.org/id/district-council/south-oxfordshire,SHELAA: 822,"The Downs, Wheatley Road, Garsington",-1.155502,51.725618,,1.138,not owned by a public authority,,not permissioned,,,,29,29,yes,Large majority of site is Brownfield. Mininum number of net dwellings is based on the capacity calculated in the SHELAA.,2017-12-22,2017-12-22,
http://opendatacommunities.org/id/district-council/south-oxfordshire,SHELAA: 824 (P16/S0375/FUL),"Land at Woodcote Garden Centre, Woodcote",-1.065993,51.534464,,0.208,not owned by a public authority,,permissioned,full planning permission,2017-06-29,,9,9,yes,Large majority of site is Brownfield.,2017-12-22,2017-12-22,
http://opendatacommunities.org/id/district-council/south-oxfordshire,SHELAA: 853 (P17/S0024/RM),"Land at Highlands Farm, Henley-on-Thames",-0.931951,51.525911,,5.913,not owned by a public authority,,permissioned,reserved matters approval,2017-05-24,P17/S4409/O - Outline planning application with all matters reserved for the construction of up-to 5 detached dwellings - pending consideration.,536,536,yes,Partially Brownfield site. Forms part of a larger site overall. The  minimum number of net dwellings is based on the capacity calulated in the SHELAA (536). This is because the planning permission of 170 dwellings only relates to part of the site and not the overall site where there is potential for a higher capacity.,2017-12-22,2017-12-22,
http://opendatacommunities.org/id/district-council/south-oxfordshire,SHELAA: 869,"Foxcovert Farm, Woodcote",-1.078977,51.526168,,0.514,not owned by a public authority,,not permissioned,,,,17,17,yes,Large majority of site is Brownfield. Mininum number of net dwellings is based on the capacity calculated in the SHELAA.,2017-12-22,2017-12-22,
http://opendatacommunities.org/id/district-council/south-oxfordshire,SHELAA: 870,"Land at Wimblestraw Road, Berinsfield",-1.176214,51.660541,,1.079,not owned by a public authority,,pending decision,outline planning permission,,P16/S3462/O - Proposed redevelopment of existing buildings to provide new residential development comprising 39 houses/flats,24,24,yes,Minimum net dwellings is based on the capacity calculated in the SHELAA rather than the planning application which is still pending a decision.,2017-12-22,2017-12-22,
http://opendatacommunities.org/id/district-council/south-oxfordshire,P11/W2357 (SHELAA: 940),"Mongewell Park (Carmel College), Mongewell",-1.121745,51.583881,,4.206,not owned by a public authority,,permissioned,full planning permission,2016-03-21,,166,166,yes,Partially Brownfield site. Forms part of a larger site overall.,2017-12-22,2017-12-22,
http://opendatacommunities.org/id/district-council/south-oxfordshire,SHELAA: 949,"Henley College, Henley-on-Thames",-0.915797,51.53542,,3.323,not owned by a public authority,,not permissioned,,,,184,184,yes,Partially Brownfield site. Forms part of a larger site overall. Mininum number of net dwellings is based on the capacity calculated in the SHELAA.,2017-12-22,2017-12-22,
http://opendatacommunities.org/id/district-council/south-oxfordshire,SHELAA: 979,"Lord William's Lower School, Thame",-0.961993,51.744263,,2.48,not owned by a public authority,,not permissioned,,,,5,5,yes,Partially Brownfield site. Forms part of a larger site overall. Mininum number of net dwellings is based on the capacity calculated in the SHELAA.,2017-12-22,2017-12-22,
http://opendatacommunities.org/id/district-council/south-oxfordshire,SHELAA: 991,"Chiltern's End, Henley-on-Thames",-0.918198,51.530209,,0.525,not owned by a public authority,,not permissioned,,,,27,27,yes,Partially Brownfield site. Forms part of a larger site overall. Mininum number of net dwellings is based on the capacity calculated in the SHELAA.,2017-12-22,2017-12-22,
http://opendatacommunities.org/id/district-council/south-oxfordshire,SHELAA: 999,"Land east of Goring Road, Woodcote",-1.076562,51.527246,,0.462,not owned by a public authority,,not permissioned,,,,89,89,yes,Partially Brownfield site. Forms part of a larger site overall. Mininum number of net dwellings is based on the capacity calculated in the SHELAA.,2017-12-22,2017-12-22,
