OrganisationURI,SiteReference,SiteNameAddress,GeoX,GeoY,SiteplanURL,Hectares,OwnershipStatus,HazardousSubstances,PlanningStatus,PermissionType,PermissionDate,PlanningHistory,NetDwellingsRangeFrom,NetDwellingsRangeTo,Deliverable,Notes,FirstAddedDate,LastUpdatedDate,EndDate
http://opendatacommunities.org/id/metropolitan-district-council/tameside,H-AUDENS-110,"Former Robertson's Jam, land at Fitzroy Street, Audenshaw.",-2.141845,53.476544,https://www.tameside.gov.uk/planning/brownfieldregister/h-audens-110.pdf,8.08,not owned by a public authority,,not permissioned,,,https://public.tameside.gov.uk/plan/f422planapp.asp,318,318,,"Vacant employment site, formally Robertson's Jam. Submitted through 2014 site ref: CFS 40. Policy E3 Employment Land. Sustainable location with canal frontage.",2017-12-04,2017-12-04,
http://opendatacommunities.org/id/metropolitan-district-council/tameside,H-DENSTH-001,"Site of 2-32 Wordsworth Road, Denton.",-2.104161,53.439083,https://www.tameside.gov.uk/planning/brownfieldregister/h-densth-001.pdf,0.36,not owned by a public authority,,permissioned,full planning permission,2014-05-16,https://public.tameside.gov.uk/plan/f422planapp.asp,16,16,yes,Planning permission reference 13/00929/FUL. Construction has not commenced. Overgrown land and hardstanding.. Gross addition of 16 houses.,2017-12-04,2017-12-04,
http://opendatacommunities.org/id/metropolitan-district-council/tameside,H-DENSTH-031,"Former site of the Old Rectory, Meadow Lane, Denton, M34 7GD",-2.10122,53.437018,https://www.tameside.gov.uk/planning/brownfieldregister/h-densth-031.pdf,0.36,not owned by a public authority,,not permissioned,,,https://public.tameside.gov.uk/plan/f422planapp.asp,13,13,,NLUD site - former rectory and grounds. Site included in adopted Haughton Green SPD.,2017-12-04,2017-12-04,
http://opendatacommunities.org/id/metropolitan-district-council/tameside,H-DENTNE-001,"Former Oldham Batteries site west side Edward Street, Denton.",-2.110562,53.457585,https://www.tameside.gov.uk/planning/brownfieldregister/h-dentne-001.pdf,3.43,not owned by a public authority,,permissioned,outline planning permission,2015-09-09,https://public.tameside.gov.uk/plan/f422planapp.asp,150,150,yes,Planning permission reference 15/00704/OUT. Construction has not commenced. Vacant brownfield former employment site.. Gross addition of up to 150 houses.,2017-12-04,2017-12-04,
http://opendatacommunities.org/id/metropolitan-district-council/tameside,H-DENTNE-002,"Land and buildings on the east side of Edward Street, Denton.",-2.108287,53.45729,https://www.tameside.gov.uk/planning/brownfieldregister/h-dentne-002.pdf,1.14,not owned by a public authority,,permissioned,outline planning permission,2015-05-07,https://public.tameside.gov.uk/plan/f422planapp.asp,56,56,yes,Planning permission reference 15/00081/OUT. Construction has not commenced. Site of former works buildings - now demolished.  Buildings have been demolished leaving areas of rubble and hard standing.. Gross addition of up to 56 houses.,2017-12-04,2017-12-04,
http://opendatacommunities.org/id/metropolitan-district-council/tameside,H-DENTNE-005,"Works building, 88-90 Wilton Street, Denton.",-2.12029,53.457468,https://www.tameside.gov.uk/planning/brownfieldregister/h-dentne-005.pdf,0.29,not owned by a public authority,,not permissioned,,,https://public.tameside.gov.uk/plan/f422planapp.asp,19,19,,Employment site containing works unit. Residential outline planning permission 05/00642/OUT expired 26/09/2008.,2017-12-04,2017-12-04,
http://opendatacommunities.org/id/metropolitan-district-council/tameside,H-DENTNE-026,"Works at junction of Bromsgrove Lane and Thornleys Road, Denton, M34 3DS",-2.10344,53.45831,https://www.tameside.gov.uk/planning/brownfieldregister/h-dentne-026.pdf,0.45,mixed ownership,,not permissioned,,,https://public.tameside.gov.uk/plan/f422planapp.asp,18,18,,Small employment site consisting of industrial/commercial units and yard area. Residential outline permission 11/00642/OUT withdrawn 15/06/2016.,2017-12-04,2017-12-04,
http://opendatacommunities.org/id/metropolitan-district-council/tameside,H-DENTNE-044,"51-55 Stockport Road, Denton, M34 6DB",-2.112542,53.454851,https://www.tameside.gov.uk/planning/brownfieldregister/h-dentne-044.pdf,0.1,not owned by a public authority,,permissioned,full planning permission,2014-02-27,https://public.tameside.gov.uk/plan/f422planapp.asp,9,9,yes,Planning permission reference 13/01037/FUL. Construction has not commenced. Vacant listed early 19th century house last in use as offices.. Gross addition of 9 apartments.,2017-12-04,2017-12-04,
http://opendatacommunities.org/id/metropolitan-district-council/tameside,H-DENWST-021,"S G Turret Ltd, 96 Town Lane, Denton, M34 2DD",-2.118342,53.450369,https://www.tameside.gov.uk/planning/brownfieldregister/h-denwst-021.pdf,0.1,not owned by a public authority,,permissioned,full planning permission,2015-05-14,https://public.tameside.gov.uk/plan/f422planapp.asp,8,8,yes,Planning permission reference 15/00094/FUL. Construction has not commenced. Two storey industrial/works building. Gross addition of 8 apartments.,2017-12-04,2017-12-04,
http://opendatacommunities.org/id/metropolitan-district-council/tameside,H-DROEST-013,"Land adjacent to 46 Gorsey Fields, Droylsden.",-2.145262,53.475884,https://www.tameside.gov.uk/planning/brownfieldregister/h-droest-013.pdf,0.18,not owned by a public authority,,permissioned,full planning permission,2014-10-07,https://public.tameside.gov.uk/plan/f422planapp.asp,9,9,yes,Planning permission reference 14/00741/FUL. Construction has not commenced. Vacant overgrown site.. Gross addition of 9 houses.,2017-12-04,2017-12-04,
http://opendatacommunities.org/id/metropolitan-district-council/tameside,H-DROEST-014,"296 Edge Lane and 429-431 Manchester Road, Droylsden, M43 6BG",-2.166284,53.480737,https://www.tameside.gov.uk/planning/brownfieldregister/h-droest-014.pdf,0.02,not owned by a public authority,,not permissioned,,,https://public.tameside.gov.uk/plan/f422planapp.asp,5,5,,Derelict multi-storey building. Building vacant and boarded up.,2017-12-04,2017-12-04,
http://opendatacommunities.org/id/metropolitan-district-council/tameside,H-DROEST-017,"Garage premises at 178 Moorside Street, Droylsden, M43 7HG",-2.132629,53.488042,https://www.tameside.gov.uk/planning/brownfieldregister/h-droest-017.pdf,0.07,not owned by a public authority,,not permissioned,,,https://public.tameside.gov.uk/plan/f422planapp.asp,6,6,,Car repair garage and surrounding yard area. Residential outline permission 07/00834/OUT expired 12/11/2010.,2017-12-04,2017-12-04,
http://opendatacommunities.org/id/metropolitan-district-council/tameside,H-DROEST-035,"Victoria Mill, Buckley Street, Droylsden, M43 6DU",-2.151436,53.479013,https://www.tameside.gov.uk/planning/brownfieldregister/h-droest-035.pdf,1.24,not owned by a public authority,,permissioned,outline planning permission,2015-11-19,https://public.tameside.gov.uk/plan/f422planapp.asp,127,127,yes,Planning permission reference 15/00030/OUT. Construction has not commenced. Existing mill complex located close to Droylsden Marina.. Gross addition of 70 houses and 57 flats.,2017-12-04,2017-12-04,
http://opendatacommunities.org/id/metropolitan-district-council/tameside,H-DROEST-053,"Meadow View Fish Farm, Lumb Lane, Droylsden, M43 7LN",-2.126312,53.497136,https://www.tameside.gov.uk/planning/brownfieldregister/h-droest-053.pdf,0.51,not owned by a public authority,,permissioned,outline planning permission,2015-09-11,https://public.tameside.gov.uk/plan/f422planapp.asp,8,8,yes,Planning permission reference 15/00564/OUT. Construction has not commenced. Former fish farm buildings and associated parking areas.. Gross addition of 8 houses.,2017-12-04,2017-12-04,
http://opendatacommunities.org/id/metropolitan-district-council/tameside,H-DUKINF-017,"Site of North Star Public House, Queen Street, Dukinfield, SK16 4LS",-2.093356,53.48132,https://www.tameside.gov.uk/planning/brownfieldregister/h-dukinf-017.pdf,0.09,not owned by a public authority,,not permissioned,,,https://public.tameside.gov.uk/plan/f422planapp.asp,18,18,,Cleared site of former pub. Residential reserved matters planning permission 07/00826/REM expired 12/09/2010.,2017-12-04,2017-12-04,
http://opendatacommunities.org/id/metropolitan-district-council/tameside,H-DUKINF-018,"Garage and showroom at 193 King Street, Dukinfield, SK16 4TH",-2.092591,53.47609,https://www.tameside.gov.uk/planning/brownfieldregister/h-dukinf-018.pdf,0.18,not owned by a public authority,,not permissioned,,,https://public.tameside.gov.uk/plan/f422planapp.asp,10,10,,Garage and showroom.  Site remains in commercial use. Residential outline permission 06/00392/OUT expired 10/05/2009.,2017-12-04,2017-12-04,
http://opendatacommunities.org/id/metropolitan-district-council/tameside,H-DUKSTB-002,"Land adjacent 102-128 Sandy Lane, Dukinfield.",-2.074939,53.479715,https://www.tameside.gov.uk/planning/brownfieldregister/h-dukstb-002.pdf,0.4,not owned by a public authority,,permissioned,outline planning permission,2015-03-30,https://public.tameside.gov.uk/plan/f422planapp.asp,15,15,yes,"Planning permission reference 14/00627/OUT. Construction has not commenced. Triangular shaped, vacant former reservoir site in established employment area.. Gross addition of 15 houses.",2017-12-04,2017-12-04,
http://opendatacommunities.org/id/metropolitan-district-council/tameside,H-DUKSTB-020,"Pineapple Inn, 18 Kenworthy Street, Stalybridge, SK15 2DX",-2.056331,53.480687,https://www.tameside.gov.uk/planning/brownfieldregister/h-dukstb-020.pdf,0.13,not owned by a public authority,,permissioned,full planning permission,2015-01-16,https://public.tameside.gov.uk/plan/f422planapp.asp,6,6,yes,Planning permission reference 14/00696/FUL. Construction has not commenced. PH and car parking area.. Gross addition of 7 houses. Loss of 1 apartment.,2017-12-04,2017-12-04,
http://opendatacommunities.org/id/metropolitan-district-council/tameside,H-DUKSTB-023,"Castle Street car park west of restaurant, Stalybridge.",-2.05998,53.482348,https://www.tameside.gov.uk/planning/brownfieldregister/h-dukstb-023.pdf,0.51,mixed ownership,,not permissioned,,,https://public.tameside.gov.uk/plan/f422planapp.asp,51,51,,Vacant land/car park.  Potential DOA development site - sustainable location.,2017-12-04,2017-12-04,
http://opendatacommunities.org/id/metropolitan-district-council/tameside,H-DUKSTB-024,"Former Site Of 10-12 Castle Street (Parcel A), Stalybridge.",-2.058368,53.48314,https://www.tameside.gov.uk/planning/brownfieldregister/h-dukstb-024.pdf,0.3,not owned by a public authority,,permissioned,full planning permission,2017-03-31,https://public.tameside.gov.uk/plan/f422planapp.asp,38,38,yes,Planning permission reference 17/00019/FUL. Construction has not commenced. Former mill site now waste land and informal car park.. Gross addition of 38 apartments.,2017-12-04,2017-12-04,
http://opendatacommunities.org/id/metropolitan-district-council/tameside,H-DUKSTB-036,"Former police station site, Corporation Street, Stalybridge, SK15 3AA",-2.054842,53.483016,https://www.tameside.gov.uk/planning/brownfieldregister/h-dukstb-036.pdf,0.08,not owned by a public authority,,permissioned,full planning permission,2014-12-12,https://public.tameside.gov.uk/plan/f422planapp.asp,18,18,yes,Planning permission reference 14/00821/FUL. Construction has not commenced. Former police station in the centre of Stalybridge town centre.. Gross addition of 18 apartments.,2017-12-04,2017-12-04,
http://opendatacommunities.org/id/metropolitan-district-council/tameside,H-DUKSTB-039,"Site of Wellington Inn, Caroline Street/Bridge Street, Stalybridge, SK15 1PD",-2.061848,53.481943,https://www.tameside.gov.uk/planning/brownfieldregister/h-dukstb-039.pdf,0.15,mixed ownership,,not permissioned,,,https://public.tameside.gov.uk/plan/f422planapp.asp,24,24,,"Cleared site of Wellington Inn, currently used as an informal parking area. Cleared vacant site - sustainable location. Residential full planning permission 07/00455/FUL expired 21/01/2011.",2017-12-04,2017-12-04,
http://opendatacommunities.org/id/metropolitan-district-council/tameside,H-DUKSTB-049,"44 Grosvenor Street, Stalybridge, Stalybridge, SK15 1RR",-2.057643,53.48155,https://www.tameside.gov.uk/planning/brownfieldregister/h-dukstb-049.pdf,0.04,not owned by a public authority,,not permissioned,,,https://public.tameside.gov.uk/plan/f422planapp.asp,5,5,,"Large, single commercial unit located within Stalybridge town centre. Ground floor in commercial use. Sustainable town centre location. Residential full planning permission 12/01052/FUL expired 27/02/2016.",2017-12-04,2017-12-04,
http://opendatacommunities.org/id/metropolitan-district-council/tameside,H-DUKSTB-061,"Former site of 10-12 Castle Street (Parcel B), Stalybridge.",-2.05882,53.483059,https://www.tameside.gov.uk/planning/brownfieldregister/h-dukstb-061.pdf,0.17,not owned by a public authority,,permissioned,outline planning permission,2017-03-31,https://public.tameside.gov.uk/plan/f422planapp.asp,24,24,yes,Planning permission reference 17/00019/FUL. Construction has not commenced. Former mill site and informal car park.. Gross addition of 24 apartments.,2017-12-04,2017-12-04,
http://opendatacommunities.org/id/metropolitan-district-council/tameside,H-DUKSTB-062,"Parking area, rear Of 1-7 Gloucester Rise, Dukinfield.",-2.061008,53.474186,https://www.tameside.gov.uk/planning/brownfieldregister/h-dukstb-062.pdf,0.21,not owned by a public authority,,not permissioned,,,https://public.tameside.gov.uk/plan/f422planapp.asp,7,7,,NLUD site. Cleared former garage site in residential area - existing access off Gloucester Rise.,2017-12-04,2017-12-04,
http://opendatacommunities.org/id/metropolitan-district-council/tameside,H-HURST-028,"Site of former Conservative Club, Vernon Street, Ashton-under-Lyne.",-2.085489,53.496184,https://www.tameside.gov.uk/planning/brownfieldregister/h-hurst-028.pdf,0.4,not owned by a public authority,,permissioned,full planning permission,2017-02-28,https://public.tameside.gov.uk/plan/f422planapp.asp,24,24,yes,Planning permission reference 15/00063/FUL. Construction has not commenced. Site of former club building. Cleared vacant site with access.. Gross addition of 24 apartments.,2017-12-04,2017-12-04,
http://opendatacommunities.org/id/metropolitan-district-council/tameside,H-HYDGOD-022,"Former Globe Works, Brook Street, Hyde.",-2.069516,53.452834,https://www.tameside.gov.uk/planning/brownfieldregister/h-hydgod-022.pdf,1.43,not owned by a public authority,,not permissioned,,,https://public.tameside.gov.uk/plan/f422planapp.asp,44,44,,"Vacant former industrial site. Sloping sections, with stream adjacent. Cleared vacant site with access. Site bisected by Godley Brook. Residential outline permission 13/01025/FUL written off 09/12/16.",2017-12-04,2017-12-04,
http://opendatacommunities.org/id/metropolitan-district-council/tameside,H-HYDGOD-038,"Land at Junction of William Street and Crook Street, Hyde.",-2.076934,53.449872,https://www.tameside.gov.uk/planning/brownfieldregister/h-hydgod-038.pdf,0.13,not owned by a public authority,,not permissioned,,,https://public.tameside.gov.uk/plan/f422planapp.asp,23,23,,"Former site of Unitarian Methodist Church, now car park and car showroom and garage.  Existing commercial garage site. Sustainable town centre location. Residential full planning permission 10/01028/FUL expired 03/03/2014.",2017-12-04,2017-12-04,
http://opendatacommunities.org/id/metropolitan-district-council/tameside,H-HYDGOD-046,"Hattersley Regeneration Site 17-site of Hattersley Court and adjoining land, Hatterlsey Road West, Hyde.",-2.036246,53.446242,https://www.tameside.gov.uk/planning/brownfieldregister/h-hydgod-046.pdf,0.34,not owned by a public authority,,permissioned,outline planning permission,2016-12-21,https://public.tameside.gov.uk/plan/f422planapp.asp,20,20,yes,Planning permission reference 16/00963/OUT. Construction has not commenced. Former housing site.. Gross addition of 20 houses.,2017-12-04,2017-12-04,
http://opendatacommunities.org/id/metropolitan-district-council/tameside,H-HYDGOD-047,"Hattersley Regeneration Site 19-site of 2-18 Waterside and garages, Hyde.",-2.037662,53.447132,https://www.tameside.gov.uk/planning/brownfieldregister/h-hydgod-047.pdf,0.38,not owned by a public authority,,permissioned,outline planning permission,2016-12-21,https://public.tameside.gov.uk/plan/f422planapp.asp,21,21,yes,Planning permission reference 16/00964/OUT. Construction has not commenced. Former housing site.. Gross addition of 21 houses.,2017-12-04,2017-12-04,
http://opendatacommunities.org/id/metropolitan-district-council/tameside,H-HYDGOD-069,"1-3 Market Place, Hyde, SK14 2LY",-2.079693,53.451632,https://www.tameside.gov.uk/planning/brownfieldregister/h-hydgod-069.pdf,0.1,not owned by a public authority,,permissioned,other,2015-12-22,https://public.tameside.gov.uk/plan/f422planapp.asp,11,11,yes,Planning permission reference 15/00949/P3N. Construction has not commenced. Office building located within Hyde Town Centre.. Gross addition of 11 apartments.,2017-12-04,2017-12-04,
http://opendatacommunities.org/id/metropolitan-district-council/tameside,H-HYDGOD-070,"Woodhead House, 44-46 Market Street, Hyde, SK14 1AH",-2.080611,53.451604,https://www.tameside.gov.uk/planning/brownfieldregister/h-hydgod-070.pdf,0.05,not owned by a public authority,,permissioned,other,2016-06-24,https://public.tameside.gov.uk/plan/f422planapp.asp,8,8,yes,Planning permission reference 16/00439/P3N. Construction has not commenced. First and second floor office accommodation located within Hyde town centre.. Gross addition of 8 apartments.,2017-12-04,2017-12-04,
http://opendatacommunities.org/id/metropolitan-district-council/tameside,H-HYDNEW-001,"Land at 2 Broadway, Hyde, SK14 4QQ",-2.090303,53.46313,https://www.tameside.gov.uk/planning/brownfieldregister/h-hydnew-001.pdf,2.1,not owned by a public authority,,permissioned,outline planning permission,2015-02-02,https://public.tameside.gov.uk/plan/f422planapp.asp,90,90,yes,"Planning permission reference 15/00721/OUT. Construction has not commenced. Vacant employment site, located within an established employment area.. Gross addition of 90 houses.",2017-12-04,2017-12-04,
http://opendatacommunities.org/id/metropolitan-district-council/tameside,H-HYDNEW-007,"Former Carrfield Mills site, Newton Street, Hyde.",-2.082124,53.455208,https://www.tameside.gov.uk/planning/brownfieldregister/h-hydnew-007.pdf,2.77,not owned by a public authority,,pending decision,,,https://public.tameside.gov.uk/plan/f422planapp.asp,127,127,,Planning application pending reference 16/00897/OUT. Vacant site located within an established employment area. CFS 66: Large former cleared industrial site.,2017-12-04,2017-12-04,
http://opendatacommunities.org/id/metropolitan-district-council/tameside,H-HYDNEW-052,"Part of East Tame Business Park, Rexcine Way, Hyde, SK14 4GX",-2.054639,53.464617,https://www.tameside.gov.uk/planning/brownfieldregister/h-hydnew-052.pdf,1.82,not owned by a public authority,,permissioned,outline planning permission,2015-12-24,https://public.tameside.gov.uk/plan/f422planapp.asp,42,42,yes,Planning permission reference 15/00721/OUT. Construction has not commenced. Cleared former industrial site within East Tame Business Park.. Gross addition of 42 houses.,2017-12-04,2017-12-04,
http://opendatacommunities.org/id/metropolitan-district-council/tameside,H-HYDNEW-066,"Wharf Mill North Site, Dukinfield Road, Hyde.",-2.089555,53.45816,https://www.tameside.gov.uk/planning/brownfieldregister/h-hydnew-066.pdf,0.9,not owned by a public authority,,not permissioned,,,https://public.tameside.gov.uk/plan/f422planapp.asp,33,33,,Remainder of Wharf Mill site. Submitted through GMSF CFS 2015/16.,2017-12-04,2017-12-04,
http://opendatacommunities.org/id/metropolitan-district-council/tameside,H-HYDNEW-082,"Part of Newton Business Park, Cartwright Street, Hyde, SK14 4FA",-2.059156,53.463347,https://www.tameside.gov.uk/planning/brownfieldregister/h-hydnew-082.pdf,2.08,not owned by a public authority,,permissioned,outline planning permission,2016-12-16,https://public.tameside.gov.uk/plan/f422planapp.asp,64,64,yes,Planning permission reference 16/00054/OUT. Construction has not commenced. Element of existing business park and ancillary parking areas.. Gross addition of 64 houses.,2017-12-04,2017-12-04,
http://opendatacommunities.org/id/metropolitan-district-council/tameside,H-HYDWER-026,"Vacant builders yard off Acorn Avenue and Rowbotham Street, Gee Cross, Hyde.",-2.069432,53.438794,https://www.tameside.gov.uk/planning/brownfieldregister/h-hydwer-026.pdf,0.46,not owned by a public authority,,permissioned,full planning permission,2011-06-29,https://public.tameside.gov.uk/plan/f422planapp.asp,16,16,yes,"Planning permission reference 10/00512/FUL Construction has not commenced. Derelict buildings and areas of hardstanding. Flat, untidy and within residential area.  Works buildings/sheds remain at rear of site.. Gross addition of 16 houses.",2017-12-04,2017-12-04,
http://opendatacommunities.org/id/metropolitan-district-council/tameside,H-HYDWER-059,"Dress Up And Party Showroom, Croft Street, Hyde.",-2.07862,53.449574,https://www.tameside.gov.uk/planning/brownfieldregister/h-hydwer-059.pdf,0.03,not owned by a public authority,,permissioned,outline planning permission,2015-03-13,https://public.tameside.gov.uk/plan/f422planapp.asp,6,6,yes,Planning permission reference 15/00011/OUT. Construction has not commenced. Early 20 century single storey building in retail use.. Gross addition of 6 apartments.,2017-12-04,2017-12-04,
http://opendatacommunities.org/id/metropolitan-district-council/tameside,H-HYDWER-062,"20 Alexandra Street, Hyde.",-2.085784,53.448005,https://www.tameside.gov.uk/planning/brownfieldregister/h-hydwer-062.pdf,0.06,not owned by a public authority,,permissioned,other,2016-08-03,https://public.tameside.gov.uk/plan/f422planapp.asp,9,9,yes,Planning permission reference 16/00222/P3N. Construction has not commenced. Office building located within an employment area adjacent to residential dwellings.. Gross addition of 9 apartments.,2017-12-04,2017-12-04,
http://opendatacommunities.org/id/metropolitan-district-council/tameside,H-HYDWER-066,"Charlotte House Residential Home, Albert Road, Hyde, SK14 1DH",-2.08283,53.446956,https://www.tameside.gov.uk/planning/brownfieldregister/h-hydwer-066.pdf,0.1,not owned by a public authority,,permissioned,full planning permission,2016-06-23,https://public.tameside.gov.uk/plan/f422planapp.asp,16,16,yes,Planning permission reference 15/01038/FUL. Construction has not commenced. Site of residential care home.. Gross addition of 16 apartments.,2017-12-04,2017-12-04,
http://opendatacommunities.org/id/metropolitan-district-council/tameside,H-LONGDE-008,"Land at Dove House Thorncliffe Wood, Hollingworth, Hyde, SK14 8NJ",-1.993181,53.464027,https://www.tameside.gov.uk/planning/brownfieldregister/h-longde-008.pdf,0.16,not owned by a public authority,,not permissioned,,,https://public.tameside.gov.uk/plan/f422planapp.asp,5,5,,Single storey industrial unit and yard.  Site with existing buildings adjacent to residential dwelling. Residential full planning permission 08/00657/FUL expired 21/08/2011.,2017-12-04,2017-12-04,
http://opendatacommunities.org/id/metropolitan-district-council/tameside,H-LONGDE-035,"Land on the junction of Ball Walk and Clough End Road, Mottram, Hyde, SK14 3PX",-2.023462,53.445122,https://www.tameside.gov.uk/planning/brownfieldregister/h-longde-035.pdf,0.3,not owned by a public authority,,not permissioned,,,https://public.tameside.gov.uk/plan/f422planapp.asp,10,10,,"NLUD site, now grassed site and parking area. Cleared housing site.",2017-12-04,2017-12-04,
http://opendatacommunities.org/id/metropolitan-district-council/tameside,H-LONGDE-111,"Hattersley District Centre, Hyde.",-2.027198,53.448887,https://www.tameside.gov.uk/planning/brownfieldregister/h-longde-111.pdf,2.15,mixed ownership,,not permissioned,,,https://public.tameside.gov.uk/plan/f422planapp.asp,75,75,,Former Hattersley District Centre. Amended site boundary includes the former Tameside Court and Four In Hand PH.,2017-12-04,2017-12-04,
http://opendatacommunities.org/id/metropolitan-district-council/tameside,H-LONGDE-112,"Land on corner of Hattersley Road East and Underwood Road, Hyde.",-2.027622,53.45108,https://www.tameside.gov.uk/planning/brownfieldregister/h-longde-112.pdf,0.19,not owned by a public authority,,not permissioned,,,https://public.tameside.gov.uk/plan/f422planapp.asp,7,7,,Former Peak Valley housing office. Cleared site partially landscaped following demolition of offices.,2017-12-04,2017-12-04,
http://opendatacommunities.org/id/metropolitan-district-council/tameside,H-LONGDE-206,"Hattersley Regeneration Site 16-Site of flats and bungalows at Sandy Bank Avenue, Hyde.",-2.036275,53.445316,https://www.tameside.gov.uk/planning/brownfieldregister/h-longde-206.pdf,0.59,not owned by a public authority,,permissioned,outline planning permission,2017-02-22,https://public.tameside.gov.uk/plan/f422planapp.asp,31,31,yes,Planning permission reference 16/00962/OUT. Construction has not commenced. Former housing site now cleared.. Gross addition of 31 houses.,2017-12-04,2017-12-04,
http://opendatacommunities.org/id/metropolitan-district-council/tameside,H-LONGDE-207,"Hattersley Regeneration Site 23-cleared site and land off Bunkers Hill Road, Hyde.",-2.027256,53.444699,https://www.tameside.gov.uk/planning/brownfieldregister/h-longde-207.pdf,0.39,not owned by a public authority,,permissioned,outline planning permission,2016-12-21,https://public.tameside.gov.uk/plan/f422planapp.asp,22,22,yes,Planning permission reference 16/00945/OUT. Construction has not commenced. Former housing site now comprising areas of grass and hardstanding.. Gross addition of 22 houses.,2017-12-04,2017-12-04,
